date,open,high,low,close,volume,title,description,title_sentiment,desc_sentiment,daily_change_pct,market_sentiment,next_day_change_pct,next_day_sentiment
2021-05-14 18:13:00.000,121.6,123.4,119.05,121.45,4325579.0,Aditya Birla Capital PAT up 2.6x to Rs 375 crore in March quarter,"Aditya Birla Capital Ltd reported its highest ever quarterly profit after tax at Rs 375 crore in Q4 FY21, marking a 2.6 times growth year-on-year and 30% growth over the previous quarter",positive,positive,-0.1233552631578877,neutral,-0.1574803149606321,neutral
2021-05-14 19:11:33.000,121.6,123.4,119.05,121.45,4325579.0,Results: Aditya Birla Capital posts Rs 375 crore net profit in Q4,Aditya Birla Capital on Friday said it has reported the highest ever quarterly net profit of Rs 375 crore for the fourth quarter ended March 2021.It had posted a net profit of Rs 144 crore in the year-ago period. The non-banking financial company said it posted strong growth across busines…,neutral,positive,-0.1233552631578877,neutral,-0.1574803149606321,neutral
2021-05-14 20:35:00.000,121.6,123.4,119.05,121.45,4325579.0,Aditya Birla Capital Q4 results: Company posts highest-ever quarterly net profit of Rs 375 cr,"The non-banking financial company said it posted strong growth across businesses leading to delivery of the highest ever consolidated profit, despite a COVID-hit year.",positive,positive,-0.1233552631578877,neutral,-0.1574803149606321,neutral
2021-05-17 00:47:36.000,127.0,129.35,123.4,126.8,10947532.0,"Stocks to watch today: L&T, SKF India, Camlin Fine Sciences, Cipla, Aditya Birla Capital, Bata India, Escorts, Thyrocare, Shriram City Union, Hero MotoCorp among others","Some companies happened to perform well despite COVID-19 and subsequent lockdown. So, those companies can be of investors’ interest.Here is the list of stocks for Monday:Camlin Fine Sciences: Mumbai-based Camlin Fine Sciences has acquired Tamil Nad…",neutral,neutral,-0.1574803149606321,neutral,-0.3940110323089046,neutral
2021-05-17 11:13:23.000,127.0,129.35,123.4,126.8,10947532.0,Aditya Birla Capital Q4 Review - Operating Performance Gathers Momentum: ICICI Securities,Aditya Birla Capital Q4 Review - Operating Performance Gathers Momentum: ICICI Securities,neutral,neutral,-0.1574803149606321,neutral,-0.3940110323089046,neutral
2021-05-17 11:39:00.000,127.0,129.35,123.4,126.8,10947532.0,"Buy Aditya Birla Capital, target price Rs 171: ICICI Securities","Aditya Birla Capital Ltd., incorporated in the year 2007, is a Large Cap company (having a market cap of Rs 29321.47 Crore) operating in NBFC sector.",neutral,neutral,-0.1574803149606321,neutral,-0.3940110323089046,neutral
2021-05-19 08:50:00.000,125.9,130.85,125.55,128.5,5698096.0,Aditya Birla Fashion and Retail receives board nod to appoint Arun Adhikari as Independent Director effective today,"Adhikari is an Independent Director on the Boards of UltraTech Cement Ltd, Aditya Birla Capital Ltd, Aditya Birla Sunlife Insurance Co Ltd, Voltas Ltd and Vodafone Idea Ltd.",neutral,neutral,2.065131056393959,positive,-2.015503875968988,negative
2021-05-19 18:40:53.000,129.0,129.5,125.6,126.4,2779754.0,Aditya Birla Sun Life Insurance launches Vision LifeIncome Plus: Know about this customised plan,"Aditya Birla Sun Life Insurance (ABSLI), the life insurance subsidiary of Aditya Birla Capital Limited (ABCL), announced the launch of a hyper-flexible savings plan, ABSLI Vision LifeIncome Plus Plan.ABSLI Vision LifeIncome Plus Plan offers tax-free guaranteed additional income for lif…",neutral,positive,-2.015503875968988,negative,-1.8860510805501027,negative
2021-06-01 19:57:00.000,118.65,124.5,118.65,122.9,3201658.0,Aditya Birla Capital allots 1.10 lakh equity shares under ESOP,"Consequent to the above allotment, the Paid-up Equity Share Capital of the Company will increase from Rs 24,15,33,00,260 (i.e. 2,41,53,30,026 equity shares of face value Rs 10/- each) to Rs 24,15,44,09,080 (i.e. 2,41,54,40,908 equity shares of",neutral,neutral,3.581963758954909,positive,-0.1209677419354884,neutral
2021-06-16 19:11:00.000,123.0,125.4,121.25,121.65,2128770.0,Outcome of board meeting of Aditya Birla Capital,Held on 16 June 2021,neutral,neutral,-1.0975609756097515,negative,-2.6165167620605096,negative
2021-06-17 07:08:00.000,123.0,125.4,121.25,121.65,2128770.0,Aditya Birla Capital board approves to strike-off subsidiary ABCAP Trustee from ROC,The company said that ABCAP Trustee is a non-material subsidiary and inoperative.,neutral,neutral,-1.0975609756097515,negative,-2.6165167620605096,negative
2021-07-02 16:33:00.000,115.0,119.45,114.6,117.45,2530114.0,Aditya Birla Capital allots 3.84 lakh equity shares under ESOP,"Consequent to the above allotment, the paid-up equity share capital of the Company will increase from Rs 24,15,44,09,080 (i.e. 2,41,54,40,908 equity shares of face value Rs 10/- each) to Rs 24,15,82,53,180 (i.e. 2,41,58,25,318 equity shares of",neutral,neutral,2.130434782608698,positive,-1.825127334465188,negative
2021-08-05 16:56:00.000,117.5,122.5,117.05,121.85,17456068.0,Aditya Birla Capital reports standalone net profit of Rs 26.49 crore in the June 2021 quarter,Sales rise 419.68% to Rs 41.73 crore,neutral,positive,3.702127659574464,positive,-1.9575856443719344,negative
2021-08-05 18:02:00.000,117.5,122.5,117.05,121.85,17456068.0,Aditya Birla Capital consolidated net profit rises 52.25% in the June 2021 quarter,Sales rise 6.57% to Rs 4298.99 crore,positive,positive,3.702127659574464,positive,-1.9575856443719344,negative
2021-08-05 18:04:31.000,117.5,122.5,117.05,121.85,17456068.0,Aditya Birla Capital Q1 net profit up 52%,"Total revenue from operations increased by 6.6 per cent to ₹4,298.99 crore",positive,positive,3.702127659574464,positive,-1.9575856443719344,negative
2021-08-05 18:56:00.000,117.5,122.5,117.05,121.85,17456068.0,Aditya Birla Capital reports highest ever quarterly net profit at Rs 302 cr,The company had posted a net profit of Rs 198 crore in the year-ago period.,positive,positive,3.702127659574464,positive,-1.9575856443719344,negative
2021-08-05 19:04:43.000,117.5,122.5,117.05,121.85,17456068.0,Aditya Birla Capital reports highest-ever net profit at Rs 302 cr in June quarter,"Aditya Birla Capital Ltd on Thursday reported its highest ever consolidated net profit of Rs 302 crore, a 52 per cent jump, for the first quarter ended June 30.The company had posted a net profit of Rs 198 crore in the year-ago period.Strong growth across businesses led to the highe…",positive,positive,3.702127659574464,positive,-1.9575856443719344,negative
2021-08-05 19:26:59.000,117.5,122.5,117.05,121.85,17456068.0,Aditya Birla Capital Reports Highest Ever Net Profit At Rs 302 Crore In June Quarter,The company had posted a net profit of Rs 198 crore in the year-ago period.,neutral,positive,3.702127659574464,positive,-1.9575856443719344,negative
2021-08-06 08:08:21.000,117.5,122.5,117.05,121.85,17456068.0,"SEBI Clears Aditya Birla Capital’s AMC Arm DRHP, Aditya Birla Sun Life Eyes IPO In Sept-Oct: Sources","Aditya Birla Sun Life had filed the DRHP with SEBI in April, but it had been put in abeyance by the market regulator.",neutral,neutral,3.702127659574464,positive,-1.9575856443719344,negative
2021-08-06 08:57:00.000,117.5,122.5,117.05,121.85,17456068.0,Aditya Birla Capital reports strong results as Q1 profit rises 52% yoy,"The scale is evidenced with overall AUM across asset management, life insurance and health insurance businesses growing 26% year on year, to over Rs3,43,000 Crore.",positive,positive,3.702127659574464,positive,-1.9575856443719344,negative
2021-08-06 12:04:45.000,117.5,122.5,117.05,121.85,17456068.0,Vodafone Idea Ltd leads gainers in ‘A’ group,"Narayana Hrudayalaya Ltd, Tata Chemicals Ltd, Aditya Birla Capital Ltd and Bliss GVS Pharma Ltd are among the other gainers in the BSE’s ‘A’ group today, 06 August 2021.",positive,neutral,3.702127659574464,positive,-1.9575856443719344,negative
2021-08-09 18:17:00.000,121.0,121.0,114.1,115.8,3216521.0,Aditya Birla Sun Life AMC gets Sebi’s go ahead to float IPO,The IPO of up to 3.88 crore equity shares comprises an offer for sale of up to 28.51 lakh equity shares by Aditya Birla Capital and up to 3.6 crore equity shares by Sun Life AMC.,neutral,neutral,-4.2975206611570265,negative,-0.3892733564013743,neutral
2021-08-09 18:30:47.000,121.0,121.0,114.1,115.8,3216521.0,Aditya Birla Sun Life AMC Gets SEBI’s Go-ahead To Float IPO,"The initial public offer (IPO) is entirely an offer for sale, wherein two promoters — Aditya Birla Capital and Sun Life (India) AMC Investments — will divest their stake in the asset management firm, according to the draft red herring prospectus (DRHP).",neutral,neutral,-4.2975206611570265,negative,-0.3892733564013743,neutral
2021-08-23 15:50:30.000,99.6,102.65,99.5,101.65,3663970.0,Ujjivan Financial Services Ltd leads losers in ‘A’ group,"Sadbhav Engineering Ltd, Caplin Point Laboratories Ltd, Aditya Birla Capital Ltd and Biocon Ltd are among the other losers in the BSE’s ‘A’ group today, 23 August 2021.",negative,negative,2.058232931726919,positive,4.759568204121682,positive
2021-09-02 15:50:05.000,108.4,108.8,105.8,106.0,2370352.0,"Aditya Birla Capital allots 83,515 equity shares under ESOP",Powered by Capital Market - Live News,neutral,neutral,-2.2140221402214078,negative,0.9376465072667604,positive
2021-09-14 12:27:46.000,113.95,116.7,113.35,114.7,2443875.0,"Stocks to buy: Aditya Birla Capital, Sundaram Fasteners, Kansai Nerolac among top picks this month",Sensex and Nifty have gained a little over 1% so far in September but have managed to hit fresh all-time highs repeatedly.,positive,positive,0.6581834137779727,neutral,-0.605536332179921,neutral
2021-09-24 08:55:00.000,118.0,118.8,113.5,115.25,8291823.0,Aditya Sun Life AMC IPO to open on Sept 29 at a price band of Rs695-712 per equity share,The total offer size comprises 28.51 lakh equity shares by Aditya Birla Capital and 3.6cr equity shares by Sun Life AMC.,neutral,neutral,-2.330508474576271,negative,0.08557980316646,neutral
2021-09-24 14:20:56.000,118.0,118.8,113.5,115.25,8291823.0,Aditya Birla Sun Life AMC IPO Set To Open On Sep 29: Check Price Band,The IPO of up to 3.88 crore equity shares comprises an offer for sale of up to 28.51 lakh equity shares by Aditya Birla Capital and up to 3.6 crore equity shares by Sun Life AMC.,neutral,neutral,-2.330508474576271,negative,0.08557980316646,neutral
2021-09-24 15:07:02.000,118.0,118.8,113.5,115.25,8291823.0,"Aditya Birla Sun Life AMC IPO opens next week: GMP, price band, other details",Aditya Birla Sun Life AMC IPO of up to 3.88 crore equity shares comprises an OFS of up to 28.51 lakh shares by Aditya Birla Capital and up to 3.6 cr shares by Sun Life AMC,neutral,neutral,-2.330508474576271,negative,0.08557980316646,neutral
2021-09-24 17:39:00.000,118.0,118.8,113.5,115.25,8291823.0,"Aditya Birla AMC eyes Rs 20,500 cr valuation in Rs 2,768 cr IPO",The IPO will entirely be a secondary share sale by promoters Aditya Birla Capital and Sun Life AMC; price band Rs 695-712 per share,neutral,neutral,-2.330508474576271,negative,0.08557980316646,neutral
2021-09-28 13:44:00.000,114.0,115.7,113.3,114.25,2529289.0,Aditya Birla Sun Life AMC IPO opens tomorrow: Should you apply?,The proposed sale of equity shares by Aditya Birla Capital and Sun Life India in the IPO will together constitute up to 13.50 per cent of the paid-up share capital of Aditya Birla Sun Life AMC.,neutral,neutral,0.219298245614035,neutral,-1.7421602787456445,negative
2021-09-29 08:59:16.000,114.0,115.7,113.3,114.25,2529289.0,Aditya Birla Sun Life AMC Raises Rs 789 Crore From Anchor Investors Ahead Of IPO,The IPO of up to 3.88 crore equity shares comprises an offer for sale of up to 28.51 lakh equity shares by Aditya Birla Capital and up to 3.6 crore equity shares by Sun Life AMC.,neutral,neutral,0.219298245614035,neutral,-1.7421602787456445,negative
2021-09-30 07:38:03.000,114.8,114.9,112.3,112.8,2339297.0,"Aditya Birla AMC IPO: GMP, other details. Should you subscribe?",Aditya Birla IPO comprises an offer for sale of up to 28.51 lakh equity shares by Aditya Birla Capital and up to 3.6 crore equity shares by Sun Life AMC,neutral,neutral,-1.7421602787456445,negative,0.3565062388591724,neutral
2021-09-30 17:42:12.000,112.2,112.65,110.9,112.6,1430476.0,Aditya Birla Sun Life AMC IPO subscribed fully on day 2,"The IPO, which is a pure offer for sale by joint venture partners Aditya Birla Capital Ltd and Sun Life (India) AMC Investments Inc., will be priced at ₹695-712 per share",neutral,positive,0.3565062388591724,neutral,-1.4178112538768228,negative
2021-10-04 11:10:21.000,112.85,112.85,110.55,111.25,2085696.0,"Aditya Birla Capital Sun Life IPO: Check share allotment status, grey market premium; stock listing on Oct 11","Aditya Birla Capital Sun Life AMC’s Rs 2,768.26-crore IPO, which was subscribed 5.25 times, will finalise the share allotment on Wednesday, 6 October 2021.",neutral,neutral,-1.4178112538768228,negative,-0.449438202247191,neutral
2021-10-05 16:47:00.000,111.0,111.65,110.0,110.2,2169649.0,Aditya Birla Capital update on IPO of Aditya Birla Sun Life AMC,"Accordingly, the size of IPO aggregates to Rs. 2768.25 crore, comprising an Offer for Sale of 2,850,880 Equity Shares by ABCL aggregating to Rs. 202.98 crore and 36,029,120 Equity Shares by Sun Life AMC aggregating to Rs. 2565.27 crore, subject to",neutral,neutral,-0.7207207207207181,neutral,-1.5625,negative
2021-10-07 20:45:00.000,111.35,112.5,110.7,111.75,2571688.0,Aditya Birla Capital update on IPO of Aditya Birla Sun Life AMC,Aditya Birla Capital now holds 50.01% stake in Aditya Birla Sun Life AMC,neutral,neutral,0.3592276605298659,neutral,-2.454261490406069,negative
2021-10-08 07:35:14.000,111.35,112.5,110.7,111.75,2571688.0,"Buzzing Stocks: TCS, Aditya Birla Capital, KPI Global Infrastructure, And Other Newsmakers",Stocks In the News: Check out the companies making the biggest headlines before the opening bell.,neutral,neutral,0.3592276605298659,neutral,-2.454261490406069,negative
2021-10-26 19:34:00.000,101.0,102.3,98.2,99.1,2388137.0,"Aditya Birla Capital allots 69,142 equity shares under ABCL Scheme","Consequent to the above allotment, the Paid-up Equity Share Capital of the Company will increase from Rs 24,16,10,96,020 (i.e. 2,41,61,09,602 equity shares of face value Rs 10 each) to Rs 24,16,17,87,440 (i.e. 2,41,61,78,744 equity shares of face",neutral,neutral,-1.8811881188118864,negative,0.0505816894284384,neutral
2021-11-01 08:30:00.000,97.45,102.9,96.6,99.9,6808232.0,"Aditya Birla Capital consolidated net profit at Rs377cr in Q2, up 43% yoy","The Company, through its subsidiaries, continues to maintain its track record of delivering strong performance through market and macroeconomic cycles, backed by its diversified business model.",positive,positive,2.514109799897386,positive,5.776892430278881,positive
2021-11-01 16:03:00.000,100.4,108.85,100.25,106.2,9004501.0,Aditya Birla Capital posts its highest qtrly profit of Rs 377 cr in Jul-Sep,The company had posted a consolidated net profit of Rs 264 crore in the same period a year ago,positive,positive,5.776892430278881,positive,-1.682242990654203,negative
2021-11-01 16:54:00.000,100.4,108.85,100.25,106.2,9004501.0,Aditya Birla Capital consolidated net profit rises 42.58% in the September 2021 quarter,Sales rise 21.72% to Rs 5593.22 crore,positive,positive,5.776892430278881,positive,-1.682242990654203,negative
2021-11-01 17:44:00.000,100.4,108.85,100.25,106.2,9004501.0,Aditya Birla Capital reports 43% jump in Q2 net profit,Marks its highest ever consolidated quarterly profit,positive,positive,5.776892430278881,positive,-1.682242990654203,negative
2021-11-02 11:22:00.000,100.4,108.85,100.25,106.2,9004501.0,"Results Review for Aditya Birla Capital, Indian Oil Corporation, Bharat Petroleum","Results Review for Aditya Birla Capital, Indian Oil Corporation, Bharat Petroleum",neutral,neutral,5.776892430278881,positive,-1.682242990654203,negative
2021-11-02 12:57:00.000,107.0,107.6,104.4,105.2,2174675.0,Aditya Birla Capital jumps after Q2 PAT rises 43% YoY to Rs 377 cr,Aditya Birla Capital rose 4.67% to Rs 104.15 after the company’s consolidated net profit rose 42.58% to Rs 376.90 crore on 22% increase in revenue to Rs 5961.45 crore in Q2 September 2021 over Q2 September 2020.,positive,positive,-1.682242990654203,negative,-0.4716981132075472,neutral
2021-11-26 06:07:00.000,107.7,111.5,106.65,106.9,10183163.0,"NSE to add Aditya Birla Capital, Honeywell Auto to F&O segment","The National Stock Exchange will add Aditya Birla Capital and Honeywell Automation India to the futures and options segment from the January series. The futures and options contracts on these two securities would be available for trading with effect from December 31, subject to fulfillment of eligib…",neutral,neutral,-0.7428040854224671,neutral,-0.9416195856873822,negative
2021-12-01 16:46:00.000,110.0,111.7,108.6,111.2,3177247.0,Aditya Birla Capital - Stock in Focus for Your Trading,Aditya Birla Capital - Stock in Focus for Your Trading,neutral,neutral,1.0909090909090935,positive,4.155495978552271,positive
2021-12-10 07:56:39.000,125.2,126.2,122.7,124.15,6182627.0,"Hot Stocks | Double-digit Returns From ITC, Aditya Birla Capital And Zee Entertainment Likely In Short Term","Karan Pai of GEPL Capital believes that Nifty50 might continue to hover around the 20-week SMA (17,344) and might remain rangebound between 17,200 (multiple touch point levels) and 17,800 (3-week high).",neutral,neutral,-0.838658146964854,neutral,-1.187648456057007,negative
2021-12-13 10:24:00.000,126.3,127.5,124.5,124.8,6457395.0,MedPlus Health IPO opens for subscription: Does the pharma retailer have a pill for profit?,"At the issue price, MedPlus would trade at 3.1x FY21 P/S & 40x FY21 EV/EBITDA, said Aditya Birla Capital, which has suggested investors with high-risk appetite to subscribe to the IPO.",neutral,neutral,-1.187648456057007,negative,-2.3618895116092897,negative
2021-12-22 17:24:00.000,117.75,119.1,116.8,117.9,2225132.0,Aditya Birla Money stock rallies 3% after board nods issue of preference shares worth Rs80cr to Aditya Birla Capital,The transaction aggregates to Rs80cr at an issue price of Rs500 per equity share.,positive,neutral,0.1273885350318519,neutral,-2.602854743912674,negative
2021-12-24 16:44:00.000,119.1,119.45,115.5,116.0,2415570.0,Aditya Birla Money allots 16 lakh non-convertible preference shares to promoter,"The board of directors of Aditya Birla Money has approved and allotted 16,00,000 (4 per cent) non-cumulative non-convertible redeemable preference shares at an issue price of Rs 500 per share, including a premium of Rs 400 per share aggregating to Rs 80 crore, to Aditya Birla Capital, promoter and h…",neutral,neutral,-2.602854743912674,negative,3.182795698924733,positive
2021-12-27 10:40:43.000,116.25,120.0,113.75,119.95,3303567.0,HDFC Securities Picks These 10 Stocks For 2022,"Zee Entertainment Enterprises, State Bank of India, Max Financial Services, Aditya Birla Capital, Hindustan Zinc, are among the top ten picks of HDFC Securities for 2022",neutral,neutral,3.182795698924733,positive,-0.3737541528239226,neutral
2021-12-27 12:39:35.000,120.4,121.45,118.85,119.95,2939918.0,Top 10 stock picks for 2022 by HDFC Securities,"SBI, GAIL, Tech Mahindra, Aditya Birla Capital, Hindustan Zinc are among the brokerage’s top stock picks",neutral,neutral,-0.3737541528239226,neutral,2.0239570425444056,positive
2021-12-31 14:37:37.000,122.0,125.5,121.9,124.0,11181989.0,Aditya Birla Health Insurance GWP Jumps 39% To Rs 764 Crore In H1 FY22,"Aditya Birla Health Insurance, the subsidiary of Aditya Birla Capital Limited, has also completed five years of its existence recently and covered as many as 16 million (1.6 crores) lives to date.",neutral,neutral,1.639344262295082,positive,3.608660785886116,positive
2021-12-31 14:49:00.000,122.0,125.5,121.9,124.0,11181989.0,Aditya Birla Health Insurance gross written premium jumps 39 pc to Rs 764 cr in H1 FY22,"Aditya Birla Health Insurance Co. Limited. (ABHICL), the health insurance subsidiary of Aditya Birla Capital Limited (ABCL), has completed five years with a gross written premium (GWP) of Rs 764 crore in H1 FY22, the insurer said in a release. It had registered a gross written premium of Rs 550 cror…",positive,neutral,1.639344262295082,positive,3.608660785886116,positive
2022-01-02 15:49:51.000,124.7,130.45,124.0,129.2,13404850.0,5 stocks to buy in 2022: Check HDFC Securities’ top picks,"Top stocks to buy in 2022: Aditya Birla Capital, GAIL, Hindustan Zinc, Ipca Labs and Mahindra and Mahindra.",positive,neutral,3.608660785886116,positive,0.268302031429684,neutral
2022-01-07 18:55:32.000,133.8,135.5,131.0,132.6,7302045.0,Aditya Birla Sun Life Insurance Launches ABSLI Secureplus Plan,"Aditya Birla Sun Life Insurance (ABSLI), the life insurance subsidiary of Aditya Birla Capital Limited (ABCL), has announced the launch of an improved version of its new-age savings solution, ABSLI SecurePlus Plan.",neutral,positive,-0.8968609865470979,neutral,-1.0463378176382705,negative
2022-02-03 18:53:03.000,127.05,129.3,123.3,124.25,9289686.0,Aditya Birla Capital Q3 consolidated net profit doubles to ₹577 crore,Company says focus going forward will be on maximising value of active customer base,positive,neutral,-2.2038567493112926,negative,-2.90791599353796,negative
2022-02-03 19:11:56.000,127.05,129.3,123.3,124.25,9289686.0,Aditya Birla Capital Q3 Net Doubles To Rs 577 Crore On Strong Growth Across Business,The net profit stood at Rs 289 crore in the corresponding quarter a year ago.,neutral,neutral,-2.2038567493112926,negative,-2.90791599353796,negative
2022-02-03 19:14:00.000,127.05,129.3,123.3,124.25,9289686.0,Aditya Birla Capital Q3 consolidated net doubles to Rs 577 cr,Improved interest margins; AMC stake sale boost bottomline,positive,positive,-2.2038567493112926,negative,-2.90791599353796,negative
2022-02-08 11:44:00.000,120.5,121.65,117.1,118.15,3005826.0,"Results Review for Astral, Aarti Industries , Aditya Birla Capital, Radico Khaitan","Results Review for Astral, Aarti Industries , Aditya Birla Capital, Radico Khaitan",neutral,neutral,-1.9502074688796631,negative,-0.4184100418410041,neutral
2022-02-09 09:36:00.000,119.5,120.7,118.0,119.0,4327194.0,"Buy Aditya Birla Capital, target price Rs 158: Morgan Stanley","Aditya Birla Capital Ltd., incorporated in the year 2007, is a Large Cap company (having a market cap of Rs 28668.21 Crore) operating in NBFC sector.",neutral,neutral,-0.4184100418410041,neutral,0.5847953216374293,neutral
2022-02-09 20:44:49.000,119.7,121.85,118.3,120.4,3029722.0,Aditya Birla Capital: Brokerages see 17-40 per cent upside post Q3,Analysts expect NBFC to post better RoE,positive,positive,0.5847953216374293,neutral,-2.4237358963644007,negative
2022-02-16 01:30:00.000,115.45,117.5,114.75,115.55,3691277.0,ABCL can break into top 100 club of most-valued listed firms: Analysts,Analysts are upbeat on the long-term prospects of Aditya Birla Capital and have set price targets between 20 per cent and 45 per cent higher than the current market price,neutral,positive,0.086617583369419,neutral,-2.20302375809935,negative
2022-03-23 12:48:32.000,108.8,112.4,108.25,109.8,4822024.0,"Analysts initiate coverage on 5 stocks with buy rating, expect 14-39 percent returns","Brokerages see opportunities in companies including Star Health, Data Patterns, Cipla, Aditya Birla Capital and KPIT Technologies",positive,positive,0.9191176470588236,positive,-1.2217194570135694,negative
2022-04-24 06:00:00.000,112.5,117.8,111.75,116.2,15177443.0,Vishakha Mulye to be CEO of Aditya Birla Capital | The Financial Express,"Mulye will operate as the CEO-designate from June 1, reports fe Bureau.",neutral,neutral,3.2888888888888914,positive,-0.724946695095944,neutral
2022-04-24 07:40:00.000,112.5,117.8,111.75,116.2,15177443.0,Vishakha Mulye | Aditya Birla Capital: ICICI Bank’s Vishakha Mulye to join Aditya Birla Capital as CEO,"Mulye, a career banker with three decades of experience behind her, will join her new role on June 1 as CEO designate, Aditya Birla Group announced late Saturday",neutral,neutral,3.2888888888888914,positive,-0.724946695095944,neutral
2022-04-24 09:54:55.000,112.5,117.8,111.75,116.2,15177443.0,Aditya Birla Capital appoints Vishakha Mulye as CEO,"She will join Aditya Birla Capital as the new CEO on June 1, 2022.",neutral,neutral,3.2888888888888914,positive,-0.724946695095944,neutral
2022-04-24 17:30:00.000,112.5,117.8,111.75,116.2,15177443.0,Aditya Birla Capital appoints ICICI Bank’s Vishakha Mulye as CEO,"Mulye, who was the executive director of ICICI Bank in charge of the wholesale banking portfolio, will take over her role on June 1.",neutral,neutral,3.2888888888888914,positive,-0.724946695095944,neutral
2022-04-25 08:18:23.000,112.5,117.8,111.75,116.2,15177443.0,"Stocks that will see action on April 25, 2022","Buzzing stocks: Reliance Industries, Future Retail, ICICI Bank, HDFC Bank, Sterlite Technologies, Aditya Birla Capital Limited, Quess Corp Ltd, Zenzar Technologies, Nazara Technologies, Religare Enterprises, Sarda Energy & Minerals",neutral,neutral,3.2888888888888914,positive,-0.724946695095944,neutral
2022-04-25 20:14:45.000,117.25,118.45,115.25,116.4,6691312.0,Buy Aditya Birla Capital: target of Rs 169: ICICI Securities,"ICICI Securities is bullish on Aditya Birla Capital has recommended buy rating on the stock with a target price of Rs 169 in its research report dated April 24, 2022.",neutral,positive,-0.724946695095944,neutral,5.150589262330866,positive
