date,open,high,low,close,volume,title,description,title_sentiment,desc_sentiment,daily_change_pct,market_sentiment,next_day_change_pct,next_day_sentiment
2020-10-21 12:04:18.000,66.35,67.85,65.3,66.5,2302271.0,Dewan Housing Finance Corporation Ltd leads gainers in ‘A’ group,"Aditya Birla Capital Ltd, Godrej Properties Ltd, Chennai Petroleum Corporation Ltd and Mahindra Logistics Ltd are among the other gainers in the BSEs A group today, 21 October 2020.",positive,neutral,0.226073850791267,neutral,3.692539562923893,positive
2020-10-21 13:44:49.000,66.35,67.85,65.3,66.5,2302271.0,Aditya Birla Capital shares gain over 8 per cent,"The shares of Aditya Birla Capital, a holding cmpany for financial services businesses of the Aditya Birla Group has risen 8.8 per cent to ₹67.6 on Wednesday trade. At the current price, the stock has",positive,positive,0.226073850791267,neutral,3.692539562923893,positive
2020-10-21 14:50:21.000,66.35,67.85,65.3,66.5,2302271.0,Volumes soar at Aditya Birla Capital Ltd counter,"Aditya Birla Capital Ltd recorded volume of 97.8 lakh shares by 14:19 IST on NSE, a 8.05 times surge over two-week average daily volume of 12.15 lakh shares",neutral,positive,0.226073850791267,neutral,3.692539562923893,positive
2020-10-28 07:02:00.000,65.2,69.25,65.1,66.7,4477663.0,Another top mutual fund house all set to go public,"The fund house, a joint venture between the Aditya Birla Capital and Sun Life, has met about half a dozen local and global investment banks that are currently pursuing feasibility study of the proposed share sale, multiple sources with knowledge of the matter told ET.",neutral,positive,2.3006134969325154,positive,-1.1363636363636365,negative
2020-11-05 08:57:00.000,68.45,70.5,67.7,69.6,3750725.0,"Stocks in focus: Adani Power, Berger Paints, HPCL, PVR, Inox Leisure, PNB Housing Finance, to remain in buzz","A total of 127 listed companies including ABB India, Aditya Birla Capital, Adani Power, Adani Transmission, AstraZeneca Pharma, Bajaj Electricals, are scheduled to announce their July-September quarter earnings today.",neutral,neutral,1.6800584368151812,positive,-0.2115655853314607,neutral
2020-11-05 09:37:00.000,68.45,70.5,67.7,69.6,3750725.0,Aditya Birla Capital Q2 net up marginally by 3.4% at Rs264.34cr,"Aditya Birla Capital reported 16.11% increase in the Sep-20 quarter top line sales revenues at Rs4,589.12cr.",positive,positive,1.6800584368151812,positive,-0.2115655853314607,neutral
2020-11-05 14:50:00.000,70.9,72.8,70.5,70.75,7262235.0,Aditya Birla Capital allots 2.54 lakh equity shares,Under ESOP,neutral,neutral,-0.2115655853314607,neutral,-1.8080667593880544,negative
2020-11-05 15:48:03.000,70.9,72.8,70.5,70.75,7262235.0,BRIEF-India’s Aditya Birla Capital Sept-Quarter Consol Profit Rises,BRIEF-India’s Aditya Birla Capital Sept-Quarter Consol Profit Rises,neutral,neutral,-0.2115655853314607,neutral,-1.8080667593880544,negative
2020-11-05 16:18:08.000,70.9,72.8,70.5,70.75,7262235.0,BRIEF-Aditya Birla Capital Sept-Qtr Domestic Average AUM Up 11% Q/Q,BRIEF-Aditya Birla Capital Sept-Qtr Domestic Average AUM Up 11% Q/Q,neutral,neutral,-0.2115655853314607,neutral,-1.8080667593880544,negative
2020-11-05 17:56:11.000,70.9,72.8,70.5,70.75,7262235.0,Aditya Birla Capital Q2 net marginally up at Rs 264 cr,Aditya Birla Capital on Thursday reported a 3 per cent increase in its consolidated net profit to Rs 264 crore for the second quarter ended September. The company’s net profit stood at Rs 256 crore in,positive,positive,-0.2115655853314607,neutral,-1.8080667593880544,negative
2020-11-05 18:46:00.000,70.9,72.8,70.5,70.75,7262235.0,Aditya Birla Capital Q2 net up 3% at Rs 264 crore,The company’s net profit stood at Rs 256 crore in the same quarter a year ago.,positive,positive,-0.2115655853314607,neutral,-1.8080667593880544,negative
2020-11-05 18:52:16.000,70.9,72.8,70.5,70.75,7262235.0,Aditya Birla Cap Q2 profit up 3%,Aditya Birla Capital reported a 3.3 per cent increase in consolidated net profit at ₹264.34 crore for the second quarter of the fiscal against ₹255.78 crore in the corresponding period a year ago.For,positive,positive,-0.2115655853314607,neutral,-1.8080667593880544,negative
2020-11-06 08:27:00.000,70.9,72.8,70.5,70.75,7262235.0,"Stocks in the news | RIL, HFCL, ITC, Dish TV India, Adani Transmission, Axis Bank, Minda Corporation","Berger Paints, Dalmia Bharat, Adani Power, Chambal Fertilisers, Indiabulls Housing Finance, Inox Leisure, Aditya Birla Capital, Container Corporation of India, Torrent Power, Matrimony.com, are also among the stocks in focus today.",neutral,neutral,-0.2115655853314607,neutral,-1.8080667593880544,negative
2020-11-06 08:52:20.000,70.9,72.8,70.5,70.75,7262235.0,Motilal Oswal: Aditya Birla Capital Posts Steady Q2; Collection Efficiency Improving,Motilal Oswal: Aditya Birla Capital Posts Steady Q2; Collection Efficiency Improving,neutral,neutral,-0.2115655853314607,neutral,-1.8080667593880544,negative
2020-11-06 11:41:00.000,70.9,72.8,70.5,70.75,7262235.0,"Buy Aditya Birla Capital, target price Rs 100: Motilal Oswal","Aditya Birla Capital Ltd., incorporated in the year 2007, is a Large Cap company (having a market cap of Rs 17309.29 Crore) operating in NBFC sector.",neutral,neutral,-0.2115655853314607,neutral,-1.8080667593880544,negative
2020-11-06 14:22:00.000,70.9,72.8,70.5,70.75,7262235.0,"Aditya Birla Capital’s Q2 PAT rises to Rs264cr as biz revives; Lending book stood Rs57,592cr","Focus on balanced growth, liquidity, technology, enhanced processes and cost control helped the company to raise consolidated revenue by 14% yoy to Rs4,879cr and net profit by 33% qoq to Rs264cr.",neutral,positive,-0.2115655853314607,neutral,-1.8080667593880544,negative
2020-11-10 12:04:00.000,72.0,73.4,70.75,72.45,2895272.0,Buy Aditya Birla Capital; target of Rs 100: Motilal Oswal,"Motilal Oswal is bullish on Aditya Birla Capital recommended buy rating on the stock with a target price of Rs 100 in its research report dated November 05, 2020.",neutral,positive,0.6250000000000039,neutral,1.793103448275858,positive
2020-11-14 18:51:00.000,77.45,81.65,77.05,80.6,5901830.0,"BSE Midcap index hits 52-week high; Balkrishna, PI Ind at record levels","Aditya Birla Capital, Kansai Nerolac, Vodafone Idea, Adani Transmission and Hindustan Aeronautics were up 2% to 5% on the BSE in Muhurat trading on Saturday evening.",positive,positive,4.06714009038088,positive,0.0,neutral
2020-11-17 15:51:00.000,82.1,87.0,81.05,82.45,5651262.0,"Aditya Birla Capital: High on diversification, not much on conviction",Lending businesses accounting for about half its valuations remain laggards,neutral,negative,0.4263093788063442,neutral,-1.953601953601964,negative
2020-12-08 19:00:00.000,93.4,97.9,93.25,96.55,7580434.0,Veteran Banker Romesh Sobti set to join Aditya Birla Capital board,Rehauling of business strategy is presently underway; set to approach the RBI for banking license once final guidelines is released,neutral,neutral,3.3725910064239737,positive,-2.643856920684289,negative
2020-12-08 23:16:20.000,93.4,97.9,93.25,96.55,7580434.0,IndusInd Bank Ex-CEO Romesh Sobti May Join Aditya Birla Capital Board As Nominee Director,"Sobti, who took the role of operating partner at Advent Capital after retiring from IndusInd Bank, is likely to be appointed as a non-executive board member at AB Capital.",neutral,neutral,3.3725910064239737,positive,-2.643856920684289,negative
2020-12-09 08:33:00.000,93.4,97.9,93.25,96.55,7580434.0,"IndusInd’s Ramesh Sobti likely to join Aditya Birla Capital’s board, pending RBI approval","Sobtis induction which is subject to the Reserve Bank of Indias (RBI) approval, comes after some prominent investors had expressed concern over the performance of the groups flagship financial services business, according to ET’s sources.",neutral,negative,3.3725910064239737,positive,-2.643856920684289,negative
2020-12-30 11:07:00.000,84.5,86.0,83.25,85.4,2252722.0,"Aditya Birla Capital allots 44,917 equity shares under ESOP","Consequent to the above allotment, the Paid-up Equity Share Capital of the Company will increase from
Rs 24,14,95,88,140 (i.e. 2,41,49,58,814 equity shares of face value Rs 10/- each) to Rs 24,15,00,37,310 (i.e.
2,41,50,03,731 Fully Paid-up Equity",neutral,neutral,1.0650887573964565,positive,-1.2805587892898818,negative
2021-02-05 05:30:00.000,91.0,91.9,89.4,89.6,3642411.0,BRIEF-India’s Aditya Birla Capital Dec-Qtr Consol Net Profit Rises,BRIEF-India’s Aditya Birla Capital Dec-Qtr Consol Net Profit Rises,neutral,neutral,-1.5384615384615448,negative,0.3823047515019209,neutral
2021-02-05 12:56:00.000,91.0,91.9,89.4,89.6,3642411.0,"Aditya Birla Capital allots 40,550 equity shares under ESOS","Consequent to the above allotment, the Paid-up Equity Share Capital of the Company will increase from
Rs 24,15,00,37,310 (i.e. 2,41,50,03,731 equity shares of face value Rs 10/- each) to Rs 24,15,04,42,810 (i.e.
2,41,50,44,281 Fully Paid-up Equity",neutral,neutral,-1.5384615384615448,negative,0.3823047515019209,neutral
2021-02-05 17:14:00.000,91.0,91.9,89.4,89.6,3642411.0,Aditya Birla Capital Q3 PAT up 15.25% at Rs289cr on lower financing costs,"Aditya Birla Capital reported 17.08% growth in total revenues for the Dec-20 quarter on consolidated basis at Rs5,025.98cr",positive,positive,-1.5384615384615448,negative,0.3823047515019209,neutral
2021-02-05 18:26:00.000,91.0,91.9,89.4,89.6,3642411.0,Aditya Birla Capital consolidated net profit rises 15.25% in the December 2020 quarter,Sales rise 16.19% to Rs 5025.98 crore,positive,positive,-1.5384615384615448,negative,0.3823047515019209,neutral
2021-02-05 19:20:00.000,91.0,91.9,89.4,89.6,3642411.0,Aditya Birla Capital Q3 results: Posts highest ever consolidated net at Rs 289 cr on strong biz growth,"Consolidated revenue for Q3FY21 grew 16 per cent to Rs 5,346 crore as against Rs 4,612 crore in the December quarter of FY20, the company said.",positive,positive,-1.5384615384615448,negative,0.3823047515019209,neutral
2021-02-05 20:23:00.000,91.0,91.9,89.4,89.6,3642411.0,Aditya Birla Capital posts highest ever consolidated net at Rs 289 cr,"Aditya Birla Capital Ltd (ABCL) on Friday posted a 15 per cent jump in consolidated net profit to Rs 289 crore for the quarter ended December 2020, the highest ever consolidated quarterly profit.",positive,positive,-1.5384615384615448,negative,0.3823047515019209,neutral
2021-02-05 23:02:26.000,91.0,91.9,89.4,89.6,3642411.0,Aditya Birla Capital profit rises 15%,"Aditya Birla Capital Ltd. reported consolidated third quarter profit increased by 15% to ₹289 crore. Consolidated revenue rose 16% to ₹5,346 crore. The performance was driven by strong growth across b",positive,positive,-1.5384615384615448,negative,0.3823047515019209,neutral
2021-02-08 16:15:49.000,92.25,92.4,88.65,88.8,2730476.0,Aditya Birla Capital Delivers Steady Q3; Pro Forma GNPLs Decline: Motilal Oswal,Aditya Birla Capital Delivers Steady Q3; Pro Forma GNPLs Decline: Motilal Oswal,neutral,neutral,-3.7398373983739863,negative,-0.224466891133545,neutral
2021-02-12 15:46:28.000,89.35,89.7,88.15,88.55,1303463.0,Buy Aditya Birla Capital; Target Of Rs 140: Motilal Oswal,"Motilal Oswal is bullish on Aditya Birla Capital has recommended buy rating on the stock with a target price of Rs 140 in its research report dated February 06, 2021.",neutral,positive,-0.8953553441522074,neutral,4.224569205113949,positive
2021-02-23 12:02:23.000,113.65,124.9,112.85,124.65,17573719.0,"Why Shares Of Muthoot Capital, HOEC, AB Capital, Zuari Agro Rallied Between 6-18%","Stocks like HOEC, Muthoot Capital Services, Aditya Birla Capital and Zuari Agro are in focus.",neutral,neutral,9.678838539375274,positive,-2.754491017964074,negative
2021-02-24 10:29:00.000,113.65,124.9,112.85,124.65,17573719.0,"Aditya Birla Capital allots 70,615 equity shares under ESOP","Consequent to the above allotment, the Paid-up Equity Share Capital of the Company will increase from
Rs 24,15,04,42,810 (i.e. 2,41,50,44,281 equity shares of face value Rs 10/- each) to Rs 24,15,11,48,960 (i.e.
2,41,51,14,896 Fully Paid-up Equity",neutral,neutral,9.678838539375274,positive,-2.754491017964074,negative
2021-03-10 09:20:43.000,135.55,137.0,132.5,133.05,2721033.0,Work That Speaks | Ad Reviews | 1 to 8 March 2021,"Brands that cut through: Axis Bank, Kerala Tourism, Clinic Plus, Honda, Bumble, Vi, Unacademy, Aditya Birla Capital, Sunfeast, Facebook, Saffola.",neutral,neutral,-1.844337882700111,negative,-3.078635014836799,negative
2021-03-15 23:04:12.000,128.8,132.7,126.95,128.1,4768669.0,Analyst Corner: Initiate with ‘add’ on Aditya Birla Capital,We initiate coverage on Aditya Birla Capital (ABCL) with ADD rating and SoTP-based FV of Rs 145.,neutral,neutral,-0.5434782608695784,neutral,-3.658536585365841,negative
2021-03-17 05:30:00.000,131.2,134.9,124.5,126.4,4197231.0,BRIEF-Aditya Birla Capital Board Gives In Principle Approval To Explore IPO Of Aditya Birla Sun Life AMC,BRIEF-Aditya Birla Capital Board Gives In Principle Approval To Explore IPO Of Aditya Birla Sun Life AMC,neutral,neutral,-3.658536585365841,negative,-2.292152292152284,negative
2021-03-17 09:23:10.000,131.2,134.9,124.5,126.4,4197231.0,Aditya Birla Capital board gives nod to explore IPO of mutual fund venture,The Board of Directors of Aditya Birla Capital at its meeting held on Wednesday provided its in-principle approval to explore an initial public offering of Aditya Birla Sun Life,neutral,neutral,-3.658536585365841,negative,-2.292152292152284,negative
2021-03-17 09:56:29.000,131.2,134.9,124.5,126.4,4197231.0,Aditya Birla Capital Share Price Jumps 4% As Board Approves Subsidiary IPO,The share price rose 150 percent in last 9 months.,neutral,positive,-3.658536585365841,negative,-2.292152292152284,negative
2021-03-17 10:18:00.000,131.2,134.9,124.5,126.4,4197231.0,"Buy Aditya Birla Capital, target price Rs 155: HDFC Securities","Aditya Birla Capital Ltd., incorporated in the year 2007, is a Large Cap company (having a market cap of Rs 32192.00 Crore) operating in NBFC sector.",neutral,neutral,-3.658536585365841,negative,-2.292152292152284,negative
2021-03-17 10:20:22.000,131.2,134.9,124.5,126.4,4197231.0,Aditya Birla Capital board gives in-principle approval for Aditya Birla Sun Life AMC’s IPO,"Aditya Birla Capital on Wednesday said its board has given in-principle approval to explore an initial public offering (IPO) of its arm Aditya Birla Sun Life AMC.Aditya Birla Sun Life AMC Ltd, the investment manager of Aditya Birla Sun Life Mutual Fund, is a joint venture between the Adity…",positive,neutral,-3.658536585365841,negative,-2.292152292152284,negative
2021-03-17 11:09:00.000,131.2,134.9,124.5,126.4,4197231.0,Aditya Birla Capital board gives in-principle approval for AMC arm IPO,"Aditya Birla Sun Life AMC Ltd, the investment manager of Aditya Birla Sun Life Mutual Fund, is a joint venture between the Aditya Birla Group and the Sun Life Financial Inc. of Canada.",positive,positive,-3.658536585365841,negative,-2.292152292152284,negative
2021-03-17 14:41:41.000,128.7,130.5,121.55,125.75,3130263.0,Aditya Birla Capital Board Gives In-principle Approval For AMC Arm IPO,"Aditya Birla Sun Life AMC Ltd, the investment manager of Aditya Birla Sun Life Mutual Fund, is a joint venture between the Aditya Birla Group and the Sun Life Financial Inc. of Canada.",neutral,positive,-2.292152292152284,negative,-1.348039215686279,negative
2021-03-17 17:42:00.000,128.7,130.5,121.55,125.75,3130263.0,Aditya Birla Capital approves listing of Aditya Birla Sun Life AMC; Stock zooms 5%,"Currently, the parent organisation are Aditya Birla Capital, Aditya Birla Group and Sun Life Financial of the AMC.",neutral,neutral,-2.292152292152284,negative,-1.348039215686279,negative
2021-03-17 17:48:37.000,128.7,130.5,121.55,125.75,3130263.0,Aditya Birla Capital board gives nod to explore IPO for mutual fund arm,Aditya Birla Sun Life AMC had an average AUM of ₹2.55-lakh crore in the quarter ended Dec,neutral,neutral,-2.292152292152284,negative,-1.348039215686279,negative
2021-03-18 07:49:00.000,128.7,130.5,121.55,125.75,3130263.0,Aditya Birla Capital soars on MF arm ‘listing’ plans,"The share sale in Aditya Birla Sun Life Asset Management Company will unlock value in the financial services company belonging to the Aditya Birla Group, boosting its valuations.",neutral,positive,-2.292152292152284,negative,-1.348039215686279,negative
2021-03-24 15:04:00.000,116.85,120.25,112.5,118.25,4387773.0,Aditya Birla Capital allots 1.63 lakh equity shares under ESOP,"Consequent to the above allotment, the Paid-up Equity Share Capital of the Company will increase from Rs 24,15,11,48,960 (i.e. 2,41,51,14,896 equity shares of face value Rs 10/- each) to Rs 24,15,27,79,780 (i.e. 2,41,52,77,978 Fully Paid-up Equity",neutral,neutral,1.198117244330343,positive,2.5210084033613445,positive
2021-03-25 09:59:00.000,116.85,120.25,112.5,118.25,4387773.0,Time for AB Capital to bat on the front foot: Ajay Srinivasan,"Aditya Birla Capital CEO on revival strategy in a year of 3 Vs - virus, vaccine and V-shaped recovery",neutral,positive,1.198117244330343,positive,2.5210084033613445,positive
2021-04-14 05:30:00.000,121.0,123.4,117.35,119.0,7347906.0,BRIEF-Aditya Birla Capital Approves IPO Of Unit Aditya Birla Sun Life AMC,BRIEF-Aditya Birla Capital Approves IPO Of Unit Aditya Birla Sun Life AMC,neutral,neutral,-1.6528925619834711,negative,0.8819823603527905,neutral
2021-04-14 21:06:00.000,121.0,123.4,117.35,119.0,7347906.0,Aditya Birla Capital board approves AMC arm’s IPO,"The board has approved an offer for sale of up to 28.5 lakh shares of face value of Rs 5 held by the company in the AMC, the company said in a notification to exchanges.",neutral,positive,-1.6528925619834711,negative,0.8819823603527905,neutral
2021-04-14 21:10:37.000,121.0,123.4,117.35,119.0,7347906.0,"Aditya Birla Capital, Sun Life to sell 13.5% stake in asset management biz IPO","Aditya Birla Capital board has approved sale of up to 2.88 million shares held by it in the asset management business, while Sun Life (India) AMC wil sell upto 36.03 million shares",neutral,neutral,-1.6528925619834711,negative,0.8819823603527905,neutral
2021-04-14 21:14:18.000,121.0,123.4,117.35,119.0,7347906.0,Aditya Birla Capital Approves IPO For Aditya Birla Sun Life AMC,The IPO will be conducted as an offer for sale in which the two promoters will divest their shares.,neutral,neutral,-1.6528925619834711,negative,0.8819823603527905,neutral
2021-04-15 01:40:00.000,121.0,123.4,117.35,119.0,7347906.0,Aditya Birla Capital board approves initial public offering of AMC arm,"The board has approved an offer for sale of up to 2.8 million shares at face value of Rs 5 held by the company in the AMC, the firm said in a notification to exchanges, according to reports",neutral,positive,-1.6528925619834711,negative,0.8819823603527905,neutral
2021-04-15 06:46:00.000,121.0,123.4,117.35,119.0,7347906.0,Aditya Birla Capital and Sun Life to offload 13.50% stake in Aditya Birla Sun Life AMC through IPO,"The IPO will be subject to market conditions, receipt of applicable approvals and other considerations.",neutral,neutral,-1.6528925619834711,negative,0.8819823603527905,neutral
2021-04-15 08:40:00.000,121.0,123.4,117.35,119.0,7347906.0,"Stocks to watch: Infosys, Wipro, Aditya Birla Capital, HDFC Bank, 5paisa","The board of Aditya Birla Capital has approved an initial public offer of its asset management business, Aditya Birla Sun Life AMC",neutral,positive,-1.6528925619834711,negative,0.8819823603527905,neutral
2021-04-15 21:33:26.000,119.05,121.95,117.6,120.1,3836281.0,Aditya Birla Cap okays AMC listing plan,"The Board of Directors of Aditya Birla Capital has approved the sale of 28,50,880 shares of its subsidiary Aditya Birla Sun Life AMC through an initial public offering.Aditya Birla Sun Life AMC has a",neutral,positive,0.8819823603527905,neutral,-0.7758620689655221,neutral
2021-04-20 07:46:58.000,118.0,120.6,116.0,116.9,3679441.0,"Stocks to Watch: ACC, Aditya Birla Capital, Bajaj Consumer, ICICI Prudential","Aditya Birla Sun Life AMC Ltd has filed a red herring prospectus with the Sebi for an IPO, Aditya Birla Capital said in a regulatory filing",neutral,neutral,-0.9322033898305035,negative,0.9482758620689606,positive
2021-04-20 09:10:43.000,118.0,120.6,116.0,116.9,3679441.0,Aditya Birla Sun Life AMC Files DRHP With SEBI For IPO,"Aditya Birla Capital Limited (ABCL) has approved sale of up to 28,50,880 equity shares of face value of Rs 5 each held in Aditya Birla Sun Life AMC.",neutral,neutral,-0.9322033898305035,negative,0.9482758620689606,positive
2021-04-20 09:12:00.000,118.0,120.6,116.0,116.9,3679441.0,Aditya Birla Sun Life AMC files DRHP with Sebi,The board of Aditya Birla Capital on April 14 had approved the IPO of Aditya Birla Sun Life AMC,neutral,positive,-0.9322033898305035,negative,0.9482758620689606,positive
2021-04-20 09:37:18.000,118.0,120.6,116.0,116.9,3679441.0,Aditya Birla Capital Share Price Rises 6% After Subsidiary Files DRHP For IPO,"The share touched a 52-week high of Rs 139.60 and a 52-week low of Rs 37.45 on 09 March, 2021 and 24 March, 2020, respectively.",neutral,negative,-0.9322033898305035,negative,0.9482758620689606,positive
2021-04-20 11:26:00.000,118.0,120.6,116.0,116.9,3679441.0,Aditya Birla Sun Life AMC files documents for IPO with markets regulator,"Aditya Birla Sun Life AMC Ltd (ABSLAMC), a material subsidiary of Aditya Birla Capital, filed a draft red herring prospectus (DRHP) dated 19th April 2021 with the Securities and Exchange Board of India, Aditya Birla Capital said",neutral,neutral,-0.9322033898305035,negative,0.9482758620689606,positive
2021-04-20 11:44:10.000,118.0,120.6,116.0,116.9,3679441.0,Aditya Birla Sun Life AMC files DRHP with SEBI for IPO; parent Aditya Birla Capital to trim holding,"Through the IPO, Aditya Birla Capital will sell up to 28,50,880 equity shares of face value Rs 5 each, held in Aditya Birla Sun Life AMC.",neutral,neutral,-0.9322033898305035,negative,0.9482758620689606,positive
2021-04-20 12:40:10.000,118.0,120.6,116.0,116.9,3679441.0,Aditya Birla Sun Life AMC files DRHP for IPO,Aditya Birla Capital Ltd and Sun Life India will together sell up to 13.50% of the paid-up share capital of ABSL AMC via OFS,neutral,neutral,-0.9322033898305035,negative,0.9482758620689606,positive
2021-04-20 15:45:00.000,118.0,120.6,116.0,116.9,3679441.0,Aditya Birla Sun Life AMC files draft red herring prospectus with SEBI for IPO,The proposed sale of equity shares by Aditya Birla Capital and Sun Life India in the IPO will together constitute up to 13.50% of the paid-up share capital of ABSLAMC.,neutral,neutral,-0.9322033898305035,negative,0.9482758620689606,positive
2021-04-20 16:58:00.000,118.0,120.6,116.0,116.9,3679441.0,Aditya Birla Sun Life AMC files papers with Sebi for IPO,Aditya Birla Capital on Tuesday said its arm Aditya Birla Sun Life AMC has filed a draft red herring prospectus (DRHP) with capital markets regulator Sebi to launch its initial public offering (IPO).,neutral,neutral,-0.9322033898305035,negative,0.9482758620689606,positive
2021-04-20 17:58:00.000,118.0,120.6,116.0,116.9,3679441.0,"Aditya Birla MF files IPO document with Sebi; issue size Rs 2,000 cr","Through the maiden offering Canadian firm Sun Life Financial will divest its 12.56% holding, while Aditya Birla Capital will sell a little less than 1%",neutral,neutral,-0.9322033898305035,negative,0.9482758620689606,positive
2021-05-10 18:16:00.000,121.0,125.35,118.1,119.55,5031674.0,Aditya Birla Capital seeks shareholders nod to dilute stakes in AMC to 50% ahead of IPO; Stock climbs 6%,"Aditya Birla Capital received board of directors approval for the initial public offering (IPO) of its material subsidiary, Aditya Birla Sun Life AMC (“ABSLAMC”).",positive,positive,-1.1983471074380188,negative,-0.62266500622665,neutral
2021-05-14 05:30:00.000,121.6,123.4,119.05,121.45,4325579.0,BRIEF-Aditya Birla Capital Reports Higher March-Quarter Profit,BRIEF-Aditya Birla Capital Reports Higher March-Quarter Profit,neutral,neutral,-0.1233552631578877,neutral,-0.1574803149606321,neutral
2021-05-14 08:01:34.000,121.6,123.4,119.05,121.45,4325579.0,"Stocks to Watch: Dr Reddy’s, Tata Power, Jindal Steel, Airtel, Happiest Minds","Among major companies that will report their March quarter earnings are Cipla, Dr Reddy’s, and Larsen & Toubro. Jindal Stainless, Aditya Birla Capital, Balkrishna Industries, , Macrotech Developers and Welspun India are a few other companies that will also declare their results today",neutral,neutral,-0.1233552631578877,neutral,-0.1574803149606321,neutral
2021-05-14 08:09:00.000,121.6,123.4,119.05,121.45,4325579.0,"Market Ahead Podcast, May 14: Top factors that could guide markets today","A total of 41 companies, including Larsen & Toubro, Dr Reddy’s Laboratories, Cipla, Aditya Birla Capital, Macrotech Developers and Welspun India are scheduled to release their quarterly results today",neutral,neutral,-0.1233552631578877,neutral,-0.1574803149606321,neutral
2021-05-14 17:35:00.000,121.6,123.4,119.05,121.45,4325579.0,"Aditya Birla Capital allots 52,048 equity shares under ESOP","Consequent to the above allotment, the Paid-up Equity Share Capital of the Company will increase from Rs24,15,27,79,780 (i.e. 2,41,52,77,978 equity shares of face value ₹10/- each) to Rs 24,15,33,00,260 (i.e. 2,41,53,30,026 equity shares of face",neutral,neutral,-0.1233552631578877,neutral,-0.1574803149606321,neutral
2021-05-14 17:45:00.000,121.6,123.4,119.05,121.45,4325579.0,Aditya Birla Capital consolidated net profit rises 161.12% in the March 2021 quarter,Sales rise 16.19% to Rs 5586.83 crore,positive,positive,-0.1233552631578877,neutral,-0.1574803149606321,neutral
2021-05-14 17:50:30.000,121.6,123.4,119.05,121.45,4325579.0,Aditya Birla Capital Q4 net profit surges 161%,The company posted 16.2% jump in revenue from operations,positive,positive,-0.1233552631578877,neutral,-0.1574803149606321,neutral
