date,open,high,low,close,volume,title,description,title_sentiment,desc_sentiment,daily_change_pct,market_sentiment,next_day_change_pct,next_day_sentiment
2018-02-06 18:01:39.976,162.0,164.8,162.1,163.7,1941210.0,Stock market crash: Nearly 200 stocks hit 52-week lows,"Around 188 stocks, including Aditya Birla Capital, Andhra Bank, Bajaj Hindusthan Sugar, BGR Energy Systems and Central Bank of India, hit fresh 52 -week lows on BSE",negative,negative,1.0493827160493756,positive,1.7873371705543706,positive
2018-02-12 13:00:10.252,169.5,171.0,168.2,169.95,1972103.0,Aditya Birla Capital to launch ARC business this quarter,"Aditya Birla Group’s ARC arm keen to tap into bad loan opportunity in India, open to partnering with foreign stressed assets investors, says  Aditya Birla Capital CEO Srinivasan",neutral,neutral,0.26548672566371,neutral,-1.6441573693482154,negative
2018-02-13 13:01:31.556,170.3,172.65,167.35,167.5,1768041.0,"Aditya Birla Capital to push retail, small and medium enterprise loan book",The Aditya Birla Group invested about Rs 2.5 billion in April-December 2017 in the housing finance business,neutral,neutral,-1.6441573693482154,negative,-1.601898546425403,negative
2018-05-08 23:01:23.501,160.25,160.25,157.1,157.5,2785395.0,Aditya Birla Capital to name management team for ARC wing,Aditya Birla Capital to announce management team for ARC in next few weeks,neutral,neutral,-1.71606864274571,negative,-2.089930335655485,negative
2018-05-08 23:02:05.735,160.25,160.25,157.1,157.5,2785395.0,Aditya Birla Capital March quarter profit rises 91% at Rs208 crore,Aditya Birla Capital reports a rise of 91% in its consolidated net profit at Rs208 for the quarter ended March of 2017-18 against Rs109 crore in the same period a year ago,positive,positive,-1.71606864274571,negative,-2.089930335655485,negative
2018-05-09 10:01:07.360,160.25,160.25,157.1,157.5,2785395.0,Aditya Birla Capital net rises 92% on strong business growth,The asset management business saw profit before tax jump 62 per cent to Rs 138 crore in the quarter.,positive,positive,-1.71606864274571,negative,-2.089930335655485,negative
2018-05-09 10:01:07.730,160.25,160.25,157.1,157.5,2785395.0,"We will focus on non-metros as margins are higher, costs are low: Ajay Srinivasan, Aditya Birla Capital","""You get better returns and better traction if you do a fund and ARC. Also focus on resolution.""",neutral,positive,-1.71606864274571,negative,-2.089930335655485,negative
2018-05-24 13:02:34.594,142.5,143.5,141.85,143.2,872038.0,Aditya Birla Capital gains 3% after Credit Suisse initiates Outperform rating,Company reported nearly double growth in consolidated profit at Rs 208 crore for the March quarter 2018 against Rs 109 crore in corresponding period last fiscal.,positive,positive,0.4912280701754306,neutral,1.6689847009735586,positive
2018-06-28 13:00:16.636,128.9,133.95,128.55,133.1,2373595.0,Aditya Birla Capital rises 2%; Credit Suisse maintains outperform with target Rs 175,The research house has remained positive given its good growth potential and improving profitability across business.,positive,positive,3.2583397982932416,positive,-2.597891566265073,negative
2018-08-10 23:01:13.500,150.85,152.1,145.1,146.1,2118887.0,Aditya Birla Capital net up 31%,"Aditya Birla Capital today reported a 31 per cent rise in net profit for the three months ended June 30 this year at ₹ 227 crore on an income growth of 32 per cent at ₹ 3,374 crore. The company’s asse",positive,positive,-3.148823334438184,negative,-2.3793103448275783,negative
2018-08-29 18:01:14.462,141.0,145.0,141.0,143.4,4537275.0,"Large cap portfolio: Sundaram Finance replaces Aditya Birla Capital, HDFC makes the cut","In our constant endeavour to enhance portfolio performance, we are making few changes in our large cap portfolio ",neutral,neutral,1.7021276595744723,positive,-1.1904761904762025,negative
2018-08-29 18:02:08.820,141.0,145.0,141.0,143.4,4537275.0,"Varde, Aditya Birla to Create $1 Billion Joint Venture","Varde Partners Inc. and Aditya Birla Capital Ltd. are creating a joint venture to invest as much as $1 billion in distressed assets in India, according to people familiar with the transaction, who asked not to be identified because the information is private.",neutral,positive,1.7021276595744723,positive,-1.1904761904762025,negative
2018-08-30 13:00:10.811,142.8,142.9,140.3,141.1,1015024.0,Aditya Birla Capital ties up with Varde Partners for distressed assets business,Varde Partners will come on board as a 50:50 joint venture partner in ABCL’s newly incorporated asset reconstruction company,neutral,neutral,-1.1904761904762025,negative,0.1415929203539742,neutral
2018-09-09 18:00:12.276,136.4,137.2,134.5,134.9,738071.0,Maneesh Yadav joins ASK group's new NBFC ASK Financial Holdings as CEO,Yadav had spent over a decade with Aditya Birla Capital's mortgage and real estate business and at last as the CEO of the company's real estate fund for two years,neutral,neutral,-1.099706744868035,negative,-1.668520578420467,negative
2018-10-22 13:00:56.209,99.85,99.85,96.0,97.05,2127697.0,"IndusInd Bank, AU Small Finance, Bharti Airtel, Dish TV hit 52-week lows","UltraTech Cement, Aditya Birla Capital, Dilip Buildcon, Dish TV, Edelweiss Financial, Indiabulls Real Estate, KEI Ind and India Cements were among 32 stocks from the S&P BSE500 index hit 52-week lows.",positive,neutral,-2.8042063094641936,negative,-2.702702702702694,negative
2018-10-22 18:00:56.267,99.85,99.85,96.0,97.05,2127697.0,D-Street Buzz: Auto stocks gain with Eicher Motors up 3%; IndusInd Bank falls 8%,"131 stocks have hit new 52-week low including names like Aditya Birla Capital, Adlabs Entertainment, Dish TV, Indiabulls Real Estate, India Cements, Kwality, Persistent Systems and Videocon Industries among others.",positive,negative,-2.8042063094641936,negative,-2.702702702702694,negative
2018-11-05 23:01:21.183,106.75,108.85,105.25,106.6,1536209.0,"Voltas, Manappuram, Graphite Ind results","About 40 companies including Aditya Birla Capital, ABC India, Automotive Axles, Balmer Lawrie Inv, Camlin Fine Sciences, Cupid, Dr Lal PathLabs, Eon Electric, Garware Polyester, Goldcrest, Graphite In",neutral,neutral,-0.1405152224824409,neutral,-1.0185185185185133,negative
2018-12-19 18:00:56.650,100.0,100.5,99.1,99.45,1587183.0,Aditya Birla AMC expands footprints in TN,"Our Bureau Aditya Birla Sun Life AMC (formerly known as Birla Sun Life Asset Management Company), a subsidiary of Aditya Birla Capital has expanded its footprint in Tamil Nadu with the opening of",positive,positive,-0.5499999999999972,neutral,-1.0060362173038229,negative
2019-01-17 10:01:09.429,96.6,96.8,95.0,95.25,1877920.0,"Despite demerger, Aditya Birla Capital fails to catch Street's interest","However, asking price of 1.8x its FY20 book value a key positive for stock",negative,positive,-1.3975155279503046,negative,-1.832460732984293,negative
2019-02-05 23:00:58.119,83.15,83.75,81.55,82.3,3247595.0,"Aditya Birla Capital Q3 net up 42% on strong NBFC, home loan, MF biz","Revenues up 26% to Rs 4,119 crore; lending book expands 29% to Rs 60,129 crore",positive,positive,-1.0222489476849168,negative,1.0902483343428293,positive
2019-03-21 10:00:52.883,105.0,105.95,102.15,103.0,2439931.0,"Remember The Grasim Demerger? It’s Staring At A Tax Hit Of Over Rs 5,800 Crore",The demerger of Grasim’s financial services undertaking to Aditya Birla Capital is considered a taxable event by IT authorities.,neutral,neutral,-1.9047619047619049,negative,-1.2376237623762376,negative
2019-05-03 23:01:25.802,100.0,102.4,99.15,102.05,3412758.0,"LIC HF, Federal Bank results on Saturday"," The boards of Aditya Birla Capital (also for fund-raising), CJ Gelatine Products, Escorts Finance, Federal Bank, LIC Housing Finance, Kewal Kiran Clothing, Kirloskar Pneumatic Co, Morepen Labs, NIIT",neutral,neutral,2.049999999999997,positive,-1.6601562500000029,negative
2019-05-05 10:00:40.466,102.4,103.8,100.3,100.7,4982770.0,Aditya Birla Capital which is the financial services arm of the Aditya Birla group had posted a net profit of Rs 169.45 crore in the year ago period.,Aditya Birla Capital which is the financial services arm of the Aditya Birla group had posted a net profit of Rs 169.45 crore in the year ago period.,positive,positive,-1.6601562500000029,negative,-2.5980392156862804,negative
2019-05-05 13:02:22.406,102.4,103.8,100.3,100.7,4982770.0,Aditya Birla Capital's Q4 net profit jumps 52% to  ₹258 crore,"Aditya Birla Capital's total income for the reporting quarter grew to  ₹4,730.80 crore from the  ₹3,578.44 crore.On the insurance side, the total gross premium for life and general side grew 30 per cent to  ₹8,008 crore",positive,positive,-1.6601562500000029,negative,-2.5980392156862804,negative
2019-05-06 10:00:27.789,102.4,103.8,100.3,100.7,4982770.0,Aditya Birla Capital plans to raise $300 million via ECBs in FY20,"Aditya Birla Capital raised about  ₹11,000 crore of long-term funds in the second half of FY19.ABCL raised about  ₹11,000 crore of long-term funds in the second half of FY19 despite liquidity headwinds across the industry",positive,positive,-1.6601562500000029,negative,-2.5980392156862804,negative
2019-07-12 13:00:26.144,90.25,91.3,90.0,91.15,765661.0,K M Birla consolidates group companies under Birla Group Holdings,"The investment companies that would be merged into BGH have substantial stake in major group entities like Hindalco, Aditya Birla Capital. ",neutral,neutral,0.9972299168975132,positive,-2.454991816693944,negative
2019-07-18 23:01:40.010,90.4,90.4,86.8,87.2,1352525.0,Prioritise personalisation,"With over three decades of expertise in consulting and financial services marketing to Aditya Birla Capital, Ajay Kakar, Chief Marketing Officer, provides strategic direction and leadership to the bra",neutral,neutral,-3.5398230088495604,negative,1.1487650775416427,positive
2019-08-06 10:00:57.012,85.7,89.75,85.1,87.05,1515780.0,Aditya Birla Capital (₹85.4): Buy,Investors with a short-term horizon and contrarian view can buy the stock of Aditya Birla Capital at current levels.The stock gained 4.6 per cent accompanied by above average volume on Monday while th,neutral,positive,1.5752625437572862,positive,-2.0689655172413763,negative
2019-09-05 10:01:32.391,91.4,92.4,91.1,91.3,1762882.0,Aditya Birla Capital’s fund-raising plans eyed,"The board of directors of Aditya Birla Capital will meet on Thursday to consider approval for raising of funds by way of preferential allotment, QIP or by any other method. Shareholders will closely m",neutral,neutral,-0.1094091903720005,neutral,0.2705627705627705,neutral
2019-09-05 13:00:23.433,92.4,93.0,92.0,92.65,1322778.0,"Aditya Birla Capital to  ₹2100 crore from Advent, Premji Invest, others","The equity capital will be raised at  ₹100 per share, a 10.62% premium to ABCL’s closing price of  ₹90.40 as of 4 September 2019.ABCL has aggregate average assets under management across asset management and insurance businesses of over  ₹3 lakh crore",neutral,positive,0.2705627705627705,neutral,1.3963480128893786,positive
2019-09-06 10:01:39.594,92.4,93.0,92.0,92.65,1322778.0,"Advent, Birlas to pump Rs 1,000 crore each into Aditya Birla Capital","PremjiInvest to put in Rs 100 cr; fundraise to help refinance debt, provide growth equity.",neutral,neutral,0.2705627705627705,neutral,1.3963480128893786,positive
2019-09-10 18:03:03.846,95.1,97.5,95.1,96.5,1446672.0,"Aditya Birla Capital to raise Rs 2,100 cr via preferential allotment","Aditya Birla Capital Ltd (ABCL) is planning to raise Rs 2,100 crore through issuance of equity shares on a preferential basis to Jomei Investments Ltd, promoter Grasim Industries, members of the promo",positive,positive,1.4721345951629925,positive,-1.5353121801432956,negative
2019-09-10 20:36:51.265,95.1,97.5,95.1,96.5,1446672.0,"Aditya Birla Capital to raise Rs2,100 crore equity capital","Aditya Birla Capital will take up the proposal for the consideration of shareholders at its extraordinary general meeting to be held on October 5.Board approves the creation, offer, issue and allotment of 21 crore equity shares at a price of Rs100 per share including premium of Rs90",positive,neutral,1.4721345951629925,positive,-1.5353121801432956,negative
2019-09-11 10:00:43.785,95.1,97.5,95.1,96.5,1446672.0,"CVC Capital, Carlyle could be shortlisted for Piramal, TPG stake in Shriram Capital","Advent International has invested Rs 1,000 crore via its affiliate Jomei Investment in Aditya Birla capital last week.",neutral,neutral,1.4721345951629925,positive,-1.5353121801432956,negative
2019-09-11 10:00:58.727,95.1,97.5,95.1,96.5,1446672.0,"CVC Capital, Carlyle could be shortlisted for Piramal, TPG stake in Shriram Capital","Advent International has invested Rs 1,000 crore via its affiliate Jomei Investment in Aditya Birla capital last week.",neutral,neutral,1.4721345951629925,positive,-1.5353121801432956,negative
2019-10-24 23:03:14.670,81.5,81.7,78.75,79.0,1358563.0,CCI clears Advent International investment in Aditya Birla Capital,"CCI approval is for indirect acquisition of 4.15% stake in Aditya Birla Capital by Advent International Corp.Aditya Birla Capital had in Sept said that its board had approved mobilising Rs2,100 crore investments including Rs1,000 crore of equity investments from Jomei Investments",neutral,neutral,-3.067484662576687,negative,0.8145363408521374,neutral
2019-11-07 18:04:28.664,85.6,88.6,85.6,86.85,6229687.0,Aditya Birla Capital Q2 up by 37 pc at Rs 256 cr on diversified portfolio,"Mumbai (Maharashtra) [India], Nov 7 (ANI): Aditya Birla Capital Ltd said on Thursday its consolidated profit after tax after minority interest in Q2 FY2019-20 grew by 37 per cent year-on-year to Rs 256 crore on the back of a diversified business portfolio.",positive,positive,1.4602803738317758,positive,-0.6868918145392036,neutral
2019-11-08 13:01:41.855,85.6,88.6,85.6,86.85,6229687.0,Aditya Birla Capital Q2 net profit rises 37% to  ₹256 crore,"Overall loan book, including non-banking and housing finance, grew 4% year-on-year to  ₹60,477 crore.Aditya Birla Finance, the NBFC business, reported a 32% increase in net profit to  ₹273 crore at the end of September, excluding the impact of deferred tax assets",positive,positive,1.4602803738317758,positive,-0.6868918145392036,neutral
2019-11-19 18:03:46.463,84.2,85.9,84.0,85.5,2259576.0,"Perfios raises $50 million led by Warburg Pincus, Bessemer Venture Partners","Perfios' clients include Tata Capital, Lendingkart, IIFL, Aditya Birla Capital and DSP BlackRock Mutual Fund, among others.The deal also includes a secondary share purchase from early angel investors in the company",neutral,neutral,1.543942992874106,positive,10.115606936416183,positive
2019-11-29 10:27:28.802,110.3,114.6,108.8,109.15,5979411.0,Aditya Birla Finance becomes first company to raise CP worth Rs100cr on NSE,"ABFL, the lending subsidiary of Aditya Birla Capital Limited is the first company to list its Commercial Paper on NSE with a value date of November 28, 2019, and maturity date on February 7, 2020.",neutral,neutral,-1.0426110607434194,negative,-2.73224043715847,negative
2020-01-15 23:03:37.592,111.5,111.9,109.0,109.65,1469184.0,"The Social Street launches outdoor advertising division, The Blank Canvas","Currently, the nine-people strong The Blank Canvas team has resources catering to client servicing, copy writing, media buying and retail segment.Based out of The Social Street’s Mumbai office, the division has already started working on projects for brands including Aditya Birla Capital, Disney Consumer Products",neutral,neutral,-1.6591928251121026,negative,2.4720149253731263,positive
2020-01-31 23:01:44.563,99.15,102.1,93.9,95.0,2357226.0,Aditya Birla Capital Q3 net rises by 17%,Aditya Birla Capital posted a 17.1 per cent increase in its consolidated net profit to ₹250.48 crore in the third quarter of the fiscal year as against ₹213.79 crore in the same period a year ago.Howe,positive,positive,-4.185577407967731,negative,-2.748414376321347,negative
2020-02-25 10:05:42.198,87.0,88.0,84.1,84.6,1627865.0,"Aditya Birla Capital gets  ₹1,000 cr foreign investment from Jomei","DEA has communicated its approval to the company for foreign investment by Jomei for the purpose of subscription to the preferential issue of the company.Shares of the company closed at  ₹87.15 apiece on the BSE, down 3.27% from the previous close",neutral,negative,-2.758620689655179,negative,-1.1309523809523845,negative
2020-03-06 13:00:50.403,74.45,74.8,73.0,74.2,1938260.0,Aditya Birla AMC ties up with Saraswat Bank to sell mutual fund products,"Aditya Birla Sun Life AMC, a subsidiary of Aditya Birla Capital Limited (a significant non-bank financial services’ conglomerate), and investment manager to Aditya Birla Sun Life Mutual Fund (ABSLMF)",positive,neutral,-0.3357958361316319,neutral,-2.0999275887038418,negative
2020-06-05 05:30:00.000,53.9,56.65,53.3,56.45,5235983.0,BRIEF-India’s Aditya Birla Capital March Quarter PAT Rises - Investing.com India,"The Financial News section features stock market news in addition to stories about bonds, forex, commodities and economic releases.",neutral,neutral,4.730983302411882,positive,-1.1433597185576052,negative
2020-06-05 19:34:05.000,53.9,56.65,53.3,56.45,5235983.0,Aditya Birla Capital’s Net Profit Falls 44.2% To Rs 144 Crore In March Quarter,"Revenues during the three months to March 2020 grew to Rs 5,122 crore, from Rs 5,050 crore in the corresponding period of 2018-19.",neutral,positive,4.730983302411882,positive,-1.1433597185576052,negative
2020-06-05 20:18:32.000,53.9,56.65,53.3,56.45,5235983.0,Aditya Birla Cap net profit down 44 per cent in Q4,"Aditya Birla Capital reported a 44.4 per cent drop in consolidated net profit at ₹143.67 crore in the fourth quarter of FY20 against ₹258.40 crore a year ago.Revenue was up 1.4 per cent to ₹5,122 cror",negative,positive,4.730983302411882,positive,-1.1433597185576052,negative
2020-06-05 20:45:00.000,53.9,56.65,53.3,56.45,5235983.0,Aditya Birla Capital FY20 profit rises to Rs 920 crore; active customer base grows to 2 crore,"The consolidated revenue recorded a 9 per cent on year surge at Rs 18,028 crore in fiscal year 2019-20, Aditya Birla Capital said in an exchange filing",positive,positive,4.730983302411882,positive,-1.1433597185576052,negative
2020-06-08 11:43:00.000,56.85,59.6,55.0,56.2,7634636.0,Trending stocks: Aditya Birla Capital shares jump nearly 5%,"A total of 334,376 shares changed hands on the counter till 11:40AM (IST).",positive,neutral,-1.1433597185576052,negative,-6.479859894921196,negative
2020-06-09 13:38:10.000,54.05,55.8,53.25,54.85,2635741.0,Buy Aditya Birla Capital; Target Of Rs 84: Motilal Oswal,"Motilal Oswal is bullish on Aditya Birla Capital has recommended buy rating on the stock with a target price of Rs 84 in its research report dated June 07, 2020.",neutral,positive,1.4801110083256326,positive,0.0,neutral
2020-07-16 18:16:41.000,57.85,59.8,57.6,59.35,1954522.0,"Aditya Birla Capital’s subsidiaries witness 2X increase in customer interactions on WhatsApp, chatbots","Aditya Birla Capital Limited (ABCL), the holding company of the financial services businesses of the Aditya Birla Group, explained that on the back of the ongoing COVID-19 pandemic, it has experienced a demand shift for zero contact and paperless purchase options.",positive,positive,2.592912705272256,positive,3.868797308662737,positive
2020-07-17 13:46:00.000,57.85,59.8,57.6,59.35,1954522.0,Aditya Birla Capital records two-fold rise in online interface amid pandemic,"“Digital enablement to create a superior customer experience throughout the customer journey has been a key part of our agenda,” said Ajay Srinivasan, Chief Executive, Aditya Birla Capital.",positive,positive,2.592912705272256,positive,3.868797308662737,positive
2020-08-04 19:36:00.000,59.0,59.9,58.05,58.3,1983519.0,"Aditya Birla Health Insurance unveils new services, products for Covid-19","With the onset of COVID-19, it has become imperative to realise the importance of health and wellness, alongside having a comprehensive health insurance policy.Keeping this in mind, Aditya Birla Health Insurance (ABHICL), the health insurance arm of Aditya Birla Capital Limited, has introduced an ar…",neutral,neutral,-1.1864406779661063,negative,-1.0221465076661012,negative
2020-08-07 04:04:00.000,58.5,59.75,57.9,58.95,2634158.0,Aditya Birla Capital Q1FY21; consolidated profit falls by ~27% yoy,Consolidated profit after tax stood at ~Rs198cr for the quarter ended June 2020.,negative,neutral,0.7692307692307742,neutral,-1.3300083125519488,negative
2020-08-07 05:30:00.000,58.5,59.75,57.9,58.95,2634158.0,BRIEF-India’s Aditya Birla Capital June Quarter Consol Net Profit Falls - Investing.com India,"The Financial News section features stock market news in addition to stories about bonds, forex, commodities and economic releases.",neutral,neutral,0.7692307692307742,neutral,-1.3300083125519488,negative
2020-08-07 10:06:00.000,58.5,59.75,57.9,58.95,2634158.0,"Share Market News Live: Sensex slips 60 points, Nifty at 11,210; HDFC Bank, Infosys, HCL Tech top losers","India Stock Market News Updates Today: M&M, Cipla, Siemens, Abbott, Aditya Birla Capital, Adani Transmission, Alkem Labs, Bata among others are the top companies that will be reporting their April-June quarterly earnings",neutral,neutral,0.7692307692307742,neutral,-1.3300083125519488,negative
2020-08-07 13:56:00.000,58.5,59.75,57.9,58.95,2634158.0,"Aditya Birla Capital allots 38,550 equity shares under ESOS","Consequent to the above allotment, the Paid-up Equity Share Capital of the Company will increase from Rs 24,13,85,87,700 (i.e. 2,41,38,58,770 equity shares of face value Rs 10/- each) to Rs 24,13,89,73,200 (i.e.
2,41,38,97,320 Fully Paid-up Equity",neutral,neutral,0.7692307692307742,neutral,-1.3300083125519488,negative
2020-08-07 16:22:00.000,58.5,59.75,57.9,58.95,2634158.0,Aditya Birla Capital reports standalone net loss of Rs 0.72 crore in the June 2020 quarter,Sales rise 60.60% to Rs 8.03 crore,negative,positive,0.7692307692307742,neutral,-1.3300083125519488,negative
2020-08-07 17:30:00.000,58.5,59.75,57.9,58.95,2634158.0,Aditya Birla Capital consolidated net profit declines 26.49% in the June 2020 quarter,Sales rise 10.66% to Rs 4034.55 crore,negative,positive,0.7692307692307742,neutral,-1.3300083125519488,negative
2020-08-07 18:27:00.000,58.5,59.75,57.9,58.95,2634158.0,Aditya Birla Capital profit down 27% at Rs 198 crore in June quarter,"Aditya Birla Capital on Friday reported nearly 27 per cent fall in consolidated net profit at Rs 198 crore for
June quarter, 2020-21.",negative,negative,0.7692307692307742,neutral,-1.3300083125519488,negative
2020-08-07 18:33:45.000,58.5,59.75,57.9,58.95,2634158.0,Aditya Birla Capital Q1 result: Net profit down 27% at ₹198 crore,"Aditya Birla Capital reported nearly 27% fall in consolidated net profit at ₹198 crore for June quarter 2020-21, as against a profit of ₹270 crore in the year-ago same period",negative,negative,0.7692307692307742,neutral,-1.3300083125519488,negative
2020-08-07 20:08:00.000,58.5,59.75,57.9,58.95,2634158.0,Aditya Birla Capital Q1 net profit down 27% at Rs 198 crore,ABCL said the profit during April-June was higher than Rs 144 crore in the preceding March quarter and it provided Rs 62 crore as COVID-19 provisions on its lending businesses during the period under review.,negative,positive,0.7692307692307742,neutral,-1.3300083125519488,negative
2020-08-07 22:18:00.000,58.5,59.75,57.9,58.95,2634158.0,Aditya Birla Capital Q1 results: Profit down 27% at Rs 198 cr,"The revenue grew 9 per cent year-on- year to Rs 4,293 crore during April-June 2020-21, Aditya Birla Capital Ltd (ABCL) said in a release.",negative,positive,0.7692307692307742,neutral,-1.3300083125519488,negative
2020-08-10 08:08:00.000,60.15,60.9,59.15,59.35,2694203.0,"In pics | Stocks in the news: IndusInd Bank, Bharti Airtel, Cipla, JSW Energy, Aditya Birla Capital, Bata, Birla Corp",REC | JSW Steel | Phoenix Mills | Container Corporation of India | PSP Projects | Amara Raja Batteries | Siemens | Shipping Corporation of India | Century Textiles | Gateway Distriparks RE | Mindspace Business Parks REIT are also some of the stocks in focus today.,neutral,neutral,-1.3300083125519488,negative,-1.4202172096908965,negative
2020-08-11 18:59:00.000,59.0,60.1,58.55,59.7,1561654.0,Buy Aditya Birla Capital; target of Rs 86: Motilal Oswal,"Motilal Oswal is bullish on Aditya Birla Capital recommended buy rating on the stock with a target price of Rs 86 in its research report dated August 09, 2020.",neutral,positive,1.1864406779661063,positive,1.2510425354462051,positive
2020-08-19 12:36:00.000,60.45,64.4,60.4,62.95,4890504.0,"Morgan Stanley bullish on small, midcaps on growth recovery, valuations","Aditya Birla Capital, Jubilant FoodWorks, MhpasiS, Narayana Hrudyalaya, and Tata Power are among the 22 SMIDs where it remains bullish.",positive,neutral,4.135649296939619,positive,-1.1811023622047243,negative
2020-09-04 12:16:09.000,70.15,77.4,69.65,72.5,29841405.0,IFB Industries Ltd leads gainers in ‘A’ group,"Aditya Birla Capital Ltd, Jamna Auto Industries Ltd, IFCI Ltd and Force Motors Ltd are among the other gainers in the BSEs A group today, 04 September 2020.",positive,neutral,3.349964362081246,positive,-2.5675675675675755,negative
2020-09-07 17:59:00.000,71.95,73.65,70.25,70.65,4525748.0,Aditya Birla Capital allots 2.29 lakh equity shares under RSUs,"Consequent to the above allotment, the Paid-up Equity Share Capital of the Company will increase from
Rs 24,13,89,73,200 (i.e. 2,41,38,97,320 equity shares of face value Rs 10/- each) to Rs 24,14,12,66,320 (i.e.
2,41,41,26,632 Fully Paid-up Equity",neutral,neutral,-1.8068102849200791,negative,-2.9078014184397123,negative
