date,open,high,low,close,volume,title,description,title_sentiment,desc_sentiment,daily_change_pct,market_sentiment,next_day_change_pct,next_day_sentiment
2022-04-25 22:15:00.000,117.25,118.45,115.25,116.4,6691312.0,Ahead of Market: 12 things that will decide stock action on Tuesday,"Momentum indicator Moving Average Convergence Divergence (MACD) showed bullish trade setup on the counters of Aditya Birla Capital, Colgate Palmolive, Minda Industries and Sterlite Tech.",neutral,positive,-0.724946695095944,neutral,5.150589262330866,positive
2022-04-27 09:04:46.000,114.55,121.9,114.5,120.45,14223813.0,Aditya Birla Capital: Will A Management Transition Breathe New Life Into The Business?,Can Aditya Birla Capital’s fortunes change under new leadership?,neutral,neutral,5.150589262330866,positive,0.4101722723543888,neutral
2022-05-12 07:53:00.000,101.4,101.95,98.05,99.9,3801574.0,"Stocks to Watch: CoForge, MRPL, Petronet, JSW Ispat, PNB, Birla Corp, PSBs","Stocks to Watch Today: Aditya Birla Capital, Apollo Tyres, GSPL, HCC, L&T, RBL Bank, Siemens and Tata Motors ahead of Q4 earnings; Prudent Corporate Advisory Services IPO to close on Thursday.",neutral,neutral,-1.4792899408284024,negative,-3.574879227053142,negative
2022-05-12 07:59:04.000,101.4,101.95,98.05,99.9,3801574.0,"Stocks to Watch: L&T, Tata Motors, PNB, Vodafone Idea, Hindalco, UltraTech","Larsen & Toubro, Tata Motors, RBL Bank, Aditya Birla Capital, Anupam Rasayan India, Apollo Tyres, Gujarat State Petronet, Honeywell Automation India, Poonawalla Fincorp, Ujjivan Small Finance Bank, CreditAccess Grameen are among the companies scheduled to announce their results today",neutral,neutral,-1.4792899408284024,negative,-3.574879227053142,negative
2022-05-12 21:13:59.000,103.5,104.95,99.6,99.8,6470012.0,Aditya Birla Capital profit after tax rises 20% to Rs 450 crore,"The consolidated revenue of the company for Q4 FY22 grew 18 per cent from a year ago to Rs 6,962 crore, Aditya Birla Capital (ABCL) said in a release.",positive,positive,-3.574879227053142,negative,-5.505952380952378,negative
2022-05-12 21:17:00.000,103.5,104.95,99.6,99.8,6470012.0,Aditya Birla Capital profit after tax rises 20% to Rs 450 cr in March qtr,"The consolidated revenue of the company for Q4 FY22 grew 18 per cent from a year ago to Rs 6,962 crore, Aditya Birla Capital (ABCL) said in a release",positive,positive,-3.574879227053142,negative,-5.505952380952378,negative
2022-05-13 07:52:00.000,103.5,104.95,99.6,99.8,6470012.0,Aditya Birla Capital consolidated net profit rises 20.02% in the March 2022 quarter,Sales rise 18.38% to Rs 6616.85 crore,positive,positive,-3.574879227053142,negative,-5.505952380952378,negative
2022-05-13 07:52:00.000,103.5,104.95,99.6,99.8,6470012.0,Aditya Birla Capital standalone net profit rises 8.27% in the March 2022 quarter,Sales rise 35.39% to Rs 104.06 crore,positive,positive,-3.574879227053142,negative,-5.505952380952378,negative
2022-05-13 18:16:35.000,103.5,104.95,99.6,99.8,6470012.0,Aditya Birla Capital profit after tax rises 20 pc to Rs 450 crore | The Financial Express,"The consolidated profit after tax for the year grew 51 per cent to Rs 1,706 crore, the highest ever recorded by the company, it added.",positive,positive,-3.574879227053142,negative,-5.505952380952378,negative
2022-05-16 09:44:43.000,100.8,101.8,90.05,95.25,22746968.0,Aditya Birla Capital Q4 Review - All-Round Improvement; Earnings Quality Much Better: Motilal Oswal,Aditya Birla Capital Q4 Review - All-Round Improvement; Earnings Quality Much Better: Motilal Oswal,neutral,neutral,-5.505952380952378,negative,4.285714285714288,positive
2022-05-16 10:55:00.000,100.8,101.8,90.05,95.25,22746968.0,"Results Review for SBI, Bandhan Bank, Aditya Birla Capital, APL Apollo, CESC","Results Review for SBI, Bandhan Bank, Aditya Birla Capital, APL Apollo, CESC",neutral,neutral,-5.505952380952378,negative,4.285714285714288,positive
2022-05-16 18:23:00.000,98.0,102.65,95.85,102.2,8816229.0,"Found no merit in whistleblower complaints, says Aditya Birla Capital","A news report on Monday said a 16-page whistleblower complaint alleging corruption, insider trading and front running at Aditya Birla MF was sent to the board of Aditya Birla Capital",neutral,negative,4.285714285714288,positive,-1.8987341772151929,negative
2022-05-16 21:43:10.000,98.0,102.65,95.85,102.2,8816229.0,Aditya Birla Capital denies whistle-blower’s allegations,The letter bereft of facts; no employee exit as a fallout of malicious allegations,neutral,neutral,4.285714285714288,positive,-1.8987341772151929,negative
2022-05-17 07:37:50.000,98.0,102.65,95.85,102.2,8816229.0,Buy Aditya Birla Capital; target of Rs 140: Motilal Oswal,"Motilal Oswal is bullish on Aditya Birla Capital recommended buy rating on the stock with a target price of Rs 140 in its research report dated May 14, 2022.",neutral,positive,4.285714285714288,positive,-1.8987341772151929,negative
2022-05-17 07:42:51.000,98.0,102.65,95.85,102.2,8816229.0,"Stocks to Watch: GSK, Raymond, Greenply, Aditya Birla Capital","Indian indices on Monday closed higher, in a volatile trading session, as losses in infra and IT stocks were offset by gains in banking and auto scrips.",neutral,positive,4.285714285714288,positive,-1.8987341772151929,negative
2022-05-17 09:01:00.000,98.0,102.65,95.85,102.2,8816229.0,"Bharti Airtel, Aditya Birla Capital, KEC International in focus; LIC listing eyed","Life Insurance Corporation (LIC) of India: The insurance major will debut on the bourses today, 17 May 2022. The issue was subscribed 2.95 times. It opened on 4 May 2022 and closed on 9 May 2022. The IPO price band was Rs 902 to Rs 949 per equity",neutral,neutral,4.285714285714288,positive,-1.8987341772151929,negative
2022-05-24 05:30:00.000,100.45,100.45,97.7,98.05,2174773.0,"Seven brokerage, investment firms give ‘buy’ call for Aditya Birla Capital","Seven brokerage, investment firms give ‘buy’ call for Aditya Birla Capital",neutral,neutral,-2.389248382279747,negative,-2.884615384615379,negative
2022-08-03 16:04:06.000,109.5,109.5,103.3,105.0,6661017.0,Aditya Birla Capital Q1 PAT Rises 42% YoY to Rs 429 cr,"Aditya Birla Capital’s consolidated net profit rose 42% to Rs 429.47 crore on 26% increase in revenue to Rs 5,859 crore in Q1 FY23 over Q1 FY22.",neutral,positive,-4.10958904109589,negative,-0.8034026465028302,neutral
2022-08-03 16:04:40.000,109.5,109.5,103.3,105.0,6661017.0,Aditya Birla Capital consolidated net profit rises 42.19% in the June 2022 quarter,Sales rise 30.04% to Rs 5590.28 crore,positive,positive,-4.10958904109589,negative,-0.8034026465028302,neutral
2022-08-03 22:06:13.000,109.5,109.5,103.3,105.0,6661017.0,Aditya Birla Capital posts highest-ever Q1 PAT of ₹429 crore,Revenue up 26%; customer base grows 55%,neutral,positive,-4.10958904109589,negative,-0.8034026465028302,neutral
2022-08-04 12:08:00.000,105.8,106.25,104.6,104.95,2111327.0,"Results Review For Gujarat Gas, Aditya Birla Capital, Brigade Enterprises, BSE","Results Review For Gujarat Gas, Aditya Birla Capital, Brigade Enterprises, BSE",neutral,neutral,-0.8034026465028302,neutral,1.426533523537803,positive
2022-08-04 18:14:00.000,105.8,106.25,104.6,104.95,2111327.0,Q1FY23 net profit of Aditya Birla Capital increases by 42% to Rs429 crore,"With its diversified business model, the Company, through its subsidiaries, continues to uphold its reputation for providing solid performance through the market and macroeconomic cycles.",positive,positive,-0.8034026465028302,neutral,1.426533523537803,positive
2022-08-12 11:45:00.000,110.6,112.5,109.5,110.7,10134481.0,Aditya Birla Capital says ADIA to invest Rs 665 crore in health insurance JV,"“Aditya Birla Health Insurance has a strong management team, a wellness-first product offering and a differentiated distribution model. We look forward to partnering with Aditya Birla Capital and Momentum Metropolitan Holdings to support the next phase of ABHIs growth.”",neutral,positive,0.090415913200731,neutral,1.7048003589053309,positive
2022-08-12 17:30:00.000,110.6,112.5,109.5,110.7,10134481.0,Abu Dhabi Investment Authority to invest Rs 665 cr in Aditya Birla Health Insurance,"Once the transaction is complete, ADIA will own a 9.99 per cent stake, Aditya Birla Capital Limited 45.91 per cent, and Momentum Metropolitan Holdings 44.10 per cent stake in Aditya Birla Health Insurance.",neutral,neutral,0.090415913200731,neutral,1.7048003589053309,positive
2022-08-26 20:04:00.000,115.5,116.5,114.2,116.0,4855585.0,"Technology, data, analytics key growth drivers for Aditya Birla Capital","The company’s active customer base has increased 36% year on year to 35 million, with more than 1000 branches and 2 lakh channel. The company’s lending book grew 11% year on year to Rs. 67,185 crore of which retail, SME and HNI segment now account for 68% of total lending book.",neutral,positive,0.4329004329004329,neutral,2.850678733031679,positive
2022-09-29 00:22:00.000,110.1,110.4,107.75,110.35,2915504.0,"GMR Airports raises ₹1,110 crore","GMR Airports, which operates Delhi and Hyderabad airports, paid entire dues to DB International and Aditya Birla Capital, but part payment was made to Standard Chartered Bank, as reported by ET on September 17. On September 22, it raised ₹795 crore from JP Morgan Securities and ₹315 crore from Morga…",positive,positive,0.2270663033605813,neutral,2.705181109582763,positive
2022-10-06 09:27:39.000,116.3,117.0,115.2,115.4,2355393.0,"Stocks that will see action on October 6, 2022","Buzzing stocks: Reliance, Tata Steel, JSW Energy, Jubilant FoodWorks, Apollo Hospitals, Lemon Tree, Lupin, Ratnamani Metal, Gagan Gases, Aditya Birla Capital, IndusInd Bank, Atul Auto, NPR Finance, Trimurthi",neutral,neutral,-0.7738607050730795,neutral,-0.5608283002588487,neutral
2022-10-14 16:35:37.000,112.1,112.85,109.65,109.8,1158400.0,Aditya Birla Capital joins race to acquire life insurer Reliance Nippon,"Successful bid will give additional market share to Aditya Birla Capital, which sees life insurance and health insurance as sunrise sectors",neutral,neutral,-2.051739518287241,negative,0.4096495220755601,neutral
2022-10-14 19:18:35.000,112.1,112.85,109.65,109.8,1158400.0,Aditya Birla Capital eyes Reliance Capital’s life insurance arm,Aditya Birla Capital has approached the CoC citing a provision under the IBC Code which in certain cases allows for bids post the deadline for submission of non-binding bids,neutral,neutral,-2.051739518287241,negative,0.4096495220755601,neutral
2022-10-14 19:44:00.000,112.1,112.85,109.65,109.8,1158400.0,Aditya Birla Capital enters fray to pick up Reliance’s 51% stake in Nippon Life JV,​Aditya Birla Capital is reportedly looking to buy out 51% stake that Reliance has in the joint venture with Nippon Life of Japan.,neutral,neutral,-2.051739518287241,negative,0.4096495220755601,neutral
2022-10-16 23:47:00.000,109.85,111.0,108.1,110.3,1513031.0,Lenders permit Aditya Birla Capital to bid for Reliance Nippon Life,"The Committee of Creditors (CoC) has approved Aditya Birla Capital Ltd to bid for RNLIC, sources said. Reliance Nippon Life Insurance is a 51:49 joint venture between Reliance Capital and Nippon Life of Japan.",neutral,positive,0.4096495220755601,neutral,0.8104457451598431,neutral
2022-10-20 14:56:00.000,111.6,113.25,110.2,111.15,1385152.0,"Sensex news | Stock Market Outlook: Sensex likely to hit 70,000 by next Diwali; 4 sectors to boost growth: Vikas Khemani","“There are lots of ideas and it is very hard to pick one idea. Companies like L&T, ICICI Bank, IndusInd Bank, Aditya Birla Capital all of them according to me will be very well placed. We recently added Aditya Birla Capital and we think from this Diwali to next, Diwali also, it can surprise us and d…",neutral,neutral,-0.4032258064516027,neutral,1.327433628318584,positive
2022-11-01 09:01:00.000,117.65,119.9,117.15,117.95,4238762.0,"Hot Stocks: Brokerages on L&T, Bharti Airtel, Tata Steel, and Aditya Birla Capital post Q2 results",CLSA downgraded Tata Steel to sell with a target price of Rs 90 as Q2 results were below estimates.,neutral,negative,0.2549936251593686,neutral,-0.5054759898904874,neutral
2022-11-01 19:31:29.000,118.7,118.7,116.75,118.1,1649642.0,Aditya Birla Capital allots 5000 equity shares under ESOS,Powered by Capital Market - Live News,neutral,neutral,-0.5054759898904874,neutral,2.9613733905579425,positive
2022-11-07 17:53:19.000,125.0,129.8,123.15,128.5,13516135.0,"Aditya Birla Capital Q2 profit rises 30% to Rs 488 cr, revenue up 21%",It had posted a net profit of Rs 377 crore in the same period a year ago,positive,positive,2.8000000000000003,positive,0.2694380292532674,neutral
2022-11-07 18:48:29.000,125.0,129.8,123.15,128.5,13516135.0,Aditya Birla Capital net up 29% on strong growth across businesses,The company has added 2 million customers leading to a 47 per cent year-on-year growth in the total customer base,positive,positive,2.8000000000000003,positive,0.2694380292532674,neutral
2022-11-15 09:45:05.000,130.1,130.95,127.2,127.95,3021562.0,"Stocks that will see action on November 15, 2022","Stocks to watch: Adani Ports, LTI-Mindtree, PB Fintech, Aditya Birla Capital, Alembic Pharma and Strides Pharma",neutral,neutral,-1.6525749423520304,negative,-1.9921874999999976,negative
2022-12-05 06:10:00.000,152.5,159.2,151.5,158.45,18222467.0,"Nifty likely to trade in 18,400-18,900 range: Analysts","The weakness on Wall Street on Friday could weigh on Asian markets on Monday. Ashok Leyland, LIC Housing Finance, Voltas, Havells, Crompton, SBI Cards, Chola Finance, and Aditya Birla Capital are some of the stocks investors can buy for short-term trades, said analysts.",neutral,neutral,3.901639344262288,positive,0.0,neutral
2022-12-13 11:35:25.000,157.9,159.4,155.5,156.55,4781799.0,Aditya Birla Capital considering selling insurance brokerage unit,The publicly-traded company has held talks with potential buyers about a sale of Aditya Birla Insurance Brokers Ltd. as it failed to scale up the 19-year-old business,neutral,negative,-0.8549715009499647,neutral,-1.0184595798854197,negative
2022-12-13 15:03:33.000,157.1,157.55,155.3,155.5,2428569.0,Aditya Birla Capital Is Said To Weigh Selling Insurance Brokerage Unit,The sale is part of Aditya Birla Capital Chief Executive Officer Vishakha Mulye’s efforts to restructure the company’s businesses.,neutral,neutral,-1.0184595798854197,negative,-1.3539651837524145,negative
2022-12-13 17:30:00.000,157.1,157.55,155.3,155.5,2428569.0,"Aditya Birla Capital weighs selling its insurance brokerage unit, says report","Aditya Birla Insurance Brokers Ltd is one of India’s largest composite insurers, offering both life and non-life policies, yet the unit reported revenue of only Rs 595 crore in the year to March 31, 2021, its website shows",neutral,neutral,-1.0184595798854197,negative,-1.3539651837524145,negative
2022-12-13 21:12:12.000,157.1,157.55,155.3,155.5,2428569.0,Aditya Birla Capital may sell its insurance brokerage unit,Kumar Mangalam Birla-backed group seeks to rejig financial services business,neutral,positive,-1.0184595798854197,negative,-1.3539651837524145,negative
2022-12-19 15:25:22.000,154.55,155.35,150.7,153.25,2227745.0,Samara Capital looking to buy Aditya Birla Capital’s insurance broking arm: Report,Samara Capital is among the leading mid-market private equity companies in India as stated by the firm’s official website,neutral,neutral,-0.8411517308314533,neutral,-3.6593264248704696,negative
2022-12-20 19:50:16.000,154.4,155.5,147.65,148.75,4963207.0,Aditya Birla Capital allots 1 lakh equity shares under ESOS,Powered by Capital Market - Live News,neutral,neutral,-3.6593264248704696,negative,-1.304347826086949,negative
2022-12-21 14:51:00.000,149.5,150.9,145.75,147.55,3917892.0,Samara Capital planning to buy Aditya Birla Capital’s insurance broking arm: Report,"The deal is estimated to be worth between Rs 800 crore and Rs 1,000 crore, as per the report. If the deal goes through, it could become one of the biggest deals in the sector.",neutral,neutral,-1.304347826086949,negative,-1.6134569172674178,negative
2022-12-27 19:50:04.000,148.0,149.4,146.6,147.05,1950719.0,Aditya Birla Capital announces change in Chief Risk Officer,With effect from 01 April 2023,neutral,neutral,-0.6418918918918842,neutral,2.619047619047615,positive
2022-12-28 10:31:23.000,148.0,149.4,146.6,147.05,1950719.0,AB Capital appoints Sanchita Mustauphy as chief risk officer,"Aditya Birla Capital announced that its board has approved the appointment of Sanchita Mustauphy, as the chief risk officer (CRO) of the company for a period of five years.",neutral,neutral,-0.6418918918918842,neutral,2.619047619047615,positive
2023-02-02 05:00:00.000,135.75,140.5,134.9,139.0,2164881.0,"Titan, Aditya Birla Capital, Apollo Tyres, Tata Consumer, Dabur Q3 Results Today — Earnings Estimates","Titan, Aditya Birla Capital, Apollo Tyres, Tata Consumer and Dabur will announce their results today.",neutral,neutral,2.394106813996317,positive,-0.2112676056338108,neutral
2023-02-02 17:46:32.000,142.0,142.85,138.0,141.7,5363565.0,"Aditya Birla Capital’s Q3 net up 27% YoY as retail, SME lending grows",Aditya Birla Capital Q3 Results: Strong performance across businesses help 40% YoY growth in lending book,positive,positive,-0.2112676056338108,neutral,2.748414376321357,positive
2023-02-02 21:39:17.000,142.0,142.85,138.0,141.7,5363565.0,Aditya Birla Capital Q3 net profit rises 27% YoY to Rs 530 crore,"The company said 1.4 million customers were added during the quarter, while total active customer base as of December 31, 2022 stood at 43 million",positive,positive,-0.2112676056338108,neutral,2.748414376321357,positive
2023-03-03 12:32:05.000,153.0,155.5,152.5,154.5,4024467.0,"Aditya Birla Capital’s Q3 net up 27% YoY as retail, SME lending grows",Aditya Birla Capital Q3 Results: Strong performance across businesses help 40% YoY growth in lending book,positive,positive,0.9803921568627452,positive,0.643293663557414,neutral
2023-03-06 17:30:00.000,155.45,156.9,153.8,156.45,2889459.0,"AB Capital, VBL, Sonata Software & Oberoi Realty: Axis Securities sees up to 20% rise in these stocks",Aditya Birla Capital on the weekly chart has decisively broken out above the ‘falling channel’ at Rs 146 with a strong bullish candle indicating a positive bias.,positive,neutral,0.643293663557414,neutral,1.5730337078651613,positive
2023-03-06 19:16:10.000,155.45,156.9,153.8,156.45,2889459.0,Buy Aditya Birla Capital; target of Rs 200: Emkay Global Financial,"Emkay Global Financial is bullish on Aditya Birla Capital has recommended buy rating on the stock with a target price of Rs 200 in its research report dated March 06, 2023.",neutral,positive,0.643293663557414,neutral,1.5730337078651613,positive
2023-03-10 16:28:51.000,155.2,156.15,152.6,154.0,2706464.0,"Aditya Birla Capital announces allotment of 1,14,707 equity shares","Aditya Birla Capital Limited announced that the Stakeholders Relationship Committee of the Company has approved the allotment of 1,14,707 equity shares of the face value of ₹10 each on 10 March 2023 pursuant to exercise of Stock Options /Restricted Stock Units under ABCL Scheme 2017, via an exchange…",neutral,positive,-0.7731958762886525,neutral,-3.790849673202622,negative
2023-03-24 10:04:29.000,152.8,152.8,142.7,143.2,7276881.0,Aditya Birla Capital Ltd Slides 3.6%,Aditya Birla Capital Ltd has added 6.98% over last one month compared to 2% fall in S&P BSE Financial Services index and 3.37% drop in the SENSEX,neutral,positive,-6.28272251308902,negative,2.4747298710352124,positive
2023-03-24 14:58:09.000,152.8,152.8,142.7,143.2,7276881.0,Aditya Birla Capital incorporates distribution subsidiary,Aditya Birla Capital sets up distribution subsidiary,neutral,neutral,-6.28272251308902,negative,2.4747298710352124,positive
2023-03-27 20:12:55.000,146.5,149.1,143.6,147.95,8001671.0,Aditya Birla Capital To Sell Entire Stake In Insurance Brokerage Unit,"The entire stake sale will be executed at an enterprise value of Rs 455 crore, Aditya Birla Capital said in its statement.",neutral,neutral,0.989761092150163,positive,3.9661016949152503,positive
2023-03-27 23:34:45.000,146.5,149.1,143.6,147.95,8001671.0,Aditya Birla Capital to sell insurance broking business to Edme Services,Financial Services firm Aditya Birla Capital on Monday said it has decided to sell its entire stake in Aditya Birla Insurance Brokers Limited (ABIBL) to Edme Services for an undisclosed amount.,neutral,neutral,0.989761092150163,positive,3.9661016949152503,positive
2023-03-27 23:39:00.000,146.5,149.1,143.6,147.95,8001671.0,Samara Capital to buy Aditya Birla Insurance brokers for Rs 455 crore,"​​The proposed deal includes the sale of the entire 25,65,103 equity shares of Rs 10 each held by the company (along with its nominees), representing 50.002 per cent of the issued and paid-up share capital of ABIBL to Edme Services Private Limited, Aditya Birla Capital said in a regulatory filing.",neutral,neutral,0.989761092150163,positive,3.9661016949152503,positive
2023-03-28 06:24:27.000,146.5,149.1,143.6,147.95,8001671.0,"Stocks To Watch: Adani Enterprises, Aditya Birla Capital, NDTV, Nestle India, Allcargo, PNC Infratech",Stocks to watch before going into trade today.,neutral,neutral,0.989761092150163,positive,3.9661016949152503,positive
2023-04-04 21:51:00.000,153.8,156.45,152.8,155.5,3005074.0,"Grasim Industries gets Rs 5,000 cr term loan from Axis Bank","Grasim is a diversified player with a presence across sectors. It is a leading global producer of VSF, the largest Chlor-Alkali, Linen and Insulators player in India. Through its subsidiaries, UltraTech Cement and Aditya Birla Capital, it is also India’s largest cement producer and a leading diversi…",neutral,positive,1.1053315994798365,positive,1.4129736673089386,positive
2023-04-17 21:45:23.000,165.9,167.45,161.45,163.25,7369308.0,Trade setup for today: Top 15 things to know before the opening bell,"Based on the OI percentage, 79 stocks, including Nestle India, Havells India, Aditya Birla Capital, MCX India, and TVS Motor Company, saw long build-ups",neutral,neutral,-1.5973477998794487,negative,-1.8890920170627632,negative
2023-04-18 07:09:32.000,165.9,167.45,161.45,163.25,7369308.0,"Trade Spotlight | Your game plan for Nestle India, Aditya Birla Capital, Power Grid today","Nestle India was the third biggest gainer in the futures & options segment, rising 4 percent to Rs 20,244, the highest closing level since December 22 last year and formed long bullish candlestick pattern on the daily timeframe with strong volumes.",neutral,positive,-1.5973477998794487,negative,-1.8890920170627632,negative
2023-05-08 18:13:28.000,174.9,175.1,169.45,170.85,3075313.0,Aditya Birla Capital to consider raising of funds; board meeting on May 11,AB Capital to Raise Funds: The board of directors will also consider and approve the audited standalone and consolidated financial results of the company,neutral,neutral,-2.3156089193825107,negative,0.0584795321637393,neutral
2023-05-11 15:31:19.000,165.8,167.1,162.8,163.35,5849928.0,Aditya Birla Capital shares fall 4% despite sharp increase in Q4 profitability,"Aditya Birla Capital said the board of directors has approved fund raising up to Rs 3,000 crore via equity shares or debt.",negative,neutral,-1.477683956574196,negative,1.1259890444309155,positive
2023-05-11 15:55:46.000,165.8,167.1,162.8,163.35,5849928.0,Aditya Birla Capital Q4 results: Net profit rises 35% to Rs 609 crore,"Consolidated total revenue from operation rose by 21.2 per cent to Rs 8,025 crore for the March quarter as compared to Rs 6,617 crore in the year-ago period",positive,positive,-1.477683956574196,negative,1.1259890444309155,positive
2023-05-11 21:03:25.000,165.8,167.1,162.8,163.35,5849928.0,Aditya Birla Capital Q4 net profit rises 35% to Rs 609 crore,"During the quarter, the company’s total income rose to Rs 8,052 crore against Rs 6,620 crore a year ago, Aditya Birla Capital said in a regulatory filing.",positive,positive,-1.477683956574196,negative,1.1259890444309155,positive
2023-05-11 22:33:10.000,165.8,167.1,162.8,163.35,5849928.0,"Aditya Birla Capital Q4 net up 35%, to raise upto Rs 3,000 cr in equity",The fund raised through equity offering would be used for supporting growth in lending and insurance businesses,positive,neutral,-1.477683956574196,negative,1.1259890444309155,positive
2023-05-12 03:50:00.000,165.8,167.1,162.8,163.35,5849928.0,Aditya Birla Capital profit rises 35% | The Financial Express,"Aditya Birla Capital on Thursday posted a consolidated net profit of Rs 609 crore for Q4FY23, a rise of 35.3%, the company said in an exchange filing.",positive,positive,-1.477683956574196,negative,1.1259890444309155,positive
2023-05-12 10:06:00.000,165.8,167.1,162.8,163.35,5849928.0,"Aditya Birla Capital Q4 Results Review - NIM Expansion, Asset Quality Improvement For NBFC, HFC: Motilal Oswal",Operational metrics continue to improve.,neutral,positive,-1.477683956574196,negative,1.1259890444309155,positive
2023-05-14 00:32:50.000,164.3,166.7,160.55,166.15,3894398.0,Buy Aditya Birla Capital; target of Rs 190: Motilal Oswal,"Motilal Oswal is bullish on Aditya Birla Capital recommended buy rating on the stock with a target price of Rs 190 in its research report dated May 12, 2023.",neutral,positive,1.1259890444309155,positive,-0.6908981676178897,neutral
2023-05-16 09:35:29.000,166.45,170.3,164.6,165.3,4441485.0,Aditya Birla Capital: Strong business growth and improving profitability,"Impressive performance across lending segments, and improving insurance business; fresh capital infusion to further aid growth",positive,positive,-0.6908981676178897,neutral,-0.5748865355521868,neutral
