date,open,high,low,close,volume,title,description,title_sentiment,desc_sentiment,daily_change_pct,market_sentiment,next_day_change_pct,next_day_sentiment
2022-01-18 18:08:26.000,7850.0,8045.0,7473.0,7590.0,4975947.0,"Bajaj Finance reports stellar 85% growth in Q3 profits, plans fundraising","Bajaj Finance shares went up more than one percent on Tuesday, ahead of the quarterly earnings. The stock touched intraday high of Rs 7,944",positive,positive,-3.3121019108280256,negative,-0.985545335085414,negative
2022-01-18 18:14:00.000,7850.0,8045.0,7473.0,7590.0,4975947.0,"Bajaj Finance Q3 results: Net profit rises 85% to Rs 2,125 cr","Net interest income for Q3FY22 increased by 40% to Rs 6,000 cr",positive,positive,-3.3121019108280256,negative,-0.985545335085414,negative
2022-01-18 19:24:30.000,7850.0,8045.0,7473.0,7590.0,4975947.0,Bajaj Finance Q3 net up 84% on income growth,A 20% decline in loan loss provisions also boosts bottomline,positive,positive,-3.3121019108280256,negative,-0.985545335085414,negative
2022-01-18 20:31:42.000,7850.0,8045.0,7473.0,7590.0,4975947.0,Bajaj Finance Q3 Results: Net Profit Rises 84% On Higher Income,"Bajaj Finance’s consolidated net profit rose 84% year-on-year to Rs 2,125 crore in Q3.",neutral,positive,-3.3121019108280256,negative,-0.985545335085414,negative
2022-01-18 20:39:00.000,7850.0,8045.0,7473.0,7590.0,4975947.0,Bajaj Finance Q3 results: Net profit jumps 84% to Rs 1934 cr; asset quality improves,Bajaj Finance said its interest income rose 27.38 per cent year-on-year (YoY) to Rs 6335 crore from Rs 4973 crore in the same quarter a year ago.,positive,positive,-3.3121019108280256,negative,-0.985545335085414,negative
2022-01-18 20:48:05.000,7850.0,8045.0,7473.0,7590.0,4975947.0,"Bajaj Finance Q3 results: Net profit soars 84% YoY to Rs 1,934 cr","Bajaj Finance Q3 results: Net profit soars 84% YoY to Rs 1,934 cr",neutral,neutral,-3.3121019108280256,negative,-0.985545335085414,negative
2022-01-18 23:40:00.000,7850.0,8045.0,7473.0,7590.0,4975947.0,"Bajaj Finance consolidated net profit jumps 85% to Rs 2,125 crore in Q3",To infuse Rs 2.9k cr as equity in two subsidiaries,positive,neutral,-3.3121019108280256,negative,-0.985545335085414,negative
2022-01-19 02:15:00.000,7850.0,8045.0,7473.0,7590.0,4975947.0,Bajaj Finance reports highest-ever quarterly net profit in Q3,"Bajaj Finance on Tuesday reported an 85% year-on-year increase in its consolidated profit after tax at Rs 2,125 crore in the October-December quarter, which is its highest ever. The company also reported its highest ever quarterly core AUM growth of Rs 14,700 crore during the December quarter. Asset…",positive,positive,-3.3121019108280256,negative,-0.985545335085414,negative
2022-01-19 05:30:00.000,7850.0,8045.0,7473.0,7590.0,4975947.0,"Stocks in Focus on Jan 19: Bajaj Finance, Hero MotoCorp, L&T Infotech & More","Stocks in Focus on Jan 19: Bajaj Finance, Hero MotoCorp, L&T Infotech & More",neutral,neutral,-3.3121019108280256,negative,-0.985545335085414,negative
2022-01-19 08:07:54.000,7850.0,8045.0,7473.0,7590.0,4975947.0,Bajaj Finance Q3 Review - Robust Earnings Quarter: Prabhudas Lilladher,Bajaj Finance Q3 Review - Robust Earnings Quarter: Prabhudas Lilladher,neutral,neutral,-3.3121019108280256,negative,-0.985545335085414,negative
2022-01-19 08:15:00.000,7850.0,8045.0,7473.0,7590.0,4975947.0,"Bajaj Finance Q3 PAT surges 85% YoY to Rs 2,125 cr","Bajaj Finance posted an 85% jump in consolidated net profit to Rs 2,125.2 crore on a 28% increase in total income to Rs 8,535.06 crore in Q3 FY22 over Q3 FY21.",positive,positive,-3.3121019108280256,negative,-0.985545335085414,negative
2022-01-19 08:26:00.000,7850.0,8045.0,7473.0,7590.0,4975947.0,Bajaj Finance consolidated net profit rises 85.46% in the December 2021 quarter,Sales rise 24.54% to Rs 8238.03 crore,positive,positive,-3.3121019108280256,negative,-0.985545335085414,negative
2022-01-19 08:50:00.000,7850.0,8045.0,7473.0,7590.0,4975947.0,"Bajaj Finance, LTTS, Tata Elxsi in focus","Bajaj Finance: The NBFC major posted an 85% jump in consolidated net profit to Rs 2,125.2 crore on a 28% increase in total income to Rs 8,535.06 crore in Q3 FY22 over Q3 FY21.",neutral,positive,-3.3121019108280256,negative,-0.985545335085414,negative
2022-01-19 09:17:00.000,7850.0,8045.0,7473.0,7590.0,4975947.0,What foreign brokerages said on Bajaj Finance & 7 other stocks,CLSA has initiated coverage on L&T Technology Services with an ‘outperform’ rating while it maintained a ‘buy’ rating on ICICI Prudential Life. Credit Suisse stayed ‘neutral’ on Bajaj Finance following its Q3 numbers.,neutral,positive,-3.3121019108280256,negative,-0.985545335085414,negative
2022-01-19 09:25:14.000,7850.0,8045.0,7473.0,7590.0,4975947.0,Bajaj Finance shares surge as Q3 results beat estimates. What brokerages say,"Shares of Bajaj Finance surged over 1% to ₹7,857 per share on the BSE in Wednesday’s opening deals",positive,positive,-3.3121019108280256,negative,-0.985545335085414,negative
2022-01-19 10:05:00.000,7850.0,8045.0,7473.0,7590.0,4975947.0,"Bajaj Finance gains 4%, hits record high on strong December quarter results","The NBFC reported a strong 85 per cent YoY jump in consolidated net profit at Rs 2,125 crore, beating Street estimates.",positive,positive,-3.3121019108280256,negative,-0.985545335085414,negative
2022-01-19 10:18:51.000,7850.0,8045.0,7473.0,7590.0,4975947.0,Bajaj Finance Share Price Opens Higher On Strong Q3 Earnings,"Bajaj Finance reported a solid quarter with profit surging 84.4 percent year-on-year at Rs. 1,933.9 crore for the quarter ended December. Its net interest income in the quarter jumped 40 percent on-year to Rs. 5,553 crore with assets under management (AUM) rising 21 percent on-year to Rs. 1.3 lakh …",neutral,positive,-3.3121019108280256,negative,-0.985545335085414,negative
2022-01-19 10:24:00.000,7850.0,8045.0,7473.0,7590.0,4975947.0,"Reduce Bajaj Finance, target price Rs 5536: HDFC Securities","Bajaj Finance Ltd., incorporated in the year 1987, is a Large Cap company (having a market cap of Rs 467423.46 Crore) operating in NBFC sector.",neutral,neutral,-3.3121019108280256,negative,-0.985545335085414,negative
2022-01-19 10:40:00.000,7850.0,8045.0,7473.0,7590.0,4975947.0,Bajaj Finance scales new 52-week high as net profit jumps 86% in Q3,"Following the update, shares of Bajaj Finance jumped about 4 per cent to Rs 8,043.50, its new 52-week high, before giving up all the gains and trading a per cent lower at 7,655 at 10.25 am. The scrip settled at Rs 7,747.15 on Tuesday.",positive,positive,-3.3121019108280256,negative,-0.985545335085414,negative
2022-01-19 10:58:00.000,7850.0,8045.0,7473.0,7590.0,4975947.0,"Results Review For Bajaj Finance, ICICI Prudential Life, L&T Technology Services","Results Review For Bajaj Finance, ICICI Prudential Life, L&T Technology Services",neutral,neutral,-3.3121019108280256,negative,-0.985545335085414,negative
2022-01-19 12:09:14.000,7610.0,7650.0,7401.0,7535.0,2907135.0,Bajaj Finance shares up nearly 4% after post-earnings announcement,Bajaj Finance shares up nearly 4% after post-earnings announcement,positive,positive,-0.985545335085414,negative,-0.303951367781155,neutral
2022-01-19 12:55:00.000,7610.0,7650.0,7401.0,7535.0,2907135.0,"Top stocks in focus: Bajaj Finance, Bajaj Auto, ICICI Pru, L&T Technology Services, Tata Elxsi",Check out the stocks that will be in focus during trade today based on recent and latest news developments.,neutral,neutral,-0.985545335085414,negative,-0.303951367781155,neutral
2022-01-19 13:00:20.000,7610.0,7650.0,7401.0,7535.0,2907135.0,"Bajaj Finance Q3 profit rises 86% to Rs 2,125 crore","Total income increased to Rs 8,535.06 crore for the quarter under review from Rs 6,658.34 crore in the year-ago period, according to a regulatory filing.",positive,positive,-0.985545335085414,negative,-0.303951367781155,neutral
2022-01-19 13:17:39.000,7610.0,7650.0,7401.0,7535.0,2907135.0,Bajaj Finance - Strong Beat Driven By All-Round Healthy Business Momentum: Motilal Oswal,Bajaj Finance - Strong Beat Driven By All-Round Healthy Business Momentum: Motilal Oswal,neutral,neutral,-0.985545335085414,negative,-0.303951367781155,neutral
2022-01-19 17:30:00.000,7610.0,7650.0,7401.0,7535.0,2907135.0,"Stocks in news: Bajaj Finance, Reliance Industries, Bharti Airtel, Just Dial and more","Stocks in news: Just Dial, ICICI Prudential Life Insurance, Tata Elxsi, Bajaj Finance, L&T Tech, Reliance Industries, Bharti Airtel and more",neutral,neutral,-0.985545335085414,negative,-0.303951367781155,neutral
2022-01-19 17:30:00.000,7610.0,7650.0,7401.0,7535.0,2907135.0,"Bajaj Finance stock hits record high post Q3 earnings: Should you buy, sell or hold?","Bajaj Finance stock touched a record high of Rs 8,043.50, rising 3.82% on BSE. Market cap of the NBFC rose to Rs 4.79 lakh crore.",positive,positive,-0.985545335085414,negative,-0.303951367781155,neutral
2022-01-19 17:34:53.000,7610.0,7650.0,7401.0,7535.0,2907135.0,"Market Roundup: Sensex ends 656 points lower, Nifty below 18,000; today’s top winners and losers","The top gainers of BSE Sensex were SBI, Tata Steel, Maruti, Axis Bank and Tech Mahindra. The top laggards were Infosys, Asian Paints, Hindustan Unilever, Nestle India and Bajaj Finance",negative,neutral,-0.985545335085414,negative,-0.303951367781155,neutral
2022-01-19 17:53:00.000,7610.0,7650.0,7401.0,7535.0,2907135.0,Nifty Jan futures trade at premium,"Bajaj Finance, Adani Ports and Tata Steel were the top traded contracts.",neutral,neutral,-0.985545335085414,negative,-0.303951367781155,neutral
2022-01-19 17:53:08.000,7610.0,7650.0,7401.0,7535.0,2907135.0,Bajaj Finance shares give up early gains; settle over 2% lower,Bajaj Finance shares give up early gains; settle over 2% lower,neutral,neutral,-0.985545335085414,negative,-0.303951367781155,neutral
2022-01-19 18:04:00.000,7610.0,7650.0,7401.0,7535.0,2907135.0,"Market wrap: Sensex sheds 656 pts, Nifty below 18K amid weak global cues",Bajaj Finance hits new high on Q3 results; falls on profit-booking later; Paytm hits new low; declines 26% in three weeks; AGS Transact Technologies IPO subscribed 85% on day 1,negative,negative,-0.985545335085414,negative,-0.303951367781155,neutral
2022-01-19 18:37:01.000,7610.0,7650.0,7401.0,7535.0,2907135.0,Bajaj Finance Q3 Review - Strong Quarter; Stretched Valuations: Axis Securities,Bajaj Finance Q3 Review - Strong Quarter; Stretched Valuations: Axis Securities,neutral,neutral,-0.985545335085414,negative,-0.303951367781155,neutral
2022-01-19 19:16:00.000,7610.0,7650.0,7401.0,7535.0,2907135.0,Bajaj Finance shares give up entire early gains; settle over 2% lower,Bajaj Finance stock on Wednesday surrendered all its early gains and settled over 2 per cent lower on profit-taking.,neutral,negative,-0.985545335085414,negative,-0.303951367781155,neutral
2022-01-19 20:30:00.000,7610.0,7650.0,7401.0,7535.0,2907135.0,No sparks visible in Q3FY22 results of financial sector’s leaders,HDFC Bank’s quarterly show was in-line; Bajaj Finance was ahead on some metrics but low penetration of new app disappointed,neutral,positive,-0.985545335085414,negative,-0.303951367781155,neutral
2022-01-20 01:12:11.000,7610.0,7650.0,7401.0,7535.0,2907135.0,Bajaj Finance’s digital shift is a tipping point,"Bajaj Finance is on a journey of digital transformation, and investors are closely watching it.The company has delivered strong growth in Q3, with highest quarterly consolidated PAT",neutral,positive,-0.985545335085414,negative,-0.303951367781155,neutral
2022-01-20 09:33:00.000,7610.0,7650.0,7401.0,7535.0,2907135.0,There’s room for further upside in Bajaj Finance: Siddhartha Khemka,"“Overall, the numbers and the return ratios are the best in class. So ROAs are at about 4.3% to 4.6% and ROEs are in excess of 20%. Theres still room for further upside in Bajaj Finance. ”",positive,positive,-0.985545335085414,negative,-0.303951367781155,neutral
2022-01-20 13:47:00.000,7402.5,7499.0,7305.85,7380.0,1363264.0,Could Bajaj Finance be a quarantine stock for 2022?,"“If one is a long-term investor with a mindset of three to five years, the best returns are coming in the larger companies within the banking and NBFC space.”",neutral,positive,-0.303951367781155,neutral,-6.057823129251701,negative
2022-01-20 16:25:15.000,7402.5,7499.0,7305.85,7380.0,1363264.0,Buy Bajaj Finance; Target Of Rs 9500: ICICI Direct,"ICICI Direct is bullish on Bajaj Finance recommended buy rating on the stock with a target price of Rs 9500 in its research report dated January 19, 2022.",neutral,positive,-0.303951367781155,neutral,-6.057823129251701,negative
2022-01-20 18:01:00.000,7402.5,7499.0,7305.85,7380.0,1363264.0,Market movers: CLSA continues with ‘sell’ on Bajaj Fin; Jefferies grows bullish on Apollo Hospitals,"CLSA acknowledged that Bajaj Finance delivered a strong quarter, but “valuation seems disconnected” to them",positive,positive,-0.303951367781155,neutral,-6.057823129251701,negative
2022-01-21 11:48:49.000,7402.5,7499.0,7305.85,7380.0,1363264.0,Domestic Brokerages Bet On These 10 Largecaps For 13-32% Return,"HDFC, HCL Technologies, HUL, Asian Paints, Bajaj Auto, Bajaj Finance, Tech Mahindra, UltraTech Cement, Tata Consultancy Services and Infosys are among the ten largecap stocks brokerages bet on.",neutral,neutral,-0.303951367781155,neutral,-6.057823129251701,negative
2022-01-21 16:29:05.000,7402.5,7499.0,7305.85,7380.0,1363264.0,"Sensex tumbles 427 points; Nifty retains 17,600","Bajaj Finserv was the top laggard in the Sensex pack followed by Tech Mahindra, Tata Steel, Bharti Airtel, L&T, IndusInd Bank, Bajaj Finance and Infosys.",negative,neutral,-0.303951367781155,neutral,-6.057823129251701,negative
2022-01-21 16:29:05.000,7402.5,7499.0,7305.85,7380.0,1363264.0,"Sensex tumbles 427 points; Nifty retains 17,600","Bajaj Finserv was the top laggard in the Sensex pack followed by Tech Mahindra, Tata Steel, Bharti Airtel, L&T, IndusInd Bank, Bajaj Finance and Infosys.",negative,neutral,-0.303951367781155,neutral,-6.057823129251701,negative
2022-01-24 12:48:35.000,6900.0,6996.0,6752.2,6946.55,2518179.0,Bajaj Finance’s Super App Ambitions: Customers Will Have Over 30 Services On One App,Phase I of the digital transformation journey has gone live and in Phase II Bajaj Finance’s app will offer 72 features as compared to 52 currently.,neutral,neutral,0.6746376811594229,neutral,0.6799929655900058,neutral
2022-01-24 16:10:00.000,6900.0,6996.0,6752.2,6946.55,2518179.0,Stock market update: Stocks that hit 52-week lows on NSE in today’s trade,"JSW Steel, Tata Steel, Bajaj Finance, Grasim Inds. and Hindalco were among the top losers on NSE in today’s trade.",neutral,negative,0.6746376811594229,neutral,0.6799929655900058,neutral
2022-01-24 17:33:19.000,6900.0,6996.0,6752.2,6946.55,2518179.0,Buy Bajaj Finance; Target Of Rs 8953: Prabhudas Lilladher,"Prabhudas Lilladher is bullish on Bajaj Finance has recommended buy rating on the stock with a target price of Rs 8953 in its research report dated January 19, 2022.",neutral,positive,0.6746376811594229,neutral,0.6799929655900058,neutral
2022-01-24 17:33:58.000,6900.0,6996.0,6752.2,6946.55,2518179.0,Buy Bajaj Finance: Target Of Rs 9097: Sharekhan,"Sharekhan is bullish on Bajaj Finance has recommended buy rating on the stock with a target price of Rs 9097 in its research report dated January 18, 2022.",neutral,positive,0.6746376811594229,neutral,0.6799929655900058,neutral
2022-01-24 17:35:38.000,6900.0,6996.0,6752.2,6946.55,2518179.0,Buy Bajaj Finance; Target Of Rs 9080: Motilal Oswal,"Motilal Oswal is bullish on Bajaj Finance recommended buy rating on the stock with a target price of Rs 9080 in its research report dated January 19, 2022.",neutral,positive,0.6746376811594229,neutral,0.6799929655900058,neutral
2022-01-27 16:56:58.000,6961.05,7045.6,6845.0,6846.4,1463167.0,Stressed about exhausting your sum insured? Get multiple claims on your health insurance offered by Bajaj Finance Limited,"Given the uncertain predicament of our modern lives, investing in a health insurance policy is no longer optional but mandatory. Since a medical emergency can knock on your door without prior notice, you must always remain prepared to tackle such crises effectively.",neutral,neutral,-1.647021641850016,negative,0.3438444676857835,neutral
2022-01-30 17:30:00.000,6979.9,7075.9,6930.1,7003.9,1247137.0,Nine of top 10 most valued cos lose Rs 3 lakh cr in m-cap; RIL top drag,"Among the companies whose valuation got eroded included Reliance Industries Ltd. (RIL), Infosys, Tata Consultancy Services (TCS), Hindustan Unilever Ltd. (HUL), HDFC, HDFC Bank, ICICI Bank, Bharti Airtel, and Bajaj Finance.",neutral,neutral,0.3438444676857835,neutral,0.0155457256320802,neutral
2022-02-02 10:34:07.000,7100.0,7280.0,7095.0,7252.0,1337140.0,Sensex surges over 400 points in early trade,"PowerGrid was the top gainer in the Sensex pack, rising over 2 per cent, followed by ITC, Axis Bank, Kotak Bank, Bajaj Finance, IndusInd Bank and Bajaj Finserv.",positive,positive,2.140845070422535,positive,-2.040534951054736,negative
2022-02-02 10:56:57.000,7100.0,7280.0,7095.0,7252.0,1337140.0,"Sensex surges over 400 pts in opening session; Nifty breaches 17,650-level","PowerGrid was the top gainer in the Sensex pack, rising over 2 per cent, followed by ITC, Axis Bank, Kotak Bank, Bajaj Finance, IndusInd Bank and Bajaj Finserv.",positive,positive,2.140845070422535,positive,-2.040534951054736,negative
2022-02-02 15:38:17.000,7253.0,7287.05,7100.0,7105.0,836782.0,"Day after budget, Sensex rises 696 points to settle at 59,558; Nifty closes 203 points in green at 17,780","IndusInd Bank was the top gainer in the Sensex pack, spurting over 5 per cent, followed by Bajaj Finserv, HCL Tech, Bajaj Finance, Kotak Bank and Axis Bank.",positive,positive,-2.040534951054736,negative,0.8180535966149507,neutral
2022-02-03 09:55:00.000,7253.0,7287.05,7100.0,7105.0,836782.0,"Sensex, Nifty fall at open after 4 days of gap-up starts","Among Sensex names, Bajaj Finance declined 1.47 per cent to Rs 7,140. HDFC dropped 1.45 per cent to Rs 2,574. Infosys, Tech Mahindra, HCL Tech and Bajaj Finserv shed over 1 per cent each.",negative,neutral,-2.040534951054736,negative,0.8180535966149507,neutral
2022-02-03 18:05:41.000,7090.0,7188.4,7055.0,7148.0,820128.0,"Market Roundup: Sensex slumps 770 points, Nifty ends at 17,560; check top winners and losers here","The top gainers were ITC, Maruti, Titan, SBI and Asian Paints while the top losers were HDFC, Infosys, L&T, Bajaj Financial Services and Bajaj Finance",neutral,neutral,0.8180535966149507,neutral,-3.405443126308444,negative
2022-02-06 10:47:00.000,7165.0,7165.0,6881.0,6921.0,1180699.0,M-cap of eight of 10 most valued Indian firms jumps over Rs 1.51 trn,"In the ranking of top-10 firms, RIL remained the most valued firm followed by TCS, HDFC Bank, Infosys, ICICI Bank, HUL, SBI, HDFC, Bajaj Finance and Bharti Airtel.",positive,neutral,-3.405443126308444,negative,0.6142857142857142,neutral
2022-02-07 10:21:11.000,7165.0,7165.0,6881.0,6921.0,1180699.0,"Sensex falls 225 points in early trade; Nifty dips below 17,500","Bajaj Finance was top loser in the Sensex pack followed by HDFC Bank, Infosys, M&M, Asian Paints, Bharti Airtel, Dr Reddy’s, Maruti and HDFC.",neutral,negative,-3.405443126308444,negative,0.6142857142857142,neutral
2022-02-07 10:45:17.000,7165.0,7165.0,6881.0,6921.0,1180699.0,"Sensex falls 225 pts in early trade; Nifty dips below 17,500","Bajaj Finance was top loser in the Sensex pack, shedding nearly 2 per cent",neutral,negative,-3.405443126308444,negative,0.6142857142857142,neutral
2022-02-08 19:11:36.000,7128.55,7157.9,7070.0,7107.55,645868.0,"Market Roundup: Sensex rises 187 points, Nifty ends at 17,266; check top winners and losers","Top BSE gainers included Tata Steel, Bajaj Finance and Reliance. Top losers included Tech Mahindra and Kotak Bank",positive,neutral,-0.2945900638979877,neutral,0.0007007708479352,neutral
2022-02-09 09:58:00.000,7128.55,7157.9,7070.0,7107.55,645868.0,"Sensex surges 500 points, Nifty above 17,400 on strong global cues","Among Sensex names, Tech Mahindra advanced 1.94 per cent to Rs 1,460.60. HCL Tech gained 1.76 per cent to Rs 1,182.75. Bajaj Finserv, Maruti Suzuki, Wipro, Titan and HDFC Bank rose over 1 per cent each. IndusInd Bank, ICICI Bank, Bajaj Finance, Infosys and Axis Bank also gained over 1 per cent each.",positive,positive,-0.2945900638979877,neutral,0.0007007708479352,neutral
2022-02-11 09:26:00.000,7040.0,7079.95,6921.05,6995.0,1272572.0,"In opening session, Sensex slumps 611 points to 58,314; Nifty down 169 points at 17,437","Infosys was the top loser in the Sensex pack, shedding over 2 per cent, followed by Wipro, Tech Mahindra, HCL Tech, HDFC, Bajaj Finance, M&M and Bajaj Finserv.",negative,negative,-0.6392045454545455,neutral,-0.6828193832599119,neutral
2022-02-15 12:59:00.000,7185.0,7224.95,7050.0,7063.35,1050502.0,"Bajaj Finance pips HDFC in m-cap race, now 8th most valued stock",Shares of Bajaj Finance have rallied 20 per cent in the last one year compared with an 8 per cent drop in HDFC shares. The BSE Sensex is up 10 per cent during the same period.,positive,positive,-1.6931106471816233,negative,-0.9129213483146068,negative
2022-02-15 13:51:31.000,7185.0,7224.95,7050.0,7063.35,1050502.0,Bajaj Finance briefly snatches NBFC crown from Housing Development Finance Corp as market value rises,This comes as shares of HDFC have been in a downward spiral for some time trading near their 52-week low,positive,negative,-1.6931106471816233,negative,-0.9129213483146068,negative
2022-02-15 14:14:00.000,7185.0,7224.95,7050.0,7063.35,1050502.0,50% return in next 1 year? Deven Choksey has 2 stocks in mind,“We remain extremely convinced of the growth in ICICI Bank and Bajaj Finance. Both these companies have demonstrated their ability to acquire the technology stake in a systematic manner for producing a sustainable growth. Both of them remain in the top list as far as we are concerned in buying into …,neutral,positive,-1.6931106471816233,negative,-0.9129213483146068,negative
2022-02-16 00:59:00.000,7185.0,7224.95,7050.0,7063.35,1050502.0,"Bajaj Finance pips HDFC in m-cap race, now eighth-most valued stock",Bajaj Finance on Tuesday beat mortgage lender HDFC in terms of market capitalisation (m-cap) to become the eighth-most valued stock on the BSE,positive,positive,-1.6931106471816233,negative,-0.9129213483146068,negative
2022-02-16 14:40:00.000,7120.0,7128.0,6982.0,7055.0,901432.0,Why is HDFC Bank & Bajaj Finance divergent in a bull market? Hemang Jani answers,"“When the performance of HDFC Bank is compared with ICICI Bank and Axis Bank, we find that the growth that ICICI Bank has displayed in the last six quarters is way higher than HDFC Bank with much lower valuations. So part of the underperformance is coming because of that. Even if Bajaj Finance repo…",positive,negative,-0.9129213483146068,negative,0.0,neutral
2022-02-18 19:12:59.000,7020.0,7116.0,7010.0,7020.0,759375.0,"Market Roundup: Sensex falls 59 points, Nifty ends at 17,276; today’s top winners and losers","Top BSE gainers include HDFC Bank and Axis Bank. Top losers include UltraTech Cement, Infosys and Bajaj Finance",neutral,neutral,0.0,neutral,0.1428571428571428,neutral
2022-02-20 11:22:00.000,7000.0,7080.9,6911.0,7010.0,814943.0,"Five of top-10 cos add Rs 86,000 cr in m-cap; TCS biggest gainer","In the ranking of top-10 firms, RIL retained its number one position, followed by TCS, HDFC Bank, Infosys, HUL, ICICI Bank, SBI, HDFC, Bajaj Finance and Bharti Airtel.",positive,neutral,0.1428571428571428,neutral,3.1029411764705883,positive
2022-02-24 16:32:42.000,6800.0,6989.95,6759.0,6968.8,1405323.0,"Sensex tanks over 2,700 pts in line with global impact as Russia invades Ukraine","On the Sensex chart, all 30 shares suffered heavy losses, with IndusInd Bank, M&M and Bajaj Finance shedding as much as 8 per cent.",positive,negative,2.4823529411764733,positive,1.8950437317784257,positive
2022-02-25 09:26:00.000,6800.0,6989.95,6759.0,6968.8,1405323.0,"Sell Bajaj Finance, target price Rs 6430: Kotak Securities","Bajaj Finance Ltd., incorporated in the year 1987, is a Large Cap company (having a market cap of Rs 400050.26 Crore) operating in NBFC sector.",neutral,neutral,2.4823529411764733,positive,1.8950437317784257,positive
2022-02-25 10:21:21.000,6800.0,6989.95,6759.0,6968.8,1405323.0,"Sensex, Nifty rebound 2 per cent tracking recovery in Asian markets","On the Sensex pack, IndusInd Bank, Tata Steel, Bajaj Finance, Bajaj FinServ and SBI emerged as top gainers",positive,positive,2.4823529411764733,positive,1.8950437317784257,positive
2022-03-07 13:39:00.000,6128.0,6217.35,5912.9,6176.1,2879588.0,"As Bajaj Finance continues sinking, Jefferies finds it perfectly priced",The stock is a proven multibagger and has delivered 6 fold returns in the last five years.,positive,positive,0.7849216710182827,neutral,4.268831899670392,positive
2022-03-08 16:58:51.000,6219.5,6525.0,6121.85,6485.0,2274271.0,Broker’s call: Bajaj Finance (Buy),JM Financial,neutral,neutral,4.268831899670392,positive,-3.1468943185163405,negative
2022-03-08 23:19:33.000,6219.5,6525.0,6121.85,6485.0,2274271.0,All eyes are on Bajaj Finance’s digital goals,Bajaj Finance’s new digital platform will aid growth as it channelizes efforts to expand reach.The company can capitalize on its strengths in the offline channel of being a key financier,neutral,positive,4.268831899670392,positive,-3.1468943185163405,negative
2022-03-11 09:26:51.000,6550.0,6685.0,6490.05,6615.0,1261547.0,"Day after election results, markets open in red; Sensex, Nifty down 414 and 124 points","In the Sensex pack, Tata Steel, Axis Bank, Bajaj Finance, Sun Pharma and Bajaj Finserv were among the gainers, while Maruti Suzuki India, Nestle, Infosys, Wipro among others were trading lower.",neutral,positive,0.9923664122137404,positive,1.0452961672473868,positive
