date,open,high,low,close,volume,title,description,title_sentiment,desc_sentiment,daily_change_pct,market_sentiment,next_day_change_pct,next_day_sentiment
2017-12-26 13:02:23.571,1797.2,1797.6,1762.0,1768.9,449307.0,"Buy Bajaj Finance, Voltas and V-Guard Industries, says Prabhudas Lilladher","Few trading ideas by Vaishali Parekh, Research Analyst - Technical Research at Prabhudas Lilladher",neutral,neutral,-1.5746717115512996,negative,-1.741573033707865,negative
2018-01-16 13:01:23.343,1695.1,1706.85,1665.7,1701.2,1197506.0,Bajaj Finance to acquire 12.6% stake in Mobikwik,"Last year, Bajaj Finance had entered into a subscription agreement with One MobiKwik Systems to acquire 10.83 per cent stake for about Rs 225 crore",neutral,positive,0.3598607751755139,neutral,-3.3206775700934528,negative
2018-01-16 18:02:55.863,1695.1,1706.85,1665.7,1701.2,1197506.0,Bajaj Finance to acquire 12.6% in Mobikwik,Bajaj Finance on Tuesday said it will acquire 12.60% stake in mobile wallet company Mobikwik,neutral,neutral,0.3598607751755139,neutral,-3.3206775700934528,negative
2018-02-02 18:01:18.611,1708.05,1708.9,1620.2,1633.0,1643243.0,Company is well-positioned to manage rise in G-sec yields: Bajaj Finance,"In an interview with CNBC-TV18, Rajeev Jain, MD of Bajaj Finance spoke about the company's Q3 performance and his outlook for the company.",positive,neutral,-4.3938994760106524,negative,0.9375,positive
2018-02-05 13:01:40.608,1530.0,1683.35,1511.55,1666.0,2101714.0,"NBFCs are an interesting story, have an edge over banks: Dipan Mehta, Member, BSE & NSE","""A few NBFCs like say Capital First or Bajaj Finance, Chola Mandalam Finance and Shriram Transport certainly make it to our shopping list.""",neutral,neutral,8.88888888888889,positive,-2.9166666666666665,negative
2018-02-15 13:02:09.063,1690.0,1703.5,1671.55,1673.0,946979.0,"Buy Reliance Industries, Ceat, Bajaj Finance: Ashwani Gujral","Ashwani Gujral of ashwanigujral.com recommends buying Reliance Industries, Ceat and Bajaj Finance.",neutral,neutral,-1.0059171597633136,negative,-1.78805970149254,negative
2018-02-15 13:02:41.791,1690.0,1703.5,1671.55,1673.0,946979.0,"Buy smartphone, TV, refrigerator - start paying EMIs after two months","NBFCs (Non-Banking Financial Companies) like Bajaj Finance, Capital First and Home Credit India are coming up with such schemes where consumers will be able to buy products, and pay through EMIs, which will start two-three months later once you buy a prod",neutral,neutral,-1.0059171597633136,negative,-1.78805970149254,negative
2018-02-23 13:02:22.986,1606.8,1638.0,1602.35,1630.0,710833.0,Expect home insurance to be the next big product in general insurance: Bajaj Finserv,"Bajaj Finserv is set to follow in the footsteps of Bajaj Finance and be included in the Nifty. In an interview to CNBC-TV18, Sanjiv Bajaj, MD of Bajaj Finserv spoke about the latest happenings in the company and the sector.",neutral,neutral,1.4438635797859127,positive,2.073170731707317,positive
2018-03-15 18:02:00.009,1712.0,1724.35,1681.05,1692.0,999518.0,"Low operating expense, high yields to help NBFCs' grow their rural books",Bajaj Finance Limited increased their urban outlet network by 40.3% to 529 stores at the end of December 2017,neutral,positive,-1.1682242990654206,negative,-4.026134557654959,negative
2018-03-27 13:02:32.394,1776.0,1793.0,1760.8,1772.8,985041.0,"Add LIC Housing Finance, Bajaj Finance & DHFL: Sanjiv Bhasin","In an interview to CNBC-TV18, Sanjiv Bhasin, Executive VP-Markets & Corporate Affairs at IIFL shared his readings and outlook on the market, specific stocks and sectors.",neutral,neutral,-0.1801801801801827,neutral,2.974744335838175,positive
2018-03-28 13:02:23.292,1776.0,1793.0,1760.8,1772.8,985041.0,"Intraday dip towards 10,100 is a buying opportunity; Bajaj Finance a good short term bet","“Nifty is likely to get into consolidation in the price range of 10,080 to 10,230.” says Jaydeb Dey, Technical Analyst at Stewart & Mackertich Wealth Management Ltd.",positive,positive,-0.1801801801801827,neutral,2.974744335838175,positive
2018-04-04 13:01:05.536,1866.0,1922.1,1869.0,1914.0,1384086.0,Bajaj Finance hits over 5-month high,"April 4 Shares of Bajaj Finance hit over 5-month high, and technicals suggested further upside. The stock jumped as much as 1.3 per cent to Rs 1,858, its highest since October 19, 2017.Bajaj Financi s",positive,positive,2.572347266881029,positive,0.8858780614903595,neutral
2018-04-22 18:00:54.009,1880.0,1919.75,1860.8,1899.0,760622.0,Bajaj Finance tests a key resistance,"Breaking the ₹1,950 barrier can strengthen the uptrend and take the stock to new highs",neutral,positive,1.0106382978723405,positive,0.9433962264150944,positive
2018-05-15 13:00:29.442,1892.5,1929.0,1872.9,1929.0,952591.0,"Top intraday trading ideas for afternoon trade for Tuesday, 15 May 2018","Bajaj Finance is a 'Buy' call with a target price of Rs 2,000 and a stop loss of Rs 1,880.",neutral,neutral,1.9286657859973584,positive,7.202072538860104,positive
2018-05-16 23:01:50.125,1930.0,2087.8,1906.1,2069.0,5577108.0,"Bajaj Fin, Escorts, Central Bank results","Over 50 companies will declare their quarter/annual results on Thursday. These include Alembic, Adlabs Entertainment, Bajaj Finserv, Bajaj Finance, Bombay Burmah, Bliss GVS, Central Bank, Coffee Day,",neutral,neutral,7.202072538860104,positive,3.3431566742354613,positive
2018-05-17 18:01:49.697,2069.9,2171.75,2065.65,2139.1,8302498.0,Bajaj Finance Q4 profit jumps 61% to Rs721 crore,"On consolidated basis, Bajaj Finance’s net profit grew by 46% to Rs2,674 crore in 2017-18 from Rs1,836 crore in the previous fiscal",positive,positive,3.3431566742354613,positive,-0.4752941176470546,neutral
2018-05-18 10:00:19.484,2069.9,2171.75,2065.65,2139.1,8302498.0,Bajaj Finance Q4: Consumer business nets another stellar quarter,Bajaj Finance reported a 60% surge in its net profit for Q4 beating Street estimates by a mile and even bucking a seasonally expected slower final quarter,positive,positive,3.3431566742354613,positive,-0.4752941176470546,neutral
2018-05-18 13:01:08.570,2069.9,2171.75,2065.65,2139.1,8302498.0,Motilal Oswal Sec says consumption has been highlight of Q4 earnings; likes Bajaj Finance,"Rajat Rajgarhia, MD—Institutional Equities at Motilal Oswal Securities, advises investors to look at NBFCs due to improvement in credit growth",neutral,positive,3.3431566742354613,positive,-0.4752941176470546,neutral
2018-05-18 18:02:39.793,2069.9,2171.75,2065.65,2139.1,8302498.0,"Bajaj Finance's surge in 2 days pushes m-cap beyond Sun Pharma, IndusInd Bank","Bajaj Finance saw its market capitalisation soaring to Rs 1,23,124.97 crore, followed by IndusInd Bank and Sun Pharma at Rs 1,15,939.95 and Rs 1,12,045 crore.",positive,positive,3.3431566742354613,positive,-0.4752941176470546,neutral
2018-05-18 23:02:08.905,2069.9,2171.75,2065.65,2139.1,8302498.0,"Bajaj Finance, RCom, Voltas most active stocks in value terms","Bajaj Finance, Tech Mahindra, Bajaj Finserv were the top gainers in the Nifty pack of stocks.",neutral,positive,3.3431566742354613,positive,-0.4752941176470546,neutral
2018-05-21 23:00:16.881,2111.0,2177.9,2110.0,2146.0,1961873.0,Accumulate Bajaj Finance; target of Rs 2346: KR Choksey,"KR Choksey recommended accumulate rating on Bajaj Finance with a target price of Rs 2346 in its research report dated May 18, 2018.",neutral,positive,1.6579819990525817,positive,-3.1727188081936726,negative
2018-05-22 13:01:49.565,2148.0,2148.0,2066.2,2079.85,1442983.0,"Bajaj Finance, Bajaj Finserv hit record highs in a flat market","Bajaj Finance hit a new high of Rs 2,177, surging 19% in past eight trading sessions, as compared to 2.2% decline in Sensex since May 10, 2018",positive,positive,-3.1727188081936726,negative,0.644237652111668,neutral
2018-05-22 18:00:16.364,2148.0,2148.0,2066.2,2079.85,1442983.0,"Bajaj Finserv, Bajaj Finance hit 52-week highs on NSE","Bajaj Finserv and Bajaj Finance, both, have reported decent numbers for the March quarter of last fiscal.",positive,positive,-3.1727188081936726,negative,0.644237652111668,neutral
2018-05-23 13:00:38.433,2095.5,2109.8,2068.0,2109.0,839497.0,"SBI may be in demand, but tread with caution: Rahul Shah, Motilal Oswal","""One can expect  another 10-15% more upside in Bajaj Finance stock.""",neutral,positive,0.644237652111668,neutral,0.6644518272425249,neutral
2018-05-25 10:03:01.889,2107.0,2151.9,2103.5,2121.0,1341236.0,"Fazed by selloff, investors seek comfort in Bajaj Finance","The nervous mood among investors is because of concerns over surging oil prices, weakening rupee and rising bond yields.",positive,negative,0.6644518272425249,neutral,-1.3952941176470632,negative
2018-06-05 23:00:54.699,2122.0,2172.9,2107.0,2168.25,1801918.0,Bajaj Finance raises fixed deposit rates by 30 bps,"The rate for existing customers has been increased to 8.65 per cent from 8.35 per cent for deposits maturing in 36-60 months, the company said in press release today.",positive,positive,2.179547596606975,positive,-0.2302025782688766,neutral
2018-06-06 10:01:23.664,2122.0,2172.9,2107.0,2168.25,1801918.0,Bajaj Finance raises fixed deposit rates by 30 bps,"The rate for existing customers has been increased to 8.65 per cent from 8.35 per cent for deposits maturing in 36-60 months, the company said in press release today.",positive,positive,2.179547596606975,positive,-0.2302025782688766,neutral
2018-06-06 13:01:28.565,2172.0,2197.2,2160.15,2167.0,1486786.0,Elecon Engineering up nearly 8% after Bajaj Finance acquires additional stake in Co,Bajaj Finance has acquired additional 3.64 percent stake in the company stake in the company via encumbrance.,positive,neutral,-0.2302025782688766,neutral,2.083237101020828,positive
2018-06-07 10:00:19.873,2172.0,2197.2,2160.15,2167.0,1486786.0,Bajaj Finance shares hit new high; Infosys nears record high,"Bajaj Finance hit a new high of Rs 2,190, up 1.6% on the BSE, while Infosys touched a fresh 52-week high of Rs 1,257, up 1.7%, trading close to its all-time high of Rs 1,278 hit on June 3, 2016.",positive,positive,-0.2302025782688766,neutral,2.083237101020828,positive
2018-06-12 13:02:13.385,2270.0,2271.6,2225.7,2233.2,1091895.0,"Jyothy Labs, TAKE Solutions, Tata Elxsi hit new high","Bajaj Finance, United Breweries, VIP Industries, Astec Lifesciences and MM Forgings were eight stocks from the S&P BSE 500 and Smallcap index hitting their respective new highs on the BSE",positive,positive,-1.6211453744493471,negative,0.7472035794183364,neutral
2018-06-15 13:00:16.730,2250.0,2291.55,2231.1,2279.0,1635450.0,"Reliance Industries, Bajaj Finance, Jubilant FoodWorks hit new highs","United Breweries, Page Industries and Sundram Fasteners from the S&P BSE500 index hitting their respective new highs on the BSE in intra-day trade in otherwise subdued market.",positive,positive,1.288888888888889,positive,-1.423855633802813,negative
2018-06-20 18:01:03.475,2277.0,2288.0,2250.1,2257.2,716446.0,Bajaj Finance hits record high; technicals suggest more upside,"Shares of Bajaj Finance hit a record high, and technicals suggested more upside. The country’s largest consumer finance company by market-cap rose as much as 1.39 per cent to a record high of Rs 2,302",positive,positive,-0.8695652173913123,neutral,3.308337009263344,positive
2018-06-22 18:01:14.703,2267.0,2342.0,2250.55,2342.0,1711731.0,Bajaj Finance surpasses Axis Bank in market-cap ranking,"At 02:37 pm; with market-cap of Rs 1,345.85 billion, Bajaj Finance, the non-banking finance company, overtook the Axis Bank, which has market-cap of Rs 1,340.18 billion, the BSE data shows",positive,positive,3.308337009263344,positive,1.8509820666097312,positive
2018-06-22 23:01:16.490,2267.0,2342.0,2250.55,2342.0,1711731.0,Bajaj Finance surpasses Axis Bank in m-cap ranking,"At the end of session on Friday, market valuation of Bajaj Finance stood at Rs1,34,952.29 crore, which was Rs227.16 crore more than that of Axis Bank’s Rs 1,34,725.13 crore m-cap",positive,positive,3.308337009263344,positive,1.8509820666097312,positive
2018-06-25 10:01:18.123,2342.0,2399.0,2334.0,2385.35,2389839.0,Stock market prediction for June 25-29: Satish Gupta,"According to Satish Gupta of astrostocktips, Bajaj Finance, Shriram Transport, Cholamandalam Investment, LKP Finance and M&M Financial will get astrological support.",neutral,neutral,1.8509820666097312,positive,-0.7547169811320755,neutral
2018-06-27 18:02:22.425,2337.0,2348.0,2253.8,2290.0,1710989.0,Bajaj Finance is runaway leader in the great finance war being fought in India's malls,"NBFCs have the early-movers advantage here, and India's big banks will have to try real hard to have any chance of making it an even fight.",positive,neutral,-2.011125374411639,negative,0.740545988344073,neutral
2018-07-04 10:02:35.160,2333.0,2345.0,2306.55,2326.3,915183.0,"Multibaggers and football world cup winners have a similarity, they are inconsistent!","For the current bull phase, stocks which gave over 100 percent return include names like Bajaj Finance, Bajaj Finserv, Vedanta, Titan Company, and Maruti Suzuki.",neutral,neutral,-0.2871838834119082,neutral,-0.4275331338178709,neutral
2018-07-09 10:02:20.927,2359.0,2363.2,2337.0,2344.45,550803.0,"From RIL, TCS to Jubilant FoodWorks, here are 10 cool stocks to consider","While this all-under-one roof financial services player draws over 60 per cent of its strength from Bajaj Finance, its insurance arms too offer promise",neutral,positive,-0.6167867740568114,neutral,0.2542372881355932,neutral
2018-07-13 13:00:37.410,2433.85,2475.0,2422.2,2474.0,1386038.0,"Bajaj Finance, Bajaj Finserv, Cholamandalam Investment to get astrological support: Satish Gupta","Bajaj Finance, Bajaj Finserv, Cholamandalam Investment and Shriram Transport Finance will get astrological support, says Satish Gupta of astrostocktips.",neutral,positive,1.6496497319062429,positive,-0.1616161616161616,neutral
2018-07-13 13:02:22.268,2433.85,2475.0,2422.2,2474.0,1386038.0,"D-Street Buzz: Nifty PSU bank underperforms with IDBI Bank down 6%; RIL hits new record high, Wipro gains 2%","Bajaj Finserv, Bajaj Finance, Britannia Industries, HDFC Bank, Hindustan Unilever, Kotak Mahindra Bank, Mphasis and Reliance Industries are some of the very few stocks that hit fresh 52-week high in the morning trade.",negative,neutral,1.6496497319062429,positive,-0.1616161616161616,neutral
2018-07-13 18:00:58.385,2433.85,2475.0,2422.2,2474.0,1386038.0,Bajaj Finance hits new high; stock rises 32% in two months since Q4 results,"Bajaj Finance hit a new high of Rs 2,460 on the BSE, rising by 2% today and extending their 2.5% gain on Thursday, on expectations of healthy financial performance in Q1FY19.",positive,positive,1.6496497319062429,positive,-0.1616161616161616,neutral
2018-07-16 10:00:30.347,2475.0,2499.4,2460.0,2471.0,1168821.0,Stock market prediction for July 16-20: Satish Gupta,"According to Satish Gupta of astrostocktips, Bajaj Finance, Shriram Transport, Cholamandalam Investment, Bajaj Finserv and M&M Financial will get astrological support.",neutral,neutral,-0.1616161616161616,neutral,0.0,neutral
2018-07-17 18:01:44.476,2478.2,2523.05,2471.35,2493.65,1402616.0,"There are stocks where it is easier to make 15-20% on shorts: Samir Arora, Helios Capital","But Helios Capital founder is sure he will never short stocks like Lever, Bajaj Finance, Britannia",neutral,neutral,0.6234363651037154,neutral,0.4033707416430332,neutral
2018-07-18 18:00:13.291,2503.9,2537.0,2357.5,2514.0,4882713.0,"Prasanth Prabhakaran on Ultratech, Zee, Bajaj Finance and OMCs","“It is very difficult to read and track commodity stocks for a pure retail investor.”
",neutral,neutral,0.4033707416430332,neutral,7.971043236810782,positive
2018-07-18 23:00:34.354,2503.9,2537.0,2357.5,2514.0,4882713.0,"Kotak Bank, Bajaj Finserv, ABB results","Thursday will see a host of most actively tracked companies declaring their results for the period ended June 2018. Among these are 21st Century, AB Money, ABB, Bajaj Finserv, Bajaj Finance, Bharat Im",neutral,neutral,0.4033707416430332,neutral,7.971043236810782,positive
2018-07-19 10:02:31.886,2503.9,2537.0,2357.5,2514.0,4882713.0,"Stocks To Watch: Bajaj Finance, DFM Foods, JK Tyre, Kotak Mahindra Bank, RBL Bank",Here are the stocks to watch out for in today’s trade.,neutral,neutral,0.4033707416430332,neutral,7.971043236810782,positive
2018-07-20 10:01:00.106,2521.0,2745.0,2486.85,2721.95,7357342.0,Bajaj Finance does well in Q1 even as competition hots up,"Given that most banks have upped their ante in acquiring retail customers, Bajaj Finance perhaps found it tougher than before to grab more customers",positive,positive,7.971043236810782,positive,1.180147058823526,positive
2018-07-20 13:00:11.708,2521.0,2745.0,2486.85,2721.95,7357342.0,Bajaj group financial firms hit record high,"Shares of non-banking financial firm Bajaj Finserv and unit Bajaj Finance Ltd climb 5.7 per cent and 6.7 per cent, respectively to all-time highs.Kotak Institutional Equities has raised the price targ",positive,positive,7.971043236810782,positive,1.180147058823526,positive
2018-07-20 18:00:14.500,2521.0,2745.0,2486.85,2721.95,7357342.0,"RIL, Bandhan Bank, Jubilant FoodWorks hit new high","Bajaj Finance, Bajaj Finserv, HEG and 3M India have hit their respective all-time highs on the BSE in intra-day trade on Friday.",positive,positive,7.971043236810782,positive,1.180147058823526,positive
2018-07-23 10:01:44.352,2720.0,2797.0,2717.0,2752.1,3544377.0,"Sun Pharma, Cipla, Bajaj Finance, Nestle to get astrological support this week: Satish Gupta","Sun Pharma, Cipla, Ajanta Pharma, Bajaj Finance, Shriram Transport and Nestle will get astrological support, says Satish Gupta of astrostocktips.",neutral,positive,1.180147058823526,positive,-1.23135685703892,negative
2018-07-23 13:01:15.858,2749.0,2758.0,2687.25,2715.15,2774646.0,"Asian Paints, Havells India, Bata India, Bajaj Finance, HEG hit new high","Bajaj Finserv, Berger Paints, Graphite India, Relaxo Footwear and Procter & Gamble Hygiene & Healthcare from the S&P BSE 500 index hit record highs on Monday.",neutral,positive,-1.23135685703892,negative,-1.0964429776310998,negative
2018-07-23 18:00:21.590,2749.0,2758.0,2687.25,2715.15,2774646.0,"D-street Buzz: Market off day's high as Hero MotoCorp, Bajaj Auto, TVS Motor drag auto index over 1%","Dewan Housing, Just Dial, PC Jeweller, UPL and Bajaj Finance are the most active shares on BSE.",neutral,neutral,-1.23135685703892,negative,-1.0964429776310998,negative
2018-07-24 13:02:17.287,2727.0,2778.3,2692.0,2697.1,1880979.0,"D-street Buzz: 120 stocks hits 52-week low; L&T Infotech up 5%, Vedanta gains 2%","Kotak Mahindra Bank, HUL, TCS, NTPC, Yes Bank, Cipla, Bajaj Finance and Bajaj Finserv are the top losers on the indices.",positive,negative,-1.0964429776310998,negative,0.109461966604817,neutral
2018-07-26 13:01:01.476,2685.0,2724.5,2667.05,2719.0,951524.0,"Private financials, IT, FMCG, Reliance lead Nifty 50 to record high","Bajaj Finance and Bajaj Finserv have rallied 58% and 43%, respectively, while Asian Paints and TCS were surged more than 20% since January 29, 2018.",positive,positive,1.266294227188082,positive,-1.5263942847673684,negative
2018-08-06 18:00:59.724,2705.0,2754.5,2682.0,2752.8,1165170.0,"Check out insider trading transaction for Aug 2; YES Bank, ITC, Bajaj Finance in focus","Uday D.Tare sold 2,000 shares of RBL Bank through market sale on August 2, 2018 while Upendra Marathe sold 7,200 shares of Bajaj Finance through market sale on August 2, 2018 and Mayank Agrawal sold 5,000 shares of ICICI Bank through market sale on August 1, 2018.",neutral,neutral,1.7670979667282878,positive,1.9889663182346176,positive
2018-08-08 13:02:00.211,2824.0,2846.05,2800.0,2825.45,1143655.0,"Bajaj Finance, Bajaj Finserv, Shriram Transport to get astrological support: Satish Gupta","Bajaj Finance, Bajaj Finserv, Cholamandalam Investment and Shriram Transport will get astrological support, says Satish Gupta of astrostocktips.",neutral,positive,0.0513456090651493,neutral,-0.0355113636363636,neutral
2018-08-08 13:02:02.956,2824.0,2846.05,2800.0,2825.45,1143655.0,D-Street Buzz: Media stocks gain with INOX Leisure up 5%; Bajaj Finance hits new 52-week high,"The breadth of the market favoured advances, with 872 stocks advancing, 739 declining and 451 remaining unchanged. On BSE, 1095 stocks advanced, 875 declined and 85 remained unchanged.",positive,positive,0.0513456090651493,neutral,-0.0355113636363636,neutral
2018-08-09 13:00:54.629,2816.0,2837.4,2791.25,2815.0,876149.0,"MACD shows Bajaj Finance, Bajaj Holdings & Investment among 15 stocks ready to rally","The MACD is known for signalling trend reversal in a traded security or index.
",positive,negative,-0.0355113636363636,neutral,-1.7557292686835495,negative
2018-08-09 13:02:07.863,2816.0,2837.4,2791.25,2815.0,876149.0,"D-Street Buzz: Pharma, PSU Bank stocks gain; Selan Exploration hits 52-week high","Bajaj Finance, IPCA Laboratories, Torrent Pharmaceuticals, Info Edge, Nelco, Selan Exploration, VIP Industries are some of the stocks which have hit new 52-week high in the morning trade on NSE.",positive,neutral,-0.0355113636363636,neutral,-1.7557292686835495,negative
2018-08-09 18:02:23.096,2816.0,2837.4,2791.25,2815.0,876149.0,"D-Street Buzz: BoB, Union Bank spike 5% as Nifty PSU bank outshines; RIL hits record high","Bajaj Finance, Exide Industries, Reliance Industries, Page Industries, Havells India, HOEC, IPCA Labs, Info Edge, NELCO, Nestle India, Selan Exploration and VIP Industries are some of the stocks which have hit new 52-week high in the afternoon trade on NSE.",neutral,neutral,-0.0355113636363636,neutral,-1.7557292686835495,negative
2018-08-14 23:00:26.913,2763.3,2837.5,2763.3,2830.2,1050503.0,"Reverse Pitch: Insurance, savings and investments are major opportunities, says Deepak Gupta","Companies that have taken a persistent view on cracking these large opportunities have become immensely valuable, e.g., Bajaj Finance",neutral,neutral,2.421018347627822,positive,0.8156779661016917,neutral
2018-08-16 13:00:10.584,2866.0,2885.0,2841.5,2850.0,687200.0,"D-Street Buzz: PSU banks gain led by IDBI Bank; Axis Bank hits fresh 52-week high, realty stocks drag","Axis Bank, Bajaj Finserv, Bajaj Finance, Dabur India, Havells India, Infosys, Jubilant Foodworks, Sun Pharma and United Breweries are some of the stocks which have hit new 52-week high in the afternoon trade on NSE.",positive,neutral,-0.5582693649685974,neutral,-1.2891120415573556,negative
2018-08-16 13:00:24.776,2866.0,2885.0,2841.5,2850.0,687200.0,"Bajaj Finance, Shriram Transport, Capital First to get astrological support: Satish Gupta","Bajaj Finance, Shriram Transport, Cholamandalam Investment and Capital First will get astrological support, says Satish Gupta of astrostocktips.",neutral,positive,-0.5582693649685974,neutral,-1.2891120415573556,negative
2018-08-16 13:00:55.650,2866.0,2885.0,2841.5,2850.0,687200.0,"GAIL, Infosys, Bajaj Finance, Bajaj Finserv from Nifty 50 hit new highs","AIA Engg, Astral Poly, Balkrishna Ind, Dabur, Exide Ind, Havells India, Infibeam Incorp, Jubilant FoodWorks, NIIT Tech, Pfizer, United Breweries and Varun Beverages from Nifty 500 index hit new highs",positive,positive,-0.5582693649685974,neutral,-1.2891120415573556,negative
2018-08-16 18:02:21.594,2866.0,2885.0,2841.5,2850.0,687200.0,"Check out insider trades for Aug 13; ITC, YES Bank, JSW Steel, Bajaj Finance in focus","Sajan Kumar Bansal bought 2,50,000 shares of Skipper through market purchase on August 13, 2018",neutral,neutral,-0.5582693649685974,neutral,-1.2891120415573556,negative
2018-08-17 18:02:14.321,2866.0,2885.0,2841.5,2850.0,687200.0,"Check out insider trades for August 13; Bajaj Finance, Dabur, Yes Bank in focus","Hindustan Times (promoter) bought 10,000 shares of Chambal Fertilisers & Chemicals through market purchase on August 13. Bajaj Allianz Life Insurance bought 50,000 shares of Bajaj Finance",neutral,neutral,-0.5582693649685974,neutral,-1.2891120415573556,negative
2018-08-20 10:02:15.774,2877.95,2877.95,2836.3,2840.85,663987.0,"HUL, Sun Pharma, Tech Mahindra, Bajaj Finance, United Spirits to get astrological support this week: Satish Gupta","Hindustan Unilever, Godrej Consumer, Marico and Colgate from the personal care space and Strides Shasun, Dr Lal PathLab, Aurobindo Pharma, Wockhardt and Sun Pharma from the pharma space will get astrological support, says Satish Gupta of astrostocktips.",neutral,neutral,-1.2891120415573556,negative,1.0261013429079358,positive
2018-08-24 18:02:20.196,2892.0,2943.4,2891.05,2921.25,1325349.0,"D-Street Buzz: Metals shine led by Hindustan Zinc, JSW Steel; Pfizer zooms 12%, hits fresh 52-week high","36 stocks are trading at new 52-week high including names like Bajaj Finance, Bata India, Bombay Burmah, Exide Industries, Glenmark Pharma, JSW Steel, Jubilant Food, Kaveri Seed, Marico, Mphasis, Reliance Industries and United Breweries.",positive,neutral,1.0114107883817427,positive,0.6327822004490682,neutral
2018-08-27 10:02:01.543,2939.4,2959.0,2925.05,2958.0,974488.0,"HUL, Bajaj Finance, Jubilant Food, DHFL, United Spirits to get astrological support for the week: Satish Gupta","Personal care stocks like Hindustan Unilever, Godrej Consumer, Marico, Emami and Godrej Industries will get astrological support, says Satish Gupta of astrostocktips.",neutral,positive,0.6327822004490682,neutral,-1.5392354124748522,negative
2018-08-27 18:00:22.345,2982.0,2982.0,2925.8,2936.1,1228571.0,"RIL, TCS, Bajaj Finance hit new highs; rally over 60% in one year","Dabur, Havells, Indiabulls Ventures, Infibeam Avenues, JSW Steel, Merck, MphasiS, Page Ind, Pfizer, RBL Bank, Sunteck Realty, Torrent Pharma and VIP Ind  from the Nifty 500 index hit new high today.",positive,neutral,-1.5392354124748522,negative,2.0255972696245705,positive
