date,open,high,low,close,volume,title,description,title_sentiment,desc_sentiment,daily_change_pct,market_sentiment,next_day_change_pct,next_day_sentiment
2021-04-15 10:21:30.000,4708.1,4750.0,4566.1,4646.7,2885034.0,"Sensex drops over 200 pts in early trade; Infosys, M&M, IndusInd Bank, Maruti, Bajaj Finance, UltraTech Cement, ICICI Bank shed","Equity benchmark Sensex tumbled over 200 points in early trade on Thursday, tracking losses in index majors Infosys, ICICI Bank and M&M amid negative cues from domestic and global markets.After opening over 200 points higher, the 30-share BSE index reversed all its gains to trade 216.73 po…",neutral,negative,-1.304135426180424,negative,-1.3301866552242008,negative
2021-04-16 09:57:26.000,4661.0,4690.0,4590.0,4599.0,2138352.0,COVID SALE! Over 50% Nifty50 Stocks Are Down 10-20% From Highs,"Stocks that are down in double digits include Tata Steel, UPL, Bajaj Finance, NTPC, Kotak Mahindra Bank, Bharti Airtel, Tata Motors, Axis Bank, Bajaj Finance, and IndusInd Bank among others",neutral,negative,-1.3301866552242008,negative,0.6471910112359591,neutral
2021-04-16 09:57:26.000,4661.0,4690.0,4590.0,4599.0,2138352.0,"COVID Takes Toll, Over 50% Nifty50 Stocks Are Down 10-20% From Highs","Stocks that are down in double digits include Tata Steel, UPL, Bajaj Finance, NTPC, Kotak Mahindra Bank, Bharti Airtel, Tata Motors, Axis Bank, Bajaj Finance, and IndusInd Bank among others",neutral,negative,-1.3301866552242008,negative,0.6471910112359591,neutral
2021-04-19 09:38:17.000,4450.0,4504.0,4362.0,4478.8,3413636.0,"Sensex crashes by over 1,300 points to begin at 47,513, Nifty opens at 14,223","All Sensex components were in the red. Bajaj Auto was the top loser in the Sensex pack, dropping over 5%, followed by IndusInd Bank, SBI, ICICI Bank, Bajaj Finance and Axis Bank.",neutral,negative,0.6471910112359591,neutral,0.7034845496384038,neutral
2021-04-19 11:16:47.000,4450.0,4504.0,4362.0,4478.8,3413636.0,"D-Street Buzz: Banks & Financials Tumble On Second Wave Of COVID; RBK Bank, ICICI Bank, SBI, Bajaj Finance Top Losers","Bank Nifty fell over 4 percent with the top losers being RBL Bank, ICICI Bank, IDFC First bank, IndusInd Bank, Kotak Mahindra Bank and Axis Bank while SBI, PNB and Ban of Baroda are the top PSU bank losers.",neutral,negative,0.6471910112359591,neutral,0.7034845496384038,neutral
2021-04-20 15:37:46.000,4563.0,4699.0,4555.2,4595.1,3387431.0,"Sensex down 200 points, Nifty around 14,296; Bajaj Finance, Dr Reddy’s among major gainers","Sensex was trading 243/62 points down at 47,705.80 while the Nifty was down 63 points at 14,296.40. Bajaj Finance, Dr Reddy’s, Mahindra & Mahindra, and Bajaj Finserv were up 3 percent. The S&P BSE MidCap and SmallCap indices traded 0.6 percent higher, each. Wockhardt, ICICI Prudential Life…",neutral,positive,0.7034845496384038,neutral,2.934065934065934,positive
2021-04-20 18:16:00.000,4563.0,4699.0,4555.2,4595.1,3387431.0,Bajaj Finance spurts 3% after allotment of NCDS to raise Rs116cr on private placement basis,The company allotted 1160 Secured redeemable non-convertibles debentures on Monday having a face value of Rs10 Lakh each.,positive,neutral,0.7034845496384038,neutral,2.934065934065934,positive
2021-04-21 14:32:00.000,4550.0,4714.0,4505.75,4683.5,2553385.0,IFC loan to increase Bajaj Finance’s lending to women led MSMEs,The proposed $150 million senior loan for up to five years to Bajaj Finance will enable the company to expand its lending to MSMEs.,positive,positive,2.934065934065934,positive,0.7119516998117252,neutral
2021-04-22 09:19:49.000,4550.0,4714.0,4505.75,4683.5,2553385.0,"Sensex tumbles over 500 points in early trade; Nifty slips below 14,200","IndusInd Bank was the top loser in the Sensex pack, shedding over 3 per cent, followed by Asian Paints, Axis Bank, HUL, M&M, Tech Mahindra, Bajaj Finance, Reliance Industries and HDFC Bank.",negative,negative,2.934065934065934,positive,0.7119516998117252,neutral
2021-04-22 13:32:05.000,4621.1,4759.8,4610.5,4654.0,2722962.0,Go paperless on Earth Day 2021: Invest in a Bajaj Finance online FD,"We are living in the times of Digital Ubiquity, where digital revolution brought in by the internet has given our world a new lease on life.",neutral,neutral,0.7119516998117252,neutral,1.1513859275053304,positive
2021-04-23 08:24:00.000,4621.1,4759.8,4610.5,4654.0,2722962.0,"Top trading ideas by Anand Rathi: Buy Bajaj Finance, DLF, Maruti","The recent correction in the markets dragged Bajaj Finance’s from the high of Rs 5,800 towards Rs 4,400-mark",neutral,negative,0.7119516998117252,neutral,1.1513859275053304,positive
2021-04-23 10:13:37.000,4621.1,4759.8,4610.5,4654.0,2722962.0,"Sensex declines over 200 points, Nifty below 14,350 in early trade; ICICI Bank, Bajaj Finance among top losers","The markets opened on a negative note. The Sensex declined over 300 points in early trade on Friday, tracking losses in index majors HDFC twins, ICICI Bank and Infosys amid concerns that the second wave of COVID-19 pandemic may derail the economic recovery of the country.The 30-share BSE i…",negative,negative,0.7119516998117252,neutral,1.1513859275053304,positive
2021-04-23 10:41:11.000,4621.1,4759.8,4610.5,4654.0,2722962.0,"Sensex falls over 300 points in early trade; Nifty below 14,350","ICICI Bank was the top loser in the Sensex pack, shedding around 2 per cent, followed by HDFC twins, Bajaj Finance, HUL, SBI, M&M and Kotak Bank.",neutral,negative,0.7119516998117252,neutral,1.1513859275053304,positive
2021-04-26 17:01:39.000,4747.0,4889.85,4746.55,4885.0,2640511.0,Grow your savings with assured returns up to 7.25% with a Bajaj Finance FD,"Investing your income in an instrument that provides consistent returns, can help you secure your future. However, when choosing the right instrument, look for a balance of high growth of savings and safety of capital. By investing in a fixed de…",positive,neutral,2.9070992205603536,positive,6.917599186164802,positive
2021-04-27 05:30:00.000,4747.0,4889.85,4746.55,4885.0,2640511.0,BRIEF-Bajaj Finance March-Qtr PAT Rises,BRIEF-Bajaj Finance March-Qtr PAT Rises,neutral,neutral,2.9070992205603536,positive,6.917599186164802,positive
2021-04-27 05:30:00.000,4747.0,4889.85,4746.55,4885.0,2640511.0,BRIEF-Bajaj Finance Appoints Rahul Bajaj As Chairman Emeritus For 5 Years Effective May 1,BRIEF-Bajaj Finance Appoints Rahul Bajaj As Chairman Emeritus For 5 Years Effective May 1,neutral,neutral,2.9070992205603536,positive,6.917599186164802,positive
2021-04-27 07:16:00.000,4747.0,4889.85,4746.55,4885.0,2640511.0,Earnings estimates of India Inc take a hit,"Among the Nifty 50 companies, 18 including Bharti Airtel, Titan, Tata Motors, Hindustan Unilever, Indian Oil, ONGC, Dr Reddys, Bajaj Finance, UltraTech Cement have seen EPS downgrades in the past four weeks compared with 16 companies that have seen an upward revision.",neutral,negative,2.9070992205603536,positive,6.917599186164802,positive
2021-04-27 07:52:00.000,4747.0,4889.85,4746.55,4885.0,2640511.0,"Stocks in the news: Maruti Suzuki, Axis Bank, Bajaj Finance, TechM, SBI Card and Britannia","ABB, TVS Motor, Nippon Life, Symphony, PNB Housing, Sanofi India, Hatsun Agro Products and VST Industries are among companies which will report their quarterly results on Tuesday.",neutral,neutral,2.9070992205603536,positive,6.917599186164802,positive
2021-04-27 07:53:00.000,4747.0,4889.85,4746.55,4885.0,2640511.0,"RIL, pvt banks take Sensex 558 pts up; Nifty tops 14,650; Nifty Metal up 3%","Hindalco, L&T, Tata Steel, Divis Labs, Reliance Industries, Bajaj Finance, and SBI were the top gainers on the 50-share pack",positive,positive,2.9070992205603536,positive,6.917599186164802,positive
2021-04-27 08:12:39.000,4747.0,4889.85,4746.55,4885.0,2640511.0,Bajaj Finance Q4 Preview: Profit May Grow Around 40% On Lower Provisions But NII May Decline,Motilal Oswal sees a 39 percent YoY growth in profit and a 4.7 percent YoY decline in net interest income in March quarter.,neutral,positive,2.9070992205603536,positive,6.917599186164802,positive
2021-04-27 12:55:00.000,4915.0,5310.0,4915.0,5255.0,8550315.0,"Top stocks in focus: Tech Mahindra, HDFC Life Insurance, Axis Bank, Maruti, Bajaj Finance, Britannia",Check out the stocks that will be in focus during trade today based on recent and latest news developments.,neutral,neutral,6.917599186164802,positive,2.336448598130841,positive
2021-04-27 16:43:34.000,4915.0,5310.0,4915.0,5255.0,8550315.0,"Market Roundup: Sensex surges 557 points, Nifty above 14,600; today’s top gainers & losers-Business News , Firstpost","The top gainers of the day were Larsen & Toubro (LT), Bajaj Finance, Reliance, Indusind Bank, and SBI. The top laggards included Maruti, NTPC, Kotak Bank, Nestle India",positive,neutral,6.917599186164802,positive,2.336448598130841,positive
2021-04-27 17:42:53.000,4915.0,5310.0,4915.0,5255.0,8550315.0,"Bajaj Finance Q4 Profit Spikes 42% To Rs 1,347 Crore On Lower Provisions","Loan losses and provisions for Q4FY21 was at Rs 1,231 crore as against Rs 1,954 crore in Q4FY20 and Rs 1,352 crore in Q3FY21.",neutral,negative,6.917599186164802,positive,2.336448598130841,positive
2021-04-27 17:42:53.000,4915.0,5310.0,4915.0,5255.0,8550315.0,"Bajaj Finance Q4 Profit Up 42% At Rs 1,347 Crore, Declares Dividend Of Rs 10 Per Share","Loan losses and provisions for Q4FY21 were at Rs 1,231 crore against Rs 1,954 crore in Q4FY20 and Rs 1,352 crore in Q3FY21.",neutral,negative,6.917599186164802,positive,2.336448598130841,positive
2021-04-27 17:49:00.000,4915.0,5310.0,4915.0,5255.0,8550315.0,"Bajaj Finance Q4 PAT rises 42% to Rs 1,347 cr","The NBFC’s consolidated net profit jumped 42% to Rs 1,347 crore on 5% decline in total income to Rs 6,855 crore in Q4 FY21 over Q4 FY20.",positive,positive,6.917599186164802,positive,2.336448598130841,positive
2021-04-27 18:01:00.000,4915.0,5310.0,4915.0,5255.0,8550315.0,Bajaj Finance consolidated net profit rises 42.04% in the March 2021 quarter,Sales decline 5.74% to Rs 6778.03 crore,positive,negative,6.917599186164802,positive,2.336448598130841,positive
2021-04-27 18:57:50.000,4915.0,5310.0,4915.0,5255.0,8550315.0,Bajaj Finance Q4 Results: Net Profit Rises 42%,"Bajaj Finance Ltd. saw its net profit rise 42% to Rs 1,347 crore in January-March, from Rs 948 crore a year ago.",neutral,positive,6.917599186164802,positive,2.336448598130841,positive
2021-04-27 18:58:00.000,4915.0,5310.0,4915.0,5255.0,8550315.0,"Bajaj Finance Q4 consolidated net profit jumps 42% to Rs 1,347 cr","Total income fell by 5 per cent to Rs 6,855 crore from Rs 7,231 crore in year-ago period",positive,negative,6.917599186164802,positive,2.336448598130841,positive
2021-04-27 19:10:24.000,4915.0,5310.0,4915.0,5255.0,8550315.0,"Bajaj Finance Q4 consolidated net jumps 42% to Rs1,347 crore","The new loans booked during Q4 FY21 fell to 54.7 lakh (5.47 million) as against 60.3 lakh (6.03 million) in the same quarter a year ago, Bajaj Finance said",positive,negative,6.917599186164802,positive,2.336448598130841,positive
2021-04-27 19:51:28.000,4915.0,5310.0,4915.0,5255.0,8550315.0,"Bajaj Finance Q4 consolidated net jumps 42% to Rs 1,347 crore","Bajaj Finance (BFL) on Tuesday reported a 42 per cent jump in consolidated net profit at Rs 1,347 crore for the fourth quarter of the fiscal ended March 2021.The company’s net profit stood at Rs 948 crore in the January-March period of the preceding fiscal year 2019-20..Results: Britan…",positive,positive,6.917599186164802,positive,2.336448598130841,positive
2021-04-27 20:03:43.000,4915.0,5310.0,4915.0,5255.0,8550315.0,Results: TVS Motor reports four-fold increase in Q4 profit to Rs 319 crore,"TVS Motor Company on Tuesday posted nearly four-fold increase in its consolidated net profit to Rs 319.19 crore for the fourth quarter ended March 31, 2021, riding on the back of robust sales in the domestic and international markets..Bajaj Finance Q4 consolidated net jumps 42% to Rs 1,347 cr…",positive,positive,6.917599186164802,positive,2.336448598130841,positive
2021-04-27 20:31:00.000,4915.0,5310.0,4915.0,5255.0,8550315.0,"Bajaj Finance Q4 takeaways: Recovery on track, NBFC confident of absorbing any Covid 2.0 impact",The non-bank finance company is counting on its experience of the first wave to help ride out any difficulty during the second wave.,positive,neutral,6.917599186164802,positive,2.336448598130841,positive
2021-04-27 20:41:00.000,4915.0,5310.0,4915.0,5255.0,8550315.0,Top headlines: Maruti Suzuki Q4 net drops 10%: record Covid cases in Kerala,"Maruti Suzuki Q4 net declines 10% on supply chain disruptions, higher raw material costs, Bajaj Finance posts profit of Rs 1,347 crore in March quarter, and other top news of the day",negative,negative,6.917599186164802,positive,2.336448598130841,positive
2021-04-27 20:42:00.000,4915.0,5310.0,4915.0,5255.0,8550315.0,"Bajaj Finance Q4: Consolidated net jumps 42% to Rs 1,347 cr","Bajaj Finance (BFL) on Tuesday reported a 42 per cent jump in consolidated net profit at Rs 1,347 crore for the fourth quarter of the fiscal ended March 2021. The company’s net profit stood at Rs 948 crore in the January-March period of the preceding fiscal year 2019-20.",positive,positive,6.917599186164802,positive,2.336448598130841,positive
2021-04-27 20:44:00.000,4915.0,5310.0,4915.0,5255.0,8550315.0,"Bajaj Finance Q4 results: PAT jumps 30% YoY, below Street estimates; firm declares dividend of Rs 10","The non-bank lenders net interest income in the quarter fell 4 per cent on-year to Rs 4,287 crore, which was higher than analysts estimate of Rs 4,182 crore.",negative,negative,6.917599186164802,positive,2.336448598130841,positive
2021-04-27 20:46:48.000,4915.0,5310.0,4915.0,5255.0,8550315.0,Bajaj Finance consolidated net profit rises 42%,"Bajaj Finance long term guidance is to grow AUM in the corridor of 25% to 27%, profit growth in the corridor of 23% to 24% and gross NPA in the 1.4% to 1.7% range with net NPA at 0.4% to 0.7%",positive,positive,6.917599186164802,positive,2.336448598130841,positive
2021-04-27 21:15:00.000,4915.0,5310.0,4915.0,5255.0,8550315.0,"Q4 earnings: Reduction in provisions, finance costs help Bajaj Finance tide over timid loan growth",Provisions on bad loans fell 37% to Rs 1231 crore in the quarter ended March 2021 from Rs 1954 crore last year while finance costs fell 14% to Rs 2196 crore from Rs 2547 crore in March 2020.,positive,negative,6.917599186164802,positive,2.336448598130841,positive
2021-04-27 21:26:20.000,4915.0,5310.0,4915.0,5255.0,8550315.0,Bajaj Finance Q4 net rises 42%,"Net for FY21 falls 16% to ₹4,420 cr; new loans booked down at 54.7 lakh",positive,neutral,6.917599186164802,positive,2.336448598130841,positive
2021-04-27 22:46:22.000,4915.0,5310.0,4915.0,5255.0,8550315.0,Bajaj Finance confident of absorbing second Covid wave impact,"Bajaj Finance says that despite the disruptions, the company remains open for business across geographies in line with local administration advisories",positive,positive,6.917599186164802,positive,2.336448598130841,positive
2021-04-27 23:56:00.000,4915.0,5310.0,4915.0,5255.0,8550315.0,"Bajaj Finance net rises 30% to Rs 1,161 cr in January-March quarter",The company had posted a net profit of Rs 892 crore in the corresponding quarter last year,positive,positive,6.917599186164802,positive,2.336448598130841,positive
2021-04-28 00:11:28.000,4915.0,5310.0,4915.0,5255.0,8550315.0,"At Bajaj Finance, asset quality concerns persist",Bajaj Finance’s AUM growth was largely on the back of a jump in mortgages of its housing subsidiary,negative,positive,6.917599186164802,positive,2.336448598130841,positive
2021-04-28 07:00:16.000,4915.0,5310.0,4915.0,5255.0,8550315.0,"Stocks To Watch: Axis Bank, Bajaj Finance, Info Edge, Britannia, United Breweries",Here are the stocks to watch in trade today...,neutral,neutral,6.917599186164802,positive,2.336448598130841,positive
2021-04-28 07:33:49.000,4915.0,5310.0,4915.0,5255.0,8550315.0,"Buzzing Stocks | Axis Bank, Britannia, Bajaj Finance And Others Shares That Will Be In News Today",Stocks in news: Check out the companies making the biggest headlines before the market opening bell.,neutral,neutral,6.917599186164802,positive,2.336448598130841,positive
2021-04-28 08:00:58.000,4915.0,5310.0,4915.0,5255.0,8550315.0,"Stocks to Watch: Axis Bank, Bajaj Finance, Britannia, Info Edge, TVS Motor","The Tata group, Reliance Industries Ltd, JSW Group, Adani group, ITC Ltd, and Jindal Steel and Power Ltd are among many top Indian companies that are stepping in to fill the gaps in India’s healthcare infrastructure, crumbling under an explosion of covid-19 cases",neutral,neutral,6.917599186164802,positive,2.336448598130841,positive
2021-04-28 08:28:06.000,4915.0,5310.0,4915.0,5255.0,8550315.0,"Info Edge, Maruti, Axis Bank, Tata Comm, PNB Housing, Vedanta, JSPL, Bajaj Finance, HDFC AMC stocks in focus","Nifty futures were trading flat with a negative bias at 14,656.50 on Singaporean Exchange, hinting a flat start for BSE Sensex and Nifty 50 on Wednesday.",neutral,neutral,6.917599186164802,positive,2.336448598130841,positive
2021-04-28 08:44:00.000,4915.0,5310.0,4915.0,5255.0,8550315.0,"Stocks to watch: Axis Bank, Britannia, Bajaj Finance, Info Edge, HDFC AMC",FMCG major Britannia Industries reported a 3 per cent YoY decline in consolidated net profit at Rs 360.07 crore in the fourth quarter ended March 31,neutral,negative,6.917599186164802,positive,2.336448598130841,positive
2021-04-28 09:13:00.000,4915.0,5310.0,4915.0,5255.0,8550315.0,"Stocks in news: Axis Bank, Info Edge, Bajaj Finance, Britannia and more","Stocks in news: Axis Bank, Info Edge, Bajaj Finance, Britannia TVS Motor, Sanofi India and more",neutral,neutral,6.917599186164802,positive,2.336448598130841,positive
2021-04-28 09:52:53.000,4915.0,5310.0,4915.0,5255.0,8550315.0,"Sensex rises over 350 pts in early trade, Nifty trades at 14,750","Bajaj Finance was the top gainer in the Sensex pack, rising around 3%, followed by Bajaj Finserv, Bajaj Auto, SBI, IndusInd Bank, M&M, Bharti Airtel, HDFC twins, Kotak Bank and Infosys.",positive,positive,6.917599186164802,positive,2.336448598130841,positive
2021-04-28 09:59:00.000,4915.0,5310.0,4915.0,5255.0,8550315.0,"Sensex reclaims 49,000-mark, Nifty tops 14,700; bank, auto, IT stocks gain","Equity benchmark Sensex rallied over 350 points in early trade on Wednesday, tracking gains in index-heavyweights HDFC twins, Bajaj Finance and Infosys. The 30-share BSE index was trading 351.06 points or 0.72 per cent higher at 49,295.20. Similarly, the broader NSE Nifty advanced 95.30 points or 0.…",positive,positive,6.917599186164802,positive,2.336448598130841,positive
2021-04-28 10:30:26.000,4915.0,5310.0,4915.0,5255.0,8550315.0,"Sensex surges over 350 points in early trade; Nifty tests 14,750","Bajaj Finance was the top gainer in the Sensex pack, rising around 3 per cent, followed by Bajaj Finserv, Bajaj Auto, SBI, IndusInd Bank, M&M, Bharti Airtel, HDFC twins, Kotak Bank and Infosys.",positive,positive,6.917599186164802,positive,2.336448598130841,positive
2021-04-28 10:50:00.000,4915.0,5310.0,4915.0,5255.0,8550315.0,Bajaj Finance gains 8% despite a miss on Q4 nos; brokerages remain mixed,HDFC Securities notes that Bajaj Finance reported muted performance primarily on account of higher employee expenses,positive,negative,6.917599186164802,positive,2.336448598130841,positive
2021-04-28 11:45:20.000,4915.0,5310.0,4915.0,5255.0,8550315.0,Bajaj Finance Q4 Review - Long Term Prospects Intact: ICICI Direct,Bajaj Finance Q4 Review - Long Term Prospects Intact: ICICI Direct,neutral,neutral,6.917599186164802,positive,2.336448598130841,positive
2021-04-28 11:54:00.000,4915.0,5310.0,4915.0,5255.0,8550315.0,"Results Review for Bajaj Finance, Axis Bank, Maruti Suzuki, Britannia Industries","Results Review for Bajaj Finance, Axis Bank, Maruti Suzuki, Britannia Industries",neutral,neutral,6.917599186164802,positive,2.336448598130841,positive
2021-04-28 12:30:00.000,5350.0,5525.0,5330.0,5475.0,7241215.0,Bajaj Finance shares jump over 7% post Q4 earnings,"Bajaj Finance Ltd (BFL) on Tuesday reported a 42 per cent jump in consolidated net profit at Rs 1,347 crore for the fourth quarter of the fiscal ended March 2021.",positive,positive,2.336448598130841,positive,1.8504672897196264,positive
2021-04-28 12:50:17.000,5350.0,5525.0,5330.0,5475.0,7241215.0,"Sensex surges over 350 points in early trade, Nifty tests 14,750","Bajaj Finance was the top gainer in the Sensex pack, rising around 3%.",positive,positive,2.336448598130841,positive,1.8504672897196264,positive
2021-04-28 12:54:21.000,5350.0,5525.0,5330.0,5475.0,7241215.0,Bajaj Finance Shares Gain Most In Five Months On Stable Quarterly Earnings,Brokerages see Bajaj Finance’s balancesheet as resilient even though Q4 growth disappointed some analysts.,neutral,positive,2.336448598130841,positive,1.8504672897196264,positive
2021-04-28 12:55:00.000,5350.0,5525.0,5330.0,5475.0,7241215.0,"Top stocks in focus: Axis Bank, Britannia, Bajaj Finance, Bajaj Finserv, Biocon",Check out the stocks that will be in focus during trade today based on recent and latest news developments.,neutral,neutral,2.336448598130841,positive,1.8504672897196264,positive
2021-04-28 13:32:44.000,5350.0,5525.0,5330.0,5475.0,7241215.0,Bajaj Finance Ltd jumps more than 7%,"Bajaj Finance Ltd is quoting at Rs 5213.8, up 7.17% on the day as on 12:49 IST on the NSE. The stock is up 127.04% in last one year as compared to a 55.32% spurt in NIFTY and a 55.01% spurt in the Nifty Financial Services index.",positive,positive,2.336448598130841,positive,1.8504672897196264,positive
2021-04-28 14:41:45.000,5350.0,5525.0,5330.0,5475.0,7241215.0,Bajaj Finance Q4 Review - Asset Quality Improves; Expect A Normalised FY22: Motilal Oswal,Bajaj Finance - Asset Quality Improves In Q4; Expect A Normalized FY22: Motilal Oswal,neutral,neutral,2.336448598130841,positive,1.8504672897196264,positive
2021-04-28 14:55:00.000,5350.0,5525.0,5330.0,5475.0,7241215.0,Bajaj Finance Board approves 9.36 lakh grant of stock options; Stock gains in trade today,Bajaj Finance Board approves 9.36 lakh grant of stock options.,positive,neutral,2.336448598130841,positive,1.8504672897196264,positive
2021-04-28 15:16:00.000,5350.0,5525.0,5330.0,5475.0,7241215.0,"Bajaj Finance Q4 PAT jumps 42% yoy to Rs1,347cr; Declares dividend of Rs10 per share; Stock gains ~3%","For FY21, PAT declines 16% yoy to Rs4,420cr from Rs5264cr in FY20. NII in Q4FY21 declined half a percent to Rs4,659cr from Rs4,684cr in Q4FY20.",positive,negative,2.336448598130841,positive,1.8504672897196264,positive
2021-04-28 15:38:19.000,5350.0,5525.0,5330.0,5475.0,7241215.0,"Markets rally for third day; Sensex ends 790 pts higher led by banks, financials","Market closing: Indices ended higher for the third day in a row on Wednesday amid better-than-expected earnings and drop in covid cases. Sensex ended 790 points at 49,733 and Nifty closed 1.4% higher at 14,864. Bajaj Finance rose 8%",positive,positive,2.336448598130841,positive,1.8504672897196264,positive
2021-04-28 16:10:00.000,5350.0,5525.0,5330.0,5475.0,7241215.0,Bajaj Finance share rises 6% post Q4 earnings,"At 11:37 hours, Bajaj Finance was quoting at Rs 5195, up 6.60 percent on the BSE",positive,positive,2.336448598130841,positive,1.8504672897196264,positive
2021-04-28 16:12:33.000,5350.0,5525.0,5330.0,5475.0,7241215.0,"Market consolidates further as strong numbers from ICICI Bank, Axis Bank, Bajaj Finance fuel upsurge","The positive and stable results by ICICI, Axis and Bajaj Finance have changed the momentum of the markets which showed weakness in the past few weeks. Mohit Nigam, Head, PMS, Hem Securities said he expects the momentum to continue with a stronger movement across small and mid caps especially in t…",positive,positive,2.336448598130841,positive,1.8504672897196264,positive
2021-04-28 16:39:27.000,5350.0,5525.0,5330.0,5475.0,7241215.0,"Sensex soars 790 pts, Nifty tops 14,850 as financial stocks shine","Bajaj Finance was the top gainer in the Sensex pack, soaring around 8 %.",positive,positive,2.336448598130841,positive,1.8504672897196264,positive
2021-04-28 17:11:20.000,5350.0,5525.0,5330.0,5475.0,7241215.0,"Sensex soars 790 pts, Nifty tops 14,850 as financial stocks shine",Bajaj Finance was the top gainer in the Sensex pack,positive,positive,2.336448598130841,positive,1.8504672897196264,positive
2021-04-28 17:11:48.000,5350.0,5525.0,5330.0,5475.0,7241215.0,"Sensex soars 790 points, Nifty tops 14,850 as financial stocks shine","Bajaj Finance was the top gainer in the Sensex pack, soaring around 8 per cent, followed by IndusInd Bank, Bajaj Finserv, ICICI Bank, Kotak Bank, SBI, Bajaj Auto and HDFC Bank.",positive,positive,2.336448598130841,positive,1.8504672897196264,positive
2021-04-29 08:24:10.000,5350.0,5525.0,5330.0,5475.0,7241215.0,"Trade Spotlight: What Should Investors Do With Bajaj Finance, TVS Motor?","Stocks that were in focus include Bajaj Finance which closed with gains of over 8 percent and was the top Nifty gainer, TVS Motors which hit a fresh 52-week high post Q4 results on Wednesday.",neutral,positive,2.336448598130841,positive,1.8504672897196264,positive
2021-04-29 12:12:36.000,5350.0,5524.65,5327.7,5449.0,4116999.0,"Bajaj Finance Consolidated March 2021 Net Sales At Rs 6,850.62 Crore, Down 5.2% Y-o-Y",,neutral,neutral,1.8504672897196264,positive,4.3582943024283765,positive
2021-04-30 13:17:22.000,5350.0,5524.65,5327.7,5449.0,4116999.0,Bajaj Finance Ltd sees sustained upmove,"Bajaj Finance Ltd is quoting at Rs 5495, up 0.19% on the day as on 12:49 IST on the NSE. The stock is up 164.23% in last one year as compared to a 59.38% spurt in NIFTY and a 63.12% spurt in the Nifty Financial Services.",positive,positive,1.8504672897196264,positive,4.3582943024283765,positive
