date,open,high,low,close,volume,title,description,title_sentiment,desc_sentiment,daily_change_pct,market_sentiment,next_day_change_pct,next_day_sentiment
2020-07-08 09:14:45.000,3351.95,3408.8,3180.1,3197.0,19121918.0,"Stocks To Watch: Titan Company, Maruti Suzuki & Bajaj Finance","Stocks To Watch: Titan Company, Maruti Suzuki & Bajaj Finance",neutral,neutral,-4.622682319247001,negative,2.942812982998449,positive
2020-07-08 09:31:00.000,3351.95,3408.8,3180.1,3197.0,19121918.0,"Nifty above 10,800-mark; SBI, IndusInd Bank stocks lead","IndusInd Bank, Tata Steel Bajaj Finance, M&M, and SBI were the top gainers at the opening while Infosys, HCL Tech, Maruti, HUL and TCS led the losses.",positive,positive,-4.622682319247001,negative,2.942812982998449,positive
2020-07-08 10:13:00.000,3351.95,3408.8,3180.1,3197.0,19121918.0,Trending stocks: Bajaj Finance shares fall over 1%,"A total of 340,085 shares changed hands on the counter till 10:10AM (IST).",negative,neutral,-4.622682319247001,negative,2.942812982998449,positive
2020-07-08 11:30:00.000,3351.95,3408.8,3180.1,3197.0,19121918.0,Stock market update: 4 stocks hit 52-week lows on NSE,"However, HCL Tech, Infosys, UltraTech Cement, Maruti Suzuki and Bajaj Finance were among the top losers.",negative,negative,-4.622682319247001,negative,2.942812982998449,positive
2020-07-08 11:53:00.000,3351.95,3408.8,3180.1,3197.0,19121918.0,Why Bajaj Finance continues to be a strong buy,’Rally is clearly driven by positive statements coming out from the management,positive,positive,-4.622682319247001,negative,2.942812982998449,positive
2020-07-08 15:58:00.000,3235.0,3379.9,3195.1,3330.2,18753842.0,"Share Market Highlights: Sensex ends 345 points lower, Nifty at 10,705; Bajaj twins, Asian Paints top losers","Stock Market LIVE Updates on July 8: Bajaj Finance, Bajaj Auto, Asian Paints, HCL Tech and Zee Entertainment were among the top losers today on NSE, while IndusInd Bank, SBI, JSW Steel, Tata Steel and Vedanta were among the top performers.",neutral,negative,2.942812982998449,positive,0.8854961832061069,neutral
2020-07-09 02:45:00.000,3235.0,3379.9,3195.1,3330.2,18753842.0,"Banking, NBFC stocks among top gainers - SBI, Axis Bank, Bajaj Finance take the lead","Nifty Bank and Nifty Financial Services have edged to an intraday high of 22,893.15 and 11,320.90 respectively.",positive,positive,2.942812982998449,positive,0.8854961832061069,neutral
2020-07-09 10:08:00.000,3235.0,3379.9,3195.1,3330.2,18753842.0,Trending stocks: Bajaj Finance shares rise over 1%,"A total of 119,613 shares changed hands on the counter till 10:07AM (IST).",positive,neutral,2.942812982998449,positive,0.8854961832061069,neutral
2020-07-09 10:16:12.000,3235.0,3379.9,3195.1,3330.2,18753842.0,"Sensex jumps over 200 points in early trade; Nifty tests 10,750","Tata Steel was the top gainer in the Sensex pack, rising around 2%, followed by IndusInd Bank, Bajaj Finance, ICICI Bank, M&M, SBI and Axis Bank.",positive,positive,2.942812982998449,positive,0.8854961832061069,neutral
2020-07-09 10:41:15.000,3235.0,3379.9,3195.1,3330.2,18753842.0,"Market update: Sensex jumps over 200 pts in early trade; Tata Steel, IndusInd Bank, Bajaj Finance, ICICI Bank, M&M, SBI top gainers","Equity benchmark Sensex jumped over 200 points in early trade on Thursday tracking gains in financial stocks amid positive cues from global markets. After touching a high of 36,541.53 in opening session, the 30-share index was trading 190.57 points, or 0.52 per cent, higher at 36,519.58. The NSE …",positive,positive,2.942812982998449,positive,0.8854961832061069,neutral
2020-07-09 12:39:00.000,3275.0,3395.0,3272.05,3304.0,16147579.0,Three midcap private bank stocks Sanjiv Bhasin is bullish on - The Economic Times,’Bajaj Finance for us at this price would not be a recommendation,positive,neutral,0.8854961832061069,neutral,-3.422619047619048,negative
2020-07-09 16:07:00.000,3275.0,3395.0,3272.05,3304.0,16147579.0,"Share Market Highlights: Sensex ends 408 points higher, Nifty at 10,813; Bajaj Finance, HDFC top gainers","Stock Market LIVE Updates on July 9: Tata Steel, IndusInd Bank, Bajaj Finance, ICICI Bank, M&M, SBI and Axis Bank were among the top gainers today. On the other hand, Maruti, Reliance Industries, TCS and Titan were among the laggards",positive,positive,0.8854961832061069,neutral,-3.422619047619048,negative
2020-07-09 16:19:55.000,3275.0,3395.0,3272.05,3304.0,16147579.0,"Sensex Rallies 409 Points, Nifty Tops 10,800-level","Bajaj Finance was the top gainer in the Sensex pack, spurting around 4 per cent, followed by SBI, Tata Steel, HDFC, Bajaj Finserv, HCL Tech and M&M.",neutral,positive,0.8854961832061069,neutral,-3.422619047619048,negative
2020-07-09 18:56:09.000,3275.0,3395.0,3272.05,3304.0,16147579.0,"Markets resume upward march; HDFC twins, RIL sparkle","Bajaj Finance was the top gainer in the Sensex pack, spurting 3.93% , followed by SBI, Tata Steel, HDFC, Bajaj Finserv, HCL Tech and Axis Bank",neutral,positive,0.8854961832061069,neutral,-3.422619047619048,negative
2020-07-09 19:08:00.000,3275.0,3395.0,3272.05,3304.0,16147579.0,"Taking Stock: PM Modi’s pep talk at global event lifts sentiment; Nifty reclaims 10,800 levels","Top Nifty gainers include names like Tata Steel, SBI, Bajaj Finance, and Hindalco Industries.",positive,neutral,0.8854961832061069,neutral,-3.422619047619048,negative
2020-07-10 09:08:00.000,3275.0,3395.0,3272.05,3304.0,16147579.0,"Top buy and sell ideas by Ashwani Gujral, Mitesh Thakkar, Prakash Gaba for short term","Ashwani Gujral of ashwanigujral.com recommends buying HDFC with a stop loss of Rs 1,900, target at Rs 2,050 and Bajaj Finance with a stop loss of Rs 3,300, target at Rs 3,420.",neutral,neutral,0.8854961832061069,neutral,-3.422619047619048,negative
2020-07-10 16:41:00.000,3275.0,3395.0,3272.05,3304.0,16147579.0,Nifty July futures trade at small premium,"RIL, Bajaj Finance and SBI top traded stock futures in F&O segment.",neutral,neutral,0.8854961832061069,neutral,-3.422619047619048,negative
2020-07-13 09:59:00.000,3360.0,3378.0,3216.2,3245.0,13135310.0,Trending stocks: Bajaj Finance shares gain nearly 1% - The Economic Times,"A total of 75,680 shares changed hands on the counter till 09:57AM (IST).",positive,neutral,-3.422619047619048,negative,-0.9565811541089564,negative
2020-07-13 11:18:00.000,3360.0,3378.0,3216.2,3245.0,13135310.0,Stock market update: 4 stocks hit 52-week lows on NSE - The Economic Times,"However, HDFC Bank, GAIL, HDFC, Axis Bank and Bajaj Finance were among the top losers.",negative,negative,-3.422619047619048,negative,-0.9565811541089564,negative
2020-07-13 13:57:00.000,3219.8,3219.8,3122.35,3189.0,12402434.0,"Share Market LIVE: Sensex, Nifty trade lower; HDFC twins, SBI, PowerGrid, Bajaj Finance top laggards","Stock Market LIVE Updates on July 13: RIL, Infosys, Tech Mahindra, Tata Steel, IndusInd Bank, HUL and Maruti were among the other gainers on Sensex pack today. On the other hand, Bharti Airtel and HDFC were among the top laggards",neutral,neutral,-0.9565811541089564,negative,-1.9040247678018576,negative
2020-07-13 17:00:00.000,3219.8,3219.8,3122.35,3189.0,12402434.0,Nifty July 2020 futures near spot price,"Reliance Industries (RIL), Bajaj Finance and Bharti Airtel most active in futures segment.",neutral,neutral,-0.9565811541089564,negative,-1.9040247678018576,negative
2020-07-14 09:28:00.000,3219.8,3219.8,3122.35,3189.0,12402434.0,Nifty Bank index drops over 350 points; Sensex down over 300 points,"Index heavyweights like HDFC twins, RIL, ICICI Bank and Bajaj Finance contributed the most to the losses.",negative,negative,-0.9565811541089564,negative,-1.9040247678018576,negative
2020-07-14 10:37:00.000,3219.8,3219.8,3122.35,3189.0,12402434.0,"Financial stocks crack; Nifty Bank tanks 4%; Axis Bank, SBI slide up to 5%","That apart, NBFC stocks such as Bajaj Financial Holding, Bajaj Finserv, M&M Finance, Choldamandalam Investment and Finance Company, and Bajaj Finance tumbled up to 5 per cent",positive,negative,-0.9565811541089564,negative,-1.9040247678018576,negative
2020-07-14 11:27:16.000,3219.8,3219.8,3122.35,3189.0,12402434.0,Sensex drops over 300 points in early trade; financial stocks drag,"IndusInd Bank, Bajaj Finserv, Axis Bank, Bajaj Finance, Maruti and SBI were among the laggards. On the other hand, HCL Tech, Infosys, Nestle India, UltraTech Cement and ITC were the gainers.",neutral,neutral,-0.9565811541089564,negative,-1.9040247678018576,negative
2020-07-14 15:56:00.000,3230.0,3297.7,3122.25,3168.5,10979538.0,"Share Market Highlights: Sensex ends 660 points lower, Nifty at 10,607; Axis Bank, Adani Ports top losers","Stock Market LIVE Updates on July 14: IndusInd Bank, Bajaj Finserv, Axis Bank, Bajaj Finance, Maruti and SBI were among the other laggards. On the other hand, HCL Tech, Infosys, Nestle India, UltraTech Cement and ITC were the gainers.",negative,neutral,-1.9040247678018576,negative,0.6320754716981103,neutral
2020-07-15 08:50:00.000,3230.0,3297.7,3122.25,3168.5,10979538.0,"Top buy and sell ideas by Ashwani Gujral, Sudarshan Sukhani, Mitesh Thakkar for short term","Ashwani Gujral of ashwanigujral.com recommends buying Bajaj Finance with a stop loss of Rs 3,150, target at Rs 3,300 and JSW Steel with a stop loss of Rs 190, target at Rs 204.",neutral,neutral,-1.9040247678018576,negative,0.6320754716981103,neutral
2020-07-15 10:05:53.000,3230.0,3297.7,3122.25,3168.5,10979538.0,"Sensex rallies over 400 points in early trade; Nifty tops 10,700","Shares of Infosys rallied around 3 per cent ahead of its quarterly earnings. Axis Bank, Tech Mahindra, Bajaj Finance, Tata Steel, HCL Tech and IndusInd Bank were among the other gainers.",positive,positive,-1.9040247678018576,negative,0.6320754716981103,neutral
2020-07-15 10:14:20.000,3230.0,3297.7,3122.25,3168.5,10979538.0,"Market update: Infosys, Axis Bank, Tech Mahindra, Bajaj Finance, Tata Steel among the other gainers","Equity benchmark Sensex rallied over 400 points in early trade on Wednesday led by gains in index-heavyweights Infosys, Reliance Industries and TCS amid largely positive trend in global markets.After touching a high of 36,465.34, the 30-share BSE Sensex was trading 423.11 points, or 1.17 p…",neutral,positive,-1.9040247678018576,negative,0.6320754716981103,neutral
2020-07-16 10:00:00.000,3180.0,3215.0,3102.3,3200.1,9998576.0,Trending stocks: Bajaj Finance shares rise nearly 1% - The Economic Times,"A total of 84,890 shares changed hands on the counter till 09:59AM (IST).",positive,neutral,0.6320754716981103,neutral,3.4267912772585665,positive
2020-07-16 22:50:00.000,3210.0,3323.0,3205.0,3320.0,8422889.0,Infosys soars 10% after Q1 showing; Sensex ends 419 points higher,"M&M, Nestle India, IndusInd Bank, Kotak Bank, HCL Tech, Bajaj Finance and Axis Bank were the other gainers, spurting up to 3.81 per cent",positive,positive,3.4267912772585665,positive,2.722013781969841,positive
2020-07-17 10:13:19.000,3210.0,3323.0,3205.0,3320.0,8422889.0,"Market in green: Tata Steel,ONGC, HCL Tech, Bajaj Finance among the gainers","Equity benchmark Sensex jumped over 200 points in early trade on Friday tracking gains in index-heavyweights HDFC twins, HUL, Reliance Industries and ICICI Bank.The 30-share BSE Sensex was trading 217.95 points, or 0.60 per cent, higher at 36,689.63. Similarly, the NSE Nifty rose 71.50 poi…",neutral,positive,3.4267912772585665,positive,2.722013781969841,positive
2020-07-17 10:20:50.000,3210.0,3323.0,3205.0,3320.0,8422889.0,"Sensex Jumps Over 200 Points in Early Trade, Nifty Tops 10,800 Tracking Gains","The 30-share BSE Sensex was trading 217.95 points, or 0.60 per cent, higher at 36,689.63. Similarly, the NSE Nifty rose 71.50 points, or 0.67 per cent, to 10,811.45. Tata Steel was the top gainer in the Sensex pack, rallying around 4 per cent, followed by ONGC, HCL Tech, Bajaj Finance, HUL, HDFC duo…",neutral,positive,3.4267912772585665,positive,2.722013781969841,positive
2020-07-17 14:35:00.000,3210.0,3323.0,3205.0,3320.0,8422889.0,Neutral Bajaj Finance; target of Rs 3000: Motilal Oswal,"Motilal Oswal recommended Neutral rating on Bajaj Finance with a target price of Rs 3000 in its research report dated July 07, 2020.",neutral,positive,3.4267912772585665,positive,2.722013781969841,positive
2020-07-17 15:50:33.000,3210.0,3323.0,3205.0,3320.0,8422889.0,Sensex ends above 37K level climbing 548 points,"Equity benchmark Sensex rallied 548 points higher breaching the key psychological 37,000 mark on Friday tracking gains in index-heavyweights ONGC, Reliance Industries, HDFC Bank, Titan, Bajaj Finance",positive,positive,3.4267912772585665,positive,2.722013781969841,positive
2020-07-19 20:56:00.000,3344.95,3453.95,3316.5,3436.0,10550687.0,Weak ahead in share market: 5 things you need to know for the upcoming week,"Stock Market Update for the upcoming week: Besides tracking global cues, investors will also await Q1 earnings from companies such as ACC, SBI Cards, Axis Bank, Bajaj Finance, Bajaj Finserv, HDFC Life, ICICI Prudential Life, Hindustan Unilever, SBI Life, among others",neutral,neutral,2.722013781969841,positive,-5.542857142857143,negative
2020-07-20 04:51:00.000,3344.95,3453.95,3316.5,3436.0,10550687.0,Monday’s Multi-bagger: Bajaj Finance becomes top gainer on Sensex ahead of Q1 result,"Leading the Sensex’s gainers list, Bajaj Finance ended at Rs3441.35 per piece, higher by 4.23%.",positive,positive,2.722013781969841,positive,-5.542857142857143,negative
2020-07-20 09:48:00.000,3344.95,3453.95,3316.5,3436.0,10550687.0,Trending stocks: Bajaj Finance shares rise over 1%,"A total of 86,903 shares changed hands on the counter till 09:46AM (IST).",positive,neutral,2.722013781969841,positive,-5.542857142857143,negative
2020-07-20 13:32:17.000,3500.0,3519.5,3218.65,3306.0,25958055.0,Bajaj Finance Ltd in demand,"Bajaj Finance Ltd is quoting at Rs 3371.25, up 2.12% on the day as on 12:59 IST on the NSE. The stock is up 3.84% in last one year as compared to a 3.19% fall in NIFTY and a 13.9% fall in the Nifty Financial Services index.",positive,positive,-5.542857142857143,negative,-2.108433734939759,negative
2020-07-20 15:45:44.000,3500.0,3519.5,3218.65,3306.0,25958055.0,"Sensex ends nearly 400 points higher, Nifty above 11,000; hearing in AGR case on","HCL Tech, Bajaj Finance, Bajaj Financial Services among major gainers on Sensex.On the Nifty, 30 stocks advanced, 19 declined. One was unchanged",positive,positive,-5.542857142857143,negative,-2.108433734939759,negative
2020-07-20 16:20:53.000,3500.0,3519.5,3218.65,3306.0,25958055.0,"Shrugging off Pandemic Concerns, Sensex Soars 399 Points; Nifty Tops 11,000-level","On the Sensex chart, Bajaj Finance, Bajaj Finserv, HCL Tech, Tech Mahindra, Infosys, HDFC Bank and ICICI Bank were among the prominent gainers.",neutral,positive,-5.542857142857143,negative,-2.108433734939759,negative
2020-07-20 16:22:00.000,3500.0,3519.5,3218.65,3306.0,25958055.0,Bajaj Finance Q1 results preview: Profit may dip up to 29% YoY on surge in provisions,"The non-banking finance major (NBFC) is slated to announce its financial results on July 21, Tuesday.",positive,neutral,-5.542857142857143,negative,-2.108433734939759,negative
2020-07-20 18:22:00.000,3500.0,3519.5,3218.65,3306.0,25958055.0,Corp FDs attractive for senior citizens despite cuts,"Over the last fortnight, AAA rated companies such as Mahindra Finance, Bajaj Finance, HDFC and LIC Housing Finance cut deposit rates by 30-50 basis points over all tenures.",positive,negative,-5.542857142857143,negative,-2.108433734939759,negative
2020-07-21 01:36:00.000,3500.0,3519.5,3218.65,3306.0,25958055.0,Bajaj Finance’s Q1 PAT drops to Rs962cr on higher provisions; new loans booked dives 76% yoy,"Assets under management (AUM) as of June 30, 2020 increased by 7% to Rs138,055cr from Rs128,898cr as of June 30, 2019.",negative,positive,-5.542857142857143,negative,-2.108433734939759,negative
2020-07-21 01:51:00.000,3500.0,3519.5,3218.65,3306.0,25958055.0,Bajaj Finance Q1FY21: Rahul Bajaj to step down as chairman; son Sanjiv Bajaj will head the NBFC,Rahul Bajaj will continue to hold his position as non-executive non-independent director at Bajaj Finance.,neutral,neutral,-5.542857142857143,negative,-2.108433734939759,negative
2020-07-21 02:20:00.000,3500.0,3519.5,3218.65,3306.0,25958055.0,Hero Motocorp make changes in management to drive growth in emerging biz climate,Rahul Bajaj will continue to hold his position as non-executive non-independent director at Bajaj Finance.,neutral,neutral,-5.542857142857143,negative,-2.108433734939759,negative
2020-07-21 05:30:00.000,3500.0,3519.5,3218.65,3306.0,25958055.0,BRIEF-India’s Bajaj Finance June-Quarter PAT Falls - Investing.com India,"The Financial News section features stock market news in addition to stories about bonds, forex, commodities and economic releases.",neutral,neutral,-5.542857142857143,negative,-2.108433734939759,negative
2020-07-21 05:30:00.000,3500.0,3519.5,3218.65,3306.0,25958055.0,BRIEF-Bajaj Finance Says Rahul Bajaj To Demit Office As Chairman - Investing.com India,"The Financial News section features stock market news in addition to stories about bonds, forex, commodities and economic releases.",neutral,neutral,-5.542857142857143,negative,-2.108433734939759,negative
2020-07-21 07:46:00.000,3500.0,3519.5,3218.65,3306.0,25958055.0,"Top stocks in focus: HUL, ACC, Bajaj Finance, Axis Bank, NTPC, Bajaj Finserv",Check out the stocks that will be in focus during trade today based on recent and latest news developments.,neutral,neutral,-5.542857142857143,negative,-2.108433734939759,negative
2020-07-21 08:05:00.000,3500.0,3519.5,3218.65,3306.0,25958055.0,"Stocks in the news: Axis Bank, HUL, Bajaj Finance, ACC, Vodafone Idea and SBI Card","DCM Shriram, IndiaMART InterMESH and Syngene International are slated to announce their June quarter earnings on Tuesday.",neutral,neutral,-5.542857142857143,negative,-2.108433734939759,negative
2020-07-21 08:09:49.000,3500.0,3519.5,3218.65,3306.0,25958055.0,"Stocks To Watch: Axis Bank, Bajaj Finance, Bajaj Finserv, Bombay Dyeing, HUL, HDFC Life",Here are the stocks to watch in trade today.,neutral,neutral,-5.542857142857143,negative,-2.108433734939759,negative
2020-07-21 08:11:00.000,3500.0,3519.5,3218.65,3306.0,25958055.0,A gap-up opening on the cards; key results eyed,"Local stocks are likely to open on a firm note tracking global cues. Trading of Nifty 50 index futures on the Singapore stock exchange indicates that the Nifty could rise 97 points at the opening bell. Hindustan Unilever, Axis Bank, Bajaj Finance,",neutral,positive,-5.542857142857143,negative,-2.108433734939759,negative
2020-07-21 08:12:00.000,3500.0,3519.5,3218.65,3306.0,25958055.0,"Wipro, ACC, NTPC in focus","Hindustan Unilever, Axis Bank, Bajaj Finance, Bajaj Finserv, HDFC Life Insurance Company, ICICI Prudential Life Insurance Company, SBI Life Insurance Company will declare their April to June quarterly results today, 21 June 2020.",neutral,neutral,-5.542857142857143,negative,-2.108433734939759,negative
2020-07-21 08:38:00.000,3500.0,3519.5,3218.65,3306.0,25958055.0,"Board Meetings Today: HUL, Bajaj Finance, Axis Bank, SBI Life and ICICI Pru Life",It makes sense to have a look at the corporate agendas for the days as announced to the stock exchanges.,neutral,neutral,-5.542857142857143,negative,-2.108433734939759,negative
2020-07-21 08:47:00.000,3500.0,3519.5,3218.65,3306.0,25958055.0,"Stocks to watch: InterGlobe Aviation, Bajaj Finance, HUL, Axis Bank, ACC",Heres a list of stocks that may remain in focus today,neutral,neutral,-5.542857142857143,negative,-2.108433734939759,negative
2020-07-21 08:52:00.000,3500.0,3519.5,3218.65,3306.0,25958055.0,"Important results today: Hindustan Unilever, Axis Bank, Bajaj Finance, Bajaj Finserv","ICICI Prudential Life Insurance Company, SBI Life Insurance Company, IndiaMART InterMESH, Crisil, DCM Shriram and Syngene International are slated to announce their June quarter earnings on Tuesday.",neutral,neutral,-5.542857142857143,negative,-2.108433734939759,negative
2020-07-21 08:58:35.000,3500.0,3519.5,3218.65,3306.0,25958055.0,"Stocks in focus: RIL, Airtel, Vodafone Idea, Britannia, Jubilant Life Sciences, HUL, Axis Bank, Bajaj Finance","Hindustan Unilever, Axis Bank, Bajaj Finance, ICICI Prudential Life, Bajaj Finserv, Crisil, DCM Shriram, IndiaMART InterMESH and Syngene International are slated to announce their June quarter earnings later in the day today",neutral,neutral,-5.542857142857143,negative,-2.108433734939759,negative
2020-07-21 09:10:26.000,3500.0,3519.5,3218.65,3306.0,25958055.0,Companies and stocks to watch out for today: July 21,"Results action: Eyes on life insurers, HZL, Axis Bank, Bajaj FinanceAround 40 companies will declare their quarterly numbers today. Among them are Axis Bank, Bajaj Finance, Bajaj Finserv, Hindustan Co",neutral,neutral,-5.542857142857143,negative,-2.108433734939759,negative
2020-07-21 11:37:00.000,3500.0,3519.5,3218.65,3306.0,25958055.0,"Bajaj Finance, HDFC Bank, ACC among 50 stocks look set to rally, suggests MACD","Many of these stocks have also been witnessing strong trading volumes of late, lending credence to the emerging trend.",positive,positive,-5.542857142857143,negative,-2.108433734939759,negative
2020-07-21 11:50:00.000,3500.0,3519.5,3218.65,3306.0,25958055.0,The rise of GenNext Champions: How to identify quality smallcaps?,"Powerful well-run franchises like Asian Paints, HDFC Bank, Nestle, Titan and Bajaj Finance have all performed way better than their rivals.",neutral,positive,-5.542857142857143,negative,-2.108433734939759,negative
2020-07-21 12:29:00.000,3320.0,3340.0,3193.6,3250.0,17067013.0,Bajaj Finance Q1 PAT slips 20% to Rs 962 cr,The NBFCs consolidated net profit tumbled 20% to Rs 962.32 crore in Q1 June 2020 (Q1FY21) from Rs 1195.25 crore in Q1 June 2019 (Q1FY20).,neutral,negative,-2.108433734939759,negative,1.3833384568090994,positive
2020-07-21 12:32:00.000,3320.0,3340.0,3193.6,3250.0,17067013.0,Bajaj Finance records a consolidated net profit of ~Rs962cr in Q1FY21,"Net interest income stood at Rs4,150.57cr for Q1FY21 that increased by 12.4% yoy.",neutral,positive,-2.108433734939759,negative,1.3833384568090994,positive
2020-07-21 12:42:00.000,3320.0,3340.0,3193.6,3250.0,17067013.0,"Bajaj Finance Q1 results: Profit falls 19% YoY to Rs 962 crore; firm provides further Rs 1,450 crore for Covid",The company said its business operations in Q1 FY21 were considerably impacted due to Covid-19 pandemic and the consequent lockdown which remained in force for the most of the quarter.,neutral,negative,-2.108433734939759,negative,1.3833384568090994,positive
2020-07-21 12:42:00.000,3320.0,3340.0,3193.6,3250.0,17067013.0,Bajaj Finance standalone net profit declines 22.69% in the June 2020 quarter,Sales rise 11.72% to Rs 5887.36 crore,negative,positive,-2.108433734939759,negative,1.3833384568090994,positive
2020-07-21 12:48:00.000,3320.0,3340.0,3193.6,3250.0,17067013.0,Bajaj Finance consolidated net profit declines 19.49% in the June 2020 quarter,Sales rise 14.93% to Rs 6634.93 crore,negative,positive,-2.108433734939759,negative,1.3833384568090994,positive
2020-07-21 14:11:00.000,3320.0,3340.0,3193.6,3250.0,17067013.0,"Bajaj Finance PAT a marginal miss, consolidated revenue better than estimates: Geojit",Top bank and NBFC managements appear quite confident that moratorium is not going to impact their performance.,positive,neutral,-2.108433734939759,negative,1.3833384568090994,positive
2020-07-21 14:16:00.000,3320.0,3340.0,3193.6,3250.0,17067013.0,Trending stocks: Bajaj Finance shares down nearly 4%,"A total of 844,747 shares changed hands on the counter till 02:11PM (IST).",negative,neutral,-2.108433734939759,negative,1.3833384568090994,positive
2020-07-21 14:20:00.000,3320.0,3340.0,3193.6,3250.0,17067013.0,Rahul Bajaj to step down as Bajaj Finance chairman; stock drops 6%,Rahul Bajaj will be replaced by his son Sanjiv Bajaj who is currently the vice chairman of the company from August 1.,negative,neutral,-2.108433734939759,negative,1.3833384568090994,positive
2020-07-21 14:27:00.000,3320.0,3340.0,3193.6,3250.0,17067013.0,Rahul Bajaj steps down as Bajaj Finance’s chairman; stock ends 4% lower,"The board has appointed Sanjiv Bajaj, currently the Vice Chairman of the Company, as Non-Executive Chairman of the Company with effect from August 1, 2020",negative,neutral,-2.108433734939759,negative,1.3833384568090994,positive
2020-07-21 14:58:45.000,3320.0,3340.0,3193.6,3250.0,17067013.0,Bajaj Finance Q1 Results: Profit Falls On Additional Contingency Provisions Amid Covid-19,"Bajaj Finance has made additional contingency provisions of Rs1,450 crore to mitigate virus-related impact, company says.",neutral,neutral,-2.108433734939759,negative,1.3833384568090994,positive
2020-07-21 15:04:05.000,3320.0,3340.0,3193.6,3250.0,17067013.0,Sterlite Technologies Ltd leads losers in ‘A’ group,"Vodafone Idea Ltd, Bajaj Finance Ltd, IRB Infrastructure Developers Ltd and Venkys (India) Ltd are among the other losers in the BSEs A group today, 21 July 2020.",positive,negative,-2.108433734939759,negative,1.3833384568090994,positive
2020-07-21 15:10:03.000,3320.0,3340.0,3193.6,3250.0,17067013.0,Rahul Bajaj steps down as Chairman of Bajaj Finance,"He will be succeeded by Sanjiv Bajaj, currently Vice Chairman, Bajaj Finance said in a regulatory filing on Tuesday",neutral,neutral,-2.108433734939759,negative,1.3833384568090994,positive
2020-07-21 15:14:00.000,3320.0,3340.0,3193.6,3250.0,17067013.0,Bajaj Finance consolidated Q1 pre-tax profit down 29% on Covid provisioning,"Net profit down 19 per cent to Rs 962 crore from Rs 1,195 crore in Q1FY20",negative,negative,-2.108433734939759,negative,1.3833384568090994,positive
