date,open,high,low,close,volume,title,description,title_sentiment,desc_sentiment,daily_change_pct,market_sentiment,next_day_change_pct,next_day_sentiment
2021-01-04 17:13:00.000,394.0,403.9,390.4,401.9,11714896.0,"Diversification, deposit growth put IDFC First ahead of Bandhan Bank",Both the banks have relied on inorganic options for growth and diversification,positive,neutral,2.005076142131974,positive,-1.745265503156334,negative
2021-01-05 19:34:16.000,403.95,409.25,394.6,396.9,9439477.0,Bandhan Bank to provide salary accounts for Indian Army personnel,Bandhan Bank has signed a Memorandum of Understanding with the Indian Army for Bandhan Bank Shaurya salary account.Services under the account will be offered to serving personnel of the Army through t,neutral,neutral,-1.745265503156334,negative,-0.3812569179682724,neutral
2021-01-06 05:30:00.000,403.95,409.25,394.6,396.9,9439477.0,BRIEF-Bandhan Bank Says Loans & Advances Up 23% YoY At End-Dec - Investing.com India,"The Financial News section features stock market news in addition to stories about bonds, forex, commodities and economic releases.",neutral,neutral,-1.745265503156334,negative,-0.3812569179682724,neutral
2021-01-06 18:21:13.000,406.55,411.0,401.4,405.0,12456269.0,Bandhan Bank records 23% growth in Q3 advances,"Bandhan Bank has registered a 23 per cent growth in advances at around ₹80,255 crore for the quarter ended December 31, 2020, compared to ₹65,456 crore in the same period last year.In a notification t",positive,positive,-0.3812569179682724,neutral,1.994891132465634,positive
2021-01-06 20:16:00.000,406.55,411.0,401.4,405.0,12456269.0,"Private banks report healthy deposit accretions, sluggish advances growth in Q3","Microlender-turned-universal bank Bandhan Bank was the only one which showed a surge in loan book, which grew 23 per cent on an annual basis to Rs 80,255 crore, while in case of IndusInd Bank and IDFC First Bank, the growth has been marginal.",negative,positive,-0.3812569179682724,neutral,1.994891132465634,positive
2021-01-07 06:47:00.000,406.55,411.0,401.4,405.0,12456269.0,"Bandhan Bank records 30% yoy rise in Q3FY21 deposits; Loan book robust to Rs80,255cr; Stock gains 3%","Total deposits zoomed by 30% to Rs71,188cr in the quarter under review against Rs54,908cr in the similar quarter of the previous year.",positive,neutral,-0.3812569179682724,neutral,1.994891132465634,positive
2021-01-07 07:37:00.000,406.55,411.0,401.4,405.0,12456269.0,"Stocks in the news: Bandhan Bank, Maruti Suzuki, PNC Infratech, TCS and Lupin",CN Infrabuild sold shares of PNC Infratech worth over Rs 276 crore through an open market transaction.,neutral,neutral,-0.3812569179682724,neutral,1.994891132465634,positive
2021-01-07 08:22:00.000,406.55,411.0,401.4,405.0,12456269.0,"Stocks to watch: Bandhan Bank, Sobha, Lupin, Maruti Suzuki, CEAT, Wendt","Bandhan Bank said its loans and advances grew by 23 per cent YoY to Rs 80,255 crore during the third quarter of the current fiscal",neutral,positive,-0.3812569179682724,neutral,1.994891132465634,positive
2021-01-07 08:22:01.000,406.55,411.0,401.4,405.0,12456269.0,"Stocks To Watch: Bandhan Bank, Future Consumer, Lupin, NMDC",Here are the stocks to watch in trade today.,neutral,neutral,-0.3812569179682724,neutral,1.994891132465634,positive
2021-01-07 09:03:00.000,406.55,411.0,401.4,405.0,12456269.0,"Stocks in focus: Dixon Tech, Titan, Bandhan Bank, and more","Here are the top stocks that are likely to be in focus in today’s trading. Dixon Tech, Titan, Bandhan Bank, NMDC and Sobha.",neutral,neutral,-0.3812569179682724,neutral,1.994891132465634,positive
2021-01-07 09:16:00.000,406.55,411.0,401.4,405.0,12456269.0,Bandhan Bank gains after strong Q3 business update,"Bandhan Bank rose 3.05% to Rs 408.25 after the banks total deposits jumped 30% to Rs 71,188 crore in Q3 FY21 as against Rs 54,908 crore in Q3 FY20.",positive,positive,-0.3812569179682724,neutral,1.994891132465634,positive
2021-01-07 09:38:00.000,406.55,411.0,401.4,405.0,12456269.0,Bandhan Bank rises on 23% jump in Q3 advances,"Total deposits during the quarter advanced 30 per cent to Rs 71,188 crore as against Rs 54,908 crore in the corresponding period last year, the lender said in a statement.",positive,positive,-0.3812569179682724,neutral,1.994891132465634,positive
2021-01-07 09:41:00.000,406.55,411.0,401.4,405.0,12456269.0,"Stocks in news: Bandhan Bank, Lupin, TCS, SBI, Wipro, Maruti","Stocks to watch today on January 7: Bandhan Bank, Lupin, TCS, SBI, Wipro, Maruti among others are the top stocks to watch out for in Thursday’s trading session",neutral,neutral,-0.3812569179682724,neutral,1.994891132465634,positive
2021-01-07 16:39:00.000,411.05,424.0,409.4,419.25,16704169.0,Bandhan Bank share rises 3% as Q3 advances grow 23%,"Market capitalisation of the lender stood at Rs 65,220.39 crore as of today’s session",positive,neutral,1.994891132465634,positive,-3.965638973876198,negative
2021-01-08 08:08:00.000,411.05,424.0,409.4,419.25,16704169.0,"Nifty Bank holds steady amid Q3 provisional data; Bandhan Bank, HDFC Bank keep the index higher","On the index, 3 scrips advanced and 9 scrips declined.",positive,neutral,1.994891132465634,positive,-3.965638973876198,negative
2021-01-08 12:28:17.000,411.05,424.0,409.4,419.25,16704169.0,Bandhan Bank Stock Gains Most Among Peers After BofA Initiates Coverage,Bandhan Bank is the top gainer on the Nifty Bank Index.,neutral,positive,1.994891132465634,positive,-3.965638973876198,negative
2021-01-08 15:20:30.000,411.05,424.0,409.4,419.25,16704169.0,Buy Bandhan Bank; Target Of Rs 425: Emkay Global Financial,"Emkay Global Financial is bullish on Bandhan Bank has recommended buy rating on the stock with a target price of Rs 425 in its research report dated January 06, 2020.",neutral,positive,1.994891132465634,positive,-3.965638973876198,negative
2021-01-12 15:04:04.000,395.3,395.45,371.0,375.65,21738648.0,Rail Vikas Nigam Ltd leads losers in ‘A’ group,"Adani Green Energy Ltd, Astral Poly Technik Ltd, Bandhan Bank Ltd and Asian Paints Ltd are among the other losers in the BSEs A group today, 12 January 2021.",positive,negative,-4.970908171009369,negative,0.0266737796745859,neutral
2021-01-12 17:07:00.000,395.3,395.45,371.0,375.65,21738648.0,"Nifty Bank sheds 100 pts as RBI warns of double-digit rise in NPA by Sept 2021; Bandhan Bank, Kotak Bank drag",Private banks saw most selling pressure compared to the state-owned banks.,positive,negative,-4.970908171009369,negative,0.0266737796745859,neutral
2021-01-14 09:41:00.000,374.9,379.8,369.3,375.0,12068371.0,"SBI MF dumps Bandhan Bank and metal biggies, bets on debutants",Analysts at the fund house believe the market has run up quite a bit and any more uptick will require a solid financial performance from India Inc.,neutral,positive,0.0266737796745859,neutral,-1.9813829787234007,negative
2021-01-19 15:46:41.000,362.95,367.3,357.1,359.3,14458883.0,Bandhan Bank Q3 Net Profit Seen Up 11% YoY To Rs. 813 Cr: Arihant Capital,"Net Interest Income (NII) is expected to increase by 17 percent Y-o-Y (down 6 percent Q-o-Q) to Rs. 1,802 crore, according to Arihant Capital.",neutral,positive,-1.0056481609036996,negative,-5.356898205233597,negative
2021-01-19 19:25:14.000,362.95,367.3,357.1,359.3,14458883.0,Bandhan Bank Q3 Net Profit Seen Up 27.5% YoY To Rs. 931.9 Cr: Motilal Oswal,"Net Interest Income (NII) is expected to increase by 27.3 percent Y-o-Y (up 2 percent Q-o-Q) to Rs. 1,961.2 crore, according to Motilal Oswal.",neutral,positive,-1.0056481609036996,negative,-5.356898205233597,negative
2021-01-20 18:41:48.000,364.95,372.55,335.0,345.4,34373388.0,Bandhan Bank Q3 Net Profit May Dip 5% YoY To Rs. 694.5 Cr: Emkay,"Net Interest Income (NII) is expected to increase by 29 percent Y-o-Y (up 3.3 percent Q-o-Q) to Rs. 1,986.9 crore, according to Emkay.",neutral,positive,-5.356898205233597,negative,-5.420420420420424,negative
2021-01-20 19:51:51.000,364.95,372.55,335.0,345.4,34373388.0,Bandhan Bank Q3 Net Profit Seen Up 3.3% YoY To Rs. 755.1 Cr: ICICI Direct,"Net Interest Income (NII) is expected to increase by 28.8 percent Y-o-Y (up 3.2 percent Q-o-Q) to Rs. 1,984 crore, according to ICICI Direct.",neutral,positive,-5.356898205233597,negative,-5.420420420420424,negative
2021-01-21 07:57:00.000,364.95,372.55,335.0,345.4,34373388.0,"Stocks in the news: RIL, Future Retail, Axis Bank, Bajaj Finance, Asian Paints & Bajaj Auto","SBI Card, Bandhan Bank, Biocon, Mphasis, Kajaria Ceramics, MCX and Mphasis are some of the companies which will announce their Q3 results today.",neutral,neutral,-5.356898205233597,negative,-5.420420420420424,negative
2021-01-21 15:13:00.000,333.0,336.2,311.85,314.95,35373296.0,"Nifty Bank sheds 500 pts; PSU Bank top laggards; Bandhan Bank, BOB dips 5-6%","Nifty PSU Bank plunged by 3.64% at 1,908.60. While Nifty Private Bank slipped by 1.16% at 17,593.70.",neutral,negative,-5.420420420420424,negative,-3.203125,negative
2021-01-21 15:31:00.000,333.0,336.2,311.85,314.95,35373296.0,Markets close lower; Financial stocks underperform,"Financial stocks witnessed selling pressure with stocks like SBI, Kotak Bank & Bandhan Bank leading the laggards.",negative,negative,-5.420420420420424,negative,-3.203125,negative
2021-01-21 16:09:40.000,333.0,336.2,311.85,314.95,35373296.0,Bandhan Bank Q3 Results: Net Profit Declines 13.5% On Higher Provisions,The private lender’s net profit fell 13.5% year-on-year to Rs 632.6 crore in the quarter ended December.,neutral,negative,-5.420420420420424,negative,-3.203125,negative
2021-01-21 16:19:00.000,333.0,336.2,311.85,314.95,35373296.0,Bandhan Bank standalone net profit declines 13.47% in the December 2020 quarter,Total Operating Income rise 21.72% to Rs 3307.84 crore,negative,positive,-5.420420420420424,negative,-3.203125,negative
2021-01-21 16:34:20.000,333.0,336.2,311.85,314.95,35373296.0,Bandhan Bank Q3 Profit Falls 14% At Rs 633 Crore,The bank had posted a net profit of Rs 731 crore for the same period of the previous fiscal year.,neutral,positive,-5.420420420420424,negative,-3.203125,negative
2021-01-21 16:36:00.000,333.0,336.2,311.85,314.95,35373296.0,Bandhan Bank’s Q3 net profit down 13.5% on higher Covid provisioning,"The lender has made provisioning to the tune of Rs 1,068 crore in Q3FY21, of which Rs 1,000 crore is covid-related",negative,neutral,-5.420420420420424,negative,-3.203125,negative
2021-01-21 17:21:41.000,333.0,336.2,311.85,314.95,35373296.0,Bandhan Bank net profit declines 13 per cent to Rs 633 cr,"Further provision of Rs 1,000 crore made on standard advances against the potential impact of Covid-19",negative,neutral,-5.420420420420424,negative,-3.203125,negative
2021-01-21 19:05:03.000,333.0,336.2,311.85,314.95,35373296.0,Bandhan Bank posts 13% decline in net profit at ₹633 cr,"Bandhan Bank has registered a 13 per cent decline in net profit at ₹633 crore for the quarter ended December 31, 2020, against ₹731 crore in the same period last year on the back of higher provisionin",negative,negative,-5.420420420420424,negative,-3.203125,negative
2021-01-21 19:36:00.000,333.0,336.2,311.85,314.95,35373296.0,Bandhan Bank Q3 results: Net profit falls 13% on higher provisions,The Kolkata-based private lender reported its net profit at Rs 633 crore as against Rs 731 crore for the year ago period.,negative,negative,-5.420420420420424,negative,-3.203125,negative
2021-01-22 01:06:16.000,333.0,336.2,311.85,314.95,35373296.0,Results: Bandhan Bank Q3 profit slips 14 %; flags concerns over Assam law on MFIs,"Micro loans-focussed Bandhan Bank on Thursday reported 14 per cent decline in December quarter net profit at Rs 632.59 crore as provisions more than trebled.The bank also flagged concerns over the impact of a recent law on MFI loans in poll-bound Assam, which constitutes 8 per cent of its …",negative,negative,-5.420420420420424,negative,-3.203125,negative
2021-01-22 08:28:22.000,333.0,336.2,311.85,314.95,35373296.0,Bandhan Bank Q3 profit down 13.5% on Covid provisioning,"The bank’s total seposits increased by 29.6% y-o-y to Rs 71,188 crore as on December 31, 2020 as compared to Rs 54,908.5 crore as on December 31, 2019 while total advances grew by 22.6% y-o-y to Rs 80,255 crore against Rs 65,456 crore in the year-ago period.",negative,positive,-5.420420420420424,negative,-3.203125,negative
2021-01-22 08:48:30.000,333.0,336.2,311.85,314.95,35373296.0,"Interview | Collections in Assam to see short-term challenges, says Bandhan Bank MD Chandra Shekhar Ghosh","In an interview with Mithun Dasgupta, Ghosh says the bank’s gross NPA ratio is not likely to rise further.",neutral,positive,-5.420420420420424,negative,-3.203125,negative
2021-01-22 09:33:56.000,333.0,336.2,311.85,314.95,35373296.0,Bandhan Bank Q3 Review - Asset Quality Deteriorates; Assam Woes Hit Collections: Motilal Oswal,Bandhan Bank Q3 Review - Asset Quality Deteriorates; Collection Efficiency In Assam Witnesses A Sharp Decline: Motilal Oswal,neutral,neutral,-5.420420420420424,negative,-3.203125,negative
2021-01-22 09:50:37.000,333.0,336.2,311.85,314.95,35373296.0,Bandhan Bank Ltd Slips 5.1%,Bandhan Bank Ltd has lost 18.89% over last one month compared to 5.28% gain in S&P BSE BANKEX index and 6.37% rise in the SENSEX,neutral,negative,-5.420420420420424,negative,-3.203125,negative
2021-01-22 09:51:00.000,333.0,336.2,311.85,314.95,35373296.0,"Neutral on Bandhan Bank, target price Rs 370: Motilal Oswal","Bandhan Bank Ltd., incorporated in the year 2014, is a banking company (having a market cap of Rs 52796.30 Crore).",neutral,neutral,-5.420420420420424,negative,-3.203125,negative
2021-01-22 09:52:00.000,333.0,336.2,311.85,314.95,35373296.0,Bandhan Bank’s business grows 26% to Rs1.51 lakh crore in Q3FY21; stock dips 4% in trade today,"Total customer base stands at 2.25 crore. Total deposits grew 30% yoy to Rs71,188cr. Loan book grew 23% yoy to Rs80,255cr.",positive,positive,-5.420420420420424,negative,-3.203125,negative
2021-01-22 11:37:00.000,333.0,336.2,311.85,314.95,35373296.0,Bandhan Bank: Problem of portfolio concentration tightens grip on lender,"Dependence on microfinance loans for growth is steadily increasing, which poses a risk in present environment",positive,negative,-5.420420420420424,negative,-3.203125,negative
2021-01-22 12:02:00.000,333.0,336.2,311.85,314.95,35373296.0,Bandhan Bank sinks 11% in 2 days on disappointing December quarter results,Bandhan Bank reported a sharp deterioration in asset quality trends with pro-forma gross non-performing assets (GNPA) ratio increasing to 7.1 per cent,negative,negative,-5.420420420420424,negative,-3.203125,negative
2021-01-22 13:06:00.000,333.0,336.2,311.85,314.95,35373296.0,Nifty Bank sheds 800 pts on broad-based selling amid earnings season; Bandhan Bank dives 8% after Q3,"Nifty PSU Bank fell by 2.53% at 1,867.50 and Nifty Private Bank slumped by 2.6% at 17,164.35.",neutral,negative,-5.420420420420424,negative,-3.203125,negative
2021-01-22 14:57:00.000,333.0,336.2,311.85,314.95,35373296.0,"Bandhan Bank’s NPA shocker nutmegs investors, but stock will survive","The private sector lender reported a 3.6 times jump in provisions on year to Rs 1,068 crore in the December quarter.",negative,positive,-5.420420420420424,negative,-3.203125,negative
2021-01-22 15:04:24.000,333.0,336.2,311.85,314.95,35373296.0,Steel Authority of India Ltd leads losers in ‘A’ group,"Biocon Ltd, Bandhan Bank Ltd, Tata Steel Ltd Partly Paid Up and RBL Bank Ltd are among the other losers in the BSE’s ‘A’ group today, 22 January 2021.",negative,negative,-5.420420420420424,negative,-3.203125,negative
2021-01-22 18:05:00.000,333.0,336.2,311.85,314.95,35373296.0,"Portfolio concentration weighs on Bandhan Bank, stock down 13% post results","Dependence on microfinance loans for growth is steadily increasing, which poses a risk in present environment",negative,negative,-5.420420420420424,negative,-3.203125,negative
2021-01-22 18:32:32.000,333.0,336.2,311.85,314.95,35373296.0,"Share Prices of Bandhan Bank Declines 26.85 Points, Know the Reason Here",The share price of Bandhan Bank declined by 26.,neutral,negative,-5.420420420420424,negative,-3.203125,negative
2021-01-22 19:19:15.000,333.0,336.2,311.85,314.95,35373296.0,Assam Microfinance Bill May Give A Bigger Jolt To Banks Than Pure-play MFIs,"Bandhan Bank is among the banks which have felt the heat of the Assam Microfinance Bill. In the third quarter, Bandhan’s proforma gross non-performing assets grew to 7.12 percent, a good chunk of which has come from delayed microloan payments.",neutral,positive,-5.420420420420424,negative,-3.203125,negative
2021-01-22 21:49:00.000,333.0,336.2,311.85,314.95,35373296.0,"Collection efficiency going up in every state other than Assam: Chandra Shekhar Ghosh, Bandhan Bank","Bandhan Bank gross NPA ratio has improved. NIM is sustainable and will hover between 7.9-8.3%, says Chandra Shekhar Ghosh, Chairman & MD, Bandhan Bank.",positive,positive,-5.420420420420424,negative,-3.203125,negative
2021-01-24 15:14:00.000,320.0,320.0,301.5,309.75,19061486.0,"The week that was: Consumer discretionary stocks rally; SAIL, Bandhan Bank plunge","In the BSE 500 index, 351 stocks closed the week in red led by SAIL and Bandhan Bank.",positive,neutral,-3.203125,negative,-1.662094561884794,negative
2021-01-27 13:50:13.000,299.9,313.9,297.0,311.9,18654377.0,Bandhan Bank Ltd down for fifth straight session,"Bandhan Bank Ltd is quoting at Rs 308, down 0.5% on the day as on 13:19 IST on the NSE. The stock tumbled 33.38% in last one year as compared to a 16.73% rally in NIFTY and a 0.23% fall in the Nifty Bank index.",negative,negative,4.001333777925976,positive,-1.66034155597723,negative
2021-01-28 14:59:06.000,316.2,318.2,306.5,310.95,14857278.0,Hold Bandhan Bank; Target Of Rs 370: ICICI Direct,"ICICI Direct recommended hold rating on Bandhan Bank with a target price of Rs 370 in its research report dated January 22, 2021.",neutral,positive,-1.66034155597723,negative,4.516129032258064,positive
2021-01-28 15:50:28.000,316.2,318.2,306.5,310.95,14857278.0,Buy Bandhan Bank; Target Of Rs 406: HDFC Securities,"HDFC Securities is bullish on Bandhan Bank has recommended buy rating on the stock with a target price of Rs 406 in its research report dated January 22, 2021.",neutral,positive,-1.66034155597723,negative,4.516129032258064,positive
2021-01-28 21:53:39.000,316.2,318.2,306.5,310.95,14857278.0,FPI interest in private banks on the rise,"Bandhan Bank, YES Bank, RBL, Axis Bank see record inflows from foreign portfolio investors",positive,positive,-1.66034155597723,negative,4.516129032258064,positive
2021-02-01 07:03:25.000,310.0,325.9,304.9,324.0,16082622.0,Hot Stocks | Bandhan Bank And Infosys Are Two Trading Ideas For The Budget Month,"Nifty is possibly headed towards the strong support zone of 20-week EMA and 89-day EMA of 13,200 – 13,000.",neutral,positive,4.516129032258064,positive,2.7575757575757645,positive
2021-02-02 15:02:56.000,347.0,347.65,337.15,342.8,12475468.0,"HDFC Q3 Profit Declines 65.1% To Rs 2,926 Crore; Net Interest Income Rises 26%",The profit in Q3FY20 had included proceeds from stake sale in Gruh Finance which was merged with Bandhan Bank in October 2019.,neutral,neutral,-1.2103746397694493,negative,2.633136094674549,positive
2021-02-02 17:15:00.000,347.0,347.65,337.15,342.8,12475468.0,HDFC’s adjusted net profit up 27% in Q3,"Figure not comparable with Q3FY20, when it booked a fair value gain of over Rs 9,000 crore due to merger of Gruh Finance with Bandhan Bank",positive,neutral,-1.2103746397694493,negative,2.633136094674549,positive
2021-02-02 21:11:50.000,347.0,347.65,337.15,342.8,12475468.0,Neutral Bandhan Bank; Target Of Rs 370: Motilal Oswal,"Motilal Oswal recommended Neutral rating on Bandhan Bank with a target price of Rs 370 in its research report dated January 21, 2021.",neutral,positive,-1.2103746397694493,negative,2.633136094674549,positive
2021-02-03 13:31:35.000,338.0,352.0,335.15,346.9,14401829.0,Bandhan Bank Ltd rises for third consecutive session,"Bandhan Bank Ltd is quoting at Rs 343.4, up 1.19% on the day as on 12:49 IST on the NSE. The stock is down 21.58% in last one year as compared to a 23.82% spurt in NIFTY and a 13.06% spurt in the Nifty Bank index.",positive,positive,2.633136094674549,positive,-5.714285714285714,negative
2021-02-04 08:45:00.000,338.0,352.0,335.15,346.9,14401829.0,Bandhan Bank’s Head of the Housing Finance vertical Sudhin Choksey to retire on Feb 15 after Gruh Finance merger,"Suresh Iyer, currently Head of Operations (Housing Finance) will succeed Choksey as the Head- Housing Finance, Bandhan Bank.",neutral,positive,2.633136094674549,positive,-5.714285714285714,negative
2021-02-04 09:43:00.000,338.0,352.0,335.15,346.9,14401829.0,"Stocks in news: Airtel, Bajaj Consumer Care, Adani Transmission, Bandhan Bank, Hero MotoCorp","Stocks to watch today on February 4: Airtel, Bajaj Consumer Care, Adani Transmission, Bandhan Bank, Hero MotoCorp among others are the top stocks to watch out for in Thursday’s trading session",neutral,neutral,2.633136094674549,positive,-5.714285714285714,negative
2021-02-04 11:39:00.000,338.0,352.0,335.15,346.9,14401829.0,Bandhan Bank adds over 13% in four days,"Bandhan Bank rose 2.10% to Rs 349.95, extending gains for fourth day.",positive,positive,2.633136094674549,positive,-5.714285714285714,negative
2021-02-04 13:15:14.000,350.0,357.0,328.0,330.0,23612807.0,"Bank Nifty Hits Record 35,000, Up Over 13% Since Budget Day; BoB, PNB, Kotak Bank Lead","Federal Bank, Bank of Baroda, which jumped 4 percent each, are pushing the index higher along with PNB, Kotak Mahindra Bank, IDFC First Bank, Bandhan Bank and State Bank of India.",neutral,positive,-5.714285714285714,negative,-0.0151057401812723,neutral
2021-02-09 10:56:58.000,332.4,332.4,323.55,328.75,7615586.0,Matnic Finvest pledges part of Kellton Tech shares,"Matnic Finvest LLP, which holds a promoter share of 44.10 per cent in Kellton Tech Solutions, has pledged 24 lakh shares as collateral with Bandhan Bank on February 3, 2021.The firm informed the Bomba",neutral,positive,-1.0980746089049271,negative,1.1212121212121178,positive
2021-02-10 11:45:57.000,330.0,334.45,321.25,333.7,8278047.0,SRF And Bandhan Bank Among Six Buying Ideas By Various Brokerages,Brokerages are betting on these six stocks for an upside upto 52 percent.,neutral,positive,1.1212121212121178,positive,-0.1049317943336899,neutral
2021-02-12 13:31:12.000,333.1,341.95,333.1,338.0,9436887.0,Bandhan Bank Ltd jumps around 2%,"Bandhan Bank Ltd is quoting at Rs 339.5, up 2.06% on the day as on 12:49 IST on the NSE. The stock is down 24.9% in last one year as compared to a 24.88% gain in NIFTY and a 15.76% gain in the Nifty Bank index.",positive,positive,1.4710297208045562,positive,-0.5270092226613999,neutral
2021-02-16 11:34:12.000,338.95,352.6,336.5,351.5,13106591.0,"Biocon, Bandhan Bank Among 11 Stocks That Brokerages Are Betting On For Double-digit Return","SBI Life Insurance, South Indian Bank, Mphasis and HDFC Life Insurance also figure on the list",neutral,neutral,3.702611004572949,positive,-0.7571428571428507,neutral
2021-02-17 09:07:04.000,350.0,353.8,343.65,347.35,10518731.0,"Top Buy And Sell Ideas By Sudarshan Sukhani, Mitessh Thakkar For Short Term","Mitessh Thakkar of mitesshthakkar.com suggests buying Bandhan Bank with a stop loss of Rs 344, target at Rs 370 and Biocon with a stop loss of Rs 412, target at Rs 435.",neutral,neutral,-0.7571428571428507,neutral,-0.7751937984496091,neutral
2021-02-19 10:35:00.000,344.7,349.8,335.0,338.0,7191798.0,Bandhan Bank allots 1.16 lakh equity shares under EOSP,"Post allotment, the issued and paid-up equity share capital of the Bank stands increased from
Rs. 1610,46,69,570/- comprising of 161,04,66,957 equity shares of Rs. 10/- each fully paid-up
to Rs. 1610,58,33,670/- comprising of 161,05,83,367 equity",neutral,positive,-1.943719176095152,negative,-2.9394299287411028,negative
2021-03-03 12:09:00.000,350.0,362.65,346.0,356.0,11952133.0,Stock market news: Bandhan Bank shares rises nearly 3%,Shares of Bandhan Bank Ltd. traded 2.86 per cent up in trade at 12:05PM on Wednesday.,positive,positive,1.7142857142857144,positive,-1.448863636363643,negative
2021-03-04 13:31:20.000,352.0,354.4,343.05,346.9,5671072.0,Bandhan Bank Ltd in demand,"Bandhan Bank Ltd is quoting at Rs 358.7, up 1.07% on the day as on 12:49 IST on the NSE. The stock is down 15.24% in last one year as compared to a 34.75% jump in NIFTY and a 25.76% jump in the Nifty Bank index.",positive,positive,-1.448863636363643,negative,0.2849002849002849,neutral
2021-03-09 08:08:00.000,354.0,357.9,345.8,351.1,5204369.0,"Top trading ideas by Anand Rathi Shares: Buy Bandhan Bank, HCL Tech","At current juncture, Bandhan Bank’s stock is hovering just above the clusters of moving averages on daily chart",neutral,positive,-0.8192090395480162,neutral,-1.4265536723163874,negative
2021-03-15 11:51:10.000,348.95,350.0,330.0,340.35,9251646.0,"D-Street Buzz: Banks & Financials Fall; HDFC Twins, Bajaj Finance, ICICI Bank Among Top Drags","Federal Bank, Axis Bank and Bandhan Bank were down over 4 percent each followed by IDFC First Bank, ICICI Bank, State Bank of India and RBL Bank.",neutral,negative,-2.464536466542475,negative,-1.3818181818181818,negative
2021-03-15 12:02:26.000,343.75,345.0,334.5,339.0,5212586.0,"Sensex down by 800 points; Nifty slips: Shares of Federal Bank, Bandhan Bank, Axis Bank, RBL Bank fall over 4%","Asian market has been giving mixed reactions ahead of the Federal Reserve’s meeting. In the case of India, the market is trading in red. At 11.30 am, Sensex was down by 1.53 per cent or 753.16 points, at 50,050.07 points. Nifty was trading at 14,813.67 points, down by 1.40 per cent or 216 points …",negative,negative,-1.3818181818181818,negative,-1.2241887905604651,negative
