date,open,high,low,close,volume,title,description,title_sentiment,desc_sentiment,daily_change_pct,market_sentiment,next_day_change_pct,next_day_sentiment
2022-03-16 15:59:09.000,298.0,303.3,296.0,302.2,11578983.0,"Bandhan Bank extends rally for second day, Nomura upgrade comes as a boost","Despite a weakening macro environment, Nomura thinks micro factors remain intact for microfinance institutions and sees upside risks to earnings estimates (around 10 percent ahead on consensus PAT for FY23/24)",positive,positive,1.4093959731543586,positive,-3.0343007915567246,negative
2022-03-24 19:20:52.000,300.1,306.65,297.4,299.75,12079899.0,Broker’s Call: Bandhan Bank (Buy),ICICI Securities,neutral,neutral,-0.1166277907364287,neutral,-1.434768101434772,negative
2022-03-30 19:20:00.000,301.0,309.0,299.15,305.1,11448710.0,"NPAs to reduce in Q4, industry loss to be restricted to 5-6% of total microfinance loans, says Bandhan Bank MD Chandra Shekhar Ghosh","In an exclusive interview with ETs Atmadip Ray, Ghosh said that with improving loan recovery, the banks profitability would increase because of write back on provisions. The bank is also back on track to achieve the medium term business goals of reducing the weightage of microfinance on its balance …",neutral,positive,1.3621262458471837,positive,4.659146640510054,positive
2022-04-05 13:49:00.000,315.0,319.3,306.1,314.5,14485314.0,Bandhan Bank shares drop 0.66% as Sensex falls,"A total of 234,973 shares changed hands on the counter till 01:49PM (IST)",negative,neutral,-0.1587301587301587,neutral,-0.8620689655172413,neutral
2022-04-05 17:30:00.000,315.0,319.3,306.1,314.5,14485314.0,"Bandhan Bank Q4 update: Total advances up 16%, deposits rise 24%","However, CASA ratio declined to 41.6 per cent from 43.4 per cent a year ago and 45.6 per cent at the end of preceding December quarter.",positive,negative,-0.1587301587301587,neutral,-0.8620689655172413,neutral
2022-04-05 20:09:42.000,315.0,319.3,306.1,314.5,14485314.0,"Bandhan Bank Q4 advances rise 16% YoY to Rs 1.01 lakh crore, deposits up 24%","During Q4, the private sector lender’s total deposits rose 24% on a yearly basis to Rs 96,331 crore as on December end.",positive,positive,-0.1587301587301587,neutral,-0.8620689655172413,neutral
2022-04-05 20:14:00.000,315.0,319.3,306.1,314.5,14485314.0,Bandhan Bank crosses Rs 1 lakh crore loans,"Ujjivan Small Finance Bank, another predominantly microfinance lender, has also shown robust loan growth. It disbursed Rs 4,870 crore in the December quarter, its highest ever quarterly disbursement, while asset quality improved with 100% collection efficiency in March in step with steady economic r…",neutral,positive,-0.1587301587301587,neutral,-0.8620689655172413,neutral
2022-04-05 21:43:48.000,315.0,319.3,306.1,314.5,14485314.0,Bandhan Bank’s collection efficiency improves to 96 per cent in March,Bank sees improvement in asset quality,positive,positive,-0.1587301587301587,neutral,-0.8620689655172413,neutral
2022-04-05 21:50:00.000,315.0,319.3,306.1,314.5,14485314.0,Bandhan Bank’s overall collection efficiency ratio stands at 96%,"The overall collection efficiency ratio (CER) of private lender Bandhan Bank stood at 96% at the end of FY 2021-22, against 93% in the preceding third quarter, the bank said in a statement on Tuesday",neutral,negative,-0.1587301587301587,neutral,-0.8620689655172413,neutral
2022-04-05 22:07:39.000,315.0,319.3,306.1,314.5,14485314.0,Bandhan Bank loan book rises 16% in Q4; crosses Rs 1 lakh crore mark | The Financial Express,"Loans and advances of the bank grew 16 per cent year-on-year at Rs 1,01,359 crore at the end of March 31, 2022, while its total deposits increased to Rs 96,331 crore year-on-year at the end of last quarter on 2021-22.",positive,positive,-0.1587301587301587,neutral,-0.8620689655172413,neutral
2022-04-05 22:18:00.000,315.0,319.3,306.1,314.5,14485314.0,Bandhan Bank loan book rises 16% in Q4; crosses Rs 1 trillion-mark,"The bank’s total loan stood at Rs 1,01,359 crore during Q4 of FY22",positive,neutral,-0.1587301587301587,neutral,-0.8620689655172413,neutral
2022-04-06 08:01:51.000,315.0,319.3,306.1,314.5,14485314.0,"Stocks to Watch: Tata Steel, Marico, Bandhan Bank, TVS Motor","The ministerial panel working on the restructuring of GST rates will examine whether companies passed on rate cuts in the past, before recommending changes to tax slabs",neutral,neutral,-0.1587301587301587,neutral,-0.8620689655172413,neutral
2022-04-06 10:27:25.000,315.0,319.3,306.1,314.5,14485314.0,Bandhan Bank shares up 23% in a month. Brokerages see more upside,Jefferies has a Buy recommendation on Bandhan Bank shares with a target price of ₹318.70 per share,positive,positive,-0.1587301587301587,neutral,-0.8620689655172413,neutral
2022-04-06 10:39:00.000,315.0,319.3,306.1,314.5,14485314.0,Bandhan Bank records 16% YoY growth in advances,"Bandhan Bank’s loans & advances amounted to Rs 1,01,359 crore as on 31 March 2022, up 16% from Rs 87,043 crore as on 31 March 2021.",positive,positive,-0.1587301587301587,neutral,-0.8620689655172413,neutral
2022-04-06 10:57:29.000,315.0,319.3,306.1,314.5,14485314.0,"Bandhan Bank’s Q4 business update signals recovery, but risks remain","Improving trends in collection efficiency should continue to moderate credit cost and support earnings for Bandhan Bank. However, movement in Special Mention Account book and performance of restructured book remains a key monitorable",positive,positive,-0.1587301587301587,neutral,-0.8620689655172413,neutral
2022-04-06 17:30:00.000,319.0,323.3,314.15,316.25,9943221.0,"Stocks in news: Bandhan Bank, Marico, Tata Steel, Ruchi Soya and more","Stocks in news: Bandhan Bank, SBI Cards, Marico,Lupin, Tata Steel, Tata Power Company, Tata Consultancy Services, Ruchi Soya Industries, Adani Enterprises and more",neutral,neutral,-0.8620689655172413,neutral,3.8338658146964857,positive
2022-04-06 22:10:00.000,319.0,323.3,314.15,316.25,9943221.0,Bandhan-led group wins bid to own IDFC MF,"The consortium led by the Kolkata-based owner of Bandhan Bank trumped the US based Invesco that partnered with buyout firm Warburg Pincus and Kedaara Capital, paying 3.6 percent of the assets under management. The winning group includes Lathe Investment Pte. Ltd, an affiliate of Singapore sovereign …",neutral,positive,-0.8620689655172413,neutral,3.8338658146964857,positive
2022-04-07 07:43:53.000,319.0,323.3,314.15,316.25,9943221.0,"Stocks to Watch: Zee, Bandhan Bank, Titan, Maruti, HDFC Bank, Godrej Consumer","Banks have missed the 31 March deadline to transfer the first tranche of toxic assets to bad bank because of procedural delays. They now hope to transfer ₹50,000 crore of bad loans to NARCL by the end of April",neutral,negative,-0.8620689655172413,neutral,3.8338658146964857,positive
2022-04-07 08:17:00.000,319.0,323.3,314.15,316.25,9943221.0,"Bandhan-led consortium to acquire IDFC MF for Rs 4,500 cr","A consortium of Bandhan Bank’s parent Bandhan Financial Holdings (BFHL), private equity firm ChrysCapital and Singapore’s sovereign fund GIC will acquire IDFC Asset Management Company for Rs 4,500 crore.",positive,neutral,-0.8620689655172413,neutral,3.8338658146964857,positive
2022-04-07 08:22:36.000,319.0,323.3,314.15,316.25,9943221.0,"Stocks to Watch Today: Zee, Bandhan Bank, Titan, Uma Exports, HDFC Bank, and Others","Stocks to watch today: Shares of firms like TCS, Adani Group, Zomato, Marico, and others will be in focus in Wednesday’s trade",neutral,neutral,-0.8620689655172413,neutral,3.8338658146964857,positive
2022-04-07 12:09:00.000,313.0,329.85,307.8,325.0,32785435.0,"Bandhan Bank, IDFC, ZEEL: Trading strategies for buzzing stocks of the day",The stock of Zee Entertainment needs to firmly overcome the hurdle of Rs 298.60 levels to see fresh upside,neutral,positive,3.8338658146964857,positive,-0.6022235948116086,neutral
2022-04-07 12:41:00.000,313.0,329.85,307.8,325.0,32785435.0,"Bandhan-led group to buy IDFC MF, deal valued at ₹4,500 crore","The consortium led by the Kolkata-based owner of Bandhan Bank trumped the US based Invesco that partnered with buyout firm Warburg Pincus and Kedaara Capital, paying 3.6% of the assets under management.",positive,positive,3.8338658146964857,positive,-0.6022235948116086,neutral
2022-04-08 09:58:16.000,313.0,329.85,307.8,325.0,32785435.0,Bandhan Bank share price rises more than 3% on block deals,"The share touched a 52-week high of Rs 364.85 and a 52-week low of Rs 229.65 on 09 April, 2021 and 27 December, 2021, respectively.",positive,negative,3.8338658146964857,positive,-0.6022235948116086,neutral
2022-04-08 10:00:00.000,313.0,329.85,307.8,325.0,32785435.0,Bandhan Bank rebounds 7% from day’s low after huge block deals,"At 09:15 am; 50.14 million equity shares representing 3.11 per cent of total equity of Bandhan Bank changed hands on the BSE, the exchange data shows.",positive,neutral,3.8338658146964857,positive,-0.6022235948116086,neutral
2022-04-08 17:30:00.000,313.0,329.85,307.8,325.0,32785435.0,"HDFC divests 3% stake in Bandhan Bank for Rs 1,522 cr",The transaction comes days after HDFC announced a mega merger with its banking arm HDFC Bank.,neutral,neutral,3.8338658146964857,positive,-0.6022235948116086,neutral
2022-04-08 18:58:22.000,313.0,329.85,307.8,325.0,32785435.0,About 5 crore Bandhan Bank shares change hands,HDFC Ltd reported to have pared its stake in the private sector lender,neutral,neutral,3.8338658146964857,positive,-0.6022235948116086,neutral
2022-04-08 20:43:56.000,313.0,329.85,307.8,325.0,32785435.0,"HDFC pares 3% stake in Bandhan Bank for Rs 1,521 crore | The Financial Express",The transaction comes days after HDFC announced a mega merger with its banking arm HDFC Bank.,neutral,neutral,3.8338658146964857,positive,-0.6022235948116086,neutral
2022-04-08 20:48:36.000,313.0,329.85,307.8,325.0,32785435.0,Bulk deals | Societe Generale buys more than 1% stake in Bandhan Bank,Societe Generale bought more than 1.9 crore equity shares in Bandhan Bank as per the bulk deals data. These shares were bought at an average price of Rs 306.55 per share.,neutral,neutral,3.8338658146964857,positive,-0.6022235948116086,neutral
2022-04-08 20:57:00.000,313.0,329.85,307.8,325.0,32785435.0,"Housing finance major HDFC pares 3% stake in Bandhan Bank for Rs 1,521 cr","According to bulk deal data available with the BSE, Housing Development Finance Corporation (HDFC) sold a total of 4,96,32,349 shares, amounting to 3.08 per cent stake, of Bandhan Bank",neutral,neutral,3.8338658146964857,positive,-0.6022235948116086,neutral
2022-04-11 06:51:07.000,323.8,325.45,317.05,321.85,8754269.0,"Buzzing Stocks | Tata Motors, Veranda Learning, Bandhan Bank, others in news today",Stocks In the News: Check out the companies making headlines before the opening bell.,neutral,neutral,-0.6022235948116086,neutral,3.603603603603611,positive
2022-04-11 09:36:34.000,323.8,325.45,317.05,321.85,8754269.0,"Why ICICI Bank, Bandhan Bank are Jefferies’ top bank stock picks post RBI policy","Banks are better placed in a higher rate environment as most leading banks have higher Casa ratio, said Jefferies",neutral,positive,-0.6022235948116086,neutral,3.603603603603611,positive
2022-04-11 17:30:00.000,321.9,335.45,317.45,333.5,12092408.0,"Stocks in news: TCS, Tata Motors, Bandhan Bank, Tata Steel and more","The Indian equity market is likely to open lower today as SGX Nifty was trading 130 points lower at 17,764.20.",neutral,negative,3.603603603603611,positive,-3.000594177064772,negative
2022-04-12 15:07:00.000,336.6,336.6,324.55,326.5,8912109.0,Bandhan Bank hits 6-month high; gains 9% in 3 days post HDFC stake sale,"In the past one month, Bandhan Bank has outperformed the market by surging 28 per cent as compared to 5.6 per cent rise in the S&P BSE Sensex",positive,positive,-3.000594177064772,negative,0.0,neutral
2022-04-20 11:06:00.000,324.95,330.0,320.1,323.05,7733613.0,Bandhan Bank stock price up 0.62 per cent as Sensex climbs,"As of 31-Mar-2022, promoters held 39.99 per cent stake in the company, while FIIs held 34.31 per cent and domestic institutional investors had 4.19 per cent.",positive,neutral,-0.5847053392829596,neutral,4.1717791411043015,positive
2022-04-22 07:43:00.000,336.0,339.0,328.65,329.2,9049491.0,F&O Strategy: Nandish Shah recommends a Bull spread on Bandhan Bank,The derivative analyst from HDFC Securities recommends buying Bandhan Bank April 360 Call and simultaneously selling 360 Call.,neutral,positive,-2.023809523809527,negative,2.006125574272592,positive
2022-04-27 07:41:00.000,335.0,337.3,329.7,333.7,5700412.0,"Nifty likely to remain choppy, these are the key levels as per Vinay Rajani",The technical analyst from HDFC Securities recommends buying Action Construction Equipment and Bandhan Bank.,neutral,neutral,-0.3880597014925407,neutral,-0.7092198581560216,neutral
2022-05-06 13:53:14.000,311.0,322.05,307.8,318.5,7077033.0,"Kotak Mahindra Bank, ICICI Bank, Bandhan Bank, Others Hike FD Interest Rates; Check Here","Kotak Mahindra Bank, ICICI Bank, Bandhan Bank, Others Hike FD Interest Rates; Check Here; At least five banks, including ICICI Bank, Kotak Mahindra Bank, Bandhan Bank, bank of Baroda and Jana Small Finance Bank have hiked their fixed deposit interest rates",neutral,neutral,2.4115755627009645,positive,-0.8530805687203756,neutral
2022-05-06 17:55:26.000,311.0,322.05,307.8,318.5,7077033.0,Five major banks increase FD rates after RBI rate hike,"Bandhan Bank, Kotak Mahindra Bank, Jana Small Finance Bank, Bank of Baroda, and ICICI Bank are among the lenders.",positive,neutral,2.4115755627009645,positive,-0.8530805687203756,neutral
2022-05-08 13:17:16.000,316.5,321.05,308.35,313.8,9163369.0,"Bank FD: Bank Of Baroda, PNB, ICICI Bank Recently Raised Interest; Know New Rates","Even as the Reserve Bank of India (RBI) recently raised the key repo rate by 40 basis points (bps) in a surprise move, banks have started increasing loan as well as deposit interest rates. Recently, Bandhan Bank, Kotak Mahindra Bank, Jana Small Finance Bank, Bank of Baroda, ICICI Bank and Punjab Nat…",neutral,positive,-0.8530805687203756,neutral,-0.2075019952114851,neutral
2022-05-13 07:44:10.000,309.05,332.75,309.05,318.0,20351675.0,"Stocks to Watch: SBI, Tech Mahindra, RIL, Bank of Baroda, Airtel, Tata Motors","SBI, Eicher Motors, Tech Mahindra, Bank of Baroda, Bandhan Bank, Union Bank of India, Alkem Laboratories, Emami, Escorts, Hindustan Aeronautics, Nazara Technologies, REC, Reliance Power are among the companies scheduled to announce their earnings today",neutral,neutral,2.895971525643096,positive,4.565083281924742,positive
2022-05-13 07:56:00.000,309.05,332.75,309.05,318.0,20351675.0,"Stocks to Watch: L&T, Tata Motors, Siemens, Apollo Tyres, HCC, HP Adhesives","Stocks to Watch Today: Bandhan Bank, BoB, Eicher Motors, Escorts, REC, SBI, Tech Mahindra and UCO Bank are likely to be in focus ahead of Q4 results; Delhivery and Venus Pipes IPOs close on Friday.",neutral,neutral,2.895971525643096,positive,4.565083281924742,positive
2022-05-13 08:57:33.000,309.05,332.75,309.05,318.0,20351675.0,Stocks that will see action today (May 13),"Buzzing stocks: SBI, BoB, Bandhan Bank, DB Corp,Nazara Tech, Hind Aeronautics, Reliance Power, RInfra, Matrimony.com",neutral,neutral,2.895971525643096,positive,4.565083281924742,positive
2022-05-13 14:41:00.000,309.05,332.75,309.05,318.0,20351675.0,"Bandhan Bank Q4FY22 income up 43% to Rs 3,504.2 cr; profit at Rs 1,902.3 cr","Net NPAs or bad loans reduced significantly to 1.66 per cent, from 3.51 per cent",positive,neutral,2.895971525643096,positive,4.565083281924742,positive
2022-05-13 15:10:45.000,309.05,332.75,309.05,318.0,20351675.0,"Bandhan Bank Q4FY22 net profit jumps multi-fold to Rs 1,902 crore | The Financial Express","Total income of the bank in Q4FY22 rose by 43 per cent to Rs 3,504.2 crore, as against Rs 2,457.4 crore in the same period of FY21, Bandhan Bank said in a regulatory filing.",positive,positive,2.895971525643096,positive,4.565083281924742,positive
2022-05-13 15:26:00.000,309.05,332.75,309.05,318.0,20351675.0,Bandhan Bank gains after Q4 PAT rises sharply YoY,"Bandhan Bank gained 4.60% to Rs 318.20 after the microfinance bank reported a 18.46 times surge in standalone net profit to Rs 1,902.34 crore on a 27.7% rise in total income to Rs 4,835.97 crore in Q4 FY22 over Q4 FY21.",positive,positive,2.895971525643096,positive,4.565083281924742,positive
2022-05-13 16:48:40.000,309.05,332.75,309.05,318.0,20351675.0,"Bandhan Bank Q4 net profit soars to ₹1,902 crore","For the full fiscal 2021-22, its net profit, however, fell 94.3 per cent to ₹125.8 crore",positive,negative,2.895971525643096,positive,4.565083281924742,positive
2022-05-13 17:30:00.000,309.05,332.75,309.05,318.0,20351675.0,"Bandhan Bank Q4 results: Net profit jumps 1747% to Rs 1,902.3 cr","Its net interest income (NII) for the current year grew 15.2 per cent to Rs 8,714 crore as opposed to Rs 7,563.4 crore the previous year.",positive,positive,2.895971525643096,positive,4.565083281924742,positive
2022-05-15 17:47:00.000,324.2,342.8,315.7,339.0,21009908.0,Bandhan Bank to halve its microfinance portfolio over the next two years,"The private sector lender intends to diversify to new geographies and add more than 500 branches, mostly in semi-urban and rural areas beyond East India, most likely UP and South India.",neutral,positive,4.565083281924742,positive,-0.2485743529755712,neutral
2022-05-16 05:30:00.000,324.2,342.8,315.7,339.0,21009908.0,"Bank Stocks in Focus on Monday: SBI, Bank of Baroda, Bandhan Bank & More","Bank Stocks in Focus on Monday: SBI, Bank of Baroda, Bandhan Bank & More",neutral,neutral,4.565083281924742,positive,-0.2485743529755712,neutral
2022-05-16 07:41:00.000,324.2,342.8,315.7,339.0,21009908.0,"Stocks to Watch: Adani Group, RIL, SBI, Dmart, Railtel, Bandhan Bank, PSBs","Stocks to Watch Today: Bharat Forge, Fino Payments Bank, MCX India, RateGain Travel, Raymond and VIP Industries are some of the notable companies scheduled to announce Q4 results on Monday.",neutral,neutral,4.565083281924742,positive,-0.2485743529755712,neutral
2022-05-16 10:55:00.000,324.2,342.8,315.7,339.0,21009908.0,"Results Review for SBI, Bandhan Bank, Aditya Birla Capital, APL Apollo, CESC","Results Review for SBI, Bandhan Bank, Aditya Birla Capital, APL Apollo, CESC",neutral,neutral,4.565083281924742,positive,-0.2485743529755712,neutral
2022-05-16 11:57:00.000,324.2,342.8,315.7,339.0,21009908.0,Bandhan Bank surges 8% on improvement in asset quality in March quarter,"Gross non-performing asset (NPA) and net NPA ratios declined 435 bps and 135 bps to 6.46 per cent and 3.01 per cent, respectively, on a quarter on quarter (QoQ) basis.",positive,negative,4.565083281924742,positive,-0.2485743529755712,neutral
2022-05-16 12:42:57.000,341.95,349.55,334.55,341.1,14774889.0,"Bandhan Bank Q4 Review - Robust Quarter, Encouraging Outlook: Axis Securities","Bandhan Bank Q4 Review - Robust Quarter, Encouraging Outlook: Axis Securities",neutral,neutral,-0.2485743529755712,neutral,-3.4261554162414347,negative
2022-05-16 15:22:30.000,341.95,349.55,334.55,341.1,14774889.0,Deadline for diversification pushed back to 2026 due to pandemic: Bandhan Bank MD & CEO,"Rise in consumer demand, mobility fuelling credit demand, he said",neutral,neutral,-0.2485743529755712,neutral,-3.4261554162414347,negative
2022-05-16 16:44:36.000,341.95,349.55,334.55,341.1,14774889.0,Buy Bandhan Bank; target of Rs 365: ICICI Direct,"ICICI Direct is bullish on Bandhan Bank has recommended buy rating on the stock with a target price of Rs 365 in its research report dated May 16, 2022.",neutral,positive,-0.2485743529755712,neutral,-3.4261554162414347,negative
2022-05-16 18:54:05.000,341.95,349.55,334.55,341.1,14774889.0,Accumulate Bandhan Bank; target of Rs 363: Arihant Capital,"Arihant Capital recommended accumulate rating on Bandhan Bank with a target price of Rs 363 in its research report dated May 16, 2022.",neutral,positive,-0.2485743529755712,neutral,-3.4261554162414347,negative
2022-05-16 19:38:45.000,341.95,349.55,334.55,341.1,14774889.0,Hold Bandhan Bank; target of Rs 325: Emkay Global Financial,"Emkay Global Financial recommended hold rating on Bandhan Bank with a target price of Rs 325 in its research report dated May 15, 2022.",neutral,positive,-0.2485743529755712,neutral,-3.4261554162414347,negative
2022-05-17 17:30:00.000,342.95,346.0,329.65,331.2,7206458.0,Bandhan Bank shares on a roll post Q4 results! What should investors do?,"On Monday, the scrip closed 6.73 per cent higher at Rs 338.75 against the previous close of Rs 317.40. Market cap of the bank rose to Rs 54,564.98 crore.",neutral,positive,-3.4261554162414347,negative,-2.579150579150586,negative
2022-05-17 19:27:18.000,342.95,346.0,329.65,331.2,7206458.0,Accumulate Bandhan Bank; target of Rs 385: KR Choksey,"KR Choksey recommended accumulate rating on Bandhan Bank with a target price of Rs 385 in its research report dated May 17, 2022.",neutral,positive,-3.4261554162414347,negative,-2.579150579150586,negative
2022-05-19 08:34:37.000,323.75,325.65,309.8,315.4,9468486.0,Bandhan Bank may not require microfinance loan recast | The Financial Express,"For the fourth quarter last fiscal, the bank’s collection efficiency, other than non-performing assets (NPAs) accounts, returned to the pre-Covid level.",neutral,positive,-2.579150579150586,negative,-1.537267080745338,negative
2022-05-20 12:40:52.000,322.0,323.55,311.4,317.05,7953820.0,"ICICI, Bandhan among Jefferies’ top bank picks as RBI embarks on rate hike cycle","ICICI Bank & Bandhan Bank are top buys, IndusInd Bank (IIB) looks attractive, said Jefferies",neutral,positive,-1.537267080745338,negative,-2.0315674324113147,negative
2022-05-22 16:57:30.000,319.95,324.75,312.15,313.45,5622854.0,"Bandhan Bank to increase exposure to secured loans, says MD & CEO","Private lender Bandhan Bank will gradually increase its exposure to secured loans by enhancing advances to the housing and MSME sectors, an official said.",positive,positive,-2.0315674324113147,negative,-0.8716323296354992,neutral
2022-05-22 17:30:00.000,319.95,324.75,312.15,313.45,5622854.0,Bandhan Bank to increase exposure to secured loans: CEO Chandra Shekhar Ghosh,"Presently, the bank’s exposure to MFI loans, which are unsecured, is 47 per cent, and the share of its advances to the housing segment is at 24 per cent, retail at two per cent and the micro, small and medium enterprises sector at 27 per cent.",positive,neutral,-2.0315674324113147,negative,-0.8716323296354992,neutral
2022-05-22 19:07:00.000,319.95,324.75,312.15,313.45,5622854.0,Bandhan Bank to increase exposure to secured loans: MD & CEO,Bandhan Bank MD and CEO Chandra Shekhar Ghosh told PTI that “the lender will increase its exposure to secured loans and has set a target to increase disbursements to housing and medium-size MSME loans. Advances to MFIs and small-ticket MSME loans are unsecured”.,positive,positive,-2.0315674324113147,negative,-0.8716323296354992,neutral
2022-05-22 20:57:18.000,319.95,324.75,312.15,313.45,5622854.0,Bandhan Bank to increase exposure to secured loans: MD & CEO Chandra Shekhar Ghosh | The Financial Express,Bandhan Bank MD and CEO Chandra Shekhar Ghosh told PTI that “the lender will increase its exposure to secured loans and has set a target to increase disbursements to housing and medium-size MSME loans. Advances to MFIs and small-ticket MSME loans are unsecured”.,positive,positive,-2.0315674324113147,negative,-0.8716323296354992,neutral
2022-05-22 21:23:54.000,319.95,324.75,312.15,313.45,5622854.0,Bandhan Bank to progressively boost its stake to secured loans,Bandhan Bank would steadily expand its exposure to secured loans by increasing advances to the housing and MSME sectors.,positive,positive,-2.0315674324113147,negative,-0.8716323296354992,neutral
2022-05-23 02:22:14.000,319.95,324.75,312.15,313.45,5622854.0,Bandhan Bank to increase exposure to secured loans to MSME: MD & CEO,"Bandhan Bank will gradually increase its exposure to secured loans by enhancing advances to the housing and MSME sectors, its Managing Director and CEO Chandra Shekhar Ghosh said.",positive,positive,-2.0315674324113147,negative,-0.8716323296354992,neutral
2022-05-27 06:08:00.000,319.0,326.2,317.6,324.0,4539653.0,"Customer trusts the physical bank branch, says Bandhan Bank MD & CEO","‘When we started the bank seven years back, 98 per cent of the loan book was micro and group loans; now it is 47 per cent’",neutral,neutral,1.5673981191222568,positive,0.4140469253181922,neutral
2022-06-08 21:01:13.000,329.75,334.8,325.9,333.7,4319321.0,Trade setup for Thursday: Top 15 things to know before Opening Bell,"Based on the open interest future percentage, a long build-up was seen in 30 stocks including TVS Motor Company, JK Cement, Dr Lal PathLabs, Dalmia Bharat, and Bandhan Bank",neutral,positive,1.1978771796815737,positive,-2.000000000000007,negative
2022-06-21 17:30:00.000,282.8,284.55,276.05,281.1,5838494.0,"Despite Assam floods, Jefferies sees 57% upside in Bandhan Bank stock",Shares of Bandhan Bank rose 4 per cent today after brokerage Jefferies assigned a buy call with a target price of Rs 430. The buy call comes amid the flood situation in Assam where death toll has reached 81 and over 45 lakh people have been affected in 32 of the state’s 34 districts.,positive,positive,-0.6011315417255971,neutral,-1.5046910957691628,negative
2022-06-21 21:21:50.000,282.8,284.55,276.05,281.1,5838494.0,Trade setup for today: Top 15 things to know before the opening bell,"Based on the open interest future percentage, a short-covering was seen in 109 stocks including Bank Nifty, Coforge, GNFC, Bandhan Bank, and Alembic Pharmaceuticals",neutral,neutral,-0.6011315417255971,neutral,-1.5046910957691628,negative
