date,open,high,low,close,volume,title,description,title_sentiment,desc_sentiment,daily_change_pct,market_sentiment,next_day_change_pct,next_day_sentiment
2020-05-14 13:02:00.000,254.0,255.3,242.15,243.2,10297884.0,Bandhan Bank expects recovery to start from second quarter of FY21,The bank’s MD and CEO Chandrashekhar Ghosh said customers in that sector are not facing problems in their businesses as they deal with basic goods and the local supply chain.,positive,negative,-4.251968503937013,negative,-5.498563807960599,negative
2020-05-14 13:03:48.000,254.0,255.3,242.15,243.2,10297884.0,Bandhan Bank expects recovery to start from second quarter of FY21,The bank’s MD and CEO Chandrashekhar Ghosh said customers in that sector are not facing problems in their businesses as they deal with basic goods and the local supply chain.,positive,negative,-4.251968503937013,negative,-5.498563807960599,negative
2020-05-14 13:51:16.000,254.0,255.3,242.15,243.2,10297884.0,"Bandhan Bank expects recovery of loans extended to micro-credit customers to start from second quarter of FY21 - Business News , Firstpost",Private lender Bandhan Bank said on Thursday that recovery of loans extended to micro-credit customers will happen from the second quarter of the 2020-21 fiscal,positive,positive,-4.251968503937013,negative,-5.498563807960599,negative
2020-05-15 11:51:00.000,254.0,255.3,242.15,243.2,10297884.0,Share market update: Bank shares down; Bandhan Bank dips 3%,The Nifty Bank index was trading 1.49 per cent down at 18784.25.,negative,negative,-4.251968503937013,negative,-5.498563807960599,negative
2020-05-15 13:18:00.000,254.0,255.3,242.15,243.2,10297884.0,Slideshow | Bandhan Bank and Maruti among 10 buying ideas for 10-39% returns,Brokerages bet on these 10 stocks for 10-39 percent return.,neutral,neutral,-4.251968503937013,negative,-5.498563807960599,negative
2020-05-18 10:28:10.000,243.7,244.6,224.35,230.3,13559963.0,"Sensex, Nifty see sharp fall as eco measures failed to cheer-up markets; check what’s dragging D-St","Except Nifty Pharma, all the sectoral indices were trading in deep sea of red. Nifty Bank index was top sectoral loser declining over 8,50 points or 4.5% dragged by losses in Bandhan Bank, RBL Bank and ICICI Bank.",negative,negative,-5.498563807960599,negative,-4.716572912159242,negative
2020-05-21 05:30:00.000,222.0,222.0,209.95,210.35,10216589.0,"BRIEF-Bandhan Bank Says Business Of Around 65,000 Of Micro Banking Borrowers May Be Impacted Due To Amphan Cyclone - Investing.com India","The Financial News section features stock market news in addition to stories about bonds, forex, commodities and economic releases.",neutral,neutral,-5.24774774774775,negative,0.0980392156862689,neutral
2020-05-21 18:54:48.000,204.0,209.75,195.4,204.2,26936051.0,Bandhan Bank sees ₹260 crore loans impacted by cyclone Amphan,"In a statement to the stock exchanges, Bandhan Bank said it expects the Amphan-affected portfolio to regularise by the December quarter of FY21",neutral,positive,0.0980392156862689,neutral,-0.9057527539779654,negative
2020-05-22 00:58:14.000,204.0,209.75,195.4,204.2,26936051.0,"Cyclone Amphan: Bandhan Bank services impacted in some areas of West Bengal, Odisha",New Delhi: Kolkata-headquartered Bandhan Bank on Thursday said its services have been impacted in some areas of West Bengal and Odisha due to Amphan and the cyclone is likely to impact business worth Rs 260 crore. The lender expects to resume banking services in these areas shortly.,neutral,negative,0.0980392156862689,neutral,-0.9057527539779654,negative
2020-05-22 02:38:00.000,204.0,209.75,195.4,204.2,26936051.0,Bandhan Bank slumps 5% as cyclone Amphan impacts business,"The bank further said in the press note that, “as per the initial assessment, in our areas of operations, 49 banking units (micro banking outlet) in five districts were impacted of which 45 are operational today.",negative,neutral,0.0980392156862689,neutral,-0.9057527539779654,negative
2020-05-22 09:49:00.000,204.0,209.75,195.4,204.2,26936051.0,Bandhan Bank slips 6% on business update post Cyclone Amphan,The bank said Cyclone Amphan is likely to impact business worth Rs 260 crore.,neutral,negative,0.0980392156862689,neutral,-0.9057527539779654,negative
2020-05-22 11:58:24.000,204.0,209.75,195.4,204.2,26936051.0,Bandhan Bank share price tanks over 7% as Amphan cyclone rips through business,Bandhan Bank said in its press release that the banking outlets which had received prior warning of the Amphan cyclone were prepared with the necessary safety and business continuity measures,neutral,neutral,0.0980392156862689,neutral,-0.9057527539779654,negative
2020-05-26 11:01:00.000,204.25,208.5,201.0,202.4,7909046.0,"Pain likely to exacerbate for banks, financials; should you avoid the sector?","Nifty Bank index plunged 2.6 percent on May 22. As many as 9 out of a total of 12 stocks ended in the red, with Axis Bank, Federal Bank, RBL Bank, ICICI Bank and Bandhan Bank as the top losers.",neutral,negative,-0.9057527539779654,negative,7.1323529411764754,positive
2020-05-27 14:39:00.000,221.0,230.9,219.3,220.55,13472269.0,"D-Street Buzz: Bank Nifty outshines, surges 6% led by Axis Bank; ICICI Bank, Bandhan Bank jumps 6%","Bank Nifty zoomed over 6 percent led by Axis Bank which was the top index gainer, spiking over 11 percent followed by ICICI Bank, Bandhan Bank, Federal Bank, HDFC Bank, IndusInd Bank, Kotak Mahindra Bank and RBL Bank.",positive,positive,-0.2036199095022573,neutral,1.3475836431226793,positive
2020-05-28 11:34:00.000,221.0,230.9,219.3,220.55,13472269.0,Sensex reclaims 32K; Bank Nifty index outperforms,"IndusInd Bank among top gainer, up by 8%, followed by HDFC Bank, Axis Bank, Bandhan Bank and ICICI Bank are up over 4% each.",positive,positive,-0.2036199095022573,neutral,1.3475836431226793,positive
2020-05-29 11:54:00.000,215.2,220.0,211.15,218.1,14056861.0,Share market update: Bank shares mixed; Bandhan Bank dips 3%,The Nifty Bank index was trading 0.78 per cent down at 19020.45.,negative,negative,1.3475836431226793,positive,0.4444444444444444,neutral
2020-06-01 10:12:00.000,225.0,230.5,223.5,226.0,10164981.0,Trending stocks: Bandhan Bank shares up nearly 5% as Nifty surges,Shares of Bandhan Bank Ltd. traded 4.63 per cent up in trade at 10:09AM on Monday.,positive,positive,0.4444444444444444,neutral,7.026431718061669,positive
2020-06-03 11:45:00.000,248.95,261.4,245.0,248.0,18058731.0,Share market update: Bank shares up; Bandhan Bank jumps 6%,The Nifty Bank index was trading 3.0 per cent up at 21146.1.,positive,positive,-0.3816027314721786,neutral,-5.7661290322580685,negative
2020-06-05 13:35:00.000,234.0,251.6,233.55,250.85,14946041.0,"Voda Idea, IDBI Bank, Saregama and 7 other stocks rally over 50% in 1 week","IDBI Bank has rallied 89% during the week. It has become the sixth most valued listed lender, surpassing Bandhan Bank, YES Bank and IndusInd Bank in market capitalisation ranking.",positive,positive,7.200854700854699,positive,2.4068322981366417,positive
2020-06-08 08:53:54.000,257.6,268.0,256.0,263.8,15479619.0,"Top Buy And Sell Ideas By Ashwani Gujral, Sudarshan Sukhani, Mitesh Thakkar For Short Term","Mitessh Thakkar of mitesshthakkar.com suggests buying Bandhan Bank with a stop loss of Rs 240, target at Rs 260 and Siemens with a stop loss of Rs 1,130, target at Rs 1,195.",neutral,neutral,2.4068322981366417,positive,-2.052730696798489,negative
2020-06-08 09:32:17.000,257.6,268.0,256.0,263.8,15479619.0,Bankers working remotely face security issues: Bandhan Bank CEO,"Coronavirus pandemic has brought a whole new set of risks for banks and banks need to pivot around these challenges to emerge from the crisis. .In the latest interview of Mint’s Pivot or Perish series, Chandra Shekhar Ghosh, chief executive, Bandhan Bank, discusses the strategies to navigate its way…",neutral,neutral,2.4068322981366417,positive,-2.052730696798489,negative
2020-06-10 12:14:00.000,271.05,289.2,265.4,267.3,28638267.0,Its official! 39% of all loans in banking system now under 6-month moratorium,Small finance banks and those dealing with micro lending like Bandhan Bank have seen more than 90 per cent of their micro loan book come under moratorium,neutral,neutral,-1.383508577753182,negative,13.020000000000003,positive
2020-06-14 20:54:46.000,278.0,281.55,264.6,268.3,15860601.0,RBI proposals may impact top management at private banks,"Private sector banks, including City Union Bank, AU Small Finance Bank, Bandhan Bank, Equitas Small Finance Bank, IDFC First Bank and Kotak Mahindra, could see significant changes, going by the Reserv",negative,neutral,-3.4892086330935213,negative,-4.121863799283155,negative
2020-06-15 11:10:33.000,278.0,281.55,264.6,268.3,15860601.0,"D-Street Buzz: Bank Stocks Tumble; IndusInd Bank, SBI, ICICI Bank, RBL Bank Fall 3-5%","The top losers included IndusInd Bank which shed over 5 percent and was one of the top index loser. This was followed by RBL Bank, State Bank of India, ICICI Bank and Bandhan Bank.",neutral,neutral,-3.4892086330935213,negative,-4.121863799283155,negative
2020-06-15 12:39:00.000,279.0,280.0,260.05,267.5,13945898.0,"HDFC MF exits Bandhan Bank, Info Edge; bets on PSU lenders",The fund house bought over 1 crore shares in power-focused PSU firms.,neutral,neutral,-4.121863799283155,negative,-0.0380807311500467,neutral
2020-06-19 09:53:00.000,272.55,294.7,272.55,291.25,20295462.0,Trending stocks: Bandhan Bank share price climbs over 3%,Shares of Bandhan Bank Ltd. traded 3.44 per cent up in trade at 09:49AM on Friday.,positive,positive,6.861126398825899,positive,6.050847457627127,positive
2020-06-19 11:51:00.000,272.55,294.7,272.55,291.25,20295462.0,Share market update: Bank shares up; Bandhan Bank climbs 5%,The Nifty Bank index was trading 1.65 per cent up at 21303.05.,positive,positive,6.861126398825899,positive,6.050847457627127,positive
2020-06-19 14:09:00.000,272.55,294.7,272.55,291.25,20295462.0,Bandhan Bank says collection efficiency improves to 55% in second week of June,The bank with predominantly high microfinance exposure has a 26000-strong field workforce who form the backbone of its repayment collection mechanism.,positive,positive,6.861126398825899,positive,6.050847457627127,positive
2020-06-22 14:39:56.000,316.0,357.9,315.0,357.9,24593579.0,"D-Street Buzz: Banks Rally Led By RBL Bank, Stock Jumps 12%; Bandhan Bank, SBI, PNB Rise","RBL Bank jumped 12 percent hitting upper circuit of Rs 185.60 per share on the BSE followed by IDFC First Bank, Bandhan Bank, Kotak Mahindra Bank, Federal Bank and Axis Bank.",neutral,positive,13.25949367088607,positive,-9.260273972602745,negative
2020-06-23 14:54:00.000,365.0,367.8,328.1,331.2,38738037.0,"Nifty above 10,350-mark; IndusInd Bank, Bandhan Bank stocks surge","The market breadth was in favour of the advances with 1,172 stocks opened with gains and 266 declined on the NSE.",positive,positive,-9.260273972602745,negative,4.905483518200278,positive
2020-06-23 18:58:00.000,365.0,367.8,328.1,331.2,38738037.0,"Bandhan Bank, small finance banks emerge as job creators amid coronavirus pandemic","These lenders are in the process of raising staff strength by 5-10% in the next three-four months, although several others in the sector might be more circumspect. The new workforce will largely be deployed for client servicing and to boost repayment, people familiar with the matter said.",neutral,positive,-9.260273972602745,negative,4.905483518200278,positive
2020-06-26 10:12:00.000,340.7,345.3,332.35,339.0,12949564.0,Trending stocks: Bandhan Bank shares rise nearly 2%,Shares of Bandhan Bank Ltd. traded 1.74 per cent up in trade at 10:09AM on Friday.,positive,positive,-0.4989727032579949,neutral,-0.975975975975976,negative
2020-07-02 11:46:00.000,330.85,355.75,329.15,345.6,28665150.0,Share market update: Bank shares up; Bandhan Bank jumps 4%,The Nifty Bank index was trading 0.46 per cent up at 22079.35.,positive,positive,4.45821369200544,positive,-0.0576368876080658,neutral
2020-07-03 13:40:00.000,347.0,351.75,336.5,346.8,15129084.0,Buy Bandhan Bank; target of Rs 380: Keynotes Financial Opiniery,"Keynotes Financial Opiniery is bullish on Bandhan Bank has recommended buy rating on the stock with a target price of Rs 380 in its research report dated July 01, 2020.",neutral,positive,-0.0576368876080658,neutral,1.3363662212112564,positive
2020-07-06 05:30:00.000,351.7,359.3,349.0,356.4,12829150.0,"BRIEF-Bandhan Bank Total Deposits As Of June Quarter At 606.02 Bln Rupees, Up 35% Y/Y - Investing.com India","The Financial News section features stock market news in addition to stories about bonds, forex, commodities and economic releases.",neutral,neutral,1.3363662212112564,positive,6.365614798694226,positive
2020-07-06 20:47:00.000,367.6,402.0,362.1,391.0,41830608.0,Banks and NBFCs report mixed Q1 performance,Private lender Bandhan Bank reported healthy loan and deposit growth for the June quarter.,positive,positive,6.365614798694226,positive,-3.4482758620689684,negative
2020-07-06 21:42:58.000,367.6,402.0,362.1,391.0,41830608.0,"Bandhan Bank Q1 loans increase 18 per cent, deposits up 35 per cent",Reports improvement in collection efficiency,positive,positive,6.365614798694226,positive,-3.4482758620689684,negative
2020-07-07 03:46:00.000,367.6,402.0,362.1,391.0,41830608.0,"Sensex, Nifty end higher for fifth day; Bajaj Finance, Bandhan Bank outperform","Nifty IT was the top performer in today’s trading session, ending with gains of 2.1% with the Nifty Bank index ending 1.9% higher and the media index too ended with gains of 1%.",positive,positive,6.365614798694226,positive,-3.4482758620689684,negative
2020-07-07 06:19:25.000,367.6,402.0,362.1,391.0,41830608.0,"Stocks To Watch: Bajaj Finance, Bandhan Bank, Emami, Godrej Consumer, HUL, PVR, Shree Renuka Sugars, Shriram Transport",Here are the stocks to watch in trade today.,neutral,neutral,6.365614798694226,positive,-3.4482758620689684,negative
2020-07-07 09:15:00.000,367.6,402.0,362.1,391.0,41830608.0,"Stocks in news: Suzlon, Bandhan Bank, HUL, Godrej Consumer, PVR, Bajaj Finance","Stocks to watch today on June 26: Suzlon, Bandhan Bank, HUL, Godrej Consumer, PVR, Bajaj Finance among others are the top stocks to watch out for in Tuesday’s trading session",neutral,neutral,6.365614798694226,positive,-3.4482758620689684,negative
2020-07-07 09:17:27.000,367.6,402.0,362.1,391.0,41830608.0,Bandhan Bank’s loans & advances grow 18% in Q1,"Private sector lender Bandhan Bank on Monday said its loans and advances grew 18% year-on-year to Rs 74,325 crore for the first quarter this fiscal, from Rs 63,164 crore for the same period last fiscal.",positive,positive,6.365614798694226,positive,-3.4482758620689684,negative
2020-07-07 10:12:00.000,367.6,402.0,362.1,391.0,41830608.0,Bandhan Bank jumps 13% post Q1FY21 biz update; Analysts maintain ‘buy’,"The Kolkata-headquartered bank saw its deposits growing 35 per cent year-on-year (YoY) to Rs 60,602 crore at the end of Q1FY21, compared to Rs 44,796 crore in Q1FY20.",positive,positive,6.365614798694226,positive,-3.4482758620689684,negative
2020-07-07 12:10:27.000,392.95,398.55,375.5,379.4,21016367.0,Bandhan Bank share price rallies 148% since March; stock jumps 5.6% today as loans grow 18%,"Bandhan Bank stock price has rallied 148 per cent from March lows, taking the total market capitalisation of the bank to Rs 58,855.71 crore",positive,positive,-3.4482758620689684,negative,-0.364868386760484,neutral
2020-07-07 12:16:00.000,392.95,398.55,375.5,379.4,21016367.0,Bandhan Bank share price gains after deposit grow 35% YoY,"Total advances grew 3 percent QoQ and 18 percent YoY to Rs74,325 crore in June, the private lender has said.",positive,positive,-3.4482758620689684,negative,-0.364868386760484,neutral
2020-07-07 13:17:00.000,392.95,398.55,375.5,379.4,21016367.0,"Buy Bandhan Bank, target price Rs 350: Motilal Oswal",Bandhans collection efficiency has improved to 70 per cent in the microfinance portfolio and 84 per cent in the Non-MFI portfolio.,neutral,positive,-3.4482758620689684,negative,-0.364868386760484,neutral
2020-07-07 14:43:00.000,392.95,398.55,375.5,379.4,21016367.0,"Financials in focus; Bajaj Finance, M&M Financial, Bandhan Bank up over 5%","MAS Financial, Ujjivan Financial, HUDCO, Cholamandalam Investment, Aditya Birla Money, Geojit Financial, AU SFB, and CreditAccess Grameen were up in the range of 5 per cent to 9 per cent on the BSE.",positive,positive,-3.4482758620689684,negative,-0.364868386760484,neutral
2020-07-07 17:46:24.000,392.95,398.55,375.5,379.4,21016367.0,"NBFCs, small bank stocks hit upper circuit","Bajaj Finance, Bandhan Bank lead the gains; decline in moratorium, deposit growth turn sentiment positive",neutral,positive,-3.4482758620689684,negative,-0.364868386760484,neutral
2020-07-07 20:02:00.000,392.95,398.55,375.5,379.4,21016367.0,"Bandhan Bank share rises over 12% intra day as Q1 loans grow 18%, deposits up 35%",Bandhan Bank stock rose up to 12.61% to Rs 401.95 intra day against previous close of Rs 356.95 on BSE. The stock closed 10.65% or Rs 38 higher at Rs 394,positive,positive,-3.4482758620689684,negative,-0.364868386760484,neutral
2020-07-08 18:35:42.000,383.7,385.0,375.1,382.3,12685478.0,Collection efficiency of Bandhan Bank improves for all advances,"The bank said that nearly 70 per cent of its customers have started repaying their loans. For non-micro banking advances, the collection efficiency for June was 84 per cent, according to the bank.",positive,neutral,-0.364868386760484,neutral,-0.7978723404255319,neutral
2020-07-08 20:25:20.000,383.7,385.0,375.1,382.3,12685478.0,Bandhan Bank’s Collection Efficiency Improves For All Advances In Q1 FY21,"Bandhan Bank’s loans and advances stood at Rs 74,325 crore on the end of the June quarter, while deposits touched Rs 60,602 crore.",neutral,neutral,-0.364868386760484,neutral,-0.7978723404255319,neutral
2020-07-14 15:42:00.000,361.0,370.0,345.4,353.55,21249299.0,"Bank, financial stocks tumble; RBL Bank, IndusInd Bank shed 4-5% each, SBI, BoB slip","Bank Nifty shed 2 percent dragged by RBL Bank which shed over 5 percent followed by Bank of Baroda, IndusInd Bank and Bandhan Bank which were down over 3 percent each.",negative,negative,-2.0637119113573377,negative,-3.531073446327684,negative
2020-07-15 03:23:00.000,361.0,370.0,345.4,353.55,21249299.0,Bandhan Bank Ltd Q1FY21 results; net profit falls by 32% yoy,The bank reported a net profit of Rs549.81cr for the quarter ending June 2020.,negative,positive,-2.0637119113573377,negative,-3.531073446327684,negative
2020-07-15 05:13:00.000,361.0,370.0,345.4,353.55,21249299.0,Bandhan Bank Q1 PAT drops by 32% yoy on additional provisions for Covid-19; Asset quality stable,The Q1 PAT was impacted as the bank has taken accelerated additional provision on standard assets amounting to Rs750cr for COVID-19 pandemic.,negative,negative,-2.0637119113573377,negative,-3.531073446327684,negative
2020-07-15 08:44:00.000,361.0,370.0,345.4,353.55,21249299.0,"Stocks to watch: RIL, Infosys, Bharti Airtel, SBI, Wipro, Bandhan Bank, LTI",Heres a list of stocks that may remain in focus today,neutral,neutral,-2.0637119113573377,negative,-3.531073446327684,negative
2020-07-15 08:52:20.000,361.0,370.0,345.4,353.55,21249299.0,"Stocks in focus: RIL, Yes Bank, Bharti Airtel, Infosys, Bandhan Bank, among others to remain in news","The global markets are still buoyant, rising cases in India have raised fears of the imposition of lockdown in certain parts, which could dent the pace of recovery",neutral,negative,-2.0637119113573377,negative,-3.531073446327684,negative
2020-07-15 09:17:00.000,361.0,370.0,345.4,353.55,21249299.0,"Stocks in news: RIL, Yes Bank, Bharti Airtel, Wipro, Infosys, Bandhan Bank","Stocks to watch today on July 15: RIL, Yes Bank, Bharti Airtel, Wipro, Infosys, Bandhan Bank among others are the top stocks to watch out for in Wednesday’s trading session.",neutral,neutral,-2.0637119113573377,negative,-3.531073446327684,negative
2020-07-15 09:49:00.000,361.0,370.0,345.4,353.55,21249299.0,"Share Market LIVE: Sensex gains over 400 points, Nifty at 10,735; Dr Reddy, Bharti Airtel, Titan top gainers","Stock Market LIVE Updates on July 15: Infosys, Bandhan Bank, Federal Bank, and L&T Infotech are among the top companies that will be reporting their April-June quarterly earnings",positive,neutral,-2.0637119113573377,negative,-3.531073446327684,negative
2020-07-15 12:17:00.000,354.0,354.7,330.55,341.5,13756860.0,Trending stocks: Bandhan Bank shares rise nearly 4% - The Economic Times,Shares of Bandhan Bank Ltd. traded 3.63 per cent up in trade at 12:15PM on Wednesday.,positive,positive,-3.531073446327684,negative,2.695652173913047,positive
2020-07-15 15:00:33.000,354.0,354.7,330.55,341.5,13756860.0,Bandhan Bank net profit falls 31.6pc to ₹550cr in April-June,"Operating profit during the quarter grew by 16.8 per cent to ₹1,584 crore while lender’s deposits grew by 6.18 per cent",neutral,positive,-3.531073446327684,negative,2.695652173913047,positive
2020-07-15 15:07:47.000,354.0,354.7,330.55,341.5,13756860.0,Bandhan Bank June quarter net profit down 32% YoY at ₹550 crore,"Gross non-performing assets as on June 30 fell to ₹1,007 crore from ₹1,020 crore in the year-ago period. Net NPAs fell 3.45% to ₹336 crore from ₹348 crore a year ago",negative,negative,-3.531073446327684,negative,2.695652173913047,positive
2020-07-15 15:18:00.000,354.0,354.7,330.55,341.5,13756860.0,Bandhan Bank net profit falls 31.6% to Rs 550 crore in April-June,The lender’s bottomline in the corresponding period a year ago was Rs 804 crore.,positive,neutral,-3.531073446327684,negative,2.695652173913047,positive
2020-07-15 15:21:00.000,354.0,354.7,330.55,341.5,13756860.0,Bandhan Bank slips after Q1 PAT declines 32%,"Bandhan Bank fell 1.18% to Rs 348.25 after the banks standalone net profit fell 31.58% to Rs 549.81 crore on a 14.93% increase in total income to Rs 3,404.84 crore in Q1 June 2020 over Q1 June 2019.",neutral,negative,-3.531073446327684,negative,2.695652173913047,positive
2020-07-15 15:28:00.000,354.0,354.7,330.55,341.5,13756860.0,Bandhan Bank Q1 results: Net profit falls 31.6% to Rs 550 crore - The Economic Times,"Operating profit during the quarter grew by 16.8 per cent to Rs 1,584 crore as against Rs 1,356 crore a year ago.",negative,positive,-3.531073446327684,negative,2.695652173913047,positive
2020-07-15 15:42:00.000,354.0,354.7,330.55,341.5,13756860.0,Bandhan Bank standalone net profit declines 31.58% in the June 2020 quarter,Total Operating Income rise 14.70% to Rs 3018.09 crore,negative,positive,-3.531073446327684,negative,2.695652173913047,positive
2020-07-15 15:43:00.000,354.0,354.7,330.55,341.5,13756860.0,Bandhan Bank reports 31.6% decline in net profit to Rs 550 cr in Apr-June,"A Bandhan Bank statement said it has taken accelerated additional provision on standard assets amounting to Rs 750 crore, due to the Covid-19 pandemic",negative,positive,-3.531073446327684,negative,2.695652173913047,positive
2020-07-15 17:21:58.000,354.0,354.7,330.55,341.5,13756860.0,Bandhan Bank Q1 net profit falls 32% to Rs 550 cr on higher provisioning,"Accelerated additional provision on standard advances amounting to Rs 750 crore taken for COVID-19 to further strengthen the balance sheet, it said.",negative,positive,-3.531073446327684,negative,2.695652173913047,positive
2020-07-15 19:36:22.000,354.0,354.7,330.55,341.5,13756860.0,Bandhan Bank Q1 profit falls 32% at ₹550 crore,"Our BureauRiding on the back of higher provisioning on standard assets, Bandhan Bank posted a 32 per cent drop in net profit at ₹550 crore for the quarter ended June 30, 2020, against ₹804 crore in t",negative,negative,-3.531073446327684,negative,2.695652173913047,positive
2020-07-15 19:48:00.000,354.0,354.7,330.55,341.5,13756860.0,Bandhan Bank’s pre-tax profit drops 40% in Q1 on higher provisioning,Pre-tax profit of the bank in Q1FY21 stood at Rs 735 crore,negative,neutral,-3.531073446327684,negative,2.695652173913047,positive
2020-07-15 19:48:12.000,354.0,354.7,330.55,341.5,13756860.0,Bandhan Bank Q1 profit falls 32% at ₹550 crore,"Riding on the back of higher provisioning on standard assets, Bandhan Bank posted a 32 per cent drop in net profit at ₹550 crore for the quarter ended June 30, 2020, against ₹804 crore in the correspo",negative,negative,-3.531073446327684,negative,2.695652173913047,positive
2020-07-15 20:53:00.000,354.0,354.7,330.55,341.5,13756860.0,Bandhan Bank Q1 profit drops 32% to Rs 550 crore on higher COVID provisions,"On the asset front, Bandhan Bank’s gross non-performing assets (NPAs), as a percentage of total advances, fell to 1.43 per cent in Q1 FY21 compared with 1.70 per cent in Q1 FY20",negative,negative,-3.531073446327684,negative,2.695652173913047,positive
2020-07-15 22:08:39.000,354.0,354.7,330.55,341.5,13756860.0,"Bandhan Bank’s Q1 numbers look rosy, but provisions show wariness","The bank is cautious on the asset quality front, and had set aside ₹690 cr as covid provisions in the last quarter",neutral,neutral,-3.531073446327684,negative,2.695652173913047,positive
2020-07-16 00:02:36.000,354.0,354.7,330.55,341.5,13756860.0,Bandhan Bank Q1 net profit falls 31.6% to Rs 549.82 cr on Rs 750-cr Covid-related provisions,The Kolkata-headquartered lender had posted a net profit of Rs 803.62 crore in the corresponding quarter of the previous fiscal year.,positive,positive,-3.531073446327684,negative,2.695652173913047,positive
2020-07-16 08:42:38.000,354.0,354.7,330.55,341.5,13756860.0,"INTERVIEW| We expect 15-20% Y-o-Y growth in advances: Chandra Shekhar Ghosh, MD & CEO, Bandhan Bank","Bandhan Bank expects collection efficiency in both microfinance and non-microfinance segments to become almost normal by second quarter this fiscal year, says its managing director and CEO Chandra Shekhar Ghosh.",positive,positive,-3.531073446327684,negative,2.695652173913047,positive
