date,open,high,low,close,volume,title,description,title_sentiment,desc_sentiment,daily_change_pct,market_sentiment,next_day_change_pct,next_day_sentiment
2020-08-17 07:39:00.000,458.33,463.58,439.42,451.33,3150618.0,"In pics | Stocks in the news: Fortis Healthcare, Berger Paints, Lupin, NLC India, Borosil, Jindal Steel & Power, Zee Learn, Ajanta Pharma, ICICI Bank","Sun TV Network, CG Power, PTC Industries, Man Industries (I), Satin Creditcare RE, IIFL Wealth Management, Gammon India, S Chand and Company and Dilip Buildcon are also in focus today",neutral,neutral,-1.527283834791526,negative,4.21444890535235,positive
2020-08-17 07:50:02.000,458.33,463.58,439.42,451.33,3150618.0,"Stocks to Watch: RIL, ICICI Bank, Infosys, Glenmark Pharma, Wipro, Berger Paints","ICICI Bank has completed the allotment of equity shares under its qualified institutional placement and raised approximately ₹15,000 crore.Wipro has completed the acquisition of Brazilian IT firm IVIA Serviços de lnformatica Ltda for about ₹169 crore",neutral,positive,-1.527283834791526,negative,4.21444890535235,positive
2020-08-17 08:42:00.000,458.33,463.58,439.42,451.33,3150618.0,"Stocks to watch: Tata Steel, Tata Motors, ICICI Bank, RIL, Berger Paints",Heres a list of stocks that may trade actively in todays trading session.,neutral,neutral,-1.527283834791526,negative,4.21444890535235,positive
2020-08-17 09:14:00.000,458.33,463.58,439.42,451.33,3150618.0,"Stocks in news: ICICI Bank, Glenmark Pharma, United Breweries, Fortis Healthcare, Berger Paints","Stocks to watch today on August 17: ICICI Bank, Glenmark Pharma, United Breweries, Fortis Healthcare, Berger Paints among others are the top stocks to watch out for in Monday’s trading session",neutral,neutral,-1.527283834791526,negative,4.21444890535235,positive
2020-08-17 10:21:00.000,458.33,463.58,439.42,451.33,3150618.0,Berger Paints slips after weak Q1 outcome,Berger Paints slipped 2.58% to Rs 536.15 after the paint maker posted a 91.45% slump in consolidated net profit to Rs 15.09 crore in Q1 FY21 as against Rs 176.41 crore posted in Q1 FY20.,negative,negative,-1.527283834791526,negative,4.21444890535235,positive
2020-08-17 10:40:15.000,458.33,463.58,439.42,451.33,3150618.0,Berger Paints stock loses sheen after a colourless June quarter,"According to analysts at Nomura, Berger would have had a larger stock of higher-priced crude inventory, due to which gross margin expansion was more impacted versus peers",negative,positive,-1.527283834791526,negative,4.21444890535235,positive
2020-08-17 11:01:00.000,458.33,463.58,439.42,451.33,3150618.0,"Berger Paints Consolidated June 2020 Net Sales at Rs 930.76 crore, down 45.78% Y-o-Y",,negative,neutral,-1.527283834791526,negative,4.21444890535235,positive
2020-08-17 11:52:04.000,458.33,463.58,439.42,451.33,3150618.0,Berger Paints shares plunge 4% post weak Q1 earnings,Shares of Berger Paints India Ltd on Monday plunged over four per cent after the company reported a 91.44 per cent decline in consolidated net profit for the quarter ended June. The stock tumbled 4.10,negative,negative,-1.527283834791526,negative,4.21444890535235,positive
2020-08-17 12:54:00.000,450.83,473.33,450.83,469.83,4949931.0,Berger Paints falls 4% as Q1 net profit slips 91% YoY; what brokerages say,It had posted a net profit of Rs 176.41 crore in the corresponding quarter of the previous fiscal.,negative,positive,4.21444890535235,positive,-1.0316090116588936,negative
2020-08-17 16:39:12.000,450.83,473.33,450.83,469.83,4949931.0,ICICI Securities: Berger Paints’ Revenue Decline In-Line With The Industry,ICICI Securities: Berger Paints’ Revenue Decline In-Line With The Industry,neutral,neutral,4.21444890535235,positive,-1.0316090116588936,negative
2020-08-17 19:38:00.000,450.83,473.33,450.83,469.83,4949931.0,Berger Paints: Weaker Q1 show indicates premium valuation unjustifiable,Top-line declined by 46% and gross profit margin was muted leading to a 88% fall in pre-tax profit,positive,negative,4.21444890535235,positive,-1.0316090116588936,negative
2020-08-20 08:36:20.000,463.5,466.17,458.75,463.75,816979.0,Analyst Corner – Berger Paints: Maintain ‘neutral’ with target price at Rs 540,Industrial business has been more affected vs other segments. Some recovery seen in two-wheelers and passenger vehicles; commercial vehicles continue to be challenged.,positive,negative,0.0539374325782092,neutral,1.9096774193548376,positive
2020-08-27 08:37:42.000,470.83,474.79,466.21,468.83,935453.0,Berger Paints sees 10-13% volume growth in Q2,"Berger Paints India Ltd is witnessing demand recovery at better than pre-Covid levels. Consequently, the country’s second largest paint-manufacturer is eyeing a double-digit volume growth and high sin",positive,positive,-0.4247817683665017,neutral,-0.5130705790065121,neutral
2020-09-01 11:12:00.000,450.83,463.75,448.21,461.5,2134963.0,"Paint stocks see solid rebound, but can they paint the town red?","Stocks of Asian Paints and Berger Paints havent logged big gains on a year-to-date basis; they have simply gyrated back to their pre-Covid levels, and continued to be consistent performers and wealth creators.",positive,positive,2.3667457800057705,positive,0.0624045103397862,neutral
2020-09-07 19:10:00.000,462.54,466.46,458.75,460.42,1182475.0,Sell Berger Paints; target of Rs 460: HDFC Securities,"HDFC Securities is bearish on Berger Paints has recommended sell rating on the stock with a target price of Rs 460 in its research report dated September 07, 2020.",neutral,negative,-0.4583387382712856,neutral,1.4473884078727548,positive
2020-09-07 19:16:27.000,462.54,466.46,458.75,460.42,1182475.0,HDFC Securities: Berger Paints - Catalysts Missing For A Performance Encore,"Berger Paints will have to contend with Asian Paints stepped-up aggression at the bottom of the pyramid, HDFC Securities says.",neutral,neutral,-0.4583387382712856,neutral,1.4473884078727548,positive
2020-09-07 20:58:00.000,462.54,466.46,458.75,460.42,1182475.0,Berger Paints Catalysts Missing For A Performance Encore - Investing.com India,Read Berger Paints Catalysts Missing For A Performance Encore by Jay Gandhi on Investing.com India,neutral,neutral,-0.4583387382712856,neutral,1.4473884078727548,positive
2020-09-10 07:12:00.000,474.12,480.83,468.5,478.62,3594433.0,"Hot Stocks | Berger Paints, HCL Tech two short-term buy calls; sell Hero MotoCorp","Nifty50, on the weekly chart, has completed the ‘Bearish Bat’ harmonic pattern and is currently trading below its potential reversal zone (PRZ).",neutral,negative,0.9491268033409264,positive,-0.5095355947008275,neutral
2020-09-10 08:56:00.000,474.12,480.83,468.5,478.62,3594433.0,"Top buy and sell ideas by Ashwani Gujral, Sudarshan Sukhani, Mitesh Thakkar for short term","Sudarshan Sukhani of s2analytics.com recommends buying Berger Paints with a stop loss of Rs 546, target at Rs 592 and Escorts with a stop loss of Rs 1,146, target at Rs 1,297.",neutral,neutral,0.9491268033409264,positive,-0.5095355947008275,neutral
2020-09-10 13:37:00.000,480.83,482.08,470.5,478.38,1791986.0,"Paint stocks in focus; Asian Paints hits record high, Berger Paints up 2%","Kansai Nerolac Paints and Shalimar Paints, too, were up 2 per cent each, as compared to 1.4 per cent rise in the S&P BSE Sensex at 01:08 pm",positive,positive,-0.5095355947008275,neutral,-0.1809371295468262,neutral
2020-09-10 18:24:17.000,480.83,482.08,470.5,478.38,1791986.0,Akshay Kumar to be brand ambassador for Berger Paints,"Berger Paints India Limited, the country’s second largest paint company, has roped in actor Akshay Kumar as brand ambassador for its waterproofing range of products under the HomeShield brand.Berger H",neutral,neutral,-0.5095355947008275,neutral,-0.1809371295468262,neutral
2020-09-11 09:06:00.000,480.83,482.08,470.5,478.38,1791986.0,"Top buy and sell ideas by Ashwani Gujral, Mitesh Thakkar for short term","Mitessh Thakkar of mitesshthakkar.com suggests buying Berger Paints with a stop loss of Rs 566, target at Rs 590 and HDFC Life Insurance with a stop loss of Rs 593, target at Rs 620.",neutral,neutral,-0.5095355947008275,neutral,-0.1809371295468262,neutral
2020-09-11 19:34:00.000,480.83,482.08,470.5,478.38,1791986.0,"Paint stocks’ valuations dicey, investors should await better entry point",Gains from expected business recovery and benign input costs already priced in Asian Paints and Berger Paints scrips,positive,positive,-0.5095355947008275,neutral,-0.1809371295468262,neutral
2020-09-22 11:11:00.000,474.08,474.92,458.75,468.33,916865.0,"Hero Moto, M&M, TechM, Berger Paints among 112 stocks likely to see selloff, suggests MACD","When the MACD crosses above the Signal Line, it gives a bullish signal, indicating that the price of the security may see an upward movement and vice versa.",positive,positive,-1.2128754640566994,negative,1.7807955928512014,positive
2020-09-22 12:56:00.000,468.33,477.92,466.71,476.67,2146716.0,"Hold Berger Paints, target price Rs 540: ICICI Securities","Berger Paints (India) Ltd., incorporated in the year 1923, is a Large Cap company (having a market cap of Rs 54262.05 Crore) operating in Building Materials sector.",neutral,neutral,1.7807955928512014,positive,0.2270481636428583,neutral
2020-09-25 22:05:57.000,481.67,488.17,477.96,483.42,2190605.0,Berger Paints sees recovery in urban markets,"Berger Paints India Ltd, the country’s second largest paint-maker, is witnessing recoveries in urban markets, particularly metros. Demand is back to 85-90 per cent of pre-Covid levels, and should impr",positive,positive,0.3633192849876471,neutral,0.2642089093702039,neutral
2020-09-28 07:20:00.000,488.25,497.08,484.83,489.54,1687808.0,"Top stocks in focus: Vodafone Idea, RIL, Berger Paints, Nalco, Grasim, Thomas Cook",Check out the stocks that will be in focus during trade today based on recent and latest news developments.,neutral,neutral,0.2642089093702039,neutral,-2.7019380393266386,negative
2020-09-28 08:51:00.000,488.25,497.08,484.83,489.54,1687808.0,"Top buy and sell ideas by Ashwani Gujral, Sudarshan Sukhani, Mitesh Thakkar for short term","Sudarshan Sukhani of s2analytics.com suggests buying Apollo Hospitals with a stop loss of Rs 1,985, target at Rs 2,136 and Berger Paints with a stop loss of Rs 570, target at Rs 602.",neutral,neutral,0.2642089093702039,neutral,-2.7019380393266386,negative
2020-10-01 08:53:00.000,491.67,494.08,485.29,490.96,1086641.0,"Top buy and sell ideas by Ashwani Gujral, Sudarshan Sukhani for short term","Sudarshan Sukhani of s2analytics.com suggests buying Berger Paints with a stop loss of Rs 573, target at Rs 590 and Dr Reddy’s Labs with a stop loss of Rs 5,080, target at Rs 5,300.",neutral,neutral,-0.1444058006386471,neutral,-0.1685279187817226,neutral
2020-10-04 17:05:00.000,492.5,494.83,486.92,491.67,999178.0,"Paint maker Kansai Nerolac expects double-digit growth in 2020, to invest Rs 450 crore","The nearly Rs 5,000-crore Kansai Nerolac, which is 75 per cent owned by the world’s eighth largest player Kansai Paint Co of Japan, overall enjoys 18 per cent market share, making it the second largest player after Asian Paints. The top three--Asian Paints, Nerolac and Berger Paints-control around 6…",positive,positive,-0.1685279187817226,neutral,2.8946991843326386,positive
2020-10-06 11:16:00.000,489.17,508.12,489.17,503.33,3384654.0,"Paint stocks in focus; Asian Paints, Berger Paints hit record highs","In the past three months, Asian Paints (up 22 per cent) and Berger Paints (up 19 per cent) outpaced the benchmark index, which gained 8 per cent during the same period",neutral,positive,2.8946991843326386,positive,0.1561789534033213,neutral
2020-10-07 07:50:00.000,505.83,509.92,501.0,506.62,2204537.0,"Weekly stock picks by Religare Broking: Buy Berger Paints, HDFC Life",Berger Paints has resumed the uptrend and is currently trading at its record high. Indications are in the favor of prevailing momentum to extend upside further,neutral,positive,0.1561789534033213,neutral,0.260784313725487,neutral
2020-10-08 07:25:00.000,510.0,514.5,503.46,511.33,1678604.0,"Hot Stocks | Siemens, Berger Paints two buy calls for the short term","Nifty is nicely poised above its 20, 50, 100-day exponential moving averages (EMA) on a daily interval which is positive for the Indian bourses.",neutral,positive,0.260784313725487,neutral,-2.048780487804878,negative
2020-10-20 22:05:00.000,515.88,519.17,500.33,504.12,1583933.0,"IIT Guwahati in association, Berger Paints jointly launch multi-surface protector","IIT claimed that the innovation protects surfaces from germs, bacteria and viruses for a period of 24 hours and prevent its spread. The product can protect desk, car seat, door handle, keys, buttons, bags etc. from the viruses. The innovation is designed on the Advanced Nanosilver Technology and is …",positive,neutral,-2.279599906955104,negative,0.4612308727754981,neutral
2020-10-21 09:35:00.000,515.88,519.17,500.33,504.12,1583933.0,"Buy Berger Paints, target price Rs 720: Edelweiss","Berger Paints (India) Ltd., incorporated in the year 1923, is a Large Cap company (having a market cap of Rs 59749.44 Crore) operating in Building Materials sector.",neutral,neutral,-2.279599906955104,negative,0.4612308727754981,neutral
2020-10-29 13:50:00.000,527.38,531.67,514.38,519.92,3864157.0,"Paint shares shine in a weak market; Asian, Berger Paints hit record highs","In the past three months, Asian Paints and Berger Paints have rallied 28 per cent and 19 per cent, respectively as compared to a 4.6 per cent rise in the benchmark Sensex",negative,positive,-1.4145398005233487,negative,0.4144520981637626,neutral
2020-10-29 16:47:00.000,527.38,531.67,514.38,519.92,3864157.0,"Taking Stock: Nifty ends below 11,700 on expiry day","Long buildup was seen in Godrej Properties, SRF and Berger Paints, while short buildup was seen in PFC, L&T and Escorts.",neutral,neutral,-1.4145398005233487,negative,0.4144520981637626,neutral
2020-11-05 05:30:00.000,537.33,542.21,533.54,539.67,1496162.0,BRIEF-Berger Paints India Sept-Quarter Consol Profit Rises - Investing.com India,"The Financial News section features stock market news in addition to stories about bonds, forex, commodities and economic releases.",neutral,neutral,0.4354865724973327,neutral,-2.0454545454545454,negative
2020-11-05 07:44:00.000,537.33,542.21,533.54,539.67,1496162.0,MARKETS: Sensex leaps 600 pts on firm global cues; Nifty Bank at 8-mth high,"Catch all the live market updates here. SC adjourns hearing in interest waiver case to November 18. Berger Paints, Emami, and 125 other companies to announce quarterly results",neutral,neutral,0.4354865724973327,neutral,-2.0454545454545454,negative
2020-11-05 08:04:00.000,537.33,542.21,533.54,539.67,1496162.0,"Stocks in the news: Berger Paints, HPCL, Adani Enterprises, PVR, Inox Leisure & Adani Power","Oil marketing player Hindustan Petroleum Corporation Limited (HPCL) on Wednesday said the board has approved the proposal to buyback 10 crore shares, or 6.56 per cent equity stake, at Rs 250 per share.",neutral,positive,0.4354865724973327,neutral,-2.0454545454545454,negative
2020-11-05 08:13:00.000,537.33,542.21,533.54,539.67,1496162.0,"Market Ahead, November 5: Top factors that could guide markets today","A total of 127 companies including Berger Paints, Emami, and Godrej Consumer Products are scheduled to announce their results today",neutral,neutral,0.4354865724973327,neutral,-2.0454545454545454,negative
2020-11-05 08:48:00.000,537.33,542.21,533.54,539.67,1496162.0,"Stocks to watch: Pidilite Ind, PVR, Inox Leisure, HPCL, Berger Paints",Heres a list of stocks that may trade actively in todays session.,neutral,neutral,0.4354865724973327,neutral,-2.0454545454545454,negative
2020-11-05 08:57:00.000,537.33,542.21,533.54,539.67,1496162.0,"Stocks in focus: Adani Power, Berger Paints, HPCL, PVR, Inox Leisure, PNB Housing Finance, to remain in buzz","A total of 127 listed companies including ABB India, Aditya Birla Capital, Adani Power, Adani Transmission, AstraZeneca Pharma, Bajaj Electricals, are scheduled to announce their July-September quarter earnings today.",neutral,neutral,0.4354865724973327,neutral,-2.0454545454545454,negative
2020-11-05 11:12:00.000,537.33,542.21,533.54,539.67,1496162.0,Berger Paints Q2 up 13.6% at Rs221.05cr despite 5-fold tax burden,"Berger Paints reported 9.01% increase in the Sep-20 quarter top line sales revenues at Rs1,742.55cr.",positive,positive,0.4354865724973327,neutral,-2.0454545454545454,negative
2020-11-05 18:07:00.000,550.0,558.33,538.75,538.75,6193798.0,Berger Paints India consolidated net profit rises 13.31% in the September 2020 quarter,Sales rise 9.01% to Rs 1742.55 crore,positive,positive,-2.0454545454545454,negative,0.5639480058428628,neutral
2020-11-05 18:48:26.000,550.0,558.33,538.75,538.75,6193798.0,Berger Paints Sept quarter net profit increases 13.55% to Rs 221 crore,Berger Paints India Ltd on Thursday reported an increase of 13.55 per cent in its consolidated net profit to Rs 221.05 crore for the second quarter ended September 2020,positive,positive,-2.0454545454545454,negative,0.5639480058428628,neutral
2020-11-05 19:24:00.000,550.0,558.33,538.75,538.75,6193798.0,Berger Paints Q2 net profit up 13.55% at Rs 221 crore,"The company had posted a net profit of Rs 194.66 crore during the July-September quarter of the previous fiscal, Berger Paints India said in a regulatory filing.",positive,positive,-2.0454545454545454,negative,0.5639480058428628,neutral
2020-11-06 07:56:35.000,550.0,558.33,538.75,538.75,6193798.0,"Stocks To Watch: Adani Power, Berger Paints, Cipla, Inox Leisure, ITC, RIL",Here are the stcks to watch in trade today.,neutral,neutral,-2.0454545454545454,negative,0.5639480058428628,neutral
2020-11-06 08:27:00.000,550.0,558.33,538.75,538.75,6193798.0,"Stocks in the news | RIL, HFCL, ITC, Dish TV India, Adani Transmission, Axis Bank, Minda Corporation","Berger Paints, Dalmia Bharat, Adani Power, Chambal Fertilisers, Indiabulls Housing Finance, Inox Leisure, Aditya Birla Capital, Container Corporation of India, Torrent Power, Matrimony.com, are also among the stocks in focus today.",neutral,neutral,-2.0454545454545454,negative,0.5639480058428628,neutral
2020-11-06 08:32:00.000,550.0,558.33,538.75,538.75,6193798.0,"RIL, Berger Paints India, Axis Bank in focus","Shares of Reliance Industries (RIL) will be in focus. The Public Investment Fund (PIF) will invest Rs 9,555 crore (approximately $1.3 billion) for an equity stake of 2.04% into Reliance Retail Ventures (RRVL), a subsidiary of Reliance Industries",neutral,neutral,-2.0454545454545454,negative,0.5639480058428628,neutral
2020-11-06 09:24:00.000,550.0,558.33,538.75,538.75,6193798.0,"Berger Paints Consolidated September 2020 Net Sales at Rs 1,742.55 crore, up 9.01% Y-o-Y",,positive,neutral,-2.0454545454545454,negative,0.5639480058428628,neutral
2020-11-06 09:37:00.000,550.0,558.33,538.75,538.75,6193798.0,Berger Paints climbs after Q2 PAT rises 14% to Rs 221 cr,"Berger Paints India rose 3.18% to Rs 667.50 after consolidated net profit jumped 13.6% to Rs 221.05 crore on 9% rise in net sales to Rs 1,742.55 crore in Q2 September 2020 over Q2 September 2019.",positive,positive,-2.0454545454545454,negative,0.5639480058428628,neutral
2020-11-06 10:07:00.000,550.0,558.33,538.75,538.75,6193798.0,"Berger Paints gains over 4%, hits record high after Q2 result announcement","Revenue from operations grew 9 per cent to Rs 1,742.55 crore during the quarter under review.",positive,positive,-2.0454545454545454,negative,0.5639480058428628,neutral
2020-11-06 12:18:00.000,550.0,558.33,538.75,538.75,6193798.0,Berger Paints share climbs over 4% post Q2 earnings,Berger Paints share rose hit a fresh all-time high in early trade after the firm reported a 13.55 percent increase in its Q2 net profit. Share of Berger Paints gained 4.3% to Rs 675.45 against previous close of Rs 646.95 on BSE. Berger Paints stock has ri,positive,positive,-2.0454545454545454,negative,0.5639480058428628,neutral
2020-11-09 11:18:00.000,540.83,546.0,536.25,543.88,1304829.0,"Berger Paints: Q2 performance shines, but time to book profit",The trajectory of recovery appears unclear for Berger owing to uncertainty around the virus,neutral,negative,0.5639480058428628,neutral,-1.470128820037856,negative
2020-11-10 11:28:00.000,544.17,544.17,531.75,536.17,1126719.0,"Sell Berger Paints, target price Rs 480: Emkay Global","Berger Paints (India) Ltd., incorporated in the year 1923, is a Large Cap company (having a market cap of Rs 62813.64 Crore) operating in Building Materials sector.",neutral,neutral,-1.470128820037856,negative,0.6279464102707445,neutral
2020-11-11 07:01:00.000,536.67,542.92,531.67,540.04,1246582.0,Broker’s call: Berger Paints (Sell),"IDBI CapitalBerger Paints (Sell) Target: ₹518CMP: ₹641.45Berger Paints results were above expectations. The company has outperformed competition (Asian Paints, Kansai Nerolac) on volume growth in deco",neutral,positive,0.6279464102707445,neutral,0.5704548822047787,neutral
2020-11-11 15:03:00.000,539.92,546.75,535.33,543.0,1492612.0,Berger Paints Marginally Outperforms Leader; Premium Unjustified - Investing.com India,Read Berger Paints Marginally Outperforms Leader; Premium Unjustified by Jay Gandhi on Investing.com India,neutral,neutral,0.5704548822047787,neutral,-0.5838797612907903,neutral
2020-11-12 09:05:10.000,539.92,546.75,535.33,543.0,1492612.0,‘Sell’ on Berger Paints with revised FV of Rs 505,We increase our FY2021E EPS by 12% as we incorporate better-than-estimated recovery in the business and raise FY2022-23E EPS by 5%.,neutral,positive,0.5704548822047787,neutral,-0.5838797612907903,neutral
2020-11-12 19:21:00.000,542.92,546.33,538.0,539.75,906195.0,Hold Berger Paints India; target of Rs 675: ICICI Direct,"ICICI Direct recommended hold rating on Berger Paints India with a target price of Rs 675 in its research report dated November 11, 2020.",neutral,positive,-0.5838797612907903,neutral,0.5555967108674716,neutral
2020-12-04 16:02:27.000,555.83,560.58,551.25,559.33,808525.0,"Berger Paints eyeing ‘higher than mid-teen’ value growth in H2: Abhijit Roy, MD & CEO",This is thanks to recovery in decorative paints segment; softer prices of crude and raw materials helped improve margins,positive,positive,0.6296889336667686,neutral,0.0733229608169397,neutral
2020-12-07 17:45:00.000,560.17,564.79,552.12,557.5,813866.0,"Market Movers: Asian Paints, Berger Paints, Kansai Nerolac hit new 52-week high; 45 stocks flash ‘Buy’ signals",45 stocks on the NSE flashed ’buy signal on the MACD indicator during Mondays trade.,neutral,positive,-0.4766410196904438,neutral,1.2833381129911243,positive
2020-12-08 09:18:56.000,560.17,564.79,552.12,557.5,813866.0,"Top Buy And Sell Ideas By Mitessh Thakkar, Sudarshan Sukhani For Short Term","Sudarshan Sukhani of s2analytics.com suggests buying Apollo Hospitals with a stop loss of Rs 2,401, target at Rs 2,508 and Berger Paints with a stop loss of Rs 657, target at Rs 703.",neutral,neutral,-0.4766410196904438,neutral,1.2833381129911243,positive
2020-12-22 21:52:00.000,596.67,613.54,591.96,612.5,2407555.0,Top 10 consistent and biggest wealth creators of Dalal Street,"Berger Paints and HDFC delivered CAGR returns of 24 per cent and 19 per cent, respectively.",neutral,neutral,2.6530578041463526,positive,-0.7995059962949657,neutral
2020-12-23 12:09:00.000,615.38,615.38,601.38,610.46,1185017.0,Berger Paints hits record high; rises 5% in two days,"Berger Paints India gained 2.17% to Rs 727.85, rising for the second consecutive trading session.",positive,positive,-0.7995059962949657,neutral,0.8574928542262148,neutral
2020-12-31 18:14:00.000,632.92,641.62,629.58,638.08,709926.0,"Market movers: Tejas Networks, Jubilant Food zoom; 87 stocks turn overbought","Nearly 300 stocks hit the 52-week highs during the session. Asian Paints, Bajaj Finance, Berger Paints, DMart, HDFC, JSW Steel, Motherson Sumi Systems, Info Edge, Tata Steel, Tech Mahindra and Titan were top names.",neutral,neutral,0.8152689123428052,neutral,1.566587815079974,positive
2021-01-03 11:49:00.000,638.33,649.88,637.75,648.33,868159.0,"The week that was in 10 stocks: Asian Paints, Berger Paints log new highs; Antony Waste makes solid debut",The market exuberance was broad-based with 409 of BSE 500 stocks logging gains.,positive,positive,1.566587815079974,positive,2.471691409327545,positive
2021-01-21 11:04:05.000,662.58,685.79,660.42,672.67,3603472.0,Volumes spurt at Berger Paints India Ltd counter,"Berger Paints India Ltd registered volume of 2.9 lakh shares by 10:48 IST on BSE, a 6.88 fold spurt over two-week average daily volume of 42171 shares",neutral,positive,1.522834978417688,positive,-4.786966677508056,negative
2021-02-02 13:04:37.000,614.17,614.17,596.08,607.0,1890996.0,"Budget to give push to infra, healthcare, BFSI: Abhijit Roy, CEO, Berger Paints",‘Another year of tax holiday for affordable housing to boost construction sector’,neutral,positive,-1.1674292134099613,negative,0.7242330683833808,neutral
2021-02-09 05:30:00.000,632.0,641.25,627.25,639.17,3252108.0,BRIEF-Berger Paints India Dec-Qtr Consol Net Profit Rises,BRIEF-Berger Paints India Dec-Qtr Consol Net Profit Rises,neutral,neutral,1.1344936708860691,positive,-2.058461538461538,negative
2021-02-09 07:38:00.000,632.0,641.25,627.25,639.17,3252108.0,"Stocks in the news: Adani Ports, Tata Steel, Berger Paints, Bodal Chemicals and UltraTech Cement","Muthoot Finance, Max Financial India, Indian Overseas Bank, Endurance Technologies and Torrent Power are among companies, which will disclose their third quarter results today.",neutral,neutral,1.1344936708860691,positive,-2.058461538461538,negative
2021-02-09 07:44:33.000,632.0,641.25,627.25,639.17,3252108.0,"Stocks To Watch: Adani Ports & SEZ, Berger Paints, BPCL, Future Retail, NMDC, Sun TV, Tata Steel",Here are the stocks to watch in trade today,neutral,neutral,1.1344936708860691,positive,-2.058461538461538,negative
