date,open,high,low,close,volume,title,description,title_sentiment,desc_sentiment,daily_change_pct,market_sentiment,next_day_change_pct,next_day_sentiment
2021-05-26 20:02:40.000,693.62,694.17,655.12,665.83,5195206.0,Berger Paints Q4 standalone net dips 5% to ₹185 crore,Revenue from operations up 53%,neutral,positive,-4.006516536432047,negative,-0.2238805970149253,neutral
2021-05-26 20:11:00.000,693.62,694.17,655.12,665.83,5195206.0,"Berger Paints Q4 net profit at Rs 209 crore on revenue of Rs 2,026 crore",Berger Paints is the second largest paint company in India with 16 manufacturing units.,positive,neutral,-4.006516536432047,negative,-0.2238805970149253,neutral
2021-05-26 20:33:50.000,693.62,694.17,655.12,665.83,5195206.0,"Berger Paints Standalone March 2021 Net Sales At Rs 1,797.04 Crore, Up 52.96% Y-o-Y",,neutral,neutral,-4.006516536432047,negative,-0.2238805970149253,neutral
2021-05-27 00:27:50.000,693.62,694.17,655.12,665.83,5195206.0,"Stocks to watch: BPCL, Berger Paints, Arvind, Manappuram Finance, Pfizer, Burger King among others","When the markets open on May 27, there may be some stocks that may be buzzing.Given below are the list of some of those stocks:Berger Paints India: The paint reported more than doubling of consolidated net profit to Rs 208.60 crore for the fourth quarter ended M…",neutral,positive,-4.006516536432047,negative,-0.2238805970149253,neutral
2021-05-27 07:35:00.000,693.62,694.17,655.12,665.83,5195206.0,"Stocks in the news: BPCL, Sun Pharma, Eicher Motors, Berger Paints and Cadila Healthcare","UCO Bank, Aegis Logistics, Solar Industries, HEG, Metropolis, Fine Organic, India Grid, Wockhardt are among companies that will announce their March quarter results today.",neutral,neutral,-4.006516536432047,negative,-0.2238805970149253,neutral
2021-05-27 09:24:00.000,693.62,694.17,655.12,665.83,5195206.0,"Stocks in news: BPCL, Berger Paints, Burger King India, Pfizer and more","Stocks in news: BPCL, Berger Paints, Burger King India, Pfizer, Cummins India, Aster DM Healthcare and more",neutral,neutral,-4.006516536432047,negative,-0.2238805970149253,neutral
2021-05-27 10:47:46.000,693.62,694.17,655.12,665.83,5195206.0,Berger Paints Share Price Falls 4% On Muted Q4 Results; Brokerages Maintain Underperform Rating,Macquarie has maintained underperform call on the stock with target at Rs 600 per share. It is of the view that profit was below estimates as sales beat was offset by higher expenses.,neutral,negative,-4.006516536432047,negative,-0.2238805970149253,neutral
2021-05-28 06:10:00.000,670.0,677.88,664.42,668.5,1772015.0,"Margin worries, valuations weigh on Berger Paints; stock falls 4%","The company’s Q4 show, however, was better than market leader Asian Paints",negative,positive,-0.2238805970149253,neutral,0.3799323899841561,neutral
2021-05-28 15:35:02.000,670.0,677.88,664.42,668.5,1772015.0,"Covid Surge Won’t Delay New Launches, Capex For Berger Paints",Berger Paints is cautious about a recovery in rural demand after the second Covid-19 wave.,neutral,neutral,-0.2238805970149253,neutral,0.3799323899841561,neutral
2021-05-30 19:27:00.000,668.54,678.25,666.0,671.08,1150479.0,Why Berger Paints Share Fell Down 4% On Friday?,Why Berger Paints Share Fell Down 4% On Friday?,neutral,neutral,0.3799323899841561,neutral,-1.055577887950916,negative
2021-06-02 11:35:00.000,663.33,670.17,655.0,660.42,1221689.0,"Asian Paints, Berger Paints: Can rising crude oil prices dent sentiment?",Shares of Asian Paints and Berger Paints India hit their respective record highs on the BSE in May,neutral,positive,-0.4386956718375592,neutral,2.154816197851312,positive
2021-06-02 13:49:00.000,653.42,668.54,653.42,667.5,2048200.0,Berger Paints has hiked price once and will do so again around July 1: CEO,"“We have already hiked prices of water based products which is covering most of the increases of raw material prices. We need to hike prices of solvent-based products next, ” says Abhijit Roy.",positive,positive,2.154816197851312,positive,-0.0677078631398461,neutral
2021-06-02 14:09:00.000,653.42,668.54,653.42,667.5,2048200.0,Share price of Berger Paints falls as Nifty weakens,"A total of 23,567 shares changed hands on the counter till 02:09PM (IST).",neutral,neutral,2.154816197851312,positive,-0.0677078631398461,neutral
2021-06-04 12:36:00.000,664.62,670.42,661.96,664.17,740838.0,Berger Paints shares down 0.4% as Nifty drops,"A total of 18,196 shares changed hands on the counter till 12:35PM (IST).",negative,neutral,-0.0677078631398461,neutral,1.7148368041951714,positive
2021-06-04 13:28:54.000,664.62,670.42,661.96,664.17,740838.0,Hold Berger Paints India; Target Of Rs 835: ICICI Direct,"ICICI Direct recommended hold rating on Berger Paints India with a target price of Rs 835 in its research report dated Jun 03, 2021.",neutral,positive,-0.0677078631398461,neutral,1.7148368041951714,positive
2021-06-07 12:36:00.000,675.54,680.0,670.83,673.25,572286.0,Berger Paints shares gain 1.15% as Sensex rises,"A total of 31,199 shares changed hands on the counter till 12:35PM (IST)",positive,neutral,-0.3389880688042105,neutral,-0.9570370370370423,negative
2021-06-11 13:24:00.000,677.0,678.92,669.17,671.5,271552.0,Berger Paints shares drop 0.59% as Sensex rises,"A total of 14,420 shares changed hands on the counter till 01:24PM (IST)",negative,neutral,-0.8124076809453471,neutral,0.5463342017119404,neutral
2021-06-14 11:24:00.000,671.75,676.67,662.75,675.42,496325.0,Berger Paints shares gain 0.02% as Sensex falls,"A total of 7,424 shares changed hands on the counter till 11:24AM (IST)",positive,neutral,0.5463342017119404,neutral,1.4857565667776491,positive
2021-06-16 12:51:00.000,679.62,691.62,672.54,683.04,770915.0,Shares of Berger Paints fall as Nifty drops,"On the technical charts, the 200-day moving average of the stock stood at Rs 698.66.",neutral,neutral,0.5032223889820722,neutral,0.669835466179165,neutral
2021-06-17 11:17:00.000,679.62,691.62,672.54,683.04,770915.0,Berger Paints rises 0.28% as Sensex slides,"The stock traded at a P/E multiple of 110.66, while the price-to-book value ratio stood at 18.16.",positive,neutral,0.5032223889820722,neutral,0.669835466179165,neutral
2021-06-18 10:10:00.000,683.75,695.83,676.62,688.33,1534985.0,Share price of Berger Paints rises as Nifty weakens,"A total of 17,009 shares changed hands on the counter till 10:10AM (IST).",positive,neutral,0.669835466179165,neutral,0.5710123816460246,neutral
2021-06-21 08:51:00.000,686.5,694.96,682.42,690.42,725660.0,"Buy Berger Paints, target price Rs 855: Yes Securities","Berger Paints (India) Ltd., incorporated in the year 1923, is a Large Cap company (having a market cap of Rs 80190.12 Crore) operating in Building Materials sector.",neutral,neutral,0.5710123816460246,neutral,-3.0539068450627305,negative
2021-06-21 10:31:00.000,686.5,694.96,682.42,690.42,725660.0,Berger Paints shares up 1.08% as Nifty drops,"A total of 12,871 shares changed hands on the counter till 10:31AM (IST).",positive,neutral,0.5710123816460246,neutral,-3.0539068450627305,negative
2021-06-22 13:06:00.000,678.33,681.54,669.79,672.5,580070.0,Berger Paints shares drop 1.06% as Sensex rises,The stock quoted a 52-week high of Rs 842.55 and a 52-week low of Rs 488.45.,negative,negative,-0.8594636828682265,neutral,0.2718481215740512,neutral
2021-06-24 12:59:00.000,677.5,680.0,670.0,671.58,362878.0,Berger Paints shares up 0.29% as Nifty gains,"A total of 6,979 shares changed hands on the counter till 12:59PM (IST).",positive,neutral,-0.873800738007374,neutral,-0.1410898073752907,neutral
2021-06-25 14:08:00.000,677.5,680.0,670.0,671.58,362878.0,Berger Paints shares drop 0.76% as Sensex rises,The stock quoted a 52-week high of Rs 842.55 and a 52-week low of Rs 488.45.,negative,negative,-0.873800738007374,neutral,-0.1410898073752907,neutral
2021-06-27 15:09:00.000,673.33,680.67,669.67,672.38,455755.0,Berger Paints eyeing double digit volume in FY22,The company clocked a sales growth of over 7% and 13% in value and volume terms,positive,positive,-0.1410898073752907,neutral,-0.0610046423044997,neutral
2021-06-29 11:17:00.000,672.08,678.33,669.38,671.67,485424.0,Share price of Berger Paints jumps as Sensex drops 126.84 points,"A total of 6,831 shares changed hands on the counter till 11:17AM (IST)",positive,neutral,-0.0610046423044997,neutral,0.0625698324022285,neutral
2021-07-07 11:04:59.000,679.08,708.33,678.42,706.67,3455250.0,Volumes spurt at Berger Paints India Ltd counter,"Berger Paints India Ltd notched up volume of 3.01 lakh shares by 10:49 IST on BSE, a 12.19 fold spurt over two-week average daily volume of 24677 shares",neutral,positive,4.06284973788065,positive,-1.3554598429186715,negative
2021-07-12 20:29:47.000,706.67,706.67,696.17,700.0,546940.0,Berger Paints Q1 PAT Seen Up 716% YoY To Rs. 123.1 Cr: ICICI Direct,"Net Sales are expected to increase by 59.7 percent Y-o-Y (down 26.7 percent Q-o-Q) to Rs. 1,486 crore, according to ICICI Direct.",neutral,positive,-0.943863472342106,negative,0.0057146122635527,neutral
2021-07-14 08:17:00.000,699.96,701.88,693.58,700.0,450460.0,"Three stocks Ajit Mishra is bullish on: Buy Bata India, Berger Paints",Berger Paints after the recent up move has been consolidating in a narrow range around its record high,positive,neutral,0.0057146122635527,neutral,-0.2311544882496475,neutral
2021-07-22 12:13:00.000,713.08,720.0,709.46,710.83,758165.0,Tech View: How to trade paint stocks amid drop in crude oil prices?,Share of Asian Paints and Berger Paints recorded new all-time highs in trade on Thursday,neutral,positive,-0.3155326190609749,neutral,0.2527070715626845,neutral
2021-07-22 22:43:36.000,713.08,720.0,709.46,710.83,758165.0,"Hot Stocks | Asian Paints, Berger Paints India, DMart Can Give Up To 19% Return In Short Term","“The key support levels for the Nifty in the short term are 15,430 and 15,145. On the upside, the key resistance level is 15,962,” said Vidnyan Sawant of GEPL Capital.",neutral,neutral,-0.3155326190609749,neutral,0.2527070715626845,neutral
2021-08-06 08:19:28.000,698.33,705.08,681.38,684.67,2307382.0,"RBI policy to steer markets; Tata Power, financials, auto stocks in focus","Among key companies Hindalco Industries, Mahindra & Mahindra, Berger Paints (India), Muthoot Finance, Piramal Enterprises, Steel Authority of India, Bharat Electronics, Tata Power, AU Small Finance and Abbott India will announce June quarter earnings today.",neutral,neutral,-1.9560952558246216,negative,-1.7117989792820156,negative
2021-08-06 13:23:00.000,698.33,705.08,681.38,684.67,2307382.0,"Important results today: Mahindra & Mahindra, Hindalco, Alkem Lab, JK Tyre among others","Balkrishna Industries, BASF India, Bharat Electronics, BEML, Berger Paints India, Graphite India, Indigo Paints are among the companies that will announce their June quarter results today.",neutral,neutral,-1.9560952558246216,negative,-1.7117989792820156,negative
2021-08-06 16:17:00.000,698.33,705.08,681.38,684.67,2307382.0,Berger Paints India consolidated net profit rises 811.74% in the June 2021 quarter,Sales rise 93.23% to Rs 1798.49 crore,positive,positive,-1.9560952558246216,negative,-1.7117989792820156,negative
2021-08-06 17:06:55.000,698.33,705.08,681.38,684.67,2307382.0,Berger Paints India’s net profit jumps multi-fold to Rs 140 cr in June quarter,"Berger Paints India on Friday reported multi-fold jump in its consolidated net profit to Rs 140.48 crore for the first quarter ended June 30.The company had posted a net profit of Rs 15.09 crore during the April-June quarter of the previous financial year, Berger Paints India said in a reg…",positive,positive,-1.9560952558246216,negative,-1.7117989792820156,negative
2021-08-06 19:59:47.000,698.33,705.08,681.38,684.67,2307382.0,Berger Paints clocks ₹135-cr net in Q1,Reports 170 per cent rise against same quarter last year,neutral,positive,-1.9560952558246216,negative,-1.7117989792820156,negative
2021-08-06 23:26:00.000,698.33,705.08,681.38,684.67,2307382.0,Berger Paints India net profit jumps 9-fold to Rs 140 crore in June quarter,Berger Paints India on Friday reported multi-fold jump in its consolidated net profit to Rs 140.48 crore for the first quarter ended June 30,positive,positive,-1.9560952558246216,negative,-1.7117989792820156,negative
2021-08-08 11:43:00.000,691.67,693.25,674.38,679.83,1200503.0,Situation complicated but paint industry has growth potential: Berger,"Though the situation remains “complicated”, the paint industry essentially provides “growth potential” in view of pent up demand, Berger Paints has said",neutral,neutral,-1.7117989792820156,negative,0.0,neutral
2021-08-08 12:45:00.000,691.67,693.25,674.38,679.83,1200503.0,"Situation ‘complicated’ but paint industry offers growth potential, says Berger Paints","Moreover, there is a gradual shift from unorganised to organised players led by better consumer awareness in the segment and per capita paint consumption in India is expected to boost the paint and coatings industry, said the latest annual report of Berger Paints.",positive,positive,-1.7117989792820156,negative,0.0,neutral
2021-08-08 17:30:00.000,691.67,693.25,674.38,679.83,1200503.0,"Situation ‘complicated’ but paint industry has growth potential, says Berger Paints","There is a gradual shift from unorganised to organised players and per capita paint consumption in India is expected to boost the paint and coatings industry, said the latest annual report of Berger Paints",neutral,positive,-1.7117989792820156,negative,0.0,neutral
2021-08-09 15:09:31.000,678.33,682.75,671.92,678.33,569111.0,"Berger Paints Q1 - Market Share Gains In Value-For-Money Emulsions, Putty, Waterproofing: ICICI Securities","Berger Paints Q1 - Market Share Gains In Value-For-Money Emulsions, Putty, Waterproofing: ICICI Securities",neutral,neutral,0.0,neutral,0.89818590084501,neutral
2021-08-10 10:44:26.000,678.33,682.75,671.92,678.33,569111.0,"Berger Paints Standalone June 2021 Net Sales At Rs 1,619.21 Crore, Up 96% Y-o-Y",,neutral,neutral,0.0,neutral,0.89818590084501,neutral
2021-08-10 16:54:00.000,676.92,685.0,665.96,683.0,846520.0,"Demand robust and may remain like this going forward: Abhijit Roy, Berger Paints",“It seems that demand is pretty strong and probably will remain like this going forward.”,neutral,positive,0.89818590084501,neutral,-0.6714754867464287,neutral
2021-08-10 16:54:00.000,676.92,685.0,665.96,683.0,846520.0,"Demand to remain robust, expect to retain margins at this level: Berger Paints MD",“It seems that demand is pretty strong and probably will remain like this going forward.”,positive,positive,0.89818590084501,neutral,-0.6714754867464287,neutral
2021-08-11 15:27:09.000,682.08,689.08,671.21,677.5,761117.0,Berger Paints Q1 Review - Strong Performance Continues: Dolat Capital,Berger Paints Q1 Review - Strong Performance Continues: Dolat Capital,neutral,neutral,-0.6714754867464287,neutral,-0.5149557873673989,neutral
2021-08-12 15:08:15.000,679.67,687.5,674.21,676.17,950896.0,Berger Paints - Time To Book Profit?,Berger’s stock has had a stellar run in the recent past and its market capitalisation increased by more than 50 per cent in the past 12 months,neutral,positive,-0.5149557873673989,neutral,-0.4653484241276658,neutral
2021-08-13 12:07:00.000,679.67,687.5,674.21,676.17,950896.0,"Results Review for Berger Paints, Eicher Motors, Bharat Forge, Max Healthcare","Results Review for Berger Paints, Eicher Motors, Bharat Forge, Max Healthcare",neutral,neutral,-0.5149557873673989,neutral,-0.4653484241276658,neutral
2021-08-17 19:35:33.000,683.29,686.83,675.04,679.96,523423.0,Buy Berger Paints India; Target Of Rs 860: ICICI Direct,"ICICI Direct is bullish on Berger Paints India has recommended buy rating on the stock with a target price of Rs 860 in its research report dated August 12, 2021.",neutral,positive,-0.4873479781644583,neutral,0.1354774106143546,neutral
2021-08-24 09:22:33.000,663.25,667.92,652.08,660.79,1293079.0,"Berger Paints Consolidated June 2021 Net Sales At Rs 1,798.49 Crore, Up 93.23% Y-o-Y",,neutral,neutral,-0.3709008669430888,neutral,-0.8197093207906826,neutral
2021-08-27 19:28:18.000,657.79,658.92,646.08,654.92,825318.0,"Berger Paints India eyes ₹10,000 crore turnover by FY24",Top-line expected to grow on the back of organic expansion in India,neutral,positive,-0.4363094604661069,neutral,2.019696969696976,positive
2021-08-27 19:41:00.000,657.79,658.92,646.08,654.92,825318.0,"Berger Paints eyes Rs 10,000 crore turnover in three years","Berger is also growing its international presence, major contributor to the growth would be the India market and drivers would be the decorative, protective, construction chemicals segments",neutral,positive,-0.4363094604661069,neutral,2.019696969696976,positive
2021-08-27 23:56:28.000,657.79,658.92,646.08,654.92,825318.0,"Berger Paints India aims at achieving Rs 8,000 cr revenue in FY′22","Berger Paints India aims at achieving Rs 8,000 cr revenue in FY′22",positive,positive,-0.4363094604661069,neutral,2.019696969696976,positive
2021-09-07 15:12:00.000,694.92,698.83,689.0,694.75,620038.0,"We’ll roll back prices only if it’s sustainable for us, says Berger Paints CEO, Abhijit Roy","“People are staying at home much longer, work-from-home keeps going on, which means people might end up looking at their walls a lot more, which creates the itch to repaint,” says Roy.",neutral,neutral,-0.0244632475680595,neutral,0.6620224135692842,neutral
2021-09-07 15:12:00.000,694.92,698.83,689.0,694.75,620038.0,Berger Paints to roll back prices only if it’s sustainable: CEO,"“People are staying at home much longer, work-from-home keeps going on, which means people might end up looking at their walls a lot more, which creates the itch to repaint,” says Roy.",neutral,neutral,-0.0244632475680595,neutral,0.6620224135692842,neutral
2021-09-24 07:38:00.000,685.08,710.83,684.21,701.58,2872366.0,"Osho Krishan of Anand Rathi recommends buying Datamatics, Berger Paints","Berger Paints is placed near its strong historical consolidation zone and is expected to surge higher from here onwards, says the technical analyst",neutral,positive,2.4084778420038533,positive,-2.090478755066753,negative
2021-09-30 14:53:00.000,676.08,677.0,665.17,675.83,694318.0,"Asian Paints, Berger Paints extend losses on firm crude oil prices",Asian Paints and Berger Paints India declined for the four straight session amid rising crude oil prices.,negative,negative,-0.0369778724411312,neutral,0.8416118857412261,neutral
2021-10-18 14:08:36.000,698.42,704.71,680.04,685.83,615551.0,Berger Paints Q2 PAT May Dip 0.2% YoY To Rs 220.4 Cr: KRChoksey,"Net Sales are expected to increase by 15 percent Y-o-Y (up 11.4 percent Q-o-Q) to Rs 2,003.9 crore, according to KRChoksey.",neutral,positive,-1.8026402451246983,negative,-2.757243048568899,negative
2021-10-19 12:07:42.000,685.83,685.83,661.96,666.92,1156912.0,Berger Paints Q2 PAT Seen Up 1% YoY To Rs 223.3 Cr: ICICI Direct,"Net Sales are expected to increase by 19.5 percent Y-o-Y (up 15.8 percent Q-o-Q) to Rs 2,082 crore, according to ICICI Direct.",neutral,positive,-2.757243048568899,negative,-6.95286495482645,negative
2021-10-21 15:04:12.000,624.96,633.33,610.0,616.17,1315238.0,Havells India Ltd leads losers in ‘A’ group,"HEG Ltd, Asian Granito India Ltd, Paisalo Digital Ltd and Berger Paints India Ltd are among the other losers in the BSE’s ‘A’ group today, 21 October 2021.",negative,negative,-1.4064900153609954,negative,-3.0275512024259266,negative
2021-10-22 06:05:00.000,624.96,633.33,610.0,616.17,1315238.0,Berger Paints (₹749.80): SELL,The outlook for the stock of Berger Paints is bearish. The stock has been under pressure since the beginning of this week. It fell sharply by 6.2 per cent on Thursday and is down over 10 per cent so f,neutral,negative,-1.4064900153609954,negative,-3.0275512024259266,negative
2021-10-27 10:21:00.000,622.5,639.83,610.54,614.17,4941390.0,"Paint stocks up on price hike reports; Asian, Berger Paints gain up to 6%","Paint companies Asian Paints and Berger Paints have taken high-single-digit price increases across their portfolio in a move to offset the rising inputs costs, indicate reports",positive,positive,-1.3381526104417736,negative,-0.3048632169555833,neutral
2021-11-01 08:36:00.000,621.67,630.75,619.46,630.75,780734.0,From RIL to Berger Paints: Brokerages bet on these stocks for Samvat 2078,Here’s a list of stocks recommended by top brokerage and research firms that can help you build your portfolio this Diwali,neutral,neutral,1.4605819807936753,positive,-0.26314537989634,neutral
2021-11-10 08:14:57.000,647.25,651.58,638.79,645.83,1053050.0,"Nykaa, HDFC, Zee Media, Jet Airways, Power Grid, Berger Paints, Petronet LNG stocks in focus","Nifty futures tumbled over half a per cent or 108.50 points to 17,971.50 on Singaporean Exchange, suggesting a sell-off in BSE Sensex and Nifty 50 on Wednesday",neutral,negative,-0.2193897257628364,neutral,0.5945837139804465,neutral
2021-11-10 18:39:00.000,645.83,659.71,634.21,649.67,2324589.0,Berger Paints Q2 consolidated net profit declines 1% to Rs 219 cr,Berger Paints India Ltd on Wednesday reported 1 per cent decline in consolidated net profit at Rs 219.21 crore for September quarter 2021-22 impacted by high raw material cost and COVID-19.,negative,negative,0.5945837139804465,neutral,1.5197242435848273,positive
2021-11-10 19:06:32.000,645.83,659.71,634.21,649.67,2324589.0,Berger Paints Q2 Net Profit Declines 1% At Rs 219 Crore,"The company, which is into paints and coatings, had posted a net profit of Rs 221.05 crore in the year-ago period.",neutral,positive,0.5945837139804465,neutral,1.5197242435848273,positive
2021-11-10 20:00:55.000,645.83,659.71,634.21,649.67,2324589.0,Berger Paints India Q2 results: Profit declines 1% to Rs 219 cr; impacted by high material costs,Berger Paints India Q2 results: Profit declines 1% to Rs 219 cr; impacted by high material costs,negative,negative,0.5945837139804465,neutral,1.5197242435848273,positive
2021-11-10 20:40:46.000,645.83,659.71,634.21,649.67,2324589.0,Berger Paints Q2 profit down marginally at ₹192 crore,Revenue from operations was up 26 per cent,negative,positive,0.5945837139804465,neutral,1.5197242435848273,positive
2021-11-11 07:36:00.000,645.83,659.71,634.21,649.67,2324589.0,Berger Paints Q2FY22 net profit logs at Rs219.21cr,"PBDIT was Rs353.99cr against Rs335.21cr in the corresponding quarter last year, representing an increase of 5.60%.",neutral,positive,0.5945837139804465,neutral,1.5197242435848273,positive
2021-11-11 08:44:00.000,645.83,659.71,634.21,649.67,2324589.0,"Wipro, Pidilite Industries, Berger Paints, MOIL in focus",Wipro announced that it is has been chosen as a strategic partner in the transformation of Aggreko’s Finance and Procurement function.,neutral,positive,0.5945837139804465,neutral,1.5197242435848273,positive
2021-11-11 10:56:00.000,645.83,659.71,634.21,649.67,2324589.0,Berger Paints India Q2 FY22 PAT slides 1% to Rs 219 cr,"On a consolidated basis, Berger Paints India’s net profit slipped 0.8% to Rs 219.21 crore on a 27.7% surge in net sales to Rs 2,225.01 crore in Q2 September 2021 over Q2 September 2020.",neutral,negative,0.5945837139804465,neutral,1.5197242435848273,positive
2021-11-11 11:11:42.000,645.83,659.71,634.21,649.67,2324589.0,"Berger Paints Consolidated September 2021 Net Sales At Rs 2,225.01 Crore, Up 27.69% Y-o-Y",,neutral,neutral,0.5945837139804465,neutral,1.5197242435848273,positive
2021-11-15 12:04:00.000,666.67,672.29,657.58,659.08,1078050.0,"Results Review for ONGC, Berger Paints, Apollo Hospitals, Hero Motocorp","Results Review for ONGC, Berger Paints, Apollo Hospitals, Hero Motocorp",neutral,neutral,-1.1384943075284502,negative,0.2539923954372561,neutral
2021-11-15 14:04:07.000,666.67,672.29,657.58,659.08,1078050.0,Berger Paints -- Inflation Continues To Weigh On Margins,The demand momentum is very strong across rural as well as urban markets and Berger’s plants are running at close to 90 percent utilisation rate,neutral,positive,-1.1384943075284502,negative,0.2539923954372561,neutral
2021-11-22 10:51:00.000,662.67,663.29,644.58,647.33,942090.0,Berger Paints shares up 0.57% as Nifty falls,The stock quoted a 52-week high price of Rs 872.0 and low of Rs 626.45.,positive,neutral,-2.314877691762102,negative,-1.200918803089393,negative
2021-11-23 13:36:00.000,648.29,648.29,633.33,635.38,1215312.0,Berger Paints shares up 0.22% as Sensex rises,"A total of 165,196 shares changed hands on the counter till 01:36PM (IST)",positive,neutral,-1.991392740902986,negative,-1.4293962517360426,negative
2021-11-23 13:42:57.000,648.29,648.29,633.33,635.38,1215312.0,Berger Paints To Again Hike Prices As Input Costs Soar,Berger Paints is set to again hike prices across its portfolio.,neutral,positive,-1.991392740902986,negative,-1.4293962517360426,negative
2021-11-24 11:58:00.000,648.29,648.29,633.33,635.38,1215312.0,Share price of Berger Paints rises as Nifty strengthens,"A total of 78,935 shares changed hands on the counter till 11:58AM (IST).",positive,neutral,-1.991392740902986,negative,-1.4293962517360426,negative
2021-11-25 11:42:00.000,640.83,641.62,627.75,631.67,1225984.0,Share price of Berger Paints falls as Nifty strengthens,"A total of 12,632 shares changed hands on the counter till 11:42AM (IST).",neutral,neutral,-1.4293962517360426,negative,1.4716456545707175,positive
2021-11-26 10:36:00.000,625.83,638.21,623.58,635.04,884617.0,Berger Paints shares fall 0.62% as Nifty drops,The stock quoted a 52-week high price of Rs 872.0 and a 52-week low of Rs 626.45.,negative,negative,1.4716456545707175,positive,-1.8587301587301648,negative
2021-11-29 12:43:00.000,616.88,640.79,616.0,626.38,3727422.0,Shares of Berger Paints fall as Nifty gains,"On the technical charts, the 200-day moving average of the stock stood at Rs 783.93.",positive,neutral,1.5400077810919466,positive,-2.097913170144716,negative
