date,open,high,low,close,volume,title,description,title_sentiment,desc_sentiment,daily_change_pct,market_sentiment,next_day_change_pct,next_day_sentiment
2021-02-09 10:28:00.000,632.0,641.25,627.25,639.17,3252108.0,"Stocks in focus: Sun TV, Adani Ports, Tata Steel & more","Here are the top stocks that are likely to be in focus in today’s trading. Sun TV, Adani Ports, Tata Steel, Berger Paints, BPCL & more.",neutral,neutral,1.1344936708860691,positive,-2.058461538461538,negative
2021-02-09 10:30:00.000,632.0,641.25,627.25,639.17,3252108.0,Berger Paints Q3 PAT up 50.7% at Rs274.8cr on working capital efficiencies,"Berger Paints reported 24.9% growth in gross revenues for the Dec-20 quarter on consolidated basis at Rs2,118.19cr",positive,positive,1.1344936708860691,positive,-2.058461538461538,negative
2021-02-09 15:51:00.000,650.0,660.67,621.75,636.62,10376070.0,Berger Paints Q3 PAT jumps 51% YoY to Rs 275 cr,"On a consolidated basis, Berger Paints India reported a 51.2% jump in net profit to Rs 274.98 crore on 25% rise in revenue from operations to Rs 2,118.2 crore in Q3 FY21 over Q3 FY20.",neutral,positive,-2.058461538461538,negative,1.082050233552993,positive
2021-02-09 16:56:00.000,650.0,660.67,621.75,636.62,10376070.0,Berger Paints Q3 results: Net profit jumps 51% to Rs 275 cr,"Revenue from operations of the company stood at Rs 2,118.2 crore, up 25 per cent, during the quarter under review as against Rs 1,695.9 crore in the corresponding period of the last fiscal, Berger Paints said in a BSE filing.",positive,positive,-2.058461538461538,negative,1.082050233552993,positive
2021-02-09 18:48:49.000,650.0,660.67,621.75,636.62,10376070.0,Berger Paints Q3 Net Jumps 51.2% To Rs 275 Crore,It had posted a net profit of Rs 181.9 crore in the October-December quarter a year ago.,neutral,positive,-2.058461538461538,negative,1.082050233552993,positive
2021-02-09 20:46:06.000,650.0,660.67,621.75,636.62,10376070.0,Berger Paints posts 53% rise in profit at ₹253 cr,"Berger Paints India Ltd posted 53 per cent rise in net profit at ₹253 crore for the quarter ended December 31, 2020, as against ₹165 crore same period last year.Revenue from operations increased by 24",positive,positive,-2.058461538461538,negative,1.082050233552993,positive
2021-02-09 22:55:57.000,650.0,660.67,621.75,636.62,10376070.0,"Berger Paints Consolidated December 2020 Net Sales At Rs 2,118.19 Crore, Up 24.9% Y-o-Y",,neutral,neutral,-2.058461538461538,negative,1.082050233552993,positive
2021-02-10 07:31:38.000,650.0,660.67,621.75,636.62,10376070.0,Results: Berger Paints Q3 net jumps 51% to Rs 275 crore,"Berger Paints on Tuesday reported a 51.2 per cent jump in consolidated net profit to Rs 275 crore for the third quarter ended December 2020.It had posted a net profit of Rs 181.9 crore in the October-December quarter a year ago.Revenue from operations of the company stood at Rs 2,11…",positive,positive,-2.058461538461538,negative,1.082050233552993,positive
2021-02-10 07:34:28.000,650.0,660.67,621.75,636.62,10376070.0,"Stocks In The News | Berger Paints, InterGlobe Aviation, Neuland Labs, Raymond, IG Petrochemicals","Mahanagar Gas, PPAP Automotive, Siti Networks, Tata Steel, Gujarat Mineral Development Corporation, are also among the stocks in focus today.",neutral,neutral,-2.058461538461538,negative,1.082050233552993,positive
2021-02-10 08:31:00.000,650.0,660.67,621.75,636.62,10376070.0,"Tata Steel, Berger Paints, Glenmark Pharma in focus","Tata Steel reported 54.03% drop in consolidated net profit to Rs 1,565.41 crore on 7.4% rise in total income to Rs 37,531.67 crore in Q3 December 2020 over Q3 December 2019.",neutral,negative,-2.058461538461538,negative,1.082050233552993,positive
2021-02-10 08:35:06.000,650.0,660.67,621.75,636.62,10376070.0,"Berger Paints, Tata Steel, Raymond: Top Stocks for Investors Today","The stock market on Tuesday, February 9, snapped its sixth consecutive winning streak by closing in the red.",neutral,positive,-2.058461538461538,negative,1.082050233552993,positive
2021-02-10 09:26:00.000,650.0,660.67,621.75,636.62,10376070.0,"Stocks in news: Berger Paints, Torrent Power, Tata Steel, Interglobe Aviation, Glenmark Pharma","Stocks to watch today on February 10: Berger Paints, Torrent Power, Tata Steel, Interglobe Aviation, Glenmark Pharma among others are the top stocks to watch out for in Wednesday’s trading session",neutral,neutral,-2.058461538461538,negative,1.082050233552993,positive
2021-02-10 10:04:58.000,650.0,660.67,621.75,636.62,10376070.0,Berger Paints Share Price Rises 3% After Q3 Profit Jumps 51% To Rs 275 Crore,The paint maker reported a 51.2 percent jump in consolidated net profit to Rs 275 crore for the third quarter ended December 2020. It had posted a net profit of Rs 181.9 crore in the October-December quarter a year ago.,neutral,positive,-2.058461538461538,negative,1.082050233552993,positive
2021-02-10 11:28:00.000,650.0,660.67,621.75,636.62,10376070.0,"Stocks in focus: Berger Paints, Indus Towers , Titan & more","Here are the top stocks that are likely to be in focus in today’s trading. Berger Paints, Dhanlaxmi Bank, Indus Towers , Titan, Eicher Motors , Hindalco and more.",neutral,neutral,-2.058461538461538,negative,1.082050233552993,positive
2021-02-10 11:43:02.000,650.0,660.67,621.75,636.62,10376070.0,Berger Paints’ Recovery Momentum Remains Strong In Q3: ICICI Securities,Berger Paints’ Recovery Momentum Remains Strong In Q3: ICICI Securities,neutral,neutral,-2.058461538461538,negative,1.082050233552993,positive
2021-02-10 13:43:55.000,635.83,645.83,630.58,642.71,1924649.0,Berger Paints Share Prices Fall Below 1% Post Q3 Profit,"The share price of Berger Paints India remained volatile on Wednesday, February 10, post the declaration of its Q3 results on Tuesday, February 9.",neutral,negative,1.082050233552993,positive,-0.2991026919242209,neutral
2021-02-10 14:53:00.000,635.83,645.83,630.58,642.71,1924649.0,"Demand remains robust across all segments: Abhijit Roy, Berger Paints","Rural momentum is continuing while urban demand is picking up, says Abhijit Roy, MD & CEO, Berger Paints, in an interview with ETNOW.",positive,positive,1.082050233552993,positive,-0.2991026919242209,neutral
2021-02-10 14:58:00.000,635.83,645.83,630.58,642.71,1924649.0,Berger Paints Q3 net profit jumps 51% yoy to Rs275cr; stock gains 2%,"The consolidated revenue from operations for the quarter ended, December 31, 2020, was Rs2118.2cr as against Rs1 695.9cr in Q3FY20, representing a growth of 25.0% yoy.",positive,positive,1.082050233552993,positive,-0.2991026919242209,neutral
2021-02-10 17:23:00.000,635.83,645.83,630.58,642.71,1924649.0,Berger Paints stock rises 4% on strong Q3 earnings,"Berger Paints share has fallen 6.5% in a month. Year-to-date, the stock is down 0.25%. However, it has risen 3.92% in one week and 30% in one year",positive,negative,1.082050233552993,positive,-0.2991026919242209,neutral
2021-02-12 01:24:30.000,641.92,644.17,628.08,640.0,1792702.0,"Berger Paints: Stellar Show, But Can You Invest?",Berger’s share price has risen by 40 percent in the last 6 months beating the consumer index by a wide margin,neutral,positive,-0.2991026919242209,neutral,0.0596078431372541,neutral
2021-02-15 05:30:00.000,637.5,645.75,633.75,637.88,1094230.0,Is it Time to Sell Berger Paints?,Is it Time to Sell Berger Paints?,neutral,neutral,0.0596078431372541,neutral,-0.1973694598392623,neutral
2021-02-15 15:51:13.000,633.33,643.17,626.33,632.08,1422717.0,Hold Berger Paints India: Target Of Rs 810: ICICI Direct,"ICICI Direct recommended hold rating on Berger Paints India with a target price of Rs 810 in its research report dated February 11, 2021.",neutral,positive,-0.1973694598392623,neutral,-1.054545454545448,negative
2021-02-16 21:51:03.000,632.5,634.96,621.67,625.83,1205016.0,Broker’s call: Berger Paints (Sell),"Chola SecuritiesBerger Paints (Sell)Target: ₹601CMP: ₹759.30Berger’s top line growth expanded 25 per cent (y-o-y) to ₹2,110 crore; growth was driven by a strong performance in its decorative business",neutral,positive,-1.054545454545448,negative,0.8929142930295144,neutral
2021-02-28 00:26:24.000,567.5,602.5,567.5,600.0,2430417.0,Berger Paints — Book profits,The stock of Berger Paints has rallied nearly 70 per cent since the March 2020 lows. Improved demand conditions for housing and the festival season last year helped the company deliver strong performa,neutral,positive,5.726872246696035,positive,-1.4966887417218484,negative
2021-02-28 00:34:41.000,567.5,602.5,567.5,600.0,2430417.0,Berger Paints (₹679.90) | Why you should book profit in Berger Paints stock,"With crude prices rising, margin is likely to come under pressure",neutral,negative,5.726872246696035,positive,-1.4966887417218484,negative
2021-03-03 16:05:12.000,608.25,616.62,600.5,610.08,1273244.0,"Betting on pent-up demand, Berger Paints speeds up expansion plans",Berger is in the process of setting up a Rs 700-cr plant in Uttar Pradesh,positive,neutral,0.3008631319358883,neutral,1.4583333333333333,positive
2021-03-19 18:24:00.000,584.71,611.83,572.58,607.79,1377014.0,"Market Movers: HUL, ICRA shares roar; 20 stocks flash buy signals","Over 20 stocks listed on the National Stock Exchange gave a buy signal based on MACD indicators, including RIL, Tata Motors, Berger Paints and Pidilite Industries.",positive,positive,3.9472559046364735,positive,0.832947709393793,neutral
2021-03-22 12:59:00.000,611.58,626.62,611.58,621.62,2598935.0,Share price of Berger Paints (India) Ltd. jumps as Sensex drops 484.73 points,"A total of 13,155 shares changed hands on the counter till 12:59PM (IST)",positive,neutral,1.6416494980215122,positive,-0.3083099156965008,neutral
2021-03-24 12:27:00.000,617.5,620.38,607.62,612.5,1239493.0,"Buy Berger Paints, target price Rs 830: ICICI Direct","Berger Paints (India) Ltd., incorporated in the year 1923, is a Large Cap company (having a market cap of Rs 73206.51 Crore) operating in Building Materials sector.",neutral,neutral,-0.8097165991902834,neutral,2.18106929151735,positive
2021-03-24 16:29:23.000,617.5,620.38,607.62,612.5,1239493.0,Gladiator Stocks - Berger Paints: ICICI Direct,"According to ICICI Direct, Buy Berger Paints in the range of Rs 730.00–745.00 for target price of Rs 830.00 with stop loss of Rs 675.00. Time Frame: Six months.",neutral,neutral,-0.8097165991902834,neutral,2.18106929151735,positive
2021-03-31 07:10:05.000,637.46,644.17,633.46,637.5,1073998.0,"Hot Stocks | Ramco Cements, Berger Paints, Marico Can Give Up To 12% Return In Short Term","Now, 15,000 Call strike holds the maximum open interest of nearly 43 lakh shares which should act as an immediate strong hurdle for the Nifty.",neutral,positive,0.0062749035233526,neutral,-0.3515625,neutral
2021-04-01 13:21:00.000,640.0,641.67,634.17,637.75,863483.0,Berger Paints (India) Ltd. shares gain 0.66% as Sensex rises,"On the technical charts, the RSI of the stock stood at 62.39.",positive,neutral,-0.3515625,neutral,-2.5420158232292613,negative
2021-04-05 11:38:00.000,640.83,640.83,619.17,624.54,1025099.0,Share price of Berger Paints (India) Ltd. falls as Nifty weakens,"A total of 18,573 shares changed hands on the counter till 11:38AM (IST).",neutral,neutral,-2.5420158232292613,negative,-0.7946977764356217,neutral
2021-04-06 11:18:00.000,629.17,637.08,620.88,624.17,1405347.0,Berger Paints (India) Ltd. rises 1.57% as Sensex climbs,"The stock traded at a P/E multiple of 120.11, while the price-to-book value ratio stood at 18.16.",positive,neutral,-0.7946977764356217,neutral,0.3936000000000058,neutral
2021-04-07 11:13:00.000,625.0,636.58,623.25,627.46,960636.0,Berger Paints stock price up 1.04 per cent as Sensex climbs,"As of 31-Dec-2020, promoters held 60.5 per cent stake in the company, while FIIs held 11.52 per cent and domestic institutional investors had 0.91 per cent.",positive,neutral,0.3936000000000058,neutral,1.1233982797963964,positive
2021-04-08 13:17:00.000,640.75,641.0,625.25,628.33,814261.0,Berger Paints stock price down 0.02 per cent as Sensex climbs,"As of 31-Dec-2020, promoters held 60.5 per cent stake in the company, while FIIs held 11.52 per cent and domestic institutional investors had 0.91 per cent.",negative,neutral,-1.9383534920015544,negative,-2.7987532534301534,negative
2021-04-09 12:58:00.000,640.75,641.0,625.25,628.33,814261.0,Berger Paints shares drop 1.0% as Sensex rises,"A total of 17,751 shares changed hands on the counter till 12:58PM (IST)",negative,neutral,-1.9383534920015544,negative,-2.7987532534301534,negative
2021-04-11 13:06:20.000,622.42,622.42,594.79,605.0,788433.0,Berger Paints Q4 PAT Seen Up 111.5% YoY To Rs. 217.1 Cr: KRChoksey,"Net Sales are expected to increase by 53.8 percent Y-o-Y (down 1.6 percent Q-o-Q) to Rs. 2,083.6 crore, according to KRChoksey.",neutral,positive,-2.7987532534301534,negative,0.4007750525810176,neutral
2021-04-12 17:03:00.000,603.83,615.75,600.83,606.25,666579.0,Market Movers: Dr Reddy’s gets Sputnik lift; 84 stocks blink sell,"As many as 84 stocks listed on the National Stock Exchange gave sell signal based on MACD indicators. The list included UPL, Berger Paints, NALCO, and JK Cement.",neutral,neutral,0.4007750525810176,neutral,0.7607776838545933,neutral
2021-04-13 12:45:00.000,603.83,615.75,600.83,606.25,666579.0,Share price of Berger Paints jumps as Sensex gains 219.81 points,"Promoters held 60.5 per cent stake in the company as of 31-Dec-2020, while FII and DII ownership stood at 11.52 per cent and 0.91 per cent, respectively.",positive,neutral,0.4007750525810176,neutral,0.7607776838545933,neutral
2021-04-15 13:12:00.000,610.0,624.92,609.83,610.75,1585821.0,Berger Paints shares down 0.63% as Nifty drops,"A total of 13,734 shares changed hands on the counter till 01:12PM (IST).",negative,neutral,0.1229508196721311,neutral,-2.000953617993797,negative
2021-04-16 10:10:00.000,610.0,624.92,609.83,610.75,1585821.0,Berger Paints shares rise 2.02 per cent in Friday’s trading session,The Relative Strength Index of the stock stood at 50.97 on Friday.,positive,neutral,0.1229508196721311,neutral,-2.000953617993797,negative
2021-04-19 12:05:00.000,596.67,603.96,588.38,591.25,507202.0,Share price of Berger Paints falls as Sensex drops 1154.4 points,"Promoters held 60.5 per cent stake in the company as of 31-Mar-2021, while FII and DII ownership stood at 11.24 per cent and 0.82 per cent, respectively.",neutral,neutral,-0.9083748135485208,negative,1.0949152542372944,positive
2021-04-20 13:11:00.000,596.67,603.96,588.38,591.25,507202.0,Berger Paints shares up 0.04% as Nifty gains,"A total of 7,410 shares changed hands on the counter till 01:11PM (IST).",positive,neutral,-0.9083748135485208,negative,1.0949152542372944,positive
2021-04-22 14:07:00.000,594.92,600.75,588.38,591.67,577837.0,Berger Paints shares gain 0.31% as Sensex rises,"A total of 90,191 shares changed hands on the counter till 02:06PM (IST)",positive,neutral,-0.5462919384118873,neutral,1.1823586711900975,positive
2021-04-23 12:43:00.000,594.92,600.75,588.38,591.67,577837.0,Share price of Berger Paints falls as Nifty weakens,"A total of 10,600 shares changed hands on the counter till 12:43PM (IST).",neutral,neutral,-0.5462919384118873,neutral,1.1823586711900975,positive
2021-04-26 10:36:00.000,595.42,605.38,594.21,602.46,681297.0,Berger Paints shares up 1.37% as Nifty gains,The stock quoted a 52-week high price of Rs 824.8 and low of Rs 431.55.,positive,negative,1.1823586711900975,positive,-1.9368025450409612,negative
2021-04-27 14:09:00.000,596.92,602.0,592.71,597.5,863010.0,Berger Paints shares down 1.29% as Sensex rises,"A total of 16,810 shares changed hands on the counter till 02:08PM (IST)",negative,neutral,0.0971654493064465,neutral,-0.4723909995326235,neutral
2021-04-28 11:38:00.000,596.92,602.0,592.71,597.5,863010.0,Share price of Berger Paints jumps as Sensex gains 459.47 points,"A total of 7,130 shares changed hands on the counter till 11:38AM (IST)",positive,neutral,0.0971654493064465,neutral,-0.4723909995326235,neutral
2021-04-29 11:24:00.000,599.08,605.75,593.58,596.25,632531.0,Share price of Berger Paints falls as Nifty strengthens,"A total of 12,778 shares changed hands on the counter till 11:24AM (IST).",neutral,neutral,-0.4723909995326235,neutral,-0.8383051363090782,neutral
2021-04-30 13:02:00.000,591.67,597.33,583.71,586.71,698829.0,Berger Paints shares down 0.57% as Nifty falls,The stock quoted a 52-week high price of Rs 824.8 and low of Rs 431.55.,negative,negative,-0.8383051363090782,neutral,1.314197078425697,positive
2021-05-03 10:46:00.000,586.67,595.04,580.92,594.38,542215.0,Berger Paints stock price up 0.56 per cent as Sensex slides,"As of 31-Mar-2021, promoters held 60.5 per cent stake in the company, while FIIs held 11.24 per cent and domestic institutional investors had 0.82 per cent.",positive,neutral,1.314197078425697,positive,-0.7719144489575853,neutral
2021-05-04 13:32:00.000,588.33,595.75,587.5,594.58,402330.0,Shares of Berger Paints fall as Nifty drops,"On the technical charts, the 200-day moving average of the stock stood at Rs 661.72.",neutral,neutral,1.062328965036629,positive,0.8292181416749462,neutral
2021-05-06 12:45:00.000,598.25,603.0,594.79,595.88,305629.0,Berger Paints declines 0.08% as Sensex climbs,"The stock traded at a P/E multiple of 112.28, while the price-to-book value ratio stood at 18.16.",negative,neutral,-0.3961554534057676,neutral,0.4591598210111535,neutral
2021-05-07 11:59:00.000,598.25,603.0,594.79,595.88,305629.0,Share price of Berger Paints jumps as Sensex gains 290.72 points,"Promoters held 60.5 per cent stake in the company as of 31-Mar-2021, while FII and DII ownership stood at 11.24 per cent and 0.82 per cent, respectively.",positive,neutral,-0.3961554534057676,neutral,0.4591598210111535,neutral
2021-05-10 11:59:00.000,598.92,603.5,593.83,601.67,687222.0,Berger Paints shares fall 0.11% as Nifty gains,"A total of 7,070 shares changed hands on the counter till time (IST).",negative,neutral,0.4591598210111535,neutral,2.346666666666674,positive
2021-05-11 12:11:00.000,613.33,618.58,605.83,609.17,1108809.0,Share price of Berger Paints rises as Nifty weakens,"A total of 11,777 shares changed hands on the counter till 12:11PM (IST).",positive,neutral,-0.6782645557856426,neutral,1.490766029392632,positive
2021-05-12 08:25:00.000,613.33,618.58,605.83,609.17,1108809.0,"Top trading calls by Ajit Mishra: Buy Berger Paints, Havells India",Havells’ stock is currently trading around the support zone of medium-term moving average (100 EMA) on the daily chart and indications are in the favor of a strong surge in near future,neutral,positive,-0.6782645557856426,neutral,1.490766029392632,positive
2021-05-12 13:08:00.000,613.33,618.58,605.83,609.17,1108809.0,Share price of Berger Paints rises as Nifty weakens,"A total of 19,154 shares changed hands on the counter till 01:08PM (IST).",positive,neutral,-0.6782645557856426,neutral,1.490766029392632,positive
2021-05-17 11:43:00.000,629.92,651.62,618.67,640.21,2623334.0,Berger Paints share price up 1.64 per cent,"A total of 20,473 shares changed hands on the counter till 11:43AM (IST).",positive,neutral,1.6335407670815465,positive,1.360110674148571,positive
2021-05-18 13:06:00.000,654.17,665.0,651.67,656.88,2273853.0,Share price of Berger Paints rises as Nifty strengthens,"A total of 45,763 shares changed hands on the counter till 01:06PM (IST).",positive,neutral,0.41426540501705,neutral,0.3556328891738085,neutral
2021-05-19 07:14:49.000,654.17,665.0,651.67,656.88,2273853.0,"Hot Stocks: Trent, LIC Housing Finance And Berger Paints Top Stocks To Buy For Short Term","Overall, market witnessed follow-up buying on Tuesday and Nifty managed to surpass the key resistance level of 15,100. The rally was supported by banking, auto and metal counters, said Shitij Gandhi of SMC Global",neutral,positive,0.41426540501705,neutral,0.3556328891738085,neutral
2021-05-19 08:45:00.000,654.17,665.0,651.67,656.88,2273853.0,"Nifty outlook & trading ideas by HDFC Sec: Buy Berger Paints, ICICI Bank","The immediate target for the Nifty50 index is seen above the all-time high of 15,432 odd levels",neutral,positive,0.41426540501705,neutral,0.3556328891738085,neutral
2021-05-21 09:42:00.000,658.33,667.5,656.88,660.0,1774170.0,"DMart, Berger Paints among 10 stocks that may fall short of earnings growth estimates","Stocks stare at sell-off fears as second wave of pandemic throws growth expectations out of gear. To be sure, the rapid acceleration in the second wave has already led to a bout of earnings downgrades. However, this revision is limited to a select few names.",neutral,negative,0.2536721704919962,neutral,2.158132530120488,positive
2021-05-25 10:36:00.000,680.0,689.12,675.17,685.0,3331156.0,Berger Paints shares gain 1.53% as Sensex rises,"A total of 62,202 shares changed hands on the counter till 10:36AM (IST)",positive,neutral,0.7352941176470588,neutral,0.7616090986900323,neutral
2021-05-25 11:29:00.000,680.0,689.12,675.17,685.0,3331156.0,"Asian Paints, Berger Paints hit new highs, gain 15% in a month","The domestic paints industry commands strong pricing power, which is evident from frequent price hikes amid inflationary raw material prices",positive,positive,0.7352941176470588,neutral,0.7616090986900323,neutral
2021-05-26 07:37:00.000,689.33,702.29,679.29,694.58,4747931.0,"Stocks in the news: Berger Paints, SPARC, BPCL, HDFC, Burger King and Ajmera Realty","Karur Vysya Bank, Sharda Cropchem, LT foods, Karnataka Bank, Arvind are among companies that will announce their March quarter results today.",neutral,neutral,0.7616090986900323,neutral,-4.006516536432047,negative
2021-05-26 07:44:55.000,689.33,702.29,679.29,694.58,4747931.0,"Buzzing Stocks: BPCL, Berger Paints, Mahindra Holidays And Others That Will Be In Focus Today",Check out the companies making the biggest headlines before the bell.,neutral,neutral,0.7616090986900323,neutral,-4.006516536432047,negative
2021-05-26 07:57:42.000,689.33,702.29,679.29,694.58,4747931.0,"Stocks To Watch: AstraZeneca, Berger Paints, BPCL, PNB Housing Finance, Thermax, Vardhman Textiles",Here are the stocks to watch in trade today...,neutral,neutral,0.7616090986900323,neutral,-4.006516536432047,negative
2021-05-26 08:12:00.000,689.33,702.29,679.29,694.58,4747931.0,"Market Ahead Podcast, May 26: Top factors that could guide markets today","A total of 52 companies, including Berger Paints India, Bharat Petroleum Corporation, Burger King India, Cummins India, and Vardhman Holdings are scheduled to announce their quarterly results today",neutral,neutral,0.7616090986900323,neutral,-4.006516536432047,negative
2021-05-26 08:26:45.000,689.33,702.29,679.29,694.58,4747931.0,"Markets may continue to be volatile; HDFC, PSU stocks in focus","Bharat Petroleum, Berger Paints (India), Pfizer, Cummins India, Burger King India, Karur Vysya Bank and Karnataka Bank, will announce their March quarter results today",negative,neutral,0.7616090986900323,neutral,-4.006516536432047,negative
2021-05-26 12:36:00.000,693.62,694.17,655.12,665.83,5195206.0,Berger Paints share price up 0.34 per cent,"A total of 41,168 shares changed hands on the counter till 12:36PM (IST).",positive,neutral,-4.006516536432047,negative,-0.2238805970149253,neutral
2021-05-26 13:20:00.000,693.62,694.17,655.12,665.83,5195206.0,"Important results today: BPCL, Berger Paints, Burger King India, Arvind","Shreyas Shipping & Logistics, Sicagen India, The Investment Trust of India, UFO Moviez India and Vardhman Holdings will release quarterly earnings today.",neutral,neutral,-4.006516536432047,negative,-0.2238805970149253,neutral
2021-05-26 15:41:00.000,693.62,694.17,655.12,665.83,5195206.0,Berger Paints gains after Q4 PAT spurts to Rs 209 cr,Berger Paints India rose 1.66% to Rs 833.20 after paint maker’s consolidated net profit surged 101% to Rs 208.59 crore in Q4 FY21 as against Rs 103.72 crore in Q4 FY20.,positive,positive,-4.006516536432047,negative,-0.2238805970149253,neutral
2021-05-26 16:04:00.000,693.62,694.17,655.12,665.83,5195206.0,Berger Paints India consolidated net profit rises 101.11% in the March 2021 quarter,Sales rise 49.54% to Rs 2026.09 crore,positive,positive,-4.006516536432047,negative,-0.2238805970149253,neutral
2021-05-26 16:46:04.000,693.62,694.17,655.12,665.83,5195206.0,Results: Berger Paints Q4 profit more than doubles to Rs 209 crore,"Berger Paints India on Wednesday reported more than doubling of consolidated net profit to Rs 208.60 crore for the fourth quarter ended March 31, 2021, on account of higher revenue from operations. It had reported a net profit of Rs 103.18 crore for the year-ago period.Revenue from operati…",positive,positive,-4.006516536432047,negative,-0.2238805970149253,neutral
2021-05-26 16:55:49.000,693.62,694.17,655.12,665.83,5195206.0,Berger Paints Q4 Profit More Than Doubles To Rs 209 Crore,"Revenue from operations in the quarter under review was higher at Rs 2,026.09 crore as against Rs 1,354.84 crore in the year-ago period, Berger Paints said in a BSE filing.",neutral,positive,-4.006516536432047,negative,-0.2238805970149253,neutral
2021-05-26 16:58:00.000,693.62,694.17,655.12,665.83,5195206.0,Berger Paints Q4 profit more than doubles to Rs 209 crore,"Revenue from operations in the quarter under review rose to Rs 2,026.09 crore in Q4 from Rs 1,354.84 crore in the corresponding period a year ago, Berger Paints said.",positive,positive,-4.006516536432047,negative,-0.2238805970149253,neutral
2021-05-26 17:44:00.000,693.62,694.17,655.12,665.83,5195206.0,Berger Paints Q4 profit more than doubles to Rs 209 cr,"Revenue from operations in the quarter under review was higher at Rs 2,026.09 crore as against Rs 1,354.84 crore in the year-ago period",positive,positive,-4.006516536432047,negative,-0.2238805970149253,neutral
