date,open,high,low,close,volume,title,description,title_sentiment,desc_sentiment,daily_change_pct,market_sentiment,next_day_change_pct,next_day_sentiment
2022-05-19 08:09:00.000,400.0,414.1,392.5,399.5,2581102.0,"Stocks to Watch: ITC, Lupin, Ruchi Soya, Manappuram Finance, JSW, Biocon","Stocks to Watch today: Ashok Leyland, Bosch, Chambal Fertilisers & Chemicals, Container Corp, Dr Reddy’s will be in focus ahead of their Q4 results today.",neutral,neutral,-0.125,neutral,0.0,neutral
2022-06-28 15:04:36.000,265.85,276.4,264.0,272.85,2676254.0,Welspun India Ltd leads losers in ‘A’ group,"Chambal Fertilisers & Chemicals Ltd, JTEKT India Ltd, Indian Energy Exchange Ltd and Astral Ltd are among the other losers in the BSE’s ‘A’ group today, 28 June 2022.",negative,negative,2.633063757758134,positive,-2.701715954727995,negative
2022-06-29 06:13:00.000,265.85,276.4,264.0,272.85,2676254.0,"Adani Power, Chola Invest, BoB may get AMFI’s large-cap tag","AMFI classifies stocks by taking into account data from January to June 2022. According to ICICI Securities, Tata Tele, KPR Mills, Tanla Platform, Poonawala Fin, Phoenix Mills, SKF India, and Chambal Fertilisers are likely to be shifted from small-cap to mid-cap category.",neutral,neutral,2.633063757758134,positive,-2.701715954727995,negative
2022-08-03 16:04:35.000,323.0,325.0,310.5,319.6,3104372.0,Chambal Fertilisers & Chemicals consolidated net profit declines 10.38% in the June 2022 quarter,Sales rise 105.99% to Rs 7291.18 crore,negative,positive,-1.0526315789473617,negative,0.4822650902302462,neutral
2022-10-13 14:21:12.000,324.0,329.85,321.55,325.1,1566508.0,"Coromandel, Chambal Fertilisers - Nurturing A Sustainable Tomorrow: Prabhudas Lilladher Initiates Coverage",Both Coromandel International and Chambal Fertilisers are well placed to capitalise on long term growth opportunities.,neutral,positive,0.3395061728395132,neutral,0.5229160258382001,neutral
2022-10-19 15:46:05.000,322.95,328.9,317.65,327.5,1025125.0,"Diwali picks: Midcap, smallcap stocks to buy as suggested by Prabhudas Lilladher","Ashok Leyland, Chambal Fertilisers & Chemicals and Federal Bank are its top midcap stock picks",positive,neutral,1.4088868245858528,positive,-0.9146341463414632,negative
2022-10-20 18:55:06.000,328.0,332.4,322.1,325.0,926612.0,"M&M, Chambal Fertilisers, Jubilant Ingrevia & More - Stock Picks For Diwali, Samvat 2079: Prabhudas Lilladher","We continue to prefer companies with presence in emerging segments, strong balance sheets and business moats.",neutral,neutral,-0.9146341463414632,negative,0.0152462265589301,neutral
2022-11-01 18:50:08.000,318.0,318.4,303.5,308.2,7686900.0,Chambal Fertilisers & Chemicals consolidated net profit declines 45.79% in the September 2022 quarter,Sales rise 91.73% to Rs 8586.75 crore,negative,positive,-3.0817610062893115,negative,0.6472491909385114,neutral
2022-11-02 08:53:26.000,318.0,318.4,303.5,308.2,7686900.0,"Stocks that will see action on November 02, 2022","Stocks to watch: Tata Motors, HFCL, Adani Wilmar, Patanjali, Chambal Fertilisers, Gulshan Polyols, Veranda Learning, Adani Transmission, Dalmia Bharat, EIH, M&M Financial, Mahindra Holidays and P&G Hygiene",neutral,neutral,-3.0817610062893115,negative,0.6472491909385114,neutral
2022-11-02 13:16:32.000,309.0,311.8,306.5,311.0,1715832.0,Chambal Fertilisers slides as Q2 PAT slumps 46% YoY,Chambal Fertilisers & Chemicals slipped 6.13% to Rs 306.20 after the company posted a 45.8% fall in consolidated net profit to Rs 274.27 crore in Q2 FY23 from Rs 505.92 crore posted in Q2 FY22.,negative,negative,0.6472491909385114,neutral,-1.586030118551761,negative
2022-11-02 15:04:04.000,309.0,311.8,306.5,311.0,1715832.0,LIC Housing Finance Ltd leads losers in ‘A’ group,"Fineotex Chemical Ltd, Chambal Fertilisers & Chemicals Ltd, Bharti Airtel Ltd Partly Paidup and Devyani International Ltd are among the other losers in the BSE’s ‘A’ group today, 02 November 2022.",positive,negative,0.6472491909385114,neutral,-1.586030118551761,negative
2022-11-17 10:54:00.000,286.65,289.0,282.55,286.25,849190.0,Chart Check: Breakdown from rising channel formation could fuel selling pressure in Chambal Fertilisers,"“As Nifty is retracing earlier gains, weak stocks become weaker. Chambal Fertiliser has breached the rising channel on the lower side which was bearish development on the weekly charts,” Kapil Shah, Technical Analyst, Emkay Global Financial Services and Trainer- FinLearn Academy, said.",negative,negative,-0.1395429966858459,neutral,-0.8576929809207032,neutral
2022-11-30 15:17:26.000,306.95,307.35,301.55,303.7,1119768.0,F&O Query: Should you hold call option on Chambal Fertilisers?,Consider buying calls only after the stock breaking out of the resistance at ₹310,neutral,neutral,-1.0588043655318455,negative,0.0993213044198018,neutral
2023-01-31 22:27:37.000,316.0,318.8,291.0,297.0,3502428.0,Trade setup for Budget day: Top 15 things to know before the opening bell,"Based on the OI percentage, 81 stocks were on the short-covering list, including Chambal Fertilisers, City Union Bank, Atul, UltraTech Cement, and IDFC First Bank",neutral,neutral,-6.012658227848101,negative,0.8532423208191127,neutral
2023-02-07 16:15:49.000,291.35,297.65,287.5,296.45,1997197.0,Chambal Fertilisers reports 26% slump in Q3 profits on weak demand,(Reuters) - India’s Chambal Fertilisers and Chemicals Ltd reported a near 26% slump in quarterly profit on Tuesday after a weak demand due to erratic monsoon led to a pile-up of unsold stock.,negative,negative,1.750471940964464,positive,0.3378378378378378,neutral
2023-02-16 17:30:00.000,297.5,301.65,292.45,292.75,1216754.0,"Shree Cement, Chambal Fertilisers shares to turn ex-dividend; Nestle India Q4 results today",.Shree Cement shares would turn ex-dividend today. Shree Cement had announced an interim dividend of Rs 45 per share. Today is also the record date for the same. The dividend will be paid on March 1.,neutral,neutral,-1.5966386554621848,negative,-0.7672634271099744,neutral
2023-03-28 10:22:00.000,254.95,255.95,249.6,251.0,1033950.0,"Sell Chambal Fertilisers & Chemicals, target price Rs 252.7 : ICICI Direct","Chambal Fertilisers & Chemicals, incorporated in the year 1985, is a Mid Cap company (having a market cap of Rs 10542.54 Crore) operating in Fertilisers sector.",neutral,neutral,-1.5493233967444553,negative,3.166699860585536,positive
2023-05-03 15:34:00.000,298.9,303.4,296.4,301.0,3690265.0,Market in a bullish trend; buy these 2 stocks on dips now: Shilpa Rout,"Analyst Shilpa Rout suggests buying Oracle Financial Services Software (OFSS) and Chambal Fertilisers on dips. OFSS has been consolidating above Rs 3,600 and is expected to reach targets of Rs 3,700 and above with a stop loss of around Rs 3,620 for intraday. Chambal Fertilisers is experiencing a goo…",positive,positive,0.7025761124121856,neutral,-0.4973474801061007,neutral
2023-07-20 16:22:33.000,270.25,270.25,267.55,268.8,591044.0,Chambal Fertilisers MD quits,"Chambal Fertilizers and Chemicals Ltd. announced Gaurav Mathur’s resignation as Managing Director and Key Managerial Personnel. Abhay Baijal is set to take over, pending shareholder approval, with a two-year term from July 21, 2023 to July 20, 2025. The company’s share price rose 0.21% to Rs 266.25 …",neutral,positive,-0.5365402405180347,neutral,-0.0926955876900259,neutral
