date,open,high,low,close,volume,title,description,title_sentiment,desc_sentiment,daily_change_pct,market_sentiment,next_day_change_pct,next_day_sentiment
2018-02-14 13:02:26.854,158.0,159.2,155.55,158.2,349317.0,Chambal Fertilisers Q3 profit up 14.45% to Rs 149.08 crore,"Chambal Fertilisers net income declined to Rs2,312.69 crore in the third quarter of 2017-18, from Rs2,431.97 crore in the year-ago period",positive,negative,0.1265822784810054,neutral,-2.1383647798742174,negative
2018-02-14 13:02:40.520,158.0,159.2,155.55,158.2,349317.0,Chambal Fertilisers Q3 net profit up 14.45%,Chambal Fertilisers and Chemicals Ltd (CFCL) today posted 14.45 per cent jump in standalone net profit at Rs 149.08 crore in the December quarter of the current fiscal.,positive,positive,0.1265822784810054,neutral,-2.1383647798742174,negative
2018-04-13 13:00:30.352,167.0,189.4,166.7,185.75,5555621.0,"Agri related stocks rally;Chambal Fertilisers, Shakti Pumps hit 52-wk highs","Madras Fertilizers, FACT, RCF, Escorts, Shakti Pumps, Chambal Fertilisers and Roto Pumps were up 3% to 8% on the BSE.",positive,positive,11.22754491017964,positive,-2.919508867667118,negative
2018-05-14 18:02:33.181,172.0,174.9,165.3,169.4,897849.0,Chambal Fertilisers Q4 FY18 review: Difficult quarter; raw material prices to be an overhang,The quarter saw around 8 percent uptick in urea production but sales remained more or less flattish,neutral,positive,-1.5116279069767409,negative,-0.8875739644970414,neutral
2018-07-12 18:01:06.582,152.8,152.8,144.5,145.55,257730.0,Chambal Fertilisers down 1% as downstream subsidiary voluntary wind-up its biz,"Board of directors of Inuva has approved voluntary winding up under the provisions of Insolvency and Bankruptcy Code, 2016 subject to approval of shareholders and other requisite approvals.",negative,neutral,-4.744764397905759,negative,-4.775086505190315,negative
2018-08-02 10:00:52.939,147.55,147.75,143.1,143.4,134353.0,"Check out Insider Trading transaction for July 27, 2018; Sun Pharma, Infosys in focus","World Crest Advisors LLP bought 44,62,38,855 shares of Dish TV India through market purchase on July 24, 2018 while Hindustan Times bought 1,41,000 shares of Chambal Fertilisers & Chemicals through market purchase on July 27, 2018 and Eriez Industries Pvt.Ltd. bought 40,086 shares of 20 Microns Ltd through market purchase on July 27, 2018.",neutral,neutral,-2.8126058963063407,negative,0.1391788448155999,neutral
2018-08-07 13:01:28.582,142.1,143.4,140.35,140.6,170085.0,Chambal Fertilisers Q1 review: Healthy growth,"Although the urea subsidy situation is comfortable, we see raw material and procurement prices remaining an overhang. The recent correction makes the stock attractive.",neutral,positive,-1.0555946516537649,negative,-0.3203987184051183,neutral
2018-08-17 18:02:14.321,144.5,155.0,144.1,152.4,1406820.0,"Check out insider trades for August 13; Bajaj Finance, Dabur, Yes Bank in focus","Hindustan Times (promoter) bought 10,000 shares of Chambal Fertilisers & Chemicals through market purchase on August 13. Bajaj Allianz Life Insurance bought 50,000 shares of Bajaj Finance",neutral,neutral,5.467128027681665,positive,-1.2251655629139035,negative
2018-08-28 13:01:55.024,161.4,165.95,157.25,164.5,1347918.0,"Fertiliser shares in focus; FACT, SPIC, Chambal Fertilisers up over 10%","Nagarjuna Fertilizers and Chemicals, National Fertilizers, RCF, Deepak Fertilisers & Petrochemicals, GSFC were up between 3% and 6%.",positive,positive,1.9206939281288689,positive,3.4356947400425697,positive
2018-11-30 18:01:02.371,148.55,155.6,148.55,152.7,266258.0,Chambal Fertilisers gains 4% as co commenced production at Rajasthan plant,"Chambal Fertilisers has been setting up of new Urea plant for production of 1.34 Million MT of Urea per annum at the existing site at Gadepan, Kota, Rajasthan.",positive,neutral,2.793672164254444,positive,1.2903225806451613,positive
2019-01-10 23:02:12.584,164.2,170.9,161.2,170.45,730370.0,Chambal Fertilisers & Chemicals (₹163.5): Buy,"Investors with a short-term perspective can buy the stock of Chambal Fertilisers &amp;amp; Chemicals at current levels. On Thursday, the stock gained 3.5 per cent accompanied by good volume, decisivel",neutral,positive,3.806333739342266,positive,-0.4165426956263118,neutral
2019-02-28 23:00:43.999,158.5,163.35,158.0,160.0,145218.0,Company news: Chambal Fertilisers & Chemicals,"In a notice to the exchanges, Chambal Fertilisers &amp;amp; Chemicals on Thursday said that Hamriyah Free Zone Authority, Government of Sharjah, UAE, on Thursday confirmed that India Steamship Interna",neutral,neutral,0.946372239747634,positive,2.18681661980631,positive
2019-03-29 10:02:03.281,170.5,170.5,165.65,166.4,163504.0,Company news: Chambal Fertilisers & Chemicals,"Following a $55-million external commercial borrowing agreement to part-finance the Gadepan-III plant (Rajasthan), Chambal Fertilisers &amp;amp; Chemicals has reduced the rupee term loan facility with",neutral,neutral,-2.404692082111433,negative,-1.4583333333333266,negative
2019-11-01 10:04:17.503,171.0,174.25,168.25,170.05,1033542.0,Chambal Fertilisers & Chemicals (₹170.3): Buy,"The stock of Chambal Fertilisers &amp;amp; Chemicals gained bullish momentum and surged 6.4 per cent accompanied by above average volume on Thursday, breaking above a key resistance at ₹160 as as well",neutral,positive,-0.5555555555555489,neutral,0.881316098707403,neutral
2020-01-27 18:02:24.897,181.0,182.5,174.3,179.95,623586.0,"Agri stocks in focus; Atul, Deepak Fertilisers, Godrej Agrovet up over 5%","Chambal Fertilisers & Chemicals, RCF, Zuari Agro Chemicals and National Fertilizers were up more than 3 per cent on the BSE in an otherwise weak market.",positive,positive,-0.5801104972375754,neutral,-3.0193905817174453,negative
2020-05-15 06:32:00.000,139.3,139.3,133.8,135.45,1148729.0,Chambal Fertilisers & Chemicals (₹142.9): Buy,"Investors with a short-term perspective can buy the stock of Chambal Fertilisers &amp;amp; Chemicals at current levels. The stock gained 4.4 per cent accompanied by above average volume on Thursday, b",neutral,positive,-2.763819095477403,negative,-4.530386740331497,negative
2020-05-25 00:44:44.000,139.2,139.2,132.15,132.75,725558.0,Chambal Fertilisers Q4 profit rises 122%,"Profit in the financial year ended 31 March surges to ₹1,224.31 crore from ₹545.27 crore in FY19.Chambal Fertilisers expects the farming sector to likely get a boost in FY21 with the forecast of a good monsoon",positive,positive,-4.633620689655165,negative,-1.541353383458655,negative
2020-07-03 07:40:00.000,148.0,148.8,145.35,147.0,692355.0,"In pics | Stocks in the news: HDFC Life, HUL, NOCIL, TCS, VST Tillers, McLeod Russel",Ramkrishna Forgings | NCL Industries | PNC Infratech | Max Financial Services | Ujjivan Financial Services | GPT Infraprojects | Arrow Greentech | KRBL | McLeod Russel India | Ruby Mills | Affle India | Axis Bank | PI Industries | Nagarjuna Fertilizers | Chambal Fertilisers &amp; Chemicals | Muthoot…,neutral,neutral,-0.6756756756756757,neutral,2.647453083109931,positive
2020-07-29 06:40:00.000,165.7,167.3,162.1,164.3,1121378.0,Chambal Fertilisers & Chemicals Q1FY21; consolidated profit rises by ~77% yoy,The company recorded a consolidated profit of ~Rs298cr in Q1FY21.,positive,positive,-0.8449004224501976,neutral,-7.975279576221313,negative
2020-07-30 08:26:00.000,169.9,172.95,155.3,156.35,5899224.0,Chambal Fertilisers & Chemicals consolidated net profit rises 80.30% in the June 2020 quarter,Sales rise 12.75% to Rs 3218.67 crore,positive,positive,-7.975279576221313,negative,0.8298755186721882,neutral
2020-07-30 08:52:00.000,169.9,172.95,155.3,156.35,5899224.0,Chambal Fertilisers & Chemicals standalone net profit rises 33.11% in the June 2020 quarter,Sales rise 12.75% to Rs 3218.67 crore,positive,positive,-7.975279576221313,negative,0.8298755186721882,neutral
2020-07-30 13:08:00.000,156.65,159.9,155.25,157.95,1571154.0,Chambal Fertilisers Q1 PAT spurts 81% to Rs 298 cr,"The fertilizer manufacturers consolidated net profit surged 81.5% to Rs 298.38 crore on 12.8% jump in net sales to Rs 3,218.67 crore in Q1 June 2020 over Q1 June 2019.",positive,positive,0.8298755186721882,neutral,-2.69254852849091,negative
2020-08-14 07:14:00.000,156.5,156.5,151.5,152.85,857130.0,"In pics | Stocks in the news: Tata Steel, 3M India, Vedanta, BPCL, SpiceJet, Shriram Transport Finance, Bank of India, Trent","Eicher Motors, City Union Bank, Redington, InterGlobe Aviation, Praj Industries, Satin Creditcare, Spencer, DCM Shriram Industries, Minda Corporation, EIH, Chambal Fertilisers, Tamil Nadu Newsprint & Papers. Engineers India, Endurance Technologies, Balkrishna Industries, Ajanta Pharma, Garden Re…",neutral,neutral,-2.332268370607032,negative,-0.8119519324455992,neutral
2020-11-06 08:06:00.000,171.0,171.8,162.0,164.25,1830987.0,Chambal Fertilisers & Chemicals standalone net profit rises 10.89% in the September 2020 quarter,Sales rise 12.30% to Rs 3986.94 crore,positive,positive,-3.947368421052632,negative,2.2522522522522523,positive
2020-11-06 08:27:00.000,171.0,171.8,162.0,164.25,1830987.0,"Stocks in the news | RIL, HFCL, ITC, Dish TV India, Adani Transmission, Axis Bank, Minda Corporation","Berger Paints, Dalmia Bharat, Adani Power, Chambal Fertilisers, Indiabulls Housing Finance, Inox Leisure, Aditya Birla Capital, Container Corporation of India, Torrent Power, Matrimony.com, are also among the stocks in focus today.",neutral,neutral,-3.947368421052632,negative,2.2522522522522523,positive
2020-12-01 11:20:00.000,206.65,207.75,198.1,201.8,883241.0,"Deepak Fertilisers, GSFC, GNFC: What charts indicate for fertiliser stocks",Chambal Fertilisers may rally towards Rs 240 if it sustains above Rs 200 levels.,neutral,positive,-2.3469634647955453,negative,-0.450225112556281,neutral
2020-12-02 13:43:00.000,199.2,205.3,196.5,196.7,1551051.0,Chambal Fertilisers & Chemicals consolidated net profit rises 14.23% in the September 2020 quarter,Sales rise 12.30% to Rs 3986.94 crore,positive,positive,-1.2550200803212852,negative,0.9610520991401142,positive
2020-12-10 12:04:08.000,219.1,239.0,218.55,238.7,4183206.0,Shipping Corporation of India Ltd leads gainers in ‘A’ group,"Triveni Turbine Ltd, Chambal Fertilisers & Chemicals Ltd, Tube Investments of India Ltd and Yaarii Digital Integrated Services Ltd are among the other gainers in the BSEs A group today, 10 December 2020.",positive,neutral,8.945686900958465,positive,-3.403361344537813,negative
2021-02-04 05:30:00.000,242.65,267.0,241.05,265.95,3709257.0,BRIEF-India’s Chambal Fertilisers & Chemicals Dec-Quarter Consol Profit Falls,BRIEF-India’s Chambal Fertilisers & Chemicals Dec-Quarter Consol Profit Falls,neutral,neutral,9.602307850813922,positive,-6.92452830188679,negative
2021-02-04 18:38:00.000,265.0,265.65,245.35,246.65,1562580.0,Board of Chambal Fertilisers & Chemicals approves change in MD,At meeting held on 04 February 2021,neutral,neutral,-6.92452830188679,negative,-5.372894947874902,negative
2021-02-05 17:41:00.000,265.0,265.65,245.35,246.65,1562580.0,Chambal Fertilisers & Chemicals consolidated net profit declines 1.93% in the December 2020 quarter,Sales rise 1.06% to Rs 3872.64 crore,negative,positive,-6.92452830188679,negative,-5.372894947874902,negative
2021-02-10 16:31:23.000,232.0,244.95,232.0,243.9,1355070.0,Chambal Fertilisers & Chemicals receives NCLT approval for dissolution of subsidiary,Powered by Capital Market - Live News,positive,neutral,5.129310344827589,positive,-1.5309246785058177,negative
2021-03-02 15:50:20.000,247.0,256.55,240.0,243.1,1467051.0,Reliance Power Ltd leads losers in ‘A’ group,"Chambal Fertilisers & Chemicals Ltd, Indiamart Intermesh Ltd, Pricol Ltd and Central Bank of India are among the other losers in the BSE’s ‘A’ group today, 02 March 2021.",negative,negative,-1.5789473684210549,negative,0.2479338842975182,neutral
2021-03-19 05:01:00.000,215.1,220.0,207.0,219.0,1709130.0,Chambal Fertilisers & Chemicals (₹216.7): Sell,Investors with a short-term horizon can sell the stock of Chambal Fertilisers &amp; Chemicals at current levels. The stock took support at around ₹135 in early September 2020 and had been in a med,neutral,positive,1.8131101813110209,positive,1.932811780947993,positive
2021-04-15 15:42:00.000,231.0,233.1,225.0,225.5,892289.0,CRISIL upgrades rating on long-term bank facilities of Chambal Fertilisers and Chemicals,The rating on Rs8573.56cr bank loan facilities of the company has been upgraded to AA+ from AA and changed outlook from Positive to Stable.,positive,positive,-2.380952380952381,negative,-2.679767753461366,negative
2021-05-04 08:16:00.000,219.5,222.65,212.4,213.95,612623.0,Chambal Fertilisers & Chemicals receive NCLT Kolkata approval for winding up Inuva Info Management,The reason behind winding up the said subsidiary is because Inuva Info Management was not having any business operations.,positive,neutral,-2.528473804100233,negative,0.5111524163568879,neutral
2021-05-10 05:30:00.000,223.0,227.15,222.0,223.8,1164652.0,BRIEF-Chambal Fertilisers And Chemicals Says March-Quarter Consol Profit Rises,BRIEF-Chambal Fertilisers And Chemicals Says March-Quarter Consol Profit Rises,neutral,neutral,0.3587443946188391,neutral,3.3989266547406056,positive
2021-05-10 21:01:21.000,223.6,244.5,220.3,231.2,7940910.0,Results: Chambal Fertilisers Q4 profit surges to Rs 541.75 crore,Chambal Fertilisers and Chemicals (CFCL) on Monday reported a surge in consolidated profit for the quarter ending March 31 at Rs 541.75 crore compared to the same period of the previous financial year.The company’s consolidated net profit stood at Rs 201.07 crore during the corresponding q…,positive,positive,3.3989266547406056,positive,11.014744145706857,positive
2021-05-11 00:09:00.000,223.6,244.5,220.3,231.2,7940910.0,Chambal Fertilisers Q4 results: Net profit surges to Rs 542 cr,"Its total revenue from operations for the quarter under review witnessed a decline of 16.67 per cent at Rs 1,640.76 crore as compared to Rs 1,969.09 crore in the same period of FY20.",positive,negative,3.3989266547406056,positive,11.014744145706857,positive
2021-05-11 07:46:00.000,223.6,244.5,220.3,231.2,7940910.0,Chambal Fertilisers & Chemicals consolidated net profit rises 126.72% in the March 2021 quarter,Sales decline 16.67% to Rs 1640.76 crore,positive,negative,3.3989266547406056,positive,11.014744145706857,positive
2021-05-11 10:18:00.000,223.6,244.5,220.3,231.2,7940910.0,Chambal Fertiliser gains after Q4 PAT spurts 169% YoY,"Chambal Fertilisers & Chemicals advanced 2.98% to Rs 230 after the company’s consolidated net profit surged 169.4% to Rs 541.75 crore on 16.7% decline in net sales to Rs 1,640.76 crore in Q4 FY21 over Q4 FY20.",positive,positive,3.3989266547406056,positive,11.014744145706857,positive
2021-05-11 12:13:12.000,230.6,267.4,228.3,256.0,12988821.0,Chambal Fertilisers shares jump 6% after Q4 profit surges to Rs 541.75 cr,"Shares of Chambal Fertilisers and Chemicals (CFCL) on Tuesday gained 6 percent after the company reported a surge in consolidated profit for the quarter ending March 31.The stock jumped 5.95 percent to Rs 236.65 on BSE. On NSE, it rallied 5.94 percent to Rs 236.90.Chambal Fertiliser…",positive,positive,11.014744145706857,positive,4.384615384615376,positive
2021-05-12 17:45:00.000,230.6,267.4,228.3,256.0,12988821.0,Chambal Fertilisers & Chemicals stock zooms 16% post Q4 earnings,"The stock has gained 99 per cent in one year and risen 12.27 per cent since the beginning of this year. Market cap of the firm rose to Rs 10,647.89 crore",neutral,positive,11.014744145706857,positive,4.384615384615376,positive
2021-06-18 08:31:00.000,302.9,314.2,291.2,310.6,4095564.0,"Two stock picks by Osho Krishan: Buy NOCIL, Chambal Fertilisers",NOCIL has been trading in a symmetrical triangle pattern on the daily time frame,neutral,neutral,2.5420931000330294,positive,0.974025974025974,positive
2021-06-30 08:28:25.000,312.0,314.0,304.5,305.2,1253318.0,Chambal Fertilisers (₹310.3): Buy,The stock of Chambal Fertilisers &amp; Chemicals regained bullish momentum and advanced 5 per cent with above average volume on Tuesday and moved above a key level of ₹300. Investors with a short-,neutral,positive,-2.1794871794871837,negative,-3.155339805825242,negative
2021-08-04 15:50:00.000,317.95,323.85,314.25,318.55,3055760.0,Chambal Fertilisers & Chemicals consolidated net profit rises 27.66% in the June 2021 quarter,Sales rise 9.97% to Rs 3539.52 crore,positive,positive,0.1887089164963116,neutral,-0.9639303482587136,negative
2021-08-04 17:53:09.000,317.95,323.85,314.25,318.55,3055760.0,Chambal Fertilisers Q1 profit up 28% on strong revenue; shares down marginally,Chambal Fertilisers and Chemicals Ltd (CFCL) on Wednesday posted a 28 per cent jump in its consolidated net profit at Rs 381.32 crore in the first quarter of the current fiscal on strong revenue.The company had posted a net profit of Rs 298.38 crore in the same quarter of the previous fisc…,positive,positive,0.1887089164963116,neutral,-0.9639303482587136,negative
2021-08-04 18:48:08.000,317.95,323.85,314.25,318.55,3055760.0,Chambal Fertilisers Q1 Profit Up 28% On Strong Revenue,"Net income rose on a consolidated basis to Rs 3,547.01 crore in the April-June quarter of 2021-22 financial year from Rs 3,226.12 crore in the year-ago period.",neutral,positive,0.1887089164963116,neutral,-0.9639303482587136,negative
2021-08-05 09:43:00.000,317.95,323.85,314.25,318.55,3055760.0,Chambal Fertilisers net profit rises 28% yoy to Rs381cr in Q1FY22,"Sales rose on a consolidated basis to Rs3,540cr in Q1FY22 from Rs3219cr in Q1FY21.",positive,positive,0.1887089164963116,neutral,-0.9639303482587136,negative
2021-10-07 12:04:15.000,376.0,451.0,370.3,434.8,9839484.0,Sobha Ltd leads gainers in ‘A’ group,"Jain Irrigation Systems Ltd, Titan Company Ltd, Chambal Fertilisers & Chemicals Ltd and Oberoi Realty Ltd are among the other gainers in the BSE’s ‘A’ group today, 07 October 2021.",positive,neutral,15.638297872340427,positive,-4.705882352941177,negative
2021-10-07 13:23:20.000,376.0,451.0,370.3,434.8,9839484.0,"Over 250 Stocks Hit 52-week High On BSE As Auto, Realty Rally. Titan At Rs 2-lakh-crore Market-cap","274 stocks hit new 52-week high on BSE including names like Titan Company, Sobha, Chambal Fertilisers, Tata Motors, PAGE Industries, Godrej Properties, Bata India, IRCTC, United Spirits and Tata Elxsi among others.",neutral,neutral,15.638297872340427,positive,-4.705882352941177,negative
2021-10-11 15:05:17.000,402.6,404.95,382.65,384.9,1916369.0,Chambal Fertilisers & Chemicals Ltd leads losers in ‘A’ group,"Surya Roshni Ltd, Tata Consultancy Services Ltd, Bandhan Bank Ltd and Coforge Ltd are among the other losers in the BSE’s ‘A’ group today, 11 October 2021.",positive,negative,-4.396423248882277,negative,-0.875386199794021,neutral
2021-10-12 15:04:04.000,388.4,399.4,378.75,385.0,1194898.0,Tata Metaliks Ltd leads losers in ‘A’ group,"Chambal Fertilisers & Chemicals Ltd, Bajaj Hindusthan Sugar Ltd, HCL Technologies Ltd and Honda India Power Products Ltd are among the other losers in the BSE’s ‘A’ group today, 12 October 2021.",positive,negative,-0.875386199794021,neutral,-1.4444157854010744,negative
2021-11-01 17:35:00.000,367.0,374.0,362.6,366.0,1435658.0,Chambal Fertilisers & Chemicals consolidated net profit rises 15.76% in the September 2021 quarter,Sales rise 12.33% to Rs 4478.61 crore,positive,positive,-0.2724795640326975,neutral,-3.504226888464676,negative
2021-11-17 08:15:00.000,376.15,376.5,352.05,356.4,1825827.0,"Short-term bias for Nifty seems weak, says Subash Gangadharan",The technical & derivative analyst from HDFC Securities recommends buying Chambal Fertilisers and Info Edge,negative,positive,-5.2505649342017815,negative,2.8993666432090106,positive
2021-11-25 08:45:00.000,380.5,403.95,380.0,401.5,6579691.0,"Buy Chambal Fertilisers & Chemicals, target price Rs 400: Yes Securities","Chambal Fertilisers & Chemicals Ltd., incorporated in the year 1985, is a Mid Cap company (having a market cap of Rs 15790.93 Crore) operating in Fertilisers sector.",neutral,neutral,5.519053876478318,positive,-8.429648241206033,negative
2021-11-26 07:57:37.000,398.0,398.0,363.05,364.45,2147023.0,"Trade Spotlight | What Should Investors Do With Reliance Industries, Chambal Fertilizers And Torrent Pharma?","Reliance Industries was the biggest Nifty gainer on November 25, rallying 6.02 percent, Chambal Fertilisers and Chemicals gained 5.42 percent and Torrent Pharmaceuticals was up 6.14 percent",neutral,positive,-8.429648241206033,negative,-1.5157666802002887,negative
2021-12-01 12:04:04.000,396.95,401.45,387.15,393.35,3205151.0,Chambal Fertilisers & Chemicals Ltd leads gainers in ‘A’ group,"Reliance Industrial Infrastructure Ltd, Spandana Sphoorty Financial Ltd, Vaibhav Global Ltd and National Fertilizer Ltd are among the other gainers in the BSE’s ‘A’ group today, 01 December 2021.",positive,neutral,-0.9069152286182052,negative,3.4223918575063585,positive
2021-12-02 07:00:35.000,396.95,401.45,387.15,393.35,3205151.0,"Trade Spotlight | What Should You Do Now With IndusInd Bank, Chambal Fertilisers, Texmo Pipes, & BSE?","Here’s what Gaurav Sharma of Globe Capital Markets, recommends investors should do with these stocks when the market resumes trading today.",neutral,neutral,-0.9069152286182052,negative,3.4223918575063585,positive
2021-12-02 09:20:00.000,396.95,401.45,387.15,393.35,3205151.0,"Buy Chambal Fertilisers & Chemicals, target price Rs 410: IIFL","Chambal Fertilisers & Chemicals Ltd., incorporated in the year 1985, is a Mid Cap company (having a market cap of Rs 16538.02 Crore) operating in Fertilisers sector.",neutral,neutral,-0.9069152286182052,negative,3.4223918575063585,positive
2021-12-16 08:49:00.000,413.1,424.1,395.25,406.0,2756313.0,"Buy Chambal Fertilisers & Chemicals, target price Rs 435: IIFL","Chambal Fertilisers & Chemicals Ltd., incorporated in the year 1985, is a Mid Cap company (having a market cap of Rs 17087.41 Crore) operating in Fertilisers sector.",neutral,neutral,-1.7187121762285211,negative,-4.042027194066755,negative
2022-01-05 13:54:00.000,424.0,437.4,421.55,427.5,3614036.0,"Buy Chambal Fertilisers, target price Rs 499: HDFC Securities","Chambal Fertilisers & Chemicals Ltd., incorporated in the year 1985, is a Mid Cap company (having a market cap of Rs 17932.32 Crore) operating in Fertilisers sector.",neutral,neutral,0.8254716981132075,neutral,-1.6976744186046535,negative
2022-01-11 07:24:20.000,436.8,436.8,421.55,425.75,2202816.0,"Hot Stocks | Double-digit Return Likely From Birla Corp, Chambal Fertilisers, Tata Coffee In Short Term","Vinay Rajani of HDFC Securities says they believe that the Nifty is in uptrend and dips should be utilised to create longs positions. Support for the Nifty is seen at 17,640. Upside targets for the Nifty are seen at 18,210 and 18,610",neutral,neutral,-2.5297619047619078,negative,6.690140845070422,positive
2022-01-17 09:02:00.000,470.0,477.65,468.2,469.85,2892361.0,"Buy Chambal Fertilisers & Chemicals, target price Rs 495: Chandan Taparia","Chambal Fertilisers & Chemicals Ltd., incorporated in the year 1985, is a Mid Cap company (having a market cap of Rs 19515.99 Crore) operating in Fertilisers sector.",neutral,neutral,-0.0319148936170164,neutral,-1.5306661036630425,negative
2022-01-28 15:11:00.000,460.1,469.1,428.1,434.5,3700232.0,Chambal Fertilisers falls after Q3 PAT declines 7.5% YoY,Chambal Fertilisers & Chemicals slipped 4.79% to Rs 432.15 after the company posted a 7.56% fall in consolidated net profit to Rs 435.17 crore in Q3 FY22 from Rs 470.75 crore posted in Q3 FY21.,negative,negative,-5.5640078243860085,negative,0.2193995381062329,neutral
2022-01-28 15:21:00.000,460.1,469.1,428.1,434.5,3700232.0,Chambal Fertilisers & Chemicals consolidated net profit declines 7.64% in the December 2021 quarter,Sales rise 22.48% to Rs 4743.33 crore,negative,positive,-5.5640078243860085,negative,0.2193995381062329,neutral
2022-01-28 17:14:00.000,460.1,469.1,428.1,434.5,3700232.0,Chambal Fertilisers Q3 Results: Net profit falls 8% to Rs 435.17 crore,"Total income, however, increased to Rs 4,762.22 crore in the third quarter of the current fiscal from Rs 3,879.6 crore in the year-ago period.",negative,positive,-5.5640078243860085,negative,0.2193995381062329,neutral
2022-02-02 15:04:07.000,404.2,415.85,404.0,407.25,2087653.0,Gujarat Ambuja Exports Ltd leads losers in ‘A’ group,"IFB Industries Ltd, Alkyl Amines Chemicals Ltd, Alok Industries Ltd and Chambal Fertilisers & Chemicals Ltd are among the other losers in the BSE’s ‘A’ group today, 02 February 2022.",negative,negative,0.7545769421078702,neutral,-1.9634477648802144,negative
2022-03-04 08:29:00.000,386.95,392.75,380.3,389.1,1198136.0,Nandish Shah recommends a Bull spread strategy on Chambal Fertilisers,The derivative analyst from HDFC Securities recommends buying CHAMBAL FERT March 400 CALL at Rs 13.50 & simultaneously selling 420 CALL at Rs 7.50.,neutral,positive,0.5556273420338633,neutral,-1.3506493506493478,negative
2022-03-23 15:04:04.000,416.55,424.0,413.0,415.85,2822392.0,Dhani Services Ltd leads losers in ‘A’ group,"Lakshmi Machine Works Ltd, Hinduja Global Solutions Ltd, Chambal Fertilisers & Chemicals Ltd and Mahindra Holidays & Resorts India Ltd are among the other losers in the BSE’s ‘A’ group today, 23 March 2022.",positive,negative,-0.1680470531748862,neutral,-1.834972415447344,negative
2022-05-04 17:30:00.000,452.6,464.3,449.05,450.1,1528084.0,"Taking Stock | Market tanks for the fourth day; IT, banks hammered","Despite the carnage, more than 200 stocks, including Welspun Corp, NTPC, Chambal Fertilisers and Adani Green Energy, touched their 52-week high on the BSE",positive,positive,-0.552364118426867,neutral,1.076233183856505,positive
