date,open,high,low,close,volume,title,description,title_sentiment,desc_sentiment,daily_change_pct,market_sentiment,next_day_change_pct,next_day_sentiment
2021-04-05 10:52:00.000,596.5,607.8,574.1,578.6,1678953.0,Container Corporation of India Ltd. shares fall 1.73 per cent in Monday’s trading session,The Relative Strength Index of the stock stood at 57.87 on Monday.,negative,neutral,-3.0008382229673054,negative,-0.9931506849314992,negative
2021-04-06 12:15:00.000,580.05,608.25,579.0,582.7,4416064.0,Share price of Container Corporation of India Ltd. as Sensex gains 258.95 points,"A total of 58,626 shares changed hands on the counter till 12:15PM (IST)",positive,neutral,0.4568571674855773,neutral,0.0254215744428592,neutral
2021-04-07 17:06:45.000,590.05,601.0,586.5,590.2,3628029.0,Concor calls EoI from local box manufacturers,State-run rail hauler Container Corporation of India Ltd (Concor) has called expression of interest on wednesday from prospective local container manufacturers ahead of launching a competitive bidding,neutral,positive,0.0254215744428592,neutral,-0.8642602948652809,neutral
2021-04-30 08:48:14.000,557.85,605.0,551.3,589.5,6490050.0,"Mumbai-Delhi Dedicated Freight Corridor Could Favour Concor, Says Nomura",Container Corporation of India stands to benefit from the commissioning of Western Dedicated Freight Corridor.,neutral,positive,5.673568163484803,positive,-2.9576271186440755,negative
2021-05-10 16:16:00.000,577.55,631.95,575.6,612.75,10152790.0,First ‘Oxygen Express’ train to Karnataka to arrive in Bengaluru tomorrow,"The train is expected to reach Inland Container Depot, Container Corporation of India, Whitefield, here, on Tuesday, an official press release said.",neutral,neutral,6.09471041468272,positive,-3.5569927243330643,negative
2021-05-12 09:50:00.000,618.5,624.0,593.7,596.5,2985115.0,"Buy Container Corporation of India, target price Rs 670: Edelweiss","Container Corporation of India Ltd., incorporated in the year 1988, is a Large Cap company (having a market cap of Rs 37319.28 Crore) operating in Logistics sector.",neutral,neutral,-3.5569927243330643,negative,-4.299096687855459,negative
2021-05-21 08:36:00.000,595.0,608.95,582.65,588.4,3017209.0,SGX Nifty up 130 points; here’s what changed for market while you were sleeping,"SBI, JSW Steel, Shree Cements, Hindalco Industries, United Spirits, Container Corporation of India, Crompton Greaves Consumer, Dr Lal Pathlabs, Godrej Industries, Ircon International and Birlasoft are among companies which will announce their March quarter results today.",neutral,neutral,-1.1092436974789954,negative,11.511423550087873,positive
2021-05-21 20:45:00.000,595.0,608.95,582.65,588.4,3017209.0,Board of Container Corporation Of India approves scheme of arrangement,At meeting held on 21 May 2021,neutral,neutral,-1.1092436974789954,negative,11.511423550087873,positive
2021-05-21 20:46:17.000,595.0,608.95,582.65,588.4,3017209.0,Results: Concor Q4 net profit down to Rs 24.97 crore,"State-owned Container Corporation of India Ltd (Concor) on Friday reported a 92 per cent dip in consolidated net profit to Rs 24.97 crore for the fourth quarter ended March 2021.The company had clocked a net profit of Rs 316.56 crore in the year-ago period, the multi-modal logistics compan…",negative,positive,-1.1092436974789954,negative,11.511423550087873,positive
2021-05-21 21:05:12.000,595.0,608.95,582.65,588.4,3017209.0,Container Corporation Of India announces appointment of Government Director,Powered by Capital Market - Live News,positive,neutral,-1.1092436974789954,negative,11.511423550087873,positive
2021-05-21 21:26:10.000,595.0,608.95,582.65,588.4,3017209.0,Container Corporation Q4 Net Profit Dives 92% To Rs 24.97 Crore,"For the full fiscal 2020-21, the company’s consolidated profit rose 23 percent to Rs 500.61 crore as against Rs 405.70 crore in 2019-20.",neutral,positive,-1.1092436974789954,negative,11.511423550087873,positive
2021-05-24 13:13:00.000,649.0,677.7,639.0,677.7,19605466.0,Container Corporation rallies 10% on strong revenue performance in Q4,"The stock has surpassed its previous 52-week high of Rs 644, touched on March 4, 2021",positive,positive,4.422187981510022,positive,-1.4152341434499045,negative
2021-05-24 14:31:54.000,649.0,677.7,639.0,677.7,19605466.0,Board of Container Corporation Of India approves borrowing of funds up to Rs 3500 cr,At meeting held on 21 May 2021,neutral,neutral,4.422187981510022,positive,-1.4152341434499045,negative
2021-05-25 21:25:00.000,674.8,680.95,663.05,665.25,6073949.0,Will Centre miss its disinvestment target again?,"The disinvestment plan includes sale of assets like BPCL, Air India, Shipping Corporation of India, Container Corporation of India, IDBI Bank, BEML, Pawan Hans and Neelachal Ispat Nigam",negative,neutral,-1.4152341434499045,negative,1.7692424013307193,positive
2021-05-26 15:18:00.000,661.3,675.0,646.0,673.0,8503069.0,"Results Review For Container Corporation, Alkem Labs, Emami, TTK Prestige","Results Review For Container Corporation, Alkem Labs, Emami, TTK Prestige",neutral,neutral,1.7692424013307193,positive,-0.9643916913946587,negative
2021-05-30 00:07:22.000,668.9,694.0,666.25,683.15,7589468.0,Movers & Shakers: Stocks that will see action this week,CONCOR (₹667.6)Breaches a multi-year highThe stock of Container Corporation of India (CONCOR) began a fresh leg of rally in early 2021 from about ₹400. The scrip appreciated and in early March it mark,neutral,positive,2.130363283001944,positive,1.4342163032343145,positive
2021-07-02 09:04:00.000,690.2,691.95,677.5,682.9,846041.0,10 laggards of 2020 make up for lost year in six months. Worth a look?,"This years rally in those stocks helped them completely erase the losses of last year. The list included names such as Greaves Cotton, Central Bank of India, Container Corporation of India, J&K Bank, UPL, Tata Chemicals and SCUF.",neutral,positive,-1.05766444508839,negative,1.2919708029197114,positive
2021-07-12 10:18:00.000,682.35,702.0,680.0,684.2,3457403.0,CONCOR volumes grow 35% YoY in Q1,"Container Corporation of India (CONCOR) said that total throughput increased by 35.35% to 9,91,746 twenty-foot equivalent units (TEUs) in Q1 FY22 from 7,32,711 TEUs in Q1 FY21.",positive,positive,0.2711218582838752,neutral,-1.2426422498364875,negative
2021-07-29 08:15:29.000,646.15,646.15,628.05,628.8,1166895.0,"Markets may consolidate post Fed meet; Tech Mahindra, TVS Motors in focus","Tech Mahindra, TVS Motors Company, Colgate-Palmolive (India), Container Corporation of India, Laurus Labs, , Deepak Nitrite, Oberoi Realty, Union Bank of India, LIC Housing Finance and Ajanta Pharma are key companies which will announce June quarter earnings today.",neutral,neutral,-2.685135030565662,negative,-2.254098360655724,negative
2021-07-29 18:31:00.000,658.8,665.75,641.35,643.95,6554095.0,Container Corporation Of India standalone net profit rises 313.28% in the June 2021 quarter,Sales rise 52.00% to Rs 1807.54 crore,positive,positive,-2.254098360655724,negative,4.848484848484849,positive
2021-07-29 23:23:00.000,658.8,665.75,641.35,643.95,6554095.0,Concor Q1 consolidated net profit jumps multi-fold to Rs 251 crore,State-owned Container Corporation of India Ltd (Concor) on Thursday reported 409.67 per cent surge in consolidated net profit to Rs 251.22 crore for the first quarter ended June 30.,positive,positive,-2.254098360655724,negative,4.848484848484849,positive
2021-07-30 00:44:13.000,658.8,665.75,641.35,643.95,6554095.0,"Concor Q1 consolidated net profit rises sharply to Rs 251 crore; total income at Rs 1,876.79 cr","State-owned Container Corporation of India Ltd (Concor) on Thursday reported 409.67 per cent surge in consolidated net profit to Rs 251.22 crore for the first quarter ended June 30.The company had clocked a net profit of Rs 49.29 crore in the year-ago period, the multi-modal logistics comp…",positive,positive,-2.254098360655724,negative,4.848484848484849,positive
2021-07-30 08:09:00.000,658.8,665.75,641.35,643.95,6554095.0,Container Corporation Of India consolidated net profit rises 327.70% in the June 2021 quarter,Sales rise 52.40% to Rs 1819.94 crore,positive,positive,-2.254098360655724,negative,4.848484848484849,positive
2021-07-30 08:45:00.000,658.8,665.75,641.35,643.95,6554095.0,"Stocks to watch: TechM, Concor, Bandhan Bank, UPL, Tatva Chintan, TVS Motor",State-owned Container Corporation of India (Concor) reported a 409.67 per cent YoY surge in consolidated net profit to Rs 251.22 crore for the first quarter ended June 30,neutral,positive,-2.254098360655724,negative,4.848484848484849,positive
2021-07-30 09:15:00.000,658.8,665.75,641.35,643.95,6554095.0,CONCOR spurts after strong Q1 performance,Container Corporation of India surged 4.16% to Rs 656.55 after the company’s consolidated net profit soared 327% to Rs 259.23 crore in Q1 FY22 from Rs 60.61 crore posted in Q1 FY21.,positive,positive,-2.254098360655724,negative,4.848484848484849,positive
2021-07-30 10:30:46.000,658.8,665.75,641.35,643.95,6554095.0,CONCOR Share Price Rises After Q1 Profit Surges 409% To Rs 251 Crore,"Container Corporation of India’s total income during the April-June quarter increased to Rs 1,876.79 crore from Rs 1,251.50 crore in the year-ago period. Expenses stood at Rs 1,536 crore as compared to Rs 1,179.71 crore earlier.",neutral,positive,-2.254098360655724,negative,4.848484848484849,positive
2021-08-01 11:37:00.000,660.0,694.15,654.5,692.0,5637045.0,"Results Review For Marico, JSW Energy, Container Corporation, Oberoi Realty","Results Review For Marico, JSW Energy, Container Corporation, Oberoi Realty",neutral,neutral,4.848484848484849,positive,0.8946608946609012,neutral
2021-08-06 13:14:02.000,698.95,706.75,687.85,691.35,1577024.0,"Foreign Brokerages Raise Target Price Of These 10 Stocks, Do You Own Any?","Britannia Industries, State Bank of India, Container Corporation of India, Dabur India, Sun Pharma are among the stocks where foreign broking houses have raised the target price.",neutral,neutral,-1.0873453036697935,negative,-3.605354058721928,negative
2021-08-25 14:43:00.000,648.7,664.6,644.35,653.5,2845171.0,Container Corporation Of India receives reaffirmation in credit ratings,Non fund based limits long term (Rs 462 crore) - ICRA AA+; Rating continues on watch with developing implications.,positive,neutral,0.7399414213041398,neutral,-0.2208850635996717,neutral
2021-09-13 19:22:36.000,740.0,745.6,725.5,728.9,1234785.0,Congress questions proposed disinvestment of container corporation,"The PSU had been consistently earning profits in past 10 years, it says",neutral,positive,-1.500000000000003,negative,-1.7134275377158945,negative
2021-09-27 10:41:00.000,700.5,708.05,695.0,700.9,1140033.0,GoI extends tenure of CONCOR CMD V Kalyana Rama by 2 years till Sept 2023,"Container Corporation of India said that the Ministry of Railways, Government of India, has extended the tenure of the company’s chairman and managing director V. Kalyana Rama by two years till 30 September 2023.",positive,positive,0.0571020699500324,neutral,0.4390934844192667,neutral
2021-10-11 13:39:00.000,687.6,701.45,682.05,696.5,1228018.0,"Air India disinvestment: Privatisation-bound BPCL, SCI can rally up to 15%","SpiceJet seems to be in a trading range, while Container Corporation of India is holding above its key support level",positive,neutral,1.2943571844095372,positive,-2.2209607606613178,negative
2021-10-12 12:53:00.000,704.65,704.65,680.0,689.0,1712690.0,CONCOR’s handled physical volumes rise by 11% YoY in Q2 FY22,"Container Corporation of India (CONCOR) said that its total physical volumes handled increased by 10.74% to 9,80,757 twenty-foot equivalent units (TEUs) in Q2 FY22 as compared with 8,85,673 TEUs in Q2 FY21.",positive,positive,-2.2209607606613178,negative,-2.5899280575539567,negative
2021-10-21 18:56:00.000,680.55,685.0,657.6,677.5,3858226.0,Container Corporation Of India consolidated net profit rises 37.43% in the September 2021 quarter,Sales rise 21.73% to Rs 1837.20 crore,positive,positive,-0.4481669238116162,neutral,-2.6624844992340795,negative
2021-10-21 22:47:15.000,680.55,685.0,657.6,677.5,3858226.0,Container Corporation Q2 Net Profit Jumps Over 41% To 248 Crore,"The total income in July-September FY22 increased to Rs 1,900 crore, from Rs 1,573 .97 crore a year ago.",neutral,positive,-0.4481669238116162,neutral,-2.6624844992340795,negative
2021-10-22 10:31:00.000,680.55,685.0,657.6,677.5,3858226.0,CONCOR Q2 PAT rises 37% YoY to Rs 253 cr,Container Corporation of India (CONCOR) reported a 37.4% increase in company’s consolidated net profit to Rs 253.72 crore in Q2 FY22 as compared to Rs 184.62 crore posted in Q2 FY21.,positive,positive,-0.4481669238116162,neutral,-2.6624844992340795,negative
2021-10-22 16:08:12.000,680.55,685.0,657.6,677.5,3858226.0,Container Corporation Q2 Review - In Line Quarter; FY22 Guidance Raised: Dolat Capital,Container Corporation Q2 Review - In Line Quarter; FY22 Guidance Raised: Dolat Capital,neutral,neutral,-0.4481669238116162,neutral,-2.6624844992340795,negative
2021-10-25 07:50:00.000,685.45,687.65,663.55,667.2,2105997.0,"Results Review For Mphasis, Container Corporation, Supreme Industries, IndiaMART","Results Review For Mphasis, Container Corporation, Supreme Industries, IndiaMART",neutral,neutral,-2.6624844992340795,negative,1.5880149812734117,positive
2022-01-12 10:58:00.000,655.0,661.95,645.35,655.4,2053263.0,Container Corporation reports 25.75% spike in physical container volumes in Q3,"CONCOR reported an increase of 3% for EXIM’s physical quantity, and a 25.75% increase in DOM’s quantity, y-o-y basis.",positive,positive,0.0610687022900728,neutral,2.8374233128834354,positive
2022-01-21 02:45:00.000,661.95,665.85,619.0,623.2,4368669.0,Container Corporation of India Dec-quarter net rises 24% to Rs 276 cr,The company had clocked a net profit of Rs 225.66 crore in the corresponding quarter a year ago,positive,positive,-5.85391645894705,negative,-0.6221087892805833,neutral
2022-01-21 09:16:00.000,661.95,665.85,619.0,623.2,4368669.0,Container Corporation of India fixes record date for 2nd interim dividend,Record date is 03 February 2022,neutral,neutral,-5.85391645894705,negative,-0.6221087892805833,neutral
2022-01-21 10:01:00.000,661.95,665.85,619.0,623.2,4368669.0,Container Corporation of India Q3 PAT soars 22% YoY to Rs 283 cr,"Container Corporation of India (CONCOR)’s consolidated net profit jumped 21.59% to Rs 283.39 crore on a 9.68% surge in revenue from operations to Rs 1,938.03 crore in Q3 FY22 over Q3 FY21.",neutral,positive,-5.85391645894705,negative,-0.6221087892805833,neutral
2022-01-21 17:30:00.000,661.95,665.85,619.0,623.2,4368669.0,Container Corporation of India Dec-quarter net profit rises 24% to Rs 276 cr,"Total income during the October-December quarter of the current fiscal rose to Rs 1,994.18 crore, from Rs 1,842.11 crore in the year-ago period.",positive,positive,-5.85391645894705,negative,-0.6221087892805833,neutral
2022-01-26 19:43:00.000,615.05,624.25,600.55,622.0,1401785.0,"Centrum Broking gives ‘buy’ call for Concor, Polycab India, Axis Bank","Brokerage firm Centrum Broking has given a ‘buy’ call to potential investors for shares such as Container Corporation of India, Polycab India, and Axis Bank",neutral,positive,1.1299894317535233,positive,2.741935483870968,positive
2022-01-26 19:43:00.000,615.05,624.25,600.55,622.0,1401785.0,"Centrum Broking gives ‘buy’ call for Concor, Polycab India, Axis Bank","Brokerage firm Centrum Broking has given a ‘buy’ call to potential investors for shares such as Container Corporation of India, Polycab India, and Axis Bank",neutral,positive,1.1299894317535233,positive,2.741935483870968,positive
2022-01-31 11:47:47.000,644.0,651.0,638.15,645.0,1192132.0,Buy Container Corporation Of India; Target Of Rs 780: ICICI Direct,"ICICI Direct is bullish on Container Corporation of India recommended buy rating on the stock with a target price of Rs 780 in its research report dated January 22, 2022.",neutral,positive,0.15527950310559,neutral,0.1145038167938931,neutral
2022-02-10 17:18:36.000,610.0,618.55,608.2,611.8,650054.0,Buy Container Corporation; target of Rs 790: Motilal Oswal,"Motilal Oswal is bullish on Container Corporation has recommended buy rating on the stock with a target price of Rs 790 in its research report dated January 22, 2022.",neutral,positive,0.2950819672131073,neutral,-2.496061033253183,negative
2022-03-25 12:04:09.000,623.0,705.0,623.0,686.7,13640257.0,Container Corporation Of India Ltd leads gainers in ‘A’ group,"Inox Leisure Ltd, Dhani Services Ltd, L&T Finance Holdings Ltd and EIH Ltd are among the other gainers in the BSE’s ‘A’ group today, 25 March 2022.",positive,positive,10.224719101123602,positive,-3.028966328481109,negative
2022-03-27 20:06:20.000,680.1,686.2,654.1,659.5,3706714.0,Trade setup for Monday: Top 15 things to know before Opening Bell,"Based on the open interest future percentage, here are the 35 stocks in which a long build-up was seen including Container Corporation of India, Atul, PVR, MCX India, and Intellect Design Arena.",neutral,neutral,-3.028966328481109,negative,-2.409638554216868,negative
2022-03-28 11:03:39.000,680.1,686.2,654.1,659.5,3706714.0,Buy Container Corporation Of India; target of Rs 823: Anand Rathi,"Anand Rathi is bullish on Container Corporation Of India has recommended buy rating on the stock with a target price of Rs 823 in its research report dated March 28, 2022.",neutral,positive,-3.028966328481109,negative,-2.409638554216868,negative
2022-04-11 12:30:00.000,698.8,701.6,678.05,685.8,705169.0,CONCOR throughput rises to 1.06 mn TEUs in Q4 FY22,"Container Corporation of India’s physical volumes handled in Q4 FY22 stood at 10,68,721 twenty foot equivalent units (TEUs), up 0.92% as compared with the same period last year.",positive,positive,-1.8603319977103607,negative,-2.077280650784421,negative
2022-05-06 00:03:00.000,637.0,645.9,626.85,636.2,1053069.0,Railway land use policy may be tweaked for Concor selloff,The move is expected to facilitate strategic divestment of government-owned Container Corporation of India Ltd (Concor) by making the deal more lucrative for players.,neutral,positive,-0.1255886970172613,neutral,-0.375969922406193,neutral
2022-05-06 15:44:52.000,637.0,645.9,626.85,636.2,1053069.0,"Government May Switch Tracks on Railway Land Use Policy, Reduce LLF, for Concor Sale",The Ministry of Railways is preparing a detailed proposal that will be submitted to the Cabinet for approval after which the government can issue an expression of interest for Container Corporation of India Ltd,neutral,neutral,-0.1255886970172613,neutral,-0.375969922406193,neutral
2022-05-09 22:17:32.000,620.0,646.0,608.8,612.95,1946607.0,Trade setup for Tuesday: Top 15 things to know before Opening Bell,"Based on the open interest future percentage, a short build-up was seen in 90 stocks including Navin Fluorine International, SRF, Container Corporation of India, Motherson Sumi Systems, and L&T Infotech.",neutral,positive,-1.137096774193541,negative,-2.075425987240576,negative
2022-06-09 21:58:18.000,655.9,664.85,645.55,648.5,2072667.0,Trade setup for Friday: Top 15 things to know before Opening Bell,"Based on the open interest future percentage, here are the 63 stocks including IOC, Container Corporation of India, ICICI Lombard General Insurance, ONGC, and Berger Paints, in which a long build-up was seen.",neutral,neutral,-1.1282207653605698,negative,0.1557753719137004,neutral
2022-06-16 17:30:00.000,610.0,623.4,599.8,616.0,1838661.0,RITES bags order worth Rs 365 cr from Container Corporation of India,"The consultancy firm announced bagging the deal on Thursday, to look after the operation and maintenance of shunting locomotives for 10 years.",neutral,neutral,0.9836065573770492,positive,1.6112956810631307,positive
2022-06-17 10:04:06.000,610.0,623.4,599.8,616.0,1838661.0,RITES gains on bagging new orders worth Rs 364 cr,RITES rose 1.07% to Rs 235.75 the PSU firm secured an operation and maintenance work order from Container Corporation of India for Rs 364.56 crore.,positive,positive,0.9836065573770492,positive,1.6112956810631307,positive
2022-06-28 11:59:11.000,624.65,628.05,616.2,620.0,715317.0,Buy Container Corporation; target of Rs 750: Motilal Oswal,"Motilal Oswal is bullish on Container Corporation has recommended buy rating on the stock with a target price of Rs 750 in its research report dated June 27, 2022.",neutral,positive,-0.7444168734491279,neutral,-0.1132869396342339,neutral
2022-07-05 20:11:34.000,651.0,661.8,628.15,649.5,8517790.0,Cabinet May Discuss Proposal To Raise Lease Period For Railway Lands On Wednesday,"The Union Cabinet may consider a proposal to cut land licensing fee (LLF) and longer lease period for railway land on Wednesday, according to sources. The approval of the much-awaited Railway Land Policy amendment will make privatisation of Container Corporation of India (CONCOR) more attractive",neutral,positive,-0.2304147465437788,neutral,0.0,neutral
2022-07-28 22:23:52.000,690.6,714.65,688.05,710.25,2506054.0,Trade setup for today: Top 15 things to know before the opening bell,"Based on the open interest future percentage, a short-covering was seen in 139 stocks including Indiabulls Housing Finance, ONGC, City Union Bank, Container Corporation of India, and Mahindra & Mahindra",neutral,neutral,2.8453518679409173,positive,-0.2525429673798603,neutral
2022-08-05 20:46:55.000,692.0,701.2,684.0,686.0,2374189.0,Board of Navratna company fixes record date for interim dividend for FY 2022-23,"Container Corporation of India Ltd is a Navratna company under the ownership of Indian Railways, Ministry of Railways, Government of India.",neutral,neutral,-0.8670520231213872,neutral,1.3941605839415994,positive
2022-08-08 18:31:46.000,685.0,699.95,666.6,694.55,2070474.0,Broker’s Call: Container Corporation of India (Add),Broker’s Call: Container Corporation of India (Add),neutral,neutral,1.3941605839415994,positive,-0.5763688760806917,neutral
2022-09-07 16:00:00.000,734.95,747.0,716.6,736.05,10356534.0,"India cuts railway land licensing fee, clears decks to privatise Concor",It is expected that this decision will speed up the sale of the Centre’s stake in Container Corporation of India. Wednesday’s development is believed to be in line with NITI Aayog’s recommendation to keep the railway land leasing fee for containers below 3%.,neutral,positive,0.1496700455813197,neutral,2.793715846994542,positive
2022-09-07 21:56:29.000,734.95,747.0,716.6,736.05,10356534.0,Trade setup for today: Top 15 things to know before the opening bell,"Based on the open interest future percentage, there were 71 stocks including Container Corporation, JK Cement, Ramco Cements, ACC, and Firstsource Solutions in which a long build-up was seen",neutral,neutral,0.1496700455813197,neutral,2.793715846994542,positive
2022-09-11 18:44:35.000,753.0,771.0,753.0,763.3,3714024.0,Trade setup for today: Top 15 things to know before the opening bell,"Based on the open interest future percentage, there were 50 stocks including Crompton Greaves Consumer Electricals, Container Corporation of India, Dixon Technologies, Bandhan Bank, and Polycab India, in which short-covering was seen.",neutral,neutral,1.3678618857901663,positive,0.6733346407792348,neutral
2022-09-12 10:48:43.000,753.0,771.0,753.0,763.3,3714024.0,Buy Container Corporation of India; target of Rs 870: Motilal Oswal,"Motilal Oswal is bullish on Container Corporation of India recommended buy rating on the stock with a target price of Rs 870 in its research report September 09, 2022.",neutral,positive,1.3678618857901663,positive,0.6733346407792348,neutral
2022-09-18 20:27:14.000,742.4,759.85,736.4,746.45,1678366.0,Board of Navratna company fixes record date for final dividend: Details here,"A large-cap company with a market valuation of Rs. 45,020.76 crore, Container Corporation of India Ltd.",neutral,neutral,0.5455280172413886,neutral,-0.7534337911721533,neutral
2022-10-16 13:02:50.000,697.9,714.65,686.7,712.5,1113304.0,Dipam to hold pre-EoI road show ahead of Concor divestment kick-off,"The divestment of Container Corporation of India was cleared in November 2019, through which 30.8% was up for grabs for a private player. The government currently holds 54.8% stake in Concor",neutral,neutral,2.0919902564837405,positive,0.2847419959719361,neutral
2022-10-18 13:32:03.000,722.0,778.0,721.4,771.0,6319561.0,CONCOR volumes grow 17% YoY in Q2,"Container Corporation of India (CONCOR) said that total throughput increased by 16.63% to 11,43,895 twenty-foot equivalent units (TEUs) in Q2 FY23 from 9,80,757 TEUs in Q2 FY22.",positive,positive,6.786703601108034,positive,-2.807017543859652,negative
2022-11-10 19:41:29.000,809.95,813.95,765.0,767.0,3152988.0,Container Corporation of India Q2 net profit rises 20% to Rs 303.80 crore,"Its consolidated income during the July-September quarter increased to Rs 2,030.94 crore, from Rs 1,900.28 crore in the year-ago period",positive,positive,-5.30279646891784,negative,-0.235910878112707,neutral
2022-11-11 09:18:58.000,809.95,813.95,765.0,767.0,3152988.0,Container Corporation Of India consolidated net profit rises 19.61% in the September 2022 quarter,Sales rise 8.12% to Rs 1986.34 crore,positive,positive,-5.30279646891784,negative,-0.235910878112707,neutral
2022-11-22 17:30:00.000,738.7,758.2,736.55,748.5,1765736.0,"IPCA Labs, Concor among 9 stocks to go ex-dividend; Siemens results, Vedanta dividend & more","Manappuram Finance, IPCA Labs, EID Parry, GE Shipping, Container Corporation of India (Concor), ASM Technologies, Ingersoll-Rand, Pearl Global Industries and Morganite Crucible are going ex-dividend today",neutral,neutral,1.326654934344112,positive,-0.0665335994677312,neutral
