date,open,high,low,close,volume,title,description,title_sentiment,desc_sentiment,daily_change_pct,market_sentiment,next_day_change_pct,next_day_sentiment
2020-07-15 13:19:00.000,430.95,432.0,420.25,430.0,1666485.0,Container Corporation Q1 PAT may dip 44.5% YoY to Rs. 126.5 cr: ICICI Direct,"Net Sales are expected to decrease by 68.5 percent Y-o-Y (down 64.9 percent Q-o-Q) to Rs. 1,168.4 crore, according to ICICI Direct.",neutral,negative,-0.2204432068685436,neutral,3.7224847297452985,positive
2020-07-26 15:56:26.000,445.6,447.3,436.55,443.15,1581548.0,Concor starts train service to Bangladesh,"State-run Container Corporation of India Ltd (Concor) has flagged off a container train service to Bangladesh, seeking to tap into the growing trade with the neighbouring country. The inaugural servic",neutral,neutral,-0.5498204667863656,neutral,1.5730337078651686,positive
2020-07-26 17:57:23.000,445.6,447.3,436.55,443.15,1581548.0,Concor starts container train service to Bangladesh via Petrapole-Benapole route,"The Container Corporation of India (Concor), a PSU under the Ministry of Railways, has begun dedicated container train services to Bangladesh through the Petrapole–Benapole border route. This is the",neutral,neutral,-0.5498204667863656,neutral,1.5730337078651686,positive
2020-08-07 05:24:00.000,460.0,462.5,449.1,452.75,1068298.0,Container Corporation of India Q1FY21; consolidated profit falls ~76% yoy,The company recorded a consolidated profit of ~Rs58cr in Q1FY21.,negative,positive,-1.576086956521739,negative,-10.66974595842956,negative
2020-08-07 05:30:00.000,460.0,462.5,449.1,452.75,1068298.0,BRIEF-Container Corporation Of India June Quarter Consol Net Profit Falls - Investing.com India,"The Financial News section features stock market news in addition to stories about bonds, forex, commodities and economic releases.",neutral,neutral,-1.576086956521739,negative,-10.66974595842956,negative
2020-08-07 09:08:22.000,460.0,462.5,449.1,452.75,1068298.0,"Stocks in focus: Vodafone Idea, Mindspace REIT, Yes Bank, HPCL, PNB Housing Finance, Cipla","Mahindra & Mahindra, Cipla, Siemens, Abbott India, Balrampur Chini Mills, BEML, Birla Corporation, Container Corporation of India, Mahanagar Gas, REC and Sobha, etc., are among companies scheduled to announce their quarterly earnings",neutral,neutral,-1.576086956521739,negative,-10.66974595842956,negative
2020-08-07 17:37:00.000,460.0,462.5,449.1,452.75,1068298.0,Container Corporation Of India standalone net profit declines 72.93% in the June 2020 quarter,Sales decline 27.44% to Rs 1189.14 crore,negative,negative,-1.576086956521739,negative,-10.66974595842956,negative
2020-08-07 17:55:00.000,460.0,462.5,449.1,452.75,1068298.0,Container Corporation Of India consolidated net profit declines 75.16% in the June 2020 quarter,Sales decline 27.83% to Rs 1194.20 crore,negative,negative,-1.576086956521739,negative,-10.66974595842956,negative
2020-08-10 08:08:00.000,433.0,438.9,365.95,386.8,18109874.0,"In pics | Stocks in the news: IndusInd Bank, Bharti Airtel, Cipla, JSW Energy, Aditya Birla Capital, Bata, Birla Corp",REC | JSW Steel | Phoenix Mills | Container Corporation of India | PSP Projects | Amara Raja Batteries | Siemens | Shipping Corporation of India | Century Textiles | Gateway Distriparks RE | Mindspace Business Parks REIT are also some of the stocks in focus today.,neutral,neutral,-10.66974595842956,negative,-2.926829268292677,negative
2020-08-10 10:15:00.000,433.0,438.9,365.95,386.8,18109874.0,CONCOR tumbles after weak Q1 show,Container Corporation of India (CONCOR) slumped 13.5% to Rs 394 after the companys consolidated net profit dropped 78% to Rs 49.29 crore in Q1 June 2020 over Q1 June 2019.,negative,negative,-10.66974595842956,negative,-2.926829268292677,negative
2020-08-10 14:51:24.000,389.5,392.0,376.0,378.1,6718770.0,Volumes spurt at Container Corporation Of India Ltd counter,"Container Corporation Of India Ltd registered volume of 159.29 lakh shares by 14:19 IST on NSE, a 12 fold spurt over two-week average daily volume of 13.28 lakh shares",neutral,positive,-2.926829268292677,negative,-3.7037037037037033,negative
2020-08-10 15:50:27.000,389.5,392.0,376.0,378.1,6718770.0,Container Corporation Of India Ltd leads losers in ‘A’ group,"Birla Corporation Ltd, Meghmani Organics Ltd, RBL Bank Ltd and Hindustan Zinc Ltd are among the other losers in the BSEs A group today, 10 August 2020.",positive,negative,-2.926829268292677,negative,-3.7037037037037033,negative
2020-08-10 19:14:41.000,389.5,392.0,376.0,378.1,6718770.0,ICICI Securities: Container Corporation Q1 Review - Land License Fee Concerns Return,ICICI Securities: Container Corporation Q1 Review - Land License Fee Concerns Return,neutral,neutral,-2.926829268292677,negative,-3.7037037037037033,negative
2020-08-11 12:14:00.000,378.0,378.4,361.2,364.0,6925213.0,Buy Container Corporation of India; target of Rs 468: Prabhudas Lilladher,"Prabhudas Lilladher is bullish on Container Corporation of India has recommended buy rating on the stock with a target price of Rs 468 in its research report dated August 10, 2020.",neutral,positive,-3.7037037037037033,negative,3.3698630136986334,positive
2020-08-12 15:11:00.000,365.0,379.5,365.0,377.3,7007871.0,Buy Container Corporation ; target of Rs 455: Motilal Oswal,"Motilal Oswal is bullish on Container Corporation recommended buy rating on the stock with a target price of Rs 455 in its research report dated August 11, 2020.",neutral,positive,3.3698630136986334,positive,-0.0394736842105203,neutral
2020-08-12 16:05:00.000,365.0,379.5,365.0,377.3,7007871.0,Accumulate Container Corporation of India; target of Rs 440: Dolat Capital,"Dolat Capital recommended accumulate rating on Container Corporation of India with a target price of Rs 440 in its research report dated August 10, 2020.",neutral,positive,3.3698630136986334,positive,-0.0394736842105203,neutral
2020-08-20 09:24:00.000,391.0,396.35,385.3,394.0,1923988.0,Container Corporation Of India receives credit ratings from ICRA,Non-fund-based limits- Long term (Rs 462 crore) - [ICRA]AA+ &; Rating on watch with developing implications; Assigned,neutral,neutral,0.7672634271099744,neutral,-0.1645986325652006,neutral
2020-09-03 18:52:00.000,396.0,400.7,388.25,393.7,989793.0,Container Corporation Of India receives credit ratings from Brickwork Ratings India,Term debt (fund based -long term Rs 9000 crore) - BWR AA+ Rating under Watch with Developing Implications,neutral,positive,-0.5808080808080837,neutral,-1.212662752106204,negative
2020-09-04 07:02:00.000,396.0,400.7,388.25,393.7,989793.0,"Stocks in the news | Tata Motors, Adani Gas, Continental Chemicals, Infosys, Jubilant Industries, Essar Shipping","GSFC, CreditAccess Grameen, Hindustan Aeronautics,SBI Life Insurance Company, JSW Steel Jindal Steel & Power, Himatsingka Seide, Gennex Laboratories, Mangalam Drugs, GPT Infraprojects, Mindspace Business Parks REIT, Karuturi Global, Usha Martin, Container Corporation of India, Seacoast Shipping …",neutral,neutral,-0.5808080808080837,neutral,-1.212662752106204,negative
2020-09-10 15:22:00.000,372.4,385.0,370.35,383.6,3677913.0,Accumulate Container Corporation of India; target of Rs 440: Dolat Capital,"Dolat Capital recommended accumulate rating on Container Corporation of India with a target price of Rs 440 in its research report dated September 09, 2020.",neutral,positive,3.007518796992493,positive,-0.5047236961304634,neutral
2020-09-24 11:31:33.000,373.45,378.5,366.0,370.5,2225313.0,Container Corporation of India announces cessation of directors,With effect from 19 September 2020,neutral,neutral,-0.7899317177667663,neutral,1.0209564750134368,positive
2020-10-05 09:54:00.000,355.8,358.9,351.0,352.7,2875249.0,"Sell Container Corporation of India, target price Rs 336: Motilal Oswal","Container Corporation of India Ltd., incorporated in the year 1988, is a Large Cap company (having a market cap of Rs 21706.11 Crore) operating in Logistics sector.",neutral,neutral,-0.8712759977515522,neutral,1.7937853107344697,positive
2020-10-07 22:16:25.000,367.0,367.4,362.0,366.0,1081740.0,Private container train operators queer the pitch for Concor strategic sale,Terminals built on Indian Railways land by Container Corporation of India Ltd (Concor) must be treated as national assets and subjected to a common user regime wherein no operators are denied access r,neutral,neutral,-0.2724795640326975,neutral,1.6528925619834711,positive
2020-10-09 13:08:00.000,363.0,383.0,360.85,369.0,2859230.0,CONCOR reports 9% decline in Q2 volumes,"Container Corporation of India (CONCOR) said that the companys total throughput volumes declined 8.61% to 8,85,673 twenty-foot equivalent units (TEUs) (provisional) in Q2 FY21 from 9,69,158 TEUs in Q2 FY20.",negative,negative,1.6528925619834711,positive,-0.3887920632792569,neutral
2020-10-12 16:11:00.000,368.8,369.0,360.25,363.0,1895805.0,Container Corporation Of India announced appointment of director,With effect from 30 September 2020,neutral,neutral,-1.5726681127982676,negative,0.8832459287882939,neutral
2020-10-19 01:59:48.000,372.95,385.9,370.95,382.3,2030792.0,Disinvestment: Plans afoot to raise Rs 1 lakh crore in FY21,"Strategic sales in fuel retailer-refiner BPCL, Container Corporation (ConCor) and IDBI Bank would be completed in the year, an official source said.",positive,neutral,2.507038477007648,positive,0.2486585525454753,neutral
2020-10-23 21:19:00.000,395.05,396.5,383.7,385.5,1541985.0,"Govt to fetch nearly Rs 60,000 crore from sale of BPCL, Concor, SCI, BEML","The government plans to conclude the bidding process in four major PSUs -- BPCL, Shipping Corporation (SCI), Container Corporation (Concor) and BEML -- by November last as the stock market is heading to break above pre-Covid levels",neutral,neutral,-2.4174155170231644,negative,-0.6484243288808196,neutral
2020-11-06 08:06:00.000,396.0,399.0,371.9,378.5,13473674.0,Container Corporation Of India reports standalone net profit of Rs 187.58 crore in the September 2020 quarter,Sales decline 13.57% to Rs 1502.73 crore,neutral,negative,-4.41919191919192,negative,-0.1312335958005249,neutral
2020-11-06 08:27:00.000,396.0,399.0,371.9,378.5,13473674.0,"Stocks in the news | RIL, HFCL, ITC, Dish TV India, Adani Transmission, Axis Bank, Minda Corporation","Berger Paints, Dalmia Bharat, Adani Power, Chambal Fertilisers, Indiabulls Housing Finance, Inox Leisure, Aditya Birla Capital, Container Corporation of India, Torrent Power, Matrimony.com, are also among the stocks in focus today.",neutral,neutral,-4.41919191919192,negative,-0.1312335958005249,neutral
2020-11-06 15:05:14.000,396.0,399.0,371.9,378.5,13473674.0,Container Corporation Of India Ltd leads losers in ‘A’ group,"Welspun India Ltd, Heritage Foods Ltd, Suzlon Energy Ltd and Birlasoft Ltd are among the other losers in the BSEs A group today, 06 November 2020.",positive,negative,-4.41919191919192,negative,-0.1312335958005249,neutral
2020-11-09 11:47:00.000,381.0,383.45,375.25,380.5,3094668.0,"Buy Container Corporation, target price Rs 442: Motilal Oswal","Container Corporation of India Ltd., incorporated in the year 1988, is a Large Cap company (having a market cap of Rs 22924.70 Crore) operating in Logistics sector.",neutral,neutral,-0.1312335958005249,neutral,1.3089005235602094,positive
2020-11-09 17:58:11.000,382.0,389.4,378.6,387.0,2454468.0,Concor to levy surcharge at Tughlakabad ICD as steep hike in land license fee bites,"The Container Corporation of India Ltd (Concor) will levy a land usage surcharge of ₹5,000 per twenty-foot equivalent unit (TEU) on loaded import containers at its flagship inland container depot (ICD",neutral,neutral,1.3089005235602094,positive,2.9320987654320927,positive
2020-11-11 11:22:00.000,388.8,408.0,386.6,400.2,3857368.0,Container Corporation of India hands over Mulund terminal to Railways,"As per the Company’s assessment, the above surrender/ handover of the terminal to the Railways will not impact the business of the Company materially. The turnover from this terminal for FY 2019-20 was Rs.47.63 crores , net fixed assets deployed at",neutral,neutral,2.9320987654320927,positive,-0.3993012228599865,neutral
2020-11-11 17:15:00.000,400.7,402.7,398.0,399.1,1903153.0,Container Corporation to handover terminal in Mulund to Railways,The turnover from this terminal for FY20 was Rs47.63cr.,neutral,neutral,-0.3993012228599865,neutral,0.2007528230865775,neutral
2020-11-11 18:29:00.000,400.7,402.7,398.0,399.1,1903153.0,"Container Corporation of India surges 3.5% despite surrendering its ICD, Mulund (NGSM) terminal","As per the company’s assessment, the surrender of the terminal to the Railways will not impact the business of the company materially.",positive,neutral,-0.3993012228599865,neutral,0.2007528230865775,neutral
2020-11-12 15:25:00.000,398.5,403.0,393.0,399.3,1650816.0,Buy Container Corporation of India; target of Rs 468: Prabhudas Lilladher,"Prabhudas Lilladher is bullish on Container Corporation of India has recommended buy rating on the stock with a target price of Rs 468 in its research report dated November 06, 2020.",neutral,positive,0.2007528230865775,neutral,2.1545319465081696,positive
2021-01-03 17:38:00.000,405.9,418.75,403.7,413.7,4707722.0,"Govt to divest 26% stake in BEML, invites bids till March 1","The government is aggressively going ahead with privatisation of state-run companies such as Bharat Petroleum Corporation Limited, Container Corporation of India, Shipping Corporation of India and Air India.",neutral,positive,1.9216555801921684,positive,0.1691638472692094,neutral
2021-01-03 21:47:00.000,405.9,418.75,403.7,413.7,4707722.0,Missing the mark: How will govt achieve divestment target for FY21,"Among strategic sales, the government is already working on plans to divest Bharat Petroleum, Container Corporation, BEML, and Shipping Corporation",neutral,neutral,1.9216555801921684,positive,0.1691638472692094,neutral
2021-01-05 05:30:00.000,413.8,416.95,408.2,414.5,2737191.0,BRIEF-Container Corporation Of India Ltd - Concor Is Exploring Possibility Of Merger Of Units With Co - Investing.com India,"The Financial News section features stock market news in addition to stories about bonds, forex, commodities and economic releases.",neutral,neutral,0.1691638472692094,neutral,2.892857142857137,positive
2021-01-05 16:22:00.000,420.0,444.9,417.0,432.15,11691478.0,Govt to invite EoIs for strategic divestment of Container Corporation by month end,"Potential bidders will be invited for purchasing about 30% stake in the public sector enterprise after the railways ministry brings out policy for land leasing, which has been the key issue holding back the initiation of divestment process.",neutral,neutral,2.892857142857137,positive,-1.403628894214305,negative
2021-01-05 18:50:10.000,420.0,444.9,417.0,432.15,11691478.0,Container Corporation Of India evaluates proposed merger with subsidiaries,Powered by Capital Market - Live News,neutral,neutral,2.892857142857137,positive,-1.403628894214305,negative
2021-01-06 06:50:00.000,420.0,444.9,417.0,432.15,11691478.0,Container Corporation soars 6% after floating e-tender for proposed merger of subsidiary company,"The company is exploring the possibility of the merger of CONCOR AIR, SIDCUL CONCOR Infra Company and Punjab Logistics Infrastructure with CONCOR.",neutral,neutral,2.892857142857137,positive,-1.403628894214305,negative
2021-01-06 07:40:24.000,420.0,444.9,417.0,432.15,11691478.0,"Stocks In The News | ACC, Bajaj Finance, BEML, HDFC Bank, Hero MotoCorp, CONCOR","Vikas EcoTech, General Insurance Corporation of India, International Combustion, Container Corporation of India, BEML, Dai-Ichi Karkaria, Asahi India Glass, Ircon International are also among the stocks in focus today.",neutral,neutral,2.892857142857137,positive,-1.403628894214305,negative
2021-01-06 14:08:00.000,438.15,442.0,429.3,432.0,3245229.0,CONCOR spurts on plan to merge subsidiaries with itself,Container Corporation of India (CONCOR) jumped 4.02% to Rs 432 after the company said it is exploring the possibility of merging its subsidiaries with itself.,neutral,positive,-1.403628894214305,negative,0.6980203684632135,neutral
2021-01-07 06:07:00.000,438.15,442.0,429.3,432.0,3245229.0,Decks may soon be cleared for Container Corporation privatisation,The policy will provide clarity on lease rates the new buyer of the company will have to pay,neutral,positive,-1.403628894214305,negative,0.6980203684632135,neutral
2021-01-07 08:10:00.000,438.15,442.0,429.3,432.0,3245229.0,Top headlines: Covaxin cheaper than Covoshield; spectrum auction from Mar 1,"From government working on pricing of the coronavirus vaccine to decks being cleared for Container Corporation privatisation, here are top headlines this morning",neutral,neutral,-1.403628894214305,negative,0.6980203684632135,neutral
2021-01-18 16:19:16.000,426.85,440.6,426.85,439.0,1662624.0,Concor launches container train service from Shalimar to JNPT,"Container Corporation of India Ltd (Concor) has introduced a container train service from its container terminal at Shalimar, to the Jawaharlal Nehru Port (JNPT, NhavaSheva). This will act as a gate",neutral,positive,2.846433173245865,positive,-0.3772290809327794,neutral
2021-01-29 16:51:45.000,440.0,457.45,431.0,436.4,4556593.0,"To create a level-playing field, Railways proposed land licensing policy will apply to Concor and private operators",The new land licensing policy drafted by the Ministry of Railways for the Cabinet’s consideration will apply to state-run Container Corporation of India Ltd (Concor) and other private container train,neutral,neutral,-0.8181818181818232,neutral,3.386727688787188,positive
2021-02-04 13:07:00.000,488.95,491.5,461.75,469.0,4940062.0,Container Corporation Q3 PAT up 29.96% at Rs233cr on revenue boost and deferred tax benefits,"Container Corporation reported 14.38% growth in total revenues for the Dec-20 quarter on consolidated basis at Rs1,766.89cr",positive,positive,-4.080171796707228,negative,6.358996171841777,positive
2021-02-04 20:09:00.000,488.95,491.5,461.75,469.0,4940062.0,Divestment plan to work well: FM,"The government is targeting to conclude strategic sale of BPCL, Air India, Shipping Corporation of India, Container Corporation of India, IDBI Bank, BEML, Pawan Hans, Neelachal Ispat Nigam Ltd, in the next fiscal.",neutral,neutral,-4.080171796707228,negative,6.358996171841777,positive
2021-02-04 20:09:00.000,488.95,491.5,461.75,469.0,4940062.0,"Confident that disinvestment calendar will work well, non-tax revenues to improve in FY22: FM","The government is targeting to conclude strategic sale of BPCL, Air India, Shipping Corporation of India, Container Corporation of India, IDBI Bank, BEML, Pawan Hans, Neelachal Ispat Nigam Ltd, in the next fiscal.",positive,neutral,-4.080171796707228,negative,6.358996171841777,positive
2021-02-05 07:31:38.000,488.95,491.5,461.75,469.0,4940062.0,"Stocks In The News | Biocon, Tata Power, Adani Transmission, Vedanta, Godrej Agrovet","Stove Kraft, Bharat Electronics, PSP Projects, Container Corporation of India, Trent, Gillette India, Dollar Industries, are also among the stocks in focus today.",neutral,neutral,-4.080171796707228,negative,6.358996171841777,positive
2021-02-05 08:43:00.000,488.95,491.5,461.75,469.0,4940062.0,CONCOR reports robust Q3 result,"Container Corporation of India (CONCOR) said its consolidated net profit rose 29.51% to Rs 234.27 crore on 14.39% rise in total income to Rs 1,842.11 crore in Q3 December 2020 over Q3 December 2019.",positive,positive,-4.080171796707228,negative,6.358996171841777,positive
2021-02-05 10:06:51.000,488.95,491.5,461.75,469.0,4940062.0,"Hero MotoCorp, Tata Power, Container Corporation of India: Here are the Top Stocks for Investors on February 5",The Indian stock market is expected to open in the green with the indices hitting new highs during the trading session.,neutral,neutral,-4.080171796707228,negative,6.358996171841777,positive
2021-02-05 17:41:00.000,488.95,491.5,461.75,469.0,4940062.0,Container Corporation Of India consolidated net profit rises 29.51% in the December 2020 quarter,Sales rise 14.38% to Rs 1766.89 crore,positive,positive,-4.080171796707228,negative,6.358996171841777,positive
2021-02-05 20:44:26.000,488.95,491.5,461.75,469.0,4940062.0,Pressure building up on govt to fix land licensing issue ahead of Concor sale,Private container train operators fear that the privatisation of Container Corporation of India Ltd (Concor) will create a “state-supported dominant private player” in the inter-modal sector and urge,neutral,positive,-4.080171796707228,negative,6.358996171841777,positive
2021-02-08 11:21:00.000,470.2,515.5,470.2,500.1,8813453.0,"Buy Container Corporation, target price Rs 555: Motilal Oswal","Container Corporation of India Ltd., incorporated in the year 1988, is a Large Cap company (having a market cap of Rs 30132.65 Crore) operating in Logistics sector.",neutral,neutral,6.358996171841777,positive,-0.2286282306162976,neutral
2021-02-08 15:42:41.000,503.0,508.9,498.65,501.85,2639480.0,Buy Container Corporation Of India; Target Of Rs 561: Prabhudas Lilladher,"Prabhudas Lilladher is bullish on Container Corporation of India has recommended buy rating on the stock with a target price of Rs 561 in its research report dated February 05, 2021.",neutral,positive,-0.2286282306162976,neutral,-1.3735177865612629,negative
2021-02-10 15:30:17.000,498.0,507.0,492.3,500.0,917956.0,Buy Container Corporation Of India; Target Of Rs 560: ICICI Direct,"ICICI Direct is bullish on Container Corporation of India has recommended buy rating on the stock with a target price of Rs 560 in its research report dated February 05, 2021.",neutral,positive,0.4016064257028112,neutral,8.63172634526905,positive
2021-02-12 16:04:50.000,499.9,573.05,495.6,543.05,14053731.0,Buy Container Corporation; Target Of Rs 555: Motilal Oswal,"Motilal Oswal is bullish on Container Corporation has recommended buy rating on the stock with a target price of Rs 555 in its research report dated February 06, 2021.",neutral,positive,8.63172634526905,positive,0.6445672191528545,neutral
2021-02-21 13:24:00.000,568.9,568.95,544.25,547.45,2291623.0,CPSE strategic sale: Govt makes security clearance mandatory for all bidders,"The government has lined up sale of its majority stake along with management control in BPCL, Air India, Shipping Corporation of India, Container Corporation of India, IDBI Bank, BEML, Pawan Hans, Neelachal Ispat Nigam in the next fiscal.",neutral,neutral,-3.7704341712075817,negative,0.4221683283930698,neutral
2021-02-22 06:10:00.000,568.9,568.95,544.25,547.45,2291623.0,"Land policy delay hurdle to Container Corporation sale, says panel","Railway ministry denies charge, says divestment planned for next year",neutral,neutral,-3.7704341712075817,negative,0.4221683283930698,neutral
2021-02-23 20:24:00.000,568.0,595.0,565.7,585.0,3889802.0,Tata Consumer Products to enter Nifty 50 index from 31 March,"Tata Consumer Products is a multinational consumer goods company and a subsidiary of the Tata Group.Seven stocks including Bank of Baroda, Container Corporation of India (Concor), General Insurance Corporation of India, Hindustan Zinc will be excluded from the Nifty Next 50 index",neutral,neutral,2.992957746478873,positive,-3.174202239622804,negative
2021-02-26 16:01:39.000,566.0,585.95,550.2,551.25,4609208.0,Was Sure About Divestment Process Being Of No Help: Enam’s Sridhar Sivaram,"“In our view, BPCL and Container Corporation of India (CONCOR) are possibly the best two companies currently that are being offered,” Sridhar Sivaram, Investment Director at Enam Holdings said",neutral,positive,-2.606007067137809,negative,0.5151891987919661,neutral
2021-03-04 17:22:00.000,621.7,624.45,588.05,595.95,4632557.0,Container Corp share hits 52-week high after Jefferies raises price target,"Container Corporation of India share rose to a fresh high of Rs 643.9, gaining 11.3% against previous close of Rs 578.55 on BSE",positive,positive,-4.141869068682644,negative,-0.884589947089932,neutral
2021-03-04 19:16:00.000,621.7,624.45,588.05,595.95,4632557.0,"Higher realisations, market share gains drive Container Corporation stock",The resolution of land licence fee however remains the key trigger,positive,positive,-4.141869068682644,negative,-0.884589947089932,neutral
2021-03-10 20:51:04.000,593.8,593.8,567.6,573.0,2582380.0,"Railways clear new land licensing fee policy, proposal sent to Cabinet for approval",The new LLF policy for facilities built on railway land will help end the deadlock over a key issue that has halted the process of privatising the state-run Container Corporation of India Ltd (Concor).,neutral,positive,-3.502862916806998,negative,-2.3728813559322037,negative
2021-03-15 11:10:00.000,562.55,572.5,553.0,561.0,3483110.0,Fresh challenges for PSUs electing independent directors,"The development comes at a time when shareholders are increasingly turning wary about independent directors being proposed by the government. In 2020, at least half a dozen public sector undertakings (PSUs), including Container Corporation, Mahanagar Gas, Petronet and HUDCO, have seen strong opposit…",negative,neutral,-0.2755310639054226,neutral,-1.4336283185840748,negative
2021-03-15 21:33:31.000,565.0,566.0,554.0,556.9,1893450.0,Concor offers rail freight discount to exporters,"Exporters in hinterland facing container shortage can get a 50 per cent rail transportation discount from April 1, if they use Container Corporation of India’s services to haul empty boxes from ports.",neutral,neutral,-1.4336283185840748,negative,-1.856379606990854,negative
2021-03-22 13:46:00.000,558.0,576.0,558.0,567.0,3480791.0,Container Corporation of India Ltd. shares down 0.7% as Nifty drops,"A total of 53,848 shares changed hands on the counter till 01:46PM (IST).",negative,neutral,1.6129032258064515,positive,-0.6648936170212766,neutral
