date,open,high,low,close,volume,title,description,title_sentiment,desc_sentiment,daily_change_pct,market_sentiment,next_day_change_pct,next_day_sentiment
2022-12-18 20:34:50.000,741.3,745.1,730.35,740.1,879169.0,Trade setup for today: Top 15 things to know before the opening bell,"Based on the open interest future percentage, as many as 100 stocks saw a long unwinding on Friday, including Punjab National Bank, Bank Nifty, Container Corporation, Apollo Tyres, and BHEL",neutral,neutral,-0.1618777822743736,neutral,1.148648648648649,positive
2023-01-11 23:58:45.000,727.0,735.0,716.65,724.75,1933673.0,"Govt to invite EoIs for Concor privatisation this month, say officials","The government will this month invite Expression of Interest or preliminary bids for privatising Container Corporation of India (Concor), an official said on Wednesday.",neutral,neutral,-0.3094910591471801,neutral,-1.2378976486860367,negative
2023-01-12 09:50:05.000,727.0,735.0,716.65,724.75,1933673.0,CONCOR’s Q3 throughput at 10.85 lakh TEUs; domestic volumes up 24% YoY,"Container Corporation of India that its total throughput in quarter ended December 2022 was 10,85,154 twenty foot equivalent units (TEUs), up by 5.18% from 10,31,701 TEUs recorded in the same period last year.",positive,positive,-0.3094910591471801,neutral,-1.2378976486860367,negative
2023-01-23 17:30:00.000,690.6,690.6,677.0,678.5,3343391.0,"Stocks in news: Yes Bank, RIL, JSW Steel, UltraTech Cement, SBI and other banks","Axis Bank, IDBI Bank, Canara Bank, Container Corporation of India, Tata Communications, Syngene, Gland Pharma, Poonawalla Fincorp, KEI Industries, Jindal Stainless and HFCL are among the companies that will announce their results for the December 2022 quarter.",neutral,neutral,-1.7520996235157866,negative,-4.450994841562276,negative
2023-01-23 18:56:54.000,690.6,690.6,677.0,678.5,3343391.0,"Navratna company declares 80% dividend, check record date here","With a market valuation of ₹42,711.53 Cr, Container Corporation of India Ltd. is a Navratna CPSE owned by the Indian government.",neutral,neutral,-1.7520996235157866,negative,-4.450994841562276,negative
2023-01-24 09:04:48.000,690.6,690.6,677.0,678.5,3343391.0,Container Corporation Of India consolidated net profit rises 3.37% in the December 2022 quarter,Sales rise 3.43% to Rs 2004.46 crore,positive,positive,-1.7520996235157866,negative,-4.450994841562276,negative
2023-01-24 10:50:17.000,690.6,690.6,677.0,678.5,3343391.0,CONCOR reports PAT of Rs 294 cr in Q3 FY23,"Container Corporation of India’s (CONCOR) consolidated net profit rose 3.4% to Rs 294.20 crore on 3.4% increase in revenue from operations to Rs 2,004.46 crore in Q3 FY23 over Q3 FY22.",neutral,positive,-1.7520996235157866,negative,-4.450994841562276,negative
2023-01-24 22:44:39.000,678.5,679.95,645.0,648.3,3909567.0,Trade setup for today: Top 15 things to know before the opening bell,"Based on the OI percentage, a short build-up was seen in 54 stocks on January 24, including Container Corporation of India, ONGC, Indus Towers, SBI Card, and Deepak Nitrite.",neutral,positive,-4.450994841562276,negative,-1.5644171779141174,negative
2023-01-31 15:41:39.000,638.0,638.6,599.85,608.95,3142876.0,Hold Container Corporation of India; target of Rs 700: ICICI Direct,"ICICI Direct recommended hold rating on Container Corporation of India with a target price of Rs 700 in its research report dated January 29, 2023.",neutral,positive,-4.55329153605015,negative,0.1559934318555083,neutral
2023-04-12 15:01:00.000,601.3,606.2,594.1,604.45,1071547.0,"Ahead of Q4 results, Infosys, RIL, HDFC were top additions by mutual funds","Key additions to the portfolio included Gujarat Fluorochemicals, GAIL (India) and State Bank of India. Their major reductions were HDFCBank, Navin Fluoro International and Container Corporation.",positive,neutral,0.5238649592549628,neutral,0.1326699834162445,neutral
2023-04-20 11:00:18.000,616.95,623.8,608.2,611.7,3449260.0,Container Corporation Shares Gain As Goldman Sachs Upgrades Rating To ‘Buy’,"The brokerage has also set the target price on the company at Rs 720, implying an upside of 20%",neutral,positive,-0.8509603695599319,neutral,-0.8317025440313147,neutral
2023-05-02 15:36:00.000,620.6,625.9,617.7,624.1,1500990.0,CPCL MD Arvind Kumar among 10 in race for IOC top job,"PESB will interview and recommend a candidate to replace incumbent chairman Shrikant Madhav Vaidya who superannuates on attaining 60 years of age on August 31 this year. Those shortlisted for the interview include five executive directors of IOC, Container Corporation of India Ltd (Concor) director …",neutral,neutral,0.5639703512729616,neutral,1.669475880889313,positive
2023-05-18 21:28:48.000,625.0,630.35,610.0,627.0,2507604.0,Container Corporation of India announces FY23 dividend of Rs 2 per share,"Concor’s Q4 profit after tax (PAT) came in at Rs 278.5 crore, with operations revenue of Rs 2,166 crore",positive,positive,0.32,neutral,2.301587301587302,positive
2023-05-22 05:45:00.000,630.0,646.1,622.25,644.5,905422.0,ConCor privatisation plan off track for now | The Financial Express,"Privatisation of Container Corporation (ConCor), hanging fire since 2019, is unlikely to materialise even in the current financial year, as land-related issues are yet to be sorted out by the railways.",positive,neutral,2.301587301587302,positive,1.9512571340428957,positive
2023-05-22 17:28:30.000,648.3,663.55,641.4,660.95,1253834.0,Buy Container Corporation; target of Rs 710: Motilal Oswal,"Motilal Oswal is bullish on Container Corporation recommended buy rating on the stock with a target price of Rs 710 in its research report dated May 19, 2023.",neutral,positive,1.9512571340428957,positive,0.7640517437022398,neutral
2023-05-23 10:56:05.000,648.3,663.55,641.4,660.95,1253834.0,Container Corporation Of India - Misses Estimates; Downside Likely To Be Limited: ICICI Securities,Container Corporation Of India - Misses Estimates; Downside Likely To Be Limited: ICICI Securities,neutral,neutral,1.9512571340428957,positive,0.7640517437022398,neutral
2023-06-20 17:30:00.000,638.0,654.2,637.45,653.45,1518409.0,Concor shares crack after downgrade from Kotak; could it be an opportunity to buy?,"The Rs 12,000 crore disinvestment plan of Container Corporation of India has remained jeopardized because of the concerns raised by the railway ministry, its parent organisation.",positive,negative,2.421630094043894,positive,-2.1177370030581075,negative
2023-07-09 15:50:23.000,674.95,674.95,659.0,671.0,582202.0,"Over 10 EoIs received, in talks with more interested bidders for Great Nicobar port : Sarbananda Sonowal","Port officials aware of the developments said some of the names who have placed EoIs include Adani Ports and SEZ, JSW Infra, RVNL (Rail Vikas Nigam Ltd), Container Corporation, among others",neutral,neutral,-0.5852285354470769,neutral,0.8485931219294226,neutral
2023-07-18 19:42:00.000,680.0,690.0,670.25,686.4,831674.0,NCLAT stays insolvency proceedings against Container Corporation of India,"The order was challenged by the Container Corporation of India Ltd (CONCOR) before the appellate tribunal, which passed an order on July 14 to stay the NCLT’s decision.",neutral,negative,0.941176470588232,positive,-0.7246376811594203,neutral
2023-07-20 21:47:29.000,684.35,685.45,671.6,675.1,1376258.0,Trade setup for Friday: Top 15 things to know before the opening bell,"A short build-up was seen in 57 stocks, including Container Corporation of India, Coforge, ABB India, Cummins India, and Shree Cements. An increase in OI along with a price fall indicates a build-up of short positions.",neutral,positive,-1.3516475487689048,negative,0.4056047197640118,neutral
