date,open,high,low,close,volume,title,description,title_sentiment,desc_sentiment,daily_change_pct,market_sentiment,next_day_change_pct,next_day_sentiment
2018-01-05 13:04:41.955,553.16,554.0,549.32,551.88,81504.0,BusinessLine twenty years ago today: Concor GDR likely with new share mix,The Government is now planning to substantially reduce the proportion of the primary stock of Container Corporation of India (Concor) shares proposed to be offered in the form of GDRs. The proposal envisages increasing,neutral,neutral,-0.2313977872586544,neutral,0.1890909090909024,neutral
2018-05-02 10:01:44.425,532.92,535.98,527.12,530.06,922513.0,Container Corporation recommends final dividend & sub-division of equity shares,"Container Corporation of India Ltd has informed BSE that the Board of Directors of the Company at its meeting held on April 30, 2018, inter alia, has declared a Final Dividend of Rs. 7.50 (75%) per equity share of face value of Rs. 10/ each, which is in addition to an interim dividend of Rs.9.60 (96%) per equity share of face value of Rs. 10/- each already paid. The dividend declared is subject to",neutral,neutral,-0.5366659160849685,neutral,1.9711302905815469,positive
2018-05-31 23:00:30.275,551.16,551.16,532.4,534.8,117319.0,"Rail container hauler Concor to enter coastal shipping, issues tender to hire 2 ships",Container Corporation of India Ltd (Concor) will venture into the coastal shipping business by hiring two ships for 10 years each.The state-run rail hauler of containers has sought bids from fleet own,neutral,positive,-2.968285071485597,negative,-2.0706319702602207,negative
2018-06-29 13:00:36.022,491.48,526.04,486.4,520.36,1680834.0,"Neutral  Container Corporation of India, target Rs  711:   Nomura, India",Neutral  Container Corporation of India Ltd.  at a price target of Rs  711.0    .,neutral,positive,5.876129242288597,positive,-1.6771811047853462,negative
2018-08-03 23:01:43.005,520.88,523.92,510.96,516.16,831065.0,Inland container yard work to begin soon at Kadakola,"Work on the proposed greenfield project for an inland container yard by Container Corporation of India Ltd. (Concor) at Kadakola, between Mysuru and Nanjangud, is expected to take off in due course. T",neutral,negative,-0.9061588081707932,negative,-1.540238737004236,negative
2018-08-22 10:01:20.475,511.76,516.48,509.16,516.0,472463.0,Concor to run trains with EXIM boxes to Kandla container terminal,"Container Corporation of India (Concor) will run regular or weekly trains between Kandla International Container Terminal (KICT) and its inland container depots (ICDs), according to a memorandum of un",neutral,neutral,0.8285133656401455,neutral,-0.8631415241057538,neutral
2018-09-03 23:00:33.400,518.0,520.36,498.76,502.24,1020747.0,Concor disrupts container logistics market with 45-day free storage period to importers/exporters,Market leader Container Corporation of India Ltd (Concor) is seeking to disrupt the container logistics market by offering 45-day free storage period to exporters and importers at its facilities handl,neutral,negative,-3.042471042471041,negative,1.7539682539682602,positive
2018-10-05 13:01:13.913,480.4,495.0,468.96,484.0,848123.0,Concor sweetens terms in fresh tender for coastal shipping,"Container Corporation of India Ltd (CONCOR) has eased the terms in a fresh tender to hire two container ships for 10 years to start coastal shipping operations, after two earlier attempts failed.The s",neutral,positive,0.7493755203996717,neutral,-1.2932454695222466,negative
2018-11-02 10:00:50.951,529.6,537.28,523.88,525.12,748946.0,Why hike in rail haulage charges is no major problem for Concor,Successful tariff hikes by Container Corporation of India Ltd (Concor) in the recent past mean the company is comfortably placed to absorb the hike in haulage charges,neutral,positive,-0.8459214501510609,neutral,-0.6594406124459975,neutral
2018-11-06 10:01:23.390,524.0,552.0,524.0,536.0,1683058.0,"D-Street Buzz: IT stocks gain led by TCS; Tata Motors jumps 3%, SBI drags","The top BSE midcap gainers included Container Corporation of India, Dewan Housing Finance and MRL while the top losers were Balkrishna Industries, Mphasis and Natco Pharma.",positive,neutral,2.2900763358778624,positive,-1.904059040590415,negative
2018-11-11 18:02:30.440,537.6,538.96,513.2,518.4,663452.0,"FinMin rejigs CPSE ETF, includes NTPC, 3 other PSUs; eyes Rs 80 bn via FPOs","The ministry has removed three of the existing companies GAIL, Engineers India Ltd (EIL) and Container Corporation of India in the ETF basket",neutral,neutral,-3.57142857142858,negative,3.4280420012353283,positive
2018-12-19 23:00:29.483,538.4,543.08,525.36,531.68,2079100.0,Concor board meets today for bonus issue,The board of directors of Container Corporation of India (Concor) will meet on Thursday to consider an issue of bonus shares to the shareholders of the company. The company had rewarded its shareholde,neutral,neutral,-1.248142644873705,negative,-2.238805970149253,negative
2019-01-16 23:01:04.918,557.6,564.0,548.2,553.84,939585.0,Concor coastal shipping service via Mangaluru,"Container Corporation of India (Concor) has launched the coastal shipping facility from Kandla Port to VOC Port in Tuticorin, via New Mangalore Port.YR Belagal, Traffic Manager of New Mangalore Port T",neutral,neutral,-0.6743185078909596,neutral,-1.9396551724137847,negative
2019-01-31 23:02:04.962,527.56,543.04,518.16,530.4,975829.0,Container Corporation to turn ex-bonus, Shares of Container Corporation of India (Concor) will turn ex-bonus on Monday. The PSU major is rewarding its shareholders with one bonus share for every four held in the company. Investors who wish,neutral,positive,0.5383273940404945,neutral,-6.0109289617486334,negative
2019-05-01 23:01:21.591,498.0,520.9,494.0,514.2,2009838.0,Domestic containers of Concor can carry heavier loads now,Container Corporation of India (Concor) is replacing containers in the domestic segment with those that can carry almost ten per cent heavier load than its existing lot of containers. The move comes i,neutral,neutral,3.25301204819278,positive,-1.913178595707492,negative
2019-05-09 18:01:44.962,473.5,480.5,471.85,475.55,665245.0,"CONCOR to invest up to Rs 8,000 cr for developing dry ports, distribution logistic centres","State-owned Container Corporation of India (CONCOR) on Thursday said it will pump in up to Rs 8,000 crore in the next five years to develop dry ports and distribution logistics centres across the coun",neutral,positive,0.4329461457233392,neutral,-1.333753413148503,negative
2019-06-14 23:00:06.805,533.2,540.8,532.4,536.5,295478.0,Concor may soon lose monopoly on India-Nepal cargo movement,Container Corporation of India (Concor) may lose its right of being the only player to move container trains between India and Nepal. Nepal is optimistic that traders moving goods via container train,neutral,negative,0.6189047261815368,neutral,-1.3825315273236762,negative
2019-06-17 23:01:23.065,529.1,534.9,525.25,528.9,327780.0,Oriental Veneer's arm bags ₹90-order from Container Corporation of India,"Oriental Veneer Products’ wholly-owned subsidiary company, Oriental Foundry Private Limited, has secured orders worth ₹90.051 crore from Container Corporation of India for manufacturing and supplying",neutral,positive,-0.0378000378000463,neutral,0.5293005671077419,neutral
2019-07-10 10:01:10.719,551.0,559.75,550.7,556.0,596315.0,"Stocks in the news: TCS, InterGlobe, NLC India, BHEL, Manpasand Beverages, Autoline",NLC India | BHEL | Container Corporation | Manpasand Beverages | Autoline Industries and TCS are stocks which are in the news today.,neutral,neutral,0.9074410163339384,positive,-0.2150537634408683,neutral
2019-07-15 18:00:16.279,549.95,553.95,546.35,551.3,567943.0,State-owned BHEL on Monday said it has inked an agreement with Container Corporation of India (CONCOR) to set up a rail-based logistics terminal at Haridwar,State-owned BHEL on Monday said it has inked an agreement with Container Corporation of India (CONCOR) to set up a rail-based logistics terminal at Haridwar,positive,positive,0.2454768615328501,neutral,-0.3345388788426804,neutral
2019-07-15 18:02:05.510,549.95,553.95,546.35,551.3,567943.0,"BHEL, CONCOR to set up rail-based logistics facility at Haridwar","New Delhi [India], July 15 (ANI): Bharat Heavy Electricals Ltd (BHEL) said on Monday it has signed an agreement with Container Corporation of India Ltd (CONCAR) to form a joint working group for setting up a rail-based logistics terminal at Haridwar.",neutral,positive,0.2454768615328501,neutral,-0.3345388788426804,neutral
2019-07-28 10:00:11.943,514.2,519.55,510.0,515.0,583529.0,Container corporation plans coastal service to Bangladesh,To help evacuate export cargo from the region through Krishnapatnam Port,neutral,neutral,0.1555814858031805,neutral,-0.6969990319457934,neutral
2019-09-13 23:00:10.737,521.0,543.45,511.0,533.7,1391423.0,Concor to run services from Chennai Port to Tondiarpet ICD,"Container Corporation of India (Concor) will begin train services from the Chennai Port to its inland container depot (ICD) located at Tondiarpet from September 16, the state-run rail hauler of contai",neutral,neutral,2.4376199616122927,positive,0.7642230399094168,neutral
2019-09-30 10:01:19.433,595.9,611.7,591.0,605.0,2902369.0,Railway land lease terms and monopoly concern could derail CONCOR sale,"An attempt to privatise Container Corporation of India Ltd (Concor) could falter over creation of a private monopoly, competition concerns and the terms set for the land leased by Indian Railways to t",negative,negative,1.5271018627286497,positive,1.2598425196850394,positive
2019-10-03 23:00:18.376,633.0,638.8,611.25,614.0,2227791.0,Centre plans strategic stake sales in multiple PSUs in a bid to meet disinvestment target: Report,"Aside from already considering the sale of India's second-largest state refiner, Bharat Petroleum Corp. Ltd (BPCL), a group of secretaries have also consented to the strategic stake sale in BEML, Container Corporation of India (CONCOR) and Shipping Corporation of India (SCI).",neutral,neutral,-3.001579778830964,negative,-4.317803660565732,negative
2019-10-15 18:00:10.732,598.0,608.0,590.35,607.0,1709734.0,Container Corporation share price closed 2.61% or 15 points higher at Rs 594.60 compared to the previous close of Rs 579.50 on BSE. The stock has gained 5.64% in last two days.,Container Corporation share price closed 2.61% or 15 points higher at Rs 594.60 compared to the previous close of Rs 579.50 on BSE. The stock has gained 5.64% in last two days.,positive,positive,1.5050167224080269,positive,-1.5802469135802508,negative
2019-10-24 10:00:42.312,609.0,613.8,582.85,585.0,2694303.0,ARSS Infrastructure Projects Ltd announces work order of Rs 76.16 crore,ARSS Infrastructure Projects Ltd has announced that a work order of about ₹76.16 crore has been received from the Container Corporation of India. The order is for the construction of handling platform,positive,neutral,-3.940886699507389,negative,-0.6851053032225247,neutral
2019-10-30 23:02:06.132,586.0,608.6,582.0,588.05,3396591.0,Container Corporation Q2 consolidated net loss at Rs 333 crore,"Total income during the July-September quarter of the current fiscal dipped marginally to Rs 1,800.45 crore from Rs 1,897.92 crore in the year-ago period.

",negative,negative,0.3498293515358284,neutral,-1.0162254483347644,negative
2019-10-31 10:04:09.232,586.0,608.6,582.0,588.05,3396591.0,Container Corporation posts consolidated net loss of Rs 332.71 cr in Q2,"Total income during the July-September quarter of the current fiscal dipped marginally to Rs 1,800.45 crore",negative,negative,0.3498293515358284,neutral,-1.0162254483347644,negative
2019-11-01 13:00:56.461,585.5,595.0,571.4,579.55,2024586.0,Concor may have to sell its port terminal stakes ahead of privatisation,Container Corporation of India (Concor) will have to sell its stakes in two key port terminals ahead of a planned privatisation of the state-owned rail hauler by the government to avoid complications,neutral,neutral,-1.0162254483347644,negative,-0.0603552336609799,neutral
2019-11-05 13:00:38.600,577.5,585.0,573.0,580.0,1184097.0,Concor to cut dependence on Railways’ land-based terminals by 15 per cent over five years,State-owned Container Corporation of India (Concor) is looking to reduce its dependence on terminals built on land owned by the Indian Railways for handling cargo containers by as much as 15 per cent,neutral,positive,0.4329004329004329,neutral,-0.3448275862068966,neutral
2019-11-21 13:01:40.755,575.15,575.8,554.25,559.8,1567800.0,"BPCL scales fresh 52-week high as Cabinet okays divestment, retreats later","Apart from BPCL, the Cabinet also approved divestment of its stake from Shipping Corp, THDC India, and NEEPCO, and most of its stake in Container Corporation of India (CONCOR).",neutral,positive,-2.668868990698083,negative,0.0179533213644565,neutral
2019-11-21 18:01:06.796,575.15,575.8,554.25,559.8,1567800.0,"IOC, other PSUs not to bid for BPCL, hints Oil Minister Dharmendra Pradhan",The Cabinet on Wednesday decided to sell the government's entire stake in the country's second-largest state refiner BPCL and India's largest shipping company Shipping Corporation of India (SCI). It also approved privatisation of Container Corporation of India while also giving nod to paring stake below 51% in select PSUs but without losing control.,neutral,neutral,-2.668868990698083,negative,0.0179533213644565,neutral
2019-11-26 10:00:32.450,559.9,564.6,555.0,556.0,2039301.0,Will India’s bid to tame high logistics costs collapse at the altar of Concor privatisation?,"A potential legal challenge to the planned privatisation of intermodal operator Container Corporation of India (Concor) is swirling in the air, particularly on the preferential access given to the sta",negative,negative,-0.6965529558849755,neutral,-1.193895870736082,negative
2019-11-26 23:01:36.577,557.0,560.5,550.3,550.35,1349255.0,"Concor workers urge Centre to reconsider strategic sale, protests on Thursday","Our Bureau The Concor Employees Union, representing the workers in Container Corporation, has decided to hold nationwide protests against the CCEA approval for strategic disinvestment in Concor along",neutral,negative,-1.193895870736082,negative,0.0,neutral
2019-12-06 18:00:57.087,568.75,575.05,556.8,560.85,2559942.0,Deloitte's Re 1 advisory fee for BPCL disinvestment irks peers,Deloitte had quoted a similar price for its services in the divestment process of Container Corporation of India. ,neutral,neutral,-1.389010989010985,negative,-0.6761565836298851,neutral
2019-12-11 13:01:17.117,558.0,564.75,558.0,560.4,729135.0,Concor not to pay second tranche of advance freight to Indian Railways,"Privatisation-bound state-run-rail hauler Container Corporation of India (Concor) has decided not to pay a second tranche of advance freight of as much as ₹1,500 crore to Indian Railways.The decision",neutral,neutral,0.4301075268817163,neutral,2.588967971530241,positive
2019-12-24 13:01:57.320,581.85,586.95,570.3,573.0,735064.0,Container Corporation share price rises as Nomura remains bullish,"""CONCOR is the top pick and we maintain buy call with a target of Rs 670 per share,"" Nomura said.",positive,positive,-1.5210105697344716,negative,-1.252173913043486,negative
2020-01-02 13:00:58.204,574.05,575.65,566.65,569.4,1085758.0,"Air India, BPCL, Concor divestments unlikely this fiscal: Official","Strategic divestments in Air India, Bharat Petroleum Corporation (BPCL) and Container Corporation of India (Concor) are unlikely this fiscal, a senior official said on Thursday.The Finance Ministry’s",neutral,neutral,-0.810033969166445,neutral,-1.0334776079851444,negative
2020-01-02 18:01:16.735,574.05,575.65,566.65,569.4,1085758.0,"Air India, BPCL, Concor divestments “unlikely” this fiscal: Govt official","Work on Air India, BPCL and Container Corporation divestments is on and the process is facing delays due to ""surprises"" encountered once the wheels have begun moving, the official from the Department of Investment and Public Asset Management (Dipam) said. The ministry has budgeted to garner Rs 1.05 lakh crore from divestments during the fiscal.",neutral,negative,-0.810033969166445,neutral,-1.0334776079851444,negative
2020-01-02 18:03:00.739,574.05,575.65,566.65,569.4,1085758.0,"Similarly, on Container Corporation (Concor) and Air India as well, the official said that the sales will not go through in the current fiscal ending 31 March.","Similarly, on Container Corporation (Concor) and Air India as well, the official said that the sales will not go through in the current fiscal ending 31 March.",neutral,neutral,-0.810033969166445,neutral,-1.0334776079851444,negative
2020-01-08 10:03:12.295,552.0,556.6,543.85,552.85,937572.0,"Roadshows for BPCL, Container Corporation veer off the beaten track",Govt sounds out select few firms over stake sales; might push process to next financial year,neutral,neutral,0.1539855072463809,neutral,0.931899641577069,positive
2020-01-14 10:03:21.220,561.8,570.8,561.75,566.65,581146.0,IOC to take call on bidding for govt's stake in BPCL: Chairman Sanjiv Singh,"In November, CCEA approved the sale of government stake in five PSUs: BPCL, Shipping Corporation of India, Container Corporation of India",neutral,positive,0.8632965468138168,neutral,-1.6769638128861428,negative
2020-01-17 23:00:36.303,557.9,560.55,552.35,554.0,472580.0,"Successful disinvestment of BPCL, CONCOR to lay foundation for much bigger stake sell programme: Garg","Successful disinvestment of Bharat Petroleum, Container Corporation of India and Shipping Corporation will lay the foundation of a much ambitious programme for stake sale in the central public sector undertakings, Former Finance Secretary Subhash Chandra Garg said on Friday.",positive,positive,-0.6990500089621755,neutral,-0.7220216606498195,neutral
2020-02-07 23:03:25.756,583.0,588.35,573.0,577.0,781744.0,Container Corporation Q3 consolidated net profit falls 35% to Rs 179 crore,"Total expenses during the quarter were at Rs 1,311.22 crore as compared to Rs 1,366.24 crore in October-December quarter of the preceding financial year.

",negative,positive,-1.0291595197255576,negative,1.079799841980527,positive
2020-04-06 13:01:35.581,315.0,334.95,312.4,328.0,1479630.0,Concor waives charges at Tughlakabad ICD till April 14,"Container Corporation of India has waived off the ground rent on cargo (warehouse charges), auction charges and HNP charge at its inland container depot located at Tughlakabad near Delhi from March 22",neutral,positive,4.126984126984127,positive,0.8339651250947688,neutral
2020-04-07 23:03:11.529,329.75,353.95,328.1,332.5,1536207.0,Covid-19 throws a wrench into India's disinvestment plans,Strategic divestment in Shipping Corporation of India and Container Corporation of India has been put on hold in the wake of the global outbreak of Covid-19 even as the government evaluates plans to reduce its stake in state-owned entities to 51%.,neutral,positive,0.8339651250947688,neutral,10.416666666666668,positive
2020-04-17 10:18:00.000,388.15,394.9,370.15,376.6,2007735.0,Trending stocks: Container Corporation of India stock price up 1%,Shares of Container Corporation of India Ltd. traded 0.71 per cent up in trade at 10:13AM on Friday .,positive,positive,-2.9756537421099973,negative,-2.368421052631579,negative
2020-05-05 10:42:00.000,352.5,367.85,333.3,335.8,1823753.0,Trending stocks: Container Corporation of India share price rises nearly 2%,Shares of Container Corporation of India Ltd. traded 1.78 per cent up in trade at 10:39AM on Tuesday .,positive,positive,-4.737588652482266,negative,3.775811209439532,positive
2020-05-06 19:44:00.000,351.45,366.85,345.25,356.0,1208455.0,Volume worries to keep Container Corporation stock under pressure,Purchase of land from railways and delay in divestment add to uncertainty,negative,negative,1.2946365059041147,positive,0.2514317642128884,neutral
2020-05-07 12:22:59.000,357.95,366.55,356.35,358.85,786820.0,"As Adani Ports cuts capex by half for FY21, CONCOR privatisation looks unlikely this year","Adani Ports and Special Economic Zone Ltd (APSEZ) has cut its capex for FY21 by half to Rs 2,000 crore in an indication that the planned privatisation of Container Corporation of India Ltd (CONCOR) wi",negative,negative,0.2514317642128884,neutral,1.935933147632309,positive
2020-05-14 10:15:00.000,382.7,394.9,374.35,377.4,2552768.0,Share price of Container Corporation of India Ltd. rises as Nifty drops,Shares of Container Corporation of India Ltd. gained 1.91 per cent to Rs 387.65 in Thursday’s trade as of 10:15AM (IST). The stock of Container Corporation of India Ltd. hit a high price of Rs 394.9 and low of Rs 382.0 during the session. The return on equity (ROE) for the stock stood at 11.…,neutral,positive,-1.3848967859942545,negative,-0.6729119936667136,neutral
2020-05-15 06:11:00.000,378.95,385.85,371.2,376.4,1983009.0,Broker’s call: Container Corporation (Buy),ICICI Direct ResearchContainer Corporation (Buy)CMP: ₹377.95Target: ₹433Fundamental outlook: a) Container Corporation of India (Concor) reported a market share of 67-68 per cent in the container train,neutral,neutral,-0.6729119936667136,neutral,-8.611184037805186,negative
2020-06-04 13:20:49.000,393.5,409.9,392.65,403.4,3314126.0,Buy Container Corporation Of India; Target Of Rs 460: ICICI Securities,"ICICI Securities is bullish on Container Corporation of India has recommended buy rating on the stock with a target price of Rs 460 in its research report dated June 03, 2020.",neutral,positive,2.515883100381189,positive,0.7701711491442488,neutral
2020-06-18 13:47:00.000,402.0,411.95,399.35,409.45,2253626.0,"PSU stocks in focus; ITI surges 20%, BHEL gains 15%, Coal India up 8%","MSTC, MMTC, Hindustan Copper, Bharat Electronics, Ircon International, NLC India, Engineers India, BEML, STC India, NBCC, Mishra Dhatu Nigam and Container Corporation were up 4% to 8% on the BSE",positive,positive,1.853233830845768,positive,1.707317073170732,positive
2020-06-25 08:52:35.000,416.95,429.75,410.55,426.2,2306582.0,"Stocks in focus: Yes Bank, HDFC Bank, Ashok Leyland, IDBI Bank, GIC Re stocks to remain in news","Apollo Hospitals Enterprises, Ashok Leyland, Bank of India, Container Corporation of India, Endurance Technologies, Engineers India, Hindustan Aeronautics, Indiabulls Ventures and Zuari Global, are among 147 companies that are scheduled to announce their March quarter earnings today.",neutral,neutral,2.218491425830436,positive,1.3986013986013983,positive
2020-06-25 22:02:00.000,429.0,439.0,423.0,435.0,2228366.0,Container Corporation Q4 results: Net profit falls 11% to Rs 318 crore,"Total income during the January-March period of 2019-20 dipped to Rs 1,659.28 crore, from Rs 1,977.68 crore in the year-ago period.",negative,negative,1.3986013986013983,positive,-3.815214893128021,negative
2020-06-25 22:40:05.000,429.0,439.0,423.0,435.0,2228366.0,Container Corporation Of India Q4 Net Profit Falls 11% To Rs 318 Crore,"The company had clocked a net profit of Rs 355.91 crore during the corresponding quarter a year ago, the multi-modal logistics company said in a regulatory filing to the BSE.",neutral,positive,1.3986013986013983,positive,-3.815214893128021,negative
2020-06-29 06:43:45.000,435.1,435.1,410.35,418.5,3283320.0,Buy Container Corporation Of India; Target Of Rs 520: ICICI Direct,"ICICI Direct is bullish on Container Corporation of India recommended buy rating on the stock with a target price of Rs 520 in its research report dated June 27, 2020.",neutral,positive,-3.815214893128021,negative,-0.9243896657975772,negative
2020-06-29 06:58:10.000,435.1,435.1,410.35,418.5,3283320.0,Buy Container Corporation; Target Of Rs 510: Motilal Oswal,"Motilal Oswal is bullish on Container Corporation recommended buy rating on the stock with a target price of Rs 510 in its research report dated June 27, 2020.",neutral,positive,-3.815214893128021,negative,-0.9243896657975772,negative
2020-06-29 15:51:47.000,421.9,425.0,416.0,418.0,2303478.0,Concor privatisation hits wrong track with land licence fee revision,The Railway Ministry has introduced a new method of calculating the land licence fee it levies on Container Corporation of India Ltd (Concor) for facilities built on Indian Railways land in a developm,negative,neutral,-0.9243896657975772,negative,-1.8099547511312133,negative
2020-07-03 14:55:25.000,424.35,431.9,423.1,430.3,922429.0,"Low rates to boost appeal for dividend-yielding stocks, physical assets","The brokerages’ top equity picks include Tata Consultancy Services, Infosys, ITC, NTPC, Bharat Electronics, Container Corporation of India, and Mahanagar Gas.",positive,neutral,1.402144456227168,positive,-0.081131200741763,neutral
2020-07-09 18:31:21.000,427.5,433.9,423.8,430.5,1881061.0,Concor defers rate hike to October,"State-run rail hauler Container Corporation of India Ltd (Concor) has deferred a planned rate hike to October, citing weak market conditions triggered by the pandemic.The rate hike, in the range of ₹5",neutral,neutral,0.7017543859649122,neutral,-2.735632183908041,negative
2020-07-10 09:32:00.000,427.5,433.9,423.8,430.5,1881061.0,CONCOR says Q1 volumes decline 21%,"Container Corporation of India (CONCOR) said that the companys total throughput volumes declined 20.95% to 7,32,711 twenty foot equivalent units (TEUs) (provisional) in Q1 FY21 from 9,26,923 TEUs in Q1 FY20.",negative,negative,0.7017543859649122,neutral,-2.735632183908041,negative
2020-07-10 12:10:31.000,427.5,433.9,423.8,430.5,1881061.0,"In a first, Concor starts coal movement for Karnataka power utility","State-run rail hauler Container Corporation of India Ltd (Concor) has started moving coal for Karnataka Power Corporation Ltd (KPCL) on a two-year contract, as it looks at diversification into newer r",neutral,positive,0.7017543859649122,neutral,-2.735632183908041,negative
