date,open,high,low,close,volume,title,description,title_sentiment,desc_sentiment,daily_change_pct,market_sentiment,next_day_change_pct,next_day_sentiment
2017-12-28 18:01:54.038,162.04,163.82,160.5,163.54,546371.0,Top buzzing midcap stocks to trade on December 28,"Here are a few top buzzing midcap stocks picked by CNBC-TV18's analysts in trade today -- Kolte Patil, Star Cement, Hindalco, Vedanta, Hindustan Copper, ADF Foods, and City Union Bank.",neutral,neutral,0.92569735867687,positive,-1.383387165579871,negative
2018-02-07 18:00:37.006,145.27,149.0,141.82,147.27,1204670.0,City Union Bank Q3 profit up 22.2% to Rs154.79 crore,City Union Bank’s CEO N. Kamakodi says the robust growth in advances over the last three quarters and growing interest income enabled its net profit to grow by 22%,positive,positive,1.376746747435809,positive,0.6217545777534822,neutral
2018-02-08 18:02:30.158,146.36,148.14,144.54,147.27,1027067.0,City Union Bank Q3 net rises 22% to ₹154 cr,"The Kumbakonam-headquartered CUB has reported 22 per cent growth in its net profit at ₹154 crore for the quarter ended December 31, 2017 as against ₹127 crore in the year-ago period.N Kamakodi, Managi",positive,positive,0.6217545777534822,neutral,3.689162661612413,positive
2018-02-16 13:01:19.781,157.09,158.18,153.46,157.36,671598.0,Lavender Investments sells 60 lakh shares of City Union Bank,"Lavender Investments sold 60,00,000 shares of City Union Bank",neutral,neutral,0.1718759946527533,neutral,5.326941004128379,positive
2018-02-18 13:01:15.019,150.18,160.86,149.09,158.18,2151629.0,City Union Bank says hit by fraudulent remittances via SWIFT system,City Union said the transfers had been made through correspondent banks even though the Indian lender had not requested the transfers.,neutral,neutral,5.326941004128379,positive,1.2019382040148492,positive
2018-02-18 18:01:21.763,150.18,160.86,149.09,158.18,2151629.0,City Union Bank CEO says suffered cyber hack via SWIFT system,"Chief Executive Officer N. Kamakodi called it a ""conspiracy"" involving multiple countries, and added the lender was still investigating how it had happened.",neutral,neutral,5.326941004128379,positive,1.2019382040148492,positive
2018-02-19 13:01:41.782,158.91,161.14,152.91,160.82,768539.0,City Union Bank CEO says suffered cyber hack via Swift system,"Nearly $2 million were transferred illegally to accounts in Dubai, Turkey and China via the Swift financial platform in a cyber attack, says City Union Bank",negative,negative,1.2019382040148492,positive,-2.243750000000002,negative
2018-02-20 13:01:12.989,160.0,160.0,155.86,156.41,317426.0,“Cyber attack similar to Bangladesh central bank hack”,"Private sector lender City Union Bank, which was able to resolve two of the three cyber hack recently, likened it to the attempts on the Bangladesh central bank’s system in 2016. “We had three fraudul",neutral,neutral,-2.243750000000002,negative,-1.3869449039318025,negative
2018-02-20 18:01:45.487,160.0,160.0,155.86,156.41,317426.0,“Cyber attack similar to Bangladesh central bank hack”,"Private sector lender City Union Bank, which was able to resolve two of the three cyber hack recently, likened it to the attempts on the Bangladesh central bank’s system in 2016. “We had three fraudul",neutral,neutral,-2.243750000000002,negative,-1.3869449039318025,negative
2018-04-11 13:00:27.553,163.54,163.73,162.32,163.54,224839.0,"Top intraday trading ideas for afternoon trade for Wednesday, 11 April 2018",City Union Bank is a 'Buy' call with a target price of Rs 190 and a stop loss of Rs 175.,neutral,neutral,0.0,neutral,0.0,neutral
2018-05-23 23:00:18.337,168.04,173.23,160.0,166.82,2873918.0,"GAIL, MOIL, CUB, Amrutanjan results"," 20 Microns, Amrutanjan, Camlin Fine Sciences, Cochin Shipyard, City Union Bank, Cummins, Digjam, Elgi Rubber, GACL, GAIL India, GIPCL, Gokaldas, Granules, Honda Siel, Heldelberg, IVP, Jindal Drilling",neutral,neutral,-0.7260176148536057,neutral,-1.851632749645052,negative
2018-05-24 13:02:52.296,169.04,169.04,164.54,165.91,755448.0,City Union Bank Q4 profit rises 18% to Rs152.12 crore,"City Union Bank reports an 18.04% rise in net profit at Rs152.12 crore for the quarter ended 31 March, compared to a net profit of Rs128.87 crore in the year-ago period",positive,positive,-1.851632749645052,negative,-0.8385868918758157,neutral
2018-05-25 10:02:56.452,169.04,169.04,164.54,165.91,755448.0,City Union Bank Q4 profit up 18% at ₹152.12 crore," Kumbakonam-based City Union Bank reported an 18 per cent increase in net profit to ₹152 crore for the fourth quarter ended March 31, 2018, against ₹129 crore in the corresponding quarter last year.Ne",positive,positive,-1.851632749645052,negative,-0.8385868918758157,neutral
2018-06-01 10:00:39.178,178.18,178.18,173.18,173.32,507034.0,City Union Bank posts 18% rise in net profit for Q4 at Rs 1.52 billion,Net Interest Income increased by 18 per cent to Rs 3.68 billion from Rs 3.11 billion,positive,positive,-2.7275788528454448,negative,-0.5759041695461876,neutral
2018-06-26 13:02:37.337,167.27,169.41,165.5,166.23,173926.0,Top 5 stocks in the mid & smallcap space could be hidden gems for value investors,Nitin Bhasin of Ambit Capital recommends banks with superior earnings growth such as IndusInd Bank and City Union Bank,neutral,positive,-0.6217492676511152,neutral,-0.0836020542219125,neutral
2018-07-18 23:00:43.866,174.7,174.7,167.5,169.05,855704.0,After Market: 24 stocks in oversold zone; Bandhan Bank has dream run,Shares of City Union Bank ended 1 per cent lower after 14.1 lakh shares traded in a block deal.,neutral,negative,-3.234115626788768,negative,-0.8792497069167644,neutral
2018-08-07 23:00:14.751,174.6,193.0,172.05,176.9,2308336.0,"Cipla, Indian Bank, HCC, Lupin, 8K Miles results","Over 175 companies including 8K Miles, 20 Microns, AB Capital, Asahi Songwon, Balrampur Chini, BEML, BPCL, Blue Star, Cipla, City Union Bank, EID Parry, Emami Infra, Forbes, Future Consumer, Goodyear,",neutral,neutral,1.317296678121427,positive,-0.2522421524663772,neutral
2018-08-08 13:01:53.395,178.4,181.4,176.2,177.95,229369.0,City Union Bank Q1 profit rises 15% to Rs 162 cr on lower provisions; NPAs steady,City Union Bank's provisions for bad loans dropped 33.4 percent year-on-year to Rs 77.7 crore in Q1FY19 and also declined 9.85 percent on sequential basis.,positive,negative,-0.2522421524663772,neutral,-0.9497206703910552,negative
2018-08-08 23:02:47.827,178.4,181.4,176.2,177.95,229369.0,City Union Bank net rises on stable assets,NPA provisions decline to ₹77.76 crore,positive,positive,-0.2522421524663772,neutral,-0.9497206703910552,negative
2018-08-09 18:02:10.900,179.0,180.25,175.5,177.3,174471.0,City Union Bank Q1 profit grows up by 15%,"Total income for the quarter ending June 30, 2018 grew to Rs 1,018.61 crore from Rs 960.86 crore registered during year ago period.",positive,positive,-0.9497206703910552,negative,-0.1992031872509928,neutral
2018-11-02 18:00:46.822,169.45,171.6,167.1,169.2,2518131.0,"City Union Bank profit at Rs 1.68 bn in Q2, gross NPA down marginally",NPA provisioning for the quarter has declined 47% year-on-year to Rs 680 million,negative,negative,-0.1475361463558571,neutral,-2.7656477438136826,negative
2018-11-02 23:00:15.267,169.45,171.6,167.1,169.2,2518131.0,City Union Q2 profit up 16%,"Private sector lender City Union Bank (CUB) has registered a 16 per cent increase in net profit at &#8377;168 crore for the quarter ended September 30, 2018, against &#8377;145 crore in the year-ago p",positive,positive,-0.1475361463558571,neutral,-2.7656477438136826,negative
2018-11-07 23:01:24.952,165.0,167.0,164.5,166.8,54794.0,Lending to SMEs can’t be learnt overnight: City Union Bank MD,"Years of focussed effort needed to make inroads, says N. Kamakodi",neutral,neutral,1.0909090909090975,positive,-1.6417910447761193,negative
2018-11-15 18:01:53.423,164.0,164.75,163.1,163.7,299115.0,Hold City Union Bank; target of Rs 160: Centrum,"Centrum recommended Hold rating on City Union Bank with a target price of Rs 160 in its research report dated November 02, 2018.",neutral,positive,-0.1829268292682996,neutral,0.0,neutral
2018-11-22 23:00:08.085,167.9,170.0,165.6,166.5,397658.0,HCL Technologies and Bajaj Finance to replace Wipro and Adani Ports in Sensex,"On the BSE Bankex, Punjab National Bank will be dropped for City Union Bank.",neutral,neutral,-0.833829660512213,neutral,4.222821203953286,positive
2018-11-26 13:00:23.683,173.0,177.5,172.0,177.0,403146.0,"HCL Tech falls 1%, Bajaj Finance climbs 1% on news of Sensex foray","On the BSE Bankex, Punjab National Bank will be dropped for City Union Bank. 
",positive,neutral,2.312138728323699,positive,0.3409090909090876,neutral
2018-12-23 18:02:29.311,194.0,195.65,185.1,189.0,515231.0,Chart Focus: City Union Bank (₹193.3): Buy,"Last week, the stock of City Union Bank surged 8.3 per cent, accompanied bywith extra-ordinary volume, breaking above a key resistance at ₹180. Friday’s 4 per cent rally adds strength to the stock. Si",neutral,positive,-2.5773195876288657,negative,-1.06951871657754,negative
2018-12-26 10:02:46.664,187.0,187.4,182.6,185.0,618893.0,The dark horse: City Union Bank an outlier among regional peers,Has emerged as one of the best banking stocks in 2018,neutral,positive,-1.06951871657754,negative,0.0,neutral
2019-01-14 13:00:29.948,190.0,190.05,188.35,189.0,318004.0,City Union Bank Q3 Net Profit seen up 17.6% YoY to Rs. 181.9 cr: Kotak,"Net Interest Income (NII) is expected to increase by 10.6 percent Y-o-Y (up 1.4 percent Q-o-Q) to Rs. 403.5 crore, according to Kotak.",positive,positive,-0.5263157894736842,neutral,-1.691779011366649,negative
2019-01-28 23:00:14.716,190.0,192.95,185.6,192.55,1298650.0,City Union Bank Q3 profit rises 15%,"CUB’s total income also improved by 10.07 per cent to ₹1,086.45 crore during the quarter, against the previous year’s income of ₹987.05 crore",positive,positive,1.342105263157901,positive,0.5181347150259068,neutral
2019-01-29 23:00:06.656,193.0,194.4,190.0,194.0,945635.0,Broker's call: City Union Bank (Accumulate),NarnoliaCity Union Bank (Accumulate)CMP: ₹192.25Target: ₹214Assets quality has remained stable despite the concern over MSME due to GST transitions reflecting healthy credit underwriting practice. Man,neutral,positive,0.5181347150259068,neutral,-1.8814432989690757,negative
2019-02-12 10:00:14.861,186.1,188.0,186.1,186.3,193889.0,How a small Tamil Nadu bank beat India's largest banks in the stock market,"City Union Bank Ltd., a small lender based in Kumbakonam, has risen more than 27% over the last twelve months, the best performance of any Indian lender in the Bankex index after Axis Bank Ltd",positive,positive,0.1074691026330021,neutral,-1.419009370816603,negative
2019-03-01 18:02:04.028,182.7,188.5,181.05,187.6,360329.0,Hold City Union Bank; target of Rs 205: Arihant Capital,"Arihant Capital recommended hold rating on City Union Bank with a target price of Rs 205 in its research report dated January 29, 2019.",neutral,positive,2.681992337164754,positive,-1.1702127659574406,negative
2019-03-08 23:00:34.879,187.0,189.65,184.5,187.0,860789.0,RBI slaps penalties on 36 major banks for non-compliance in SWIFT operations,"The banks include, Bank of Baroda, City Union Bank, HSBC, ICICI Bank, SBI and YES Bank.﻿The RBI had carried out an assessment of compliance with its directions on implementation and strengthening of SWIFT-related operational controls of 50 major banks",neutral,neutral,0.0,neutral,-0.5029115934356893,neutral
2019-04-08 13:00:34.647,199.9,202.5,198.0,201.4,234340.0,City Union Bank Q4 Net Profit seen up 18% YoY to Rs. 179.5 cr: Kotak,"Net Interest Income (NII) is expected to increase by 16.6 percent Y-o-Y (up 2.6 percent Q-o-Q) to Rs. 429 crore, according to Kotak.",positive,positive,0.750375187593797,neutral,-0.249500998003992,neutral
2019-04-12 23:03:19.410,197.5,199.6,197.4,197.8,252063.0,Mohan named CUB part-time chairman,The board of City Union Bank Ltd. on Friday recommended its independent director R. Mohan to be the next part-time chairman with effect from May 4. The board also forwarded an application to this effe,neutral,neutral,0.1518987341772209,neutral,-0.6540880503144711,neutral
2019-05-17 10:01:07.536,196.3,200.8,196.3,198.5,958878.0,"Bajaj Auto, IOC, Sobha results eyed"," About 50 firms including Allsec Tech, Ajmera Realty, Arvind, Bajaj Auto, Bajaj Holdings, Balkrishna Ind, Birla Corp, Burnpur Cement, CESC, Corporation Bank, City Union Bank, Dr Lal Path, Engineers In",neutral,neutral,1.120733571064691,positive,1.616915422885572,positive
2019-05-17 13:02:00.885,196.3,200.8,196.3,198.5,958878.0,City Union Bank March-quarter profit rises,City Union Bank’s net profit for the March-quarter has been estimated at Rs 175 crore. This over Rs 23 crore more than that of a year ago.The interest earned for the period amounted to Rs 985 crore co,positive,positive,1.120733571064691,positive,1.616915422885572,positive
2019-05-31 23:00:20.557,212.9,215.0,211.1,211.5,753966.0,Broker's call: City Union Bank (Outperformer),"Chola SecuritiesCity Union Bank (Outperformer)CMP: ₹212.3Target: ₹228During 4QFY19, City Union Bank’s advances grew by 17.1 per cent y-o-y (beating CSEC estimate of 11.5 per cent) to ₹33,065 crore, dr",neutral,positive,-0.6575857209957754,neutral,0.9907997169143774,positive
2019-06-20 18:02:52.198,212.65,214.05,208.6,210.5,563411.0,Hold City Union Bank; target of Rs 223: Arihant Capital,"Arihant Capital recommended hold rating on City Union Bank with a target price of Rs 223 in its research report dated May 20, 2019.

",neutral,positive,-1.0110510228074323,negative,-0.3291794027745201,neutral
2019-06-25 18:00:23.484,214.75,217.0,212.1,216.0,675900.0,City Union Bank growing 3-4% above industry rate: N Kamakodi,"
Our slippages currently are about 1.9% of closing advances, says the MD & CEO.",positive,negative,0.5820721769499418,neutral,0.0,neutral
2019-07-11 18:00:35.654,204.45,205.0,201.5,204.0,128119.0,City Union Bank Q1 Net Profit seen up 13% YoY to Rs. 182.9 cr: Kotak,"Net Interest Income (NII) is expected to increase by 13 percent Y-o-Y to Rs. 422.3 crore, according to Kotak.",positive,positive,-0.2201027146001412,neutral,0.5640019617459566,neutral
2019-08-08 10:01:15.326,197.1,198.95,190.3,193.3,1643750.0,"NBCC, Coffee Day, Religare results eyed","Over 100 firms will declare their June quarter results on Thursday. Among these are Adani Enterprises, Capacite Infraprojects, City Union Bank, Coffee Day, Dredging Corp, Emami, GNFC, Godrej Propertie",neutral,neutral,-1.9279553526128783,negative,-0.4043467273186671,neutral
2019-08-08 18:02:31.464,197.85,199.0,192.4,197.05,1609725.0,City Union Bank Q1 net profits up 14.8% to Rs 185.64 crore,"Net profits for the year ending March 31, 2019 were at Rs 682.85 crore. 
",positive,neutral,-0.4043467273186671,neutral,-2.398989898989899,negative
2019-11-07 18:01:05.217,211.55,214.5,210.05,213.15,437998.0,City Union Bank Q2 net up by 15% to Rs 194 cr,City Union Bank (CUB) posted a 15 per cent growth in second quarter net profit ₹194 crore. The bank&#39;s net profit for the same period last year stood at Rs 168 crore. The bank reported a net profit,positive,positive,0.7563223824155019,neutral,0.3734827264239082,neutral
2019-11-21 13:03:33.543,215.05,217.5,213.1,215.0,696147.0,"We have continuously demonstrated that we follow rules and regulations, both in word and spirit: CEO of City Union Bank","Kumbakonam (Tamil Nadu)-headquartered old private sector lender City Union Bank (CUB) will be celebrating its 115 years of operations this Saturday. Incorporated in 1904, the bank stands out well comp",neutral,positive,-0.0232504068821257,neutral,-0.0925069380203462,neutral
2019-11-26 23:04:09.107,219.05,219.95,217.5,219.0,317468.0,CUB in pact with Fizwizard Tech for MF investments,City Union Bank Ltd. (CUB) has tied up with Finwizard Technology Pvt. Ltd. to help its customers invest in mutual funds (MFs) through its ‘all-in-one’ mobile application. A senior bank official said w,positive,positive,-0.0228258388495829,neutral,0.5007967220578167,neutral
2020-01-14 23:01:11.230,235.0,243.9,234.05,242.75,1700420.0,"FOMO driving consumer stocks higher, says Deepak Shenoy","We are also very fond of City Union Bank and Bandhan Bank, says Shenoy.",positive,neutral,3.297872340425532,positive,-0.819672131147541,neutral
2020-01-22 23:04:23.222,237.85,240.0,235.8,238.0,364900.0,City Union Bank launches all-in-one app with multilingual chat-bot,"City Union Bank (CUB) has introduced its multilingual interactive voice-based all-in-one mobile app. The customers can converse with the chat-bot ‘Ask Lakshmi’ of the app in Tamil, English, Hindi or T",neutral,neutral,0.0630649569056151,neutral,-0.4193751310547284,neutral
2020-02-12 10:00:34.079,231.5,233.5,227.1,227.9,890790.0,"Stocks to watch today on February 12: IRCTC, P&G Hygiene, Ashok Leyland, City Union Bank, Torrent Power, Suzlon, Hindalco, BHEL, IDBI Bank, Aster DM Healthcare, Glenmark Pharmaceuticals, IndusInd Bank among others are the top stocks to watch out for in Wednesday's trading session","Stocks to watch today on February 12: IRCTC, P&G Hygiene, Ashok Leyland, City Union Bank, Torrent Power, Suzlon, Hindalco, BHEL, IDBI Bank, Aster DM Healthcare, Glenmark Pharmaceuticals, IndusInd Bank among others are the top stocks to watch out for in Wednesday's trading session",neutral,neutral,-1.5550755939524814,negative,-2.6838315513855577,negative
2020-02-12 10:01:51.873,231.5,233.5,227.1,227.9,890790.0,"IRCTC, NBCC, Suzlon, ABB, Ashok Leyland results"," About 200 companies will declare their Q3 of FY20 results on Wednesday. Among them are ABB India, Amrutanjan, Ashok Leyland, Asahi India, Bharat Dynamics, Essar Shipping, City Union Bank, Dish TV, Di",neutral,neutral,-1.5550755939524814,negative,-2.6838315513855577,negative
2020-02-12 13:01:49.916,229.15,229.15,219.6,223.0,1846086.0,City Union Bank's NII up 2.2% in Q3FY20; stock down 1%,The bank reported a 8% yoy rise in net profit at Rs192.4cr for the quarter ended December 31 vs. Rs178.1cr in the same period last year.,positive,positive,-2.6838315513855577,negative,-1.9432655796292135,negative
2020-02-12 13:02:25.771,229.15,229.15,219.6,223.0,1846086.0,City Union Bank Q3 profit up 8% at ₹192 cr,"City Union Bank on Wednesday posted 8.04 per cent rise in net profit at ₹192.43 crore for the quarter ended December 31, 2019. It had logged a profit of ₹178.10 crore in the year-ago period, City Unio",positive,positive,-2.6838315513855577,negative,-1.9432655796292135,negative
2020-02-12 13:02:33.355,229.15,229.15,219.6,223.0,1846086.0,City Union Bank Q3 results: Profit up 8% at Rs 192 crore,City Union Bank had logged a profit of Rs 178.10 crore in the year-ago period.,positive,positive,-2.6838315513855577,negative,-1.9432655796292135,negative
2020-02-12 13:02:39.370,229.15,229.15,219.6,223.0,1846086.0,"BRIEF-India's City Union Bank Dec Qtr Net Profit Rises - Investing.com India
",Read BRIEF-India's City Union Bank Dec Qtr Net Profit Rises By Reuters,neutral,neutral,-2.6838315513855577,negative,-1.9432655796292135,negative
2020-02-12 18:04:25.200,229.15,229.15,219.6,223.0,1846086.0,City Union Bank posts Q3 profit of ₹192 crore,Private sector lender City Union Bank (CUB) posted an 8 per cent year-on-year growth in net profit at ₹192 crore in the third quarter of FY20. The bank’s net profit for the same quarter in the previou,neutral,positive,-2.6838315513855577,negative,-1.9432655796292135,negative
2020-02-12 18:04:29.409,229.15,229.15,219.6,223.0,1846086.0,"City Union Bank Q3 PBT dips marginally to Rs 227.43 crore, income up 11%",Gross and net non-performing assets rise,positive,positive,-2.6838315513855577,negative,-1.9432655796292135,negative
2020-02-12 23:03:29.975,229.15,229.15,219.6,223.0,1846086.0,City Union Bank profit rises 8% on higher total income,Private sector lender to add 35 branches by end of March,positive,positive,-2.6838315513855577,negative,-1.9432655796292135,negative
2020-03-11 13:05:15.654,192.1,200.0,186.0,188.9,2207634.0,"Stocks to watch today on March 11: Asian Paints, Cadila, Lupin, City Union Bank among others are the top stocks to watch out for in Wednesday's trading session","Stocks to watch today on March 11: Asian Paints, Cadila, Lupin, City Union Bank among others are the top stocks to watch out for in Wednesday's trading session",neutral,neutral,-1.665799062988021,negative,19.57055214723927,positive
2020-03-19 10:02:39.609,160.0,160.0,138.1,143.05,4597252.0,"Board Meetings Today: Emami, NTPC, Adani Gas and City Union Bank","There are corporate actions that often bring material changes to a company, directly affecting stakeholders. ",neutral,neutral,-10.593749999999991,negative,10.145911096029874,positive
2020-03-19 23:01:30.125,147.35,166.0,141.3,162.3,2099341.0,City Union Bank declares interim dividend,"The board of City Union Bank on Thursday declared an interim dividend of ₹0.50 per equity share.The 50 per cent interim dividend will be paid on 73.73 crore equity shares of ₹1 face value, the privat",neutral,neutral,10.145911096029874,positive,-16.942675159235666,negative
2020-03-23 10:05:00.000,157.0,157.0,130.4,130.4,1818910.0,"D-Street Buzz: BSE Bankex, Realty, Auto, Finance, Energy indices plunge over 10% each","Among the bank and financial stocks, shares of City Union Bank, Axis Bank, ICICI Bank, Federal Bank, IndusInd Bank and State Bank of India plunged over 10 percent.",negative,negative,-16.942675159235666,negative,-5.783582089552239,negative
2020-03-23 13:01:53.779,134.0,136.05,120.0,126.25,1494895.0,"Rate sensitive stocks crash; Nifty Auto, Bank index down over 10%","Among individual stocks, Axis Bank and City Union Bank were locked in 20 per cent lower circuit",negative,neutral,-5.783582089552239,negative,10.669371196754568,positive
2020-04-20 08:07:00.000,135.0,139.45,129.0,130.4,1484420.0,"Trading idea by Prabhudas Lilladher: Buy City Union Bank, Bosch",The stock of City Union Bank has witnessed a decent erosion from the peak of around 240 levels and has bottomed out near 110 levels,neutral,negative,-3.4074074074074034,negative,-2.0038535645472018,negative
2020-04-21 05:30:00.000,129.75,129.75,126.1,127.15,1490857.0,"BRIEF-India Cenbank Approves Re-Appointment Of N Kamakodi As City Union Bank MD, CEO - Investing.com India","The Financial News section features stock market news in addition to stories about bonds, forex, commodities and economic releases.",neutral,neutral,-2.0038535645472018,negative,-3.139534883720928,negative
2020-04-21 08:23:00.000,129.75,129.75,126.1,127.15,1490857.0,"City Union Bank extends CEO tenure, gets RBI nod; stock down 2%",Kamakodi will continue his charge for another three years tenure till further development.,neutral,neutral,-2.0038535645472018,negative,-3.139534883720928,negative
2020-04-21 12:32:30.000,129.0,129.3,124.8,124.95,920742.0,RBI gives nod to Kamakodi’s reappointment as MD & CEO of City Union Bank,"The Reserve Bank of India has given its approval for the re-appointment of N Kamakodi as MD &amp;amp; CEO of City Union Bank (CUB) for three years with effect from May 1, the private sector bank said",neutral,positive,-3.139534883720928,negative,-0.0398724082934699,neutral
2020-04-21 14:13:00.000,129.0,129.3,124.8,124.95,920742.0,City Union Bank gets RBI nod for reappointing MD&CEO,"It said Kamakodi’s reappointment is for a further period of three years with effect from May 1, 2020.",neutral,neutral,-3.139534883720928,negative,-0.0398724082934699,neutral
2020-04-21 14:27:00.000,129.0,129.3,124.8,124.95,920742.0,City Union Bank gets RBI not for reappointing MD&CEO,"City Union Bank said Kamakodi’s reappointment is for a further period of three years with effect from May 1, 2020.",neutral,neutral,-3.139534883720928,negative,-0.0398724082934699,neutral
2020-04-21 18:34:23.000,129.0,129.3,124.8,124.95,920742.0,City Union Bank gets RBI nod for reappointing N Kamakodi as MD and CEO for 3 years - Firstpost,Private sector lender City Union Bank on Tuesday said it has got RBI nod for reappointment of MD and CEO N Kamakodi,neutral,neutral,-3.139534883720928,negative,-0.0398724082934699,neutral
2020-04-24 18:53:08.000,124.1,125.8,119.2,120.9,2258793.0,"Finance, bank stocks tumble","From the bank index, Federal Bank dropped 4.12 per cent, State Bank of India 3.80 per cent, City Union Bank declined 2.79 per cent, HDFC Bank 1.79 per cent and Kotak Mahindra Bank 0.77 per cent.",negative,neutral,-2.578565672844471,negative,0.8210180623973727,neutral
2020-05-05 04:02:00.000,135.5,139.65,135.5,137.55,1044263.0,"Sensex, Nifty open higher; ONGC, Axis Bank stocks surge","All the sectoral indices were trading in the green, with Nifty Private Bank gained ~2% led by RBL Bank, Bandhan Bank, City Union Bank and IndusInd Bank.",positive,positive,1.5129151291513,positive,2.909090909090909,positive
2020-06-14 20:54:46.000,134.45,136.65,130.0,132.1,723848.0,RBI proposals may impact top management at private banks,"Private sector banks, including City Union Bank, AU Small Finance Bank, Bandhan Bank, Equitas Small Finance Bank, IDFC First Bank and Kotak Mahindra, could see significant changes, going by the Reserv",negative,neutral,-1.7478616586091442,negative,-2.717795979151158,negative
2020-06-18 05:30:00.000,133.4,137.9,132.0,137.55,766129.0,BRIEF-City Union Bank Posts March Quarter Net Loss - Investing.com India,"The Financial News section features stock market news in addition to stories about bonds, forex, commodities and economic releases.",neutral,neutral,3.110944527736136,positive,-4.210526315789469,negative
2020-06-18 13:33:00.000,133.0,134.5,122.45,127.4,9833482.0,City Union Bank Limited Q4FY20 results: City Union Bank reports a net loss of Rs95cr for Q4FY20.,City Union Bank Limited reports a net loss of Rs95cr in Q4FY20 as against a net profit of Rs175cr in Q4FY19.,neutral,negative,-4.210526315789469,negative,-2.7692307692307647,negative
