date,open,high,low,close,volume,title,description,title_sentiment,desc_sentiment,daily_change_pct,market_sentiment,next_day_change_pct,next_day_sentiment
2020-11-06 13:32:25.000,161.55,167.2,158.0,166.55,1466392.0,City Union Bank Ltd up for fifth straight session,"City Union Bank Ltd is quoting at Rs 164.25, up 1.7% on the day as on 12:54 IST on the NSE. The stock is down 22.4% in last one year as compared to a 1.85% slide in NIFTY and a 12.38% slide in the Nifty Private Bank.",positive,positive,3.095017022593624,positive,7.946428571428568,positive
2020-11-09 13:38:00.000,181.3,186.95,177.35,183.7,4938334.0,Accumulate City Union Bank; target of Rs 175: Geojit,"Geojit recommended accumulate rating on City Union Bank with a target price of Rs 175 in its research report dated November 04, 2020.",neutral,positive,1.3237727523441682,positive,-1.9586507072905452,negative
2020-11-09 16:25:00.000,181.3,186.95,177.35,183.7,4938334.0,Buy City Union Bank; target of Rs 199: HDFC Securities,"HDFC Securities is bullish on City Union Bank has recommended buy rating on the stock with a target price of Rs 199 in its research report dated November 03, 2020.",neutral,positive,1.3237727523441682,positive,-1.9586507072905452,negative
2020-11-17 13:31:26.000,188.85,200.0,186.55,196.0,3450336.0,City Union Bank Ltd gains for third straight session,"City Union Bank Ltd is quoting at Rs 190.65, up 1.65% on the day as on 12:49 IST on the NSE. The stock is down 11.12% in last one year as compared to a 8.11% slide in NIFTY and a 5.84% slide in the Nifty Private Bank index.",positive,positive,3.786073603388936,positive,-3.5885772049532445,negative
2020-12-08 11:08:14.000,176.4,179.75,172.85,173.85,1655421.0,Dolat Capital: Initiating Coverage on City Union Bank - A Dependable Franchise,Dolat Capital: Initiating Coverage on City Union Bank - A Dependable Franchise,neutral,neutral,-1.4455782312925234,negative,-0.6543385490753945,neutral
2020-12-08 13:21:15.000,175.75,177.0,173.6,174.6,1555293.0,Accumulate City Union Bank; Target Of Rs 200: Dolat Capital Market,"Dolat Capital Market recommended accumulate rating on City Union Bank with a target price of Rs 200 in its research report dated December 07, 2020.",neutral,positive,-0.6543385490753945,neutral,-1.4204545454545454,negative
2020-12-09 15:02:34.000,176.0,178.8,172.6,173.5,1841904.0,Buy City Union Bank; Target Of Rs 200: ICICI Direct,"ICICI Direct is bullish on City Union Bank recommended buy rating on the stock with a target price of Rs 200 in its research report dated December 09, 2020.",neutral,positive,-1.4204545454545454,negative,0.914285714285711,positive
2020-12-09 16:36:40.000,176.0,178.8,172.6,173.5,1841904.0,ICICI Direct: City Union Bank To Focus On Balance Sheet Strengthening,ICICI Direct: City Union Bank To Focus On Balance Sheet Strengthening,neutral,neutral,-1.4204545454545454,negative,0.914285714285711,positive
2020-12-14 08:08:00.000,177.95,186.9,177.0,185.0,3243199.0,"Nifty outlook & stock picks by Gaurav Garg: Buy Quess Corp, City Union Bank","Traders should try to create a long position keeping a close eye on 13,400",neutral,neutral,3.96178701882552,positive,0.5408328826392644,neutral
2020-12-16 12:12:07.000,189.0,189.5,183.0,184.1,1800758.0,Buy City Union Bank; Target Of Rs 225: Sharekhan,"Sharekhan is bullish on City Union Bank has recommended buy rating on the stock with a target price of Rs 225 in its research report dated December 15, 2020.",neutral,positive,-2.592592592592596,negative,-2.756756756756753,negative
2020-12-17 13:16:22.000,185.0,185.45,179.0,179.9,2187834.0,City Union Bank Ltd stays in winning mode,"City Union Bank Ltd is quoting at Rs 189.4, up 0.45% on the day as on 12:44 IST on the NSE. The stock is down 18.61% in last one year as compared to a 12.36% slide in NIFTY and a 4.05% slide in the Nifty Private Bank.",positive,positive,-2.756756756756753,negative,-1.675977653631285,negative
2020-12-23 10:58:37.000,173.1,185.8,172.05,180.0,3146226.0,​‘ECLGS scheme supported MSME borrowers to a greater extent’,"We have disbursed over ₹1,800 crore, says City Union Bank chief",neutral,neutral,3.98613518197574,positive,-1.8396485447556257,negative
2020-12-24 05:30:00.000,182.1,182.95,175.75,178.75,1486782.0,Why Brokerages are Recommending City Union Bank - Investing.com India,"The Financial News section features stock market news in addition to stories about bonds, forex, commodities and economic releases.",neutral,neutral,-1.8396485447556257,negative,1.391594767603674,positive
2020-12-29 10:51:34.000,183.65,183.65,178.4,180.0,1212520.0,Brokerages Believe 12 Stocks Could Give Double-digit Returns; Do You Own Any?,"City Union Bank, Infosys, Marico, Burger King and Exide Industries among the top 12 picks by the brokerages, which could give 11-23 percent return.",neutral,neutral,-1.987476177511574,negative,-1.3614893025840449,negative
2020-12-30 06:53:00.000,179.95,180.0,177.0,177.5,1058195.0,Price targets for select bank stocks swell by up to 57%,"ICICI Securities raised the targets on HDFC Bank, Axis Bank, SBI, IndusInd Bank, Bandhan Bank, Federal Bank, DCB Bank, Kotak Mahindra Bank, City Union Bank and YES Bank by 13-57 per cent",positive,positive,-1.3614893025840449,negative,1.1220196353436185,positive
2020-12-30 11:36:00.000,179.95,180.0,177.0,177.5,1058195.0,Small yet focused approach makes City Union Bank an interesting bet,"High concentration in the south Indian market, particularly the SME belt is working to its advantage",neutral,positive,-1.3614893025840449,negative,1.1220196353436185,positive
2021-01-11 12:03:33.000,182.95,184.45,177.6,179.25,3130193.0,City Union Bank launches ‘WhatsApp Banking’,"City Union Bank (CUB) announced that it has launched 'WhatsApp Banking' - taking the digitisation journey for its customers to the next level. In a press release, the Kumbakonam-headquartered",neutral,neutral,-2.0224104946706687,negative,-1.220865704772469,negative
2021-02-03 05:30:00.000,182.0,183.3,178.05,182.7,2334600.0,BRIEF-City Union Bank Ltd - Net Interest Margin Stood At 4.16% In Q3,BRIEF-City Union Bank Ltd - Net Interest Margin Stood At 4.16% In Q3,neutral,neutral,0.3846153846153783,neutral,-2.57190265486726,negative
2021-02-03 05:30:00.000,182.0,183.3,178.05,182.7,2334600.0,BRIEF-India’s City Union Bank Dec-Qtr Net Profit Slips,BRIEF-India’s City Union Bank Dec-Qtr Net Profit Slips,neutral,neutral,0.3846153846153783,neutral,-2.57190265486726,negative
2021-02-03 09:41:00.000,182.0,183.3,178.05,182.7,2334600.0,City Union Bank Q3 net profit down -11.69% at Rs169.9cr on higher provisioning,City Union Bank reported a 6.20% growth in total consolidated revenues in the Dec-20 quarter at Rs1.277.80cr,negative,positive,0.3846153846153783,neutral,-2.57190265486726,negative
2021-02-03 13:05:20.000,180.8,180.8,174.35,176.15,4488205.0,"City Union Bank Ltd spurts 0.25%, gains for fifth straight session","City Union Bank Ltd is quoting at Rs 182.05, up 0.25% on the day as on 12:44 IST on the NSE. The stock is down 20.83% in last one year as compared to a 23.81% jump in NIFTY and a 11.52% jump in the Nifty Private Bank.",positive,positive,-2.57190265486726,negative,-2.994350282485882,negative
2021-02-03 13:31:20.000,180.8,180.8,174.35,176.15,4488205.0,City Union Bank Ltd stays supported,"City Union Bank Ltd is quoting at Rs 182.05, up 0.25% on the day as on 12:44 IST on the NSE. The stock is down 20.83% in last one year as compared to a 23.81% jump in NIFTY and a 11.52% jump in the Nifty Private Bank.",neutral,positive,-2.57190265486726,negative,-2.994350282485882,negative
2021-02-03 16:30:00.000,180.8,180.8,174.35,176.15,4488205.0,City Union Bank standalone net profit declines 11.69% in the December 2020 quarter,Total Operating Income decline 1.21% to Rs 1048.03 crore,negative,negative,-2.57190265486726,negative,-2.994350282485882,negative
2021-02-03 16:58:00.000,180.8,180.8,174.35,176.15,4488205.0,"City Union Bank Q3 net drops 11% to Rs 170 cr, huge spike in provisions","During the quarter it made Rs 125 cr additional provision towards Covid contingencies, total provisions at Rs 465 cr as on December 31, 2020",negative,neutral,-2.57190265486726,negative,-2.994350282485882,negative
2021-02-03 17:34:00.000,180.8,180.8,174.35,176.15,4488205.0,City Union Bank Q3 results: Net profit declines 12% to Rs 170cr,"Bank’s total income during the third quarter of financial year 2020-21, however, moved up to Rs 1,277.80 crore as against Rs 1,203.24 crore in the same period of 2019-20, City Union Bank said in a regulatory filing.",negative,positive,-2.57190265486726,negative,-2.994350282485882,negative
2021-02-03 18:16:14.000,180.8,180.8,174.35,176.15,4488205.0,City Union Bank Q3 Net Profit Declines 12% To Rs 170 Crore,The bank had registered a net profit of Rs 192.43 crore in the corresponding period of the preceding financial year.,neutral,neutral,-2.57190265486726,negative,-2.994350282485882,negative
2021-02-03 19:26:07.000,180.8,180.8,174.35,176.15,4488205.0,"City Union Bank’s Q3 margins, asset quality improve amid profit fall",CUB restructured 60 MSME borrower accounts to the tune of ₹321 cr during the quarter,positive,neutral,-2.57190265486726,negative,-2.994350282485882,negative
2021-02-03 22:58:17.000,180.8,180.8,174.35,176.15,4488205.0,CUB Q3 net profit slips 11% on provisions,Private sector lender City Union Bank Ltd.’s (CUB) standalone net profit for the third quarter ended December declined 11% to ₹170 crore from ₹192 crore. Net interest income rose by 14% to ₹489 crore,negative,negative,-2.57190265486726,negative,-2.994350282485882,negative
2021-02-03 22:59:49.000,180.8,180.8,174.35,176.15,4488205.0,City Union Bank Q3 net down 11% on higher provisioning,"The gross NPA was at 2.94% and the net NPA at 1.47%, compared with 3.50% and 1.95%, respectively. The provision coverage ratio was at 73%. CUB in a release said there was no addition to NPA during the Q3FY21 because of the standstill clause as directed by the Supreme Court.",negative,neutral,-2.57190265486726,negative,-2.994350282485882,negative
2021-02-04 07:55:00.000,180.8,180.8,174.35,176.15,4488205.0,City Union Bank dives 3% on lower Q3 PAT of Rs170cr led by additional Covid-19 provisions,"Gross NPA as on December 31, 2020, was at 2.94% and Net NPA was at 1.47%.",positive,neutral,-2.57190265486726,negative,-2.994350282485882,negative
2021-02-04 09:50:12.000,180.8,180.8,174.35,176.15,4488205.0,"City Union Bank Ltd Falls 3.75%, S&P BSE BANKEX index Drops 1.19%",City Union Bank Ltd has lost 3.83% over last one month compared to 7.07% gain in S&P BSE BANKEX index and 3.31% rise in the SENSEX,neutral,negative,-2.57190265486726,negative,-2.994350282485882,negative
2021-02-04 10:01:20.000,180.8,180.8,174.35,176.15,4488205.0,City Union Bank Q3 Review - Subpar Asset Quality Trends: Dolat Capital,City Union Bank Q3 Review - Subpar Asset Quality Trends: Dolat Capital,neutral,neutral,-2.57190265486726,negative,-2.994350282485882,negative
2021-02-04 17:29:59.000,177.0,180.8,169.35,171.7,2482613.0,"City Union Bank Q3 Review - Near Term Stress Higher, But Sufficient Cover: Centrum Broking","City Union Bank Q3 Review - Near Term Stress Higher, But Sufficient Cover: Centrum Broking",neutral,neutral,-2.994350282485882,negative,-0.3179190751445152,neutral
2021-02-08 09:58:00.000,173.0,175.25,171.2,172.45,1627075.0,"Buy City Union Bank, target price Rs 216: Axis Securities","City Union Bank Ltd., incorporated in the year 1904, is a banking company (having a market cap of Rs 12634.04 Crore).",neutral,neutral,-0.3179190751445152,neutral,-3.801843317972347,negative
2021-02-08 21:45:04.000,173.6,174.45,166.25,167.0,4050763.0,Broker’s call: City Union Bank (Buy),"Geojit FinancialCity Union Bank (Buy) Target: ₹208CMP: ₹171.75City Union Bank Ltd (CUB), the oldest private sector bank in India, is a mid-sized commercial bank headquartered in Tamil Nadu, having a n",neutral,neutral,-3.801843317972347,negative,-2.6548672566371683,negative
2021-02-09 08:22:24.000,173.6,174.45,166.25,167.0,4050763.0,City Union Bank chief expects total recast at around 5-6%,"Private sector lender City Union Bank (CUB) said the bank has identified accounts worth Rs 1,037 crore for restructuring during the fourth quarter of the current fiscal.",neutral,negative,-3.801843317972347,negative,-2.6548672566371683,negative
2021-02-11 16:48:42.000,165.0,166.65,161.5,162.95,2360433.0,Buy City Union Bank; Target Of Rs 208: Geojit,"Geojit is bullish on City Union Bank has recommended buy rating on the stock with a target price of Rs 208 in its research report dated February 08, 2021.",neutral,positive,-1.242424242424249,negative,2.735562310030395,positive
2021-02-11 16:49:06.000,165.0,166.65,161.5,162.95,2360433.0,Buy City Union Bank; Target Of Rs 192: HDFC Securities,"HDFC Securities is bullish on City Union Bank has recommended buy rating on the stock with a target price of Rs 192 in its research report dated February 04, 2021.",neutral,positive,-1.242424242424249,negative,2.735562310030395,positive
2021-02-12 16:58:43.000,165.0,166.65,161.5,162.95,2360433.0,Accumulate City Union Bank; Target Of Rs 200: Dolat Capital Market,"Dolat Capital Market recommended accumulate rating on City Union Bank with a target price of Rs 200 in its research report dated February 03, 2021.",neutral,positive,-1.242424242424249,negative,2.735562310030395,positive
2021-02-22 15:41:33.000,160.0,163.95,160.0,161.6,1786910.0,Hold City Union Bank; Target Of Rs 186: Arihant Capital,"Arihant Capital recommended hold rating on City Union Bank with a target price of Rs 186 in its research report dated February 19, 2021.",neutral,positive,0.9999999999999964,positive,1.8209876543209809,positive
2021-03-23 05:30:00.000,170.0,171.9,168.0,168.2,1330507.0,Why Nirmal Bang is Bullish on City Union Bank,Why Nirmal Bang is Bullish on City Union Bank,neutral,neutral,-1.0588235294117714,negative,-2.1428571428571392,negative
2021-03-24 07:54:01.000,168.0,169.0,162.85,164.4,2782738.0,City Union Bank Offering Best Risk Reward In Midcap Banks: Nirmal Bang,City Union Bank Offering Best Risk Reward In Midcap Banks: Nirmal Bang,neutral,neutral,-2.1428571428571392,negative,-1.7393957888312446,negative
2021-03-30 13:50:15.000,155.7,160.0,154.65,155.95,3757178.0,City Union Bank Ltd down for fifth straight session,"City Union Bank Ltd is quoting at Rs 158.75, down 0.53% on the day as on 13:19 IST on the NSE. The stock jumped 23.01% in last one year as compared to a 71.85% rally in NIFTY and a 77.36% spurt in the Nifty Private Bank index.",negative,positive,0.1605651894669235,neutral,3.1000319590923766,positive
2021-04-05 19:56:53.000,157.0,158.4,155.1,155.85,1204167.0,Here’s how to withdraw cash from ATM without using debit card,"As per a report, the company has partnered with the National Payments Corporation of India (NPCI) and City Union Bank to launch this facility. More than 1,500 ATMs have been upgraded to this service, while they are looking to upgrade more ATMs rapidly.",neutral,positive,-0.7324840764331246,neutral,5.04761904761904,positive
2021-04-08 15:08:00.000,166.45,168.4,163.1,166.5,1492638.0,"Covid impact should not be as bad as last year’s: Dr N Kamakodi, City Union Bank","From December onwards, almost 90 percentage of the businesses are back on track with almost 100 percentage of the pre-COVID level transactions and profitability, says Dr N Kamakodi, MD & CEO, City Union Bank in an interview with ET NOW.",negative,positive,0.0300390507660026,neutral,-1.779141104294482,negative
2021-04-08 16:20:00.000,166.45,168.4,163.1,166.5,1492638.0,"We’re prepared for whatever happens, says City Union Bank CEO Dr N Kamakodi, of a second wave","Even though things are not looking great, they aren’t as bad as the first time around, we’ve learnt a lot from our experience from during the first lockdown and we don’t expect impact to be as bad this time around.",neutral,neutral,0.0300390507660026,neutral,-1.779141104294482,negative
2021-04-08 16:20:00.000,166.45,168.4,163.1,166.5,1492638.0,"We’re prepared for whatever happens, says City Union Bank CEO Dr N Kamakodi, of a second coronavirus wave","Even though things are not looking great, they aren’t as bad as the first time around, we’ve learnt a lot from our experience from during the first lockdown and we don’t expect impact to be as bad this time around.",neutral,neutral,0.0300390507660026,neutral,-1.779141104294482,negative
2021-04-08 17:51:00.000,166.45,168.4,163.1,166.5,1492638.0,"We’ve always been a banker for the ‘aam aadmi’, says City Union Bank CEO Dr N Kamakodi","We only did one thing, we continued with the old way of banking, without compromising the systems put in over centuries. We are perhaps the third oldest bank in the country after State Bank of India and Punjab National Bank. That’s how we were able to get the risk-adjusted return, says Dr Kamakodi.",neutral,neutral,0.0300390507660026,neutral,-1.779141104294482,negative
2021-04-15 17:18:44.000,161.8,164.85,161.0,162.0,1617779.0,City Union Bank Q4 Net Profit To Rs 167 Cr: Sharekhan,"Net Interest Income (NII) is expected to increase by 18.9 percent Y-o-Y (up 2 percent Q-o-Q) to Rs 499 crore, according to Sharekhan.",neutral,positive,0.1236093943139608,neutral,0.4427577482606053,neutral
2021-04-27 15:22:00.000,165.1,170.5,164.05,168.7,3880639.0,Ecosystem better prepared to deal with pandemic this time: City Union Bank MD,"Things by and large stable after last RBI policy statement, says N Kamakodi, MD & CEO, City Union Bank, in an interview with ET NOW.",neutral,neutral,2.1804966686856417,positive,-1.0882352941176436,negative
2021-05-13 16:01:45.000,166.05,167.45,162.25,163.45,2257830.0,City Union Bank donates ₹1 crore to fight COVID-19,The bank has donated the amount to TN’s Disaster Management Account,neutral,neutral,-1.5657934357121484,negative,3.860294117647066,positive
2021-05-20 21:08:00.000,173.0,175.75,172.6,174.8,3622970.0,"Reserve Bank imposes penalty on City Union Bank, 3 other lenders","The RBI has imposed monetary penalty on City Union Bank, Tamilnad Mercantile Bank and two other lenders for contravention of certain directions issued by the central bank.",negative,negative,1.040462427745671,positive,-1.9444444444444444,negative
2021-05-20 21:13:00.000,173.0,175.75,172.6,174.8,3622970.0,"RBI imposes penalty on City Union Bank, 3 other lenders","A penalty of Rs 1 crore has been imposed on City Union Bank Limited for contravention of/non-compliance with certain provisions contained in the RBI (Lending to Micro, Small & Medium Enterprises (MSME) Sector) Directions, 2017 and the circulars on Educational Loan Scheme and Credit Flow to Agricultu…",negative,neutral,1.040462427745671,positive,-1.9444444444444444,negative
2021-05-20 22:27:00.000,173.0,175.75,172.6,174.8,3622970.0,"RBI fines City Union Bank, 3 other lenders over violation of directions","A penalty of Rs 1 crore has been imposed on City Union Bank Limited for contravention of/non-compliance with certain provisions contained in the RBI (Lending to Micro, Small & Medium Enterprises (MSME) Sector) Directions, 2017",negative,negative,1.040462427745671,positive,-1.9444444444444444,negative
2021-05-20 22:31:29.000,173.0,175.75,172.6,174.8,3622970.0,"RBI imposes penalty on City Union Bank, Tamilnad Mercantile Bank and two other lenders","The RBI has imposed monetary penalty on City Union Bank, Tamilnad Mercantile Bank and two other lenders for contravention of certain directions issued by the central bank.A penalty of Rs 1 crore has been imposed on City Union Bank Limited for contravention of/non-compliance with certain pr…",negative,negative,1.040462427745671,positive,-1.9444444444444444,negative
2021-05-21 08:49:00.000,173.0,175.75,172.6,174.8,3622970.0,City Union Bank stock surges 2% despite RBI’s monetary penalty of Rs1cr for non-compliance,RBI carried a statutory inspection of the bank concerning its financial position and the Risk Assessment Report (RAR).,positive,neutral,1.040462427745671,positive,-1.9444444444444444,negative
2021-05-21 09:55:00.000,173.0,175.75,172.6,174.8,3622970.0,"Buy City Union Bank, target price Rs 182: Yes Securities","City Union Bank Ltd., incorporated in the year 1904, is a banking company (having a market cap of Rs 12681.88 Crore).",neutral,neutral,1.040462427745671,positive,-1.9444444444444444,negative
2021-05-21 11:54:13.000,173.0,175.75,172.6,174.8,3622970.0,"RBI slaps penalty on City Union Bank, 3 other lenders, here’s why","The RBI has imposed monetary penalty on City Union Bank, Tamilnad Mercantile Bank and two other lenders for contravention of certain directions issued by the central bank.",neutral,negative,1.040462427745671,positive,-1.9444444444444444,negative
2021-05-21 15:32:20.000,173.0,175.75,172.6,174.8,3622970.0,RBI imposes penalty on City Union Bank,Powered by Capital Market - Live News,negative,neutral,1.040462427745671,positive,-1.9444444444444444,negative
2021-05-28 08:20:56.000,174.4,175.4,172.25,174.3,946313.0,"Markets likely to gain on global cues; M&M, Sun Pharma, Glenmark in focus","Mahindra & Mahindra, REC, Ipca Laboratories, Sundaram Finance, Max Healthcare, Glenmark Pharmaceuticals, Aditya Birla Fashion & Retail, Indian Bank, City Union Bank and Dilip Buildcon are key companies which will announce their March quarter results today",positive,neutral,-0.0573394495412811,neutral,0.1159756451145358,neutral
2021-05-28 17:08:00.000,174.4,175.4,172.25,174.3,946313.0,City Union Bank reports fourth quarter net profit at Rs 111.18 crore,"For the year ending March 31, 2021, net profits of the bank grew to Rs 592.82 crore from Rs 476.31 crore.",neutral,positive,-0.0573394495412811,neutral,0.1159756451145358,neutral
2021-05-28 17:11:00.000,174.4,175.4,172.25,174.3,946313.0,City Union Bank Q4 results: Lender reports net profit at Rs 111 crore,"For the year ending March 31, 2021, net profits of the bank grew to Rs 592.82 crore from Rs 476.31 crore.",neutral,positive,-0.0573394495412811,neutral,0.1159756451145358,neutral
2021-05-28 17:24:00.000,174.4,175.4,172.25,174.3,946313.0,City Union Bank reports standalone net profit of Rs 111.19 crore in the March 2021 quarter,Total Operating Income decline 6.27% to Rs 976.32 crore,neutral,negative,-0.0573394495412811,neutral,0.1159756451145358,neutral
2021-05-28 17:59:00.000,174.4,175.4,172.25,174.3,946313.0,City Union Bank net profit grows 24% to Rs 592.82 crore in FY21,"The Tamil Nadu-based bank had reported a net loss at Rs 95.29 crore during last quarter of FY20-21, the City Union Bank said in a BSE filing",positive,negative,-0.0573394495412811,neutral,0.1159756451145358,neutral
2021-05-28 21:32:24.000,174.4,175.4,172.25,174.3,946313.0,City Union Bank posts ₹111-cr net,City Union Bank (CUB) on Friday reported net profit at ₹111.18 crore for the quarter ended March 31. The private sector lender had reported a net loss at ₹95.29 crore during corresponding quarter prev,neutral,neutral,-0.0573394495412811,neutral,0.1159756451145358,neutral
2021-05-28 22:03:00.000,174.4,175.4,172.25,174.3,946313.0,City Union Bank reports net profit of Rs 111 cr in March quarter,Private sector City Union Bank on Friday reported a net profit of Rs 111.18 crore in the last quarter ended March 2021.,neutral,neutral,-0.0573394495412811,neutral,0.1159756451145358,neutral
2021-05-28 22:05:12.000,174.4,175.4,172.25,174.3,946313.0,CUB turns profit on lower provisions,"City Union Bank has reported a standalone net profit of ₹111.18 crore for the fourth quarter ended March 2021, against a net loss of ₹95.29 crore in the year-earlier period on account of lower provisi",positive,negative,-0.0573394495412811,neutral,0.1159756451145358,neutral
2021-05-31 11:48:00.000,172.45,177.95,169.6,172.65,3679178.0,"Buy City Union Bank, target price Rs 200: ICICI Securities","City Union Bank Ltd., incorporated in the year 1904, is a banking company (having a market cap of Rs 12988.49 Crore).",neutral,neutral,0.1159756451145358,neutral,-2.985507246376815,negative
2021-05-31 13:23:35.000,172.5,172.7,166.55,167.35,3776618.0,City Union Bank Q4 Review - Stressed Asset Formation Within Guided Range: ICICI Securities,City Union Bank Q4 Review - Stressed Asset Formation Within Guided Range: ICICI Securities,neutral,neutral,-2.985507246376815,negative,0.4191616766466998,neutral
2021-05-31 13:40:40.000,172.5,172.7,166.55,167.35,3776618.0,Buy City Union Bank: Target Of Rs 225: Sharekhan,"Sharekhan is bullish on City Union Bank has recommended buy rating on the stock with a target price of Rs 225 in its research report dated May 28, 2021.",neutral,positive,-2.985507246376815,negative,0.4191616766466998,neutral
2021-06-01 05:30:00.000,172.5,172.7,166.55,167.35,3776618.0,Why Axis Direct Thinks City Union Bank has a 25% Upside,Why Axis Direct Thinks City Union Bank has a 25% Upside,neutral,neutral,-2.985507246376815,negative,0.4191616766466998,neutral
2021-06-01 22:35:00.000,167.0,168.5,166.55,167.7,1815983.0,Is the Correction in City Union Bank a Buying Opportunity?,Is the Correction in City Union Bank a Buying Opportunity?,neutral,neutral,0.4191616766466998,neutral,-0.7405213270142179,neutral
2021-06-03 19:05:36.000,167.9,168.9,165.55,166.4,1893549.0,City Union Bank hopes to maintain better asset quality in FY22 amid second wave blues,"We will be seeing things getting eased up once the lockdown is removed, says Managing Director Kamakodi",positive,neutral,-0.8933889219773675,neutral,-0.0895255147717133,neutral
2021-06-04 14:27:36.000,167.9,168.9,165.55,166.4,1893549.0,Buy City Union Bank; Target Of Rs 208: Geojit,"Geojit is bullish on City Union Bank has recommended buy rating on the stock with a target price of Rs 208 in its research report dated June 02, 2021.",neutral,positive,-0.8933889219773675,neutral,-0.0895255147717133,neutral
