date,open,high,low,close,volume,title,description,title_sentiment,desc_sentiment,daily_change_pct,market_sentiment,next_day_change_pct,next_day_sentiment
2022-08-25 12:27:06.000,190.5,191.95,186.25,188.85,7108375.0,"Resistance for Nifty seen at 17,725; Stocks to buy in September F&O series","Coal India, City Union Bank, Cummins, IDFC First Bank and Piramal Enterprises are the five F&O stocks tha can deliver up to 21 per cent returns in the September series.",neutral,positive,-0.8661417322834675,neutral,1.1235955056179776,positive
2022-08-29 15:16:14.000,181.0,183.65,177.6,179.5,5566214.0,Info Edge (India) Ltd leads losers in ‘A’ group,"Network 18 Media & Investments Ltd, Forbes & Company Ltd, Tata Elxsi Ltd and City Union Bank Ltd are among the other losers in the BSE’s ‘A’ group today, 29 August 2022.",positive,negative,-0.8287292817679558,neutral,1.2011173184357575,positive
2022-08-29 22:16:51.000,181.0,183.65,177.6,179.5,5566214.0,Trade setup for today: Top 15 things to know before the opening bell,"Based on the open interest future percentage, there were 96 stocks including Info Edge India, City Union Bank, Kotak Mahindra Bank, Sun Pharma and Voltas in which a short build-up was seen.",neutral,neutral,-0.8287292817679558,neutral,1.2011173184357575,positive
2022-08-30 01:01:42.000,181.0,183.65,177.6,179.5,5566214.0,Gap between slippage and recovery has narrowed: City Union Bank CEO,"The bank’s share closed at Rs 179.05 a piece on BSE, down 4.7% from its previous close while the broader Sensex was down 1.46%",positive,negative,-0.8287292817679558,neutral,1.2011173184357575,positive
2022-09-19 13:31:16.000,181.65,187.0,181.5,184.05,3329289.0,City Union Bank - Return On Asset To Reach Pre-Covid Level: IDBI Capital Initiates Coverage,City Union Bank - Return On Asset To Reach Pre-Covid Level: IDBI Capital Initiates Coverage,neutral,neutral,1.3212221304706884,positive,0.9782608695652236,positive
2022-09-20 06:52:00.000,181.65,187.0,181.5,184.05,3329289.0,Buy into these four stocks for 10-38% returns,"IDBI Capital has initiated coverage on City Union Bank with a buy rating citing attractive valuations. The stock is trading at an estimated FY24 Price to Adjusted Book Value (P/ ABV) of 1.7 times. The price target values the stock at 2.2 times P/ABV FY24, which is its average valuation of FY15-20, t…",neutral,positive,1.3212221304706884,positive,0.9782608695652236,positive
2022-09-21 13:16:31.000,185.0,186.5,176.95,179.5,4732821.0,City Union Bank Ltd up for third straight session,"City Union Bank Ltd is quoting at Rs 187.3, up 1.55% on the day as on 12:49 IST on the NSE. The stock is up 24.99% in last one year as compared to a 1.07% jump in NIFTY and a 9.07% jump in the Nifty PSU Bank index.",positive,positive,-2.972972972972973,negative,-2.8223574986164883,negative
2022-09-23 19:51:46.000,180.7,181.0,174.4,175.6,3813987.0,"IndusInd Bank, City Union Bank and Shivalik Small Finance Bank revise Fixed Deposit rates; Should you invest?","The revised Fixed Deposits rates for IndusInd Bank, City Union Bank and Shivalik Small Finance Bank have already come into effect.",neutral,neutral,-2.8223574986164883,negative,-1.1435105774728416,negative
2022-09-28 21:10:54.000,173.05,174.85,168.05,171.9,4515667.0,Trade setup for Thursday: Top 15 things to know before the opening bell,"Based on the open interest future percentage, there were 97 stocks including City Union Bank, IndiaMART InterMESH, Syngene International, Navin Fluorine International, and Atul, in which long unwinding was seen.",neutral,neutral,-0.6645478185495554,neutral,0.9883720930232492,positive
2022-09-29 21:45:22.000,172.0,176.45,169.45,173.7,1849933.0,Trade setup for Friday: Top 15 things to know before the opening bell,"Based on the open interest future percentage, there were 108 stocks, in which short-covering was seen including Syngene International, Alkem Laboratories, City Union Bank, Shree Cement, and Escorts.",neutral,neutral,0.9883720930232492,positive,-3.1718569780853514,negative
2022-10-03 22:36:50.000,172.45,174.9,170.9,173.0,3104575.0,Trade setup for today: Top 14 things to know before the opening bell,"Based on the open interest future percentage, there were 105 stocks in which a short build-up was seen including Nifty Financial, Crompton Greaves Consumer Electricals, Eicher Motors, City Union Bank, and Mphasis.",neutral,neutral,0.3189330240649529,neutral,-1.467203682393562,negative
2022-10-18 15:46:12.000,193.35,196.6,191.85,193.25,2954583.0,Leading brokerages line up top muhurat picks this Diwali,"Analysts believe stocks like Axis Bank, City Union Bank, CAMS, ITC Ltd, M&M, Titan, Jubilant Foodworks and Laurus Labs can generate mid double digit returns in the medium term",neutral,positive,-0.0517196793379851,neutral,-2.849740932642487,negative
2022-11-04 09:01:25.000,188.2,192.5,187.25,190.0,4937930.0,"Stocks that will see action on November 04, 2022","Stocks to watch: Titan, CIpla, Wipro, Amrutanjan, Chochin Shipyard, Indigo, Shipping Corp, Chemplast Sanmar, City Union Bank, Dreamfolks Services, Escorts Kubota, GAIL India, Go Fashion (India), Godrej Agro, Marico, Puravankara, TTK Prestiege, TVS Motor Company and Wockhardt",neutral,neutral,0.9564293304994748,positive,2.187499999999994,positive
2022-11-04 20:05:21.000,188.2,192.5,187.25,190.0,4937930.0,City Union Bank posts 52% growth in Q2 net profit at ₹276.46 crore,"Total income of the lender during the quarter grew by 11 per cent to ₹1,354.65 crore",positive,positive,0.9564293304994748,positive,2.187499999999994,positive
2022-11-07 08:02:21.000,192.0,199.25,191.0,196.2,10047288.0,"Marico, TVS Motor, SRF, City Union Bank, JK Lakshmi Cement And More Q2 Results Review: HDFC Securities","Marico, TVS Motor, SRF, CUB, JK Lakshmi Cement, Hero MotoCorp, TTK Prestige, Mahindra Lifespace, Orient Electric Q2 Results Review",neutral,neutral,2.187499999999994,positive,-2.872260015117152,negative
2022-11-07 09:47:02.000,192.0,199.25,191.0,196.2,10047288.0,"City Union Bank Q2 Results Review - Margin Expansion, Lower Provisions Aid Profitability: Nirmal Bang",The Bank’s liquidity and capitalisation position remains robust.,neutral,positive,2.187499999999994,positive,-2.872260015117152,negative
2022-11-07 12:29:00.000,192.0,199.25,191.0,196.2,10047288.0,"Results Review For SRF, Marico, TVS Motor, Hero Motocorp, City Union Bank","Results Review For SRF, Marico, TVS Motor, Hero Motocorp, City Union Bank",neutral,neutral,2.187499999999994,positive,-2.872260015117152,negative
2022-11-07 20:47:02.000,192.0,199.25,191.0,196.2,10047288.0,Buy City Union Bank; target of Rs 220: Prabhudas Lilladher,"Prabhudas Lilladher is bullish on City Union Bank has recommended buy rating on the stock with a target price of Rs 220 in its research report dated November 05, 2022.",neutral,positive,2.187499999999994,positive,-2.872260015117152,negative
2022-11-08 11:22:16.000,198.45,199.95,191.55,192.75,6096260.0,Buy City Union Bank; target of Rs 230: Sharekhan,"Sharekhan is bullish on City Union Bank has recommended buy rating on the stock with a target price of Rs 230 in its research report dated November 04, 2022.",neutral,positive,-2.872260015117152,negative,-0.0517330574237055,neutral
2022-11-09 20:20:30.000,193.3,196.5,188.05,193.2,3864526.0,Buy City Union Bank; target of Rs 228: Emkay Global Financial,"Emkay Global Financial is bullish on City Union Bank has recommended buy rating on the stock with a target price of Rs 228 in its research report dated November 06, 2022.",neutral,positive,-0.0517330574237055,neutral,-2.497425334706485,negative
2022-12-01 01:16:31.000,189.7,195.5,188.8,190.0,6251465.0,Now pay GST through City Union Bank,Now pay GST through City Union Bank,neutral,neutral,0.158144438587249,neutral,0.3149606299212568,neutral
2022-12-01 11:58:56.000,189.7,195.5,188.8,190.0,6251465.0,City Union Bank authorised to enable GST payments,City Union Bank customers can pay their GST dues payable to the Government through their bank account on the GST Portal,neutral,neutral,0.158144438587249,neutral,0.3149606299212568,neutral
2022-12-05 22:33:09.000,196.45,197.6,193.2,194.55,2465825.0,Trade setup for Tuesday: Top 15 things to know before the opening bell,"Based on the open interest future percentage, we have seen a long build-up in a total of 58 stocks on Monday, including Gujarat Narmada Valley Fertilizers & Chemicals (GNFC), M&M Financial Services, Piramal Enterprises, Hindalco Industries, and City Union Bank.",neutral,positive,-0.967167218121648,negative,-2.475752935171003,negative
2022-12-13 19:21:02.000,197.3,203.7,196.0,202.9,8133405.0,City Union Bank on a branch expansion spree,"A couple of days ago, CUB inaugurated five new branches with self-service banking facilities across various districts in Tamil Nadu",neutral,positive,2.838317283324883,positive,-3.482099068170669,negative
2022-12-14 22:56:39.000,203.9,205.0,196.55,196.8,5365160.0,Trade setup for Thursday: Top 15 things to know before the opening bell,"Based on the open interest future percentage, a long build-up was seen in 69 stocks, including Nifty Financial, Indiabulls Housing Finance, Havells India, City Union Bank, and Persistent Systems",neutral,positive,-3.482099068170669,negative,-2.557544757033248,negative
2022-12-20 17:30:00.000,181.35,182.2,172.0,179.0,23851239.0,RBI finds Rs 259-cr divergence in City Union Bank’s additional gross NPA for FY22,"RBI found the divergence during on-site Inspection for Supervisory Evaluationfor the FY22 from October 7, 2022 to November 18, 2022",positive,neutral,-1.2958367797077444,negative,-1.703910614525146,negative
2022-12-20 20:43:49.000,181.35,182.2,172.0,179.0,23851239.0,RBI finds ₹259-cr divergence in City Union Bank’s FY22 gross NPA,"The gross NPA reported by the bank as on March 31, 2022 was ₹1,933 crore, but as assessed by RBI the amount was ₹2,192 crore.",positive,neutral,-1.2958367797077444,negative,-1.703910614525146,negative
2022-12-20 21:49:29.000,181.35,182.2,172.0,179.0,23851239.0,RBI finds divergence of ₹259 cr. in NPA provisioning by City Union Bank for FY22,CUB said 13 borrower accounts (outstanding balance of more than ₹1 crore) for an amount of ₹230 crore and 218 borrowers (outstanding balance of less than ₹1 crore) for an amount of ₹29 crore comprised the divergence,neutral,neutral,-1.2958367797077444,negative,-1.703910614525146,negative
2022-12-21 09:47:44.000,181.35,182.2,172.0,179.0,23851239.0,City Union Bank tumbles 9% as RBI finds divergence of additional gross NPA,The Reserve Bank of India found divergence of Rs 259 crore in additional gross NPA for the financial year 2021-22.,negative,neutral,-1.2958367797077444,negative,-1.703910614525146,negative
2022-12-21 10:12:15.000,181.35,182.2,172.0,179.0,23851239.0,City Union Bank share price tumbles after RBI finds divergence of Rs 259 crore gross NPAs,The divergence to the tune of Rs 259 crore consists of 13 borrower accounts with an outstanding balance of more than Rs 1 crore for an amount of Rs 230 crore and 218 borrowers with an outstanding balance of less than Rs1 crore for an amount of Rs 29 crore.,negative,neutral,-1.2958367797077444,negative,-1.703910614525146,negative
2022-12-21 10:31:20.000,181.35,182.2,172.0,179.0,23851239.0,City Union Bank slides as RBI finds divergence of Rs 259 cr in NPAs,"City Union Bank slipped 4.92% to Rs 179.60 after the private lender said that the Reserve Bank of India has discovered divergence in additional gross NPA for the financial year ended March 2022, amounting to Rs 259 crore.",neutral,negative,-1.2958367797077444,negative,-1.703910614525146,negative
2022-12-21 17:30:00.000,179.0,181.15,175.25,175.95,3783970.0,"Stocks in the news: Airtel, Jubilant Ingrevia, City Union Bank, Future Enterprises and more","Stocks to watch out for today: Airtel, Jubilant Ingrevia, City Union Bank, Future Enterprises, VIP Clothing, Shyam Metalics and Energy and more",neutral,neutral,-1.703910614525146,negative,-4.53111557212504,negative
2022-12-21 17:30:00.000,179.0,181.15,175.25,175.95,3783970.0,City Union Bank shares plunge 9% on NPA divergence,"City Union Bank fell 8.94 per cent to hit a low of Rs 172 on BSE. Despite Wednesday’s losses, the scrip is up 43 per cent in the last six months",negative,positive,-1.703910614525146,negative,-4.53111557212504,negative
2022-12-21 22:03:43.000,179.0,181.15,175.25,175.95,3783970.0,Trade setup for today: Top 15 things to know before the opening bell,"Based on the open interest future percentage, a short build-up was seen in a total of 63 stocks on Wednesday including LIC Housing Finance, Max Financial Services, Nifty Financial, City Union Bank, and Dixon Technologies.",neutral,positive,-1.703910614525146,negative,-4.53111557212504,negative
2022-12-23 01:10:29.000,174.35,175.0,165.0,166.45,5253163.0,RBI report sours sentiment for City Union Bank stock,"In the past two days, the bank’s shares are down by nearly 7%. Prior to this, the stock was having a strong run having appreciated by 40% so far in CY22.",neutral,positive,-4.53111557212504,negative,6.878787878787876,positive
2022-12-26 10:04:13.000,165.0,177.35,149.0,176.35,6732130.0,City Union Bank Ltd slips for fifth straight session,"City Union Bank Ltd is quoting at Rs 165.3, down 0.15% on the day as on 09:24 IST on the NSE. The stock jumped 25.23% in last one year as compared to a 4.65% rally in NIFTY and a 19.27% spurt in the Nifty PSU Bank index.",positive,positive,6.878787878787876,positive,-0.895104895104892,neutral
2022-12-26 21:05:18.000,178.75,178.75,174.25,177.15,2284375.0,Trade setup for today: Top 15 things to know before the opening bell,"Based on the open interest future percentage, a total of 119 stocks witnessed short-covering on Monday including Aarti Industries, Firstsource Solutions, HDFC AMC, Deepak Nitrite, and City Union Bank.",neutral,neutral,-0.895104895104892,neutral,-1.6853932584269662,negative
2022-12-28 22:23:39.000,173.6,180.0,170.0,178.05,2624390.0,Trade setup for today: Top 15 things to know before the opening bell,"Based on the open interest future percentage, 81 stocks have seen long unwinding on Wednesday, including Amara Raja Batteries, Ipca Laboratories, City Union Bank, Navin Fluorine International, and Balrampur Chini Mills.",neutral,negative,2.5633640552995494,positive,-0.167130919220062,neutral
2023-01-11 18:17:03.000,167.05,168.0,164.0,165.9,2193718.0,City Union Bank Q3 Net Profit seen up 26.7% YoY to Rs. 248.5 cr: Emkay,"Net Interest Income (NII) is expected to increase by 16.6 percent Y-o-Y (up 0.6 percent Q-o-Q) to Rs. 571.2 crore, according to Emkay.",positive,positive,-0.688416641724038,neutral,-0.4505857614899369,neutral
2023-01-18 06:17:00.000,160.5,160.85,157.2,159.6,5159590.0,Small banks may need to boost provisioning: Analysts,"Even as most banks have strengthened capital buffers post Covid-19, expected credit loss (ECL)-based norms could release existing provisioning for large banks such as ICICI Bank and HDFC Bank, they said, while some small private players like City Union Bank and DCB Bank may have to accelerate provis…",neutral,positive,-0.5607476635514054,neutral,-0.3759398496240566,neutral
2023-01-30 14:04:27.000,153.1,159.5,151.9,158.1,2884317.0,City Union Bank Ltd drops for fifth straight session,"City Union Bank Ltd is quoting at Rs 151.1, down 0.3% on the day as on 13:19 IST on the NSE. The stock jumped 5.11% in last one year as compared to a 0.82% rally in NIFTY and a 6.79% spurt in the Nifty PSU Bank index.",neutral,positive,3.265839320705421,positive,-3.439649781113196,negative
2023-01-31 22:27:37.000,159.9,160.55,152.25,154.4,1714284.0,Trade setup for Budget day: Top 15 things to know before the opening bell,"Based on the OI percentage, 81 stocks were on the short-covering list, including Chambal Fertilisers, City Union Bank, Atul, UltraTech Cement, and IDFC First Bank",neutral,neutral,-3.439649781113196,negative,1.291155584247902,positive
2023-02-06 22:23:32.000,158.9,160.2,156.85,159.55,1936228.0,Trade setup for today: Top 15 things to know before the opening bell,"Based on the OI percentage, a long build-up was seen in 72 stocks including Navin Fluorine International, Alkem Laboratories, City Union Bank, Zydus Life Sciences, and Info Edge India",neutral,positive,0.4090623033354347,neutral,0.3764115432873239,neutral
2023-02-08 01:26:50.000,159.4,160.35,155.15,160.0,2374499.0,City Union Bank hands over 2 Golf Cart to Shree Somnath Temple Trust,City Union Bank hands over 2 Golf Cart to Shree Somnath Temple Trust,neutral,neutral,0.3764115432873239,neutral,-0.909090909090902,negative
2023-02-12 16:26:45.000,157.0,157.0,133.1,135.5,27667683.0,CUB mBank Plus: How to open fixed deposit in City Union Bank online,Guide to create FD with City Union Bank’s mobile banking app,neutral,neutral,-13.694267515923569,negative,2.370370370370362,positive
2023-02-13 10:31:32.000,157.0,157.0,133.1,135.5,27667683.0,City Union Bank Q3 PAT rises 11% YoY to Rs 218 cr,"The private sector bank’s net profit rose 11% to Rs 217.84 crore on 20% rise in total income to Rs 1,429.98 crore in Q3 FY23 over Q3 FY22.",positive,positive,-13.694267515923569,negative,2.370370370370362,positive
2023-02-13 11:24:30.000,157.0,157.0,133.1,135.5,27667683.0,City Union Bank shares crash 13.5% after Q3 earnings dip on quarterly basis,"According to analysts, CUB’s results had several areas of weakness this quarter",negative,negative,-13.694267515923569,negative,2.370370370370362,positive
2023-02-13 15:31:22.000,135.0,141.3,132.25,138.2,20334603.0,EKI Energy Services Ltd leads losers in ‘A’ group,"City Union Bank Ltd, IDFC Ltd, Balkrishna Industries Ltd and Info Edge (India) Ltd are among the other losers in the BSE’s ‘A’ group today, 13 February 2023.",positive,negative,2.370370370370362,positive,0.0,neutral
2023-02-13 17:30:00.000,135.0,141.3,132.25,138.2,20334603.0,City Union Bank shares dive 17% after Q3 results; here’s what analysts say,"City Union Bank share price: The private sector lender reported a net profit of Rs 217.84 crore for Q3 FY23, down 21.20 per cent quarter-on-quarter (QoQ) from Rs 276.45 crore in Q2 FY23. City Union Bank’s profit in Q3 FY22 came at Rs 196.12 crore.",positive,negative,2.370370370370362,positive,0.0,neutral
2023-02-13 22:42:50.000,135.0,141.3,132.25,138.2,20334603.0,Trade setup for today: Top 15 things to know before the opening bell,"Based on the OI percentage, 81 stocks, including City Union Bank, Coforge, Lupin, BHEL, and Info Edge India, saw a short build-up",neutral,positive,2.370370370370362,positive,0.0,neutral
2023-02-14 01:57:25.000,135.0,141.3,132.25,138.2,20334603.0,City Union Bank reports Q3 net at Rs 217.83 cr,City Union Bank reports Q3 net at Rs 217.83 cr,neutral,neutral,2.370370370370362,positive,0.0,neutral
2023-02-15 20:55:10.000,139.0,142.1,138.0,141.0,5411076.0,Buy City Union Bank; target of Rs 190: Prabhudas Lilladher,"Prabhudas Lilladher is bullish on City Union Bank has recommended buy rating on the stock with a target price of Rs 190 in its research report dated February 12, 2023.",neutral,positive,1.4388489208633095,positive,-0.682226211849184,neutral
2023-02-16 10:21:56.000,139.0,142.1,138.0,141.0,5411076.0,"After a rough Q3, City Union Bank’s path remains uncertain",City Union Bank’s management expects the slippages to stay elevated in the coming quarters and has revised its full-year FY23 slippage guidance to 2.5-2.8% versus 2.25-2.5% earlier.,negative,negative,1.4388489208633095,positive,-0.682226211849184,neutral
2023-02-16 22:43:48.000,139.25,143.6,137.2,138.3,6415255.0,Trade setup for today: Top 15 things to know before the opening bell,"Based on the open interest percentage, as many as 55 stocks were on the short-covering list. These included City Union Bank, Lupin, MCX India, Torrent Power, and Bajaj Finserv.",neutral,neutral,-0.682226211849184,neutral,-1.291711517761021,negative
2023-02-20 22:24:41.000,138.0,138.85,134.75,135.05,2462578.0,‘City Union Bank’s FY23 growth target hit by slowdown in capex cycle’,CUB’s provision coverage ratio improved to 67% and the bank was pushing it to more than 70%.,negative,positive,-2.1376811594202816,negative,-1.6044776119403026,negative
2023-02-21 15:06:19.000,134.0,135.5,131.6,131.85,4095630.0,Accumulate City Union Bank; target of Rs 159: Geojit,"Geojit recommended accumulate rating on City Union Bank with a target price of Rs 159 in its research report dated February 20, 2023.",neutral,positive,-1.6044776119403026,negative,-0.1503759398496155,neutral
2023-02-28 22:45:21.000,138.45,141.8,138.45,141.5,3031275.0,Trade setup for today: Top 15 things to know before the opening bell,"Based on the OI percentage, as many as 54 stocks were on the short-covering list. These included Adani Enterprises, Power Grid Corporation of India, City Union Bank, MCX India, and REC",neutral,neutral,2.202961357890944,positive,0.3556187766714082,neutral
2023-03-07 12:25:05.000,142.5,143.0,139.5,142.0,4322542.0,City Union Bank rolls out credit card in tie-up with 42 Card Solutions,42 Card Solutions will manage end-to-end credit card processing services for City Union Bank,neutral,neutral,-0.3508771929824561,neutral,-1.1599297012302323,negative
2023-03-07 19:57:03.000,142.5,143.0,139.5,142.0,4322542.0,City Union Bank rolls out credit card in partnership with 42 CS,CHENNAI,neutral,neutral,-0.3508771929824561,neutral,-1.1599297012302323,negative
2023-03-08 12:16:03.000,142.25,142.9,139.75,140.6,2964985.0,City Union Bank appoints Kalyanaraman M as chief risk officer,"City Union Bank announced that its board has approved the appointment of Kalyanaraman M, as the chief risk officer (CRO) of the company for a period of one year.",neutral,positive,-1.1599297012302323,negative,-1.3933547695605493,negative
2023-03-09 15:43:06.000,139.95,139.95,137.05,138.0,5866759.0,Hold City Union Bank; target of Rs 176: Sharekhan,"Sharekhan recommended hold rating on City Union Bank with a target price of Rs 176 in its research report dated February 10, 2023.",neutral,positive,-1.3933547695605493,negative,-2.6011560693641576,negative
2023-03-13 15:00:01.000,133.75,137.2,132.25,134.95,4685994.0,City Union Bank: Reset MPIN online using CUB mBank Plus app,5 steps to reset MPIN to access mobile banking,neutral,neutral,0.8971962616822345,neutral,-2.4972456849063573,negative
2023-04-06 21:20:17.000,125.65,126.4,124.3,125.15,3186230.0,Find Out Which Banks Went On To Hike Their FD Rates In April 2023,"Axis Bank, Canara Bank and City Union Bank have hiked their fixed deposit rates effective from 5th April 2023",neutral,positive,-0.3979307600477516,neutral,-0.554016620498606,neutral
2023-04-10 22:47:47.000,126.55,127.55,124.5,124.95,2893868.0,Trade setup for today: Top 15 things to know before the opening bell,"Based on the OI percentage, 67 stocks, including Tata Motors, Godrej Properties, ONGC, City Union Bank, and Chambal Fertilizers, saw long build-ups.",neutral,neutral,-1.26432240221256,negative,-0.6778309409888426,neutral
2023-04-12 10:18:01.000,125.4,125.7,123.7,124.55,2198731.0,City Union Bank Q4 Net Profit seen up 16.1% YoY to Rs. 242.7 cr: Prabhudas Lilladher,"Net Interest Income (NII) is expected to increase by 14.2 percent Y-o-Y (up 2.9 percent Q-o-Q) to Rs. 571.6 crore, according to Prabhudas Lilladher.",positive,positive,-0.6778309409888426,neutral,0.3968253968253968,neutral
2023-04-12 19:07:56.000,126.0,127.8,124.2,126.5,4397095.0,Cub customers can use their voice to login,"City Union Bank Ltd., (CUB) in association with Kaizen Secure Voiz Pvt. Ltd., has rolled out voice biometric authentication for logging into its mobile banking application",neutral,neutral,0.3968253968253968,neutral,2.569169960474309,positive
2023-04-12 19:39:02.000,126.0,127.8,124.2,126.5,4397095.0,"Now, open your City Union Bank banking app with a voice command","Now, open your City Union Bank banking app with a voice command",neutral,neutral,0.3968253968253968,neutral,2.569169960474309,positive
2023-04-17 06:30:00.000,126.5,130.2,126.1,129.75,4712124.0,City Union Bank is this week’s stock pick: Three reasons why,The bank has maintained a growth CAGR of 15% in the past 10 years and is expanding its presence in the northern states by offering various innovative products.,neutral,positive,2.569169960474309,positive,-0.535372848948366,neutral
2023-04-20 22:57:25.000,133.6,133.6,128.75,130.2,5089927.0,Trade setup for today: Top 15 things to know before the opening bell,"Based on the OI percentage, 70 stocks, including ICICI Prudential Life Insurance, City Union Bank, Navin Fluorine International, HDFC AMC, and Jubilant Foodworks, saw long build-ups.",neutral,neutral,-2.544910179640723,negative,2.131709173962704,positive
2023-04-21 09:47:00.000,133.6,133.6,128.75,130.2,5089927.0,Sudip Bandyopadhyay is gung-ho on mid-sized banks & NBFCs. Here’s why,"Sudip Bandyopadhyay is positive about the BFSI sector, particularly mid-sized banks and NBFCs. He notes that the Catholic Syrian Bank is exciting, while City Union Bank is fundamentally strong despite negative news flow, and Federal Bank is an excellent, stable bank. Bandyopadhyay recommends that lo…",neutral,positive,-2.544910179640723,negative,2.131709173962704,positive
2023-04-23 18:58:40.000,131.35,135.2,129.75,134.15,4390152.0,Trade setup for today: Top 15 things to know before the opening bell,"Based on the OI percentage, 71 stocks, including PVR, Max Financial Services, Tech Mahindra, RBL Bank, and City Union Bank, saw a short buildup.",neutral,neutral,2.131709173962704,positive,-0.8575689783743518,neutral
2023-04-26 19:26:36.000,144.0,146.0,137.8,139.3,28734933.0,N Kamakodi reappointed as MD & CEO of CUB for 3 years,N Kamakodi will continue as the Managing Director & CEO of the old private sector bank City Union Bank (CUB) for another three years as RBI has given its nod for his re-appointment.,neutral,neutral,-3.263888888888881,negative,1.1416339636104131,positive
