date,open,high,low,close,volume,title,description,title_sentiment,desc_sentiment,daily_change_pct,market_sentiment,next_day_change_pct,next_day_sentiment
2017-12-14 18:01:42.934,536.95,540.15,534.2,536.9,671239.0,Glenmark completes Phase 3 clinical trial for Ryaltris,Glenmark Pharmaceuticals has completed Phase 3 study of its investigational fixed-dose,neutral,positive,-0.0093118539901421,neutral,0.242085661080066,neutral
2017-12-27 18:02:02.848,586.9,598.1,581.8,595.0,2034385.0,Glenmark Pharma shares gain 3% on USFDA approval for birth control pill,Glenmark's current portfolio consists of 130 products authorised for distribution in the US marketplace and 58 ANDA's pending approval with the US FDA.,positive,neutral,1.3801329016868331,positive,-0.1258389261744966,neutral
2018-02-09 13:00:57.131,540.0,543.95,524.35,536.0,6567234.0,Glenmark Pharma Q3 profit falls 78% to Rs104.7 crore,Glenmark Pharma net profit dropped 78% to Rs104.7 crore for the quarter ended December on sharp decline of US sales,negative,negative,-0.7407407407407408,neutral,-0.8796296296296297,neutral
2018-02-09 13:01:00.991,540.0,543.95,524.35,536.0,6567234.0,Glenmark Pharma hits 44-month low,"Shares of Glenmark Pharmaceuticals hit 44-month low on disappointing Q3 results. The stock dropped as much as 9.6 per cent to Rs 524, lowest since May 28, 2014. The stock posted biggest intraday perce",negative,negative,-0.7407407407407408,neutral,-0.8796296296296297,neutral
2018-02-22 13:00:52.824,525.0,536.5,525.2,534.85,927232.0,Glenmark ties up with S. Korea’s SCD for ophthalmic products,"Glenmark Pharmaceuticals has entered into an exclusive agreement with South Korea’s Sam Chun Dang Pharm Co Ltd (SCD) to develop, manufacture and market a portfolio of ophthalmic products in the US and",neutral,positive,1.8761904761904808,positive,0.4865269461077887,neutral
2018-02-22 18:01:17.121,525.0,536.5,525.2,534.85,927232.0,Glenmark Pharma rises 1%; enters into agreement with SCD Pharma,"Under this agreement, these products will be developed and manufactured by SCD in South Korea.",positive,neutral,1.8761904761904808,positive,0.4865269461077887,neutral
2018-03-01 13:00:36.033,546.75,550.9,541.0,542.2,972650.0,Glenmark Pharmaceuticals launches hair growth formula,"Glenmark Pharmaceuticals has launched Nourkrin Woman, a clinically-proven proteoglycan replacement formula, for normalising hair growth cycle, the company has said.The product will be exclusively mark",neutral,neutral,-0.832190214906256,neutral,1.8450184501845015,positive
2018-03-21 13:01:10.014,545.85,549.8,541.3,543.8,675913.0,Ideas to Innovation series: In conversation with the EY Entrepreneur of the Year Award Winner 2017 (Part 6),"​ Exclusive interview with Sunder Genomal, Managing Director, Page Industries and Glenn Saldanha, Chairman and MD, Glenmark Pharmaceuticals",neutral,neutral,-0.3755610515709568,neutral,-0.3551401869158836,neutral
2018-03-27 18:01:54.276,540.0,541.0,524.0,524.0,1117009.0,Glenmark gets USFDA nod for psoriasis spray,Glenmark Pharmaceuticals has received final nod from the US health regulator for its Clobetasol Propionate spray used for the treatment of moderate to severe plaque psoriasis in adults.Glenmark Pharma,neutral,positive,-2.9629629629629632,negative,4.408571698291329,positive
2018-04-04 18:00:43.337,551.3,567.6,550.25,558.0,782396.0,"Glenmark, Helsinn Group tie up for sale of anti-emetic drug in India, Nepal","Glenmark Pharmaceuticals today said it has signed a licensing agreement with Swiss pharma player Helsinn Group to introduce ‘Akynzeo’ in India and Nepal, a drug that helps prevent chemo-related nausea",neutral,positive,1.2153092690005525,positive,1.7269439421338073,positive
2018-04-05 18:02:51.537,553.0,565.8,547.0,562.55,588767.0,Glenmark recalls over 1 lakh bottles of anti-inflammatory drug in US,"Glenmark Pharmaceuticals Inc USA is recalling 109,080 bottles of Indomethacin capsules USP, 50 mg, 100-count bottle, manufactured by Glenmark Pharmaceuticals at its Goa plant, USFDA said.",negative,negative,1.7269439421338073,positive,0.3475316342897757,neutral
2018-04-17 13:00:27.967,579.0,584.9,564.25,567.45,904767.0,Glenmark Pharma initiates phase 2b clinical trial of atopic dermatitis drug,"Glenmark Pharmaceuticals has initiated phase 2b clinical trial of GBR 830, a novel investigational treatment for moderate-to-severe atopic dermatitis. “The trial’s primary endpoint will assess the eff",neutral,positive,-1.9948186528497327,negative,-1.1842105263157896,negative
2018-04-18 13:00:48.122,570.0,571.2,561.45,563.25,664201.0,Glenmark gets USFDA nod for skin ointment,Glenmark Pharmaceuticals has received final approval from the US health regulator for Tacrolimus ointment used for treating atopic dermatitis (eczema). Glenmark Pharmaceuticals Inc USA has been grante,neutral,positive,-1.1842105263157896,negative,1.4968999114260488,positive
2018-05-11 13:00:35.936,518.0,518.4,505.5,514.6,672670.0,Glenmark Pharma gets USFDA nod for skin treatment cream,Glenmark Pharmaceuticals said it has received final approval from the US health regulator for the generic version of Temovate cream used to treat inflammation and itching caused by a number of skin co,neutral,positive,-0.656370656370652,neutral,-2.768635043562442,negative
2018-05-15 18:00:34.233,507.0,521.0,502.7,518.9,536100.0,"Tata Motors, ACC, PFC, REC hit 52-week low","Reliance Capital, Reliance Naval, Unitech, Vakrangee, Laurus Labs, Glenmark Pharma, Capital First and Allahabad Bank were among 29 stocks from the BSE500 index hit their respective 52-week lows.",neutral,neutral,2.3471400394477278,positive,1.4946962391513985,positive
2018-05-16 13:00:23.317,518.5,530.95,516.0,526.25,767057.0,Glenmark Pharma launches generic version of asthma drug in Denmark,"Glenmark Pharmaceuticals Europe Ltd has launched a generic version of Seretide Accuhaler, used to treat asthma, in Denmark. The product was developed by Celon Pharma and Glenmark has the marketing and",neutral,neutral,1.4946962391513985,positive,-4.522900763358777,negative
2018-05-16 13:02:10.969,518.5,530.95,516.0,526.25,767057.0,Glenmark Pharma launches generic version of asthma drug in Denmark,The product was developed by Celon Pharma and Glenmark has marketing and distribution rights for the product across 15 European countries.,neutral,neutral,1.4946962391513985,positive,-4.522900763358777,negative
2018-05-17 10:01:50.681,518.5,530.95,516.0,526.25,767057.0,Glenmark introduces inhaler in Denmark,Glenmark Pharmaceuticals Europe Ltd. has unveiled a generic version of Seretide Accuhaler in Denmark. Glenmark on Wednesday said this was the company’s first inhaled respiratory product introduction i,neutral,neutral,1.4946962391513985,positive,-4.522900763358777,negative
2018-05-21 13:00:21.611,500.0,513.8,498.05,513.2,783562.0,Glenmark gets USFDA nod for generic version of Welchol tablets,"Glenmark Pharma said it has already commenced supplies of Colesevelam Hydrochloride tablets, 625 mg, the generic version of Daiichi Sankyo’s Welchol tablets, 625 mg, in the US market",neutral,positive,2.640000000000009,positive,0.1934235976789168,neutral
2018-05-22 13:01:07.919,517.0,524.0,512.0,518.0,924867.0,Glenmark Pharma submits new drug application for Ryaltris,"Glenmark Pharmaceuticals has submitted a new drug application with the US health regulator for its nasal spray Ryaltris, used for the treatment of seasonal allergic rhinitis (SAR) in patients of 12 ye",neutral,positive,0.1934235976789168,neutral,1.8629343629343584,positive
2018-05-29 23:00:44.995,505.5,532.0,505.5,527.0,3517822.0,Glenmark Pharmaceuticals posts Q4 profit at Rs151 crore,Glenmark Pharmaceuticals reports a consolidated net profit of Rs151.62 crore for the fourth quarter ended March 2018,neutral,neutral,4.253214638971316,positive,2.201138519924103,positive
2018-05-30 10:01:57.719,505.5,532.0,505.5,527.0,3517822.0,Glenmark Pharma hits 52-week low on weak Q4; price erosion in US rises to 12%,"Revenue of the company was down 7 percent at Rs 2,279.8 crore against Rs 2,457.7 crore",negative,negative,4.253214638971316,positive,2.201138519924103,positive
2018-05-30 13:02:36.793,527.0,540.25,516.5,538.6,1461390.0,Glenmark Pharma drops to over 3-month low,"Glenmark Pharmaceuticals dropped the most in over 3 months. The stock fell nearly 5 per cent to Rs 505.5, its lowest since May 22.The stock posted its biggest intraday percentage loss since February 9",negative,negative,2.201138519924103,positive,1.0673467460092525,positive
2018-06-01 10:00:57.220,529.35,544.35,529.35,535.0,908447.0,"Hold  Glenmark Pharmaceuticals, Rs  530:   Edelweiss",Hold  Glenmark Pharmaceuticals Ltd.  at a price target of Rs  530.0    .,neutral,positive,1.0673467460092525,positive,0.9328358208955224,positive
2018-06-01 10:01:57.324,529.35,544.35,529.35,535.0,908447.0,Glenmark Pharma hits 52-week low on subdued Q4 results,"The stock hit a fresh 52-week low of Rs 484, slipped 9% on the BSE in early morning trade, after the company reported 17% decline in its consolidated net profit at Rs 1.52 billion in March quarter.",negative,negative,1.0673467460092525,positive,0.9328358208955224,positive
2018-06-06 13:00:54.220,542.0,545.55,533.4,537.0,762915.0,Glenmark gets USFDA nod for contraceptive drugs,"Glenmark Pharmaceuticals has received final approval from the US health regulator for generic versions of Loestrin tablets, used to prevent pregnancy. “Glenmark Pharmaceuticals Inc., USA has been gran",neutral,positive,-0.9225092250922508,negative,3.826151560178311,positive
2018-06-06 18:03:00.226,542.0,545.55,533.4,537.0,762915.0,Glenmark Pharmaceuticals gets USFDA nod for contraceptive drugs,The company's current portfolio consists of 137 products authorised for distribution at the US marketplace and 61 Abbreviated New Drug Applications (ANDAs) pending approval with the USFDA.,neutral,neutral,-0.9225092250922508,negative,3.826151560178311,positive
2018-06-08 13:00:37.657,538.4,560.0,536.25,559.0,1192447.0,Pharma shares in focus as Nifty Pharma index rises 2%,"Sun Pharma, Cadila Healthcare, Dr Reddy's Laboratories, Cipla, Glenmark Pharma and Lupin from the Nifty Pharma index were up in the range of 2% to 3% on the NSE.",positive,positive,3.826151560178311,positive,0.4025044722719141,neutral
2018-06-18 10:00:33.818,585.9,591.65,575.5,582.2,883440.0,Stock market prediction for June 18-22: Satish Gupta,"Lupin, Ajanta Pharma, Alembic Pharma, Glenmark Pharma, Aurobindo Pharma and Sun Pharmaceutical Industries will get astrological support, says Satish Gupta of astrostocktips.",neutral,positive,-0.6315070831199747,neutral,0.3504273504273426,neutral
2018-06-19 13:00:30.771,592.95,596.8,584.25,592.35,1042871.0,Glenmark Pharma rises 3% on USFDA approval for Monroe facility,"The US Food & Drug Administration (USFDA) provided its first supplemental abbreviated new drug application (sANDA) approval for the company’s manufacturing facility in Monroe, North Carolina.",positive,positive,-0.1011889704022299,neutral,0.6616969595443389,neutral
2018-06-19 18:01:32.525,592.95,596.8,584.25,592.35,1042871.0,USFDA approves 1st product from Glenmark's North Carolina plant,"Glenmark Pharmaceuticals has got approval from US health regulator for the first product from its Monroe, North Carolina-based manufacturing facility.The US Food and Drug Administration (USFDA) has pr",neutral,positive,-0.1011889704022299,neutral,0.6616969595443389,neutral
2018-07-06 13:00:32.020,582.9,591.85,580.0,580.0,857055.0,"Glenmark inks pact with Seqirus to commercialise Ryaltris in Australia, New Zealand",Glenmark Pharma today said its subsidiary Glenmark Specialty has entered into an exclusive licensing agreement with Australia’s Seqirus to commercialise its nasal spray Ryaltris in Australia and New Z,positive,positive,-0.4975124378109413,neutral,-0.6580071782601303,neutral
2018-07-12 13:01:38.324,571.0,575.1,561.0,565.6,442952.0,Glenmark launches Akynzeo in India under licensing pact with Helsinn,"Glenmark Pharmaceuticals today launched Akynzeo, a drug used for prevention chemotherapy-induced nausea and vomiting, in India and Nepal.",neutral,neutral,-0.9457092819614672,negative,-1.6130469655110873,negative
2018-07-13 23:02:09.448,571.0,575.1,561.0,565.6,442952.0,"CCI penalises Glenmark Pharma, other entities for unfair business practices",All the entities have been fined for violating competition norms with regard to mandating no-objection certificates (NOC) from the associations prior to appointing entities as stockists.,negative,negative,-0.9457092819614672,negative,-1.6130469655110873,negative
2018-07-16 13:00:30.939,558.0,566.9,552.3,565.1,728608.0,Glenmark falls 2.4% as CCI slaps Rs 47 cr penalty,"Shares of Glenmark Pharmaceuticals fell as much as 2.4 per cent to Rs 551.50, their lowest since June 8, on CCI penalty.The Competition Commission has imposed a penalty totalling nearly Rs 47 crore on",neutral,negative,1.2724014336917604,positive,-1.488306165839826,negative
2018-07-17 10:02:35.206,558.0,566.9,552.3,565.1,728608.0,Glenmark Pharma gains 1% on USFDA nod; acquires 100% in Zorg,"Glenmark Pharmaceuticals Inc., USA has been granted final approval by the United States Food & Drug Administration (USFDA) for Colesevelam Hydrochloride for Oral Suspension, 1.875 grams/Packet and 3.75 grams/Packet.",positive,positive,1.2724014336917604,positive,-1.488306165839826,negative
2018-07-17 13:00:10.138,564.4,570.0,547.65,556.0,566295.0,Glenmark shares jump over 2%,"Shares of Glenmark Pharmaceuticals climbed as much as 2.1 per cent to Rs 563 as the company has received final approval from the US health regulator for Colesevelam Hydrochloride for oral suspension,",positive,positive,-1.488306165839826,negative,0.9009009009009008,positive
2018-07-17 13:02:01.911,564.4,570.0,547.65,556.0,566295.0,Glenmark Pharma gets USFDA nod for cholesterol lowering drug,"Glenmark Pharmaceuticals has received final approval from the US health regulator for Colesevelam Hydrochloride for oral suspension, used to lower cholesterol levels in the blood. The approval has bee",neutral,positive,-1.488306165839826,negative,0.9009009009009008,positive
2018-07-26 13:00:52.907,568.9,579.5,566.55,573.6,320402.0,Study suggests similarity between biosimilar GBR 310 and omalizumab: Glenmark,Glenmark Pharma said that results from a study suggests similarity between  biosimilar GBR 310 and the reference product omalizumab.,neutral,neutral,0.8261557391457279,neutral,1.0107170863465984,positive
2018-08-02 18:00:27.522,587.5,600.35,587.5,596.2,826371.0,Pharma shares in focus; Nifty Pharma index hits 6-month high,"Divi's Lab, Aurobindo Pharma, Lupin, Dr Reddy's Lab, Sun Pharma, Glenmark Pharma and Cipla from the Nifty pharma index were up in the range of 1% to 3% on the NSE.",neutral,positive,1.480851063829795,positive,-0.066522534508561,neutral
2018-08-06 13:00:18.819,599.95,601.0,583.6,591.6,738321.0,How Edsel Pereira revitalised Glenmark with a booster dose of IT innovations,"IT is critical to the competitive health of Glenmark, says Edsel Pereira, Group Vice President-IT at Glenmark Pharmaceuticals",positive,neutral,-1.39178264855405,negative,-0.7927137797267553,neutral
2018-08-09 23:00:41.556,599.9,599.9,585.25,590.35,486715.0,"SBI, NHPC, Hindalco, Sun TV, PC Jeweller, results","Andhra Bank, Apollo Hospitals, Allcargo Logistics, Bosch, DLF, Dr Lal Path, Deep Industries, GAIL, GE Shipping, Glenmark Pharma, Hindalco, Indian Hotels, JB Chemicals, Kirloskar Oil, Max India, Max Ve",neutral,neutral,-1.59193198866477,negative,1.3737935831666972,positive
2018-08-10 23:02:45.538,599.9,599.9,585.25,590.35,486715.0,Glenmark Pharma Q1 profit at ₹232.99 crore,"Glenmark Pharma reported consolidated net profit of ₹232.99 crore in the first quarter ended 30 June 2018, as against  ₹333.38 crore in the same quarter last fiscal",neutral,positive,-1.59193198866477,negative,1.3737935831666972,positive
2018-08-24 18:02:20.196,651.75,663.5,633.05,660.9,1415350.0,"D-Street Buzz: Metals shine led by Hindustan Zinc, JSW Steel; Pfizer zooms 12%, hits fresh 52-week high","36 stocks are trading at new 52-week high including names like Bajaj Finance, Bata India, Bombay Burmah, Exide Industries, Glenmark Pharma, JSW Steel, Jubilant Food, Kaveri Seed, Marico, Mphasis, Reliance Industries and United Breweries.",positive,neutral,1.403912543153046,positive,-1.0890115707479289,negative
2018-08-27 18:02:03.800,654.0,662.2,641.55,643.95,775385.0,"D-Street Buzz: Bulls charge ahead with PSU banks outperforming; ICICI Bank jumps 3%, RIL hits new record high","53 stocks are trading at new 52-week high including names like Axis Bank, Bajaj Finance, Dabur India, Divis Labs, GSK Pharma, Glenmark Pharma, Havells India, JSW Steel, Reliance Industries, Mphasis and VIP Industries among others.",positive,neutral,-1.536697247706415,negative,-0.6316438145124053,neutral
2018-08-29 13:00:11.730,649.5,664.0,643.7,663.0,1130521.0,Glenmark inks licensing pact for marketing Tiotropium Bromide DPI in Europe,"Glenmark Pharmaceuticals Europe has entered into an exclusive licensing agreement for marketing generic Tiotropium Bromide dry powder inhaler, used in the treatment of chronic obstructive pulmonary di",neutral,positive,2.07852193995381,positive,0.037593984962406,neutral
2018-08-29 13:01:26.760,649.5,664.0,643.7,663.0,1130521.0,Glenmark Pharma signs pact to market Tiotropium Bromide dry powder inhaler in Western Europe,"Glenmark Pharmaceuticals EVP & Business Head of Europe and Latin America Achin Gupta said, respiratory is a core area of focus for Glenmark and this deal shows our commitment to increase product offerings within this segment.

",neutral,positive,2.07852193995381,positive,0.037593984962406,neutral
2018-08-31 13:00:23.067,665.0,671.6,657.2,665.25,1735321.0,"D-Street Buzz: IT & pharma stocks outperform with Tech Mahindra, Lupin up 3%; RIL falls 2%","Abbott, Divis Labs, Glenmark Pharma, Godrej Consumer, Infosys, ITC, Sun Pharma and Whirlpool are some of the few stocks which have hit new 52-week high in the afternoon trade.",positive,neutral,0.037593984962406,neutral,-1.4754098360655703,negative
2018-09-06 18:00:10.910,681.0,692.0,674.0,683.25,1229797.0,"Sun Pharma, Glenmark Pharma, Hikal hit 52-week highs; Aurobindo surges 8%","Granules India, Hikal, Pfizer, Lincoln Pharmaceuticals, Astrazeneca Pharma India and Aarti Drugs were up between 4% and 7%.",positive,positive,0.3303964757709251,neutral,0.1605839416058427,neutral
2018-09-07 13:00:13.110,681.0,692.0,674.0,683.25,1229797.0,"Aurobindo Pharma, Glenmark Pharma hit 52-week highs","Aurobindo Pharma was up 9% at Rs 826, surging 22% in past three trading days after the company on Thursday announced the acquisition of Sandoz's generic business in the US for $900 million.",positive,positive,0.3303964757709251,neutral,0.1605839416058427,neutral
2018-09-10 10:01:14.993,685.0,711.9,682.0,686.1,2618921.0,Glenmark Pharma rises 1% on marketing rights for asthma drug in Germany,"The company has already launched this product in Denmark, Sweden and Norway.",neutral,neutral,0.1605839416058427,neutral,-2.955843029558437,negative
2018-09-10 13:00:28.987,691.85,694.6,667.9,671.4,1308387.0,Glenmark Pharma rallies on Germany marketing nod,"The drug, Fluticasone/Salmeterol dry powder inhaler (DPI), is a generic version of GlaxoSmithKlines Seretide Accuhaler.
",neutral,neutral,-2.955843029558437,negative,0.9501009949876597,positive
2018-09-10 13:00:34.634,691.85,694.6,667.9,671.4,1308387.0,Glenmark Pharma arm gets nod for generic version of asthma drug in Germany,"Glenmark Pharmaceuticals Executive Vice President and Business Head of Europe and Latin America, Achin Gupta, said that upon launch, generic Fluticasone/Salmeterol DPI will be Glenmark's first inhalation product available in Germany.

",neutral,neutral,-2.955843029558437,negative,0.9501009949876597,positive
2018-09-17 10:02:47.209,692.2,705.0,673.8,680.3,1471625.0,"Lupin, Dr Reddy's Labs, Wipro, Tech Mahindra will get astrological support for the week: Satish Gupta","Pharma stocks like Glenmark Pharma,   Strides Pharma, Lupin, Ajanta Pharma, Dr Reddy’s Labs will get astrological support, says Satish Gupta of astrostocktips.",neutral,positive,-1.7191563132042893,negative,0.3826342899190614,neutral
2018-09-17 13:01:21.759,679.5,689.8,676.0,682.1,760463.0,Glenmark Pharma gets USFDA nod for menopause symptom relief drug,Glenmark Pharma gets USFDA nod for menopause symptom relief drug,neutral,neutral,0.3826342899190614,neutral,-2.19691993285161,negative
2018-09-17 18:01:11.064,679.5,689.8,676.0,682.1,760463.0,Glenmark Pharma gets final USFDA nod for menopause symptom relief drug,The approved product is a generic version of Novo Nordisk Inc's VAGIFEM,neutral,neutral,0.3826342899190614,neutral,-2.19691993285161,negative
2018-09-17 18:01:27.031,679.5,689.8,676.0,682.1,760463.0,Glenmark gets USFDA nod for menopause symptom relief drug,"Glenmark Pharmaceuticals has received final approval from the US health regulator for generic version of Nordisk Inc’s VAGIFEM, which is used for providing relief from menopause symptom.“Glenmark Phar",neutral,positive,0.3826342899190614,neutral,-2.19691993285161,negative
2018-09-25 13:02:19.254,640.85,659.3,640.85,654.0,1381529.0,Glenmark Pharma gains over 2% on reports of zero observations from USFDA for Baddi plant,The health regulator had begun its inspection of Glenmark Pharma's facility on September 17.,positive,neutral,2.0519622376531133,positive,-2.25375626043406,negative
2018-09-26 13:00:46.771,658.9,660.6,638.4,644.05,742479.0,Glenmark Pharma considers buyback of Singapore FCCBs; stock jumps 3%,Glenmark Pharma said its operations committee would consider opportunistic tenders or buybacks of any part of its Singapore listed foreign currency convertible bonds.,positive,neutral,-2.25375626043406,negative,-2.219462983082408,negative
2018-10-10 10:02:42.266,593.85,600.25,585.0,598.5,482465.0,Glenmark Pharma up 1% on transfer of API biz to subsidiary co,The transaction is expected to be completed in the next 2-3 months.,neutral,neutral,0.7830260166708727,neutral,1.2894468951476117,positive
2018-10-10 10:02:49.611,593.85,600.25,585.0,598.5,482465.0,Dr Reddy's launches cholesterol lowering Colesevelam HCl tablets in US,"Alkem Labs, Glenmark Pharmaceuticals and Impax Labs were also granted product approval to manufacture and market Colesevelam HCl tablets by the US drug regulator",neutral,positive,0.7830260166708727,neutral,1.2894468951476117,positive
2018-10-15 18:01:51.032,612.5,620.9,599.45,607.0,819703.0,Glenmark gets USFDA nod for generic Westcort cream,Drug firm Glenmark Pharmaceuticals Monday said it has received final nod from the US health regulator for generic Hydrocortisone Valerate cream used for providing relief in inflammation and itching du,neutral,positive,-0.8979591836734694,neutral,-1.5455442288720964,negative
2018-10-17 23:00:10.277,608.2,611.75,595.0,598.8,528940.0,Glenmark Pharma Q2 PAT seen up 2.8% YoY to Rs. 210 cr: HDFC Securities,"Net Sales are expected to increase by 10.3 percent Y-o-Y (up 15.2 percent Q-o-Q) to Rs. 2,450 crore, according to HDFC Securities.",positive,positive,-1.5455442288720964,negative,0.6891914607497097,neutral
2018-10-30 13:00:32.038,606.4,624.4,605.05,620.0,730236.0,Glenmark gets USFDA nod for generic Derma-Smoothe Topical Oil,"Glenmark Pharmaceuticals Tuesday said it has received final approval from the US health regulator for generic version of Derma-Smoothe Topical Oil, used in the treatment of scalp psoriasis. &ldquo;Gle",neutral,positive,2.242744063324542,positive,0.6835544833132288,neutral
2018-10-30 13:00:50.398,606.4,624.4,605.05,620.0,730236.0,Glenmark pharma gets USFDA nod for generic Derma-Smoothe Topical Oil,The company's current portfolio consists of 141 products authorised for distribution at the US marketplace and 58 Abbreviated New Drug Applications (ANDAs) pending approval with the USFDA,neutral,neutral,2.242744063324542,positive,0.6835544833132288,neutral
2018-10-31 23:01:00.366,621.75,633.3,615.25,626.0,708334.0,"Piramal Consumer COO Kedar Rajadnye quits, set to join PE fund True North","Rajadney will be appointed as the CEO of Integrace Pvt Ltd, the orthopaedic & pain management business acquired from Glenmark Pharmaceuticals.
",neutral,neutral,0.6835544833132288,neutral,0.0080128205128132,neutral
2018-11-01 13:00:44.070,624.0,643.35,621.45,624.05,634548.0,Glenmark Pharma announces launch of hair growth formula Nourkrin in Russia,The product catering to both male and female patients will be exclusively marketed in Russia by Glenmark Impex LLC,neutral,neutral,0.0080128205128132,neutral,0.0396982929734021,neutral
2018-11-01 23:02:42.702,624.0,643.35,621.45,624.05,634548.0,Glenmark's arm launches hair loss treatment product in Russia,"Glenmark Pharmaceuticals on Thursday informed the exchanges of the launch of Nourkrin, used to treat hair loss, in the Russian market. The product catering to both male and female patients will be exc",neutral,neutral,0.0080128205128132,neutral,0.0396982929734021,neutral
2018-11-07 13:01:40.915,660.8,668.0,660.0,662.2,419081.0,"Volatility could continue for 2-3 months, bet on Yes Bank, Glenmark Pharma","On the downside if Nifty slips below 10,200, only then weakness could emerge to take it towards the 52-week low of 9,952 and next major support will be at 9,800.",neutral,neutral,0.2118644067796748,neutral,1.8045112781954888,positive
2018-11-08 13:00:16.897,665.0,679.9,662.0,677.0,1391434.0,Glenmark to launch phase 1 trial in solid tumours for myeloma drug,"Glenmark Pharmaceuticals on Thursday said it will launch phase 1 trial in solid tumours for its bispecific antibody GBR 1342, indicated for the treatment of multiple myeloma. &ldquo;The company intend",neutral,positive,1.8045112781954888,positive,-1.765140324963079,negative
