date,open,high,low,close,volume,title,description,title_sentiment,desc_sentiment,daily_change_pct,market_sentiment,next_day_change_pct,next_day_sentiment
2020-04-29 05:30:00.000,327.75,335.5,325.5,329.65,3457006.0,BRIEF-Glenmark Pharma Gets ANDA Tentative Approval For Dapagliflozin & Saxagliptin Tablets - Investing.com India,"The Financial News section features stock market news in addition to stories about bonds, forex, commodities and economic releases.",neutral,neutral,0.5797101449275293,neutral,-4.661016949152542,negative
2020-04-29 11:15:52.000,327.75,335.5,325.5,329.65,3457006.0,Glenmark Pharma gets tentative USFDA nod for generic anti-diabetes tablets,Glenmark Pharmaceuticals on Wednesday said it has received tentative approval from the US health regulator for its generic Dapagliflozin and Saxagliptin anti-diabetes tablets. The approval granted by,neutral,positive,0.5797101449275293,neutral,-4.661016949152542,negative
2020-04-30 10:15:43.000,354.0,359.0,335.8,337.5,11109297.0,"Glenmark to conduct trials for potential COVID-19 drug, shares jump","Shares of Glenmark Pharmaceuticals Ltd rose almost 9% on Thursday after the Indian drugmaker got an approval to conduct clinical trials with antiviral drug favipiravir, seen as a potential treatment for COVID-19.",positive,positive,-4.661016949152542,negative,0.6666666666666667,neutral
2020-04-30 10:24:00.000,354.0,359.0,335.8,337.5,11109297.0,"Glenmark Pharma to conduct trials for potential COVID-19 drug, shares jump","Favipiravir, manufactured under the brand name Avigan by a unit of Japan’s Fujifilm Holdings Corp and approved for use as an anti-flu drug in the Asian island country in 2014, has been effective, with no obvious side-effects, in helping coronavirus patients recover, a Chinese official told reporters…",neutral,positive,-4.661016949152542,negative,0.6666666666666667,neutral
2020-04-30 10:56:00.000,354.0,359.0,335.8,337.5,11109297.0,Glenmark Pharma gets DCGI nod for clinical trials of Favipiravir tablets on COVID-19 patients,"Having internally developed the active pharmaceutical ingredients (API) and the formulations for the product, the company filed the product for clinical trials with the DCGI and has received approval for conducting the trial on mild to moderate patients, Glenmark Pharmaceuticals said in a statement.",neutral,positive,-4.661016949152542,negative,0.6666666666666667,neutral
2020-04-30 11:09:36.000,354.0,359.0,335.8,337.5,11109297.0,"Sensex rallies over 900 points, Nifty reclaims 9,800 level; Glenmark shares jump 9% on reports of trials for potential COVID-19 drug - Firstpost","Shares of Glenmark Pharmaceuticals Ltd rose as much as 8.9 percent after the drugmaker said it got the Indian drug regulator’s nod to conduct clinical trials of antiviral drug favipiravir, seen as a potential treatment for COVID-19.",positive,positive,-4.661016949152542,negative,0.6666666666666667,neutral
2020-04-30 11:30:57.000,354.0,359.0,335.8,337.5,11109297.0,DCGI nod for Glenmark Pharma clinical trials on Favipiravir antiviral tablets for COVID-19 patients,150 subjects with mild to moderate COVID-19 will be randomised in the study in a 1:1 ratio to Favipiravir with standard supportive care or standalone standard supportive care.,neutral,neutral,-4.661016949152542,negative,0.6666666666666667,neutral
2020-04-30 12:19:35.000,354.0,359.0,335.8,337.5,11109297.0,Glenmark Pharma stocks rise nearly 9% on DCGI nod for clinical trials of COVID-19 tablets,"The company said it is the first firm in India to receive such an approval from the Drug Controller General of India (DCGI).The scrip jumped 8.88 per cent to Rs 359 on the BSE.On the NSE, it zoomed 8.88 per cent to Rs 359.Having internally developed the active pharmaceutical …",positive,positive,-4.661016949152542,negative,0.6666666666666667,neutral
2020-04-30 12:29:00.000,354.0,359.0,335.8,337.5,11109297.0,Glenmark pharma starts clinical trial on anti viral Favipiravir for Covid-19 treatment,The drug sold under brand name Avigan by Fujifilm Toyama Chemical has demonstrated activity against influenza viruses and has been approved in Japan for the treatment of novel influenza virus infections.,neutral,positive,-4.661016949152542,negative,0.6666666666666667,neutral
2020-04-30 12:39:00.000,354.0,359.0,335.8,337.5,11109297.0,Glenmark Pharma share price up 9% on nod to trials for possible COVID-19 drug,"Favipiravir has demonstrated activity against influenza viruses and has been approved in Japan for the treatment of novel influenza virus infections, the company has said.",positive,positive,-4.661016949152542,negative,0.6666666666666667,neutral
2020-04-30 12:53:00.000,354.0,359.0,335.8,337.5,11109297.0,Coronavirus: Glenmark to conduct trials for potential COVID-19 drug; shares jump 9%,"Shares of Mumbai-based Glenmark Pharmaceuticals, which rose as much as 8.9% to 359 rupees ($4.78), was trading up 5.9%, as of 0407 GMT",positive,positive,-4.661016949152542,negative,0.6666666666666667,neutral
2020-04-30 13:25:34.000,354.0,359.0,335.8,337.5,11109297.0,"Covid-19 treatment: Glenmark Pharma gets DCGI nod for clinical trials, shares jump",Glenmark Pharmaceuticals on Thursday said it has become the first company in India to receive approval from Drug Controller General of India (DCGI) to conduct clinical trials of Favipiravir antiviral,positive,positive,-4.661016949152542,negative,0.6666666666666667,neutral
2020-04-30 13:37:57.000,354.0,359.0,335.8,337.5,11109297.0,Glenmark to conduct trials in India for potential COVID-19 drug,"Glenmark Pharmaceuticals Ltd said on Thursday it will start clinical trials in India of antiviral drug favipiravir, seen as a potential treatment for COVID-19, sending its shares up as much as 9%.",neutral,positive,-4.661016949152542,negative,0.6666666666666667,neutral
2020-04-30 13:58:17.000,354.0,359.0,335.8,337.5,11109297.0,Glenmark Pharma gets DCGI nod for clinical trials of Favipiravir tablets on COVID-19 patients,The Mumbai-based company is the first pharmaceutical company in India to be given an approval by the regulator to start the trial on COVID-19 patients in the country.,neutral,neutral,-4.661016949152542,negative,0.6666666666666667,neutral
2020-04-30 15:43:00.000,354.0,359.0,335.8,337.5,11109297.0,Glenmark Pharma shares jump nearly 9% on DCGI nod for clinical trials of Covid-19 tablets,The company said it is the first firm in India to receive such an approval from the DCGI.,positive,neutral,-4.661016949152542,negative,0.6666666666666667,neutral
2020-04-30 18:01:00.000,354.0,359.0,335.8,337.5,11109297.0,Glenmark Pharma share gains 9% on nod for trial of Covid-19 tablets,"Shares of Glenmark Pharmaceuticals rose almost 9% on Thursday after the Indian drugmaker received an approval from Drugs Controller General of India (DCGI) to conduct clinical trials with antiviral drug favipiravir, seen as a potential treatment for COVID",positive,positive,-4.661016949152542,negative,0.6666666666666667,neutral
2020-05-04 06:00:00.000,337.5,347.3,330.0,339.75,8531413.0,Clinical trials for drug on CoVID-19 to start soon,"Glenmark Pharmaceuticals has received a green signal from the Drug Controller General of India (DCGI) to evaluate the antiviral drug Favipiravir in clinical trials for treating patients infected with CoVID-19. If the test results are positive, then India will be able to avail this medicine in the…",neutral,positive,0.6666666666666667,neutral,-6.069364161849711,negative
2020-05-04 13:26:00.000,346.0,346.0,322.9,325.0,4682965.0,"Buy Glenmark Pharma, target price Rs 390: ICICI Securities","Overall, revenue and EPS CAGRs of 8.8% and 16.4% respectively are expected over FY20-FY22E with the core margin rising 100 bps to 17%.",neutral,positive,-6.069364161849711,negative,2.9411764705882426,positive
2020-05-11 05:30:00.000,338.0,339.65,329.05,337.2,2925793.0,BRIEF-Glenmark Pharmaceuticals Launches 3-In-1 Inhaler Therapy For COPD In India - Investing.com India,"The Financial News section features stock market news in addition to stories about bonds, forex, commodities and economic releases.",neutral,neutral,-0.2366863905325477,neutral,-0.9809750297265026,negative
2020-05-12 10:33:00.000,336.4,342.95,329.55,333.1,3145946.0,Glenmark Pharma initiates Phase 3 clinical trial for antiviral Favipiravir,Glenmark was the first pharmaceutical company in India to be given an approval by the regulator to start the trial on COVID-19 patients in India.,neutral,neutral,-0.9809750297265026,negative,-1.3157894736842104,negative
2020-05-12 15:00:28.000,342.0,342.0,334.55,337.5,2758933.0,Glenmark commences late-stage trial on Covid-prospective drug Favipiravir,Glenmark Pharmaceuticals has initiated late-stage Phase-III clinical trials on the antiviral Favipiravir to test its efficacy in patients showing mild-to moderate symptoms of the Covid-19 infection.Th,neutral,positive,-1.3157894736842104,negative,2.9717682020802374,positive
2020-05-13 06:24:00.000,342.0,342.0,334.55,337.5,2758933.0,Glenmark initiates Phase 3 clinical trials on Favipiravir to check efficacy on COVID-19 patients,Glenmark Pharmaceuticals on Tuesday said it has initiated Phase 3 clinical trials on antiviral drug Favipiravir to check its efficacy on COVID-19 patients in India.,neutral,neutral,-1.3157894736842104,negative,2.9717682020802374,positive
2020-05-22 07:58:00.000,347.0,363.6,345.0,351.5,7833953.0,Here’s a derivative strategy on Glenmark Pharma by HDFC Securities,Long build-up was seen in the Glenmark Futures yesterday,neutral,neutral,1.2968299711815563,positive,-2.6758195572989507,negative
2020-05-26 11:11:00.000,356.9,360.5,345.0,347.35,5181232.0,Glenmark Pharmaceuticals to study potential COVID-19 drug combination,"The study will look to enroll 158 hospitalized patients of moderate COVID-19 in India, the company added.",neutral,neutral,-2.6758195572989507,negative,-0.5414648047876823,neutral
2020-05-26 11:40:40.000,356.9,360.5,345.0,347.35,5181232.0,India’s Glenmark to study potential COVID-19 drug combination,"Glenmark Pharmaceuticals Ltd said on Tuesday it will begin a new clinical trial in India to test a combination of two anti-viral drugs, favipiravir and umifenovir, as a potential COVID-19 treatment.",neutral,positive,-2.6758195572989507,negative,-0.5414648047876823,neutral
2020-05-26 12:15:33.000,350.9,353.0,344.05,349.0,3045256.0,"Glenmark to study potential COVID-19 drug combination; to look to enroll 158 hospitalised patients - Business News , Firstpost","On 1 May, Glenmark Pharmaceuticals said it has become the first company in India to receive approval from Drug Controller General of India (DCGI) to conduct clinical trials of Favipiravir antiviral tablets for the treatment of COVID-19 patients.",neutral,positive,-0.5414648047876823,neutral,-1.5327317003294725,negative
2020-05-26 16:19:00.000,350.9,353.0,344.05,349.0,3045256.0,Glenmark Pharma to study potential Covid-19 drug combination,"The study will look to enroll 158 hospitalized patients of moderate Covid-19 in India, the company added. Last month, Glenmark said it would conduct clinical trials in India of just favipiravir as a potential treatment for Covid-19.",neutral,positive,-0.5414648047876823,neutral,-1.5327317003294725,negative
2020-05-27 11:06:00.000,350.9,353.0,344.05,349.0,3045256.0,Glenmark gets USFDA nod to market generic drug for muscle pain,"Glenmark Pharmaceuticals Inc, USA has been granted final approval by the US Food and Drug Administration (USFDA) for Chlorzoxazone tablets USP, in strength of 375 mg and 750 mg, the drug maker said in a statement.",neutral,positive,-0.5414648047876823,neutral,-1.5327317003294725,negative
2020-05-27 11:43:00.000,350.9,353.0,344.05,349.0,3045256.0,"Glenmark Pharma gets final nod for Chlorzoxazone Tablets, shares trade flat","The Chlorzoxazone Tablets, 375 mg and 750 mg achieved sales of approximately $20.9 million during the 12 month period ending March 2020.",neutral,positive,-0.5414648047876823,neutral,-1.5327317003294725,negative
2020-05-27 12:14:41.000,349.05,351.65,341.5,343.7,2583927.0,"Glenmark Pharmaceuticals receives approval from USFDA to market generic drug for muscle pain in American market - Business News , Firstpost","Glenmark Pharmaceuticals on Wednesday said its subsidiary has received approval from the US health regulator to market Chlorzoxazone tablets, used to treat muscle pain, in the American market",positive,positive,-1.5327317003294725,negative,2.9036004645760745,positive
2020-05-27 16:15:37.000,349.05,351.65,341.5,343.7,2583927.0,Glenmark Pharma Gets U.S. FDA Nod To Market Generic Drug For Muscle Pain,"The approval has been given for Chlorzoxazone tablets USP, in strength of 375 mg and 750 mg.",neutral,positive,-1.5327317003294725,negative,2.9036004645760745,positive
2020-05-29 13:44:00.000,344.4,358.45,343.45,354.4,6276828.0,"Pharma shares in focus: Cipla, Aurobindo Pharma hit 52-week high","Dr Reddys, Divis Labs, Biocon, JB Chemicals, Caplin Point Lab, Aarti Drugs, Indoco Remedies, RPG Lifesciences and Glenmark Pharma were up in the range of 3% to 5%.",neutral,positive,2.9036004645760745,positive,2.946927374301679,positive
2020-06-02 11:32:22.000,373.0,393.45,372.1,389.0,10219280.0,Buy Glenmark Pharmaceuticals; Target Of Rs 410: Globe Capital Market,"Globe Capital Market is bullish on Glenmark Pharmaceuticals has recommended buy rating on the stock with a target price of Rs 410 in its research report dated Jun 01, 2020.",neutral,positive,4.289544235924933,positive,-1.2658227848101269,negative
2020-06-05 13:00:00.000,400.0,413.95,398.8,402.5,5641276.0,Sun Pharma testing plant-based drug as potential COVID-19 treatment,"Drugmakers around the world are rushing to develop a treatment or vaccine for the fast-spreading novel coronavirus that has killed over 390,000 people and ravaged financial markets. Two other Indian companies, Glenmark Pharmaceuticals Ltd and Strides Pharma Science Ltd, are also conducting trials in…",neutral,neutral,0.625,neutral,-1.3178962926468694,negative
2020-06-19 05:30:00.000,410.0,417.0,407.7,410.4,4869419.0,BRIEF-Glenmark Pharmaceuticals Gets Indian Regulator Nod For Favipiravir - Investing.com India,"The Financial News section features stock market news in addition to stories about bonds, forex, commodities and economic releases.",neutral,neutral,0.0975609756097505,neutral,16.579677956690723,positive
2020-06-19 09:57:07.000,410.0,417.0,407.7,410.4,4869419.0,Glenmark Pharmaceuticals Gets USFDA Nod For Fingolimod Capsules,"""Glenmark Pharmaceuticals Inc, USA has been granted final approval by the United States Food and Drug Administration (USFDA) for Fingolimod Capsules, 0.5 mg, the generic version of Gilenya capsules, 0.5 mg, of Novartis Pharmaceuticals Corporation,"" the drug major said in a filing to BSE.",neutral,positive,0.0975609756097505,neutral,16.579677956690723,positive
2020-06-19 10:10:00.000,410.0,417.0,407.7,410.4,4869419.0,Glenmark Pharmaceuticals gets USFDA nod for Fingolimod capsules,"Glenmark Pharmaceuticals Inc, USA has been granted final approval by the United States Food and Drug Administration (USFDA) for Fingolimod Capsules, 0.5 mg, the generic version of Gilenya capsules, 0.5 mg, of Novartis Pharmaceuticals Corporation, the drug major said in a filing to BSE.",neutral,positive,0.0975609756097505,neutral,16.579677956690723,positive
2020-06-19 10:34:22.000,410.0,417.0,407.7,410.4,4869419.0,Glenmark gets USFDA nod for fingolimod capsules; shares gain 2%,"Glenmark Pharmaceuticals on Friday announced that it had been granted final approval by the United States Food &amp; Drug Administration (USFDA) for Fingolimod capsules, 0.5 mg, the generic versio",positive,positive,0.0975609756097505,neutral,16.579677956690723,positive
2020-06-19 12:13:00.000,410.0,417.0,407.7,410.4,4869419.0,Glenmark Pharma gets USFDA nod for drug to treat multiple sclerosis,The capsules are used in the treatment of adult patients with relapsing forms of multiple sclerosis,neutral,neutral,0.0975609756097505,neutral,16.579677956690723,positive
2020-06-19 16:41:00.000,410.0,417.0,407.7,410.4,4869419.0,Glenmark Pharma receives USFDA approval for Fingolimod Capsules; stock up 1%,Glenmark’s current portfolio consists of 164 products authorized for distribution in the US marketplace and 44 ANDA’s pending approval with the USFDA.,positive,neutral,0.0975609756097505,neutral,16.579677956690723,positive
2020-06-19 20:14:00.000,410.0,417.0,407.7,410.4,4869419.0,Glenmark Pharma gets nod to launch favipiravir for Covid-19 patients,Glenmark is conducting phase-3 clinical trials; drug has got restricted emergency use,neutral,neutral,0.0975609756097505,neutral,16.579677956690723,positive
2020-06-19 20:50:01.000,410.0,417.0,407.7,410.4,4869419.0,Glenmark Pharmaceuticals Gets India Approval For Favipiravir As COVID-19 Treatment,"The Mumbai-based company said the approval was part of India’s accelerated approval process and the drug was meant for ""restricted emergency use,"" meaning patients must sign their consent before being treated by the drug.",neutral,neutral,0.0975609756097505,neutral,16.579677956690723,positive
2020-06-19 21:14:26.000,410.0,417.0,407.7,410.4,4869419.0,Glenmark gets DCGI nod for favipiravir use in Covid-19,Glenmark Pharmaceuticals on Friday received manufacturing and marketing approval for restricted emergency use of oral antiviral drug favipiravir in the treatment of Covid-19 in India. The approval,neutral,positive,0.0975609756097505,neutral,16.579677956690723,positive
2020-06-19 21:39:00.000,410.0,417.0,407.7,410.4,4869419.0,"Glenmark Pharma gets nod for favipiravir; Cipla, Hetero for remdesivir","Glenmark gets nod for oral favipiravir, Maha health minister says Cipla and Hetero get nod for remdesivir",neutral,neutral,0.0975609756097505,neutral,16.579677956690723,positive
2020-06-21 05:55:00.000,450.25,573.05,450.25,524.9,89254569.0,Glenmark launches COVID drug at Rs 103 per tablet,"New Delhi: Drug firm Glenmark Pharmaceuticals on Saturday said it has launched antiviral drug Favipiravir, under the brand name FabiFlu, for the treatment of patients with mild to moderate COVID-19 at a price of about Rs 103 per tablet. The drug will be available as a 200 …",neutral,neutral,16.579677956690723,positive,-11.772727272727272,negative
2020-06-22 07:27:48.000,450.25,573.05,450.25,524.9,89254569.0,"Stocks To Watch: Glenmark Pharma, HDFC, IndiaBulls Housing Finance, LIC Housing Finance, Piramal Enterprises, Power Grid, RIL",Here are the stocks to watch in trade today.,neutral,neutral,16.579677956690723,positive,-11.772727272727272,negative
2020-06-22 07:37:00.000,450.25,573.05,450.25,524.9,89254569.0,"Sensex gains 180 pts, broader indices outperform; Glenmark Pharma soars 27%",All that happened in the markets today,positive,neutral,16.579677956690723,positive,-11.772727272727272,negative
2020-06-22 08:16:25.000,450.25,573.05,450.25,524.9,89254569.0,"In Pics | Stocks In The News: Bajaj Consumer, Indiabulls Housing, Just Dial, NALCO, PPAP Automotive",MindTree | NALCO | Apollo Tricoat Tubes | Nelcast | Ramco Systems | Glenmark Pharmaceuticals | Dalmia Bharat Sugar | Entertainment Network India | PPAP Automotive | Greenlam Industries | Deepak Nitrite | HDFC | Kirloskar Oil Engines | Novartis India | Aditya Birla Fashion and Retail | LIC Housing Fi…,neutral,neutral,16.579677956690723,positive,-11.772727272727272,negative
2020-06-22 08:54:53.000,450.25,573.05,450.25,524.9,89254569.0,"Stocks in focus: Glenmark Pharma, Cipla, Reliance Capital, HDFC Bank shares to remain in news today","Market sentiments would be swayed by global cues, development around geopolitical tensions, coronavirus cases, monthly F&O expiry and foreign fund movement",neutral,neutral,16.579677956690723,positive,-11.772727272727272,negative
2020-06-22 09:07:00.000,450.25,573.05,450.25,524.9,89254569.0,"Stocks in the news: Glenmark Pharma, HDFC, HDFC Bank, Cipla, Bajaj Electricals, Cadila and Dhanlaxmi Bank","Stocks to watch today on June 22: Glenmark Pharma, HDFC, HDFC Bank, Cipla, Bajaj Electricals, Cadila and Dhanlaxmi Bank among others are the top stocks to watch out for in Monday’s trading session.",neutral,neutral,16.579677956690723,positive,-11.772727272727272,negative
2020-06-22 09:19:00.000,450.25,573.05,450.25,524.9,89254569.0,"Glenmark Pharma zooms 28% on launch of Favipiravir, a potential Covid drug","The company launched antiviral drug Favipiravir, under the brand name FabiFlu, for the treatment of patients with mild to moderate Covid-19 at a price of about Rs 103 per tablet.",neutral,neutral,16.579677956690723,positive,-11.772727272727272,negative
2020-06-22 10:20:06.000,450.25,573.05,450.25,524.9,89254569.0,Glenmark Pharmaceuticals share price rallies 15% as firm launches COVID-19 drug Favipiravir,"Glenmark Pharma stock has gained 180 per cent in less than three months from its 52-week low of Rs 168 apiece, taking the market capitalisation of the company to Rs 13,274.60 crore",positive,positive,16.579677956690723,positive,-11.772727272727272,negative
2020-06-22 10:24:00.000,450.25,573.05,450.25,524.9,89254569.0,"Stocks in the news: Glenmark Pharma, HDFC, Cipla, Info Edge, UCO Bank and Cochin Shipyard","Kirloskar Industries, Info Edge (India), NDTV, Onmobile Global, Skipper are scheduled to announce their March quarter earnings on Monday.",neutral,neutral,16.579677956690723,positive,-11.772727272727272,negative
2020-06-22 11:37:00.000,450.25,573.05,450.25,524.9,89254569.0,Glenmark Pharma share hits upper circuit of 35% post launch of first Indian Covid-19 drug,Glenmark Pharmaceuticals share price opened 10% higher at Rs 450 against previous close of 409.10 on BSE,neutral,positive,16.579677956690723,positive,-11.772727272727272,negative
2020-06-22 13:24:04.000,550.0,550.0,475.25,485.25,65103250.0,Glenmark stocks surge after nod to launch antiviral drug ‘Favipiravir’ for mild-to-moderate COVID-19 infections,Glenmark Pharmaceuticals’ share price surged 30 per cent on Monday to Rs 531.80 per unit after it became the first pharmaceutical company in India to receive regulatory approval to make and sell oral antiviral drug favipiravir for treating mild-to-moderate COVID-19 infections. At the same …,positive,positive,-11.772727272727272,negative,-3.713834823776955,negative
2020-06-22 15:50:00.000,550.0,550.0,475.25,485.25,65103250.0,"Glenmark Pharma surges 35%, sees biggest intraday rise in history on Covid-19 drug launch",The firm launched antiviral drug Favipiravir for the treatment of Covid-19 patients.,positive,neutral,-11.772727272727272,negative,-3.713834823776955,negative
2020-06-22 16:44:05.000,550.0,550.0,475.25,485.25,65103250.0,"Share Market HIGHLIGHTS: Sensex ends 180 points higher, Nifty above 10,300; Glenmark Pharmaceuticals zooms 28%","Share Market News Today | Sensex, Nifty, Share Prices HIGHLIGHTS: Domestic equity market benchmarks Sensex and Nifty ended over half per cent higher on Monday. Glenmark Pharmaceuticals share price jumped 28 per cent",positive,positive,-11.772727272727272,negative,-3.713834823776955,negative
2020-06-22 16:48:00.000,550.0,550.0,475.25,485.25,65103250.0,"Market Wrap, June 22: Here’s all that happened in the markets today",Glenmark Pharmaceuticals was the stock of the day as the scrip ended 27 per cent higher at Rs 520 on the BSE,neutral,positive,-11.772727272727272,negative,-3.713834823776955,negative
2020-06-22 20:12:15.000,550.0,550.0,475.25,485.25,65103250.0,"Govt Of Singapore Picks Up 1.14% Stake In ICICI Pru Life, Edelweiss MF Acquires 2.45% In Indostar","Glenmark Pharmaceuticals was the star performer of the day, wherein HSBC Pooled Asian Equity Fund sold 18,79,542 shares at Rs 527.77 per share on the NSE.",neutral,positive,-11.772727272727272,negative,-3.713834823776955,negative
2020-06-22 20:21:36.000,550.0,550.0,475.25,485.25,65103250.0,Glenmark soars on Covid-19 drug launch,Yet another pharma company share took the fancy of stock market traders on Monday. The share price of Glenmark Pharmaceuticals shot up by nearly 35 per cent in intra-day trade. It rose by ₹126 to touc,neutral,positive,-11.772727272727272,negative,-3.713834823776955,negative
2020-06-22 20:35:00.000,550.0,550.0,475.25,485.25,65103250.0,"Can’t call Remdesiver, Favipiravir game changers in Covid-19 fight: Experts","Glenmark Pharmaceuticals has launched the antiviral drug Favipiravir, while Cipla and Hetero have received approvals from the Drug Controller General of India to launch Remdesivir",neutral,positive,-11.772727272727272,negative,-3.713834823776955,negative
2020-06-22 23:37:04.000,550.0,550.0,475.25,485.25,65103250.0,Virus-Drug Nod Spurs Record Rally in India’s Glenmark Pharma,Virus-Drug Nod Spurs Record Rally in India’s Glenmark Pharma,neutral,neutral,-11.772727272727272,negative,-3.713834823776955,negative
2020-06-23 09:33:00.000,550.0,550.0,475.25,485.25,65103250.0,Will the launch of Favipiravir mark the turnaround for Glenmark Pharma?,"If the drug proves to be efficacious for Covid treatment, Glenmark will cash in on first mover advantage.",positive,positive,-11.772727272727272,negative,-3.713834823776955,negative
2020-06-23 09:33:00.000,550.0,550.0,475.25,485.25,65103250.0,Will the launch of Favipiravir mark the turnaround for Glenmark Pharma?,"If the drug proves to be efficacious for Covid treatment, Glenmark will enjoy first mover advantage.",positive,positive,-11.772727272727272,negative,-3.713834823776955,negative
2020-06-23 13:14:00.000,475.25,477.3,453.3,457.6,24549413.0,Glenmark Pharma drops 5% after HSBC Pooled Investment Fund sold stake,"After rallying 27 per cent in the previous session, the scrip traded 5.24 per cent lower at Rs 492.",neutral,neutral,-3.713834823776955,negative,2.0222222222222275,positive
2020-06-23 14:44:00.000,475.25,477.3,453.3,457.6,24549413.0,Trending stocks: Glenmark Pharma shares slip nearly 6%,"A total of 2,382,824 shares changed hands on the counter till 09:58AM (IST).",negative,neutral,-3.713834823776955,negative,2.0222222222222275,positive
