date,open,high,low,close,volume,title,description,title_sentiment,desc_sentiment,daily_change_pct,market_sentiment,next_day_change_pct,next_day_sentiment
2020-11-25 09:14:00.000,484.0,484.8,465.0,467.5,2605189.0,"As refinancing risks ease, S&P affirms Glenmark Pharma’s ‘BB-’ rating",The rating agency has a stable outlook on Glenmark Pharmas rating and also removed it from CreditWatch,positive,neutral,-3.4090909090909087,negative,-0.1489361702127635,neutral
2020-11-25 09:50:22.000,484.0,484.8,465.0,467.5,2605189.0,Glenmark Pharmaceuticals receives affirmation in LT issuer credit ratings,From S&P Global Ratings,positive,neutral,-3.4090909090909087,negative,-0.1489361702127635,neutral
2020-11-25 15:07:00.000,470.0,474.0,460.4,469.3,2152234.0,S&P affirms Glenmark Pharma’s rating at BB-; stock trades flat,The rating agency removes company’s all ratings from credit watch on easing Refinancing Risk; Outlook Stable.,positive,neutral,-0.1489361702127635,neutral,0.0212314225053126,neutral
2020-11-26 12:44:00.000,471.0,478.8,470.0,471.1,2055112.0,Glenmark Pharmaceuticals retains its place in Dow Jones Sustainability Index,Powered by Capital Market - Live News,neutral,neutral,0.0212314225053126,neutral,0.5162241887905581,neutral
2020-11-26 18:26:00.000,471.0,478.8,470.0,471.1,2055112.0,Glenmark Pharma gets listed in Dow Jones Sustainability Index for the 3rd straight year; stock trades higher,DJSI is one of the world’s most respected and widely accepted sustainability benchmarks globally with only the top ranked companies in terms of Corporate Sustainability within each industry featured in the index.,positive,neutral,0.0212314225053126,neutral,0.5162241887905581,neutral
2020-11-27 14:52:36.000,471.0,478.8,470.0,471.1,2055112.0,Glenmark Pharma’s FabiFlu Booster Is Waning,A three-quarter growth run at Glenmark maybe coming to an end as FabiFlu now faces many more competitors.,neutral,positive,0.0212314225053126,neutral,0.5162241887905581,neutral
2020-11-30 09:01:00.000,474.6,480.9,473.1,477.05,2182376.0,Dr Reddys Labs to acquire select anti-allergy brands from Glenmark,"Dr. Reddys Laboratories on Saturday (28 November 2020) announced that it has entered into a definitive agreement with Glenmark Pharmaceuticals to acquire select anti-allergy brands in Russia, Ukraine, Kazakhstan and Uzbekistan.",neutral,positive,0.5162241887905581,neutral,0.0417405822811323,neutral
2020-12-01 05:30:00.000,474.6,480.9,473.1,477.05,2182376.0,BRIEF-Glenmark Pharma Gets Tentative U.S. FDA Approval For Axitinib Tablets - Investing.com India,"The Financial News section features stock market news in addition to stories about bonds, forex, commodities and economic releases.",neutral,neutral,0.5162241887905581,neutral,0.0417405822811323,neutral
2020-12-01 07:34:00.000,474.6,480.9,473.1,477.05,2182376.0,"Stocks in the news: Maruti, M&M, ONGC, Dr Reddy’s Labs, Infibeam and Route Mobile",Dr Reddy’s Laboratories on Saturday said it has inked a pact with Glenmark Pharmaceuticals to acquire its select anti-allergy brands.,neutral,positive,0.5162241887905581,neutral,0.0417405822811323,neutral
2020-12-01 08:54:08.000,474.6,480.9,473.1,477.05,2182376.0,"Stocks in focus: Maruti Suzuki, Hero MotoCorp, Bajaj Auto, ICICI Lombard, Glenmark Pharma, bank stocks","Nifty futures were trading 3.50 points down at 12,989.50 on Singaporean Exchange, suggesting a gap-down start for BSE Sensex and Nifty 50 on Tuesday",neutral,negative,0.5162241887905581,neutral,0.0417405822811323,neutral
2020-12-01 09:54:00.000,474.6,480.9,473.1,477.05,2182376.0,Glenmark Pharma rises after tentative USFDA approval for Axitinib tablets,Glenmark Pharmaceuticals gained 1.09% to Rs 476.35 after the drug maker said it received tentative approval from US drug regulator for Axitinib tablets.,positive,positive,0.5162241887905581,neutral,0.0417405822811323,neutral
2020-12-01 10:11:00.000,474.6,480.9,473.1,477.05,2182376.0,"Glenmark Pharma receives ANDA tentative approval for Axitinib Tablets, 1 mg and 5 mg","Glenmark continues to identify and explore external development partnerships to supplement and
accelerate the growth of its existing pipeline and portfolio.",positive,positive,0.5162241887905581,neutral,0.0417405822811323,neutral
2020-12-01 10:18:00.000,474.6,480.9,473.1,477.05,2182376.0,Glenmark Pharmaceuticals receives USFDA approval for Axitinib Tablets,"According to IQVIATM sales data for the 12 month period ending October 2020, the Inlyta Tablets, 1 mg and 5 mg market achieved annual sales of approximately $518.8 million.",positive,positive,0.5162241887905581,neutral,0.0417405822811323,neutral
2020-12-01 12:28:00.000,479.15,482.05,475.5,479.35,1660395.0,Glenmark Pharma share price gains on tentative USFDA nod for kidney cancer drug,The company has received FDA’s tentative nod for Axitinib tablets in the strength of 1mg and 5 mg.,positive,neutral,0.0417405822811323,neutral,1.895833333333338,positive
2020-12-01 13:28:00.000,479.15,482.05,475.5,479.35,1660395.0,Glenmark Pharma gets tentative nod from USFDA for cancer treatment drug,"Glenmark Pharmaceuticals has received tentative approval by the United States Food & Drug Administration (USFDA) for Axitinib tablets in the strength of 1 mg and 5 mg, the company said in a regulatory filing.",neutral,positive,0.0417405822811323,neutral,1.895833333333338,positive
2020-12-09 08:04:00.000,532.0,543.65,529.0,536.6,2521087.0,"Stock picks by Ajit Mishra of Religare Broking: Buy Glenmark Pharma, IGL","Glenmark Pharmaceuticals has recently witnessed a breakout with a noticeable rise in volume, after spending nearly 4 months in a consolidation range of 460-515 levels",neutral,positive,0.8646616541353427,neutral,-0.8863593954095914,neutral
2020-12-10 09:48:00.000,535.9,539.8,520.95,531.15,1800070.0,Glenmark Pharmaceuticals redeems 2021 Notes aggregating USD 182.5 mn,Powered by Capital Market - Live News,neutral,neutral,-0.8863593954095914,neutral,-0.7075471698113208,neutral
2020-12-23 09:22:00.000,488.45,497.5,487.2,496.05,2049825.0,Glenmark Pharma gains on tieup with Menarini for commercializing Ryaltris,Glenmark Pharmaceuticals rose 1.61% to Rs 491.65 after the companys Swiss subsidiary and Menarini entered into a licensing pact for commercializing Ryaltris nasal spray in Europe.,positive,positive,1.5559422663527531,positive,0.100502512562814,neutral
2020-12-23 11:14:49.000,488.45,497.5,487.2,496.05,2049825.0,Glenmark Pharma Shares Rise On Licensing Agreement With Menarini,"Ryaltris and mometasone furoate (25 mcg)], developed by Glenmark, is a novel fixed-dose combination nasal spray of an anti-histamine and a steroid, indicated for treatment of symptoms associated with seasonal allergic rhinitis (SAR) in patients over 12 years of age.",neutral,neutral,1.5559422663527531,positive,0.100502512562814,neutral
2020-12-23 16:07:00.000,497.5,504.9,489.6,498.0,1935762.0,"Glenmark Pharma share rises 3% after four days, here’s why","Reversing from 4 days of consecutive fall, Glenmark Pharma stock opened higher at Rs 488 and gained 2.86% to hit the day’s high of Rs 497.70 against the last close of Rs 483.85",positive,positive,0.100502512562814,neutral,-0.5,neutral
2020-12-31 09:14:00.000,501.5,507.5,492.0,492.55,3112224.0,Glenmark Pharmaceuticals receives USFDA approval for Tadalafil Tablets,"According to IQVIATM sales data for the 12 month period ending November 2020, the Cialis Tablets,
2.5 mg, 5 mg, 10 mg and 20 mg market2 achieved annual sales of approximately $125.5 million.",positive,neutral,-1.784646061814554,negative,1.863291139240504,positive
2020-12-31 09:42:00.000,501.5,507.5,492.0,492.55,3112224.0,Glenmark Pharma rises on receiving ANDA final approval for tadalafil tablets,Glenmark Pharmaceuticals gained 0.86% to Rs 503.05 after the drug maker said it received US drug regulators final approval for tadalafil tablets.,positive,positive,-1.784646061814554,negative,1.863291139240504,positive
2020-12-31 11:12:00.000,501.5,507.5,492.0,492.55,3112224.0,Glenmark Pharma | USFDA: Glenmark Pharma gets USFDA nod for erectile dysfunction treatment,"Glenmark Pharmaceuticals Ltd has received final approval from the United States Food and Drug Administration (USFDA) for Tadalafil tablets USP in the strengths of 2.5 mg, 5 mg, 10 mg and 20 mg, the company said in a regulatory filing.",neutral,positive,-1.784646061814554,negative,1.863291139240504,positive
2020-12-31 11:12:05.000,501.5,507.5,492.0,492.55,3112224.0,Glenmark Pharma Gets USFDA Nod For Erectile Dysfunction Treatment Drug,"Glenmark Pharmaceuticals Ltd has received final approval from the United States Food and Drug Administration (USFDA) for Tadalafil tablets USP in the strengths of 2.5 mg, 5 mg, 10 mg and 20 mg, the company said in a regulatory filing.",neutral,positive,-1.784646061814554,negative,1.863291139240504,positive
2021-01-05 10:18:03.000,514.6,520.0,510.0,517.45,2048008.0,"Global markets, SGX point to weak opening for markets","Bajaj Finance, Force Motors, Glenmark Pharma likely to remain in focus",negative,neutral,0.5538282160901715,neutral,0.3378378378378378,neutral
2021-01-18 23:11:59.000,499.0,506.7,496.05,506.5,1169062.0,Glenmark Pharmaceuticals Q3 PAT Seen Up 27.4% YoY To Rs. 190.8 Cr: Prabhudas Lilladher,"Net Sales are expected to increase by 5.5 percent Y-o-Y (down 4.3 percent Q-o-Q) to Rs. 2,638.6 crore, according to Prabhudas Lilladher.",neutral,positive,1.503006012024048,positive,1.0912698412698412,positive
2021-01-28 05:30:00.000,482.1,491.5,476.2,479.4,2435761.0,BRIEF-Glenmark Pharmaceuticals Gets ANDA Approval For Amphetamine Sulfate Tablets,BRIEF-Glenmark Pharmaceuticals Gets ANDA Approval For Amphetamine Sulfate Tablets,neutral,neutral,-0.5600497822028718,neutral,-2.169869807811532,negative
2021-01-28 09:38:00.000,482.1,491.5,476.2,479.4,2435761.0,Glenmark Pharma gets USFDA nod for amphetamine sulfate tablets,The drug maker on Thursday announced that it has received final approval by the US drug regulator for amphetamine sulfate tablets.,neutral,positive,-0.5600497822028718,neutral,-2.169869807811532,negative
2021-01-28 10:37:00.000,482.1,491.5,476.2,479.4,2435761.0,Glenmark Pharma gets USFDA approval for nervous system stimulant drug,Glenmark Pharmaceuticals Ltd has been granted final approval by the United States Food and Drug Administration (USFDA) for Amphetamine Sulfate tablets USP,positive,positive,-0.5600497822028718,neutral,-2.169869807811532,negative
2021-01-28 10:40:13.000,482.1,491.5,476.2,479.4,2435761.0,Glenmark Pharma Gets USFDA Nod For Nervous System Stimulant Drug,The approved product is a generic version of Evekeo tablets of Arbor Pharmaceuticals LLC.,neutral,neutral,-0.5600497822028718,neutral,-2.169869807811532,negative
2021-01-28 11:08:44.000,482.1,491.5,476.2,479.4,2435761.0,Glenmark Pharma gets USFDA nod for nervous system stimulant drug,The approved product is a generic version of Evekeo tablets,neutral,neutral,-0.5600497822028718,neutral,-2.169869807811532,negative
2021-01-28 11:50:54.000,482.1,491.5,476.2,479.4,2435761.0,Glenmark Pharma Share Price Rises On US FDA Final Approval,"The share touched its 52-week high Rs 572.70 and 52-week low Rs 168 on 22 June, 2020 and 13 March, 2020, respectively.",neutral,negative,-0.5600497822028718,neutral,-2.169869807811532,negative
2021-01-29 05:30:00.000,483.9,486.0,469.9,473.4,1606360.0,"Glenmark Pharmaceuticals receives ANDA approval for Amphetamine Sulfate Tablets USP, 5 mg, 10 mg","Mumbai (Maharashtra) [India], January 29 (ANI/PRNewswire): Glenmark Pharmaceuticals Limited (Glenmark) has received final approval by the United States Food & Drug Administration (U.S. FDA) for Amphetamine Sulfate Tablets USP, 5 mg and 10 mg, the",positive,positive,-2.169869807811532,negative,1.5313127046150596,positive
2021-02-03 09:03:00.000,491.95,507.8,489.3,500.8,3469650.0,Glenmark Pharma receives ANDA approval from USFDA for Topiramate Extended‐Release Capsules,"Glenmark Pharmaceuticals receives ANDA approval for
Topiramate Extended-Release Capsules,
25 mg, 50 mg, 100 mg, 150 mg, and 200 mg",positive,positive,1.798963309279403,positive,-0.3178386968613361,neutral
2021-02-03 09:48:00.000,491.95,507.8,489.3,500.8,3469650.0,Glenmark Pharma gains after USFDA approves,Glenmark Pharmaceuticals rose 1.85% to Rs 496.35 after the company said it received final approval from the US drug regulator for topiramate extended-release capsules.,positive,positive,1.798963309279403,positive,-0.3178386968613361,neutral
2021-02-03 10:40:00.000,491.95,507.8,489.3,500.8,3469650.0,Glenmark Pharma gets USFDA nod for seizure treatment drug,"Glenmark Pharmaceuticals Ltd has received final approval from the United States Food and Drug Administration (USFDA) for Topiramate extended-release capsules USP in the strengths of 25 mg, 50 mg, 100 mg, 150 mg, and 200 mg, Glenmark said in a regulatory filing.",neutral,positive,1.798963309279403,positive,-0.3178386968613361,neutral
2021-02-03 10:44:27.000,491.95,507.8,489.3,500.8,3469650.0,Glenmark Pharma Share Price Up 2% On Final Approval From USFDA For Topiramate Extended-Release Capsules,"The share touched its 52-week high Rs 572.70 and 52-week low Rs 168 on 22 June, 2020 and 13 March, 2020, respectively.",neutral,negative,1.798963309279403,positive,-0.3178386968613361,neutral
2021-02-03 12:32:24.000,503.4,509.0,499.1,501.8,1330637.0,Glenmark Pharma Gets USFDA Nod For Seizure Treatment Drug,"The approved product is a generic version of Qudexy XR Capsules of Upsher-Smith Laboratories, LLC.",neutral,neutral,-0.3178386968613361,neutral,-0.6125271685437705,neutral
2021-02-10 08:31:00.000,505.0,510.0,492.3,508.5,2060168.0,"Tata Steel, Berger Paints, Glenmark Pharma in focus","Tata Steel reported 54.03% drop in consolidated net profit to Rs 1,565.41 crore on 7.4% rise in total income to Rs 37,531.67 crore in Q3 December 2020 over Q3 December 2019.",neutral,negative,0.6930693069306931,neutral,-0.2959163543105149,neutral
2021-02-10 09:26:00.000,505.0,510.0,492.3,508.5,2060168.0,"Stocks in news: Berger Paints, Torrent Power, Tata Steel, Interglobe Aviation, Glenmark Pharma","Stocks to watch today on February 10: Berger Paints, Torrent Power, Tata Steel, Interglobe Aviation, Glenmark Pharma among others are the top stocks to watch out for in Wednesday’s trading session",neutral,neutral,0.6930693069306931,neutral,-0.2959163543105149,neutral
2021-02-11 10:37:00.000,506.9,510.0,502.0,505.4,1236961.0,Glenmark Pharmaceuticals receives USFDA approval for Clindamycin Phosphate Gel,"According to IQVIATM sales data for the 12 month period ending December 2020, the Cleocin T Gel,
1% market achieved annual sales of approximately $73.8 million.",positive,positive,-0.2959163543105149,neutral,-0.9745053647012478,negative
2021-02-11 11:05:32.000,506.9,510.0,502.0,505.4,1236961.0,Glenmark gets USFDA nod for acne treatment drug,"Drug major Glenmark Pharma on Thursday said it has received final approval from the US health regulator for Clindamycin Phosphate Gel, used to treat acne. The approved product is a generic version of",neutral,positive,-0.2959163543105149,neutral,-0.9745053647012478,negative
2021-02-11 11:13:50.000,506.9,510.0,502.0,505.4,1236961.0,Glenmark Pharma Gets USFDA Nod For Acne Treatment Drug,"The approved product is a generic version of Cleocin T Gel, 1 per cent, of Pharmacia & Upjohn.",neutral,neutral,-0.2959163543105149,neutral,-0.9745053647012478,negative
2021-02-11 11:36:00.000,506.9,510.0,502.0,505.4,1236961.0,Glenmark Pharma gets USFDA nod for acne treatment drug,"The drug maker said it has received the final approval from the US drug regulator for clindamycin phosphate gel, 1%.",neutral,positive,-0.2959163543105149,neutral,-0.9745053647012478,negative
2021-02-12 23:44:00.000,507.95,510.95,502.0,503.0,1058778.0,Glenmark Pharmaceuticals net profit up 30% at Rs 248.17 cr in Dec qtr,Glenmark on Friday reported a 30.04 percent rise in its consolidated net profit to Rs 248.17 crore for the quarter ended December 2020,positive,positive,-0.9745053647012478,negative,-3.5294117647058822,negative
2021-02-15 10:14:17.000,510.0,511.6,488.2,492.0,2329249.0,"​Glenmark Pharmaceuticals, Bharti Airtel, GMR Infrastructure: Top Stocks for Investors Today",The Bombay Stock Exchange (BSE) on Friday ended flat while the National Stock Exchange (NSE) closed in the red.,neutral,neutral,-3.5294117647058822,negative,1.8245967741935507,positive
2021-02-15 23:38:04.000,496.0,505.8,490.1,505.05,2489770.0,Glenmark Pharmaceuticals ADR (GLKQY) Management on Q3 2021 Results - Earnings Call Transcript,"Glenmark Pharmaceuticals ADR (OTC:GLKQY) Q3 2021 Results Conference Call February 14, 2021 10:00 PM ET Company Participants Jason D’souza - SVP, Corporate Strategy, Investor Relations Ravi...",neutral,neutral,1.8245967741935507,positive,-2.3428232502965645,negative
2021-02-16 09:47:00.000,496.0,505.8,490.1,505.05,2489770.0,Glenmark Pharma launches generic cancer drug in India,"The drug maker launched SUTIB, the generic version of Sunitinib oral capsules to treat kidney cancer, in India.",neutral,neutral,1.8245967741935507,positive,-2.3428232502965645,negative
2021-02-16 11:48:00.000,496.0,505.8,490.1,505.05,2489770.0,Glenmark launches kidney cancer treatment drug in India priced 96% lower than innovator brand,"In a regulatory filing, Glenmark Pharma said it launched “SUTIB, the generic version of Sunitinib oral capsules to treat kidney cancer in India. The drug is launched at a MRP that is approximately 96 per cent lower than the MRP (maximum retail price) compared to the innovator brand, priced at Rs 7,0…",neutral,positive,1.8245967741935507,positive,-2.3428232502965645,negative
2021-02-16 16:16:00.000,505.8,508.25,492.65,493.95,1369858.0,Glenmark Pharma launches generic version of Sunitinib oral capsules after USFDA nods,SUTIB is the generic version of US FDA approved Sunitinib. The drug is launched at a MRP that is approx. 96% lower than the MRP compared to the innovator brand.,neutral,neutral,-2.3428232502965645,negative,-0.6565656565656566,neutral
2021-02-16 18:43:00.000,505.8,508.25,492.65,493.95,1369858.0,"Asset monetisation, sales uptick in US key triggers for Glenmark Pharma",The India business is expected to post double digit growth in FY22,positive,positive,-2.3428232502965645,negative,-0.6565656565656566,neutral
2021-02-17 16:32:08.000,495.0,497.45,488.6,491.75,1428978.0,Buy Glenmark Pharmaceuticals; Target Of Rs 635: ICICI Direct,"ICICI Direct is bullish on Glenmark Pharmaceuticals has recommended buy rating on the stock with a target price of Rs 635 in its research report dated February 15, 2021.",neutral,positive,-0.6565656565656566,neutral,-1.9109575116893636,negative
2021-02-18 20:43:52.000,491.9,501.85,478.15,482.5,3004689.0,Broker’s call: Glenmark Pharma (Sell),Prabhudas LilladherGlenmark Pharma (Sell)Target: ₹446CMP: ₹492We reduce our earnings estimate by one per cent for FY22/23 as we lower our growth projections for semi-regulated market. Q3 FY21 earnings,neutral,negative,-1.9109575116893636,negative,-2.974592026440825,negative
2021-02-22 05:30:00.000,484.1,485.8,467.0,469.7,1531050.0,BRIEF-Glenmark Pharma Gets Russian Marketing Approval For Ryaltris Nasal Spray,BRIEF-Glenmark Pharma Gets Russian Marketing Approval For Ryaltris Nasal Spray,neutral,neutral,-2.974592026440825,negative,-0.8315565031982894,neutral
2021-02-22 09:21:00.000,484.1,485.8,467.0,469.7,1531050.0,Glenmark Pharma’s Ryaltris gets approval in Russia,"The drug maker announced that its Swiss subsidiary, Glenmark Specialty S.A., received marketing approval from the Ministry of Health of the Russian Federation for Ryaltris nasal spray.",positive,positive,-2.974592026440825,negative,-0.8315565031982894,neutral
2021-02-22 11:38:49.000,484.1,485.8,467.0,469.7,1531050.0,Glenmark arm gets Russian Health Ministry nod for nasal spray Ryaltris,Glenmark Pharmaceuticals on Monday said its Swiss subsidiary has received marketing approval from the Russian health regulator for its nasal spray Ryaltris.Ryaltris is indicated for symptomatic treatm,neutral,positive,-2.974592026440825,negative,-0.8315565031982894,neutral
2021-02-22 13:22:00.000,469.0,476.2,461.0,465.1,1463744.0,Glenmark Pharma’s nasal spray Ryaltris gets Russian health ministry’s approval,"In Russia, allergic rhinitis affects 10-20 per cent of the population on average, with certain regions having a higher prevalence rate of 18-38 per cent",neutral,neutral,-0.8315565031982894,neutral,-0.6718566705769509,neutral
2021-02-25 10:22:00.000,469.85,478.0,468.6,474.1,1730310.0,Glenmark Pharma receives “India Pharma Innovation of the Year” award; Stock ends higher,"On Sensex, Glenmark finished at Rs472.55 per piece up 1.3%.",neutral,positive,0.904544003405342,positive,-1.1382978723404304,negative
2021-03-03 05:30:00.000,479.5,481.0,473.1,478.8,1173214.0,BRIEF-Celon Pharma Signs License Deal With Glenmark Pharmaceuticals Regarding Salmex,BRIEF-Celon Pharma Signs License Deal With Glenmark Pharmaceuticals Regarding Salmex,neutral,neutral,-0.1459854014598516,neutral,-0.4210526315789473,neutral
2021-03-05 09:25:00.000,473.9,474.55,465.0,469.4,1006050.0,Glenmark Pharmaceuticals signs Rohit Sharma as brand ambassador for Candid Powder,"Skin problems are increasingly common today, resulting from hot and humid climate conditions. Glenmarkfs
Candid Dusting Powder is an expert skin solution to four key skin problems: redness, irritation, sweat rash and
fungal infections.",neutral,neutral,-0.9495674192867696,negative,3.3846153846153824,positive
2021-03-05 10:40:00.000,473.9,474.55,465.0,469.4,1006050.0,Glenmark Pharma signs Rohit Sharma as brand ambassador,"Rohit Sharma has “officially signed on to represent Glenmark’s Candid Powder, a legacy brand of the company’s consumer care division”, the company said in a statement.",neutral,positive,-0.9495674192867696,negative,3.3846153846153824,positive
2021-03-05 12:05:00.000,473.9,474.55,465.0,469.4,1006050.0,Glenmark Pharma signs Rohit Sharma as brand ambassador for Candid Powder,Drug major Glenmark Pharma on Friday said it has signed cricketer Rohit Sharma as brand ambassador for its product Candid Powder.,neutral,positive,-0.9495674192867696,negative,3.3846153846153824,positive
2021-03-09 14:23:08.000,477.95,491.5,476.1,486.9,2058176.0,Glenmark Pharma Looking To Unlock Value Of API Arm Via IPO Route In 2021,The Glenmark IPO plan is being seen as a value unlocking exercise by the promoters. Investors will have the option or flexibility of betting on a pure play API business,neutral,positive,1.872580813892664,positive,-3.0287630856794343,negative
2021-03-19 14:58:00.000,448.0,459.95,443.0,457.7,1222707.0,Glenmark Pharma announces TOSM to holders of its outstanding US $200mn bonds; stock slumps 3%,The company launches invitation to holders to tender such bonds for purchase by the company for cash subject to satisfaction or waiver of the offer condition and to approve the amendment to the optional put notice period.,negative,neutral,2.165178571428569,positive,0.3376906318082813,neutral
2021-03-22 05:30:00.000,459.0,467.8,456.05,460.55,1111582.0,BRIEF-Glenmark Pharmaceuticals Says Unit To Commercialize Ryaltris Nasal Spray In Canada,BRIEF-Glenmark Pharmaceuticals Says Unit To Commercialize Ryaltris Nasal Spray In Canada,neutral,neutral,0.3376906318082813,neutral,0.4310344827586206,neutral
2021-03-22 11:06:00.000,459.0,467.8,456.05,460.55,1111582.0,Glenmark Pharma subsidiary to commercialize Ryaltris nasal spray in Canada,"Glenmark Specialty S.A. in Switzerland and an affiliate of Bausch Health Companies Inc. have entered into an exclusive licensing agreement for the commercialization of Glenmark’s innovative nasal spray Ryaltris, under review by Health Canada.",neutral,positive,0.3376906318082813,neutral,0.4310344827586206,neutral
2021-03-23 09:49:00.000,464.0,470.0,460.75,466.0,1023827.0,Glenmark Pharma gains on final USFDA nod on diltiazem hydrochloride capsules,Glenmark Pharmaceuticals rose 1.10% to Rs 465 after the company received final approval from the US drug regulator for diltiazem hydrochloride extended‐release capsules.,positive,positive,0.4310344827586206,neutral,-1.4592274678111612,negative
2021-03-23 14:27:00.000,466.0,471.0,458.0,459.2,1395168.0,Glenmark gets USFDA nod for generic high blood pressure drug,Drug firm Glenmark Pharmaceuticals on Tuesday said it has received approval from the US health regulator for its generic Diltiazem Hydrochloride,neutral,positive,-1.4592274678111612,negative,-3.514689880304674,negative
2021-03-23 14:38:00.000,466.0,471.0,458.0,459.2,1395168.0,Glenmark Pharma | USFDA: Glenmark gets USFDA nod for generic high blood pressure drug,Drug firm Glenmark Pharmaceuticals on Tuesday said it has received approval from the US health regulator for its generic Diltiazem Hydrochloride extended-release capsules used for the treatment of high blood pressure.,neutral,positive,-1.4592274678111612,negative,-3.514689880304674,negative
2021-03-23 16:10:12.000,466.0,471.0,458.0,459.2,1395168.0,Glenmark Pharmaceuticals gets $40-million Covid loan from IFC,World Bank Group lender’s loan is under its $8-billion credit-line Covid-19 facility,neutral,neutral,-1.4592274678111612,negative,-3.514689880304674,negative
2021-03-24 09:18:00.000,466.0,471.0,458.0,459.2,1395168.0,Glenmark gets USFDA nod for Chlorpromazine Hydrochloride,Glenmark Pharmaceuticals on Wednesday before trading hours today announced that the company has received a final approval from the USFDA for Chlorpromazine Hydrochloride Tablets.,neutral,positive,-1.4592274678111612,negative,-3.514689880304674,negative
2021-03-24 10:33:17.000,466.0,471.0,458.0,459.2,1395168.0,Glenmark Pharma Share Price Gains On USFDA Nod For Chlorpromazine Hydrochloride Tablets,"The share touched a 52-week high of Rs 572.70 and a 52-week low of Rs 184 on 22 June, 2020 and 23 March, 2020, respectively.",neutral,negative,-1.4592274678111612,negative,-3.514689880304674,negative
