date,open,high,low,close,volume,title,description,title_sentiment,desc_sentiment,daily_change_pct,market_sentiment,next_day_change_pct,next_day_sentiment
2021-11-12 08:37:00.000,514.85,529.5,512.7,524.05,1348953.0,"Stocks to Watch: ONGC, Hindalco, Zee, NMDC, Tata Steel, Aptech, VodaIdea","Amaraja Batteries, Apollo Hospitals, Ashok Leyland, Bharat Forge, BPL, Glenmark Pharma, Hero MotoCorp, Vodafone Idea, National Aluminium, Reliance Capital, SpiceJet and Suzlon are some of the stocks",neutral,neutral,1.7869282315237316,positive,2.586124630212798,positive
2021-11-15 11:39:00.000,523.95,539.55,522.3,537.5,2562119.0,Glenmark Pharma gains after Q2 PAT rises 10% YoY to Rs 257 crore,"Glenmark Pharmaceuticals gained 1.41% to Rs 531.05 after the drug company posted a 10.1% increase in consolidated net profit to Rs 257.66 crore on a 7.5% rise in net sales to Rs 3,125.43 crore in Q2 FY22 over Q2 FY21.",positive,positive,2.586124630212798,positive,-4.019352437662825,negative
2021-11-15 17:18:00.000,537.4,543.5,515.0,515.8,3153790.0,Glenmark Pharma reports revenue growth of 6.6% and PAT growth of 10.1% yoy for Q2FY22; Stock gains ~1.5%,"Sales from the formulation business in India for Q2FY22 was at Rs968.9cr as against Rs1,050.7cr in the previous corresponding quarter, recording a de-growth of 7.8% yoy.",positive,positive,-4.019352437662825,negative,-3.31721470019342,negative
2021-11-16 05:30:00.000,537.4,543.5,515.0,515.8,3153790.0,Glenmark Pharmaceuticals makes it to the prestigious Dow Jones Sustainability emerging markets index for the fourth consecutive year,"Mumbai (Maharashtra) [India], November 16 (ANI/PRNewswire): Glenmark Pharmaceuticals Ltd. (Glenmark), a research-led global integrated pharmaceutical company, today announced that the company has been listed in the Dow Jones Sustainability Index",neutral,neutral,-4.019352437662825,negative,-3.31721470019342,negative
2021-11-16 09:02:00.000,537.4,543.5,515.0,515.8,3153790.0,Glenmark Pharmaceuticals gets listed in Dow Jones Sustainability Index for emerging market,Powered by Capital Market - Live News,neutral,neutral,-4.019352437662825,negative,-3.31721470019342,negative
2021-11-16 10:46:46.000,537.4,543.5,515.0,515.8,3153790.0,Glenmark Pharma Share Price Falls 3%; Morgan Stanley Remains ‘underweight’,"Glenmark Pharmaceuticals has been listed on the Dow Jones Sustainability Index under the category of emerging markets for the fourth consecutive year, the company has said",neutral,neutral,-4.019352437662825,negative,-3.31721470019342,negative
2021-11-16 14:58:06.000,517.0,517.45,499.0,499.85,1307768.0,Accumulate Glenmark Pharmaceuticals; Target Of Rs 600: Prabhudas Lilladher,"Prabhudas Lilladher recommended accumulate rating on Glenmark Pharmaceuticals with a target price of Rs 600 in its research report dated November 16, 2021.",neutral,positive,-3.31721470019342,negative,-3.8292780215396864,negative
2021-11-16 15:24:23.000,517.0,517.45,499.0,499.85,1307768.0,Neutral Glenmark Pharma; Target Of Rs 560: Motilal Oswal,"Motilal Oswal recommended Neutral rating on Glenmark Pharma with a target price of Rs 560 in its research report dated November 15, 2021.",neutral,positive,-3.31721470019342,negative,-3.8292780215396864,negative
2021-11-16 17:24:00.000,517.0,517.45,499.0,499.85,1307768.0,Glenmark Pharma makes it to Dow Jones Sustainability Emerging Markets Index for 4th year in a row,"Over 800 companies across sectors from the emerging markets were assessed, out of which around 108 made it to the prestigious index this year including 15 from India.",neutral,neutral,-3.31721470019342,negative,-3.8292780215396864,negative
2021-11-18 15:02:40.000,501.4,504.0,480.85,482.2,1446920.0,Accumulate Glenmark Pharmaceuticals Target Of Rs 575: Geojit,"Geojit recommended accumulate rating on Glenmark Pharmaceuticals with a target price of Rs 575 in its research report dated November 18, 2021.",neutral,positive,-3.8292780215396864,negative,-3.092145949288806,negative
2021-11-22 09:29:00.000,485.1,486.2,457.0,470.1,1841536.0,S&P Global Ratings upgrades Glenmark Pharma to BB on expected maintenance of lower leverage,The stable outlook reflects our view that Glenmark will maintain its financial policy such that its FFO-to-debt ratio will remain comfortably above 30%.,negative,positive,-3.092145949288806,negative,10.920770877944326,positive
2021-11-23 12:04:07.000,517.2,526.75,510.45,518.5,2271393.0,Raymond Ltd leads gainers in ‘A’ group,"Glenmark Pharmaceuticals Ltd, Aptech Ltd, Gateway Distriparks Ltd and NRB Bearings Ltd are among the other gainers in the BSE’s ‘A’ group today, 23 November 2021.",positive,positive,0.2513534416086532,neutral,1.9638043896804092,positive
2021-11-24 07:09:00.000,517.2,526.75,510.45,518.5,2271393.0,"Trade Spotlight | What Should You Do With Glenmark Pharma, Navin Fluorine, Raymond & Birlasoft Stocks?","Here’s what Mazhar Mohammad of chartviewindia.in, recommends investors should do with these stocks when the market resumes trading today.",neutral,neutral,0.2513534416086532,neutral,1.9638043896804092,positive
2021-11-25 13:16:21.000,526.8,551.8,522.3,530.05,4680477.0,"Glenmark Pharmaceuticals Ltd spurts 1.97%, up for third straight session","Glenmark Pharmaceuticals Ltd is quoting at Rs 530, up 1.97% on the day as on 12:54 IST on the NSE. The stock is up 13.03% in last one year as compared to a 34.53% gain in NIFTY and a 14.62% gain in the Nifty Pharma index.",positive,positive,0.6169324221716022,neutral,-5.272895467160037,negative
2021-11-25 14:31:26.000,526.8,551.8,522.3,530.05,4680477.0,Glenmark Pharmaceuticals Ltd jumps around 2%,"Glenmark Pharmaceuticals Ltd is quoting at Rs 530, up 1.97% on the day as on 12:54 IST on the NSE. The stock is up 13.03% in last one year as compared to a 34.53% gain in NIFTY and a 14.62% gain in the Nifty Pharma index.",positive,positive,0.6169324221716022,neutral,-5.272895467160037,negative
2021-11-29 09:37:00.000,540.5,541.9,511.0,512.0,2293946.0,"Buy Glenmark Pharma, target price Rs 560: Yes Securities","Glenmark Pharmaceuticals Ltd., incorporated in the year 1977, is a mid-cap company (with a market cap of Rs 14826.53 crore) operating in pharmaceuticals sector.",neutral,neutral,-5.272895467160037,negative,2.609122118685621,positive
2021-12-15 17:30:00.000,504.6,507.55,491.1,498.0,1426445.0,"Stocks in news: ITC, One97 Communications, State Bank of India, Infosys and more","Stocks in news: One97 Communications, Natco Pharma, Axis Bank, Emami, Glenmark Pharmaceuticals, HDFC, State Bank of India and more",neutral,neutral,-1.307966706302026,negative,-2.813634530052438,negative
2021-12-16 16:10:00.000,495.8,499.85,478.2,481.85,1254882.0,"Nifty Pharma underperforms amid Omicron concerns; Heavyweights Alembic, Sun Pharma, Biocon weigh down","Stocks like Glenmark Pharma, Gland Pharma, Granules recorded 1.16% drop each.",negative,negative,-2.813634530052438,negative,1.6458333333333286,positive
2021-12-20 13:50:36.000,491.1,496.5,484.05,488.4,1195313.0,Glenmark Pharmaceuticals Ltd slips for fifth straight session,"Glenmark Pharmaceuticals Ltd is quoting at Rs 479.45, down 0.66% on the day as on 13:24 IST on the NSE. The stock tumbled 1.86% in last one year as compared to a 23.81% rally in NIFTY and a 6.5% spurt in the Nifty Pharma index.",negative,negative,-0.5497861942577978,neutral,2.107632494372828,positive
2021-12-24 11:47:00.000,506.45,508.5,492.45,495.25,874563.0,CRISIL revises rating outlook of Glenmark Pharma to ‘Positive’,Glenmark Pharmaceuticals said that CRISIL Ratings has revised its outlook on the company’s long-term bank facilities to ‘Positive’ from ‘Stable’ while reaffirming the rating at ‘CRISIL AA-’.,positive,neutral,-2.211472011057358,negative,3.5431472081218254,positive
2021-12-24 16:40:00.000,506.45,508.5,492.45,495.25,874563.0,CRISIL upgrades credit rating of Glenmark Pharma; Stock under pressure,The long-term rating has been reaffirmed at AA with Outlook revised to Positive from Stable.,positive,positive,-2.211472011057358,negative,3.5431472081218254,positive
2021-12-27 17:42:00.000,510.2,514.0,507.05,513.55,581476.0,"Nifty Pharma leads market revival; Index surges over 1%; Lupin, Cipla among top gainers","Laurus Labs, Torrent Pharma, Natco Pharma, and Glenmark Pharma outperformed. Pfizer was under pressure.",positive,positive,0.656605252842016,neutral,0.8949416342412496,neutral
2021-12-28 07:22:18.000,510.2,514.0,507.05,513.55,581476.0,"Trade Spotlight | What Should You Do With Laurus Labs, Glenmark Pharma, Ashoka Buildcon, And Vakrangee?","Here’s what Karan Pai of GEPL Capital, recommends investors should do with these stocks when the market resumes trading today",neutral,neutral,0.656605252842016,neutral,0.8949416342412496,neutral
2021-12-28 09:00:00.000,510.2,514.0,507.05,513.55,581476.0,Glenmark Pharma Ready to Make Demand,Glenmark Pharma Ready to Make Demand,neutral,neutral,0.656605252842016,neutral,0.8949416342412496,neutral
2021-12-31 08:45:00.000,526.0,531.25,524.4,528.0,737777.0,Nandish Shah recommends a Bull spread on Glenmark Pharma for January series,"Pharma as a sector looking good on the short term chart, according to Nandish Shah of HDFC Securities.",neutral,neutral,0.3802281368821292,neutral,-1.0849056603773584,negative
2021-12-31 10:02:00.000,526.0,531.25,524.4,528.0,737777.0,"Buy Glenmark Pharmaceuticals, target price Rs 607: ICICI Securities","Glenmark Pharmaceuticals Ltd., incorporated in the year 1977, is a Mid Cap company (having a market cap of Rs 14809.60 Crore) operating in Pharmaceuticals sector.",neutral,neutral,0.3802281368821292,neutral,-1.0849056603773584,negative
2021-12-31 13:04:22.000,526.0,531.25,524.4,528.0,737777.0,"Glenmark Pharmaceuticals Ltd spurts 0.72%, gains for fifth straight session","Glenmark Pharmaceuticals Ltd is quoting at Rs 528.65, up 0.72% on the day as on 12:49 IST on the NSE. The stock is up 5.18% in last one year as compared to a 24.07% jump in NIFTY and a 9.42% jump in the Nifty Pharma.",positive,positive,0.3802281368821292,neutral,-1.0849056603773584,negative
2022-01-02 17:30:00.000,530.0,531.2,522.3,524.25,506565.0,Glenmark Pharma inks exclusive licensing agreement with Lotus International,Glenmark will be responsible for manufacturing and supply of Ryaltris,positive,neutral,-1.0849056603773584,negative,-1.3638531235097715,negative
2022-01-10 11:53:53.000,510.65,523.75,508.2,520.7,850878.0,"Ipca, Ajanta, Sun, Torrent report strong sales growth during December: IPM data","The companies that derived large contributions from covid treatment drug sales during 2020 – Cadila Healthcare Ltd, Cipla Ltd , Glenmark Pharmaceuticals Ltd – saw a soft sales growth on a high base of last year",positive,positive,1.9680798981690135,positive,-0.0288739172280995,neutral
2022-01-13 15:21:59.000,524.25,528.7,513.6,515.0,993588.0,Glenmark Pharmaceuticals Q3 PAT Seen Up 17.8% YoY To Rs 292.4 Cr: Prabhudas Lilladher,"Net Sales are expected to increase by 10.3 percent Y-o-Y (down 2.4 percent Q-o-Q) to Rs 3,073.1 crore, according to Prabhudas Lilladher.",neutral,positive,-1.764425369575584,negative,0.1937984496124031,neutral
2022-01-14 08:59:00.000,524.25,528.7,513.6,515.0,993588.0,Glenmark Pharmaceuticals subsidiary bags USFDA nod on Ryaltris nasal spray,"Glenmark Pharmaceuticals announced that its wholly-owned subsidiary, Glenmark Specialty S.A. (Switzerland), received a United States Food & Drug Administration (FDA) approval for its New Drug Application (NDA), Ryaltris nasal spray.",neutral,positive,-1.764425369575584,negative,0.1937984496124031,neutral
2022-01-14 10:14:00.000,524.25,528.7,513.6,515.0,993588.0,Glenmark gets USFDA nod for nasal spray to treat seasonal allergic rhinitis,"Glenmark Pharmaceuticals on Friday said its subsidiary has received approval from the US health regulator to market Ryaltris, a nasal spray for the treatment of seasonal allergic rhinitis.",neutral,positive,-1.764425369575584,negative,0.1937984496124031,neutral
2022-01-14 10:15:35.000,524.25,528.7,513.6,515.0,993588.0,Glenmark Pharma Gets USFDA Nod For Nasal Spray To Treat Seasonal Allergic Rhinitis,"The company’s fully-owned unit Glenmark Specialty SA (Switzerland) has received approval from the USFDA for its new drug application (NDA) for Ryaltris, a fixed-dose (metered), prescription, combination nasal spray, Glenmark Pharmaceuticals said in a statement.",neutral,positive,-1.764425369575584,negative,0.1937984496124031,neutral
2022-01-14 10:55:02.000,524.25,528.7,513.6,515.0,993588.0,Glenmark Pharma Gets US Drug Regulator’s Nod For Nasal Spray,The product is used for the treatment of symptoms of seasonal allergic rhinitis in adults and pediatric patients 12 years of age and older.,neutral,neutral,-1.764425369575584,negative,0.1937984496124031,neutral
2022-01-14 15:48:00.000,524.25,528.7,513.6,515.0,993588.0,Glenmark gets FDA approval for nasal spray for seasonal allergic rhinitis,Glenmark Pharmaceuticals Limited said its subsidiary Glenmark Specialty S.A. has received US FDA approval for nasal spray fixed dose prescription drug for seasonal allergic rhinitis Ryaltris.,positive,positive,-1.764425369575584,negative,0.1937984496124031,neutral
2022-01-17 09:17:00.000,516.0,520.0,505.0,517.0,999589.0,Glenmark Pharma receives tentative approval for regadenoson injection,Glenmark Pharmaceuticals on Monday announced that it has received tentative approval from the United States Food & Drug Administration for regadenoson injection.,positive,positive,0.1937984496124031,neutral,-4.415458937198072,negative
2022-01-17 09:22:00.000,516.0,520.0,505.0,517.0,999589.0,Glenmark Pharmaceuticals receives USFDA approval for Regadenoson Injection,"According to IQVIATM sales data for the 12 month period ending November 2021, the Lexiscan Injection, 0.4 mg/5 mL (0.08 mg/mL) market achieved annual sales of approximately $659.9 million.",positive,neutral,0.1937984496124031,neutral,-4.415458937198072,negative
2022-01-17 10:26:08.000,516.0,520.0,505.0,517.0,999589.0,Glenmark Pharma Gets Tentative USFDA Nod For Generic Regadenoson Injection,Regadenoson injection is given during the preparation for a radiologic examination of blood flow through the heart to test for coronary artery disease.,neutral,neutral,0.1937984496124031,neutral,-4.415458937198072,negative
2022-01-17 10:34:00.000,516.0,520.0,505.0,517.0,999589.0,Glenmark Pharma gets tentative FDA nod for generic Regadenoson injection,Glenmark Pharmaceuticals said its US arm has received tentative approval from the country’s health regulator for its generic Regadenoson injection,positive,positive,0.1937984496124031,neutral,-4.415458937198072,negative
2022-01-17 14:09:56.000,517.5,521.5,491.0,494.65,1486343.0,Glenmark Pharma receives ANDA tentative approval for Regadenoson injection,Glenmark Pharma receives ANDA tentative approval for Regadenoson injection,positive,positive,-4.415458937198072,negative,0.3334680679062201,neutral
2022-01-17 18:27:00.000,517.5,521.5,491.0,494.65,1486343.0,Glenmark Pharma gets USFDA approval for Regadenoson Injection; Stock stays steady,"The Lexiscan Injection, 0.4 mg/5 mL (0.08 mg/mL) market achieved annual sales of approximately $659.9 million.",positive,positive,-4.415458937198072,negative,0.3334680679062201,neutral
2022-01-20 09:13:00.000,498.4,500.0,491.2,499.1,649432.0,Glenmark Pharmaceuticals signs licensing deal with Lotus International,"Under the terms of the agreement, Glenmark will be responsible for the manufacture and supply of Ryaltris, whereas Lotus will be responsible for commercialization of Ryaltris (subject to receipt of regulatory approvals), in these markets. Glenmark",positive,positive,0.1404494382022563,neutral,-2.6741731175228733,negative
2022-01-20 10:24:00.000,498.4,500.0,491.2,499.1,649432.0,Glenmark Pharma inks exclusive licensing agreement with Lotus International,"Glenmark will receive an upfront payment as well as regulatory and sales-based milestone payments from Lotus, it added.",positive,neutral,0.1404494382022563,neutral,-2.6741731175228733,negative
2022-01-20 10:46:13.000,498.4,500.0,491.2,499.1,649432.0,Glenmark Pharma Inks Exclusive Licensing Agreement With Lotus International,"Under the agreement signed between Glenmark Specialty SA and the wholly-owned subsidiary of Lotus Pharmaceutical Co, Ltd (Lotus), Glenmark will be responsible for manufacturing and supply of Ryaltris.",positive,positive,0.1404494382022563,neutral,-2.6741731175228733,negative
2022-01-27 09:38:00.000,480.0,485.5,474.05,476.65,1391478.0,Glenmark Pharma receives final approval for hypertension treatment drug,Glenmark Pharmaceuticals on Thursday announced that it received final approval from the USFDA for bisoprolol fumarate and hydrochlorothiazide tablets.,positive,positive,-0.6979166666666714,neutral,1.7424874791318914,positive
2022-01-27 10:21:17.000,480.0,485.5,474.05,476.65,1391478.0,Glenmark Pharma arm gets final USFDA approval for blood pressure drug,Generic Bisoprolol Fumarate and Hydrochlorothiazide are tablets used to treat high blood pressure,positive,neutral,-0.6979166666666714,neutral,1.7424874791318914,positive
2022-01-27 10:47:17.000,480.0,485.5,474.05,476.65,1391478.0,Glenmark Pharma Arm Gets Final USFDA Approval For Blood Pressure Drug,"The approval granted to Glenmark Pharmaceuticals Inc, USA by the United States Food & Drug Administration (USFDA) is for Bisoprolol Fumarate and Hydrochlorothiazide tablets of strengths 2.5 mg/6.25 mg, 5 mg/6.25 mg, and 10 mg/6.25 MG, the company said in a statement.",neutral,neutral,-0.6979166666666714,neutral,1.7424874791318914,positive
2022-01-27 14:46:17.000,479.2,496.65,476.0,487.55,651400.0,Glenmark Pharma arm gets final US FDA approval for blood pressure drug,Glenmark Pharma arm gets final US FDA approval for blood pressure drug,positive,positive,1.7424874791318914,positive,-1.1994307786135348,negative
2022-01-27 15:26:00.000,479.2,496.65,476.0,487.55,651400.0,Glenmark Pharma receives ANDA approval for Bisoprolol Fumarate and Hydrochlorothiazide Tablets,Glenmark’s current product portfolio includes 172 products authorized for distribution in the U.S. markets and 46 ANDA’s are pending for approval with the U.S. FDA.,positive,neutral,1.7424874791318914,positive,-1.1994307786135348,negative
2022-01-28 12:12:37.000,479.2,496.65,476.0,487.55,651400.0,Glenmark Pharma Gets USFDA Nod For Generic Drug,"The drug firm has received final approval by the United States Food & Drug Administration (USFDA) for its product which is a generic version of Bausch Health US LLC’s MetroGel-Vaginal, the drug firm said in a statement.",neutral,positive,1.7424874791318914,positive,-1.1994307786135348,negative
2022-01-28 12:26:03.000,479.2,496.65,476.0,487.55,651400.0,Glenmark Pharmaceuticals gets US FDA approval to market Metronidazole Vaginal gel in US,Glenmark Pharmaceuticals gets US FDA approval to market Metronidazole Vaginal gel in US,positive,positive,1.7424874791318914,positive,-1.1994307786135348,negative
2022-01-28 14:10:00.000,479.2,496.65,476.0,487.55,651400.0,Glenmark gets nod from US Food & Drug Administration for generic drug,"Glenmark Pharmaceuticals on Friday said its US-based unit has received approval from the US health regulator to market Metronidazole Vaginal gel, in the American market",neutral,positive,1.7424874791318914,positive,-1.1994307786135348,negative
2022-02-09 09:05:32.000,487.8,504.5,487.15,501.45,964202.0,Glenmark Pharma launches nasal spray for treatment of Covid patients in India,Glenmark Pharma launches Nitric Oxide Nasal Spray (FabiSpray) in India for the treatment of adult patients with Covid-19 in partnership with SaNOtize,neutral,positive,2.7982779827798234,positive,-0.9009900990099032,negative
2022-02-09 09:45:00.000,487.8,504.5,487.15,501.45,964202.0,Glenmark Pharma gains on launching FabiSpray in India,Glenmark Pharmaceuticals rose 1.90% to Rs 494.25 after the company launched Nitric Oxide Nasal Spray (FabiSpray) in India for the treatment of adult patients with COVID-19.,positive,positive,2.7982779827798234,positive,-0.9009900990099032,negative
2022-02-09 10:47:00.000,487.8,504.5,487.15,501.45,964202.0,"Glenmark Pharma, SaNOtize Research launch nasal spray for COVID-19 treatment in India",The Mumbai-based drug firm had earlier received manufacturing and marketing approval from the Drugs Controller General of India (DCGI) for the Nitric Oxide nasal spray (NONS) as part of the accelerated approval process. FabiSpray is designed to kill the COVID-19 virus in the upper airways.,neutral,positive,2.7982779827798234,positive,-0.9009900990099032,negative
2022-02-11 07:33:08.000,496.0,499.7,487.0,488.0,669649.0,"Stocks to Watch: ONGC, Arvind Fashions, Glenmark Pharma, Ashok Leyland","Shares of firms like Motherson Sumi Systems, ONGC, India Cements, Anupam Rasayan, Arvind Fashions, Ashok Leyland, Mrs Bectors Food Specialities, Force Motors, Glenmark PharmA, Godrej Industries, Nazara Technologies, Voltas will be in focus as they will announce their Q3 results today",neutral,neutral,-1.6129032258064515,negative,-1.4182194616977273,negative
2022-02-11 07:58:16.000,496.0,499.7,487.0,488.0,669649.0,"Stocks to Watch Today: ONGC, Zomato, Glenmark Pharma, Ashok Leyland, and Others","Stocks to Watch: Shares of firms like Motherson Sumi Systems, ONGC, India Cements, Anupam Rasayan, Arvind Fashions will be in focus as they will announce their Q3 results Today’s biggest stock Gainers Market News at news18.com",neutral,neutral,-1.6129032258064515,negative,-1.4182194616977273,negative
2022-02-14 10:15:00.000,483.0,495.0,475.0,476.15,795079.0,Glenmark Pharma inks pact with Astrazeneca to commercialize its product Pulmicort Respules in Columbia,"This partnership will ensure continued and increased access of this essential therapy, and thus bring in much needed therapeutic relief to asthma patients in Colombia.",positive,positive,-1.4182194616977273,negative,1.4217018607568497,positive
2022-02-15 08:40:35.000,478.3,487.1,468.05,485.1,725317.0,Stocks that will see action today (Feb 15),"Buzzing stocks: Reliance Industries, Vedanta, Concor, Crisil, Glenmark Pharma, Godrej Consumer, ABB, SpiceJet",neutral,neutral,1.4217018607568497,positive,0.2470152326060083,neutral
2022-02-28 17:30:00.000,445.0,450.15,433.2,449.0,902904.0,"Russia-Ukraine war: Cadila, Lupin, Glenmark Pharma shares among top losers",Shares of Indian pharma firms have emerged as major losers amid the ongoing Russia-Ukraine war. Indian pharma companies have significant exposure mainly to Russia and also Ukraine and their stocks have turned red till date since the war between the two neighbours started.,negative,negative,0.8988764044943821,neutral,0.9773837936129132,positive
2022-03-09 13:31:21.000,448.1,450.55,443.15,443.6,583650.0,Glenmark Pharmaceuticals Ltd stays supported,"Glenmark Pharmaceuticals Ltd is quoting at Rs 442.15, up 1.07% on the day as on 12:54 IST on the NSE. The stock is down 9.12% in last one year as compared to a 7.32% spurt in NIFTY and a 6.35% spurt in the Nifty Pharma index.",neutral,positive,-1.0042401249721045,negative,1.7264573991031362,positive
2022-03-11 13:17:02.000,446.0,456.75,439.0,453.7,1094170.0,Glenmark Pharmaceuticals stays in winning mode,"Glenmark Pharmaceuticals Ltd is quoting at Rs 453.05, up 1.68% on the day as on 12:49 IST on the NSE. The stock is down 5.37% in last one year as compared to a 10.75% jump in NIFTY and a 9.93% jump in the Nifty Pharma.",positive,positive,1.7264573991031362,positive,-1.8033868484715168,negative
2022-03-21 09:18:00.000,446.0,466.75,445.55,455.1,2420301.0,Glenmark Pharma receives final approval for partial onset seizures drug,Glenmark Pharmaceuticals on Monday announced that it has received final approval by the United States Food & Drug Administration (USFDA) for its lacosamide tablets.,positive,positive,2.040358744394624,positive,-1.543176097187263,negative
2022-03-21 09:52:01.000,446.0,466.75,445.55,455.1,2420301.0,Glenmark Pharma rises 2% as Lacosamide tablets get final approval from US watchdog,The company plans to launch the product immediately.,positive,neutral,2.040358744394624,positive,-1.543176097187263,negative
2022-03-21 09:58:00.000,446.0,466.75,445.55,455.1,2420301.0,Glenmark Pharma gets ANDA nod for Lacosamide Tablets USP; stock jumps ~2.5%,The company proposes to launch the product immediately.,positive,neutral,2.040358744394624,positive,-1.543176097187263,negative
2022-03-21 10:18:29.000,446.0,466.75,445.55,455.1,2420301.0,Glenmark Pharmaceuticals gets final USFDA nod for Lacosamide tablet,"The approval granted by the US Food & Drug Administration (USFDA) to the company’s arm Glenmark Pharmaceuticals Inc, USA, is for Lacosamide tablets of strengths 50 mg, 100 mg, 150 mg and 200 mg, Glenmark said in a statement.",neutral,positive,2.040358744394624,positive,-1.543176097187263,negative
2022-03-21 10:31:20.000,446.0,466.75,445.55,455.1,2420301.0,Glenmark Pharmaceuticals’ subsidiary gets US greenlight for Lacosamide tablets,The company in a filing with the BSE said it “plans to launch the product immediately”,neutral,neutral,2.040358744394624,positive,-1.543176097187263,negative
2022-03-21 17:30:00.000,456.85,459.55,444.5,449.8,895743.0,Glenmark Pharma shares zoom 5% on receiving US FDA approval for Lacosamide Tablets,The stock closed 2.50 per cent higher at Rs 455 against the previous close of Rs 443.90.,neutral,positive,-1.543176097187263,negative,-0.1103752759381898,neutral
2022-04-01 10:30:00.000,444.25,453.5,438.55,452.55,717596.0,"Sell Glenmark Pharmaceuticals, target price Rs 436.2: ICICI Direct","Glenmark Pharmaceuticals Ltd., incorporated in the year 1977, is a Mid Cap company (having a market cap of Rs 12471.83 Crore) operating in Pharmaceuticals sector.",neutral,neutral,1.868317388857628,positive,1.703539823008847,positive
