date,open,high,low,close,volume,title,description,title_sentiment,desc_sentiment,daily_change_pct,market_sentiment,next_day_change_pct,next_day_sentiment
2020-07-26 16:42:00.000,301.5,308.8,282.25,293.35,9917871.0,"Lupin, Granules India recall around 9.71 lakh bottles of diabetes drug in the US market","As per the latest Enforcement Report of the US Food and Drug Administration (USFDA), Lupin is recalling 4,92,858 bottles of Metformin Hydrochloride extended-release tablets in 500 mg and 1,000 strengths.",negative,negative,-2.7031509121061283,negative,-1.070882202957667,negative
2020-07-26 19:26:15.000,301.5,308.8,282.25,293.35,9917871.0,"Lupin, Granules India Recall 9.71 Lakh Bottles of Diabetes Drug in US Market","According to the USFDA, Lupin is recalling 4,92,858 bottles of Metformin Hydrochloride extended-release tablets in 500 mg and 1,000 mg strengths, while Hydera.",neutral,negative,-2.7031509121061283,negative,-1.070882202957667,negative
2020-07-26 19:39:17.000,301.5,308.8,282.25,293.35,9917871.0,"Lupin, Granules India recall 9.71 lakh bottles of diabetes drug in the US market",Drug makers Lupin and Granules India are recalling close to 9.71 lakh bottles of generic diabetes drug in the US due to possibility of the affected lot containing cancer causing nitrosodimethylamine (,negative,negative,-2.7031509121061283,negative,-1.070882202957667,negative
2020-07-26 21:27:34.000,301.5,308.8,282.25,293.35,9917871.0,"Lupin, Granules India recall around 9.71 lakh bottles of diabetes drug in the US market","Lupin is recalling 1,23,912 bottles of the 500 mg Metformin Hydrochloride extended-release tablets and 3,68,946 bottles of the same drug of 1,000 mg strength.",negative,negative,-2.7031509121061283,negative,-1.070882202957667,negative
2020-07-27 05:30:00.000,301.5,308.8,282.25,293.35,9917871.0,BRIEF-Granules India Says There Has Been No Additional Recall Since July 3 Recall - Investing.com India,"The Financial News section features stock market news in addition to stories about bonds, forex, commodities and economic releases.",neutral,neutral,-2.7031509121061283,negative,-1.070882202957667,negative
2020-08-03 12:16:09.000,301.0,309.45,296.85,302.7,5691975.0,Amber Enterprises India Ltd leads gainers in ‘A’ group,"Laurus Labs Ltd, Granules India Ltd, Ratnamani Metals & Tubes Ltd and Dixon Technologies (India) Ltd are among the other gainers in the BSEs A group today, 03 August 2020.",positive,neutral,0.5647840531561423,neutral,3.9678635841941374,positive
2020-08-24 08:17:00.000,320.0,324.35,316.2,318.5,2425855.0,"Stocks in the news: SBI, ICICI Lombard, LIC Housing, Granules India, Lupin, BHEL and Union Bank","NOCIL, Scooters India and Globus Spirits are among of the companies which will announce their June quarter results today.",neutral,neutral,-0.46875,neutral,-2.903074761979089,negative
2020-08-24 09:48:00.000,320.0,324.35,316.2,318.5,2425855.0,Granules India announces receipt of USFDA approval for Ramelteon Tablets,Granules now has a total of 29 ANDA approvals from US FDA (27 Final approvals and 2 tentative approvals).,positive,neutral,-0.46875,neutral,-2.903074761979089,negative
2020-08-24 12:18:00.000,320.35,321.3,310.0,311.05,1815978.0,Granules India rises 3% on USFDA nod to insomnia drug,"The company now has a total of 29 ANDA approvals from USFDA (27 final approvals and 2 tentative approvals), Granules India said.",neutral,positive,-2.903074761979089,negative,-1.3694267515923604,negative
2020-08-24 22:58:08.000,320.35,321.3,310.0,311.05,1815978.0,USFDA nod for Granules insomnia tablets,"The US Food and Drug Administration (USFDA) has approved the abbreviated new drug application (ANDA) filed by Granules Pharmaceuticals Inc., a subsidiary of Granules India, for Ramelteon tablets, 8 mg",neutral,positive,-2.903074761979089,negative,-1.3694267515923604,negative
2020-08-27 17:14:00.000,312.0,315.5,308.0,310.2,2054217.0,How Granules India transformed itself from a company making commodity APIs into one making formulations,"Company puts interim, long-term strategies in place to beat the pricing pressure in the US market and build a sustainable generics business. Currently, the US business contributes about 52 percent to the Granules’ total revenues.",positive,positive,-0.5769230769230806,neutral,0.608876782566889,neutral
2020-09-04 14:25:00.000,320.0,350.0,315.5,347.7,10025256.0,"Granules India rallies 8% in a weak market, hits fresh all-time high","The stock hit a record high of Rs 350 today. It has surged 13% thus far in the current week, as compared to a 2% decline in the S&P BSE Sensex",positive,positive,8.656249999999996,positive,6.957513544339903,positive
2020-09-07 12:16:09.000,374.5,382.0,355.35,356.95,7550764.0,Tata Motors-DVR leads gainers in ‘A’ group,"WABCO India Ltd, Himatsingka Seide Ltd, T.V. Today Network Ltd and Granules India Ltd are among the other gainers in the BSEs A group today, 07 September 2020.",positive,positive,-4.686248331108147,negative,4.726332423502367,positive
2020-09-10 14:47:00.000,365.0,372.85,341.35,347.45,8430609.0,Granules India hits fresh record high of Rs 384; rallies 24% in 2 weeks,Analysts expect launches in formulations and additional capacity in pharmaceutical formulation intermediate (PFIs) to be key growth drivers,positive,positive,-4.808219178082196,negative,6.048158640226635,positive
2020-09-11 05:30:00.000,365.0,372.85,341.35,347.45,8430609.0,BRIEF-Granules India Gets FDA Nod For ADHD Drug - Investing.com India,"The Financial News section features stock market news in addition to stories about bonds, forex, commodities and economic releases.",neutral,neutral,-4.808219178082196,negative,6.048158640226635,positive
2020-09-11 08:48:00.000,365.0,372.85,341.35,347.45,8430609.0,Granules India’s US subsidiary gets USFDA nod attention deficit hyperactivity disorder drug,"Granules’ capsule product is bioequivalent to the reference listed drug (RLD), Focalin XR.",neutral,neutral,-4.808219178082196,negative,6.048158640226635,positive
2020-09-11 09:15:00.000,365.0,372.85,341.35,347.45,8430609.0,Granules spurts after USFDA nod for ADHD drug,Granules India gained 4.68% to Rs 378 after the pharmaceutical company announced that its US subsidiary has received marketing approval from the USFDA for Dexmethylphenidate HCI extended-release capsules.,neutral,positive,-4.808219178082196,negative,6.048158640226635,positive
2020-09-11 09:20:00.000,365.0,372.85,341.35,347.45,8430609.0,Granules India receives USFDA approval for Dexmethylphenidate HCI ER capsules,"The drug will be manufactured at the Granules manufacturing facility in Chantilly, Virginia.",positive,neutral,-4.808219178082196,negative,6.048158640226635,positive
2020-09-11 12:17:14.000,365.0,372.85,341.35,347.45,8430609.0,Granules India gains 5% on US FDA approval for ADHD drug,"The drug will be manufactured at the Granules manufacturing facility in Chantilly, Virginia. The company now has a total of 30 ANDA approvals from the USFDA, of which 28 are final approvals and 2 are tentative.",positive,neutral,-4.808219178082196,negative,6.048158640226635,positive
2020-09-11 15:16:15.000,365.0,372.85,341.35,347.45,8430609.0,Amber Enterprises India Ltd leads losers in ‘A’ group,"Granules India Ltd, Bank of India, PVR Ltd and KNR Constructions Ltd are among the other losers in the BSEs A group today, 11 September 2020.",positive,negative,-4.808219178082196,negative,6.048158640226635,positive
2020-09-14 12:35:00.000,377.7,379.0,361.65,369.3,4055604.0,Buy Granules India; target of Rs 410: Motilal Oswal,"Motilal Oswal is bullish on Granules India recommended buy rating on the stock with a target price of Rs 410 in its research report dated September 12, 2020.",neutral,positive,-2.2239872915011856,negative,-0.8756567425569177,neutral
2020-09-15 20:19:17.000,371.15,374.8,365.0,367.9,2146089.0,ICICI Direct: Granules India’s Strong Integrated Model To Support Volume Play,Granules India is seen well-poised to extend its core strength and launch niche drugs besides volume-based legacy ones.,neutral,positive,-0.8756567425569177,neutral,-0.8453776929369964,neutral
2020-09-25 05:30:00.000,395.0,395.0,370.05,378.15,7741187.0,BRIEF-Granules India Gets U.S. FDA Nod For Generic Aleve PM Tablets - Investing.com India,"The Financial News section features stock market news in addition to stories about bonds, forex, commodities and economic releases.",neutral,neutral,-4.265822784810132,negative,4.425587467362922,positive
2020-09-25 07:24:00.000,395.0,395.0,370.05,378.15,7741187.0,"Hot Stocks | Apollo Hospitals, Wipro, Granules India three buy calls for short-term","The index is trading near 261.8 percent Fibonacci projected level, based on the previous week’s trading range, suggesting that bears might take a breather.",neutral,neutral,-4.265822784810132,negative,4.425587467362922,positive
2020-09-25 10:09:00.000,395.0,395.0,370.05,378.15,7741187.0,Granules India shares hit 52-week high as global equity firms eye controlling stake,"KKR, Bain Capital and Blackstone have expressed interest in acquiring a controlling stake in the company.",positive,neutral,-4.265822784810132,negative,4.425587467362922,positive
2020-09-25 10:12:00.000,395.0,395.0,370.05,378.15,7741187.0,"Granules India stock zooms on report KKR, Bain in line to pick stake","Further, the media statement added that on September 10, the promoter family of Granules India had revived plans for a potential exit from the company and was evaluating the sale of a majority stake at a premium valuation.",neutral,positive,-4.265822784810132,negative,4.425587467362922,positive
2020-09-25 11:15:00.000,395.0,395.0,370.05,378.15,7741187.0,Granules India surges 10% as three PE firms look to pick controlling stake,"A media report said that Blackstone, KKR and Bain Capital have submitted non-binding bids for the proposed transaction and investment bank Kotak Mahindra Capital has been engaged by the promoters of Granules India to look for buyers.",positive,positive,-4.265822784810132,negative,4.425587467362922,positive
2020-09-25 11:29:00.000,395.0,395.0,370.05,378.15,7741187.0,Granules India climbs after USFDA nod for generic,"Granules India rose 3.92% to Rs 374.75 after the company said it received US drug regulators approval of Naproxen Sodium and Diphenhydramine Hydrochloride tablets, 220 mg/25 mg (OTC).",positive,positive,-4.265822784810132,negative,4.425587467362922,positive
2020-09-25 11:42:00.000,395.0,395.0,370.05,378.15,7741187.0,Granules India receives USFDA approval for generic Aleve PM Tablets,Naproxen Sodium and Diphenhydramine Hydrochloride Tablets are used for relief of occasional sleeplessness associated with minor aches and pains and to help you fall asleep and stay asleep.,positive,neutral,-4.265822784810132,negative,4.425587467362922,positive
2020-09-25 12:20:00.000,395.0,395.0,370.05,378.15,7741187.0,Granules India up 5% on USFDA approval for generic Aleve PM tablets,"According to media reports, global private equity firms have expressed interest in acquiring a controlling stake in the company",positive,neutral,-4.265822784810132,negative,4.425587467362922,positive
2020-09-25 16:40:00.000,395.0,395.0,370.05,378.15,7741187.0,Granules India gets USFDA nod for sleep aid drug,"The US Food and Drug Administration (USFDA) has approved the abbreviated new drug application (ANDA) for Naproxen Sodium and Diphenhydramine Hydrochloride tablets, 220 mg/25 mg (OTC), Granules said in a BSE filing.",neutral,positive,-4.265822784810132,negative,4.425587467362922,positive
2020-09-25 20:05:28.000,395.0,395.0,370.05,378.15,7741187.0,Granules India shares gain on stake sale buzz,The company also received approval from USFDA for sleeping pills,positive,positive,-4.265822784810132,negative,4.425587467362922,positive
2020-09-25 21:14:15.000,395.0,395.0,370.05,378.15,7741187.0,Granules India jumps on stake sale buzz,"Can’t confirm or deny news, firm tells BSE",neutral,neutral,-4.265822784810132,negative,4.425587467362922,positive
2020-10-20 05:30:00.000,392.0,404.0,382.5,391.0,6366567.0,BRIEF-Granules India Sept-Quarter Consol Profit Rises - Investing.com India,"The Financial News section features stock market news in addition to stories about bonds, forex, commodities and economic releases.",neutral,neutral,-0.2551020408163265,neutral,-2.870813397129195,negative
2020-10-20 11:09:00.000,392.0,404.0,382.5,391.0,6366567.0,"Important results today: Hindustan Unilever, L&T Infotech, Hindustan Zinc","DCM Shriram, Granules India, Hindustan Zinc,
Indian Energy Exchange will announce their quarterly earnings on October 20.",neutral,neutral,-0.2551020408163265,neutral,-2.870813397129195,negative
2020-10-20 12:30:00.000,397.1,403.8,382.0,385.7,2338216.0,Granules India Q2 profits up 70% yoy at Rs164cr,Granules India reported stellar results for the Sep-20 quarter. The total sales revenues were up by 22.7% at Rs858cr and the sales were also up 16.6% on a sequential basis.,positive,positive,-2.870813397129195,negative,1.4322916666666663,positive
2020-10-20 12:54:00.000,397.1,403.8,382.0,385.7,2338216.0,Granules India consolidated net profit rises 70.82% in the September 2020 quarter,Sales rise 22.67% to Rs 858.12 crore,positive,positive,-2.870813397129195,negative,1.4322916666666663,positive
2020-10-20 13:03:23.000,397.1,403.8,382.0,385.7,2338216.0,Granules India’s Q2 net surges 71% to ₹164 crore,Drug maker reports 23% rise in revenues,positive,positive,-2.870813397129195,negative,1.4322916666666663,positive
2020-10-20 13:29:00.000,397.1,403.8,382.0,385.7,2338216.0,Granules India Q2 PAT spurts 71% to Rs 164 cr,The pharma company reported 70.8% jump in consolidated net profit to Rs 164 crore on a 22.7% rise in income from operations to Rs 858 crore in Q2 FY21 over Q2 FY20.,neutral,positive,-2.870813397129195,negative,1.4322916666666663,positive
2020-10-20 16:43:00.000,397.1,403.8,382.0,385.7,2338216.0,Granules India Q2 results: Net profit surges 71% to Rs 164 cr,"Consolidated revenue from operations stood at Rs 858.12 crore for the quarter under consideration. It was Rs 699.53 crore in the same period a year ago, it added.",positive,neutral,-2.870813397129195,negative,1.4322916666666663,positive
2020-10-20 23:02:23.000,397.1,403.8,382.0,385.7,2338216.0,Granules India Q2 net profit surges 71% to Rs 164 crore,"Drug firm Granules India on Tuesday reported a 70.82 per cent rise in its consolidated net profit to Rs 163.63 crore for the second quarter ended September 30, mainly on account of robust sales.The company had posted a net profit of Rs 95.79 crore for the corresponding period previous fisc…",positive,positive,-2.870813397129195,negative,1.4322916666666663,positive
2020-10-21 08:39:04.000,397.1,403.8,382.0,385.7,2338216.0,Motilal Oswal: Granules India - Making Strong Headway,Motilal Oswal: Granules India - Making Strong Headway,neutral,neutral,-2.870813397129195,negative,1.4322916666666663,positive
2020-10-21 09:13:00.000,397.1,403.8,382.0,385.7,2338216.0,"Granules India Standalone September 2020 Net Sales at Rs 834.50 crore, up 30.64% Y-o-Y",,positive,neutral,-2.870813397129195,negative,1.4322916666666663,positive
2020-10-21 14:40:00.000,384.0,391.0,381.05,389.5,1350148.0,Buy Granules India; target of Rs 500: Motilal Oswal,"Motilal Oswal is bullish on Granules India recommended buy rating on the stock with a target price of Rs 500 in its research report dated October 20, 2020.",neutral,positive,1.4322916666666663,positive,-1.010359380995009,negative
2020-10-21 14:42:00.000,384.0,391.0,381.05,389.5,1350148.0,Buy Granules India Limited; target of Rs 475: Sharekhan,"Sharekhan is bullish on Granules India Limited has recommended buy rating on the stock with a target price of Rs 475 in its research report dated October 20, 2020.",neutral,positive,1.4322916666666663,positive,-1.010359380995009,negative
2020-10-22 10:12:00.000,384.0,391.0,381.05,389.5,1350148.0,Granules India receives USFDA marketing approval for Potassium Chloride ER Tablets,"The drug will be manufactured at the Granules manufacturing facility in Gagillapur, Hyderabad. Granules now
have a total of 34 ANDA approvals from the US FDA (32 Final approvals and 2 tentative approvals).",positive,neutral,1.4322916666666663,positive,-1.010359380995009,negative
2020-10-22 10:39:35.000,384.0,391.0,381.05,389.5,1350148.0,Granules India gets USFDA nod for generic hypokalemia drug,Granules India has received marketing approval from the US Food and Drug Administration (USFDA) for potassium chloride extended release tablets for the treatment of patients with hypokalemia. Granules,neutral,positive,1.4322916666666663,positive,-1.010359380995009,negative
2020-10-22 10:44:00.000,384.0,391.0,381.05,389.5,1350148.0,Granules rises after USFDA approval for generic drug,Granules India rose 1% to Rs 389.35 after the company received US drug regulators approval for generic potassium chloride tablets for the treatment of Hypokalemia.,positive,positive,1.4322916666666663,positive,-1.010359380995009,negative
2020-10-22 11:28:00.000,384.0,391.0,381.05,389.5,1350148.0,Granules India gets USFDA nod for potassium chloride tablets used to treat hypokalemia,"Granules has received marketing approval from the US Food and Drug Administration (USFDA) for Potassium Chloride extended release tablets USP in the strengths of 10 mEq (750 mg) and 20 mEq (1500 mg), the company said in a BSE filing.",neutral,positive,1.4322916666666663,positive,-1.010359380995009,negative
2020-10-22 11:49:00.000,384.0,391.0,381.05,389.5,1350148.0,Granules India gets USFDA approval for potassium chloride tablets,"Drug firm Granules India said it has received marketing approval from the US health regulator for Potassium Chloride extended release tablets, used for treatment of patients with hypokalemia",positive,positive,1.4322916666666663,positive,-1.010359380995009,negative
2020-10-22 14:22:00.000,390.95,392.7,385.0,387.0,786365.0,Buy Granules India; target of Rs 455: Anand Rathi,"Anand Rathi is bullish on Granules India has recommended buy rating on the stock with a target price of Rs 455 in its research report dated October 22, 2020.",neutral,positive,-1.010359380995009,negative,-2.051282051282051,negative
2020-10-22 16:01:00.000,390.95,392.7,385.0,387.0,786365.0,Buy Granules India; target of Rs 459: KRChoksey,"KRChoksey is bullish on Granules India has recommended buy rating on the stock with a target price of Rs 459 in its research report dated October 22, 2020.",neutral,positive,-1.010359380995009,negative,-2.051282051282051,negative
2020-10-22 23:10:42.000,390.95,392.7,385.0,387.0,786365.0,Granules’ potassium pill gets FDA nod,"Pharmaceutical manufacturer Granules India has received marketing approval from the U.S. Food and Drug Administration (USFDA) for Potassium Chloride Extended Release Tablets USP, 10 mEq (750 mg) and 2",neutral,positive,-1.010359380995009,negative,-2.051282051282051,negative
2020-10-27 18:52:06.000,385.5,386.85,376.2,378.5,726883.0,Two more drug firms to set shop in Genome Valley,"Our Bureau Drug-makers Granules India Ltd and Laurus Labs have announced independent plans to set up new manufacturing facilities in Genome Valley, Hyderabad.Granules India projectGranules India will",neutral,positive,-1.8158236057068744,negative,2.803738317757009,positive
2020-11-03 21:44:00.000,374.95,378.0,370.0,377.0,558219.0,Buy Granules India; target of Rs 460: ICICI Direct,"ICICI Direct is bullish on Granules India recommended buy rating on the stock with a target price of Rs 460 in its research report dated October 21, 2020.",neutral,positive,0.5467395652753732,neutral,-1.0426290088425616,negative
2020-11-09 05:30:00.000,372.1,387.35,366.0,387.0,1384782.0,BRIEF-Granules India To Incorporate Unit In Hyderabad - Investing.com India,"The Financial News section features stock market news in addition to stories about bonds, forex, commodities and economic releases.",neutral,neutral,4.004299919376505,positive,-3.4487212606561672,negative
2020-11-09 12:09:38.000,387.1,388.4,369.0,373.75,1057536.0,Granules India board gives nod to set up subsidiary in Hyderabad,Company to build greenfield unit for formulations biz,neutral,neutral,-3.4487212606561672,negative,0.9408602150537636,positive
2020-11-09 17:42:00.000,387.1,388.4,369.0,373.75,1057536.0,Granules India stock trades flat; board gives nod to set up subsidiary in Hyderabad,"“The Board of Directors at their meeting has approved to incorporate a wholly-owned subsidiary of the Company in Hyderabad, India to build a green field facility for formulations business,” Granules said in the filing.",neutral,positive,-3.4487212606561672,negative,0.9408602150537636,positive
2020-11-23 10:52:00.000,374.35,401.0,374.35,400.55,2536552.0,"Pharma shares in focus; Divi’s Labs hits new high, Gland Pharma zooms 20%","Dishman Carbogen Amcis, Ipca Lab, SPARC, Caplin Point Laboratories, Dr. Lal PathLabs and Granules India from the S&P BSE Healthcare index were up in the range of 4 per cent to 5 per cent on the BSE",neutral,positive,6.998797916388404,positive,3.333333333333333,positive
2020-11-24 10:58:00.000,405.0,420.0,403.7,418.5,4181113.0,"Granules India shares gain 5%, hit record high on heavy volumes","In Q2FY21, the companys Ebitda grew 78.6 per cent YoY, with a 935 basis points margin expansion YoY on changing product mix and improved operational efficiencies",positive,positive,3.333333333333333,positive,-1.729857819905216,negative
2020-11-24 22:09:14.000,422.0,425.0,408.0,414.7,1824014.0,Granules India (₹418.6): Buy,"The stock of Granules India, which was moving in a sideways trend, broke out of the range on Tuesday, opening the door for further appreciation. Hence, traders looking for short-term opportunities can",neutral,positive,-1.729857819905216,negative,-0.9877138039026796,negative
2020-12-01 09:42:00.000,426.0,437.95,425.0,427.0,2853057.0,Granules India surges 6% on Carlyle group acquisition buzz,"Carlyle is expected to buy 42 per cent of promoter shares, which will trigger an open offer to acquire additional stake from others, CNBC TV18 report.",positive,positive,0.2347417840375587,neutral,-1.2149532710280349,negative
2020-12-01 10:30:00.000,426.0,437.95,425.0,427.0,2853057.0,Granules India jumps on buzz PE firm eyes stake,Granules India rose 3.81% to Rs 428.15 after the media reported that private equity firm Carlyle group is in advanced talks to acquire the pharmaceutical firm for around $1 billion.,neutral,positive,0.2347417840375587,neutral,-1.2149532710280349,negative
2020-12-03 05:30:00.000,422.9,425.45,418.0,418.95,504218.0,BRIEF-Granules India Announces Approval Of Penicillamine Capsules - Investing.com India,"The Financial News section features stock market news in addition to stories about bonds, forex, commodities and economic releases.",neutral,neutral,-0.934026956727356,negative,-1.1260997067448706,negative
2020-12-03 09:45:00.000,422.9,425.45,418.0,418.95,504218.0,"Granules India announces USFDA approval of Penicillamine Capsules, 250 mg","The new drug is generic equivalent of Cuprimine of Bausch Health Americas, Inc.",positive,neutral,-0.934026956727356,negative,-1.1260997067448706,negative
2020-12-03 17:39:00.000,426.25,429.9,420.0,421.45,1135515.0,"Granules India receives USFDA approval for Penicillamine Capsules USP, 250 mg","Penicillamine Capsules are indicated in the treatment of Wilson’s disease, cystinuria, and in patients with severe, active rheumatoid arthritis who have failed to respond to an adequate trial of conventional therapy.",positive,neutral,-1.1260997067448706,negative,-6.925436526663526,negative
2020-12-03 18:48:39.000,426.25,429.9,420.0,421.45,1135515.0,Granules gets USFDA’s nod for Penicillamine Capsules,Granules India Limited has received approval from the US Food &amp; Drug Administration (USFDA) for its Abbreviated New Drug Application (ANDA) for Penicillamine Capsules. It is bioequivalent to t,neutral,positive,-1.1260997067448706,negative,-6.925436526663526,negative
2020-12-04 08:08:23.000,426.25,429.9,420.0,421.45,1135515.0,"Stocks To Watch: Bank of India, GHCL, Granules India, Orient Cement, PNB, Vedanta",Here are the stocks to watch in trade today.,neutral,neutral,-1.1260997067448706,negative,-6.925436526663526,negative
2020-12-04 08:50:00.000,426.25,429.9,420.0,421.45,1135515.0,"Stocks to watch: HDFC Bank, Voda Idea, rate-sensitive stks, Granules India",Heres a list of stocks that may trade actively in todays session.,neutral,neutral,-1.1260997067448706,negative,-6.925436526663526,negative
2020-12-04 08:57:00.000,426.25,429.9,420.0,421.45,1135515.0,Granules India gets USFDA approval for Penicillamine capsules,"The US Food & Drug Administration (USFDA) has approved the abbreviated new drug application (ANDA) filed by Granules Pharmaceuticals, Inc (GPI), a wholly-owned foreign subsidiary of Granules India, for Penicillamine capsules USP, 250 mg.",positive,positive,-1.1260997067448706,negative,-6.925436526663526,negative
2020-12-04 09:40:46.000,426.25,429.9,420.0,421.45,1135515.0,"Granules India shares gain on US FDA approval for generic of Cuprimine, Penicillamine capsules","Granules India announced that the US FDA has approved the ANDA filed by Granules Pharmaceuticals, Inc (GPI)., for Penicillamine Capsules USP, 250 mg, the company said in an exchange filing.",positive,positive,-1.1260997067448706,negative,-6.925436526663526,negative
2020-12-04 10:15:00.000,426.25,429.9,420.0,421.45,1135515.0,"Stocks in news: NCC, Union Bank, Granules India, GHCL, HDFC Life, NMDC","Stocks to watch today on December 4: NCC, Union Bank, Granules India, GHCL, HDFC Life, NMDC among others are the top stocks to watch out for in Friday’s trading session",neutral,neutral,-1.1260997067448706,negative,-6.925436526663526,negative
