date,open,high,low,close,volume,title,description,title_sentiment,desc_sentiment,daily_change_pct,market_sentiment,next_day_change_pct,next_day_sentiment
2021-07-28 07:47:00.000,370.0,383.9,358.25,371.0,14826539.0,Granules India consolidated net profit rises 7.85% in the June 2021 quarter,Sales rise 15.53% to Rs 849.85 crore,positive,positive,0.2702702702702703,neutral,-1.0430596416153992,negative
2021-07-28 10:40:00.000,370.0,383.9,358.25,371.0,14826539.0,Granules spurts after Q1 PAT rises 8% YoY to Rs 120 cr,Granules India rose 1.41% to Rs 369.85 after the drug company posted a 7.9% rise in consolidated net profit to Rs 120.2 crore on a 15.5% increase in net sales to Rs 849 crore in Q1 FY22 over Q1 FY21.,positive,positive,0.2702702702702703,neutral,-1.0430596416153992,negative
2021-07-28 17:30:00.000,373.9,376.4,369.3,370.0,2532753.0,"Stocks in news: Tata Motors, IndusInd Bank, Maruti Suzuki, Granules India and more","Stocks in news: Granules India, Tata Motors, Dalmia Bharat, Maruti Suzuki, Canara Bank and more",neutral,neutral,-1.0430596416153992,negative,1.6042780748663104,positive
2021-07-29 15:51:17.000,374.0,384.7,372.0,380.0,3816147.0,Granules India Q1 Review - On Track To Build Product Pipeline As Well As Capacity: Motilal Oswal,Granules India Q1 Review - On Track To Build Product Pipeline As Well As Capacity: Motilal Oswal,neutral,neutral,1.6042780748663104,positive,0.6554798112218144,neutral
2021-08-02 11:31:06.000,381.4,390.95,378.3,383.9,4851098.0,Volumes soar at Granules India Ltd counter,"Granules India Ltd clocked volume of 25.32 lakh shares by 10:50 IST on BSE, a 8.3 times surge over two-week average daily volume of 3.05 lakh shares",neutral,positive,0.6554798112218144,neutral,-1.0772225827384756,negative
2021-08-04 14:17:14.000,387.0,396.5,382.35,387.0,4147074.0,Buy Granules India; Target Of Rs 459: KR Choksey,"KR Choksey is bullish on Granules India has recommended buy rating on the stock with a target price of Rs 459 in its research report dated July 28, 2021.",neutral,positive,0.0,neutral,-2.256608639587363,negative
2021-08-04 17:30:22.000,387.0,396.5,382.35,387.0,4147074.0,Buy Granules India; Target Of Rs 430: ICICI Direct,"ICICI Direct is bullish on Granules India has recommended buy rating on the stock with a target price of Rs 430 in its research report dated July 29, 2021.",neutral,positive,0.0,neutral,-2.256608639587363,negative
2021-08-30 10:30:00.000,333.0,337.55,330.1,331.05,2041226.0,Health Canada approves Granules India’s Acetaminophen extended-release tablets,"The product manufactured by Granules is bioequivalent to the reference listed drug, Tylenol Extended-Release 650 Tablets.",neutral,neutral,-0.5855855855855822,neutral,-0.8091099790230711,neutral
2021-08-30 12:03:00.000,333.7,334.35,329.5,331.0,1431851.0,Granules India rises after Health Canada approval for acetaminophen tablets,"Granules India rose 1.28% to Rs 334.75 after the drug maker announced receiving marketing approval from Health Canada for acetaminophen extended-release tablets OTC, 650 mg for the treatment of arthritis pain.",positive,positive,-0.8091099790230711,neutral,4.135224871717473,positive
2021-08-30 13:51:06.000,333.7,334.35,329.5,331.0,1431851.0,Granules India Gets Health Canada Nod To Market Arthritis Tablets,"The company has received approval from Health Canada for Acetaminophen extended-release tablets OTC, 650 mg, Granules India said in a regulatory filing.",neutral,positive,-0.8091099790230711,neutral,4.135224871717473,positive
2021-08-30 14:24:00.000,333.7,334.35,329.5,331.0,1431851.0,Granules India gets Health Canada nod to market arthritis tablets,"The drug will be manufactured at the company’s manufacturing facility located in Gagillapur, Hyderabad, the filing said.",neutral,neutral,-0.8091099790230711,neutral,4.135224871717473,positive
2021-08-30 14:29:46.000,333.7,334.35,329.5,331.0,1431851.0,Granules India gets Health Canada nod to market arthritis tablets; shares up,Granules India gets Health Canada nod to market arthritis tablets; shares up,positive,positive,-0.8091099790230711,neutral,4.135224871717473,positive
2021-08-30 17:06:13.000,333.7,334.35,329.5,331.0,1431851.0,Granules India gets Health Canada’s approval for its Arthritis pain reliever,Granules now have a total of two ANDS (abbreviated new drug submissions) approvals from Health Canada.,positive,neutral,-0.8091099790230711,neutral,4.135224871717473,positive
2021-09-02 18:34:20.000,350.0,352.85,338.85,340.0,4140437.0,2-DG: Granules India Gets Licence from DRDO to Manufacture and Market Covid Drug,"Drug firm Granules India on Thursday said it has received licence from Defence Research & Development Organisation (DRDO) to manufacture and market COVID-19 treatment drug, 2- Deoxy-D-Glucose (2-DG).",neutral,positive,-2.857142857142857,negative,-2.571219868517169,negative
2021-09-02 18:36:42.000,350.0,352.85,338.85,340.0,4140437.0,"Granules India gets licence from DRDO to manufacture, market 2-DG Covid drug","‘Granules is working closely with DRDO team to launch the product in India at the earliest,’ the drug firm said",neutral,positive,-2.857142857142857,negative,-2.571219868517169,negative
2021-09-02 18:48:00.000,350.0,352.85,338.85,340.0,4140437.0,Granules India gets licence from DRDO to manufacture and market COVID-19 drug 2-DG,"Developed by DRDO, 2-DG has been granted permission by Drug Controller General of India (DCGI) for emergency use as adjunct therapy in moderate to severe COVID-19 patients, Granules India said in a filing to BSE.",neutral,positive,-2.857142857142857,negative,-2.571219868517169,negative
2021-09-02 19:36:10.000,350.0,352.85,338.85,340.0,4140437.0,Granules India Gets Licence From DRDO To Manufacture And Market COVID-19 Drug,"Developed by DRDO, 2-DG has been granted permission by Drug Controller General of India (DCGI) for emergency use as adjunct therapy in moderate to severe COVID-19 patients, Granules India said in a filing to BSE.",neutral,positive,-2.857142857142857,negative,-2.571219868517169,negative
2021-09-02 23:14:16.000,350.0,352.85,338.85,340.0,4140437.0,Granules gets DRDO licence for 2-DG,"Granules India has received licence from the Defence Research &amp; Development Organisation (DRDO) to manufacture and market 2-Deoxy-D-Glucose (2-DG). Developed by DRDO, 2-DG has been approved b",neutral,positive,-2.857142857142857,negative,-2.571219868517169,negative
2021-09-03 07:36:37.000,350.0,352.85,338.85,340.0,4140437.0,"Stocks To Watch: Reliance Industries, Granules India, IRB Infrastructure, RailTel Corp, J&K Bank",Here are the stocks to watch in trade today...,neutral,neutral,-2.857142857142857,negative,-2.571219868517169,negative
2021-09-03 08:32:00.000,350.0,352.85,338.85,340.0,4140437.0,"RIL, Granules India, RailTel Corporation in focus","Reliance Industries’ (RIL) subsidiary Reliance Retail Ventures (RRVL) has now taken sole control of Just Dial. On July 20, 2021, RRVL acquired 1.31 crore equity shares of Just Dial at a price of Rs.1,020/- per equity share from Mr. VSS Mani. On",neutral,neutral,-2.857142857142857,negative,-2.571219868517169,negative
2021-09-03 09:23:00.000,350.0,352.85,338.85,340.0,4140437.0,"Granules India gains after DRDO license to manufacture, market 2-DG COVID drug","Granules India rose 1.70% after the company said that it has received licence from Defence Research & Development Organisation (DRDO), Ministry of Defence, Government of India, to manufacture and market of 2- Deoxy-D-Glucose (2-DG).",positive,positive,-2.857142857142857,negative,-2.571219868517169,negative
2021-09-03 15:11:00.000,350.0,352.85,338.85,340.0,4140437.0,Granules India receives license from DRDO to manufacture and market 2-DG,2- Deoxy-D-Glucose has been granted permission by DCGI for emergency use of this drug as an adjunct therapy in moderate to severe Covid 19 patients.,positive,positive,-2.857142857142857,negative,-2.571219868517169,negative
2021-09-12 13:25:00.000,327.85,327.85,321.65,322.9,2007677.0,"Drug firms Granules India, Jubilant Cadista recall products in US market","Jubilant Cadista is a fully-owned subsidiary of Cadista Holdings Inc, which is a part of the Noida-based Jubilant Life Sciences Company.",neutral,neutral,-1.5098368156169115,negative,3.4461538461538423,positive
2021-09-12 16:52:00.000,327.85,327.85,321.65,322.9,2007677.0,"Drug makers Granules India, Jubilant Cadista recall products in US market","Salisbury-based Jubilant Cadista Pharmaceuticals Inc is a fully-owned subsidiary of Cadista Holdings Inc, which is a part of Noida-based Jubilant Life Sciences.",negative,neutral,-1.5098368156169115,negative,3.4461538461538423,positive
2021-09-13 09:42:00.000,327.85,327.85,321.65,322.9,2007677.0,Granules India issues voluntary recall of one batch of Naproxen Sodium 220mg tablets; Stock ends lower,One batch has 11.4 million units of Naproxen tablets out of which 0.9 million units that were released into the market were recalled due to a minor CGMP deviation.,negative,neutral,-1.5098368156169115,negative,3.4461538461538423,positive
2021-09-13 12:18:00.000,325.0,337.4,324.05,336.2,2721532.0,Granules India declines on voluntary recalling batch of naproxen sodium tablets,Granules India slipped 1.19% to Rs 324.35 after the company said that it is voluntarily recalling one batch of naproxen sodium 220mg tablets at a retail level due to a minor CGMP deviation.,negative,negative,3.4461538461538423,positive,-0.7883385393425486,neutral
2021-09-13 14:32:48.000,325.0,337.4,324.05,336.2,2721532.0,Granules India voluntarily recalls one batch of Naproxen Sodium tablets,Move was on account of minor CGMP deviation,neutral,neutral,3.4461538461538423,positive,-0.7883385393425486,neutral
2021-10-01 08:15:00.000,319.0,328.3,318.1,327.35,1858405.0,Granules India allots over 3.30 lakh equity shares under ESOS; Stock gains,"The current market cap of the company is Rs7,935.50cr.",neutral,neutral,2.6175548589341764,positive,-0.3952569169960336,neutral
2021-10-07 15:37:00.000,329.8,333.6,324.95,326.5,1382346.0,Jyothi Prasad resigns as Independent Director at Granules India,The company confirms in a filing that there are no other material reasons for her resignation.,neutral,neutral,-1.000606428138269,negative,0.3058103975535168,neutral
2021-10-18 15:00:00.000,325.8,327.2,317.65,318.9,1295343.0,Granules India receives USFDA approval for Dofetilide capsules,"Granules India announced that the USFDA has approved the Abbreviated New Drug Application (ANDA) filed by Granules Pharmaceuticals, Inc. for dofetilide capsules.",positive,positive,-2.117863720073675,negative,-0.78125,neutral
2021-11-12 23:44:40.000,318.1,319.05,308.25,312.8,1344439.0,Granules India warns on guidance after Q2 net slumps,"Business during the quarter was impacted due to difficulties in procuring raw materials, mainly from China",neutral,negative,-1.6661427224143388,negative,1.342281879194631,positive
2021-11-15 09:59:19.000,298.0,308.5,280.5,302.0,9706848.0,Granules India Q2 Review - Elevated key Starting Materials Prices Impact Earnings: Motilal Oswal,Granules India Q2 Review - Elevated key Starting Materials Prices Impact Earnings: Motilal Oswal,neutral,neutral,1.342281879194631,positive,-2.2222222222222223,negative
2021-11-15 14:32:00.000,303.75,307.4,296.0,297.0,2537204.0,"Granules India, IOL Chemicals hit 52-week lows on weak Q2 results","IOL Chemicals slipped 10% to Rs 487, while Granules was down 8% to 285.80 on the BSE in intra-day trade",negative,negative,-2.2222222222222223,negative,1.4285714285714286,positive
2021-11-18 11:12:00.000,304.0,306.9,299.05,304.2,1983075.0,"Accumulate Granules India, target price Rs 349: Geojit","Granules India Ltd., incorporated in the year 1991, is a Mid Cap company (having a market cap of Rs 7510.74 Crore) operating in Pharmaceuticals sector.",neutral,neutral,0.0657894736842067,neutral,-0.605564648117847,neutral
2021-11-18 18:21:04.000,304.0,306.9,299.05,304.2,1983075.0,Granules India Q2 Review - Q2 Performance Below Expectations: Centrum Broking,Granules India Q2 Review - Q2 Performance Below Expectations: Centrum Broking,neutral,neutral,0.0657894736842067,neutral,-0.605564648117847,neutral
2021-12-13 22:25:33.000,340.5,346.8,336.05,339.55,1720835.0,Granules appoints former CFO of Dr. Reddy’s as additional director,"Drugmaker Granules India has appointed Saumen Chakraborty, a former top level executive of Dr. Reddy’s Laboratories, as an additional director.The Board of Directors has appointed Saumen Chakraborty a",neutral,neutral,-0.2790014684287779,neutral,-0.6413994169096177,neutral
2021-12-21 16:54:00.000,310.0,323.4,308.2,321.1,1158912.0,Ind Ra affirms Granules India long-term issuer rating at ‘AA-/ Stable’,The agency continues to take a consolidated view of GIL and its wholly owned subsidiaries.,positive,neutral,3.58064516129033,positive,2.592592592592585,positive
2021-12-23 10:17:00.000,324.0,335.8,318.2,332.4,2352299.0,"Ind-Ra assigns Granules India’s additional bank facility ‘AA-’ with stable outlook, affirms other ratings",Ind-Ra assigned,positive,neutral,2.592592592592585,positive,-2.031063321385905,negative
2021-12-23 13:58:00.000,334.8,336.9,325.25,328.0,1192560.0,Granules India appoints Sucharita Rao Palepu as independent director,"Palepu brings with her a rich and varied experience of two decades in information technology and financial services. She is currently a strategic advisor specializing in organization and HR transformation initiatives, the company said in a statement.",neutral,neutral,-2.031063321385905,negative,3.4158190374981023,positive
2021-12-28 09:37:00.000,340.0,343.9,333.7,336.15,2095076.0,Granules India bags USFDA nod for Prazosin Hydrochloride capsules,"The United States Food & Drug Administration has approved the Abbreviated New Drug Application filed by Granules Pharmaceuticals, Inc., a wholly owned foreign subsidiary of Granules India, for Prazosin Hydrochloride capsules, USP 1mg, 2mg & 5mg.",neutral,positive,-1.1323529411764772,negative,1.9910179640718493,positive
2021-12-28 10:16:27.000,340.0,343.9,333.7,336.15,2095076.0,Granules India receives USFDA approval for Prazosin Hydrochloride Capsules,Powered by Capital Market - Live News,positive,neutral,-1.1323529411764772,negative,1.9910179640718493,positive
2021-12-28 12:16:00.000,334.0,343.15,334.0,340.65,1511987.0,Granules India gets USFDA nod for generic Prazosin Hydrochloride capsules,"The US Food & Drug Administration (USFDA) granted approval to the abbreviated new drug application (ANDA) filed by Granules Pharmaceuticals, Inc (GPI) -- a wholly owned foreign subsidiary of the company -- for Prazosin Hydrochloride capsules, of strengths 1mg, 2mg and 5mg, Granules India Limited sai…",neutral,positive,1.9910179640718493,positive,-0.8919432665594418,neutral
2021-12-28 12:40:30.000,334.0,343.15,334.0,340.65,1511987.0,Granules India Gets USFDA Nod For Generic Prazosin Hydrochloride Capsules,"The US Food & Drug Administration (USFDA) granted approval to the abbreviated new drug application (ANDA) filed by Granules Pharmaceuticals, Inc (GPI) — a wholly owned foreign subsidiary of the company — for Prazosin Hydrochloride capsules, of strengths 1mg, 2mg and 5mg, Granules India Limited said …",neutral,positive,1.9910179640718493,positive,-0.8919432665594418,neutral
2021-12-28 18:04:00.000,334.0,343.15,334.0,340.65,1511987.0,Granules India gets USFDA approval for Prazosin Hydrochloride Capsules,The product would be available for the US market shortly.,positive,neutral,1.9910179640718493,positive,-0.8919432665594418,neutral
2021-12-30 10:10:00.000,341.95,342.05,334.6,338.9,1248433.0,Granules India gets ANDA approval for Amphetamine mixed salts tablets,Granules now has a total of 47 ANDA approvals from the US Food & Drug Administration (US FDA) (45 final approvals and 2 tentative approvals).,positive,neutral,-0.8919432665594418,neutral,-0.266745702430343,neutral
2021-12-30 10:20:00.000,341.95,342.05,334.6,338.9,1248433.0,Granules India receives USFDA approval for Amphetamine Mixed Salts IR Tablets,Granules now have a total of 47 ANDA approvals from the US FDA (45 Final approvals and 2 tentative approvals).,positive,neutral,-0.8919432665594418,neutral,-0.266745702430343,neutral
2021-12-30 13:25:10.000,337.4,344.8,332.05,336.5,1182592.0,Granules India gets USFDA nod for its generic Amphetamine mixed salts,"It is bioequivalent to the reference-listed drug product (RLD), Adderall of Teva Women’s Health Inc",neutral,neutral,-0.266745702430343,neutral,-0.356930398572275,neutral
2021-12-30 17:15:00.000,337.4,344.8,332.05,336.5,1182592.0,Granules India bags USFDA approval for Amphetamine Mixed Salts,Granules now have a total of 47 ANDA approvals from the US FDA (45 Final approvals and 2 tentative approvals).,positive,neutral,-0.266745702430343,neutral,-0.356930398572275,neutral
2022-01-04 14:01:00.000,325.8,334.9,323.25,327.3,1263536.0,"Pharma company Granules India names KVS Ram Rao as Joint MD, CEO",Rao has over two decades of experience in pharmaceutical and chemical industries.,neutral,neutral,0.4604051565377531,neutral,-0.6574923547400542,neutral
2022-01-04 14:45:44.000,325.8,334.9,323.25,327.3,1263536.0,Granules India appoints KVS Ram Rao as JMD and CEO,Rao has over two decades of experience in pharmaceuticals and chemical industries,neutral,neutral,0.4604051565377531,neutral,-0.6574923547400542,neutral
2022-01-05 06:35:00.000,325.8,334.9,323.25,327.3,1263536.0,"Nifty Pharma stocks trim early gains to trade flat; Alembic Pharma drags while Laurus Labs, Gland Pharma outperform","Cadila and Divis Lab were also under selling pressure. Granules India, Strides Pharma, and IPCA Labs were bullish.",negative,positive,0.4604051565377531,neutral,-0.6574923547400542,neutral
2022-01-12 08:45:00.000,338.9,340.9,331.0,333.5,1888306.0,"Buy Granules India, target price Rs 360: Yes Securities","Granules India Ltd., incorporated in the year 1991, is a Mid Cap company (having a market cap of Rs 8328.03 Crore) operating in Pharmaceuticals sector.",neutral,neutral,-1.593390380643251,negative,2.4663677130044843,positive
2022-01-17 15:31:11.000,332.0,335.0,322.0,323.2,2608918.0,Bhansali Engineering Polymers Ltd leads losers in ‘A’ group,"Hikal Ltd, Granules India Ltd, Hinduja Global Solutions Ltd and HCL Technologies Ltd are among the other losers in the BSE’s ‘A’ group today, 17 January 2022.",negative,negative,-2.6506024096385574,negative,-1.8704591126913004,negative
2022-01-18 07:57:15.000,332.0,335.0,322.0,323.2,2608918.0,Granules India added to the list of stocks under F&O ban on NSE today,"Vodafone Idea, SAIL, Indiabulls Housing Finance, Escorts continue to be among stocks list of F&O ban by the NSE",neutral,neutral,-2.6506024096385574,negative,-1.8704591126913004,negative
2022-01-20 08:24:21.000,317.3,326.35,314.4,322.5,1856593.0,Ipca Labs To Granules India: Bulk Drug Makers’ Q3 Margin Under Pressure,Raw material inflation to be a drag on API makers’ Q3 margins.,neutral,negative,1.6388276079420072,positive,-0.8882655446470383,neutral
2022-01-31 08:49:00.000,303.5,307.75,302.75,303.2,977933.0,Granules India announces three observations from USFDA at its US-based facility,"The wholly-owned foreign subsidiary of Granules India, Granules Pharmaceuticals, Inc. (GPI) in Chantilly, Virginia (US) had undergone a pre-approval inspection by the US Food and Drug Administration (USFDA) from 24 to 28 January 2022.",neutral,neutral,-0.0988467874794106,neutral,2.3114754098360693,positive
2022-01-31 12:32:00.000,305.0,314.0,304.0,312.05,935372.0,USFDA issues 3 minor observations to Granules India arm in pre-approval inspection,"Commenting on the audit, GPI Executive Director Priyanka Chigurupati said, “We are glad to have completed yet another audit with minor observations that we will respond to within the stipulated time period”.",neutral,positive,2.3114754098360693,positive,2.8913738019169366,positive
2022-01-31 13:42:07.000,305.0,314.0,304.0,312.05,935372.0,USFDA Issues 3 Minor Observations To Granules India Arm In Pre-approval Inspection,"Granules Pharmaceuticals located in Chantilly, Virginia, US, had undergone a PAI by the US Food and Drug Administration (USFDA) from January 24-28, 2022, the company said in a statement.",neutral,neutral,2.3114754098360693,positive,2.8913738019169366,positive
2022-02-03 13:05:46.000,324.5,325.45,316.5,320.3,1017930.0,Granules India Ltd up for fifth session,"Granules India Ltd is quoting at Rs 324.55, up 1% on the day as on 12:49 IST on the NSE. The stock is down 6.63% in last one year as compared to a 18.7% spurt in NIFTY and a 6.78% spurt in the Nifty Pharma.",neutral,positive,-1.294298921417562,negative,-2.7208756841282216,negative
2022-02-03 16:10:00.000,324.5,325.45,316.5,320.3,1017930.0,Granules India gets USFDA nod for generic antidepressant drug,"“We are pleased to receive approval of Bupropion Hydrochloride (XL) tablet product within first review cycle of 10 months from filing date. This product will be a valuable addition to our growing modified release product portfolio in the US market,” GPI Executive Director Priyanka Chigurupati stated…",neutral,positive,-1.294298921417562,negative,-2.7208756841282216,negative
2022-02-03 16:48:00.000,324.5,325.45,316.5,320.3,1017930.0,Granules India gets USFDA approval for generic antidepressant drug,Bupropion Hydrochloride is used as an antidepressant medication to treat major depressive disorder and seasonal affective disorder,positive,neutral,-1.294298921417562,negative,-2.7208756841282216,negative
2022-02-03 16:50:45.000,324.5,325.45,316.5,320.3,1017930.0,Granules India Gets USFDA Nod For Generic Antidepressant Drug,"Granules Pharmaceuticals, Inc (GPI), a wholly-owned subsidiary of the company, has received approval from the US Food & Drug Administration (USFDA) to market the product in strengths of 150 mg and 300 mg, the Hyderabad-based drug firm said in a statement.",neutral,positive,-1.294298921417562,negative,-2.7208756841282216,negative
2022-02-08 10:54:00.000,311.85,316.0,301.5,308.25,2537457.0,Granules India reports Q3 PAT down by 31.3% YoY,"Its EBITDA for Q3 FY’22 was reported at Rs 173.70 crore against Rs 211.60 crore for Q3 FY’21, decreasing 21.82% YoY.",negative,negative,-1.1544011544011616,negative,0.3215951117543013,neutral
2022-02-08 23:34:26.000,310.95,315.85,306.0,311.95,737848.0,Granules net falls 31% on higher freight cost,"Drugmaker Granules India reported consolidated net profit declined 31% to ₹101 crore for the December quarter on the back of increase in freight cost and lower gross margins. The lower net profit, com",positive,negative,0.3215951117543013,neutral,-0.4149377593361032,neutral
2022-02-09 11:15:54.000,310.95,315.85,306.0,311.95,737848.0,"Granules India Consolidated December 2021 Net Sales at Rs 996.77 crore, up 18.03% Y-o-Y",,positive,neutral,0.3215951117543013,neutral,-0.4149377593361032,neutral
2022-02-09 18:49:00.000,313.3,315.35,310.45,312.0,544627.0,"Centrum Broking gives ‘buy’ call for Vijaya Diagnostic, Granules India",Brokerage house Centrum Broking has given a ‘buy’ call for Vijaya Diagnostic Centre and Granules India stocks,neutral,positive,-0.4149377593361032,neutral,-1.4516129032258065,negative
2022-02-11 20:35:39.000,310.0,311.8,305.0,305.5,736380.0,Buy Granules India; target of Rs 360: ICICI Direct,"ICICI Direct is bullish on Granules India has recommended buy rating on the stock with a target price of Rs 360 in its research report dated February 10, 2021.",neutral,positive,-1.4516129032258065,negative,0.0,neutral
2022-02-22 14:04:52.000,291.1,294.25,284.0,284.85,706776.0,Granules India Ltd tumbles 4.5%,"Granules India Ltd is quoting at Rs 284.2, down 4.5% on the day as on 13:24 IST on the NSE. The stock tumbled 11.63% in last one year as compared to a 15.16% rally in NIFTY and a 6.28% spurt in the Nifty Pharma index.",negative,negative,-2.1470285125386463,negative,-4.375,negative
2022-03-11 17:30:00.000,291.3,309.5,291.2,309.0,2734866.0,"Nifty Pharma surges over 1.5% amid volatile trade; Sun Pharma, Dr Reddy’s, Cipla lead gains","Laurus Labs and Granules India rose 4.27% each to lif the performance of the Index. Cipla rose 3.33% at Rs1,019.90 per piece. Abbot India and Strides Pharma were the top losers in the sector.",positive,positive,6.076210092687946,positive,-2.5628626692456447,negative
2022-03-15 11:37:07.000,305.5,313.8,301.0,301.3,1859395.0,Granules India edges higher after subsidiary clears US FDA audit,"Granules Pharmaceuticals, Inc, a wholly-owned foreign subsidiary located in Chantilly, Virginia, US received an Establishment Inspection Report from the US FDA",positive,neutral,-1.3747954173486052,negative,-0.326797385620915,neutral
2022-03-21 07:13:00.000,310.0,319.9,307.0,313.0,2500887.0,"Stocks in the news: RIL, Granules India, HDFC, SBI, Dodla Dairy and NMDC","Reliance Retail Ventures announced the acquisition of a majority 89 per cent equity stake in Clovia, an industry leader in the bridge-to-premium intimate wear category, with an investment of Rs 950 crore.",neutral,positive,0.967741935483871,positive,-0.7171314741035857,neutral
2022-03-21 09:09:53.000,310.0,319.9,307.0,313.0,2500887.0,"Stocks in Focus on March 21: RIL, HDFC, Granules India & More By Investing.com","Stocks in Focus on March 21: RIL, HDFC, Granules India & More",neutral,neutral,0.967741935483871,positive,-0.7171314741035857,neutral
2022-03-21 15:23:00.000,313.75,315.5,308.5,311.5,1091478.0,Granules India spurts on receiving license from MPP to market Nirmatrelvir; Ritonavir,"Granules India advanced 2.98% to Rs 314.50 after the company received a license from Medicines Patent Pool (MPP) to manufacture and market generic versions of Pfizer’s oral treatment Nirmatrelvir, co-packaged with Ritonavir for treatment of",positive,positive,-0.7171314741035857,neutral,-0.4645202626942139,neutral
