date,open,high,low,close,volume,title,description,title_sentiment,desc_sentiment,daily_change_pct,market_sentiment,next_day_change_pct,next_day_sentiment
2020-12-04 12:55:00.000,426.25,429.9,420.0,421.45,1135515.0,"Top stocks in focus: PSU Banks, Granules India, HDFC Life, Bharti Airtel, Vedanta, Adani Enterprises",Check out the stocks that will be in focus during trade today based on recent and latest news developments.,neutral,neutral,-1.1260997067448706,negative,-6.925436526663526,negative
2020-12-07 15:04:33.000,395.5,398.0,381.0,387.0,2131097.0,Granules India Ltd leads losers in ‘A’ group,"Astral Poly Technik Ltd, Adani Power Ltd, Tata Steel Ltd Partly Paid Up and Varroc Engineering Ltd are among the other losers in the BSEs A group today, 07 December 2020.",negative,negative,-2.149178255372945,negative,2.577521915478221,positive
2020-12-08 14:26:00.000,382.15,394.0,381.3,392.0,969136.0,"D-Street up for 6th day, but Vodafone Idea, BPCL, 45 other stocks sending out sell signal","BPCL, Granules India, SBI Life Insurance, Adani Gas, Bajaj Holdings, Jindal Stainless and Bajaj Holdings were among stocks hinting at possible weakness on MACD indicator.",positive,neutral,2.577521915478221,positive,-0.5612244897959154,neutral
2021-01-07 15:29:58.000,369.0,370.1,365.5,365.5,920410.0,Buy Granules India: Target Of Rs 475: Sharekhan,"Sharekhan is bullish on Granules India has recommended buy rating on the stock with a target price of Rs 475 in its research report dated January 06, 2020.",neutral,positive,-0.9485094850948508,negative,-1.626236617427836,negative
2021-01-13 09:10:00.000,361.1,371.9,361.1,368.0,2219838.0,Granules India receives USFDA approval for Metformin Hydrochloride ER Tablets USP,"Glumetza is a trademark of Salix Pharmaceuticals, Inc. or its affiliates.",positive,neutral,1.9108280254777008,positive,-2.0107238605898123,negative
2021-01-13 12:00:00.000,361.1,371.9,361.1,368.0,2219838.0,Granules India climbs after USFDA approval for type 2 diabetes drug,"Granules India gained 2.21% to Rs 369.50 after the company said it received US drug regulators approval of metformin hydrochloride ER tablets USP, 500 mg and 1000 mg.",positive,positive,1.9108280254777008,positive,-2.0107238605898123,negative
2021-01-13 12:48:49.000,373.0,376.85,365.0,365.5,2025991.0,Granules India Share Price Up 3% On USFDA Approval,"The share touched its 52-week high Rs 438.00 and 52-week low Rs 114.50 on 01 December, 2020 and 23 March, 2020, respectively.",neutral,positive,-2.0107238605898123,negative,-2.602534405232324,negative
2021-01-13 12:50:05.000,373.0,376.85,365.0,365.5,2025991.0,Granules India receives USFDA approval,For Metformin Hydrochloride ER Tablets USP,positive,neutral,-2.0107238605898123,negative,-2.602534405232324,negative
2021-01-13 15:14:01.000,373.0,376.85,365.0,365.5,2025991.0,Granules India gets USFDA nod for Metformin Hydrochloride tablets,Drug is indicated as an adjunct to diet and exercise to improve glycemic control in adults with type 2 diabetes mellitus; had US sales of about $192 mn for 12 months ending November 2020,neutral,neutral,-2.0107238605898123,negative,-2.602534405232324,negative
2021-01-28 05:30:00.000,356.0,366.9,347.05,351.9,3149233.0,BRIEF-Granules India Dec-Qtr Consol Profit Rises,BRIEF-Granules India Dec-Qtr Consol Profit Rises,neutral,neutral,-1.1516853932584332,negative,-5.035360678925038,negative
2021-01-28 06:35:00.000,356.0,366.9,347.05,351.9,3149233.0,Granules India Q3 PAT up more than doubles to Rs146.81cr on sales boost,Granules India reported 19.97% growth in total revenues for the Dec-20 quarter on consolidated basis at Rs844.51cr,positive,positive,-1.1516853932584332,negative,-5.035360678925038,negative
2021-01-28 13:34:00.000,353.5,353.5,335.2,335.7,1847575.0,Granules India consolidated net profit rises 129.28% in the December 2020 quarter,Sales rise 19.97% to Rs 844.51 crore,positive,positive,-5.035360678925038,negative,-3.4467455621301704,negative
2021-01-28 22:51:35.000,353.5,353.5,335.2,335.7,1847575.0,Granules net more than doubles to ₹147 cr.,Pharma manufacturing company Granules India has posted a consolidated net profit of ₹147 crore for the quarter ended December 31 compared with ₹64 crore in the year-earlier period. The firm has declar,positive,positive,-5.035360678925038,negative,-3.4467455621301704,negative
2021-01-29 11:46:00.000,353.5,353.5,335.2,335.7,1847575.0,"Buy Granules India, target price Rs 460: Motilal Oswal","Granules India Ltd., incorporated in the year 1991, is a Mid Cap company (having a market cap of Rs 8471.72 Crore) operating in Pharmaceuticals sector.",neutral,neutral,-5.035360678925038,negative,-3.4467455621301704,negative
2021-01-29 19:13:35.000,353.5,353.5,335.2,335.7,1847575.0,Buy Granules India; Target Of Rs 475: Sharekhan,"Sharekhan is bullish on Granules India has recommended buy rating on the stock with a target price of Rs 475 in its research report dated January 28, 2021.",neutral,positive,-5.035360678925038,negative,-3.4467455621301704,negative
2021-01-29 21:36:50.000,353.5,353.5,335.2,335.7,1847575.0,Granules Q3 net profit more than doubles to ₹147 cr,"Granules India Ltd's consolidated net profit more than doubled at ₹147 crore in the third quarter ended December 31, 2020 against ₹64 crore in the corresponding quarter of the previous financial y",positive,positive,-5.035360678925038,negative,-3.4467455621301704,negative
2021-02-01 05:30:00.000,338.0,338.0,324.0,326.35,1460468.0,BRIEF-Granules India Says Gets Approval Of Potassium Chloride Oral Solution Usp,BRIEF-Granules India Says Gets Approval Of Potassium Chloride Oral Solution Usp,neutral,neutral,-3.4467455621301704,negative,-3.1969696969697003,negative
2021-02-01 08:19:00.000,338.0,338.0,324.0,326.35,1460468.0,Granules India receives USFDA approval for Potassium Chloride Oral Solution USP,"The company announced approval of Potassium Chloride Oral Solution USP, generic equivalent of Potassium Chloride Oral Solution of Genus Lifesciences, Inc..",positive,positive,-3.4467455621301704,negative,-3.1969696969697003,negative
2021-02-01 10:22:00.000,338.0,338.0,324.0,326.35,1460468.0,Granules India receives USFDA approval for Potassium Chloride Oral Solution,"It is bioequivalent to the reference listed drug product (RLD), Potassium Chloride
Oral Solution, 20 mEq/15 mL (10%) and 40 mEq/15 mL (20%), of Genus Lifesciences, Inc.",positive,neutral,-3.4467455621301704,negative,-3.1969696969697003,negative
2021-02-01 10:46:00.000,338.0,338.0,324.0,326.35,1460468.0,Granules arm gets American health regulator’s nod for Potassium Chloride Oral Solution,"In a BSE filing, Granules said the US Food and Drug Administration (USFDA) has approved the abbreviated new drug application (ANDA) filed by Granules Pharmaceuticals, Inc (GPI), a wholly-owned foreign subsidiary of Granules India Ltd, for Potassium Chloride Oral Solution USP.",neutral,positive,-3.4467455621301704,negative,-3.1969696969697003,negative
2021-02-01 11:40:00.000,338.0,338.0,324.0,326.35,1460468.0,Granules India gets USFDA nod for generic potassium chloride oral solution,"The US drug regulator has approved the ANDA filed by Granules Pharmaceuticals, Inc, a wholly owned foreign arm of Granules India, for potassium chloride oral solution USP, 20 mEq/15 mL (10%) and 40 mEq/15 mL (20%).",neutral,positive,-3.4467455621301704,negative,-3.1969696969697003,negative
2021-02-03 20:48:53.000,344.0,356.0,344.0,348.0,2056789.0,Buy Granules India; Target Of Rs 460: Motilal Oswal,"Motilal Oswal is bullish on Granules India has recommended buy rating on the stock with a target price of Rs 460 in its research report dated January 28, 2021.",neutral,positive,1.162790697674419,positive,-3.6714285714285775,negative
2021-02-04 17:22:40.000,350.0,350.0,335.7,337.15,1381695.0,Buy Granules India; Target Of Rs 460: ICICI Direct,"ICICI Direct is bullish on Granules India has recommended buy rating on the stock with a target price of Rs 460 in its research report dated January 29, 2021.",neutral,positive,-3.6714285714285775,negative,-2.061855670103093,negative
2021-02-09 04:03:00.000,331.95,333.8,326.25,328.1,1164939.0,Granules India to invest ₹800 cr. in expansion,Drugmaker eyes facility abroad,positive,neutral,-1.1598132248832551,negative,1.441441441441445,positive
2021-02-17 05:30:00.000,351.75,353.1,340.0,341.5,1441586.0,BRIEF-Granules India Says Gets Approval Of Potassium Chloride ER Capsules USP,BRIEF-Granules India Says Gets Approval Of Potassium Chloride ER Capsules USP,neutral,neutral,-2.9140014214641083,negative,-2.1979621542940357,negative
2021-02-17 13:43:00.000,343.5,344.0,335.0,335.95,1552361.0,Granules India receives USFDA approval for Potassium Chloride ER Capsules,"Potassium Chloride is indicated for the treatment of patients with hypokalemia with or without metabolic
alkalosis, in digitalis intoxications, and in patients with hypokalemic familial periodic paralysis.It is also
indicated for the prevention of",positive,neutral,-2.1979621542940357,negative,-1.4294222751637915,negative
2021-02-17 14:37:00.000,343.5,344.0,335.0,335.95,1552361.0,Granules India gets USFDA nod for potassium chloride capsules,"The US drug regulator has approved the drug maker’s abbreviated new drug application (ANDA) for potassium chloride extended-release capsules USP, 8 mEq (600 mg) and 10 mEq (750 mg).",neutral,positive,-2.1979621542940357,negative,-1.4294222751637915,negative
2021-02-17 15:56:52.000,343.5,344.0,335.0,335.95,1552361.0,USFDA nod for Granules Potassium Chloride ER Capsules,"The US Food and Drug Administration (USFDA) has approved drugmaker Granules India’s Abbreviated New Drug Application (ANDA) for Potassium Chloride Extended-Release Capsules USP, 8 mEq (600 mg) and 10",neutral,positive,-2.1979621542940357,negative,-1.4294222751637915,negative
2021-02-17 16:41:57.000,343.5,344.0,335.0,335.95,1552361.0,Granules India gets USFDA nod for its Potassium Chloride ER Capsules USP,"Granules India Limited has announced that the US Food &amp; Drug Administration has approved its Abbreviated New Drug Application (ANDA) for Potassium Chloride Extended-Release Capsules USP, 8 mEq",neutral,positive,-2.1979621542940357,negative,-1.4294222751637915,negative
2021-02-23 10:41:00.000,324.9,327.0,315.1,321.85,1510369.0,"Telangana’s aiming for $100 billion life sciences exports by 2030, says Minister KT Rama Rao","Some of the companies that announced expansions and investments include Switzerland-based Ferring Pharmaceuticals, Canadian firm Jamp Pharmaceutical, Syngene, GVK Bio, Granules India, Laurus Labs and Sai Lifesciences.",neutral,neutral,-0.9387503847337504,negative,0.3711722858026565,neutral
2021-02-24 05:30:00.000,323.3,349.0,319.05,324.5,776686.0,"BRIEF-FDA Approves Granules India ANDA For Acetaminophen, Aspirin & Caffeine Tablets","BRIEF-FDA Approves Granules India ANDA For Acetaminophen, Aspirin & Caffeine Tablets",neutral,neutral,0.3711722858026565,neutral,0.2905198776758375,neutral
2021-02-24 12:22:00.000,327.0,337.85,325.65,327.95,2164307.0,Granules India gains after USFDA nod for migraine drug,"Granules India rose 1.57% to Rs 326.90 after the company said that US drug regulator has approved its Abbreviated New Drug Application (ANDA) for Acetaminophen, Aspirin and Caffeine Tablets USP, 250 mg/250 mg/65 mg (OTC).",positive,positive,0.2905198776758375,neutral,-0.0619195046439593,neutral
2021-02-24 13:44:00.000,327.0,337.85,325.65,327.95,2164307.0,"Granules India receives USFDA approval for Acetaminophen, Aspirin and Caffeine Tablets","Acetaminophen, Aspirin and Caffeine Tablets are indicated for the treatment of migraine.",positive,neutral,0.2905198776758375,neutral,-0.0619195046439593,neutral
2021-02-24 18:06:49.000,327.0,337.85,325.65,327.95,2164307.0,Granules India’s migraine drug gets USFDA nod,"Granules India Ltd’s Abbreviated New Drug Application (ANDA) for Acetaminophen, Aspirin and Caffeine tablets has been approved by the US Food and Drug Administration (USFDA).The approved ANDA is a bio",neutral,positive,0.2905198776758375,neutral,-0.0619195046439593,neutral
2021-02-24 23:04:05.000,327.0,337.85,325.65,327.95,2164307.0,U.S. FDA nod for Granules’ migraine drug,"The U.S. Food and Drug Administration has approved Granules India’s Abbreviated New Drug Application for Acetaminophen, Aspirin and Caffeine Tablets USP, 250 mg/250 mg/65 mg (OTC).The company said the",neutral,positive,0.2905198776758375,neutral,-0.0619195046439593,neutral
2021-03-02 09:04:05.000,344.5,345.5,334.5,336.0,1985321.0,"Top Buy And Sell Ideas By Sudarshan Sukhani, Mitessh Thakkar For Short Term","Mitessh Thakkar of mitesshthakkar.com recommends buying Bharat Electronics with a stop loss of Rs 142, target at Rs 155 and Granules India with a stop loss of Rs 336, target at Rs 353.",neutral,neutral,-2.467343976777939,negative,8.558758314855872,positive
2021-03-18 14:00:14.000,305.0,315.5,295.0,313.2,3196237.0,Buy Granules India: Target Of Rs 475: Sharekhan,"Sharekhan is bullish on Granules India has recommended buy rating on the stock with a target price of Rs 475 in its research report dated March 16, 2021.",neutral,positive,2.6885245901639307,positive,-1.2071156289707787,negative
2021-03-25 12:22:30.000,310.4,311.8,300.05,302.55,2887544.0,"These 5 Stocks Gained At Least 15% In First Quarter Of Last Two Fiscal Years, Do You Own Any?",Granules India and JB Chemicals are among the stocks that were winners in Q1 of FY20 and FY19. Here are five stocks that you can consider for studying:,neutral,neutral,-2.528994845360814,negative,2.0950181458264483,positive
2021-04-20 05:01:00.000,347.0,349.0,328.1,334.25,5488096.0,Granules India (₹341.5): Buy,"Investors with a short-term perspective can buy the stock of Granules India at current levels. In March 2020, the stock took support in the band between ₹115-₹120 and began to trend upwards. Since the",neutral,positive,-3.674351585014409,negative,-0.4633089224331224,neutral
2021-04-21 18:50:05.000,334.55,341.5,330.6,333.0,3170622.0,Uma Chigurupati takes over as new Chairperson of FICCI FLO,"Along with her husband, she co-founded Granules India —which has a presence in over 70 countries and employs over 6,000 people.",neutral,neutral,-0.4633089224331224,neutral,-1.1810435042607232,negative
2021-05-06 09:31:00.000,355.9,358.3,348.3,351.8,6186570.0,"Buy Granules India, target price Rs 375: IIFL","Granules India Ltd., incorporated in the year 1991, is a Mid Cap company (having a market cap of Rs 8729.30 Crore) operating in Pharmaceuticals sector.",neutral,neutral,-1.1520089912896787,negative,-1.3031161473087882,negative
2021-05-11 05:30:00.000,364.0,370.55,350.25,358.9,16012705.0,BRIEF-Granules India March-Quarter Consol Profit Rises,BRIEF-Granules India March-Quarter Consol Profit Rises,neutral,neutral,-1.4010989010989074,negative,-5.5664335664335605,negative
2021-05-11 07:49:00.000,364.0,370.55,350.25,358.9,16012705.0,"Stocks in the news: GCPL, Linde India, HFCL, IOB, JMC Projects and IndiGo","Siemens, Aarti Industries, Linde India, KEC International, Firstsource Solution, Granules India and Neuland Labs are among companies that will announce their March quarter results today.",neutral,neutral,-1.4010989010989074,negative,-5.5664335664335605,negative
2021-05-11 08:10:30.000,364.0,370.55,350.25,358.9,16012705.0,"Stocks to Watch: PNB, InterGlobe, SBI Card, Coforge, Indian Overseas Bank","Companies that will declare their March quarter earnings include Aarti Industries, Alembic, BASF India, Firstsource Solutions, Granules India, Godrej Consumer Products, KEC International, and Linde India",neutral,neutral,-1.4010989010989074,negative,-5.5664335664335605,negative
2021-05-11 14:14:00.000,357.5,357.7,333.35,337.6,11204614.0,Granules India consolidated net profit rises 38.15% in the March 2021 quarter,Sales rise 33.24% to Rs 799.31 crore,positive,positive,-5.5664335664335605,negative,-6.131386861313868,negative
2021-05-11 19:01:00.000,357.5,357.7,333.35,337.6,11204614.0,Granules India Q4 results: Net profit rises 38% to Rs 128 cr,Consolidated revenue from operations of the company stood at Rs 799 crore for the quarter under consideration. It was Rs 600 crore for the same period a year ago.,positive,neutral,-5.5664335664335605,negative,-6.131386861313868,negative
2021-05-11 20:39:30.000,357.5,357.7,333.35,337.6,11204614.0,Granules India Q4 net up 38% at ₹128 crore,The revenue had risen 33 per cent at ₹799 crore as against ₹600 crore in the year-ago period.,positive,positive,-5.5664335664335605,negative,-6.131386861313868,negative
2021-05-11 20:44:33.000,357.5,357.7,333.35,337.6,11204614.0,"Granules India Consolidated March 2021 Net Sales At Rs 799.31 Crore, Up 33.24% Y-o-Y",,neutral,neutral,-5.5664335664335605,negative,-6.131386861313868,negative
2021-05-11 22:10:18.000,357.5,357.7,333.35,337.6,11204614.0,Granules India Q4 Net Profit Up 38% At Rs 128 Crore,The company had posted a net profit of Rs 92.33 crore for the corresponding period of the previous fiscal.,neutral,positive,-5.5664335664335605,negative,-6.131386861313868,negative
2021-05-12 10:15:00.000,357.5,357.7,333.35,337.6,11204614.0,"Buy Granules India, target price Rs 420: Motilal Oswal","Granules India Ltd., incorporated in the year 1991, is a Mid Cap company (having a market cap of Rs 8913.82 Crore) operating in Pharmaceuticals sector.",neutral,neutral,-5.5664335664335605,negative,-6.131386861313868,negative
2021-05-12 15:05:02.000,357.5,357.7,333.35,337.6,11204614.0,Dishman Carbogen Amcis Ltd leads losers in ‘A’ group,"Neuland Laboratories Ltd, Bliss GVS Pharma Ltd, Granules India Ltd and Intellect Design Arena Ltd are among the other losers in the BSE’s ‘A’ group today, 12 May 2021.",negative,negative,-5.5664335664335605,negative,-6.131386861313868,negative
2021-05-12 21:22:35.000,357.5,357.7,333.35,337.6,11204614.0,Granules India to donate 16 crore paracetamol tablets to Telangana,"Granules India Ltd has pledged to provide 16 crore paracetamol-500 mg tablets free of cost to Telangana Government to fight the covid-19 pandemic.According to a release, the Hyderabad-based company wi",neutral,positive,-5.5664335664335605,negative,-6.131386861313868,negative
2021-05-13 10:40:00.000,342.5,342.5,320.35,321.5,6565611.0,Granules India commits to donate 160 mn Paracetamol tablets to Telangana,The city-based vertically integrated pharmaceutical company will give Paracetamol-500 mg tablets free of cost to fight the Covid-19 pandemic,neutral,positive,-6.131386861313868,negative,0.3734827264238993,neutral
2021-05-16 12:49:41.000,321.3,327.0,312.8,322.5,6369831.0,"Granules India earmarks capex of Rs 1,000 crore till FY24",The compay plans to invest on a new manufacturing facility,neutral,neutral,0.3734827264238993,neutral,0.5686184109420519,neutral
2021-05-16 17:06:00.000,321.3,327.0,312.8,322.5,6369831.0,"Granules India to invest Rs 1,000 crore over 3 years till FY24 to expand operations",The Hyderabad-based firm plans to invest in a new manufacturing facility and on expanding production capacities at existing plants,positive,positive,0.3734827264238993,neutral,0.5686184109420519,neutral
2021-06-04 09:39:00.000,324.9,331.0,322.15,327.7,4133011.0,"Buy Granules India, target price Rs 335: Kotak Securities","Granules India Ltd., incorporated in the year 1991, is a Mid Cap company (having a market cap of Rs 8008.56 Crore) operating in Pharmaceuticals sector.",neutral,neutral,0.8618036318867379,neutral,-0.1515610791148833,neutral
2021-06-18 11:40:50.000,318.0,320.3,308.45,311.45,3061431.0,"Despite Healthy Earnings In FY21, These 5 Stocks Are At Least 20% Away From Their 52-week High","Aarti Drugs, Tanla Platforms and Granules India are on the list",neutral,neutral,-2.05974842767296,negative,2.1266233766233804,positive
2021-06-28 09:30:00.000,313.85,319.5,312.0,316.2,1617514.0,Granules India US unit gets two observations from USFDA,The US drug regulator has completed inspection of the facility of Granules India’s US-based subsidiary on 25 June 2021 with two minor observations.,neutral,neutral,0.7487653337581538,neutral,2.3460872303574205,positive
2021-06-28 10:32:26.000,313.85,319.5,312.0,316.2,1617514.0,Granules India announces completion of USFDA inspection of its unit’s facility in Virginia,With two observations,positive,neutral,0.7487653337581538,neutral,2.3460872303574205,positive
2021-06-28 14:01:00.000,317.55,326.8,316.55,325.0,3903971.0,USFDA issues two observations after inspection of Granules India’s Chantilly facility in US,"“We will be responding to the two observations within the stipulated time period,” Granules Pharmaceuticals Executive Director Priyanka Chigurupati said.",neutral,neutral,2.3460872303574205,positive,1.9418960244648389,positive
2021-07-12 07:34:59.000,371.15,378.15,360.65,370.4,20445491.0,"Buzzing Stocks: Avenue Supermarts, Granules India, Sandu Pharma And Other Stocks In News Today",Stocks In News: Check out the companies making the biggest headlines before the opening bell.,neutral,neutral,-0.2020746328977502,neutral,-1.2335746849021094,negative
2021-07-12 10:59:40.000,371.15,378.15,360.65,370.4,20445491.0,Granules India Shares Jumps 2% After Company Denies Reports Of Being Sold To PE Investors,The company has slammed as “utterly false and malicious” messages floating around on social media about the firm being sold to some PE investors.,neutral,negative,-0.2020746328977502,neutral,-1.2335746849021094,negative
2021-07-12 17:30:00.000,372.9,374.1,367.0,368.3,4419884.0,"‘Not selling company to PE investors; reports false, malicious’: Granules India clarifies",The pharma company said in a BSE filing that the management remains committed to the growth of the company,neutral,positive,-1.2335746849021094,negative,1.2228260869565215,positive
2021-07-13 11:55:53.000,372.9,374.1,367.0,368.3,4419884.0,Granules India Q1 PAT Seen Up 54.7% YoY To Rs 99.2 Cr: KRChoksey,"Net Sales are expected to decrease by 9.5 percent Y-o-Y (down 22.4 percent Q-o-Q) to Rs 666 crore, according to KRChoksey.",neutral,negative,-1.2335746849021094,negative,1.2228260869565215,positive
2021-07-13 12:34:09.000,368.0,374.05,368.0,372.5,3062523.0,Granules India concludes its Covid-19 vaccine drive for its workforce,"Since the pandemic started, Granules recorded over 625 positive cases at its units",neutral,positive,1.2228260869565215,positive,-0.6836461126005392,neutral
2021-07-13 14:17:40.000,368.0,374.05,368.0,372.5,3062523.0,Granules India Concludes COVID-19 Vaccine Drive For All Its Employees In India,"The on-premises vaccination drive was conducted in association with government authorised hospitals and the vaccines were administered to over 4,500 employees as per the government approved protocols, Granules India said in a statement.",neutral,neutral,1.2228260869565215,positive,-0.6836461126005392,neutral
2021-07-13 16:21:00.000,368.0,374.05,368.0,372.5,3062523.0,Bulk Deals: BNP Paribas buys shares in Granules; IDBI Bank sells stake in Zicom Electronic,BNP Paribas Arbitrage acquired additional 12.52 lakh equity shares in Granules India at Rs370.55 per share on the NSE.,neutral,neutral,1.2228260869565215,positive,-0.6836461126005392,neutral
2021-07-21 13:56:00.000,374.7,385.0,372.15,383.6,5605750.0,Granules India subsidiary clears USFDA audit,The drug maker on Wednesday announced that its US-based subsidiary cleared a pre-approval inspection (PAI) audit by the US drug regulator.,neutral,positive,2.375233520149462,positive,-1.581540057039141,negative
2021-07-21 16:02:40.000,374.7,385.0,372.15,383.6,5605750.0,Granules subsidiary clears USFDA pre-approval audit,"Drug firm Granules India on Wednesday said its US-based facility has cleared an audit by the US health regulator.Granules Pharmaceuticals, Inc (GPI), a Virginia-based wholly-owned subsidiary of the company, had undergone a pre-approval inspection (PAI) audit by the US Food and Drug Adminis…",neutral,neutral,2.375233520149462,positive,-1.581540057039141,negative
2021-07-21 18:31:21.000,374.7,385.0,372.15,383.6,5605750.0,USFDA closes observations on Granules India’s arm,"Earlier, it had issued two minor observations during the audit.",neutral,neutral,2.375233520149462,positive,-1.581540057039141,negative
2021-07-27 18:02:00.000,370.0,383.9,358.25,371.0,14826539.0,Granules India standalone net profit declines 28.12% in the June 2021 quarter,Sales decline 1.45% to Rs 732.12 crore,negative,negative,0.2702702702702703,neutral,-1.0430596416153992,negative
2021-07-27 19:10:21.000,370.0,383.9,358.25,371.0,14826539.0,"Granules India Net Profit Rises 8% In Q1 FY22, Margins Down","Revenue from operations rose 16 percent YoY to Rs 850 crore in Q1FY22, compared to Rs 736 crore during corresponding quarter of previous year.",neutral,positive,0.2702702702702703,neutral,-1.0430596416153992,negative
2021-07-27 22:55:45.000,370.0,383.9,358.25,371.0,14826539.0,"Granules posts higher net, income in Q1, declares interim","Drugmaker Granules India has posted ₹120 crore in consolidated net profit for the quarter ended June, an 8% increase compared with the ₹111 crore of the corresponding period of the previous fiscal.Inc",positive,positive,0.2702702702702703,neutral,-1.0430596416153992,negative
2021-07-27 23:08:00.000,370.0,383.9,358.25,371.0,14826539.0,Drug firm Granules India Q1 consolidated net profit up 8% to Rs 120 cr,"Drug firm Granules India on Tuesday reported an 8 per cent rise in its consolidated net profit to Rs 120 crore for the quarter ended June 30, 2021.",positive,positive,0.2702702702702703,neutral,-1.0430596416153992,negative
2021-07-28 00:01:00.000,370.0,383.9,358.25,371.0,14826539.0,Granules India Q1 results: Net profit up 8% to Rs 120 crore,"Consolidated revenue from operations of the company stood at Rs 850 crore for the quarter under consideration. It was Rs 736 crore for the same period a year ago, it added.",positive,neutral,0.2702702702702703,neutral,-1.0430596416153992,negative
