date,open,high,low,close,volume,title,description,title_sentiment,desc_sentiment,daily_change_pct,market_sentiment,next_day_change_pct,next_day_sentiment
2021-03-09 12:09:06.000,1372.54,1383.85,1354.61,1383.3,1078152.0,"India’s Cement Stocks On The Cusp Of A New Cycle, Says Morgan Stanley","Morgan Stanley lists Ambuja Cements, UltraTech Cement and Grasim Industries as its top picks among cement makers.",neutral,neutral,0.7839480088012,neutral,-1.3767740449664705,negative
2021-03-09 18:56:00.000,1372.54,1383.85,1354.61,1383.3,1078152.0,Market Movers: Why BPCL plunged; 75 stocks send sell signals,"Over 270 stocks hit 52-week highs on Tuesday. Adani Power, BHEL, IRCTC, Mindtree, NMDC, UPL, SBI Life Insurance, HDFC Life Insurance, Grasim Industries, Trent and AU Small Finance Bank were among the top names.",negative,neutral,0.7839480088012,neutral,-1.3767740449664705,negative
2021-03-16 16:00:01.000,1377.12,1389.38,1355.91,1363.48,1000681.0,Buy Grasim Industries: Target Of Rs 1680: Sharekhan,"Sharekhan is bullish on Grasim Industries has recommended buy rating on the stock with a target price of Rs 1680 in its research report dated March 15, 2021.",neutral,positive,-0.9904728709190104,negative,0.0,neutral
2021-03-17 18:35:00.000,1386.49,1394.36,1366.57,1386.49,1777055.0,"Grasim Industries allots 93,840 equity shares under ESOS","Consequent to the above allotment, the equity share capital of the Company stands increased to 65,80,44,844 equity shares of Rs 2 each aggregating to Rs 1,31,60,89,688.",neutral,neutral,0.0,neutral,2.201973631583921,positive
2021-03-18 17:07:00.000,1375.13,1409.4,1357.6,1405.41,2416224.0,"Grasim Industries grants 93,840 equity shares under ESOS; Stock rises 1%","Grasim Industries grants 93,840 equity shares under ESOS.",neutral,neutral,2.201973631583921,positive,-0.211549618644668,neutral
2021-03-22 10:40:00.000,1413.38,1422.35,1395.7,1410.39,1576328.0,Board of Grasim Industries to consider fund raising via debt issue,On 24 March 2021,neutral,neutral,-0.211549618644668,neutral,-0.321664418092734,neutral
2021-03-24 08:27:00.000,1403.42,1403.42,1374.19,1383.15,1480108.0,"Grasim board approves fundraising within borrowing limit of Rs10,000cr on private placement","Grasim stated that the board also authorized the Finance Committee of the Board of Directors to finalise mode, terms and conditions of raising of funds.",neutral,neutral,-1.4443288538000014,negative,-1.337426162174719,negative
2021-03-24 10:36:00.000,1403.42,1403.42,1374.19,1383.15,1480108.0,Board of Grasim Industries approves fund raising via debt route,At meeting held on 24 March 2021,neutral,neutral,-1.4443288538000014,negative,-1.337426162174719,negative
2021-03-24 12:26:00.000,1378.02,1394.9,1348.24,1359.59,2156166.0,"Grasim Industries plans to raise funds through term loans, debt securities","Grasim Industries is a leading manufacturer in cement, viscose staple fibre and chemicals.",neutral,positive,-1.337426162174719,negative,2.071201645911031,positive
2021-03-24 12:43:00.000,1378.02,1394.9,1348.24,1359.59,2156166.0,"Grasim Industries plans to raise funds via debt securities, term-loan",Aditya Birla group firm Grasim Industries on Wednesday said it plans to raise funds by availing term loans or by issuing debt securities.,neutral,neutral,-1.337426162174719,negative,2.071201645911031,positive
2021-03-24 12:54:00.000,1378.02,1394.9,1348.24,1359.59,2156166.0,"Grasim Industries To Raise Funds Via Debt Securities, Term-loan","New Delhi, Mar 24 Aditya Birla group firm Grasim Industries on Wednesday said it plans to raise funds by availing term loans or by issuing debt secu..",neutral,positive,-1.337426162174719,negative,2.071201645911031,positive
2021-03-26 05:26:14.000,1375.53,1405.86,1373.54,1404.02,1755996.0,Grasim is no Jio; investors in paint stocks downplay competition threat,Scalability has been a challenge for new firms in India’s paints sector but there is scope for gains in market share,negative,positive,2.071201645911031,positive,0.1304048930183713,neutral
2021-04-06 21:43:48.000,1422.15,1438.78,1422.15,1430.31,602680.0,"Grasim raises ₹1,000 crore via NCDs","The board of directors of Grasim Industries has allotted 10,000, (6.99 per cent fully paid, unsecured and redeemable non-convertible debentures of ₹10 lakh each, aggregating to ₹1,000 crore) on privat",neutral,neutral,0.5737791372218017,neutral,0.2213632925534536,neutral
2021-04-14 16:42:10.000,1387.48,1394.41,1319.75,1343.66,1999214.0,Grasim Q4 PAT Seen Up 262.9% YoY To Rs 407 Cr: Sharekhan,"Net Sales are expected to increase by 5.6 percent Y-o-Y (up 24 percent Q-o-Q) to Rs 4,554 crore, according to Sharekhan.",neutral,positive,-3.1582437224320303,negative,0.3020154296991779,neutral
2021-04-15 09:33:54.000,1387.48,1394.41,1319.75,1343.66,1999214.0,Grasim Industries Q4 PAT Seen Up 253% YoY To Rs. 380.7 Cr: Motilal Oswal,"Net Sales are expected to increase by 5.7 percent Y-o-Y (up 24.2 percent Q-o-Q) to Rs. 4,560.3 crore, according to Motilal Oswal.",neutral,positive,-3.1582437224320303,negative,0.3020154296991779,neutral
2021-04-16 01:15:34.000,1337.68,1374.54,1335.69,1341.72,1430014.0,Ujjain: Grasim donates 30 oxygen machines to city’s hospital,Reserves 50-beds for corona patients at GD Birla Hospital,neutral,neutral,0.3020154296991779,neutral,-0.7667750918847183,neutral
2021-04-19 07:15:28.000,1325.03,1333.7,1300.08,1314.87,1228659.0,Hot Stocks | Here’s Why Strides Pharma And Grasim Industries Are Two Short-term Trading Bets,"It’s better to stay light on positions and avoid aggressive longs until few key levels are not reclaimed convincingly, said Sameet Chavan of Angel Broking",neutral,neutral,-0.7667750918847183,neutral,-4.9734348876091445,negative
2021-04-19 08:29:00.000,1325.03,1333.7,1300.08,1314.87,1228659.0,"Stock picks by Sameet Chavan: Buy Strides Pharma, sell Grasim",We finally witnessed a decisive price and volume breakout from the recent congestion zone in Strides Pharma,neutral,neutral,-0.7667750918847183,neutral,-4.9734348876091445,negative
2021-04-22 12:45:00.000,1293.86,1317.91,1257.0,1279.91,2825607.0,"Happy 25th Birthday, Nifty50! So what has changed & what hasn’t","Out of the 50 stocks on Nifty, only 13 – HDFC Bank, Reliance Industries (RIL), HDFC, ITC, HUL, L&T, SBI, Tata Motors, Dr Reddys Labs, Tata Steel, Grasim, Hero and Hindalco – could keep pace in multiplying their market-caps in order to be able to stay put on the index till its silver jubilee year.",neutral,neutral,-1.0781691991405422,negative,2.7236290051644176,positive
2021-05-03 08:16:00.000,1391.07,1419.41,1368.81,1408.4,1776413.0,"Top trading ideas by Vaishali Parekh: Buy Grasim Industries, Bharat Forge","The chart of Grasim looks attractive and, with the RSI also improving with a trend reversal, the indicators suggest strength to signal a buy",neutral,positive,1.2458035900422089,positive,0.2114374911309789,neutral
2021-05-23 16:21:00.000,1367.21,1370.95,1345.25,1369.56,1437699.0,"Grasim Inds Q4 preview: Sales may rise in single digit, margin may fall sequentially","The Aditya Birla group’s margins are seen expanding year on year, but may fall sequentially. Analyst estimates vary on the company’s profit figure.",negative,positive,0.1718828855845048,neutral,-0.2429903822369606,neutral
2021-05-24 08:24:00.000,1367.21,1370.95,1345.25,1369.56,1437699.0,"Stocks to watch: Tata Steel, Hero MotoCorp, Concor, United Spirits, Grasim","Grasim Industries, India Cements, JK Paper, Mahanagar Gas and Barbeque-Nation Hospitality are among 33 companies slated to post their quarterly numbers today",neutral,neutral,0.1718828855845048,neutral,-0.2429903822369606,neutral
2021-05-24 08:30:37.000,1367.21,1370.95,1345.25,1369.56,1437699.0,"Markets likely to be volatile; Tata Steel, Dr Reddy’s in focus","Key stocks that will announce March quarter earnings today are Grasim Industries, Ramco Cements, Mahanagar Gas, India Cements, JSW Holdings and Dalmia Bharat",neutral,neutral,0.1718828855845048,neutral,-0.2429903822369606,neutral
2021-05-24 08:58:00.000,1367.21,1370.95,1345.25,1369.56,1437699.0,"Stocks in the news: Grasim, SBI, JSW Steel, Dr Reddy’s Labs, India Cements and Natco Pharma","The country’s largest lender reported an 80.15 per cent jump in its standalone profit after tax (PAT) of Rs 6,451 crore in the three months to March 2021.",neutral,positive,0.1718828855845048,neutral,-0.2429903822369606,neutral
2021-05-24 09:25:00.000,1367.21,1370.95,1345.25,1369.56,1437699.0,"Grasim Ltd Q4 PAT up 13.5% at Rs1,715cr but operating profits up 111% yoy","Grasim Ltd reported 26.10% yoy growth in consolidated sales revenues for the Mar-21 quarter at Rs24,399cr",positive,positive,0.1718828855845048,neutral,-0.2429903822369606,neutral
2021-05-24 13:00:00.000,1374.54,1393.71,1348.84,1371.2,3050976.0,"Top stocks in focus: JSW Steel, Shree Cement, United Spirits, Hero MotoCorp, Grasim",Check out the stocks that will be in focus during trade today based on recent and latest news developments.,neutral,neutral,-0.2429903822369606,neutral,1.6462247738343798,positive
2021-05-24 13:13:00.000,1374.54,1393.71,1348.84,1371.2,3050976.0,"Important results today: Grasim Industries, India Cements, Mahanagar Gas, Barbeque-Nation Hospitality","Grasim Industries, India Cements, JK Paper, Mahanagar Gas, ADF Foods, Balaji Amines, Barbeque-Nation Hospitality will release quarterly earnings today.",neutral,neutral,-0.2429903822369606,neutral,1.6462247738343798,positive
2021-05-24 16:23:00.000,1374.54,1393.71,1348.84,1371.2,3050976.0,"Grasim Industries Q4 results: Net profit rises 13% YoY to Rs 2,617 cr; firm to pay dividend of Rs 9 per share","The total revenue from operations jumped to Rs 24,398.92 crore from Rs 19,349.54 crore in the corresponding quarter last year, registering a gain of 26 per cent",positive,positive,-0.2429903822369606,neutral,1.6462247738343798,positive
2021-05-24 16:26:00.000,1374.54,1393.71,1348.84,1371.2,3050976.0,Grasim Industries standalone net profit rises 35.72% in the March 2021 quarter,Sales rise 18.38% to Rs 4394.25 crore,positive,positive,-0.2429903822369606,neutral,1.6462247738343798,positive
2021-05-24 16:41:00.000,1374.54,1393.71,1348.84,1371.2,3050976.0,Grasim Industries consolidated net profit rises 13.52% in the March 2021 quarter,Sales rise 26.10% to Rs 24398.92 crore,positive,positive,-0.2429903822369606,neutral,1.6462247738343798,positive
2021-05-24 18:07:00.000,1374.54,1393.71,1348.84,1371.2,3050976.0,"Grasim Industries fourth quarter net profit rises 13.3% to Rs 2,616 cr","Grasim Industries’ total expenses in the March 2021 quarter stood at Rs 20,887.16 crore, up 15.7 per cent as against Rs 18,053.40 crore a year ago.",positive,positive,-0.2429903822369606,neutral,1.6462247738343798,positive
2021-05-24 18:30:00.000,1374.54,1393.71,1348.84,1371.2,3050976.0,Board of Grasim Industries appoints directors,At meeting held on 24 May 2021,neutral,neutral,-0.2429903822369606,neutral,1.6462247738343798,positive
2021-05-24 19:20:58.000,1374.54,1393.71,1348.84,1371.2,3050976.0,Grasim net up 13% in Q4 on better realisation,"Plans ₹2,600-cr capex this fiscal",positive,neutral,-0.2429903822369606,neutral,1.6462247738343798,positive
2021-05-24 20:03:00.000,1374.54,1393.71,1348.84,1371.2,3050976.0,"Grasim Q4 results: PAT rises 13% to Rs 2,617 cr; revenue rises 26% to Rs 24,399 cr","“While the signs of economic recovery picking up the momentum was visible during the Q4FY21, the impact of the second wave of COVID-19 on the economic activity needs to be assessed,” the companys statement said on Monday.",positive,positive,-0.2429903822369606,neutral,1.6462247738343798,positive
2021-05-24 20:36:53.000,1374.54,1393.71,1348.84,1371.2,3050976.0,"Results: Grasim Industries Q4 net profit rises 13.3% to Rs 2,616.6 crore","Aditya Birla Group firm Grasim Industries Ltd on Monday reported a 13.3 per cent rise in its consolidated net profit to Rs 2,616.64 crore for the fourth quarter ended March 31.The company had posted a net profit of Rs 2,309.41 crore during the January-March quarter of the previous financia…",positive,positive,-0.2429903822369606,neutral,1.6462247738343798,positive
2021-05-24 21:09:00.000,1374.54,1393.71,1348.84,1371.2,3050976.0,Top headlines: Grasim Q4 net rises 13%; BSE sees a new milestone,Business Standard brings you the top news of the evening,positive,neutral,-0.2429903822369606,neutral,1.6462247738343798,positive
2021-05-25 00:51:59.000,1374.54,1393.71,1348.84,1371.2,3050976.0,"Stocks to watch: JSPL, Dalmia Bharat Sugar and Industries, Grasim Industries, Bal Pharma among others","When the market opens, the stock that would be interesting to watch are:Jindal Steel and Power Limited: Naveen Jindal’s Jindal Steel and Power Limited (JSPL) has put off the sale of its power subsidiary to a promoter group company following concerns expressed by the in…",neutral,neutral,-0.2429903822369606,neutral,1.6462247738343798,positive
2021-05-25 08:14:15.000,1374.54,1393.71,1348.84,1371.2,3050976.0,"Buzzing Stocks: Grasim, Bajaj Electricals, MGL And Others That Will Be In Focus Today",Check out the companies making the biggest headlines before the bell.,neutral,neutral,-0.2429903822369606,neutral,1.6462247738343798,positive
2021-05-25 08:30:00.000,1374.54,1393.71,1348.84,1371.2,3050976.0,"Stocks to watch: Grasim, Bal Pharma, GMM Pfaudler, Amara Raja, DHFL","A total of 68 companies are slated to post their March quarter results today, including Alkem Labs, AstraZeneca Pharma India, Stove Kraft, Emami, Thermax and VIP Industries",neutral,neutral,-0.2429903822369606,neutral,1.6462247738343798,positive
2021-05-25 08:31:00.000,1374.54,1393.71,1348.84,1371.2,3050976.0,"Grasim Inds, Bank of India, GMM Pfaudler in focus","On a consolidated basis, Grasim Industries’ net profit jumped 14% to Rs 1,715 crore on 26% increase in revenue from operations to Rs 24,398.92 crore in Q4 March 2021 over Q4 March 2020.",neutral,positive,-0.2429903822369606,neutral,1.6462247738343798,positive
2021-05-25 09:12:00.000,1374.54,1393.71,1348.84,1371.2,3050976.0,"Stocks in news: Grasim, India Cements, Laxmi Organics, VIP Ind, Airtel and Alkem Labs","Bajaj Electricals, TTK Prestige, AstraZeneca Pharma India, Laxmi Organics Industries and VIP Industries are among companies that will announce their March quarter results today.",neutral,neutral,-0.2429903822369606,neutral,1.6462247738343798,positive
2021-05-25 09:23:31.000,1374.54,1393.71,1348.84,1371.2,3050976.0,"Top Stocks to Watch Today: Cipla, Grasim Industries and Others",Indian benchmark indices are expected to open in green on Tuesday following gains in global peers.,neutral,positive,-0.2429903822369606,neutral,1.6462247738343798,positive
2021-05-25 09:57:00.000,1374.54,1393.71,1348.84,1371.2,3050976.0,"Stocks in news: Grasim Industries, Infosys, Bharti Airtel, India Cements and more","Stocks in news: Grasim Industries, Infosys, Dalmia Bharat Sugar, ICICI Securities, Bharti Airtel, India Cements and more",neutral,neutral,-0.2429903822369606,neutral,1.6462247738343798,positive
2021-05-25 10:37:37.000,1374.54,1393.71,1348.84,1371.2,3050976.0,Grasim Q4 Review - VSF Segment Recovery Boosts Earnings: Motilal Oswal,Grasim Q4 Review - VSF Segment Recovery Boosts Earnings: Motilal Oswal,neutral,neutral,-0.2429903822369606,neutral,1.6462247738343798,positive
2021-05-25 11:58:00.000,1374.54,1393.71,1348.84,1371.2,3050976.0,Better performance of VSF boosts Grasim Industries’ Q4 results,"It is encouraging that the company has managed to reduce its debt significantly. At the end of financial year 2021, standalone net debt dropped to Rs914 crore from Rs2,999 crore last year",positive,negative,-0.2429903822369606,neutral,1.6462247738343798,positive
2021-05-25 13:00:00.000,1379.52,1426.28,1375.58,1402.23,4279524.0,"Top stocks in focus: Grasim, PNB, GMM Pfaudler, Bal Pharma, Kanpur Plastipack",Check out the stocks that will be in focus during trade today based on recent and latest news developments.,neutral,neutral,1.6462247738343798,positive,0.794692588782066,neutral
2021-05-25 15:17:00.000,1379.52,1426.28,1375.58,1402.23,4279524.0,"Add Grasim Industries, target price Rs 1460: ICICI Securities",ICICI Securities has a add call on Grasim Industries with a target price of Rs 1460. The current market price of Grasim Industries is Rs 1371.6.,neutral,positive,1.6462247738343798,positive,0.794692588782066,neutral
2021-05-25 15:58:00.000,1379.52,1426.28,1375.58,1402.23,4279524.0,Grasim Industries stock under pressure post Q4 earnings,"Other capex includes Grasim’s plans to invest towards increasing its Advanced Materials (Epoxy) business capacity by ~125 KTPA through a brownfield expansion at the existing location of Vilayat, Gujarat.",positive,positive,1.6462247738343798,positive,0.794692588782066,neutral
2021-05-26 11:41:39.000,1379.52,1426.28,1375.58,1402.23,4279524.0,Grasim Industries Shares Up 4% On Strong Q4 Results; Here’s What Brokerages Said,The management expects V-shape demand recovery as COVID-19 restrictions reverse.,neutral,positive,1.6462247738343798,positive,0.794692588782066,neutral
2021-05-26 13:26:19.000,1409.35,1430.56,1387.48,1420.55,4429338.0,"Sensex up 336 points intraday, Nifty above 15,200","Bajaj Finserv, Grasim, UPL, Infosys were top gainers",positive,positive,0.794692588782066,neutral,2.5770804335906257,positive
2021-05-26 14:42:00.000,1409.35,1430.56,1387.48,1420.55,4429338.0,Grasim Industries share rises for second consecutive session post Q4 earnings,"Grasim Industries stock touched an intraday high of Rs 1,432 rising 4.2% on BSE. The share opened higher at Rs 1,390 on BSE today",positive,positive,0.794692588782066,neutral,2.5770804335906257,positive
2021-05-28 13:18:19.000,1422.54,1474.14,1415.37,1459.2,2677366.0,NSE’s Nifty breaches all-time-high,"Reliance, Coal India, Grasim shine",negative,neutral,2.5770804335906257,positive,0.2117235945047735,neutral
2021-05-31 09:56:00.000,1459.45,1488.98,1449.24,1462.54,2922915.0,"Buy Grasim Industries, target price Rs 1535: Chandan Taparia","Grasim Industries Ltd., incorporated in the year 1947, is a Large Cap company (having a market cap of Rs 97762.43 Crore) operating in Diversified sector.",neutral,neutral,0.2117235945047735,neutral,-1.8268288700195887,negative
2021-06-04 17:30:00.000,1453.02,1501.03,1446.6,1501.03,2544021.0,"Taking Stock | Market Ends Flat In Volatile Trade; FMCG Stocks Outperform, Metals Slip","For the week, the BSE Sensex and Nifty50 shed a percent each. On May 14, Coal India, Tata Motors, Hindalco Industries, Tata Steel and Grasim Industries were among the top Nifty losers. Gainers included Asian Paints, UPL, ITC, Nestle and L&T.",neutral,neutral,3.304152730175771,positive,-1.2878572514693354,negative
2021-06-07 07:14:09.000,1512.59,1524.89,1489.68,1493.11,2469977.0,"Hot Stocks | ‘Bet On Federal-Mogul Goetze, Grasim Industries For Short Term’",Only a handful of index heavyweights are giving some notable moves while the real action still continues in the broader market.,neutral,neutral,-1.2878572514693354,negative,-0.4570949519950577,neutral
2021-06-07 08:19:36.000,1512.59,1524.89,1489.68,1493.11,2469977.0,"Nifty outlook & stock picks by Sameet Chavan: Buy Federal-Mogul, Grasim","Every 100 points upside level in Nifty should be treated as an immediate resistance and now this level comes at 15,800",neutral,neutral,-1.2878572514693354,negative,-0.4570949519950577,neutral
2021-06-07 08:56:00.000,1512.59,1524.89,1489.68,1493.11,2469977.0,"Buy Grasim Industries, target price Rs 1560: Yes Securities","Grasim Industries Ltd., incorporated in the year 1947, is a Large Cap company (having a market cap of Rs 98920.59 Crore) operating in Diversified sector.",neutral,neutral,-1.2878572514693354,negative,-0.4570949519950577,neutral
2021-06-10 08:18:00.000,1485.1,1510.99,1481.31,1486.84,869965.0,Ind-Ra assigns Aditya Birla Money at ‘IND AA+’ with stable outlook,The ratings are supported by the strong ultimate parentage of Grasim Industries Limited,positive,positive,0.1171638273516941,neutral,-0.989372908249673,negative
2021-06-10 08:53:00.000,1485.1,1510.99,1481.31,1486.84,869965.0,Birla Cellulose’s Grasim Vilayat Site achieves the EU BAT Compliances,This initiative is in line with Birla Cellulose’s aim to apply the best available technologies (EU BAT) at all of its fibre locations and investments of $170 million are in progress in order to achieve this by the end of 2022.,positive,positive,0.1171638273516941,neutral,-0.989372908249673,negative
2021-06-10 15:09:00.000,1499.94,1504.02,1469.66,1485.1,887579.0,Birla Cellulose’s Grasim Vilayat site attains EU BAT compliances,"Birla Cellulose’s Grasim Cellulosic division in Vilayat, Gujarat commissioned a carbon-disulphide adsorption plant, achieving stringent level of sulphur-to-air emission norms stipulated in the EU BAT references for the viscose manufacturing process.",neutral,positive,-0.989372908249673,negative,0.6349830241998258,neutral
2021-06-10 15:52:00.000,1499.94,1504.02,1469.66,1485.1,887579.0,Birla Cellulose’s flagship site Grasim Vilayat achieves EU BAT compliances,This initiative is in line with Birla Cellulose’s aim to apply the best available technologies (EU BAT) at all of its fibre locations and investments of $170 million are in progress in order to achieve this by the end of 2022.,positive,positive,-0.989372908249673,negative,0.6349830241998258,neutral
2021-06-15 09:00:00.000,1489.08,1509.0,1482.11,1491.07,810042.0,"Buy Grasim Industries, target price Rs 1550: Yes Securities","Grasim Industries Ltd., incorporated in the year 1947, is a Large Cap company (having a market cap of Rs 98246.10 Crore) operating in Diversified sector.",positive,neutral,0.1336395626829995,neutral,-1.6816820848829843,negative
2021-06-16 18:14:00.000,1459.2,1484.75,1444.81,1449.09,790552.0,"Grasim Industries allots 33,007 equity shares under ESOS","Consequent to the above allotment, the equity share capital of the Company stands increased to 65,80,77,851 equity shares of ₹ 2 each aggregating to ₹ 1,31,61,55,702.",neutral,neutral,-0.6928453947368508,neutral,1.5573995336716524,positive
2021-06-18 08:36:00.000,1458.2,1483.3,1414.43,1480.91,1477068.0,"Buy Grasim Industries, target price Rs 1500: Kotak Securities","Grasim Industries Ltd., incorporated in the year 1947, is a Large Cap company (having a market cap of Rs 95956.10 Crore) operating in Diversified sector.",neutral,neutral,1.5573995336716524,positive,2.1181578965448487,positive
2021-06-21 08:03:00.000,1455.51,1494.91,1449.24,1486.34,1139481.0,"D-St bucks weak global trends; Sensex up 230 pts; PSB, realty stocks gain","Adani Ports (up 5 per cent) was the top Nifty gainer today, trailed by NTPC, Titan, SBI, Tata Steel, Bajaj Finserv, Grasim, and HDFC",positive,positive,2.1181578965448487,positive,-0.1465804586161235,neutral
2021-06-22 10:20:00.000,1494.06,1514.78,1487.14,1491.87,1396449.0,Grasim Industries update on scheme of arrangement,"Consequent to the above, GPFPL stands dissolved without being wound-up and has also ceased to be a wholly owned subsidiary of the Company.",neutral,neutral,-0.1465804586161235,neutral,-0.3667858051216161,neutral
2021-06-22 15:45:00.000,1494.06,1506.26,1478.12,1488.58,969139.0,Grasim Premium Fabric ceases to be subsidiary of Grasim Industries; Stock trades flat,"All properties, assets, investments, liabilities, etc of GPFPL stands merged and transferred to and vested in the company.",neutral,neutral,-0.3667858051216161,neutral,-0.2272011366758846,neutral
2021-07-07 12:25:00.000,1490.87,1492.81,1466.37,1469.16,1068714.0,"UltraTech, ACC: These 6 cement stocks are signalling up to 16% upside","UltraTech Cement and Grasim Industries are only a few bucks short of their lifetime high of Rs 7,055 and Rs 1,547, respectively",positive,neutral,-1.4561967173529422,negative,1.9589425249802588,positive
2021-07-16 08:18:24.000,1558.6,1573.05,1541.92,1563.68,844407.0,"Stocks to Watch: Just Dial, Grasim, Venus Remedies, Wipro, banking stocks",Grasim industries has partnered with Century Textiles and Industries Ltd to form an equally owned joint venture Birla Advanced Knits Pvt. Ltd,neutral,positive,0.3259335300911173,neutral,0.0734238034818258,neutral
2021-07-16 10:04:17.000,1558.6,1573.05,1541.92,1563.68,844407.0,Grasim Industries incorporates JV ‘Birla Advanced Knits’,On 14 July 2021,neutral,neutral,0.3259335300911173,neutral,0.0734238034818258,neutral
2021-07-16 10:50:24.000,1558.6,1573.05,1541.92,1563.68,844407.0,Century Textiles and Grasim Inds form JV ‘Birla Advanced Knits’,Powered by Capital Market - Live News,neutral,neutral,0.3259335300911173,neutral,0.0734238034818258,neutral
2021-07-16 15:07:00.000,1558.6,1573.05,1541.92,1563.68,844407.0,Century Textiles and Industries incorporates JVC Birla Advanced Knits with Grasim; Stock up 1%,"The company has also sold Century Yarn Unit and Century Denim Unit in Khargone, Madhya Pradesh for a total of Rs62cr.",neutral,neutral,0.3259335300911173,neutral,0.0734238034818258,neutral
2021-08-09 19:48:00.000,1513.98,1513.98,1472.1,1478.82,923841.0,Competition Commission passes order against Grasim Industries,"While the Company is yet to receive certified copy of the said order, it believes that on merits it has sufficient grounds for an appeal.",neutral,neutral,-2.3223556453850174,negative,1.4153113414337182,positive
2021-08-09 22:47:00.000,1513.98,1513.98,1472.1,1478.82,923841.0,Grasim faces CCI heat again; lifting of anti-dumping duty may hurt revenue,"According to industry experts, prices are expected to drop by Rs 5-6 per kg once anti-dumping duty is lifted",negative,negative,-2.3223556453850174,negative,1.4153113414337182,positive
2021-08-12 11:53:14.000,1493.86,1509.0,1482.76,1486.84,503017.0,"Grasim Industries abused its dominant position for supply of VSF to spinners, says CCI",,negative,neutral,-0.4699235537466685,neutral,0.2541364403418049,neutral
