date,open,high,low,close,volume,title,description,title_sentiment,desc_sentiment,daily_change_pct,market_sentiment,next_day_change_pct,next_day_sentiment
2022-01-07 11:41:55.000,1715.18,1799.84,1715.18,1792.87,2878441.0,Core business growth and expansions keep Grasim’s prospects firm,The growth prospects are also likely to be helped by the expected demand surge from the US looking at the US ban on cotton imports from Xinjiang (China) as per reports,positive,positive,4.529553749460688,positive,1.2264051519000754,positive
2022-01-07 13:37:40.000,1715.18,1799.84,1715.18,1792.87,2878441.0,Buy Grasim; Target Of Rs 2050: Motilal Oswal,"Motilal Oswal is bullish on Grasim recommended buy rating on the stock with a target price of Rs 2050 in its research report dated January 06, 2022.",neutral,positive,4.529553749460688,positive,1.2264051519000754,positive
2022-01-07 17:39:00.000,1715.18,1799.84,1715.18,1792.87,2878441.0,Market movers: Grasim’s leap of faith; TCS’ buyback plan and the march of two knights,"Motilal Oswal upgraded the companys stock to BUY from Neutral saying its core business is improving and the paints segment, which the management is seeing as the next area of growth, should shine.",neutral,positive,4.529553749460688,positive,1.2264051519000754,positive
2022-01-07 20:42:00.000,1715.18,1799.84,1715.18,1792.87,2878441.0,"Demand triggers, expansion to drive growth for Grasim",Deleveraging and traction in paints business key for further gains,positive,positive,4.529553749460688,positive,1.2264051519000754,positive
2022-01-09 21:53:18.000,1802.83,1837.69,1786.5,1824.94,1453448.0,"RTI Reveals: 21 hit by gas leak at Grasim industries, Nagda",The RTI application was filed by an activist Kailash Sanolia. In its response the local administration revealed that 21 people were affected by gas leakage at the Grasim plant and they were treated at the Government Hospital.,negative,negative,1.2264051519000754,positive,0.8747105737072177,neutral
2022-01-10 09:14:00.000,1802.83,1837.69,1786.5,1824.94,1453448.0,"Buy Grasim Industries, target price Rs 1868: Chandan Taparia","Grasim Industries Ltd., incorporated in the year 1947, is a Large Cap company (having a market cap of Rs 118314.38 Crore) operating in Diversified sector.",neutral,neutral,1.2264051519000754,positive,0.8747105737072177,neutral
2022-01-24 16:10:00.000,1661.99,1719.36,1651.48,1717.67,829841.0,Stock market update: Stocks that hit 52-week lows on NSE in today’s trade,"JSW Steel, Tata Steel, Bajaj Finance, Grasim Inds. and Hindalco were among the top losers on NSE in today’s trade.",neutral,negative,3.350200663060552,positive,-0.3360191199611959,neutral
2022-01-25 11:30:02.000,1661.99,1719.36,1651.48,1717.67,829841.0,"Why LIC Voted Against Proposals By Asian Paints, Zee Entertainment, Vedanta, Grasim, Bharti Airtel...","Of the 47 investee company proposals that LIC has opposed so far in FY22, 26 were related to director appointments or ESOPs.",neutral,neutral,3.350200663060552,positive,-0.3360191199611959,neutral
2022-02-14 08:00:37.000,1689.88,1689.88,1629.17,1631.51,819271.0,"Stocks to Watch: SBI, Coal India, Future Retail, Eicher Motors, telcos","Coal India, Eicher Motors, Grasim Industries, SpiceJet, Adani Enterprises, Adani Wilmar, Future Retail, Jet Airways, Manappuram Finance, PC Jeweller, Spandana Sphoorty Financial are among the 989 companies that will announce their quarterly earnings on 14 February",neutral,neutral,-3.454091414775021,negative,2.9290930763040595,positive
2022-02-14 08:06:00.000,1689.88,1689.88,1629.17,1631.51,819271.0,"Stocks to Watch: Apollo Hospitals, Nazara, DB Realty, Orchid Pharma, auto","Adani Wilmar, Coal India, Dish Tv, Eicher Motors, Grasim, Medplus Health, MTNL, Nagarjuna Fertilizers, PC Jeweller, Railtel, Rajesh Exports, Spandana Sphoorty and SpiceJet to announce results today.",neutral,neutral,-3.454091414775021,negative,2.9290930763040595,positive
2022-02-14 08:07:29.000,1689.88,1689.88,1629.17,1631.51,819271.0,"Stocks to Watch Today: SBI, Future Retail, Coal India, Adani Wilmar, and Others","Stocks to Watch: Shares of firms like Coal India, Eicher Motors, Grasim Industries, SpiceJet, Adani Wilmar will be in focus as they will announce their Q3 results Today’s biggest stock Gainers Market News at news18.com",neutral,neutral,-3.454091414775021,negative,2.9290930763040595,positive
2022-02-14 08:40:20.000,1689.88,1689.88,1629.17,1631.51,819271.0,Stocks that will see action today,"ADAG stocks, Coal India, PTC India, RailTel, MTNL, IVRCL, Jet Airways, Adani Enterprises, Adani WIlmar, Bharat DYnamics, Ircon, Grasim, NBCC, Spandana, Spicejet, Sterling &WIlson, Dr Reddy’s Lab, YES Bank",neutral,neutral,-3.454091414775021,negative,2.9290930763040595,positive
2022-02-14 14:41:53.000,1652.73,1709.01,1611.64,1701.14,1188596.0,"Grasim Q3 Results | Profit rises 26% on year to Rs 1,746 crore, revenue gains to Rs 24,402 crore","VSF and chemicals business witnessed higher realizations and volumes, which aided the growth in performance compared to last year.",positive,positive,2.9290930763040595,positive,0.2944947629112225,neutral
2022-02-14 15:04:39.000,1652.73,1709.01,1611.64,1701.14,1188596.0,"Share Market Live: Sensex, Nifty Extend Decline To 2.8%; Grasim Q3 Net Income Beats Estimates","Catch all live updates on share prices, index moves, corporate announcements and more from the Sensex and Nifty, today.",neutral,neutral,2.9290930763040595,positive,0.2944947629112225,neutral
2022-02-14 16:49:00.000,1652.73,1709.01,1611.64,1701.14,1188596.0,Grasim becomes net debt-free on standalone basis after fertiliser arm sale,"In Dec quarter results, the company said its consolidated revenue was up 16% at Rs 24,402 crore while profit after tax was Rs 1,746 crore, up 26% YoY",neutral,positive,2.9290930763040595,positive,0.2944947629112225,neutral
2022-02-14 17:07:00.000,1652.73,1709.01,1611.64,1701.14,1188596.0,"Grasim Industries’ net profit jumps 23% to Rs 2,655 cr in Dec quarter","The company had posted a net profit of Rs 2,157.12 crore during the October- December quarter of the previous financial year, Grasim Industries said in a regulatory filing",positive,positive,2.9290930763040595,positive,0.2944947629112225,neutral
2022-02-14 17:30:00.000,1652.73,1709.01,1611.64,1701.14,1188596.0,Grasim Q3 results: Net profit rises 46% to Rs 522 cr,"Grasim also stated that its net debt stands at zero with the completion of disinvestment of fertiliser business on 1 January 2022, on a standalone business.",positive,neutral,2.9290930763040595,positive,0.2944947629112225,neutral
2022-02-15 00:24:00.000,1652.73,1709.01,1611.64,1701.14,1188596.0,"Grasim Industries becomes net debt free; Q3 revenue rises 16% to 24,402 cr","In its Q3, FY22 results, the company said its consolidated revenue rose 16 per cent to Rs 24,402 crore",positive,positive,2.9290930763040595,positive,0.2944947629112225,neutral
2022-02-15 07:51:00.000,1652.73,1709.01,1611.64,1701.14,1188596.0,"Stocks to Watch: Adani Wilmar, Grasim, Dish Tv, Coal India, Ashok Leyland",Adani Group stocks may be in limelight after both Adani Enterprises and Adani Wilmar reported earnings for the December quarter.,neutral,neutral,2.9290930763040595,positive,0.2944947629112225,neutral
2022-02-18 11:17:11.000,1695.26,1733.01,1691.28,1710.15,1195032.0,Buy Grasim Industries; target of Rs 2100: Sharekhan,"Sharekhan is bullish on Grasim Industries has recommended buy rating on the stock with a target price of Rs 2100 in its research report dated February 14, 2022.",neutral,positive,0.8783313474039439,neutral,-0.976874355575191,negative
2022-02-24 16:15:58.000,1573.74,1592.47,1553.97,1570.21,1113072.0,Gainers & Losers: Five stocks that moved the most on February 24,"All stocks on Nifty50 ended in the red with Tata Motors, IndusInd Bank, UPL, Grasim Industries, and Adani Ports being the biggest losers. All the sectoral indices ended with a loss of 3-8 percent, while BSE midcap and smallcap indices shed over 5 percent each.",neutral,negative,-0.2243064292703987,neutral,3.0594626054903595,positive
2022-03-02 17:30:00.000,1551.83,1571.35,1490.28,1497.05,1139825.0,Fair-value stocks: 25 Nifty firms trading at discount to historical valuations,"Some of the stocks in the list included Axis Bank, Bharat Petroleum Corporation, Bharti Airtel, Cipla, Coal India and Grasim Industries.",neutral,neutral,-3.5300258404593268,negative,-0.7139380171994122,neutral
2022-03-21 09:30:00.000,1600.64,1608.06,1550.29,1562.79,1273981.0,"Markets close lower; Nifty settles below 17,150; Britannia, Grasim stocks drop",Most sectoral indices ended in red except Nifty Media (+0.4%) and Nifty Metal (+1.4%). Nifty FMCG declined the most at 1.8% followed by Nifty PSU Bank (-1.4%) and Nifty Auto (-1.3%).,negative,neutral,-2.364679128348669,negative,0.9876985472387336,positive
2022-04-04 11:19:00.000,1660.4,1681.32,1652.43,1673.35,799697.0,"Add Grasim Industries, target price Rs 1732: ICICI Securities","Grasim Industries Ltd., incorporated in the year 1947, is a Large Cap company (having a market cap of Rs 110026.01 Crore) operating in Diversified sector.",neutral,neutral,0.7799325463743566,neutral,0.8647967073489856,neutral
2022-04-18 17:40:46.000,1747.05,1769.96,1693.37,1699.24,740172.0,Grasim Industries emerges India’s most sustainable company,Debut list of 2021 Capri Global Capital Hurun India Impact 50 companies released,positive,neutral,-2.736613147877848,negative,1.2567922874671336,positive
2022-04-19 16:01:26.000,1711.5,1752.03,1710.25,1733.01,671595.0,"Sensex Crashes 704 pts, Nifty Settles Below 16,900; HDFC Twins Tank Up To 6%","The key benchmark indices had a positive start on Tuesday. Grasim Industries, Eicher Motors, Bajaj Auto, Bajaj Finserv and Apollo Hospitals were among major gainers on the Nifty",neutral,positive,1.2567922874671336,positive,0.9740577300369982,positive
2022-04-19 19:15:32.000,1711.5,1752.03,1710.25,1733.01,671595.0,Andhra Pradesh: Grasim to commission Chlor-Alkali unit on April 21,"The Chief Minister to inaugurate the ₹2,700 crore plant, to provide direct employment to 1,300 and indirectly employ over 1,150",neutral,neutral,1.2567922874671336,positive,0.9740577300369982,positive
2022-04-19 19:46:39.000,1711.5,1752.03,1710.25,1733.01,671595.0,Andhra Pradesh: Jagan to open Grasim Industries unit in East Godavari on April 21,"It will be the biggest caustic soda unit in the State with an investment of ₹2,700 crore, says Minister",neutral,neutral,1.2567922874671336,positive,0.9740577300369982,positive
2022-05-24 08:00:24.000,1452.23,1461.19,1374.54,1395.95,1847574.0,"Stocks to Watch: Maruti Suzuki, Zomato, Marico, ONGC","Companies that will announce their March quarter earnings today are Grasim Industries, Adani Ports, Balkrishna, Balrampur Chini, Bank of India, JM Financial, Ipca Labs, Minda Industries, Strides Pharma and Zee Media among others.",neutral,neutral,-3.875419182911795,negative,-1.642929879666687,negative
2022-05-24 08:04:00.000,1452.23,1461.19,1374.54,1395.95,1847574.0,"Stocks to Watch: Zomato, Delhivery, SAIL, Ramco Cements, GAIL, BEL, Marico","Stocks to Watch: Grasim Industries, Adani Ports, JM Financials, Bank of India, Ipca Lab, Inox Wind, Jyothi Lab, and Metropolis Healthcare will be in focus ahead of their Q4 results today.",neutral,neutral,-3.875419182911795,negative,-1.642929879666687,negative
2022-05-24 08:45:37.000,1452.23,1461.19,1374.54,1395.95,1847574.0,Stocks that will see action today (May 24),"Buzzing stocks: Adani Ports, Olectra, Marico, Maruti, Natco Pharma, Pitti Engineering, Schaeffler, Rupa, Khaitan Chem, Apex Frozen, Bank of India, Amrutanjan, Grasim, Latent View, Zee Media",neutral,neutral,-3.875419182911795,negative,-1.642929879666687,negative
2022-05-24 16:19:00.000,1394.46,1438.98,1351.43,1371.55,3342675.0,"Grasim Inds Q4 PAT jumps 62% YoY to Rs 2,777 cr","The company’s consolidated net profit rose 61.89% to Rs 2,777.15 crore on 18.07% rise in net sales to Rs 28,811.39 crore in Q4 March 2022 over Q4 March 2021.",neutral,positive,-1.642929879666687,negative,0.1615590447821484,neutral
2022-05-24 16:56:00.000,1394.46,1438.98,1351.43,1371.55,3342675.0,"Grasim doubles investment outlay for paints biz to Rs 10,000 cr","Company to launch products by March 2024, take on Asian Paints and new entrants such as JSW",positive,neutral,-1.642929879666687,negative,0.1615590447821484,neutral
2022-05-24 17:30:00.000,1394.46,1438.98,1351.43,1371.55,3342675.0,"Grasim Industries Q4 rises over 55% to Rs 4,070 cr; net sales up 18%","Grasim Industries’ revenue from operations was up 18.07 per cent at Rs 28,811.39 crore during the quarter under review, as against Rs 24,401.45 crore in the corresponding period of the previous fiscal.",positive,positive,-1.642929879666687,negative,0.1615590447821484,neutral
2022-05-24 18:16:00.000,1394.46,1438.98,1351.43,1371.55,3342675.0,"Grasim Industries Q4 net profit jumps 56% to Rs 4,070 cr; revenue rises 18%","The company had posted a net profit of Rs 2,616.64 crore during the January-March quarter of the previous fiscal, Grasim Industries said in a regulatory filing",positive,positive,-1.642929879666687,negative,0.1615590447821484,neutral
2022-05-24 18:56:41.000,1394.46,1438.98,1351.43,1371.55,3342675.0,"Grasim Industries Q4 net up 76% on tax write back, gain from asset sale",The company has announced a dividend of ₹5 and a special dividend of ₹5 per equity share taking the outflow to ₹658 crore.,positive,neutral,-1.642929879666687,negative,0.1615590447821484,neutral
2022-05-24 19:32:00.000,1394.46,1438.98,1351.43,1371.55,3342675.0,"Grasim Industries doubles capex to Rs 10,000 crore to set up paints business","However, market dynamics of the decorative paints sector have changed with new capacities being announced backed by strong growth and outlook, it added.",positive,positive,-1.642929879666687,negative,0.1615590447821484,neutral
2022-05-24 22:23:23.000,1394.46,1438.98,1351.43,1371.55,3342675.0,"Grasim doubles capex to ₹10,000 crore to set up paints business","The company plans to set up 1,332 mlpa capacity by end of FY24",positive,neutral,-1.642929879666687,negative,0.1615590447821484,neutral
2022-05-25 00:13:22.000,1394.46,1438.98,1351.43,1371.55,3342675.0,"Grasim Q4 profit rises 62%, board recommends ₹10 per share in dividends",Company cites ‘robust quarterly performance’,positive,positive,-1.642929879666687,negative,0.1615590447821484,neutral
2022-05-25 02:20:00.000,1394.46,1438.98,1351.43,1371.55,3342675.0,"Grasim to double outlay for paints business to Rs 10,000 crore | The Financial Express",Grasim Industries has already started construction work at two of its plant sites — Panipat and Ludhiana — while that at Chamarajanagar is expected to start shortly.,positive,neutral,-1.642929879666687,negative,0.1615590447821484,neutral
2022-05-25 05:30:00.000,1394.46,1438.98,1351.43,1371.55,3342675.0,"Stocks Under Focus on May 25: Indian Hotels, Grasim, Coal India, BPCL & More","Stocks Under Focus on May 25: Indian Hotels, Grasim, Coal India, BPCL & More",neutral,neutral,-1.642929879666687,negative,0.1615590447821484,neutral
2022-05-25 07:38:48.000,1394.46,1438.98,1351.43,1371.55,3342675.0,"Stocks to Watch Today | BPCL, Coal India, Grasim Industries and others in news today",Stocks to Watch: Check out the companies making headlines before the opening bell.,neutral,neutral,-1.642929879666687,negative,0.1615590447821484,neutral
2022-05-25 07:58:25.000,1394.46,1438.98,1351.43,1371.55,3342675.0,"Stocks to Watch: NTPC, Dr Reddy’s, Grasim Industries, Indian Hotels, Coal India","Apollo Hospitals, BPCL, Bata India, AIA Engineering, Ashok Buildcon, Coal India, Fortis Healthcare, Interglobe Aviation, NHPC, Power Finance Corp, Praj Industries, MOIL, and V Mart are among companies that will be in focus as they announce their March quarter earnings today.",neutral,neutral,-1.642929879666687,negative,0.1615590447821484,neutral
2022-05-25 08:36:00.000,1394.46,1438.98,1351.43,1371.55,3342675.0,Asian Paints’ stock falls more than 7% today. Why?,Asian Paints to face tougher competition from Grasim,negative,negative,-1.642929879666687,negative,0.1615590447821484,neutral
2022-05-25 09:11:06.000,1394.46,1438.98,1351.43,1371.55,3342675.0,Grasim Q4 Review - Weak Quarter; Capex In Paints To Be Two Times Of The Earlier Plan: Motilal Oswal,Grasim Q4 Review - Weak Quarter; Capex In Paints To Be Two Times Of The Earlier Plan: Motilal Oswal,neutral,neutral,-1.642929879666687,negative,0.1615590447821484,neutral
2022-05-25 10:36:14.000,1394.46,1438.98,1351.43,1371.55,3342675.0,Paint stocks in the red after Grasim doubles capex plan,"Grasim has accelerated the execution of paints capacity of 1.33 billion litres, with commissioning of plants to start in phases starting fourth quarter of FY24",positive,positive,-1.642929879666687,negative,0.1615590447821484,neutral
2022-05-25 10:58:57.000,1394.46,1438.98,1351.43,1371.55,3342675.0,"As Grasim doubles investment in paints, risks rise for incumbents","Grasim may go for an aggressive strategy, pricing or otherwise, and disturb the market structure which may have a greater impact on smaller players, but Asian Paints may also be at risk",positive,negative,-1.642929879666687,negative,0.1615590447821484,neutral
2022-05-25 12:15:00.000,1386.49,1395.3,1334.94,1388.73,1549225.0,"Asian Paints, Berger Paints slip 6% after Grasim doubles capex plan","Grasim has doubled the capital expenditure for its foray into the paints business to Rs 10,000 crore.",negative,positive,0.1615590447821484,neutral,-0.8515971005824494,neutral
2022-05-25 15:50:21.000,1386.49,1395.3,1334.94,1388.73,1549225.0,"Asian Paints, Berger Paints share prices tumble as Grasim doubles capex plan","Asian Paints shares today ended 8% lower at ₹2,839. Another paint manufacturer Berger Paints tumbled 7% to ₹568.80.",negative,negative,0.1615590447821484,neutral,-0.8515971005824494,neutral
2022-05-25 17:07:36.000,1386.49,1395.3,1334.94,1388.73,1549225.0,Buy Grasim; target of Rs 1875: Motilal Oswal,"Motilal Oswal is bullish on Grasim recommended buy rating on the stock with a target price of Rs 1875 in its research report dated May 24, 2022.",neutral,positive,0.1615590447821484,neutral,-0.8515971005824494,neutral
2022-05-25 17:30:46.000,1386.49,1395.3,1334.94,1388.73,1549225.0,Buy Grasim Industries: target of Rs 1740: Sharekhan,"Sharekhan is bullish on Grasim Industries has recommended buy rating on the stock with a target price of Rs 1740 in its research report dated May 24, 2022.",neutral,positive,0.1615590447821484,neutral,-0.8515971005824494,neutral
2022-05-25 22:59:21.000,1386.49,1395.3,1334.94,1388.73,1549225.0,Grasim’s paints blitz raises risks in sector,Grasim’s thrust and new entrants have raised the risk of competition in the paints sector.Acute cost pressures have weighed on shares of paint companies in CY22,negative,positive,0.1615590447821484,neutral,-0.8515971005824494,neutral
2022-05-26 07:11:00.000,1386.49,1395.3,1334.94,1388.73,1549225.0,Paint stocks plunge on Grasim industries’ capex boost,"“This is reminiscent of Jio’s foray into the telecom industry, with significant capacity additions, which ultimately resulted in lower industry tariffs.”",negative,positive,0.1615590447821484,neutral,-0.8515971005824494,neutral
2022-05-26 11:26:00.000,1386.49,1395.3,1334.94,1388.73,1549225.0,"Grasim to raise up to Rs 2,000 cr via debentures to fund capex programme","Grasim has lined up investment for foray into decorative paints with project cost estimated at Rs 10,000 crore by FY25",neutral,positive,0.1615590447821484,neutral,-0.8515971005824494,neutral
2022-05-31 15:02:05.000,1419.36,1444.26,1407.01,1440.17,862086.0,Why Analysts Say Grasim May Do A Jio In Paints Sector,"Grasim doubled its three-year capex plan for paints business to Rs 10,000 crore.",neutral,positive,1.4661537594408869,positive,-0.9658689356041222,negative
2022-06-03 08:12:43.000,1429.32,1435.84,1324.78,1333.7,4781725.0,"With Grasim’s entry, competition in paints sector set to intensify | The Financial Express","Within the organised segment, decorative paints account for about 78-80% and industrial paint accounts for the rest.",positive,neutral,-6.689894495284464,negative,-0.5177915587934335,neutral
2022-06-10 13:50:05.000,1284.89,1326.53,1280.96,1320.35,1134729.0,Grasim Industries allots Non-Convertible Debentures,On Private Placement Basis,neutral,neutral,2.7597693187743544,positive,-0.5382862879870101,neutral
2022-06-15 15:18:51.000,1339.67,1342.56,1272.99,1275.93,945014.0,"Share Market Live: Sensex, Nifty Set To Fall For Fourth Day; Grasim Rises Most In Two Weeks","Catch all live updates on share prices, index moves, corporate announcements and more from the Sensex and Nifty, today.",neutral,neutral,-4.757888136630664,negative,0.4470276174130144,neutral
2022-06-16 18:13:00.000,1281.8,1301.58,1271.54,1287.53,1017011.0,Grasim appoints Pavan Jain as new Chief Financial Officer,Jains appointment as the new CFO comes on the basis of his exceptional track record and recommendations from the Nomination and Remuneration Committee and Audit Committee of the company. He will be replacing Ashish Adukia in the coming months.,neutral,positive,0.4470276174130144,neutral,2.0505996155612034,positive
2022-06-17 07:52:17.000,1281.8,1301.58,1271.54,1287.53,1017011.0,"Stocks to Watch Today: Tata Motors, Bharti Airtel, Dr Reddy’s, Grasim, and Others","Stocks to watch today: Shares of firms like ata Motors, Bharti Airtel, Dr Reddy’s, Grasim, and others will be in focus in Thursday’s trade",neutral,neutral,0.4470276174130144,neutral,2.0505996155612034,positive
2022-06-17 08:50:09.000,1281.8,1301.58,1271.54,1287.53,1017011.0,Grasim Industries appoints Pavan Jain as new CFO,The Aditya Birla group firm announced the appointment of Pavan Jain as its next chief financial officer with effect from 15 August 2022.,neutral,neutral,0.4470276174130144,neutral,2.0505996155612034,positive
2022-06-17 17:30:00.000,1281.8,1301.58,1271.54,1287.53,1017011.0,"Stocks in news: Wipro, Tata Motors, Dr Reddy’s, RITES and more","Stocks in news: Wipro, Tata Motors, Dr Reddy’s, RITES, Grasim Industries, RITES, Ansal Housing, Mafatlal Industries and more",neutral,neutral,0.4470276174130144,neutral,2.0505996155612034,positive
2022-06-24 22:22:15.000,1315.22,1334.69,1306.06,1314.97,753850.0,Top picks: Sharekhan is bullish on these 6 cement stocks for robust gain ahead,"The leading brokerage firm Sharekhan has placed a buy call rating on the shares of Shree Cement, Ultratech Cement, Grasim Industries, The Ramco Cement, JK Lakshmi Cement, and Dalmia Bharat.",positive,positive,-0.0190082267605419,neutral,0.6420966666416873,neutral
2022-07-19 17:30:00.000,1459.05,1459.15,1432.31,1435.79,798129.0,"Grasim to invest Rs 2,000 cr over 5 yrs on B2B e-commerce platform for building materials","Through the new platform, the company will primarily focus on MSMEs in the building materials segment with the potential to further extend to other relevant categories.",neutral,positive,-1.5941879990404708,negative,1.3145461619698788,positive
2022-07-19 19:50:24.000,1459.05,1459.15,1432.31,1435.79,798129.0,Board of Grasim Industries approves foray into B2B e-commerce for building materials,At meeting held on 19 July 2022,neutral,neutral,-1.5941879990404708,negative,1.3145461619698788,positive
2022-07-19 20:41:00.000,1459.05,1459.15,1432.31,1435.79,798129.0,Grasim forays into B2B ecommerce with building materials platform,"Grasim’s B2B platform will focus on micro, small and medium businesses in the building materials segment and may be extended to other relevant categories.",neutral,neutral,-1.5941879990404708,negative,1.3145461619698788,positive
2022-07-19 21:10:07.000,1459.05,1459.15,1432.31,1435.79,798129.0,"Grasim to invest ₹2,000 cr in B2B online platform for selling building materials","The building material segment presents a huge scalable business opportunity, according to the company",neutral,positive,-1.5941879990404708,negative,1.3145461619698788,positive
2022-07-19 21:16:00.000,1459.05,1459.15,1432.31,1435.79,798129.0,Aditya Birla Group’s Grasim to launch B2B e-commerce platform for building materials,"India’s largest cement maker UltraTech is a subsidiary of Grasim. The company has also announced plans to enter the decorative paints segment with an investment of Rs 10,000 crore. It also makes electrical insulators, chemicals and textiles.",neutral,neutral,-1.5941879990404708,negative,1.3145461619698788,positive
2022-07-19 21:17:20.000,1459.05,1459.15,1432.31,1435.79,798129.0,"Grasim enters B2B e-commerce in building materials, to invest Rs 2,000 cr","Investment adds new high-growth engine within Grasim’s standalone businesses and of its associate cos; firm is spending Rs 10,000 cr in new paints business, will launch products by early 2024",neutral,positive,-1.5941879990404708,negative,1.3145461619698788,positive
2022-07-20 07:46:31.000,1459.05,1459.15,1432.31,1435.79,798129.0,"Stocks to Watch: RIL, HUL, ONGC, NTPC, Ambuja, HDFC Life, Grasim, Vedanta","Stocks to Watch Today: CEAT, Havells, IndusInd Bank, Mastek, OFSS, RIIL, Syngene International, Tata Communications and Wirpo to announce Q1 results on Wednesday.",neutral,neutral,-1.5941879990404708,negative,1.3145461619698788,positive
2022-07-20 10:52:48.000,1459.05,1459.15,1432.31,1435.79,798129.0,"Stocks that will see action on July 20, 2022","Buzzing stocks: HUL, Grasim, Jet Freight, Vedanta, Arvind, Krsnaa Diagnostics, Mastek, Artson Engineering,",neutral,neutral,-1.5941879990404708,negative,1.3145461619698788,positive
2022-07-20 17:30:00.000,1439.28,1461.99,1436.44,1458.2,772832.0,"Stocks in news: Reliance Industries, Grasim, Ambuja Cements, Rallis India and more","Stocks in news: Reliance Industries, Grasim, Ambuja Cements, Rallis India, HDFC Life, Vedanta and more",neutral,neutral,1.3145461619698788,positive,3.4779331140350878,positive
