date,open,high,low,close,volume,title,description,title_sentiment,desc_sentiment,daily_change_pct,market_sentiment,next_day_change_pct,next_day_sentiment
2020-08-13 15:20:00.000,629.5,637.27,620.98,625.51,2828378.0,Grasim Inds Q1 PAT tumbles 67% YoY,"Grasim Industries consolidated net profit slumped 66.61% to Rs 620.74 crore on 32.24% decrease in revenue from operations to Rs 13,621.10 crore in Q1 June 2020 over Q1 June 2019.",neutral,negative,-0.633836378077841,neutral,-0.8476061499243107,neutral
2020-08-13 15:22:00.000,629.5,637.27,620.98,625.51,2828378.0,Grasim Industries Q1 results: Net profit falls 67% to Rs 621 crore; revenue dips 32%,"Consolidated revenue from operations of the company declined 32.24 per cent YoY to Rs 13,621.10 crore. The figure stood at 20,103.04 crore last year.",neutral,negative,-0.633836378077841,neutral,-0.8476061499243107,neutral
2020-08-13 15:34:00.000,629.5,637.27,620.98,625.51,2828378.0,Grasim Industries consolidated net profit declines 80.88% in the June 2020 quarter,Sales decline 32.24% to Rs 13621.10 crore,negative,negative,-0.633836378077841,neutral,-0.8476061499243107,neutral
2020-08-13 17:21:00.000,629.5,637.27,620.98,625.51,2828378.0,Grasim Industries’ VSF business switch focus to exports markets in June quarter,"“VSF business switched focus to the export market and dedicated few production lines to cater to the export demand of specialty products. The continuous flow of yarn imports and weak demand conditions impacted the domestic spinning industry,” the company said in a statement",neutral,neutral,-0.633836378077841,neutral,-0.8476061499243107,neutral
2020-08-13 18:43:10.000,629.5,637.27,620.98,625.51,2828378.0,Grasim net down 67% on weak demand,"Grasim Industries, an Aditya Birla group company, reported that its consolidated net profit was down 67 per cent in June quarter at ₹621 crore as against ₹1,860 crore logged in the same period last ye",negative,negative,-0.633836378077841,neutral,-0.8476061499243107,neutral
2020-08-13 20:18:00.000,629.5,637.27,620.98,625.51,2828378.0,"Grasim Industries Q1 net profit down 66.6% to Rs 621 cr, revenue down 32.2%","Its revenue from operations declined 32.24 per cent during the quarter under review to Rs 13,621.10 crore as against Rs 20,103.04 crore in the corresponding period of previous fiscal",negative,negative,-0.633836378077841,neutral,-0.8476061499243107,neutral
2020-08-13 21:46:00.000,629.5,637.27,620.98,625.51,2828378.0,"Grasim approves Rs 1,615-cr capex plans for FY21 to tackle Covid-19 crisis","In its earnings statement, the company specifies cost rationalisation, demand creation, working capital management and innovation, among others, as key focus areas",positive,neutral,-0.633836378077841,neutral,-0.8476061499243107,neutral
2020-08-13 21:48:00.000,629.5,637.27,620.98,625.51,2828378.0,Grasim Industries Q1 net profit down 66.6% to Rs 621 crore,"Total expenses stood at Rs 12,860.78 crore in the quarter under review as against Rs 17,478.16 crore in the year-ago quarter.",negative,neutral,-0.633836378077841,neutral,-0.8476061499243107,neutral
2020-08-13 22:56:44.000,629.5,637.27,620.98,625.51,2828378.0,Grasim Q1 net profit declines 67% to ₹621 cr.,Revenue down by more than a third,negative,negative,-0.633836378077841,neutral,-0.8476061499243107,neutral
2020-08-14 11:01:00.000,629.5,637.27,620.98,625.51,2828378.0,"Neutral on Grasim Industries, target Rs 670: Motilal Oswal","Grasim Industries Ltd., incorporated in the year 1947, is a Large Cap company (having a market cap of Rs 41563.50 Crore) operating in Diversified sector.",neutral,neutral,-0.633836378077841,neutral,-0.8476061499243107,neutral
2020-08-14 12:17:00.000,629.5,637.27,620.98,625.51,2828378.0,"Grasim Consolidated June 2020 Net Sales at Rs 13,621.10 crore, down 27.78% Y-o-Y",,negative,neutral,-0.633836378077841,neutral,-0.8476061499243107,neutral
2020-08-18 05:30:00.000,618.54,675.81,618.54,663.36,15402770.0,"Indian shares close higher, Grasim jumps - Investing.com India","The Financial News section features stock market news in addition to stories about bonds, forex, commodities and economic releases.",positive,neutral,7.246095644582412,positive,-0.5907109574627912,neutral
2020-08-18 09:27:00.000,618.54,675.81,618.54,663.36,15402770.0,"Nifty above 11,300-mark; Bandhan Bank, Petronet LNG stocks gain","Grasim, Reliance and NTPC among top Nifty gainers, while losers included Zee, Power Grid and GAIL.",positive,neutral,7.246095644582412,positive,-0.5907109574627912,neutral
2020-08-18 11:13:00.000,618.54,675.81,618.54,663.36,15402770.0,"Nifty Infra index gains 1%; Grasim, DLF stocks surge","Ambuja Cement, Ashok Leyland, ACC and Petronet LNG were up over 2% each, Shree Cement, ONGC, Eicher and Reliance Industries were up over 1.5%, respectively.",positive,positive,7.246095644582412,positive,-0.5907109574627912,neutral
2020-08-18 14:11:00.000,665.3,669.34,657.83,661.37,3232045.0,Stock market update: Nifty Commodities index gains nearly 2%; Grasim Ind leaps over 7%,The index was trading 1.52 per cent up at 3197.25.,positive,positive,-0.5907109574627912,neutral,0.2950390850746806,neutral
2020-08-19 08:03:00.000,665.3,669.34,657.83,661.37,3232045.0,"Weekly trading ideas by Religare Broking: Buy Grasim Industries, Biocon",Grasim is witnessing a breakout from the range where it has spent the last two months,neutral,neutral,-0.5907109574627912,neutral,0.2950390850746806,neutral
2020-08-19 12:43:00.000,657.54,672.33,652.46,659.48,3002298.0,LIVE Market Technicals with CK Narayan,"Ever since the first week of June, Grasim has been undergoing a sideways consolidation in a wide range between Rs 580-640.",neutral,neutral,0.2950390850746806,neutral,0.3853994613335761,neutral
2020-08-21 10:00:00.000,672.03,680.3,666.25,674.62,3975851.0,Grasim Industries allots 1.21 lakh equity shares under ESOS,"Consequent to the above allotment, the equity share capital of the Company stands increased to 65,79,28,218 equity shares of Rs 2 each aggregating to Rs 1,31,58,56,436.",neutral,neutral,0.3853994613335761,neutral,-1.4917885231146086,negative
2020-09-01 06:28:48.000,674.27,702.01,648.47,680.44,4708272.0,"Stocks To Watch: Biocon, Grasim, L&T, M&M, ONGC",Here are the stocks to watch in trade today.,neutral,neutral,0.9150636985184084,positive,-0.2933805100987777,neutral
2020-09-01 07:20:00.000,674.27,702.01,648.47,680.44,4708272.0,"Top stocks in focus: ONGC, Biocon, L&T, Grasim, M&M",Check out the stocks that will be in focus during trade today based on recent and latest news developments.,neutral,neutral,0.9150636985184084,positive,-0.2933805100987777,neutral
2020-09-07 15:07:00.000,700.12,700.12,671.53,672.33,2812223.0,Grasim’s holding discount may widen on further investment in Vodafone Idea: Morgan Stanley,"​The brokerage said capital allocation to group companies, especially to the group telecom company, has been a concern and overhang on Grasim’s stock, driving a high holding discount on the stock.",positive,negative,-3.969319545220814,negative,2.5515356739737345,positive
2020-09-09 19:02:00.000,693.79,714.91,678.6,708.68,4901001.0,Grasim’s small shareholders may not be keen to invest more in Vodafone Idea,This set owns 60% stake in the company and has seen zero returns on investments in the telecom firm,negative,neutral,2.146182562446848,positive,0.4760099414465629,neutral
2020-09-10 07:47:52.000,693.79,714.91,678.6,708.68,4901001.0,"Stocks to Watch: Reliance Industries, HUL, auto stocks, banks","Minority shareholders of Grasim Industries, who own 60% stake in the company, are unlikely to agree for further investment in Vodafone Idea",neutral,neutral,2.146182562446848,positive,0.4760099414465629,neutral
2020-09-14 18:09:21.000,708.78,720.63,706.99,715.21,2911295.0,"Despite covid, India’s long-term potential intact: KM Birla","For FY20, Grasim reported consolidated revenue from operations of ₹77,625 crore, while the consolidated EBITDA (earnings before interest, tax, depreciation, amortisation) stood at ₹13,846 crore",neutral,neutral,0.9071926408758804,positive,-0.4082822980460851,neutral
2020-09-14 19:51:00.000,708.78,720.63,706.99,715.21,2911295.0,Grasim to continue with planned VSF brownfield expansion as capacities set to reach pre-covid levels by Q4,"Both the VSF and Chemicals businesses of Grasim are now operating at about 80 per cent of pre-covid capacity, after a low of 23 per cent witnessed in April.",positive,neutral,0.9071926408758804,positive,-0.4082822980460851,neutral
2020-09-14 21:28:07.000,708.78,720.63,706.99,715.21,2911295.0,Grasim output to hit pre-Covid level by March: Kumar Mangalam Birla,"Grasim Industries, an Aditya Birla group company, has ramped up capacity utilisation to over 75 per cent in the June quarter and expects to be back at pre-Covid levels by next March.Addressing shareho",neutral,positive,0.9071926408758804,positive,-0.4082822980460851,neutral
2020-09-14 23:36:41.000,708.78,720.63,706.99,715.21,2911295.0,"Grasim capex plan for this financial year calibrated to Rs 1,615 crore, says chairman KM Birla","Addressing the shareholders at the company’s 73rd annual general meeting, Birla said across the businesses, Grasim’s fixed costs have reduced by 35% in Q1, which amounts to savings of Rs 256 crore compared to the FY20 quarterly average.",neutral,positive,0.9071926408758804,positive,-0.4082822980460851,neutral
2020-09-15 07:36:00.000,708.78,720.63,706.99,715.21,2911295.0,"Stocks in the news: Future Retail, SAIL, NBCC, Grasim, Apollo Hospitals and BSE","SAIL posted a consolidated net loss of Rs 1,226.47 crore for the first quarter ended June 30, mainly on account of reduced income.",neutral,negative,0.9071926408758804,positive,-0.4082822980460851,neutral
2020-09-15 08:54:20.000,708.78,720.63,706.99,715.21,2911295.0,"Stocks in focus: HDFC, Grasim Industries, SAIL, Future Retail, Vedanta, SpiceJet, Tata Steel","A total of 642 companies including Vedanta, SpiceJet, Future Enterprises, Max India, Kalyani Forge, Kilitch Drugs and Liberty Shoes are scheduled to announce their quarterly earnings today.",neutral,neutral,0.9071926408758804,positive,-0.4082822980460851,neutral
2020-09-15 09:28:00.000,708.78,720.63,706.99,715.21,2911295.0,"Nifty above 11,450-mark; Grasim, Sun Pharma stocks lead","The Nifty PSU Bank index was the top gainer, up 0.7% while metal and media also gained 0.6% each.",positive,positive,0.9071926408758804,positive,-0.4082822980460851,neutral
2020-09-15 11:53:00.000,708.78,720.63,706.99,715.21,2911295.0,Grasim gains 2% as firm says it will maintain comfortable liquidity,"At the 73rd Annual General Meeting (AGM), company’s chairman Kumar Mangalam Birla said the inherent financial strength, operational excellence, and diverse product portfolio with cement, financial services, viscose, chemicals, and other businesses makes the company well prepared to withstand tempora…",positive,positive,0.9071926408758804,positive,-0.4082822980460851,neutral
2020-09-15 13:24:00.000,720.09,734.28,711.27,717.15,3024001.0,Barometers sharply pare gains; most European shares decline,"Cipla (up 3.52), Dr. Reddy (up 3.41%), Sun Pharma (up 2.67%), UPL (up 2.12%) and Grasim (up 1.82%) were the top Nifty gainers.",positive,positive,-0.4082822980460851,neutral,0.7637098460037653,neutral
2020-09-17 09:27:00.000,717.55,735.82,713.71,723.03,3907948.0,Sensex drops over 150 points; Happiest Minds Technologies in focus,"Dr Reddy’s ONGC, Grasim, Britannia and Zee were among top gainers while Hindalco, Tech Mahindra, IndusInd Bank, ICICI Bank and Bajaj Auto led the losses.",neutral,positive,0.7637098460037653,neutral,2.272883997407133,positive
2020-09-17 13:33:00.000,725.07,745.69,721.78,741.55,3199795.0,"Grasim Inds, Just Dial, Dhunseri Tea gain after promoters increased stake","Data on Wednesday showed that promoter group of Grasim and Just Dial acquired 43.45 lakh and 79,507 shares during September 10-11. Likewise, Dhunseri Ventures, promoter of Dhunseri Tea, bought 83,151 shares on September 15.",positive,neutral,2.272883997407133,positive,-4.888305565972036,negative
2020-09-25 05:30:00.000,680.3,709.38,680.3,704.15,2246592.0,BRIEF-Grasim Industries Says Life Insurance Corp Of India Raises Stake In Co - Investing.com India,"The Financial News section features stock market news in addition to stories about bonds, forex, commodities and economic releases.",neutral,neutral,3.505806261943264,positive,2.79708496566832,positive
2020-09-28 07:20:00.000,712.17,732.74,712.17,732.09,2531394.0,"Stocks in the news | RIL, Usha Martin, Cummins India, Ajanta Pharma, JSW Energy","NALCO, Central Bank of India, CEAT, NCL Industries, Hero MotoCorp, Coffee Day, Thomas Cook, Grasim Industries, ISGEC Heavy Engineering, Ugro Capital are also among the stocks in focus today",neutral,neutral,2.79708496566832,positive,-2.4321706748148304,negative
2020-09-28 07:20:00.000,712.17,732.74,712.17,732.09,2531394.0,"Top stocks in focus: Vodafone Idea, RIL, Berger Paints, Nalco, Grasim, Thomas Cook",Check out the stocks that will be in focus during trade today based on recent and latest news developments.,neutral,neutral,2.79708496566832,positive,-2.4321706748148304,negative
2020-09-30 07:28:00.000,718.59,743.44,712.22,740.06,2366208.0,F&O traders expect 20% move in Vodafone Idea,"Apart from options, traders also punt on the stock through Grasim, which is a shareholder in Vi.",positive,neutral,2.9877955440515334,positive,0.3336772844833374,neutral
2020-09-30 19:02:00.000,746.23,753.01,733.14,748.72,2387439.0,Taking Stock: Sensex ends 95 points higher; mid & smallcaps underperform,"Top Nifty gainers include Titan Company, Tech Mahindra, and Grasim Industries.",positive,neutral,0.3336772844833374,neutral,-0.6246496356210544,neutral
2020-10-05 10:24:00.000,749.22,760.58,739.01,744.54,1889091.0,"Buy Grasim Industries, target price Rs 780: Kotak Securities","Grasim Industries Ltd., incorporated in the year 1947, is a Large Cap company (having a market cap of Rs 49634.79 Crore) operating in Diversified sector.",neutral,neutral,-0.6246496356210544,neutral,0.7667808585804542,neutral
2020-10-12 07:20:00.000,743.2,749.37,735.08,736.47,2798193.0,"Hot Stocks | SBI, UBL two buy calls for short term, sell on Grasim; here’s why","As far as levels are concerned, the base has shifted higher and the previous resistance area of 11,700– 11,450 should now be treated as strong support.",neutral,neutral,-0.9055435952637269,negative,0.4973913983726584,neutral
2020-10-28 20:46:00.000,769.69,774.27,762.97,766.05,1057372.0,Grasim Industries receives NCLT approval for scheme of arrangement,The web copy of aforesaid order has been received by the company on 27 October 2020.,positive,neutral,-0.4729176681521261,neutral,1.2464958602255616,positive
2020-10-30 05:30:00.000,766.95,790.61,762.22,776.51,1702286.0,BRIEF-Grasim Industries Executes Agreement With Lubrizol Manufacturing India - Investing.com India,"The Financial News section features stock market news in addition to stories about bonds, forex, commodities and economic releases.",neutral,neutral,1.2464958602255616,positive,0.4594964737805465,neutral
2020-10-30 20:08:56.000,766.95,790.61,762.22,776.51,1702286.0,Grasim ties up with Lubrizol for setting up CPVC resin plant,Grasim Industries has entered into a definitive agreement with Lubrizol Advanced Materials to manufacture and supply chlorinated polyvinyl chloride (CPVC) resin in India with initial production expect,neutral,positive,1.2464958602255616,positive,0.4594964737805465,neutral
2020-10-30 20:37:00.000,766.95,790.61,762.22,776.51,1702286.0,Grasim signs pact with Lubrizol to manufacture and supply CPVC resin in India,"This collaboration with Lubrizol Advanced Materials is part of our long-term direction to bring in world class technologies to India and additionally complements our growth strategy in Chlor-Alkali and Derivatives platform,” said Mr. Kalyan Ram Madabhushi, CEO, global chemicals, Aditya Birla Group.",positive,positive,1.2464958602255616,positive,0.4594964737805465,neutral
2020-10-30 20:46:46.000,766.95,790.61,762.22,776.51,1702286.0,Grasim signs pact with Lubrizol to set up India’s ‘largest’ CPVC resin plant,Grasim Industries Ltd. has entered into a definitive agreement with Lubrizol Advanced Materials to manufacture and supply chlorinated polyvinyl chloride (CPVC) resin in India with initial production e,positive,positive,1.2464958602255616,positive,0.4594964737805465,neutral
2020-10-30 23:06:00.000,766.95,790.61,762.22,776.51,1702286.0,"Lubrizol, Grasim Industries partner for India’s largest CPVC resin plant","The project will be done in two phases, with the first phase of production expected to be operational in late-2022",positive,neutral,1.2464958602255616,positive,0.4594964737805465,neutral
2020-11-02 08:00:00.000,781.29,788.71,772.43,784.88,1779869.0,"Companies and stocks to track today: November 2, 2020","Scrips likely to see action: Maruti Suzuki, Tata Motors, M&M, Eicher Motors, Hero MotoCorp, TVS Motor, Bajaj Auto, Equitas SFB, NTPC, Bandhan Bank, PNB, HDFC, Escorts, ZEEL, Cadila Healthcare, Grasim, Nxtdigital",neutral,neutral,0.4594964737805465,neutral,0.1526581602147304,neutral
2020-11-02 08:21:00.000,781.29,788.71,772.43,784.88,1779869.0,"Stocks in the news | RIL, ICICI Bank, UPL, DLF, Jindal Stainless, Axis Bank","Just Dial, Axis Bank, Escorts, Aarti Industries, IndusInd Bank, Rain Industries, Grasim Industries, are also among the stocks in focus today.",neutral,neutral,0.4594964737805465,neutral,0.1526581602147304,neutral
2020-11-02 11:59:00.000,781.29,788.71,772.43,784.88,1779869.0,Grasim spurts after parterning with Lubrizol,Grasim Industries gained 1.32% to Rs 789 after the company said it entered into a definitive agreement with Lubrizol Advanced Materials to manufacture and supply chlorinated polyvinyl chloride (CPVC) resin in India.,neutral,positive,0.4594964737805465,neutral,0.1526581602147304,neutral
2020-11-02 17:08:00.000,786.07,797.78,783.93,787.27,2039626.0,Lubrizol and Grasim Industries partner for India’s largest CPVC resin plant,"Once commissioned, this near 1,00,000 metric-ton state-of-the-art CPVC plant at Grasim’s site in Vilayat, Gujarat, will be the largest single-site capacity for CPVC resin production globally.",neutral,positive,0.1526581602147304,neutral,-1.1254080556861068,negative
2020-11-12 05:30:00.000,800.82,827.71,799.92,821.98,3813382.0,BRIEF-Grasim Industries Reports Fall in Sept-Quarter Profit - Investing.com India,"The Financial News section features stock market news in addition to stories about bonds, forex, commodities and economic releases.",neutral,neutral,2.6422916510576617,positive,1.558763186966607,positive
2020-11-12 18:08:00.000,823.73,844.64,816.25,836.57,5883943.0,"Grasim Industries to sell fertiliser biz to Indorama Corp for Rs 2,649 cr","Its a slump sale and a major value-unlocking exercise for Grasim, allowing it to pursue growth opportunities in its core businesses",neutral,positive,1.558763186966607,positive,-0.533549293761763,neutral
2020-11-12 18:25:00.000,823.73,844.64,816.25,836.57,5883943.0,"Grasim Industries to divest its fertiliser business to Indorama Corp for Rs. 2,649 crore","The companys other core businesses include manufacturing of Viscose Staple Fibre, Chlor-Alkali,and textiles in India. Its subsidiaries include UltraTech Cement and Aditya Birla",neutral,neutral,1.558763186966607,positive,-0.533549293761763,neutral
2020-11-12 18:42:00.000,823.73,844.64,816.25,836.57,5883943.0,"Grasim sells fertilizer biz to Indorama Corp for Rs 2,649 crore","After market hours, the company said its board approved the sale of Indo Gulf Fertilisers by way of a slump sale to Indorama India Private, a subsidiary of Singapore based -Indorama Corporation.",neutral,positive,1.558763186966607,positive,-0.533549293761763,neutral
2020-11-12 19:07:00.000,823.73,844.64,816.25,836.57,5883943.0,"Aditya Birla Group’s Grasim Industries announces sale of fertilisers business to Indorama Corporation for Rs 2,649 crores","The fertiliser unit had a turnover of Rs 2,679.51 crore in 2019-20 accounted for 3.45 per cent of the total consolidated turnover of Grasim Industries.",neutral,neutral,1.558763186966607,positive,-0.533549293761763,neutral
2020-11-12 19:15:00.000,823.73,844.64,816.25,836.57,5883943.0,"Grasim Industries Q2 net profit increased 3.30% at Rs 1,521.40 crore","Aditya Birla Group firm GrasimIndustries Ltd on Thursday reported a 3.30 per cent increase in consolidated net profit at Rs 1,521.40 crore for the second quarter ended September 2020.",positive,positive,1.558763186966607,positive,-0.533549293761763,neutral
2020-11-12 19:18:18.000,823.73,844.64,816.25,836.57,5883943.0,"Grasim Q2 net rises 3% to ₹1,521 crore on lower cost","Grasim Industries, an Aditya Birla Group company, has reported a three per cent increase in September quarter consolidated net profit at ₹1,521 crore against ₹1,473 crore, on the back of lower cost.In",positive,positive,1.558763186966607,positive,-0.533549293761763,neutral
2020-11-12 19:57:00.000,823.73,844.64,816.25,836.57,5883943.0,"Grasim Industries Q2 results: Net profit up 3% at Rs 1,521 cr","The company had posted a net profit of Rs 1,472.77 crore during the July-September quarter of the previous fiscal, Grasim Industries said in a regulatory filing.",positive,positive,1.558763186966607,positive,-0.533549293761763,neutral
2020-11-12 20:13:00.000,823.73,844.64,816.25,836.57,5883943.0,"Grasim Industries Q2 net profit up 3.30% at Rs 1,521.40 crore","Grasim Industries total expenses were at Rs 16,410.82 crore in Q2/FY 2020-21 as against Rs 17,039.30 crore in the year-ago period, down 3.68 percent.",positive,negative,1.558763186966607,positive,-0.533549293761763,neutral
2020-11-12 20:54:45.000,823.73,844.64,816.25,836.57,5883943.0,"Grasim Industries sells fertiliser unit to Indorama for ₹2,649 crore",Company to focus more on core businesses,neutral,neutral,1.558763186966607,positive,-0.533549293761763,neutral
2020-11-12 22:27:32.000,823.73,844.64,816.25,836.57,5883943.0,"Grasim Industries to sell fertiliser business for Rs 2,649 crore","Indo Gulf Fertilisers is engaged in manufacture, trade and sale of urea and other agri-inputs with a 1.2 MTPA urea manufacturing plant at Jagdishpur in Uttar Pradesh.",neutral,neutral,1.558763186966607,positive,-0.533549293761763,neutral
2020-11-12 22:37:10.000,823.73,844.64,816.25,836.57,5883943.0,"Grasim Industries Q2 net profit up 3.30% at Rs 1,521.40 cr","Aditya Birla Group firm Grasim Industries Ltd on Thursday reported a 3.30 per cent increase in consolidated net profit at Rs 1,521.40 crore for the second quarter ended September 2020.",positive,positive,1.558763186966607,positive,-0.533549293761763,neutral
2020-11-12 22:58:50.000,823.73,844.64,816.25,836.57,5883943.0,"Grasim to sell fertilizer arm for ₹2,649 crore",Indorama is buyer; ‘focus is on core’,neutral,neutral,1.558763186966607,positive,-0.533549293761763,neutral
2020-11-13 07:46:00.000,823.73,844.64,816.25,836.57,5883943.0,"Grasim to divest fertiliser biz to Indorama for consideration of Rs2,649cr; Q2 PAT rises to Rs1,521cr","According to the company, the divestment of the Fertiliser Business is a significant value unlocking exercise for Grasim.",neutral,positive,1.558763186966607,positive,-0.533549293761763,neutral
2020-11-13 08:02:00.000,823.73,844.64,816.25,836.57,5883943.0,"Stocks in the news | Just Dial, Reliance Industries, HUDCO, Indiabulls Real Estate","Mahanagar Gas, Eicher Motors, Sun TV Network, Grasim Industries, Dr Reddy’s Laboratories, Generic Engineering Construction and Projects, are also among the stocks in focus today.",neutral,neutral,1.558763186966607,positive,-0.533549293761763,neutral
2020-11-13 08:15:16.000,823.73,844.64,816.25,836.57,5883943.0,"Stocks in focus: RIL, ONGC, Tata Steel, TCS, Indiabulls Real Estate, Grasim Industries, Lakshmi Vilas Bank","Over 500 listed companies including ONGC, Tata Steel, Equitas Holdings, Eveready Industries, Future Retail, are scheduled to announce their July-September quarter earnings today.",neutral,neutral,1.558763186966607,positive,-0.533549293761763,neutral
2020-11-13 08:24:33.000,823.73,844.64,816.25,836.57,5883943.0,"Stocks To Watch: Eicher Motors, Grasim, Indiabulls Real Estate, RIL, ONGC, Tata Steel",Here are the stocks to watch in trade today.,neutral,neutral,1.558763186966607,positive,-0.533549293761763,neutral
2020-11-13 08:38:00.000,823.73,844.64,816.25,836.57,5883943.0,"RIL, Grasim Industries, Eicher Motors in spotlight","Reliance Industries (RIL) has entered into a definitive agreement, for making capital contribution, up to USD 50 million, in Breakthrough Energy Ventures II, L.P. (BEV), a limited partnership, newly incorporated under the Delaware State Laws,",neutral,positive,1.558763186966607,positive,-0.533549293761763,neutral
2020-11-13 08:55:00.000,823.73,844.64,816.25,836.57,5883943.0,"Stocks to watch: RIL, Wipro, Eicher Motors, Tata Steel, Grasim, TCS, ONGC",Heres a list of stocks that may trade actively in todays session.,neutral,neutral,1.558763186966607,positive,-0.533549293761763,neutral
2020-11-13 09:27:00.000,823.73,844.64,816.25,836.57,5883943.0,Grasim Industries share price falls on sale of fertiliser operations,"The company on November 12 reported a 3.30 percent jump in its consolidated net profit at Rs 1,521.40 crore for the second quarter ended September 2020.",negative,positive,1.558763186966607,positive,-0.533549293761763,neutral
2020-11-13 14:31:00.000,839.66,841.26,831.79,835.18,321557.0,"Grasim Ltd Q2 operating profit up 24.3% at Rs2,442cr on lower input costs","Grasim Ltd reported absolutely flat Sep-20 quarter top line sales revenues yoy at Rs18,400cr.",positive,negative,-0.533549293761763,neutral,-0.6318534763795777,neutral
