date,open,high,low,close,volume,title,description,title_sentiment,desc_sentiment,daily_change_pct,market_sentiment,next_day_change_pct,next_day_sentiment
2018-01-25 13:01:10.190,180.1,181.7,175.2,176.9,13692311.0,"L&T Finance Holdings Q3 profit may grow 35%, NII seen up 21%","Scale down of de-focused business will be another key point to watch out for. At the end of September quarter, defocused business was at Rs 2,005 crore.",positive,neutral,-1.7767906718489668,negative,-0.8358874338255782,neutral
2018-01-25 18:00:27.726,180.1,181.7,175.2,176.9,13692311.0,L&T Finance Q3FY18 consolidated net profit up 42% to Rs 3.84 billion,Company to continue consolidating subsidiaries and scaling down wholesale lending,positive,neutral,-1.7767906718489668,negative,-0.8358874338255782,neutral
2018-01-29 13:59:16.489,176.25,177.8,174.4,176.55,3527136.0,Aim to grow market share; see disbursement growth more from rural: L&T Fin Holding,"We expect the rural sector to continue to do well and hence we continue to gain market share, said  Dinanath Dubhashi, MD & CEO, L&T Finance Holding.",positive,positive,0.1702127659574532,neutral,-1.4857142857142824,negative
2018-02-01 13:01:12.256,169.6,169.75,154.95,156.75,9093919.0,"L&T Finance to mop up ₹3,000 cr from QIP, L&T"," The board of directors of L&T Finance Holdings on Wednesday approved issue of equity shares for an aggregate consideration of up to ₹1,000 crore (inclusive of premium as may be fixed) through qua",neutral,neutral,-7.576650943396224,negative,5.31177829099306,positive
2018-02-11 18:00:14.751,166.9,168.35,163.0,166.35,4406948.0,"Real estate stress: Now, Supertech to develop other players' stuck projects",Supertech has recently raised around Rs 8 billion from Altico Capital and L&T Finance to complete its ongoing projects,neutral,positive,-0.3295386458957527,neutral,1.137724550898207,positive
2018-06-20 23:00:24.597,164.7,164.7,160.5,160.85,2537313.0,L&T Finance eyes 30%growth in micro loans,L&T Finance is expecting close to 30 per cent growth in its micro loan portfolio this fiscal.The growth will be backed by its foray into new geographies and expansion of its base in existing marke,positive,positive,-2.337583485124465,negative,0.622858922454064,neutral
2018-06-27 18:00:35.464,151.25,154.9,147.25,149.2,10366323.0,L&T Finance Holdings: Well positioned in high growth segments,LTFH redefined its business strategy to achieve top quartile return on equity (RoE) by FY20 or earlier and is well on track to deliver on its stated objective.,positive,positive,-1.3553719008264538,negative,1.0,positive
2018-07-02 13:00:52.032,147.0,148.75,145.15,147.4,3513262.0,"Top intraday trading ideas for afternoon trade for Monday, 2 July 2018",L&T Finance Holdings is a 'Sell' call with a target price of Rs 142 and a stop loss of Rs 151.,neutral,neutral,0.2721088435374189,neutral,0.2386634844868696,neutral
2018-07-20 23:02:17.425,151.8,156.6,150.85,155.6,5859584.0,L&T Finance Q1 profit rises to ₹538 crore,"  L&T Finance Holdings (LTFH) has reported a profit of ₹538 crore in the first quarter of fiscal 2018-19 from the ₹314 crore recorded in the year-ago period.The company, which reported its first r",positive,positive,2.5032938076416222,positive,8.592263792010153,positive
2018-07-23 18:00:14.256,172.6,185.0,171.65,178.4,23486446.0,L&T Finance Holdings rallies 11% on strong Q1 earnings,The stock rallied 11% to Rs 172 after the company reported a healthy 71% yoy growth in consolidated net profit at Rs 5.38 billion driven by strong AUM growth and flat credit costs in June 2018 quarter,positive,positive,3.3603707995365077,positive,2.9658645775042034,positive
2018-07-24 10:00:49.395,172.6,185.0,171.65,178.4,23486446.0,Street cheers L&T Finance's clean-up act; net interest income up 51%,"Net interest income up 51 per cent, net profit rises 71 per cent in first quarter",positive,positive,3.3603707995365077,positive,2.9658645775042034,positive
2018-07-25 23:02:40.465,185.85,185.85,176.45,178.95,8486666.0,"Post Q1 numbers, analysts see turnaround in L&T Finance","Key positives: Robust growth in rural book, healthy fee income and strong asset quality",positive,positive,-3.712671509281682,negative,-1.9683947879123835,negative
2018-08-10 10:00:13.187,181.35,182.1,176.7,177.9,3605507.0,"Check out insider trading transaction for Aug 8; Axis Bank, Avenue Supermarts, L&T Finance in focus","Gajendra Singh Ranka sold 4,750 shares of Tejas Networks through market sale on August 8. Sanjay S.Rele sold 1,000 shares of Axis Bank on August 7",neutral,neutral,-1.9023986765922187,negative,-0.683176771989762,neutral
2018-08-20 10:00:27.735,184.4,189.5,184.0,186.05,16619773.0,"L&T Finance, HUL, Yes Bank, M&M and Sun Pharma look strong to go higher","On downside market has immediate support at 11,340 levels. ",positive,positive,0.8947939262472915,neutral,-1.0610079575596816,negative
2018-08-23 10:00:37.983,186.5,187.8,183.0,184.55,4259629.0,Centrum set to buy L&T Finance's supply chain business,Divestment is part of a broader Larsen &Toubro effort to trim its wholesale lending business and to concentrate instead on retail and housing segments. ,neutral,neutral,-1.0455764075066962,negative,-2.464788732394357,negative
2018-08-29 23:01:20.342,185.95,187.05,182.95,184.15,4566115.0,ICRA upgrade may flare up interest in L&T Fin,"ICRA on Wednesday upgraded its rating on L&T Finance Holdings and its subsidiaries - L&T Finance, L&T Infrastructure Finance and L&T Housing Finance - to AAA from AA+, on strong operat",positive,positive,-0.9680021511158824,negative,-1.3043478260869596,negative
2018-09-05 18:02:58.662,167.0,169.2,162.8,164.4,6676761.0,"Check out insider trades for Sept 3; IDFC Bank, L&T Finance & Tech Mahindra in focus","Satyan Kumar sold 7,000 shares of L&T Finance Holdings via market sale from August 30 to September 3Paul Parambi sold 3,000 shares of Kotak Mahindra Bank through market sale on August 31, 2018. Shivanand Raja sold 5,500 shares of Tech Mahindra through market sale on August 31, 2018.",neutral,neutral,-1.556886227544907,negative,2.284495887907401,positive
2018-09-17 23:00:34.782,155.5,157.2,150.1,150.5,9371350.0,L&T Finance Holdings (₹156): Sell,Investors with a short-term perspective can sell the stock of L&T Finance Holdings at current levels. The stock has been in an intermediate-term downtrend since hitting a resistance at ₹210 in Oct,neutral,negative,-3.215434083601286,negative,-3.782894736842105,negative
2018-09-18 18:02:22.267,152.0,152.5,144.65,146.25,12029175.0,L&T Finance Holdings (₹156): Sell,Investors with a short-term perspective can sell the stock of L&T Finance Holdings at current levels. The stock has been in an intermediate-term downtrend since hitting a resistance at ₹210 in Oct,neutral,negative,-3.782894736842105,negative,-5.1630434782608665,negative
2018-09-24 21:17:29.340,129.85,134.35,120.5,131.4,35399230.0,Short strangle in L&T Finance,"The outlook for the stock of L&T Finance Holdings (₹140) has turned neutral. Only a close above ₹165 will change the outlook to positive.Given the current volatility in the market, the stock could",neutral,positive,1.1936850211782914,positive,-2.126865671641786,negative
2018-09-26 13:01:46.666,133.0,133.3,124.75,125.95,18143842.0,Why Mayuresh Joshi is bullish on  L&T Finance in long term,"
“Mean reversion to earnings should start taking place in qualitative stocks like Indiabulls as well.”",positive,neutral,-5.300751879699246,negative,2.8571428571428523,positive
2018-10-08 18:01:52.479,120.0,126.5,119.5,123.5,14914358.0,Ideas for Profit: 2 NBFCs worth looking at in the recent market carnage,We have identified two NBFCs - L&T Finance Holdings and IndoStar Capital Finance - as good long term bets at the current market price,neutral,positive,2.9166666666666665,positive,6.653386454183262,positive
2018-10-10 18:02:04.518,127.0,132.6,122.0,127.9,12723840.0,NBFCs end on a high as big lenders look to buy larger loan portfolios,"The likes of Dewan Housing, HDFC, Ujjivan Financial, MAS Financial Services, Edelweiss, IIFL, Satin Creditcare and L&T Finance Holdings, among others rose 1-16 percent on Wednesday.",neutral,positive,0.7086614173228392,neutral,1.955521472392625,positive
2018-10-19 13:02:09.552,120.0,126.85,117.45,119.05,30410430.0,NBFC stocks continue to slide even as RBI eases liquidity coverage ratio,"Dewan Housing, Indiabulls Housing, HDFC, Ujjivan Financial, MAS Financial Services, Edelweiss Financial, IIFL Holdings, Satin Creditcare and L&T Finance Holdings, among others were down 3-12 percent on Friday",negative,negative,-0.791666666666669,neutral,1.9958419958420004,positive
2018-10-24 23:01:41.498,114.05,122.2,110.65,119.0,35097106.0,L&T Finance profit up 18% at ₹560 crore,"Despite several headwinds that impacted the NBFC segment, L&amp;amp;T Finance has managed to post a decent growth in profits at &#8377;560 crore, up 18.4 per cent, in the second quarter of fiscal 2019",positive,positive,4.340201665935996,positive,-0.7142857142857095,neutral
2018-10-25 10:00:29.108,114.05,122.2,110.65,119.0,35097106.0,"Sensex falls 300 points amid global rout, L&T Finance slumps 10%: 10 points",Sensex and Nifty opened sharply lower today amid a rout in global equities. Asian stock markets are trading with sharp losses after an overnight tumble on Wall Street.,negative,negative,4.340201665935996,positive,-0.7142857142857095,neutral
2018-10-25 13:01:16.424,119.0,119.95,115.7,118.15,12520520.0,L&T Finance Holdings hits 52-week low post September quarter results,"The stock slipped 13% to Rs 111, also its 52-week low on the BSE in early morning trade, on the back of heavy volumes.",negative,negative,-0.7142857142857095,neutral,2.6890756302521037,positive
2018-10-25 13:02:42.916,119.0,119.95,115.7,118.15,12520520.0,L&T Finance hits 52-week low despite better Q2 numbers,"Gross NPA was down at Rs 6,119 crore, while net NPA was at Rs 2,296 crore.",negative,negative,-0.7142857142857095,neutral,2.6890756302521037,positive
2018-10-26 10:01:16.315,119.0,119.95,115.7,118.15,12520520.0,Exposure to crisis-hit IL&FS takes a toll on L&T Finance Holdings' stock,"Company management though believes default probability is low, and overall liquidity levels are satisfactory",neutral,positive,-0.7142857142857095,neutral,2.6890756302521037,positive
2018-11-28 23:01:01.015,141.5,145.5,141.05,143.85,25958992.0,L&T Finance Holdings (₹138.6): Buy,"Investors with a short-term perspective can buy the stock of L&amp;amp;T Finance Holdings at current levels.On Wednesday, the stock jumped 5.5 per cent accompanied with extraordinary volume, breaching",neutral,positive,1.6607773851590064,positive,-0.5517241379310424,neutral
2018-11-29 10:01:19.762,141.5,145.5,141.05,143.85,25958992.0,'BUY' or 'SELL' ideas from experts for Thursday 29 November 2018,"L&T Finance is a 'Buy' call with a target price of Rs 149 and a stop loss of Rs 134.
",neutral,neutral,1.6607773851590064,positive,-0.5517241379310424,neutral
2018-12-03 23:00:11.292,144.0,148.0,143.5,146.1,9988808.0,IL&FS appoints L&T Finance Holdings’ N. Sivaraman as COO,L&T veteran N. Sivaraman will be responsible for day-to-day operations at  IL&FS  and provide hands-on leadership and oversight to the group’s asset sale efforts,neutral,neutral,1.4583333333333293,positive,-1.4031485284051903,negative
2018-12-21 23:00:28.057,157.9,159.25,150.5,150.85,7288728.0,After Market: Rs 2.26 crore investor wealth wiped out; IT pack takes a hard knock,"Infosys, Hero Motocorp, TVS Motor, L&T Finance, GAIL and ITC slipped below their 200-DMAs.",neutral,negative,-4.464851171627619,negative,0.7251153592617158,neutral
2019-01-01 18:00:12.887,153.2,154.35,149.6,149.95,4690143.0,Centrum Capital rallies 5% after arm completes acquisition of supply chain finance biz from L&T Finance,"The acquired business consists of an asset book of about Rs 650 crore in accordance with the Business Transfer Agreement executed on September 4, 2018.",positive,neutral,-2.1214099216710185,negative,-3.4540019926934686,negative
2019-01-11 13:00:36.285,144.5,145.0,139.6,141.0,4637104.0,"L&T Finance Holdings: Possible NPA shocks dampen outlook, stock falls",Watch out for high exposure to non-retail loans of the company,negative,neutral,-2.422145328719723,negative,-3.2280950691734542,negative
2019-01-15 18:00:38.016,141.85,144.2,141.2,141.8,5421015.0,L&T Finance Holding Q3 Net Profit seen up 51.3% YoY to Rs. 581 cr: Sharekhan,"Net Interest Income (NII) is expected to increase by 27.9 percent Y-o-Y (up 1.8 percent Q-o-Q) to Rs. 1,625.5 crore, according to Sharekhan.",positive,positive,-0.0352485019386555,neutral,-1.0526315789473684,negative
2019-01-21 23:01:56.031,138.7,140.95,135.2,137.3,15744458.0,L&T Finance Q3 profit surges 81% to Rs 581 crore,The company's consolidated net profit stood at Rs 325 crore in the year-ago period.,positive,neutral,-1.0093727469358165,negative,-0.2919708029197121,neutral
2019-01-22 18:00:58.678,137.0,138.35,135.5,136.6,4332146.0,"After a good Q3, don’t expect deterioration in NIM in Q4 too: Dinanath Dubhashi, L&T Finance Holdings","
We believe that debt and especially secured debt holders in IL&FS will be paid in full, says Dubhashi.",neutral,positive,-0.2919708029197121,neutral,0.1459854014598457,neutral
2019-01-23 18:02:39.975,137.0,138.15,135.65,137.2,3485372.0,Broker's call: L&T Finance Holdings (Accumulate),Prabhudas LilladherL&amp;amp;T Finance Holdings (Accumulate)CMP: ₹136.8Target: ₹172L&amp;amp;T Finance Holdings earnings surprised positively on back of benefit from movement to IND-AS accounting on P,neutral,positive,0.1459854014598457,neutral,-2.5668835864063717,negative
2019-02-07 23:01:34.115,133.65,134.3,128.1,128.5,8904096.0,L&T Finance offloads Anil Ambani Group stocks,RCom to go out of F&O from March 1,neutral,neutral,-3.853348297792746,negative,-2.4418604651162834,negative
2019-02-08 10:00:13.866,133.65,134.3,128.1,128.5,8904096.0,L&T Finanace offloads ADAG shares,L&T Finance sold 49 lakh shares of Reliance Infrastructure at Rs 120.98 per share.,neutral,neutral,-3.853348297792746,negative,-2.4418604651162834,negative
2019-02-08 18:01:38.310,133.65,134.3,128.1,128.5,8904096.0,"Anil Ambani Group blames L&T Finance, Edelweiss Group entities for 55% drop in market cap","Invocation of pledge of listed shares, open market sales led to slump in m-cap, the company has alleged",negative,negative,-3.853348297792746,negative,-2.4418604651162834,negative
2019-02-11 18:00:05.286,125.85,128.0,124.65,125.5,3041718.0,Sebi to look into sale of pledged shares of Reliance Group's 3 listed firms,L&T Finance and Edelweiss Group have counter-alleged that Reliance Group failed to make timely payments.,neutral,negative,-0.2781088597536705,neutral,-2.29976209357652,negative
2019-02-12 18:00:13.003,126.1,126.9,122.7,123.2,3329436.0,Reliance Power asks SEBI to immediately ban Edelweiss Group from capital mkts,"L&T Finance and Edelweiss Group have refuted the allegations and have counter-alleged that Reliance Group failed to make timely payments, which they said necessitated sale of pledged shares.

",neutral,negative,-2.29976209357652,negative,3.4552845528455287,positive
2019-02-12 23:01:18.432,126.1,126.9,122.7,123.2,3329436.0,Reliance Power asks Sebi to ban Edelweiss Group,"Reliance Group accused L&T Finance and Edelweiss Group entities of ""illegal"" and ""motivated"" actions in invoking the pledged shares.",neutral,negative,-2.29976209357652,negative,3.4552845528455287,positive
2019-02-25 10:01:46.606,126.85,127.95,125.3,126.5,3643152.0,"NBFCs look for retail money as MFs, banks keep a tight rein on funds","L&T Finance and Aditya Birla Fin both are rated ‘AAA, the top grade, by ratings firms.",neutral,neutral,-0.2759164367362983,neutral,-0.2413515687851948,neutral
2019-02-28 18:00:15.832,125.0,128.7,124.5,127.9,5243518.0,"L&T Finance raising Rs 1,500-cr via NCDs to diversify source of funds:  Dinanath Dubhashi","
The amount we are raising  is less than 2% of our balance sheet, says  Dubhashi. ",neutral,neutral,2.3200000000000047,positive,6.0546875,positive
2019-02-28 18:01:09.397,125.0,128.7,124.5,127.9,5243518.0,"L&T Finance to launch Rs 1,500 crore NCD issue",​This tranche opens for subscription on March 6 and closes on March 20.,neutral,neutral,2.3200000000000047,positive,6.0546875,positive
2019-03-04 10:01:09.503,128.0,136.15,127.5,135.75,10986272.0,L&T Fin to move SC against NCLAT’s order on IL&FS debt,"L&T Finance has Rs 1,800 crore of debt exposure to the IL&FS group companies or its SPV.
",neutral,neutral,6.0546875,positive,3.1398320554947143,positive
2019-03-05 10:01:02.665,128.0,136.15,127.5,135.75,10986272.0,"Top trading ideas by Prabhudas Lilladher: Buy Wockhardt, L&T Finance","Nifty outlook and top trading ideas by Vaishali Parekh, research analyst - technical research at Prabhudas Lilladher.",neutral,neutral,6.0546875,positive,3.1398320554947143,positive
2019-03-06 18:00:25.756,141.8,141.8,138.75,141.0,5305166.0,L&T Finance NCD issue opens today: Should you invest?,The NCDs are available at interest rates in the range of 8.98% to 9.35% across various tenors. The L&T Finance NCDs are available at coupon or interest rates in the range of 8.98% to 9.35%,neutral,neutral,-0.5641748942172153,neutral,1.2491077801570307,positive
2019-03-07 23:01:18.449,140.1,143.4,139.75,141.85,11130407.0,"L&T Finance closes NCS issue on second day, raises  ₹2,228 crore","The issue was opened on March 6 and was scheduled to close on March 20.The base size of the issue was  ₹500 crore, with an option to retain over-subscription up to  ₹1,000 crore.",neutral,neutral,1.2491077801570307,positive,1.753155680224404,positive
2019-03-08 10:00:09.445,140.1,143.4,139.75,141.85,11130407.0,"Stocks in the news: Sun Pharma, Tata Motors, Lupin, L&T Finance and Wipro"," Meanwhile, RIL has leased 4,000 acres of land from NMSEZ to develop a global economic hub.",neutral,neutral,1.2491077801570307,positive,1.753155680224404,positive
2019-03-27 13:02:16.696,154.95,155.15,151.65,153.65,15746470.0,"Pidilite, L&T Finance among 5 stocks to buy ahead of March expiry",Volatility has seen steady rise in last couple of weeks. Hence further rise above 17 will be a cause of concern for the market.,positive,negative,-0.8389803162310314,neutral,-0.424697811172823,neutral
2019-03-27 23:00:13.790,154.95,155.15,151.65,153.65,15746470.0,"Pidilite, L&T Finance among 5 stocks to buy ahead of March expiry",Volatility has seen steady rise in last couple of weeks. Hence further rise above 17 will be a cause of concern for the market.,positive,negative,-0.8389803162310314,neutral,-0.424697811172823,neutral
2019-04-03 13:00:36.583,152.75,152.8,148.8,149.05,5400400.0,"L&T Finance, SCUF, Muthoot Homefin, Magma Fincorp NCDs to open soon; know about them","After the IL&FS debacle, NBFCs have chosen to raise money through NCDs.",neutral,neutral,-2.422258592471351,negative,1.8102581293999247,positive
2019-04-07 23:00:21.617,152.3,153.4,147.5,148.65,3548352.0,L&T Finance NCD: A good risk-return trade-off,"The NCD is rated AAA, scoring over two other non-convertible debentures on offer currently",positive,neutral,-2.396585686145768,negative,-1.0709504685408262,negative
2019-04-09 23:01:20.070,148.45,149.45,144.0,144.95,6179391.0,"L&T Finance NCD gets bids worth Rs 3,238 crore","These NCDs have been rated ICRA AAA (stable), CARE AAA / Stable and IND AAA / Stable.",neutral,neutral,-2.357696194004716,negative,0.8931638612160653,neutral
2019-04-09 23:01:43.199,148.45,149.45,144.0,144.95,6179391.0,"L&T Finance NCD attracts Rs 3,238 crore","The issue was oversubscribed on day one of opening of Tranche 2 Issue on April 8, 2019.",neutral,positive,-2.357696194004716,negative,0.8931638612160653,neutral
2019-04-10 13:02:44.985,145.55,147.25,144.45,146.85,5765179.0,"L&T Finance NCD gets bids worth Rs 3,238 crore","These NCDs have been rated ICRA AAA (stable), CARE AAA / Stable and IND AAA / Stable.",neutral,neutral,0.8931638612160653,neutral,-0.2721088435374189,neutral
2019-04-11 18:00:25.902,147.0,148.1,145.75,146.6,3378645.0,"Contra bets: Select auto and metals could outperform in second half of 2019, says Sanjiv Bhasin","
If you are brave, you could make money in  Ujjivan, L&T Finance and Eqvitas, says Bhasin",positive,neutral,-0.2721088435374189,neutral,2.58503401360545,positive
2019-04-25 18:01:19.406,137.4,138.85,136.45,137.85,3650611.0,Apis Partners to invest $110 million in L&T Infrastructure Debt Fund,"L&T IDF is a subsidiary of L&T Finance Holdings, and is involved in refinancing of operating infrastructure projects in India.Out of the total investment amount, 70% is in the form of growth capital for L&T IDF and 30% is for purchase of shares from existing shareholders",neutral,neutral,0.3275109170305594,neutral,-3.5372144436256323,negative
2019-04-26 10:01:30.937,137.4,138.85,136.45,137.85,3650611.0,L&T Finance Holdings (₹137.2): Sell,Investors with a short-term view can sell the stock of L&amp;amp;T Finance Holdings at current levels. The stock has been in an intermediate-term downtrend since encountering a key resistance at ₹185,neutral,neutral,0.3275109170305594,neutral,-3.5372144436256323,negative
2019-04-29 10:00:26.943,135.7,135.75,129.5,130.9,15350516.0,L&T Finance Holdings Q4 net soars 94%,The net interest margin and fee income rose to 6.75 per cent in FY19.,neutral,positive,-3.5372144436256323,negative,-0.305343511450386,neutral
2019-04-30 18:01:17.419,135.7,135.75,129.5,130.9,15350516.0,L&T Finance putting in place a plan to  achieve top quartile ROE year after year: Dinanath Dubhashi,"
The retailisation drive started two years ago has progressed faster than expected, says the CEO.",positive,positive,-3.5372144436256323,negative,-0.305343511450386,neutral
2019-05-01 10:01:16.955,131.0,133.95,129.2,130.6,6375856.0,NBFCs aim to tap overseas loan market raising $200-400 million each,"L&T Finance, Piramal Capital Housing, Bajaj Finance declined to comment on the matter. An email sent to Hero FinCorp remained unanswered. ",positive,neutral,-0.305343511450386,neutral,-1.161890007745933,negative
2019-05-14 23:00:54.221,118.45,119.8,115.5,116.4,5167310.0,L&T Finance to raise Rs 195 cr via preference shares,"L&amp;amp;T Finance Holdings plans to raise up to ₹ 195 crore by issuing shares on a preferential basis.In an exchange filing, the company said it will issue up to 1,95,00,000 cumulative compulsorily",positive,positive,-1.7306880540312344,negative,-0.5555555555555605,neutral
2019-05-29 18:01:06.346,133.0,133.85,130.8,132.45,4280551.0,L&T Finance to raise up to Rs 100 crore by issuing securities,Stock of the company closed 1.64 per cent up at Rs 133 on BSE. ,positive,positive,-0.4135338345864747,neutral,1.0558069381598838,positive
2019-05-30 18:02:31.346,132.6,137.15,131.45,134.0,9938339.0,L&T Finance offers two-wheeler loans without hypothecation,L&amp;amp;T Finance Limited is offering two-wheeler loans without the need for hypothecation of vehicle to the financier over the tenure of the loan. The borrowers can choose from 3 different EMI tenu,neutral,neutral,1.0558069381598838,positive,1.7897091722595122,positive
2019-06-03 10:01:08.664,134.1,136.65,132.5,136.5,5704877.0,"Top trading ideas by Devang Shah: Buy L&T Finance, Tata Global, Cummins",The short-term outlook for the market remains positive till Nifty trades above 10940 levels.,neutral,positive,1.7897091722595122,positive,1.1439114391143996,positive
2019-06-11 23:02:36.688,125.0,126.3,121.15,121.6,5189939.0,L&T Finance to expand micro loan business in North India,"L&T Finances rural loan book size is about Rs 25,600 crore with nearly half of it (Rs 12,500 crore) coming from micro loan vertical.",positive,neutral,-2.7200000000000046,negative,0.7431874483897652,neutral
2019-06-20 10:00:54.629,107.5,114.1,106.3,113.95,12964442.0,L&T Finance Holdings (₹109.7): Sell,"The stock of L&amp;amp;T Finance Holdings plummeted 6.3 per cent accompanied with above average volume on Wednesday, breaking below a key medium-term support at ₹115. The fall gives investors with a s",neutral,negative,6.000000000000003,positive,0.4405286343612335,neutral
2019-07-04 13:02:00.336,122.65,127.15,119.5,124.15,23634356.0,"Top intraday trading ideas for afternoon trade on Thursday, July 4, 2019",L&T Finance is a 'Buy' call with a target price of Rs 130 and a stop loss of Rs 117.,neutral,neutral,1.222992254382389,positive,-3.1897926634768736,negative
2019-07-04 18:01:42.785,122.65,127.15,119.5,124.15,23634356.0,L&T Finance unit to raise $550 million in IFC-led investment round,"BNP Paribas, Citibank, and DBS Bank Ltd are also anchoring the round, which will see L&T Finance raise $275 million in the first tranche.In May, Cholamandalam Investment and Finance Company Ltd said it would raise $222 million in debt funds in an IFC-led investment round",positive,positive,1.222992254382389,positive,-3.1897926634768736,negative
2019-07-04 18:02:07.854,122.65,127.15,119.5,124.15,23634356.0,L&T Finance unit to raise $550 million in IFC-led investment round,A unit of L&T Finance Holdings Ltd will raise $550 million in an investment roun...,positive,positive,1.222992254382389,positive,-3.1897926634768736,negative
2019-07-05 10:00:21.507,122.65,127.15,119.5,124.15,23634356.0,L&T Finance raises $550mn through ECB; stock up 1%,"In the first tranche, the investors have contributed $275 million. Of this, IFC is bringing in $125 million, which will be utilized by L&T Finance to expand its farm equipment finance book by extending loans to farmers for buying equipment and modernizing farming.",positive,positive,1.222992254382389,positive,-3.1897926634768736,negative
2019-07-05 10:02:07.201,122.65,127.15,119.5,124.15,23634356.0,"Stocks in the news: Eveready, Sobha, GMR Infra, L&T Finance, Commercial Syn, CRISIL",GMR Infrastructure | L&T Finance Holdings | Commercial Syn Bags | Rain Industries and Usha Martin are stocks which are in the news today.,neutral,neutral,1.222992254382389,positive,-3.1897926634768736,negative
