date,open,high,low,close,volume,title,description,title_sentiment,desc_sentiment,daily_change_pct,market_sentiment,next_day_change_pct,next_day_sentiment
2020-07-03 15:52:45.000,69.7,69.95,66.9,67.65,13578809.0,"L&T Finance Holdings to raise up to Rs 2,000 cr to fund business growth","L&amp;amp;T Finance Holdings (LTFH) plans to raise up to Rs 2,000 crore by issuing preference shares through public offer or private placement, the non-banking finance company said in its annual repor",positive,positive,-2.941176470588231,negative,2.1183345507669875,positive
2020-07-03 15:59:00.000,69.7,69.95,66.9,67.65,13578809.0,"L&T Finance Holdings to raise up to Rs 2,000 crore to fund business growth","In an explanatory note on the fund mop-up plan, LTFH said the steady growth in the operations of the subsidiaries of the company has necessitated regular infusion of equity and tier I or tier II debt in its subsidiaries.",positive,positive,-2.941176470588231,negative,2.1183345507669875,positive
2020-07-03 16:17:00.000,69.7,69.95,66.9,67.65,13578809.0,"L&T Finance Holdings to raise up to Rs 2,000 crore to fund biz growth","The preference shares will allotted to various persons either through public offer or private placement, in one or more tranches.",positive,neutral,-2.941176470588231,negative,2.1183345507669875,positive
2020-07-03 16:39:33.000,69.7,69.95,66.9,67.65,13578809.0,"L&T Finance Holdings to raise up to Rs 2,000 cr to fund biz growth","The company will seek shareholders’ approval to the proposal at the annual general meeting (AGM) scheduled to take place on July 28 through audio/visual mode, the report said.",positive,neutral,-2.941176470588231,negative,2.1183345507669875,positive
2020-07-03 22:13:00.000,69.7,69.95,66.9,67.65,13578809.0,L&T Finance’s deal to sell L&T Capital Markets (Middle East) terminated,LTFH stock closed 2.17 per cent down at Rs 67.70 apiece on the BSE.,negative,negative,-2.941176470588231,negative,2.1183345507669875,positive
2020-07-07 04:30:00.000,70.15,72.7,68.8,71.5,45195915.0,L&T Finance receives $50M of total ECB loans from AIIB for lending to the renewable energy sector,The transaction was carried through a subsidiary namely L&T Infrastructure Finance.,neutral,neutral,1.924447612259436,positive,-2.413793103448276,negative
2020-07-08 00:22:45.000,72.5,74.75,70.6,70.75,61989011.0,L&T Finance arm closes $100-million external commercial borrowing from Asian Infrastructure Investment Bank,"L&T Finance had earlier disclosed that it had plans to raise up to Rs 2,000 crore by issuing preference shares through public offer or private placement.",neutral,neutral,-2.413793103448276,negative,-1.5373864430468125,negative
2020-07-08 07:01:00.000,72.5,74.75,70.6,70.75,61989011.0,"Hot Stocks | L&T Finance, Exide Industries, Century Textiles three buy calls for the short term","On the technical front, Bank Nifty is looking much stronger than Nifty and it is likely to test 23,000 levels in the coming sessions.",neutral,positive,-2.413793103448276,negative,-1.5373864430468125,negative
2020-07-08 10:52:00.000,72.5,74.75,70.6,70.75,61989011.0,Trending stocks: L&T Finance shares climb over 3%,"A total of 2,306,095 shares changed hands on the counter till 10:49AM (IST).",positive,neutral,-2.413793103448276,negative,-1.5373864430468125,negative
2020-07-15 20:12:00.000,61.0,61.2,58.3,60.0,24849401.0,NSE-BSE bulk deals: L&T Finance laps up Ballarpur Industries - The Economic Times,Heres who bought and sold what in some of the key bulk and block deals of the day.,neutral,neutral,-1.639344262295082,negative,3.6043587594300064,positive
2020-07-15 21:26:47.000,61.0,61.2,58.3,60.0,24849401.0,L&T Finance Holdings (₹60.8): Sell,"The stock of L&amp;T Finance Holdings tumbled 5 per cent with above average volume on Wednesday, decisively closing below a key support level of ₹63. This fall provides, traders with a short-term",neutral,negative,-1.639344262295082,negative,3.6043587594300064,positive
2020-07-16 05:30:00.000,61.0,61.2,58.3,60.0,24849401.0,BRIEF-India’s L&T Finance Holdings June Qtr Consol Net Profit Falls - Investing.com India,"The Financial News section features stock market news in addition to stories about bonds, forex, commodities and economic releases.",neutral,neutral,-1.639344262295082,negative,3.6043587594300064,positive
2020-07-16 09:04:00.000,61.0,61.2,58.3,60.0,24849401.0,"Stocks in the news: Infosys, YES Bank, Titan, Cadila Healthcare, IDBI Bank and L&T Finance - The Economic Times","YES Bank’s Rs 15,000 crore FPO was subscribed 22 per cent at the end of first day of the bidding process.",neutral,neutral,-1.639344262295082,negative,3.6043587594300064,positive
2020-07-16 09:08:26.000,61.0,61.2,58.3,60.0,24849401.0,"Stocks in focus: Infosys, Cadila Healthcare, Titan, L&T Finance, SBI, among others to remain in news","L&T Finance Holdings, L&T Technology Services, Bajaj Consumer Care, Aditya Birla Money, Cyient are among companies that are scheduled to announce their June quarter earnings later in the day today.",neutral,neutral,-1.639344262295082,negative,3.6043587594300064,positive
2020-07-16 19:00:00.000,59.65,61.85,58.6,61.8,18382015.0,L&T Finance Holdings Q1 results: Net drops 73% hit by provisioning - The Economic Times,The company posted a consolidated net profit of Rs 148.31 crore in the quarter under review.,neutral,neutral,3.6043587594300064,positive,0.5608974358974381,neutral
2020-07-16 20:20:51.000,59.65,61.85,58.6,61.8,18382015.0,L&T Finance Holdings Q1 net profit down at ₹148 crore on higher provisions,"L&amp;T Finance Holdings reported a 73 per cent drop in consolidated net profit for the first quarter of the fiscal on the back of higher provisions.For the quarter ended June 30, it posted a net",negative,negative,3.6043587594300064,positive,0.5608974358974381,neutral
2020-07-16 20:51:00.000,59.65,61.85,58.6,61.8,18382015.0,"L&T Finance Holdings Q1 PBT falls 86.63% to Rs 99.26 cr, impairment rises","The advances shrank by 1 per cent YoY to Rs 98,879 crore at end of June 2020 from Rs 99,904 crore in June 2019",neutral,positive,3.6043587594300064,positive,0.5608974358974381,neutral
2020-07-16 20:56:04.000,59.65,61.85,58.6,61.8,18382015.0,L&T Finance Q1 profit falls 73% to ₹148 crore on higher provisions,L&T Finance said that it had witnessed a considerable reduction in portfolio under moratorium for retail products from 79% in the March quarter to 44% in the June quarter,negative,negative,3.6043587594300064,positive,0.5608974358974381,neutral
2020-07-16 21:36:00.000,59.65,61.85,58.6,61.8,18382015.0,L&T Finance Holdings Q1 net profit dips 73% to Rs 148 crore on higher provisioning,"Total income fell to Rs 3,397.53 crore in June quarter as against Rs 3,689.50 crore in the same period of 2019-20.",positive,negative,3.6043587594300064,positive,0.5608974358974381,neutral
2020-07-16 21:39:45.000,59.65,61.85,58.6,61.8,18382015.0,L&T Finance Holdings Q1 net profit dips 73 per cent to Rs 148 crore on higher provisioning,The non-banking finance company (NBFC) had posted a net profit of Rs 549 crore in the corresponding April-June quarter of previous fiscal year.,positive,positive,3.6043587594300064,positive,0.5608974358974381,neutral
2020-07-17 07:47:59.000,59.65,61.85,58.6,61.8,18382015.0,"Stocks to Watch: Yes Bank, L&T Finance, Cyient, Thomas Cook, PTC India","The ₹15,000 crore follow-on public offer of Yes Bank was subscribed 53% on the second day.L&T Finance Holdings reported a 73% decline in net profit at ₹148 crore in Q1FY21 due to higher contingency provisioning",neutral,negative,3.6043587594300064,positive,0.5608974358974381,neutral
2020-07-17 07:50:00.000,59.65,61.85,58.6,61.8,18382015.0,L&T Finance Holdings consolidated net profit declines 72.98% in the June 2020 quarter,Sales decline 5.77% to Rs 3387.06 crore,negative,negative,3.6043587594300064,positive,0.5608974358974381,neutral
2020-07-17 07:53:00.000,59.65,61.85,58.6,61.8,18382015.0,"Top stocks in focus: HCL Tech, Cyient, Britannia, L&T Finance Holdings",Check out the stocks that will be in focus during trade today based on recent and latest news developments.,neutral,neutral,3.6043587594300064,positive,0.5608974358974381,neutral
2020-07-17 09:58:00.000,59.65,61.85,58.6,61.8,18382015.0,L&T Finance share price climbs 3% despite dip in Q1 profit; Citi gives ‘buy’ call,"As per CNBC-TV18, Citi said LTFH’s profit of Rs 150 crore is 35 percent lower than its as well as the consensus estimates.",positive,negative,3.6043587594300064,positive,0.5608974358974381,neutral
2020-07-17 10:03:00.000,59.65,61.85,58.6,61.8,18382015.0,L&T Finance Q1 PAT drops 73% to Rs 147 cr,"L&T Finance Holdings consolidated net profit tanked 73.2% to Rs 147.44 crore on 1.8% slip in total income to Rs 3,623.14 crore in Q1 June 2020 over Q1 June 2019.",neutral,positive,3.6043587594300064,positive,0.5608974358974381,neutral
2020-07-17 10:08:00.000,59.65,61.85,58.6,61.8,18382015.0,L&T Finance Holdings gains nearly 3% on Sensex despite a decline in Q1 PAT,"LTFH has also logged an incremental provision to the tune of Rs577cr in the quarter, from which Rs277cr is related to Covid-19 pandemic.",positive,positive,3.6043587594300064,positive,0.5608974358974381,neutral
2020-07-17 11:33:00.000,59.65,61.85,58.6,61.8,18382015.0,"Buy L&T Finance Holdings, target price Rs 85: Motilal Oswal - The Economic Times",The company utilized the INR2.25b gains from the sale of the Wealth Management business to create provisions for one large defocused account.,neutral,neutral,3.6043587594300064,positive,0.5608974358974381,neutral
2020-07-17 17:18:00.000,59.65,61.85,58.6,61.8,18382015.0,"This June, disbursements for tractors were higher than in last June: L&T Finance","In rural India, there has been an uptick in disbursements and collections.",positive,positive,3.6043587594300064,positive,0.5608974358974381,neutral
2020-07-17 23:51:00.000,59.65,61.85,58.6,61.8,18382015.0,L&T Finance Holdings to wind up Dubai wealth management business,"In early July, L&TFH informed that the share purchase agreement (SPA) with Proud Securities and Credits Pvt Ltd (an NBFC firm forming a part of InCred group) to sell 100 per cent of its shareholding in L&T Capital Markets (Middle East) was mutually terminated.",neutral,positive,3.6043587594300064,positive,0.5608974358974381,neutral
2020-07-19 12:30:09.000,62.4,62.95,61.7,62.75,13122544.0,Motilal Oswal: L&T Finance Q1 Strengthening The Balance Sheet,Motilal Oswal: L&T Finance Q1 Strengthening The Balance Sheet,neutral,neutral,0.5608974358974381,neutral,-0.8702531645569688,neutral
2020-07-19 18:20:35.000,62.4,62.95,61.7,62.75,13122544.0,ICICI Securities: L&T Finance Q1 Trends Point Towards Guarded Optimism,ICICI Securities: L&T Finance Q1 Trends Point Towards Guarded Optimism,neutral,neutral,0.5608974358974381,neutral,-0.8702531645569688,neutral
2020-07-29 05:43:00.000,60.65,63.7,60.4,62.3,17114792.0,ICRA appoints N. Sivaraman as MD and Group CEO,"During his 34-year career at L&T, he held senior positions including as President & Wholetime Director of L&T Finance Holdings.",neutral,neutral,2.7205276174773267,positive,-3.76904570970329,negative
2020-08-13 18:29:00.000,66.0,66.75,63.65,64.1,16850487.0,"Digital bug in Bharat: India Inc looks at marketing campaigns via Facebook, Microsoft Teams","Marketing campaigns in rural India has come a long way. Today, corporates like Mahindra Agri, L&T Finance, Hero, Marico, Maruti Suzuki and others have put in place well-defined strategies and the role of the mobile has been increasing significantly.",neutral,positive,-2.8787878787878878,negative,0.928792569659456,positive
2020-08-14 21:12:00.000,66.0,66.75,63.65,64.1,16850487.0,"NSE-BSE bulk deals: KKR, L&T Finance cut stake in CG Power","KKR India Financial Services sold 70,50,000 shares of CG Power and Industrial Solutions on the BSE and another 2,90,76,000 shares on the NSE. KKR India Debt Opportunities Fund II, L&T Finance, Vistra ITCL India, Chetan Rasiklal Shah and Alpha Leon Enterprises also sold shares in the company.",neutral,neutral,-2.8787878787878878,negative,0.928792569659456,positive
2020-08-14 21:58:05.000,66.0,66.75,63.65,64.1,16850487.0,"KKR, L&T Finance sell part of their stakes in CG Power","As per the bulk deal data available on NSE, L&T Finance, KKR India Debt Opportunities Fund II and KKR India Financial Services sold over 4.66 crore shares, approximately 7.5%, of CG Power",neutral,neutral,-2.8787878787878878,negative,0.928792569659456,positive
2020-08-17 05:30:00.000,64.6,65.2,63.6,65.2,15222042.0,BRIEF-L&T Finance Holdings Ltd - To Raise Funds Aggregating To 1.5 Billion Rupees - Investing.com India,"The Financial News section features stock market news in addition to stories about bonds, forex, commodities and economic releases.",neutral,neutral,0.928792569659456,positive,2.8265851795263472,positive
2020-08-17 09:50:32.000,64.6,65.2,63.6,65.2,15222042.0,L&T Finance Holdings to consider raising funds via NCD issue,On 19 August 2020,neutral,neutral,0.928792569659456,positive,2.8265851795263472,positive
2020-08-17 21:33:01.000,65.45,67.5,64.8,67.3,15595026.0,L&T Finance sells its remaining CG Power stake for ₹73 crore,"L&T Finance Ltd on Monday divested its remaining 8.4% stake in CG Power & Industrial Solutions Ltd for ₹73 crore, through open market transactions",neutral,neutral,2.8265851795263472,positive,-0.7374631268436578,neutral
2020-08-17 21:35:00.000,65.45,67.5,64.8,67.3,15595026.0,NSE-BSE bulk deals: L&T Finance exits CG Power; IndusInd offloads McLeod Russel,"IndusInd Bank and Manju Gaggar sold 22,00,000 shares and 9,00,000 shares of McLeod Russel India at Rs 17.78 per share, while Niraj Rajnikant Shah bought 12,12620 shares of the company at the same price.",neutral,neutral,2.8265851795263472,positive,-0.7374631268436578,neutral
2020-08-17 23:50:00.000,65.45,67.5,64.8,67.3,15595026.0,"L&T Finance exits CG Power, IndusInd Bank offloads 2.1% stake in Mcleod Russel","L&T Finance exited CG Power, erstwhile Crompton Greaves, which manufactures power transformers and reactors.",neutral,neutral,2.8265851795263472,positive,-0.7374631268436578,neutral
2020-08-18 03:00:00.000,65.45,67.5,64.8,67.3,15595026.0,CG Power zooms 5% despite L&T Finance sells stake in debt-laden for Rs73cr,L&T Finance’s stake was at 10% in CG Power as on June 2020.,neutral,neutral,2.8265851795263472,positive,-0.7374631268436578,neutral
2020-08-18 07:30:00.000,65.45,67.5,64.8,67.3,15595026.0,"Stocks in the news: Tata Motors, Bandhan Bank, L&T Finance, ZEEL and Vedanta",YES Bank will enhance pool of share in ESOP to 225 million shares from 75 million to grant them to employees.,neutral,neutral,2.8265851795263472,positive,-0.7374631268436578,neutral
2020-08-18 19:05:00.000,67.8,68.45,66.85,67.3,15139852.0,Minority shareholding shuffle seen at CG Power; Blue Diamond picks 7% stake,"The bulk sale deals in the company scrip seen in the last one week included KKR, Vistra ITCL India and L&T Finance",neutral,neutral,-0.7374631268436578,neutral,2.2288261515601784,positive
2020-08-18 21:01:05.000,67.8,68.45,66.85,67.3,15139852.0,"After KKR, L&T Finance, now Yes Bank sells CG Power shares worth ₹76 crore","Private sector lender Yes Bank Ltd on Tuesday, offloaded 5.18 crore shares or 8.27% equity stake in CG Power & Industrial Solutions Ltd for ₹76 crore, via open market transactions",neutral,neutral,-0.7374631268436578,neutral,2.2288261515601784,positive
2020-08-19 05:30:00.000,67.8,68.45,66.85,67.3,15139852.0,BRIEF-L&T Finance Holdings Ltd Says Approved Issue Of NCDs Up To 2 Bln Rupees - Investing.com India,"The Financial News section features stock market news in addition to stories about bonds, forex, commodities and economic releases.",neutral,neutral,-0.7374631268436578,neutral,2.2288261515601784,positive
2020-08-19 12:07:00.000,67.3,70.0,66.5,68.8,24817284.0,L&T Finance exits CG Power and Industrial Solutions,"L&T Finance has sold (in open market) 6.26 crore shares of CG Power and Industrial Solutions Ltd, constituting 9.99 per cent of the paid up share capital of CG Power and Industrial Solutions Ltd, a regulatory filing said.",neutral,neutral,2.2288261515601784,positive,-2.6523297491039344,negative
2020-08-19 12:49:52.000,67.3,70.0,66.5,68.8,24817284.0,L&T Finance exits CG Power and Industrial Solutions,"L&T Finance has “sold (in open market) 6.26 crore shares of CG Power and Industrial Solutions Ltd, constituting 9.99 per cent of the paid up share capital of?CG Power and Industrial Solutions Ltd,” a regulatory filing said.",neutral,neutral,2.2288261515601784,positive,-2.6523297491039344,negative
2020-08-19 13:12:00.000,67.3,70.0,66.5,68.8,24817284.0,L&T Finance sells its remaining stake in CG Power and Industrial Solutions,Shares of CG Power were trading 4.98 per cent higher at Rs 15.39 per share on BSE,neutral,positive,2.2288261515601784,positive,-2.6523297491039344,negative
2020-08-19 15:16:37.000,67.3,70.0,66.5,68.8,24817284.0,L&T Finance Holdings weighs $450 million rights issue: Report,"The report says no final decision has been made regarding the amount to be raised or the share sale’s timing, and the company can still decide not to proceed with the fundraising plan",neutral,neutral,2.2288261515601784,positive,-2.6523297491039344,negative
2020-08-19 15:20:00.000,67.3,70.0,66.5,68.8,24817284.0,L&T Finance weighs $450 million rights issue,"The financial services arm of Larsen & Toubro Ltd. has started discussing the fundraising with potential advisers, said the people, who asked not to be identified as the matter is private.",neutral,neutral,2.2288261515601784,positive,-2.6523297491039344,negative
2020-08-19 15:52:24.000,67.3,70.0,66.5,68.8,24817284.0,L&T Finance plans to tap markets with rights issue,"This month alone, leading private sector lenders ICICI Bank, HDFC Ltd, and Axis Bank have together raised around ₹39,000 crore in equity capital through their respective qualified institutional placements",neutral,positive,2.2288261515601784,positive,-2.6523297491039344,negative
2020-08-19 18:04:07.000,67.3,70.0,66.5,68.8,24817284.0,L&T Finance Holdings to issue NCDs aggregating Rs 200 cr,On 28 August 2020,neutral,neutral,2.2288261515601784,positive,-2.6523297491039344,negative
2020-08-19 23:08:00.000,67.3,70.0,66.5,68.8,24817284.0,L&T Finance Holdings to raise up to Rs 200 cr by issuing bonds,The bonds will carry coupon/interest rate of 8 per cent per annum payable annually.,positive,neutral,2.2288261515601784,positive,-2.6523297491039344,negative
2020-08-20 00:11:00.000,67.3,70.0,66.5,68.8,24817284.0,"L&T Finance plans to raise Rs 3,367 crore through a rights issue","The financial services arm of Larsen & Toubro has started discussing the fundraising with potential advisers, said the people, who asked not to be identified as the matter is private",positive,neutral,2.2288261515601784,positive,-2.6523297491039344,negative
2020-08-20 07:10:00.000,67.3,70.0,66.5,68.8,24817284.0,"In pics | Stocks in the news: IRCTC, Future Consumer, Gillette India, IIFL Wealth Management, Hindustan Aeronautics","Zee Learn, Dolat Investments, GSS Infotech, Satin Creditcare RE, Som Distilleries & Breweries, Suumaya Lifestyle, Solara Active Pharma, Future Retail, Deccan Health Care, Kennametal India, L&T Finance Holdings, India Grid Trust, Birlasoft, Ramkrishna Forgings, Sobha, Mangalam Cement, Ramky I…",neutral,neutral,2.2288261515601784,positive,-2.6523297491039344,negative
2020-08-20 07:36:05.000,67.3,70.0,66.5,68.8,24817284.0,India’s L&T Finance Weighs $450 Million Rights Issue,L&T Finance is joining financial peers in seeking to raise funds to boost its capital buffer.,neutral,neutral,2.2288261515601784,positive,-2.6523297491039344,negative
2020-08-20 08:34:00.000,67.3,70.0,66.5,68.8,24817284.0,"L&T Finance, Ruchi Soya, PNB Housing Finance in focus","L&T Finance Holdings said that the Committee of Directors of the company approved the offer and issuance of up to 2,000 Unsecured, Redeemable, Non-Convertible Debentures (NCDs) of face value of Rs 10,00,000 at par aggregating to nominal amount of",neutral,neutral,2.2288261515601784,positive,-2.6523297491039344,negative
2020-08-20 08:58:00.000,67.3,70.0,66.5,68.8,24817284.0,"Stocks to watch: SBI, L&T Finance, Ruchi Soya, Cosmo Films, CG Power",Heres a list of stocks that may trade actively in todays trading session,neutral,neutral,2.2288261515601784,positive,-2.6523297491039344,negative
2020-08-20 09:37:00.000,67.3,70.0,66.5,68.8,24817284.0,"Stocks in news: SBI, DLF, PNB Housing Finance, Ruchi Soya, L&T Finance","Stocks to watch today on August 20: SBI, DLF, PNB Housing Finance, Ruchi Soya, L&T Finance among others are the top stocks to watch out for in Thursday’s trading session",neutral,neutral,2.2288261515601784,positive,-2.6523297491039344,negative
2020-08-20 11:46:37.000,67.3,70.0,66.5,68.8,24817284.0,"RBL Bank plans to raise about ₹1,500 crore via preference share sale",Lender plans to use the proceeds to improve capital buffers and boost lending over the coming year once the pandemic eases.The bank joins financial peers from IDFC First Bank to L&T Finance Holdings in tapping the equity market to raise capital as the coronavirus outbreak threatens to push up defaul…,positive,neutral,2.2288261515601784,positive,-2.6523297491039344,negative
2020-08-20 14:00:18.000,69.75,70.15,67.45,67.9,16822164.0,L&T Finance Holdings gains 4% on ₹200-crore fund raise plan,The NCDs will be listed on National Stock Exchange (NSE) and the tenure of the NCDs shall be 1095 days. NCDs will be redeemed at par on 28 August 2023,positive,neutral,-2.6523297491039344,negative,-1.0294117647058865,negative
2020-08-21 23:12:11.000,69.75,70.15,67.45,67.9,16822164.0,Private Equity firm KKR cuts down stake in CG Power,"Recently, L&T Finance exited CG Power by selling its entire 10% stake in two block deals. KKR India Debt Opportunities Fund II still holds 9.5 lakh shares of CG Power",negative,neutral,-2.6523297491039344,negative,-1.0294117647058865,negative
2020-08-25 15:09:00.000,68.35,72.1,68.0,71.95,33681966.0,Mortgage lenders of Amtek subsidiary approaches NCLT to protect their rights,The appeal deals with a part of Amtek Autos factory land mortgaged with private lenders KKR India and L&T Finance.,neutral,neutral,5.267008046817862,positive,-2.73972602739726,negative
2020-09-25 07:58:00.000,56.85,58.65,55.6,58.25,11395787.0,"Stock recommendations by Anand Rathi: Sell Piramal Enterprises, L&T Finance",The momentum oscillator MACD has provided fresh sell crossover on the weekly scale for Piramals stock,neutral,neutral,2.462620932277922,positive,5.489864864864864,positive
2020-09-28 10:55:00.000,59.2,62.55,58.85,62.45,17883848.0,L&T Finance share price rises 5% as HSBC maintains buy,The global research firm has maintained buy rating with target at Rs 76 per share. It is of the view that rural portfolio is leading recovery in demand,positive,positive,5.489864864864864,positive,-2.146263910969796,negative
2020-10-05 08:20:30.000,64.65,65.5,62.95,63.45,8878130.0,Here’s a Bull Spread Strategy on L&T Finance by HDFC Securities,Short term trend of the stock is positive where stock price is trading above its 5 and 20-day SMA,neutral,positive,-1.8561484918793545,negative,0.390625,neutral
2020-10-22 05:30:00.000,63.0,64.6,62.6,64.5,10499768.0,BRIEF-L&T Finance Holdings Sept-Quarter Consol Profit Rises - Investing.com India,"The Financial News section features stock market news in addition to stories about bonds, forex, commodities and economic releases.",neutral,neutral,2.380952380952381,positive,-0.4611837048424245,neutral
2020-10-22 06:13:00.000,63.0,64.6,62.6,64.5,10499768.0,L&T Finance Q2 profits 41% higher on deferred tax adjustment,"L&T Finance reported a decrease of 5.63% in top line sales for the Sep-20 quarter at Rs3,408.10.1cr",positive,negative,2.380952380952381,positive,-0.4611837048424245,neutral
2020-10-22 19:24:39.000,65.05,66.8,64.35,64.75,24862916.0,L&T Finance Q2 profit up 52%,L&amp;T Finance Holdings registered a 52.2 per cent increase in consolidated net profit at ₹265.12 crore in the second quarter of the fiscal against ₹174.2 crore in the same period a year ago.Its,positive,positive,-0.4611837048424245,neutral,0.0,neutral
2020-10-22 20:17:00.000,65.05,66.8,64.35,64.75,24862916.0,L&T Finance Q2 results: Net profit rises 52% to Rs 265 crore,It recorded its best ever monthly disbursements in the rural business and a strong pick up in infrastructure disbursements.,positive,positive,-0.4611837048424245,neutral,0.0,neutral
2020-10-22 20:45:00.000,65.05,66.8,64.35,64.75,24862916.0,L&T Finance Holdings Q2 net up 42% to Rs 248 cr despite higher provisioning,Provision coverage ratio rises to 69% from 54% a year ago,positive,positive,-0.4611837048424245,neutral,0.0,neutral
2020-10-22 21:19:00.000,65.05,66.8,64.35,64.75,24862916.0,L&T Finance Holdings Q2 net jumps 52% to Rs 265 crore,"Total income for the said quarter fell to Rs 3,508.91 crore as against Rs 3,711.85 crore in year-ago period.",positive,negative,-0.4611837048424245,neutral,0.0,neutral
2020-10-23 07:58:00.000,65.05,66.8,64.35,64.75,24862916.0,L&T Finance Holdings consolidated net profit rises 52.19% in the September 2020 quarter,Sales decline 5.63% to Rs 3408.10 crore,positive,negative,-0.4611837048424245,neutral,0.0,neutral
2020-10-23 08:07:00.000,65.05,66.8,64.35,64.75,24862916.0,"Stocks in the news | Nestle India, TCS, Bharti Infratel, Hexaware Tech, Tech Mahindra, Welspun","Pricol, Crompton Greaves Consumer Electricals, Duroply Industries, Foseco India, HDFC Asset Management Company, Gokaldas Exports, Cadila Healthcare, Munjal Auto Industries, Alembic Pharma, L&T Finance Holdings, Music Broadcast, Vishal Fabrics, Coforge, 3i Infotech, Cochin Shipyard, JK Tyre &…",neutral,neutral,-0.4611837048424245,neutral,0.0,neutral
