date,open,high,low,close,volume,title,description,title_sentiment,desc_sentiment,daily_change_pct,market_sentiment,next_day_change_pct,next_day_sentiment
2020-10-23 09:33:00.000,65.05,66.8,64.35,64.75,24862916.0,L&T Finance Holdings reports 52% yoy rise in Q2 PAT to Rs265cr; stock up 2%,"With normalcy returning, NIMs+Fees have reached the desired range of 6.5%-7% despite carrying a negative carry of Rs64cr on additional liquidity.",positive,positive,-0.4611837048424245,neutral,0.0,neutral
2020-10-27 00:20:00.000,65.1,67.1,64.2,66.4,15097670.0,"L&T Finance Holdings set to slash defocused loans to Rs 1,000 crore","The company reduced its defocused book by 50 per cent year-on-year from Rs 10,365 crore in 2018-19 to Rs 5,230 crore in 2019-20.",neutral,negative,1.996927803379434,positive,-0.681302043906136,neutral
2020-11-04 05:30:00.000,65.25,65.45,64.0,64.8,8484531.0,BRIEF-L&T Finance Holdings Says To Consider Raising Funds - Investing.com India,"The Financial News section features stock market news in addition to stories about bonds, forex, commodities and economic releases.",neutral,neutral,-0.6896551724137975,neutral,1.2158054711246158,positive
2020-11-04 09:56:00.000,65.25,65.45,64.0,64.8,8484531.0,"Buy L&T Finance, target price Rs 71: Edelweiss","L&T Finance Holdings Ltd., incorporated in the year 2008, is a Large Cap company (having a market cap of Rs 13032.43 Crore) operating in NBFC sector.",neutral,neutral,-0.6896551724137975,neutral,1.2158054711246158,positive
2020-11-09 05:30:00.000,68.85,68.85,66.85,67.4,11367693.0,BRIEF-L&T Finance To Issue Shares For Up To 30 Bln Rupees Via Rights Issue - Investing.com India,"The Financial News section features stock market news in addition to stories about bonds, forex, commodities and economic releases.",neutral,neutral,-2.106027596223658,negative,2.647058823529408,positive
2020-11-09 10:32:00.000,68.85,68.85,66.85,67.4,11367693.0,"L&T Finance Holding to raise Rs3,000cr through Rights Issue",A board meeting was scheduled today to consider and approve a proposal for raising of funds.,positive,neutral,-2.106027596223658,negative,2.647058823529408,positive
2020-11-09 10:50:05.000,68.85,68.85,66.85,67.4,11367693.0,Board of L&T Finance Holdings approves rights issue of Rs 3000 cr,At meeting held on 09 November 2020,neutral,neutral,-2.106027596223658,negative,2.647058823529408,positive
2020-11-09 11:41:00.000,68.85,68.85,66.85,67.4,11367693.0,"L&T Finance gets board’s approval to raise Rs 3,000 crore via rights issue","L&T Finance Holdings said its board has approved raising of up to Rs 3,000 crore through a rights issue",positive,positive,-2.106027596223658,negative,2.647058823529408,positive
2020-11-09 11:50:17.000,68.85,68.85,66.85,67.4,11367693.0,"L&T Finance Holdings gets approval to raise ₹3,000 cr via rights issue","L&amp;T Finance Holdings on Monday said its board has approved raising of up to ₹3,000 crore through a rights issue.“The board approved the offer and issuance of fully paid-up equity shares of the",positive,positive,-2.106027596223658,negative,2.647058823529408,positive
2020-11-09 12:20:00.000,68.0,70.0,67.55,69.8,23677649.0,"L&T Finance Holdings gets board’s approval to raise Rs 3,000 crore via rights issue","The company said details of the rights issue, including price and entitlement ratio, will be determined in due course.",positive,neutral,2.647058823529408,positive,-1.924447612259456,negative
2020-11-09 13:39:00.000,68.0,70.0,67.55,69.8,23677649.0,"L&T Finance gets board’s nod to raise Rs 3,000 crore through rights issue","The company said details of the rights issue, including price and entitlement ratio, will be determined in due course",neutral,neutral,2.647058823529408,positive,-1.924447612259456,negative
2020-11-09 14:25:00.000,68.0,70.0,67.55,69.8,23677649.0,"L&T Finance Holdings gets board’s approval to raise Rs 3,000 cr via rights issue","The company said details of the rights issue, including price and entitlement ratio, will be determined in due course.",positive,neutral,2.647058823529408,positive,-1.924447612259456,negative
2020-11-09 23:26:20.000,68.0,70.0,67.55,69.8,23677649.0,"L&T Finance to raise Rs 3,000 crore via rights issue","NBFCs such as Mahindra Finance and Shriram Transport Finance have raised Rs 3,089 crore and Rs 1,500 crore through their respective rights issues.",positive,positive,2.647058823529408,positive,-1.924447612259456,negative
2020-11-09 23:59:00.000,68.0,70.0,67.55,69.8,23677649.0,"L&T Finance Holdings gets nod to raise up to Rs 3,000 cr via rights issue","The company said details of the rights issue, including price and entitlement ratio, will be determined in due course.",neutral,neutral,2.647058823529408,positive,-1.924447612259456,negative
2020-11-20 14:01:00.000,72.1,73.0,70.4,71.3,12816836.0,L&T Finance invokes shares of three Essel Group companies,"As per regulatory filings, L&T Finance invoked and appropriated against loan outstanding amount 1.24 crore shares constituting 2.65 per cent stake of Zee Media Corporation on November 18.",neutral,neutral,-1.1095700416088727,negative,0.1369863013698552,neutral
2020-11-26 05:30:00.000,74.7,78.8,73.9,78.55,34294642.0,BRIEF-L&T Finance Holdings Ltd - To Raise Funds Amounting To 6 Billion Rupees - Investing.com India,"The Financial News section features stock market news in addition to stories about bonds, forex, commodities and economic releases.",neutral,neutral,5.1539491298527365,positive,7.964601769911519,positive
2020-11-26 08:00:00.000,74.7,78.8,73.9,78.55,34294642.0,"Amid volatility, indices recover; Metal stocks outperform with SAIL at the helm","SAIL and L&T Finance Holdings were the top gainers on the index, both gaining by around 5% each.",positive,positive,5.1539491298527365,positive,7.964601769911519,positive
2020-12-07 15:47:39.000,92.45,93.4,89.65,91.2,25515751.0,"Exclusive | L&T Finance Shortlists 6 Bankers For Rs 3,000-crore Rights Issue, Launch Likely In January","If all goes to plan, L&T Finance will join NBFCs like M&M Finance and Shriram Transport Finance that have taken the rights issue route to raise Rs 3,089 crore and Rs 1,500 crore, respectively.",neutral,positive,-1.352082206598161,negative,-0.1624255549539702,neutral
2020-12-21 14:39:00.000,84.5,86.75,81.15,86.0,18541737.0,L&T Finance Holdings dissolves Middle East subsidiary,"On July 17, LTFH had informed about voluntary winding-up of one of its wholly-owned subsidiary incorporated in Dubai to carry on the off-shore wealth management business, subject to applicable laws of United Arab Emirates.",neutral,neutral,1.7751479289940828,positive,4.244186046511635,positive
2021-01-05 11:21:00.000,97.0,102.65,96.25,101.7,27154731.0,"Axis Bank, Tata Steel, NMDC among 65 stocks look set to rally, suggests MACD","Adani Ports & SEZ, Escorts, Rail Vikas Nigam, National Fertilizers, Voltas, RBL Bank, LIC Housing Finance, L&T Finance, NCC, Reliance Infra, Manappuram Finance and PVR are among some of the other stocks on the list.",positive,neutral,4.845360824742271,positive,0.146412884333813,neutral
2021-01-14 10:14:00.000,104.4,107.4,104.0,106.85,18313100.0,Board of L&T Finance Holdings to decide on terms of proposed rights issue,On 18 January 2021,neutral,neutral,2.346743295019146,positive,-1.7674418604651216,negative
2021-01-15 08:05:18.000,107.5,108.6,103.7,105.6,19283772.0,"Stocks To Watch: Bajaj Finance, Den Networks, HCL Tech, L&T Finance Holdings, PVR, SAIL",Here are the stocks to watch in trade today.,neutral,neutral,-1.7674418604651216,negative,-3.41796875,negative
2021-01-15 21:44:51.000,107.5,108.6,103.7,105.6,19283772.0,L&T Finance reports ₹291 crore net profit in Q3,"L&amp;T Finance Holdings reported 51 per cent drop in its consolidated net profit at ₹290.66 crore for the third quarter this fiscal from a year ago, but had the highest quarterly disbursement in",neutral,negative,-1.7674418604651216,negative,-3.41796875,negative
2021-01-18 05:30:00.000,102.4,103.65,98.0,98.9,33541369.0,BRIEF-L&T Finance Holdings To Make Rights Issue Of 461.3 Million Shares,BRIEF-L&T Finance Holdings To Make Rights Issue Of 461.3 Million Shares,neutral,neutral,-3.41796875,negative,6.268656716417907,positive
2021-01-18 07:26:25.000,102.4,103.65,98.0,98.9,33541369.0,"Stocks To Watch: HDFC Bank, L&T Finance, Metropolis, Shoppers Stop",Here are the stocks to watch out for in today’s session.,neutral,neutral,-3.41796875,negative,6.268656716417907,positive
2021-01-18 09:45:30.000,102.4,103.65,98.0,98.9,33541369.0,L&T Finance Holdings Share Price Falls 4% After Q3 Profit Declines 51% To Rs 287 Crore,"The non-banking financial company’s total income during the quarter under review declined to Rs 3,622.16 crore from Rs 3,735.79 crore in the year-ago quarter.",neutral,negative,-3.41796875,negative,6.268656716417907,positive
2021-01-18 10:11:43.000,102.4,103.65,98.0,98.9,33541369.0,L&T Finance’ Shares Fall After Q3 Results,L&T Finance posted its highest quarterly disbursements since Q1FY20.,neutral,positive,-3.41796875,negative,6.268656716417907,positive
2021-01-18 12:47:28.000,100.5,108.8,100.2,106.8,55267489.0,L&T Finance Holdings slumps 5.6% as Q3 profit disappoints,"L&amp;T Finance Holdings lost nearly 5 per cent till mid-session on Monday after reporting a 51-per cent drop in its consolidated net profit for the third quarter this fiscal.At 12:15 pm, the shar",negative,negative,6.268656716417907,positive,-3.5664659564613324,negative
2021-01-18 16:23:49.000,100.5,108.8,100.2,106.8,55267489.0,L&T Finance Holdings sheds nearly 5 per cent,"L&amp;T Finance Holdings lost nearly 5 per cent during the morning trade on Monday after reporting a 51 per cent drop in its consolidated net profit for the third quarter this fiscal.At 10:15 am,",neutral,negative,6.268656716417907,positive,-3.5664659564613324,negative
2021-01-18 17:41:00.000,100.5,108.8,100.2,106.8,55267489.0,L&T Finance Holdings share drops over 6% post Q3 earnings,"L&T Finance stock is trading higher than 20, 50, 100 and 200-day moving averages but lower than 5-day moving averages",negative,positive,6.268656716417907,positive,-3.5664659564613324,negative
2021-01-18 18:09:00.000,100.5,108.8,100.2,106.8,55267489.0,"Seasonal factors, rural growth aiding disbursements: Dinanath Dubhashi, L&T Finance","Rural and infra segments driving momentum for L&T Finance. Dinanath Dubhashi, MD & CEO, in conversation with ETNOW.",neutral,positive,6.268656716417907,positive,-3.5664659564613324,negative
2021-01-18 19:26:00.000,100.5,108.8,100.2,106.8,55267489.0,Board of L&T Finance Holdings approves rights issue price of Rs 65 per share,At meeting held on 18 January 2021,neutral,neutral,6.268656716417907,positive,-3.5664659564613324,negative
2021-01-18 20:17:48.000,100.5,108.8,100.2,106.8,55267489.0,"L&T Finance to raise ₹2,999 crore via rights issue","L&amp;T Finance Holding Ltd (LTFHL), on Monday, said it will raise ₹2,999 crore via a rights issue in the entitlement ratio of 17:74 at ₹65 per equity share.The rights issue will open on February",positive,positive,6.268656716417907,positive,-3.5664659564613324,negative
2021-01-18 21:59:00.000,100.5,108.8,100.2,106.8,55267489.0,"L&T Finance Rs 3,000 cr rights issue to open for subscription on Feb 1","According to a regulatory filing, the board has approved the price of Rs 65 per fully paid-up share including a premium of Rs 55 per share of face value Rs 10.",neutral,positive,6.268656716417907,positive,-3.5664659564613324,negative
2021-01-18 23:11:16.000,100.5,108.8,100.2,106.8,55267489.0,"L&T Finance To Open Rights Issue Of Rs 3,000 Crore For On February 1","The company has fixed record date of January 22, 2021 for the purpose of determining the equity shareholders entitled to receive the rights entitlement",neutral,neutral,6.268656716417907,positive,-3.5664659564613324,negative
2021-01-19 07:22:55.000,100.5,108.8,100.2,106.8,55267489.0,"Stocks To Watch: Apollo Hospitals, L&T Finance, Maruti Suzuki, Tata Steel",Here are the stocks to watch in trade today.,neutral,neutral,6.268656716417907,positive,-3.5664659564613324,negative
2021-01-19 07:32:00.000,100.5,108.8,100.2,106.8,55267489.0,"Top stocks in focus: Maruti Suzuki, L&T Finance, L&T Infotech, Tata Steel, Mindtree, Trident",Check out the stocks that will be in focus during trade today based on recent and latest news developments.,neutral,neutral,6.268656716417907,positive,-3.5664659564613324,negative
2021-01-19 08:33:00.000,100.5,108.8,100.2,106.8,55267489.0,"Maruti Suzuki, Mindtree, L&T Finance Holdings to be watched","Maruti Suzuki India said that the company is increasing the price for select models owing to increase in various input costs. The price change varies across models and ranges upto Rs 34,000 (ex-showroom - Delhi).",neutral,neutral,6.268656716417907,positive,-3.5664659564613324,negative
2021-01-19 09:00:30.000,100.5,108.8,100.2,106.8,55267489.0,"L&T Finance Standalone December 2020 Net Sales At Rs 17.10 Crore, Down 41.46% Y-o-Y",,neutral,neutral,6.268656716417907,positive,-3.5664659564613324,negative
2021-01-19 09:23:00.000,100.5,108.8,100.2,106.8,55267489.0,"Stocks in news: Mindtree, Indiabulls Real Estate, Maruti, YES Bank, RBL Bank, L&T Finance","Stocks to watch today on January 19: Mindtree, Indiabulls Real Estate, Maruti, YES Bank, RBL Bank, L&T Finance among others are the top stocks to watch out for in Tuesday’s trading session",neutral,neutral,6.268656716417907,positive,-3.5664659564613324,negative
2021-01-19 10:34:40.000,100.5,108.8,100.2,106.8,55267489.0,L&T Finance Share Price Rises 4% As Rights Issue To Open On Feb 1,The issue will open for subscription on February 1 and will close on February 15.,neutral,neutral,6.268656716417907,positive,-3.5664659564613324,negative
2021-01-19 11:05:00.000,100.5,108.8,100.2,106.8,55267489.0,L&T Finance Holdings’ rights issue to open on Feb 1; stock surges 7%,"The company has fixed January 22, 2021 as record date to determine the equity shareholders entitled to receive the rights entitlement in the rights issue.",positive,neutral,6.268656716417907,positive,-3.5664659564613324,negative
2021-01-19 12:13:00.000,107.95,108.1,102.0,104.1,39664065.0,"L&T Finance Holdings to open Rs3,000cr Rights Issue at Rs65 per equity share on February 01; Stock spurts 7%","The rights issue will open on February 01, 2021, and will be available till February 15, 2021.",neutral,neutral,-3.5664659564613324,negative,-0.8247422680412342,neutral
2021-01-19 14:26:00.000,107.95,108.1,102.0,104.1,39664065.0,"NBFC shares in focus; Bajaj twins, Cholamandalam Investment surge up to 9%","L&T Finance, Indiabulls Housing Finance, IIFL Finance, REC, Shriram Transport Finance, Power Finance Corporation, LIC Housing and HDFC were up between 3 per cent and 9 per cent on the BSE",positive,positive,-3.5664659564613324,negative,-0.8247422680412342,neutral
2021-01-19 14:48:00.000,107.95,108.1,102.0,104.1,39664065.0,"Buy L&T Finance Holdings, target price Rs 110: JM Financial",L&T Finance Holdings Ltd. key Products/Revenue Segments include Dividend which contributed Rs 386.37 Crore to Sales Value (81.26 % of Total Sales).,positive,neutral,-3.5664659564613324,negative,-0.8247422680412342,neutral
2021-01-19 18:34:00.000,107.95,108.1,102.0,104.1,39664065.0,"L&T Finance: Retail shift slowly playing out, credit cost remains a concern","While disbursements improved in Q3, asset quality trend remains an uncomfortable patch",negative,positive,-3.5664659564613324,negative,-0.8247422680412342,neutral
2021-01-20 15:04:24.000,97.0,100.4,95.0,96.2,37336879.0,Tata Communications Ltd leads losers in ‘A’ group,"Alembic Pharmaceuticals Ltd, L&T Finance Holdings Ltd, Indiabulls Real Estate Ltd and Somany Home Innovation Ltd are among the other losers in the BSE’s ‘A’ group today, 20 January 2021.",negative,negative,-0.8247422680412342,neutral,-4.552509053285054,negative
2021-01-22 07:25:00.000,96.65,97.9,91.4,92.25,28885244.0,"Stocks in the news: Reliance Industries, YES Bank, HDFC Life, JSW Steel & SBI Life","Apollo Hospitals, Gland Pharma, Crompton Greaves, L&T Finance, Oberoi Realty and Indian Bank are some of the companies which will announce their Q3 results today.",neutral,neutral,-4.552509053285054,negative,-2.81995661605207,negative
2021-02-01 05:30:00.000,86.95,92.5,84.5,92.45,22054457.0,L&T Finance Gains 7.5% Today After Falling 14% In Prior 8 Trading Days,L&T Finance Gains 7.5% Today After Falling 14% In Prior 8 Trading Days,neutral,neutral,6.325474410580793,positive,0.7502679528403031,neutral
2021-02-01 14:53:00.000,93.3,95.9,92.05,94.0,23993880.0,"L&T Finance Holdings Rs2,998.61cr Rights Issue opens today; stock trades flat","The company will issue up to 46,13,25,021 equity shares for cash, at a price of Rs65 per Equity Share (including a premium of Rs55 per equity share) on a rights basis. The Issue will close on February 15.",neutral,neutral,0.7502679528403031,neutral,-1.5957446808510638,negative
2021-02-02 17:26:00.000,94.0,94.95,92.25,92.5,14275376.0,"L&T Finance Holdings RE hits fresh record high on Day 2 of Rs3,000cr rights issue","The company has launched its Rs3,000cr rights issue from February 01, 2021, onward.",neutral,neutral,-1.5957446808510638,negative,0.9199134199134138,positive
2021-02-08 21:19:00.000,90.7,90.7,88.05,88.6,12346778.0,NSE-BSE bulk deals: Norges Bank buys 0.49% stake in L&T Finance Holdings,"In a separate deal, ECL Finance Ltd also bought 3.1 million shares of L&T Finance at Rs 23.62 per share through a bulk deal on the NSE.",neutral,neutral,-2.315325248070572,negative,2.3046655424395697,positive
2021-02-09 07:41:46.000,90.7,90.7,88.05,88.6,12346778.0,"Stocks In The News | Tata Steel, Wipro, Astrazeneca Pharma, Torrent Pharma, NMDC, Majesco, Sun TV Network","GE Power India, EID Parry India, Sical Logistics, Hinduja Global Solutions, Balkrishna Industries, Balaji Amines, Jagran Prakashan, Jindal Stainless (Hisar), Redington India, VST Tillers Tractors, Star Cement, NCL Industries, L&T Finance Holdings RE, NCC, are also among the stocks in focus today.",neutral,neutral,-2.315325248070572,negative,2.3046655424395697,positive
2021-02-16 05:30:00.000,98.8,101.0,97.35,98.55,22982503.0,BRIEF-L&T Finance Holdings Ltd - Rights Issue Was Oversubscribed By About 15%,BRIEF-L&T Finance Holdings Ltd - Rights Issue Was Oversubscribed By About 15%,neutral,neutral,-0.2530364372469635,neutral,-0.8616320324379204,neutral
2021-02-16 18:11:00.000,98.65,99.2,97.15,97.8,12061437.0,L&T Finance Holdings rights issue oversubscribed by 15%,"The allotment of equity shares offered pursuant to the Rights Issue will happen on or about Tuesday, 23 February 2021 and such equity shares shall be listed on the BSE Limited and National Stock Exchange of India Limited on or
about Friday, 26",neutral,neutral,-0.8616320324379204,neutral,3.44303797468355,positive
2021-02-16 19:27:00.000,98.65,99.2,97.15,97.8,12061437.0,"L&T Finance Holdings raises Rs 2,999 crore through rights issue","The allotment of equity shares offered pursuant to the rights issue will happen on Tuesday, February 23, 2021 and will be listed on the BSE and on NSE on February 26, 2021, said the company in a press release.",positive,neutral,-0.8616320324379204,neutral,3.44303797468355,positive
2021-02-16 19:51:46.000,98.65,99.2,97.15,97.8,12061437.0,"L&T Finance Holdings Raises Rs 2,998 Crore Through Rights Issue","The non-banking finance company is present in businesses, including rural finance, housing finance, infrastructure finance and investment management.",neutral,neutral,-0.8616320324379204,neutral,3.44303797468355,positive
2021-02-16 19:54:00.000,98.65,99.2,97.15,97.8,12061437.0,"L&T Finance Holdings raises Rs 2,998 cr through rights issue","L&T Finance Holdings Ltd (LTFH) on Tuesday said it has closed its rights issue and has raised over Rs 2,998 crore",positive,positive,-0.8616320324379204,neutral,3.44303797468355,positive
2021-02-16 21:27:03.000,98.65,99.2,97.15,97.8,12061437.0,"L&T Finance closes ₹2,998.61-cr rights issue","L&amp;T Finance Holdings Ltd (LTFHL), on Tuesday, said it has closed its ₹2,998.61-crore rights issue. The issue was oversubscribed by about 15 per cent.LTFHL is a Non-Banking Financial Company pr",neutral,neutral,-0.8616320324379204,neutral,3.44303797468355,positive
2021-02-17 06:56:00.000,98.65,99.2,97.15,97.8,12061437.0,"L&T Finance Holdings Rs2,998.61cr ‘Rights Issue’ oversubscribed by 15%; Stock at day’s low","The allotment of equity shares offered according to the Rights Issue will happen on or about Tuesday, February 23, 2021",negative,neutral,-0.8616320324379204,neutral,3.44303797468355,positive
2021-02-17 07:38:00.000,98.65,99.2,97.15,97.8,12061437.0,"Stocks In The News | Adani Ports, Nestle India, Heritage Foods, Infosys, Bajaj Electricals, Intec Capital","L&T Finance Holdings, TVS Srichakra, Mayur Uniquoters, Vertoz Advertising, Abans Enterprises, APL Apollo Tubes, East West Holdings, are also among the stocks in focus today.",neutral,neutral,-0.8616320324379204,neutral,3.44303797468355,positive
2021-02-17 08:04:00.000,98.65,99.2,97.15,97.8,12061437.0,"Stocks in the news: Adani Ports, Nestle India, L&T Finance, FRL, APL Apollo and IndusInd Bank",FMCG major Nestle India reported a 2.25 per cent rise in net profit to Rs 483.31 crore for the fourth quarter ended December.,neutral,positive,-0.8616320324379204,neutral,3.44303797468355,positive
2021-02-17 08:33:14.000,98.65,99.2,97.15,97.8,12061437.0,"Sensex, Nifty likely to open lower","Stocks likely to witness some action: APSEZ, Ashok Leyland, Heritage Foods, InterGlobe Aviation, Infosys, KEC International, L&T Finance Holdings, Muthoot Finance, Page Industries and, TVS Srichakra",neutral,neutral,-0.8616320324379204,neutral,3.44303797468355,positive
2021-02-17 08:39:00.000,98.65,99.2,97.15,97.8,12061437.0,"Stocks to watch: Nestle India, Adani Ports, L&T Finance, Heritage Foods","L&T Finance said it has closed its rights issue and raised over Rs 2,998 crore",neutral,positive,-0.8616320324379204,neutral,3.44303797468355,positive
2021-02-17 09:44:00.000,98.65,99.2,97.15,97.8,12061437.0,"Stocks in news: Future Retail, L&T Finance, ICICI Bank, Adani Ports, TVS Srichakra, Nestle","Stocks to watch today on February 17: Future Retail, L&T Finance, ICICI Bank, Adani Ports, TVS Srichakra, Nestle among others are the top stocks to watch out for in Wednesday’s trading session",neutral,neutral,-0.8616320324379204,neutral,3.44303797468355,positive
2021-02-17 13:00:00.000,98.75,102.65,98.0,102.15,21811845.0,"Top stocks in focus: IndusInd Bank, ICICI Bank, L&T Finance Holdings, Nestle India, Infosys",Check out the stocks that will be in focus during trade today based on recent and latest news developments.,neutral,neutral,3.44303797468355,positive,-1.6674840608141273,negative
2021-02-18 07:00:33.000,98.75,102.65,98.0,102.15,21811845.0,Hot Stocks: L&T Finance And DMart Are The Top 2 Buy Ideas For The Next 3-4 Weeks; Here’s Why,"The trend in Nifty is likely to remain sideways or we can expect some profit-booking till 14,900 levels. The higher-end break of 15,450 will open the gates for 15,650 levels in the coming trading sessions.",neutral,positive,3.44303797468355,positive,-1.6674840608141273,negative
2021-02-18 20:08:00.000,101.95,105.2,98.8,100.25,33566078.0,"L&T Finance’s rights issue concludes, oversubscribed by 15%","The allotment of the equity shares in rights issue will happen on Tuesday and the equity shares shall be listed on the stock exchanges on Friday, the company said.",positive,neutral,-1.6674840608141273,negative,-4.75,negative
2021-02-19 15:16:36.000,101.95,105.2,98.8,100.25,33566078.0,Buy L&T Finance Holding; Target Of Rs 118: Sharekhan,"Sharekhan is bullish on L&T Finance Holding has recommended buy rating on the stock with a target price of Rs 118 in its research report dated February 18, 2021.",neutral,positive,-1.6674840608141273,negative,-4.75,negative
2021-02-23 22:00:36.000,98.75,103.5,97.5,103.15,18568086.0,L&T Finance Holdings allots rights issue shares,"Following the finalisation of the basis of allotment for the issue, approved by BSE, the designated stock exchange, the committee of directors of L&amp;T Finance Holdings on Tuesday approved the a",neutral,neutral,4.455696202531652,positive,2.118440057775641,positive
2021-03-09 09:12:00.000,109.75,110.45,102.8,105.15,16954943.0,"Lenders cut exposure to lower rated developers, improve credit profile","As per a research made by Emkay, mortgage lender HDFC ltd has the lowest exposure to BB & below book at 3% followed by L&T Finance at 10% and PNB Housing at 16%.",positive,neutral,-4.191343963553526,negative,-0.6097560975609676,neutral
2021-03-09 23:11:00.000,106.6,106.95,104.8,105.95,8397210.0,"Nabard, REC, TMF Holdings, L&T Finance raise Rs 6,900 cr in stable market","REC raised just over Rs 3,600 crore through a 15-year paper carrying coupon of 7.4 per cent.",positive,positive,-0.6097560975609676,neutral,-1.8224299065420588,negative
2021-04-12 18:59:00.000,89.5,95.05,89.2,94.65,21744366.0,Board of L&T Finance Holdings approves change in Chief Risk Officer,At meeting held on 12 April 2021,neutral,neutral,5.754189944134085,positive,0.4294149221685361,neutral
2021-04-12 19:01:00.000,89.5,95.05,89.2,94.65,21744366.0,Board of L&T Finance Holdings approves scheme of amalgamation,On 12 April 2021,neutral,neutral,5.754189944134085,positive,0.4294149221685361,neutral
2021-04-13 16:45:00.000,89.5,95.05,89.2,94.65,21744366.0,L&T Finance Holdings gains over 4% after merger of subsidiaries comes into effect,The company has also approved the appointment of Ashish Malani as the Chief Risk Officer.,positive,neutral,5.754189944134085,positive,0.4294149221685361,neutral
2021-04-13 18:27:29.000,89.5,95.05,89.2,94.65,21744366.0,L&T Finance Holding Q4 PAT Seen Up 3.5% YoY To Rs 398 Cr: Sharekhan,"Net Sales are expected to increase by 19.6 percent Y-o-Y (up 7.1 percent Q-o-Q) to Rs 1,857 crore, according to Sharekhan.",neutral,positive,5.754189944134085,positive,0.4294149221685361,neutral
