date,open,high,low,close,volume,title,description,title_sentiment,desc_sentiment,daily_change_pct,market_sentiment,next_day_change_pct,next_day_sentiment
2021-04-29 05:30:00.000,92.7,93.45,89.2,89.85,18670312.0,BRIEF-L&T Finance Holdings March-Quarter Consol Net Profit Falls,BRIEF-L&T Finance Holdings March-Quarter Consol Net Profit Falls,neutral,neutral,-3.0744336569579382,negative,-1.0227272727272791,negative
2021-04-29 18:21:00.000,88.0,89.45,86.5,87.1,23837999.0,L&T Finance Holdings standalone net profit declines 82.68% in the March 2021 quarter,Sales decline 70.50% to Rs 118.13 crore,negative,negative,-1.0227272727272791,negative,0.3484320557491421,neutral
2021-04-29 19:43:01.000,88.0,89.45,86.5,87.1,23837999.0,Results: L&T Finance Holdings Q4 net profit dips 31% to Rs 266 cr,"L&T Finance Holdings (LTFH) on Thursday reported nearly 31 per cent dip in its net profit at Rs 266 crore for the quarter ended March 2021.The company had posted a net profit of Rs 385 crore in the corresponding quarter of 2019-20.However, its total income moved up by 4.7 per cent t…",positive,positive,-1.0227272727272791,negative,0.3484320557491421,neutral
2021-04-29 20:03:28.000,88.0,89.45,86.5,87.1,23837999.0,L&T Finance Q4 net profit falls 31% to Rs267 crore,"The NBFC’s total income during the quarter advanced to Rs3,587.18 crore from Rs3,427.22 crore in the year-ago quarter",negative,positive,-1.0227272727272791,negative,0.3484320557491421,neutral
2021-04-29 20:24:20.000,88.0,89.45,86.5,87.1,23837999.0,L&T Finance Holdings Q4 Net Profit Dips 31% To Rs 266 Crore,The company had posted a net profit of Rs 385 crore in the corresponding quarter of 2019-20.,neutral,positive,-1.0227272727272791,negative,0.3484320557491421,neutral
2021-04-29 22:05:00.000,88.0,89.45,86.5,87.1,23837999.0,L&T Finance Q4 results: Net profit falls 31% to Rs 267 cr,"CEO Dinanath Dubashi said operationally the company has the best quarter in more than a year led by higher collections, record disbursements in rural lending, increase in sell down from the risky infrastructure finance and record low NPAs.",negative,positive,-1.0227272727272791,negative,0.3484320557491421,neutral
2021-04-29 22:40:59.000,88.0,89.45,86.5,87.1,23837999.0,L&T Finance Holdings Q4 net profit down 31%,"For the full fiscal 2020-21, its consolidated net profit fell 42.9 per cent to ₹970.94 crore",negative,negative,-1.0227272727272791,negative,0.3484320557491421,neutral
2021-04-30 08:28:00.000,88.0,89.45,86.5,87.1,23837999.0,L&T Finance Holdings consolidated net profit declines 30.89% in the March 2021 quarter,Sales rise 1.79% to Rs 3415.16 crore,negative,positive,-1.0227272727272791,negative,0.3484320557491421,neutral
2021-04-30 08:33:38.000,88.0,89.45,86.5,87.1,23837999.0,"Stocks to Watch: Reliance, Titan, L&T Finance, IndusInd Bank, Dr Reddy’s","Reliance Industries and IndusInd Bank are the major companies that will report their March quarter earnings today. Ajanta Pharma, Atul, Indian Hotels, Marico, will also announce their results today",neutral,neutral,-1.0227272727272791,negative,0.3484320557491421,neutral
2021-04-30 09:14:00.000,88.0,89.45,86.5,87.1,23837999.0,L&T Finance Holdings says Q4 net profit down 30% on one-time expenses,"Quarter continued to see economic recovery across sectors led by rural and infrastructure space, company says.",negative,positive,-1.0227272727272791,negative,0.3484320557491421,neutral
2021-04-30 10:45:12.000,88.0,89.45,86.5,87.1,23837999.0,"Reliance Industries, Titan Company, L&T Finance: Top Stocks For Investors on April 30","After gaining for four straight sessions, Indian benchmark indices are trading lower in the pre-opening session amid mixed global cues on Friday, April 30.",neutral,neutral,-1.0227272727272791,negative,0.3484320557491421,neutral
2021-04-30 11:03:00.000,88.0,89.45,86.5,87.1,23837999.0,L&T Finance slips after Q4 PAT skids 31% YoY,"L&T Finance Holdings (LTFH) slipped 1.39% to Rs 88.65 after the company’s consolidated net profit dropped 30.9% to Rs 265.97 crore on 4.7% rise in total income to Rs 3,587.18 crore in Q4 FY21 over Q4 FY20.",neutral,negative,-1.0227272727272791,negative,0.3484320557491421,neutral
2021-04-30 13:53:06.000,88.0,89.45,86.5,87.1,23837999.0,"L&T Finance Consolidated March 2021 Net Sales At Rs 3,415.16 Crore, Up 1.79% Y-o-Y",,neutral,neutral,-1.0227272727272791,negative,0.3484320557491421,neutral
2021-04-30 15:18:00.000,88.0,89.45,86.5,87.1,23837999.0,"Hold L&T Finance Holdings, target price Rs 108: Emkay Research",Emkay Research has a hold call on L&T Finance Holdings with a target price of Rs 108 for a duration of 12 months. The current market price of L&T Finance Holdings is Rs 87.5.,neutral,positive,-1.0227272727272791,negative,0.3484320557491421,neutral
2021-05-20 15:11:28.000,91.0,91.9,90.5,91.1,10546676.0,"L&T Finance Consolidated March 2021 Net Sales At Rs 3,415.16 Crore, Up 1.79% Y-o-Y",,neutral,neutral,0.1098901098901036,neutral,-0.5488474204171241,neutral
2021-05-21 11:26:00.000,91.0,91.9,90.5,91.1,10546676.0,"Buy L&T Finance Holdings, target price Rs 101: ICICI Direct","L&T Finance Holdings Ltd., incorporated in the year 2008, is a Large Cap company (having a market cap of Rs 22274.40 Crore) operating in NBFC sector.",neutral,neutral,0.1098901098901036,neutral,-0.5488474204171241,neutral
2021-06-09 07:13:05.000,97.45,98.1,94.0,95.0,15241982.0,"Hot Stocks | Can Bet On TCS, L&T Finance Holdings, Ramco Cements For Short Term",Traders should expect stock-specific action in the upcoming sessions rather than any sharp upside in the benchmark index,neutral,positive,-2.514109799897386,negative,3.2291666666666607,positive
2021-06-10 18:18:00.000,99.5,99.9,96.6,97.75,12995829.0,L&T Finance subsidiary LTIDF gets converted into NBFC-ICC after merger; Stock climbs ~2%,"The company has earlier said that one of the subsidiaries of the company, may be required to undergo changes in the general character or nature of business.",positive,neutral,-1.7587939698492463,negative,-0.3595274781715401,neutral
2021-07-15 15:46:04.000,95.6,95.75,93.8,94.7,10182196.0,L&T Finance Holdings Q1 Net Profit Seen Up 142.6% YoY To Rs. 359.9 Cr: Emkay Research,"Net Interest Income (NII) is expected to increase by 20.5 percent Y-o-Y (down 6 percent Q-o-Q) to Rs. 1,697.1 crore, according to Emkay Research.",neutral,positive,-0.9414225941422506,negative,-2.6344086021505406,negative
2021-07-16 12:49:00.000,95.6,95.75,93.8,94.7,10182196.0,"Important results today: HDFC AMC, Den Networks, Just Dial, L&T Finance Holdings","Just Dial, L&T Finance Holdings, Maximaa Systems, Starlog Enterprises, and Visagar Polytex are set to release their quarterly earnings today.",neutral,neutral,-0.9414225941422506,negative,-2.6344086021505406,negative
2021-07-16 12:54:36.000,95.6,95.75,93.8,94.7,10182196.0,L&T Finance Holding Q1 Net Profit Seen Up 18% YoY To Rs. 175 Cr: Sharekhan,"Net Interest Income (NII) is expected to increase by 12 percent Y-o-Y (down 9 percent Q-o-Q) to Rs. 1,408 crore, according to Sharekhan.",neutral,positive,-0.9414225941422506,negative,-2.6344086021505406,negative
2021-07-16 20:32:00.000,95.6,95.75,93.8,94.7,10182196.0,L&T Finance Holdings consolidated Q1 net up 20% to Rs 178 cr,Margins & fees improve; NPAs up YoY and sequentially,positive,positive,-0.9414225941422506,negative,-2.6344086021505406,negative
2021-07-16 21:17:22.000,95.6,95.75,93.8,94.7,10182196.0,L&T Finance Holdings Q1 Profit Rises 20% To Rs 178 Crore,The company’s gross non-performing assets (NPAs) rose a tad to 5.75 percent during the quarter as against 5.24 percent in the year- ago period.,neutral,positive,-0.9414225941422506,negative,-2.6344086021505406,negative
2021-07-16 23:30:58.000,95.6,95.75,93.8,94.7,10182196.0,"L&T Finance Holdings Q1 profit rises 20% to Rs 178 cr, gross NPAs up slightly at 5.75% as on June end","L&T Finance Holdings on Friday reported 20 per cent rise in net profit at Rs 178 crore for quarter ended June, mainly driven by rural demand for farm equipment.The non-banking financial company had registered Rs 148 crore profit in the year-ago period.LTFH said COVID-related partial…",positive,positive,-0.9414225941422506,negative,-2.6344086021505406,negative
2021-07-19 08:55:00.000,93.0,94.0,89.9,90.55,25256564.0,L&T Finance Holdings consolidated net profit at Rs177.85cr; stock tumbles ~4.5%,"However, the other fund-based businesses like housing finance and infrastructure finance saw lower revenues yoy on the back of lower interest rates. COVID 2.0 also had an impact QoQ.",negative,negative,-2.6344086021505406,negative,-3.2578685808945367,negative
2021-07-19 10:44:50.000,93.0,94.0,89.9,90.55,25256564.0,"L&T Finance Standalone June 2021 Revenue From Operations At Rs 27.85 Crore, Up 40.94% Y-o-Y",,neutral,neutral,-2.6344086021505406,negative,-3.2578685808945367,negative
2021-07-19 10:44:55.000,93.0,94.0,89.9,90.55,25256564.0,"L&T Finance Consolidated June 2021 Revenue From Operations At Rs 3,140.12 Crore, Down 7.29% Y-o-Y",,neutral,neutral,-2.6344086021505406,negative,-3.2578685808945367,negative
2021-07-19 11:17:26.000,93.0,94.0,89.9,90.55,25256564.0,L&T Finance Shares Fall Despite 20% Rise In Q1 PAT; Global Brokerage Sees Strong Upside,"Global research firm Goldman Sachs has a buy on the stock with target at Rs 128 per share. “Marginal operating miss; disbursements bounced back in June. It sees diversification towards higher return generating retail business over long term. “Key risks are lack of clarity on strategic direction, ass…",neutral,positive,-2.6344086021505406,negative,-3.2578685808945367,negative
2021-07-19 12:48:07.000,90.55,91.05,87.5,87.6,15218196.0,L&T Finance’s Q1 show disappoints but signs of recovery may help,"Shares of the company are down more than 2% today, reflecting the disappointment from the performance",negative,negative,-3.2578685808945367,negative,-0.7882882882882916,neutral
2021-07-19 13:00:00.000,90.55,91.05,87.5,87.6,15218196.0,"Top stocks in focus: HDFC Bank, Reliance Industries, Just Dial, L&T Finance Holdings, HCL Tech",Check out the stocks that will be in focus during trade today based on recent and latest news developments.,neutral,neutral,-3.2578685808945367,negative,-0.7882882882882916,neutral
2021-07-19 14:22:00.000,90.55,91.05,87.5,87.6,15218196.0,"Built business, collection strength in Q1: Dinanath Dubhashi, L&T Finance",“Things have started improving towards the end of June and July they have improved even further. The strengths that we have built have manifested.”,positive,positive,-3.2578685808945367,negative,-0.7882882882882916,neutral
2021-07-19 22:13:47.000,90.55,91.05,87.5,87.6,15218196.0,"L&T Finance Q1 Review - Growth, Quality Both Prove A Drag: Prabhudas Lilladher","L&T Finance Q1 Review - Growth, Quality Both Prove A Drag: Prabhudas Lilladher",neutral,neutral,-3.2578685808945367,negative,-0.7882882882882916,neutral
2021-07-20 10:05:57.000,90.55,91.05,87.5,87.6,15218196.0,L&T Finance Q1 Review - Transient Impact Of Covid 2.0; Recovery Held Up Well In June: Motilal Oswal,L&T Finance Q1 Review - Transient Impact Of Covid 2.0; Recovery Held Up Well In June: Motilal Oswal,neutral,neutral,-3.2578685808945367,negative,-0.7882882882882916,neutral
2021-07-21 21:45:00.000,88.8,89.1,87.45,88.1,9225181.0,L&T Finance to make early redemption of non convertible preference shares,"With dividends being tax free in the hands of investors, the post tax return of 8 per cent was far superior to competing products like tax free bonds or fixed deposits.",neutral,positive,-0.7882882882882916,neutral,-0.507328072153329,neutral
2021-08-10 08:26:00.000,88.8,88.95,85.5,86.3,4796222.0,ICRA reaffirms credit rating of L&T Finance Holdings; Stock declines over 2%,The outlook on the company’s long-term rating has been revised to ‘Stable’ from ‘Negative’.,negative,neutral,-2.815315315315315,negative,-2.941176470588232,negative
2021-08-12 17:07:04.000,85.55,86.0,83.4,84.25,6840417.0,L&T Mutual Fund strengthens investment management team,"L&T Investment Management Ltd is a subsidiary of L&T Finance Holdings Ltd, and had over Rs75,531 crore quarterly average assets under management as of 30 June 2021",positive,neutral,-1.5195791934541172,negative,-0.8308605341246325,neutral
2021-08-30 13:00:01.000,84.0,84.65,82.35,83.15,6679952.0,L&T Finance Holdings Share Price Rises On MF Arm Stake Sale Buzz,"The sale of L&T Mutual Fund has been in the works for a while, people with direct knowledge of the development told Moneycontrol.",neutral,neutral,-1.0119047619047552,negative,0.7207207207207139,neutral
2021-08-30 13:15:00.000,84.0,84.65,82.35,83.15,6679952.0,L&T Finance Holdings in talks with HSBC to sell its MF arm: Report,"Last year, private equity giant Blackstone emerged as the frontrunner for a Rs 3,200- crore acquisition of L&T Mutual Fund, but the deal closure would hinge upon approval from the capital markets regulator, which generally frowns upon private equity ownership of mutual funds.",neutral,neutral,-1.0119047619047552,negative,0.7207207207207139,neutral
2021-08-30 13:51:17.000,84.0,84.65,82.35,83.15,6679952.0,L&T Finance Holdings in Advanced Talks with HSBC to Sell MF Arm: Sources,HSBC is in advanced and exclusive talks with L&T Finance Holdings to buy its mutual fund arm.,neutral,positive,-1.0119047619047552,negative,0.7207207207207139,neutral
2021-08-30 17:30:00.000,84.0,84.65,82.35,83.15,6679952.0,L&T Finance in talks with HSBC to sell its mutual fund business: Report,"L&T Finance wants to sell its mutual fund business to monetise non-core businesses. L&T’s mutual fund arm has over Rs 75,531 crore quarterly- average assets under management as of June 30, 2021",neutral,neutral,-1.0119047619047552,negative,0.7207207207207139,neutral
2021-08-31 09:39:00.000,84.0,84.65,82.35,83.15,6679952.0,HSBC in talks to buy L&T Mutual Fund,HSBC is in talks to buy the mutual fund arm of L&T Finance Holdings for Rs 2500 crore – Rs 3000 crore to grow its asset management business in India.,neutral,positive,-1.0119047619047552,negative,0.7207207207207139,neutral
2021-10-12 15:07:18.000,91.35,93.9,91.15,92.5,15456079.0,L&T Finance Holdings Q2 Net Profit May Dip 7.1% YoY To Rs. 230.1 Cr: Motilal Oswal,"Net Interest Income (NII) is expected to decrease by 1 percent Y-o-Y (down 8 percent Q-o-Q) to Rs. 1,379.2 crore, according to Motilal Oswal.",neutral,negative,1.2588943623426443,positive,1.2345679012345587,positive
2021-10-20 08:10:08.000,92.75,94.15,90.1,91.6,12802990.0,"Stocks to Watch: Reliance, Nestle India, ACC, L&T Tech, Deepak Fertilisers","Among major companies that will announce quarterly results today are Jubilant Foodworks Ltd, L&T Finance Holdings, Havells India, Reliance Industrial Infrastructure, Shoppers Stop, and Tata Communications",neutral,neutral,-1.2398921832884158,negative,-4.15730337078652,negative
2021-10-20 15:48:00.000,89.0,89.9,84.9,85.3,25357077.0,"Important results today: Jubilant FoodWorks, Havells India, L&T Finance Holdings in focus","Reliance Industrial Infrastructure, Rane (Madras), Shoppers Stop, Snowman Logistics, Supreme Petrochem are set to release quarterly.",neutral,neutral,-4.15730337078652,negative,-1.5652173913043417,negative
2021-10-20 19:55:00.000,89.0,89.9,84.9,85.3,25357077.0,L&T Finance Holdings’ net profit falls 10% to Rs 223 crore in Q2,L&T Finance Holdings (LTFH) on Wednesday reported a 10 per cent decline in its consolidated net profit to Rs 223 crore for the second quarter ended September 2021.,negative,negative,-4.15730337078652,negative,-1.5652173913043417,negative
2021-10-20 19:57:17.000,89.0,89.9,84.9,85.3,25357077.0,L&T Finance Holdings’ Net Profit Falls 10% To Rs 223 Crore In Q2,The non-banking financial company had posted a net profit of Rs 248 crore in the corresponding period of the previous financial year.,neutral,neutral,-4.15730337078652,negative,-1.5652173913043417,negative
2021-10-20 20:01:19.000,89.0,89.9,84.9,85.3,25357077.0,L&T Finance Holdings’ Q2 net profit down 15.5%,The firm’s net profit stood at ₹224.03 crore for the quarter,negative,neutral,-4.15730337078652,negative,-1.5652173913043417,negative
2021-10-20 21:04:00.000,89.0,89.9,84.9,85.3,25357077.0,L&T Finance Holdings Q2 consolidated net profit declines 15% to Rs 224 cr,"The company’s total lending loan book contracted by 12 per cent to Rs 86,936 cr in Sept 2021 from Rs 98,823 cr in year-ago period",negative,positive,-4.15730337078652,negative,-1.5652173913043417,negative
2021-10-21 07:59:00.000,89.0,89.9,84.9,85.3,25357077.0,L&T Finance Holdings consolidated net profit declines 15.50% in the September 2021 quarter,Sales decline 10.45% to Rs 3051.82 crore,negative,negative,-4.15730337078652,negative,-1.5652173913043417,negative
2021-10-21 08:58:20.000,89.0,89.9,84.9,85.3,25357077.0,"SGX Nifty up, Nifty support, Bank Nifty technicals, stocks under F&O ban; key things to watch out today","Stocks such as Amara Raja Batteries, Escorts, Vodafone Idea, IRCTC, L&T Finance Holdings, NALCO, Punjab National Bank, SAIL, Sun TV Network and Tata Power were under the F&O ban for 21 October 2021",neutral,neutral,-4.15730337078652,negative,-1.5652173913043417,negative
2021-10-21 08:59:49.000,89.0,89.9,84.9,85.3,25357077.0,"Stocks To Watch For Today: L&T Finance Holdings, Havells, Angel Broking, More","After a slight decline yesterday, the market on Thursday is expected to rebound at the opening bell as suggested by the SGX Nifty",neutral,positive,-4.15730337078652,negative,-1.5652173913043417,negative
2021-10-21 09:17:00.000,89.0,89.9,84.9,85.3,25357077.0,L&T Finance Services skids after Q2 FY22 PAT falls 10% to Rs 223 cr,"L&T Finance Services (LTFH) lost 2.57% to Rs 89.10 after the company’s consolidated net profit dropped 9.98% to Rs 222.99 crore on a 10.45% decline in total revenue from operations to Rs 3,051.82 crore in Q2 FY22 over Q2 FY21.",neutral,negative,-4.15730337078652,negative,-1.5652173913043417,negative
2021-10-21 10:26:22.000,89.0,89.9,84.9,85.3,25357077.0,"Global Brokerage Sees 42% Upside In L&T Finance Despite Dip In Q2 Profit, Here’s Why","Goldman Sachs has tweaked EPS estimates by an average of -1% over FY22-24. L&T Finance can generate 2.9% RoA/14.5% RoE by FY24, the research firm added.",neutral,neutral,-4.15730337078652,negative,-1.5652173913043417,negative
2021-10-21 11:14:00.000,89.0,89.9,84.9,85.3,25357077.0,L&T Finance Holdings consolidated net profit declines 15.50% in Q2,The Sales declined 10.45% to Rs3051.82cr in the quarter ended September 2021 as against Rs3408.10cr during the previous quarter ended September 2020.,negative,negative,-4.15730337078652,negative,-1.5652173913043417,negative
2021-10-21 11:41:00.000,89.0,89.9,84.9,85.3,25357077.0,L&T Finance Holdings sheds almost 5% after dip in Q2 profit,"On Wednesday, the companys top management said that profits had fallen in July-September (year-on-year) on account of a contraction in the loan book and a higher rate of taxation.",negative,negative,-4.15730337078652,negative,-1.5652173913043417,negative
2021-10-21 12:22:35.000,86.25,86.85,84.5,84.9,8804820.0,"L&T Finance Standalone September 2021 Net Sales At Rs 24.11 Crore, Up 48.19% Y-o-Y",,neutral,neutral,-1.5652173913043417,negative,-4.8594847775175705,negative
2021-10-21 12:52:00.000,86.25,86.85,84.5,84.9,8804820.0,"Top stocks in focus: Tata Communications, L&T Finance, Varroc Engineering, INEOS Styrolution",Check out the stocks that will be in focus during trade today based on recent and latest news developments.,neutral,neutral,-1.5652173913043417,negative,-4.8594847775175705,negative
2021-10-21 14:05:30.000,86.25,86.85,84.5,84.9,8804820.0,"Tata Power, L&T Finance Holdings, IRCTC Among 10 Stocks Under F&O Ban On The NSE","After the ban, traders are not allowed for any fresh positions in the F&O contracts of the particular stock that is under the F&O ban period.",neutral,neutral,-1.5652173913043417,negative,-4.8594847775175705,negative
2021-10-22 03:01:53.000,86.25,86.85,84.5,84.9,8804820.0,L&T Finance Holdings Q2 Review - Disappointment On Multiple Fronts: Prabhudas Lilladher,L&T Finance Holdings Q2 Review - Disappointment On Multiple Fronts: Prabhudas Lilladher,neutral,neutral,-1.5652173913043417,negative,-4.8594847775175705,negative
2021-10-25 09:22:14.000,85.4,85.5,81.05,81.25,13991831.0,"L&T Finance Consolidated September 2021 Net Sales At Rs 3,051.82 Crore, Down 10.45% Y-o-Y",,neutral,neutral,-4.8594847775175705,negative,2.975106253794782,positive
2021-11-01 10:32:00.000,82.05,83.7,81.85,83.4,6444496.0,L&T Finance Holdings has better times ahead: Reasons why it is stock pick of the week,"Despite challenges, LTFH was able to achieve highest ever farm and 2-wheeler loan disbursements in the second quarter. LTFH was also able to achieve 99% plus collection efficiency in the micro loan segment during September, making it a favourite of analysts.",positive,positive,1.6453382084095167,positive,2.5104602510460183,positive
2021-11-23 20:55:50.000,80.0,80.65,78.5,78.7,7501777.0,"Sebi fines 1 employee of L&T Finance, 2 Mindtree employees for disclosure lapses","In a seperate order, Sebi has levied monetary fine on two employees of Mindtree Ltd for failing to make requisite disclosures and thereby violating insider trading norms.",neutral,negative,-1.624999999999997,negative,0.3797468354430343,neutral
2021-11-24 00:09:00.000,80.0,80.65,78.5,78.7,7501777.0,Sebi levies Rs 25 lakh fine on individual for insider trading in L&T Finance Holdings scrip,"The unpublished price-sensitive information (UPSI) pertained to financial results for the period ended June 30, 2018.",negative,neutral,-1.624999999999997,negative,0.3797468354430343,neutral
2021-12-23 17:30:00.000,83.0,83.0,76.65,77.1,30831211.0,HSBC AMC acquires L&T Finance’s mutual fund business for $425 mn,"Both LTIM and HSBC AMC will work to ensure that there will be continuity of services to their investors and counterparties in the interim, the company said in a statement.",neutral,positive,-7.108433734939766,negative,1.3654096228868622,positive
2021-12-23 20:49:00.000,83.0,83.0,76.65,77.1,30831211.0,"HSBC AMC acquires L&T Finance’s mutual fund unit for Rs 3,200 cr","The divestment of mutual fund business is in line with the strategic objective of L&T Finance Holdings of unlocking value from its subsidiaries to strengthen its balance sheet, says the company",neutral,positive,-7.108433734939766,negative,1.3654096228868622,positive
2021-12-24 05:30:00.000,83.0,83.0,76.65,77.1,30831211.0,In Focus: Here’s Why L&T Finance Tumbled Almost 7% on Friday,In Focus: Here’s Why L&T Finance Tumbled Almost 7% on Friday,neutral,neutral,-7.108433734939766,negative,1.3654096228868622,positive
2021-12-24 07:40:03.000,83.0,83.0,76.65,77.1,30831211.0,"Stocks To Watch: L&T Finance, United Breweries, Data Patterns Listing, Dr Reddy’s, TCS",Here are the stocks to watch in trade today...,neutral,neutral,-7.108433734939766,negative,1.3654096228868622,positive
2021-12-24 08:01:00.000,83.0,83.0,76.65,77.1,30831211.0,"Stocks in the news: Data Patterns, TCS, L&T Finance, IOC and Havells",Data Patterns will make its debut on the bourses today. It raised Rs 588.22 crore between December 14-16 by selling its shares in the range of Rs 555-585 apiece.,neutral,positive,-7.108433734939766,negative,1.3654096228868622,positive
2021-12-24 08:50:52.000,83.0,83.0,76.65,77.1,30831211.0,"L&T Finance - Divestment Of Asset Management Business Will Further
Strengthen The Balance Sheet: Motilal Oswal",L&T Finance - Divestment Of Asset Management Business Will Further Strengthen The Balance Sheet: Motilal Oswal,neutral,neutral,-7.108433734939766,negative,1.3654096228868622,positive
2021-12-24 09:07:00.000,83.0,83.0,76.65,77.1,30831211.0,HSBC to acquire L&T Finance’s mutual fund biz for $425M; Stock ends 7% down,"HSBC intends to merge the operations of LTIM with that of its existing asset management business in India, which had an AUM of Rs117bn (US$1.6bn) as of September 2021.",neutral,neutral,-7.108433734939766,negative,1.3654096228868622,positive
2021-12-24 09:38:00.000,83.0,83.0,76.65,77.1,30831211.0,L&T Finance sheds 4% on sale of mutual fund business to HSBC,"“The divestment of mutual fund business is in line with the strategic objective of L&T Finance Holdings of unlocking value from its subsidiaries to strengthen its balance sheet,” the domestic company said in a release to bourses on Thursday.",neutral,positive,-7.108433734939766,negative,1.3654096228868622,positive
2021-12-24 09:41:00.000,83.0,83.0,76.65,77.1,30831211.0,L&T Finance Holdings declines on divestment of mutual fund biz.,"L&T Finance Holdings dropped 4.24% to Rs 79.10 after the board considered the sale of 100% stake of L&T Investment Management, a wholly owned subsidiary and asset manager of L&T Mutual Fund, to HSBC Asset Management (India).",negative,negative,-7.108433734939766,negative,1.3654096228868622,positive
2021-12-24 10:40:00.000,83.0,83.0,76.65,77.1,30831211.0,L&T Finance Holdings dips 7% on divestment of Asset Management business,"The divestment of Mutual Fund business is in line with the strategic objective of L&T Finance Holdings to unlock value from its subsidiaries and strengthen its balance sheet, the company said.",neutral,positive,-7.108433734939766,negative,1.3654096228868622,positive
2021-12-24 11:16:00.000,83.0,83.0,76.65,77.1,30831211.0,Board of L&T Finance Holdings approves sale of mutual fund biz in HSBC AMC,At meeting held on 23 December 2021,neutral,neutral,-7.108433734939766,negative,1.3654096228868622,positive
2021-12-24 11:18:11.000,83.0,83.0,76.65,77.1,30831211.0,L&T Finance Holdings Slumps After Selling Mutual Fund Business To HSBC Asset Management,Shares of L&T Finance Holdings slumped as much as 7 per cent to hit an intraday low of Rs 76.85 after it sold its entire stake in its wholly owned subsidiary L&T Investment Management.,neutral,negative,-7.108433734939766,negative,1.3654096228868622,positive
