date,open,high,low,close,volume,title,description,title_sentiment,desc_sentiment,daily_change_pct,market_sentiment,next_day_change_pct,next_day_sentiment
2021-02-23 21:28:26.000,556.0,559.6,543.5,546.3,1909138.0,United Spirits initiates review of popular brands,"Move will ensure long-term profitability by premiumising the portfolio, says CEO",neutral,positive,-1.7446043165467706,negative,-1.0272727272727231,negative
2021-02-23 23:26:30.000,556.0,559.6,543.5,546.3,1909138.0,USL to go for strategic review of its select popular brands,Diageo-controlled United Spirits Ltd (USL) on Tuesday said it is initiating a strategic review of select popular brands as part of its strategy to continue “long-term profitable growth” through premiumising its portfolio.,neutral,neutral,-1.7446043165467706,negative,-1.0272727272727231,negative
2021-02-23 23:33:20.000,556.0,559.6,543.5,546.3,1909138.0,United Spirits kicks off strategic review of popular brands,The company is chasing profits by premiumizing its portfolio while sharpening its focus on core popular spirits,neutral,positive,-1.7446043165467706,negative,-1.0272727272727231,negative
2021-02-24 05:30:00.000,556.0,559.6,543.5,546.3,1909138.0,Should You Look at United Spirits After Company Initiates Strategic Review,Should You Look at United Spirits After Company Initiates Strategic Review,neutral,neutral,-1.7446043165467706,negative,-1.0272727272727231,negative
2021-02-24 07:38:59.000,556.0,559.6,543.5,546.3,1909138.0,"Stocks To Watch: Aurobindo Pharma, GAIL, NTPC, Tata Consumer, United Spirits",Here are the stocks to watch in trade today...,neutral,neutral,-1.7446043165467706,negative,-1.0272727272727231,negative
2021-02-24 07:39:05.000,556.0,559.6,543.5,546.3,1909138.0,"Stocks In The News | Tata Consumer Products, Pfizer, UPL, Coal India, SBI Cards","Sanofi India, NTPC, Tata Power, SPARC, United Spirits, Mazagon Dock, are also among the stocks in focus today.",neutral,neutral,-1.7446043165467706,negative,-1.0272727272727231,negative
2021-02-24 07:50:00.000,556.0,559.6,543.5,546.3,1909138.0,United Spirits will review mass brands,"United Spirits (USL) on Tuesday said it is set to start a strategic review of several of its mass-priced brands, excluding McDowells and Directors Special trademarks.",neutral,neutral,-1.7446043165467706,negative,-1.0272727272727231,negative
2021-02-24 08:06:55.000,556.0,559.6,543.5,546.3,1909138.0,"Stocks to Watch: Tata Consumer, UPL, SBI, NTPC, United Spirits, Coal India","India’s GDP may turn positive at 1.3% in the third quarter of 2020-21, having witnessed contraction in the previous two quarters due to the coronavirus pandemic, as the number of cases is falling and public spending has started rising, according to a report by DBS Group",neutral,positive,-1.7446043165467706,negative,-1.0272727272727231,negative
2021-02-24 10:11:00.000,556.0,559.6,543.5,546.3,1909138.0,United Spirits to initiate strategic review of selected Popular brands,The company’s strategic review is expected to be completed by the end of the 2021 calendar year.,neutral,neutral,-1.7446043165467706,negative,-1.0272727272727231,negative
2021-03-01 08:16:45.000,537.9,547.5,532.2,547.0,1630477.0,"Buzzing Stocks | Bharti Airtel, RIL, Railtel, Bank Of Maharashtra, Equitas Holdings, Tata Chemicals, Hindustan Aeronautics","Bharti Airtel, Esab India, Railtel Corporation of India, Indian Oil Corporation, Vedanta, United Spirits, Minda Industries, Acrysil, Mallcom (India), SSPN Finance, Kilitch Drugs (India), BEML, are also among the stocks in focus today.",neutral,neutral,1.6917642684513894,positive,0.2818181818181735,neutral
2021-03-01 09:35:00.000,537.9,547.5,532.2,547.0,1630477.0,"Stocks in news: RIL, DLF, United Spirits, Indian Oil, Axis Bank, Affle","Stocks to watch today on March 1: RIL, DLF, United Spirits, Indian Oil, Axis Bank, Affle among others are the top stocks to watch out for in Monday’s trading session",neutral,neutral,1.6917642684513894,positive,0.2818181818181735,neutral
2021-03-01 18:06:00.000,550.0,556.25,544.0,551.55,3073214.0,ICRA withdraws AA+ rating on Rs750cr NCDs of United Spirits,"The credit rating agency reaffirmed Long term/Short term Fund Based/Non-fund Based of Rs3,425cr at ICRA AA+ (Stable) /[ICRA]A1+. The rating on commercial paper Rs500cr at ICRA A1+.",neutral,positive,0.2818181818181735,neutral,1.8110095033171791,positive
2021-03-15 14:48:00.000,534.0,539.8,528.8,538.5,2275243.0,Stock market update: FMCG stocks fall; United Spirits slips over 2%,The Nifty FMCG index was trading 0.33 per cent down at 32957.8.,negative,negative,0.8426966292134831,neutral,-0.2416806097787608,neutral
2021-03-19 12:54:00.000,524.95,539.75,517.65,536.0,2393642.0,Goldman Sachs upgrades United Spirits to ‘buy’,​The foreign investment bank said United Spirits can stem the market share loss to Pernod in the core India made foreign liquor (IMFL) category with the strategic review of the low end brands.,positive,negative,2.1049623773692643,positive,0.6125858548357072,neutral
2021-03-22 08:52:09.000,538.7,543.6,534.3,542.0,3418573.0,United Spirits - Outlook Improving; Prestige And Above Focus Continues To Yield Benefits: Motilal Oswal,United Spirits - Outlook Improving; Prestige And Above Focus Continues To Yield Benefits: Motilal Oswal,neutral,neutral,0.6125858548357072,neutral,1.4533820840950724,positive
2021-03-23 07:35:00.000,547.0,557.95,542.25,554.95,2735035.0,"Nifty FMCG index trades flat; ITC, Emami weigh down; Tata Consumer, United Spirits shines",United Breweries and Jubilant Foodworks also gained 1.51% and 1.36% respectively. Nestle India was also 0.61%,negative,positive,1.4533820840950724,positive,0.2727272727272727,neutral
2021-03-23 13:31:20.000,550.0,561.9,549.15,551.5,2730191.0,United Spirits Ltd rises for third consecutive session,"United Spirits Ltd is quoting at Rs 550.2, up 1.37% on the day as on 12:49 IST on the NSE. The stock is up 21.81% in last one year as compared to a 89.48% spurt in NIFTY and a 44.61% spurt in the Nifty FMCG index.",positive,positive,0.2727272727272727,neutral,-0.6620714674405909,neutral
2021-03-24 05:30:00.000,550.0,561.9,549.15,551.5,2730191.0,Is it Time to Buy United Spirits After Goldman Sachs Buy Call?,Is it Time to Buy United Spirits After Goldman Sachs Buy Call?,neutral,neutral,0.2727272727272727,neutral,-0.6620714674405909,neutral
2021-04-05 11:05:44.000,554.0,554.0,532.35,540.0,1828050.0,United Spirits Q4 PAT Seen Up 638.9% YoY To Rs. 176.6 Cr: ICICI Direct,"Net Sales are expected to decrease by 0.1 percent Y-o-Y (down 20 percent Q-o-Q) to Rs. 1,991.2 crore, according to ICICI Direct.",neutral,negative,-2.527075812274368,negative,-0.1845018450184501,neutral
2021-04-08 18:20:00.000,553.5,553.5,535.8,536.8,1226010.0,"Nifty FMCG advances for third straight session; Colgate Palmolive, Britannia lift the performance",Emami was also bullish. Marico and United Spirits gained 1.6% respectively while Procter & Gamble Hygiene was also over 1% higher.,positive,positive,-3.017163504968391,negative,-2.840481565086536,negative
2021-04-12 00:05:00.000,531.6,532.4,508.1,516.5,2197085.0,Diageo may let go of some USL brands,"The maker of Johnnie Walker whiskey, Smirnoff vodka and Captain Morgan rum has roped in investment bank Morgan Stanley to help streamline its sprawling empire of brands, many of which it inherited via the acquisition of United Spirits (USL) from Vijay Mallya.",neutral,neutral,-2.840481565086536,negative,0.8845303336217716,neutral
2021-04-12 18:25:00.000,520.05,526.0,515.0,524.65,1133868.0,"Nifty FMCG halt gaining spree, index dips 700 points; United Spirits, Jubilant FoodWorks and Godrej Consumer major losers",Emami was 3.25% lower while Tata Consumer and ITC were around 3.1% on the downside to underperform.,neutral,negative,0.8845303336217716,neutral,-1.3232514177693762,negative
2021-04-13 20:17:38.000,520.05,526.0,515.0,524.65,1133868.0,United Spirits Q4 PAT Seen Up 638.9% YoY To Rs. 176.6 Cr: ICICI Direct,"Net Sales are expected to decrease by 0.1 percent Y-o-Y (down 20 percent Q-o-Q) to Rs. 1,991.2 crore, according to ICICI Direct.",neutral,negative,0.8845303336217716,neutral,-1.3232514177693762,negative
2021-04-28 06:44:00.000,526.0,537.6,521.0,536.5,1840234.0,"Nifty FMCG advances 225 points amid Q4 earnings; United Breweries, HUL lift performance",United Spirits was also bullish; Emami and Britannia dragged the most.,positive,positive,1.9961977186311788,positive,-2.6574074074074114,negative
2021-05-05 13:16:59.000,545.45,551.8,537.85,543.95,1605879.0,United Spirits Ltd stays supported,"United Spirits Ltd is quoting at Rs 533.7, up 1.44% on the day as on 12:49 IST on the NSE. The stock is up 8.07% in last one year as compared to a 57.1% jump in NIFTY and a 26.71% jump in the Nifty FMCG index.",neutral,positive,-0.275002291685764,neutral,0.4212454212454129,neutral
2021-05-05 18:10:00.000,545.45,551.8,537.85,543.95,1605879.0,"Nifty FMCG under pressure; HUL, Marico weigh down; Procter & Gamble Hygiene sinks 3% after Q4",Heavyweight HUL was also under pressure while United Spirits surged 1.5% to lead gains.,negative,positive,-0.275002291685764,neutral,0.4212454212454129,neutral
2021-05-07 13:05:13.000,546.0,551.45,542.0,548.3,1368611.0,United Spirits Ltd up for fifth session,"United Spirits Ltd is quoting at Rs 546.9, up 0.63% on the day as on 12:44 IST on the NSE. The stock is up 9.09% in last one year as compared to a 60.04% spurt in NIFTY and a 27.66% spurt in the Nifty FMCG.",positive,positive,0.4212454212454129,neutral,0.7285974499089253,neutral
2021-05-07 15:30:00.000,546.0,551.45,542.0,548.3,1368611.0,United Spirits liquidates Panama based wholly owned subsidiary Montrose,"Since Montrose was a non-operative company, its liquidation will not have any impact on the company’s business, the company said.",neutral,neutral,0.4212454212454129,neutral,0.7285974499089253,neutral
2021-05-10 08:09:00.000,549.0,555.0,544.05,553.0,1041708.0,"Vaishali Parekh recommends buying Hero MotoCorp, United Spirits. Check why","The RSI has indicated a trend reversal for Hero MotoCorp, showing strength, and has signaled a ‘buy’ to suggest further upward movement in the coming days",neutral,positive,0.7285974499089253,neutral,1.367365542388332,positive
2021-05-20 18:25:00.000,576.0,577.3,570.25,571.95,1077110.0,Nifty FMCG Index sheds over 150 points; Britannia sinks 3% to lead the losses,Nestle India and Tata Consumer also struggled. United Spirits led the gains while Colgate Palmolive continued to make progress on quarterly earnings.,neutral,positive,-0.7031249999999921,neutral,-2.6032392097006736,negative
2021-05-21 07:58:00.000,576.0,577.3,570.25,571.95,1077110.0,"Market Ahead Podcast, May 21: Top factors that could guide markets today","SBI, Hindalco, Shree Cement, JSW Steel, Aarti Surfactants, Crompton Greaves Consumer Electricals and United Spirits are among 49 companies scheduled to post quarterly numbers today",neutral,neutral,-0.7031249999999921,neutral,-2.6032392097006736,negative
2021-05-21 08:21:00.000,576.0,577.3,570.25,571.95,1077110.0,"Stocks in the news: SBI, RIL, NBCC, Apollo Tyres, IEX, Mindtree, Hindalco and Shree Cements","United Spirits, Dr Lal Pathlabs, Godrej Industries, Ircon International and Birlasoft are among companies which will announce their March quarter results today.",neutral,neutral,-0.7031249999999921,neutral,-2.6032392097006736,negative
2021-05-21 08:36:00.000,576.0,577.3,570.25,571.95,1077110.0,SGX Nifty up 130 points; here’s what changed for market while you were sleeping,"SBI, JSW Steel, Shree Cements, Hindalco Industries, United Spirits, Container Corporation of India, Crompton Greaves Consumer, Dr Lal Pathlabs, Godrej Industries, Ircon International and Birlasoft are among companies which will announce their March quarter results today.",neutral,neutral,-0.7031249999999921,neutral,-2.6032392097006736,negative
2021-05-21 18:17:00.000,576.0,577.3,570.25,571.95,1077110.0,United Spirits consolidated net profit rises 257.36% in the March 2021 quarter,Sales rise 12.05% to Rs 2230.40 crore,positive,positive,-0.7031249999999921,neutral,-2.6032392097006736,negative
2021-05-21 19:40:00.000,576.0,577.3,570.25,571.95,1077110.0,United Spirits Q4 profit up four-fold to Rs 203 cr; net sales up 20%,"United Spirits Ltd on Friday reported a four-fold jump in consolidated net profit to Rs 203.3 crore for the fourth quarter ended March 2021, helped by double-digit growth in sales",positive,positive,-0.7031249999999921,neutral,-2.6032392097006736,negative
2021-05-21 19:48:25.000,576.0,577.3,570.25,571.95,1077110.0,United Spirits Q4 net soars to ₹167 cr,"Total income rises to ₹7,678 crore",neutral,positive,-0.7031249999999921,neutral,-2.6032392097006736,negative
2021-05-21 21:05:00.000,576.0,577.3,570.25,571.95,1077110.0,United Spirits Q4 results: Net profit jumps six-fold to Rs 167 crore,"Net sales rose 11.6% from a year earlier to Rs 2,224 crore, driven by continued momentum in demand at retail outlets, partly offset by contraction of its owned business in Andhra Pradesh and softer footfall in the on-trade channel such as bars and restaurants.",positive,positive,-0.7031249999999921,neutral,-2.6032392097006736,negative
2021-05-21 21:44:23.000,576.0,577.3,570.25,571.95,1077110.0,United Spirits Q4 Profit Up Four-fold To Rs 203 Crore; Net Sales Jumps 20%,"For the fiscal year 2020-21, United Spirits’ net profit was down 41.7 percent to Rs 362.1 crore from Rs 620.6 crore in the previous year.",neutral,negative,-0.7031249999999921,neutral,-2.6032392097006736,negative
2021-05-24 08:23:16.000,589.65,599.9,571.2,574.3,9268961.0,"Buzzing Stocks: Shree Cement, JSW Steel, United Spirits And Others That Will Be In Focus Today",Check out the companies making the biggest headlines before the bell.,neutral,neutral,-2.6032392097006736,negative,1.388050694025339,positive
2021-05-24 08:24:00.000,589.65,599.9,571.2,574.3,9268961.0,"Stocks to watch: Tata Steel, Hero MotoCorp, Concor, United Spirits, Grasim","Grasim Industries, India Cements, JK Paper, Mahanagar Gas and Barbeque-Nation Hospitality are among 33 companies slated to post their quarterly numbers today",neutral,neutral,-2.6032392097006736,negative,1.388050694025339,positive
2021-05-24 10:15:00.000,589.65,599.9,571.2,574.3,9268961.0,United Spirits Q4 PAT at Rs167cr; EBITDA up 51.8%,"It reported EBITDA margin was 18.5%, up 491bps, driven by gross margin enhancement; lower advertising and promotional spends during the quarter and on-going cost optimisation measures.",positive,positive,-2.6032392097006736,negative,1.388050694025339,positive
2021-05-24 13:00:00.000,579.95,594.2,574.15,588.0,4697020.0,"Top stocks in focus: JSW Steel, Shree Cement, United Spirits, Hero MotoCorp, Grasim",Check out the stocks that will be in focus during trade today based on recent and latest news developments.,neutral,neutral,1.388050694025339,positive,-0.0337866373849219,neutral
2021-05-25 01:59:18.000,579.95,594.2,574.15,588.0,4697020.0,"After decent Q4, United Spirits awaits demand engine to fire fully","United Spirits should easily turn into a net cash position in FY22, said analysts",positive,neutral,1.388050694025339,positive,-0.0337866373849219,neutral
2021-05-25 08:02:00.000,579.95,594.2,574.15,588.0,4697020.0,"Curbs have hurt, but liquor business will recover fast: United Spirits Ltd","United Spirits Ltd (USL), the countrys largest liquor company, said the alco-bev segment could recover faster than other discretionary segments, even as the industry faces both demand and supply challenges due to restrictions.",negative,positive,1.388050694025339,positive,-0.0337866373849219,neutral
2021-05-25 13:32:24.000,591.95,596.95,588.3,591.75,2187555.0,"United Spirits Ltd spurts 2.05%, gains for third straight session","United Spirits Ltd is quoting at Rs 584.95, up 2.05% on the day as on 12:49 IST on the NSE. The stock is up 0.33% in last one year as compared to a 68.86% spurt in NIFTY and a 24.14% spurt in the Nifty FMCG index.",positive,positive,-0.0337866373849219,neutral,1.9483805668016312,positive
2021-05-25 14:17:18.000,591.95,596.95,588.3,591.75,2187555.0,United Spirits Ltd jumps around 2%,"United Spirits Ltd is quoting at Rs 584.95, up 2.05% on the day as on 12:49 IST on the NSE. The stock is up 0.33% in last one year as compared to a 68.86% spurt in NIFTY and a 24.14% spurt in the Nifty FMCG index.",positive,positive,-0.0337866373849219,neutral,1.9483805668016312,positive
2021-05-25 15:04:10.000,591.95,596.95,588.3,591.75,2187555.0,United Spirits Q4 Review - Strong Operational Performance Amid Tough Scenario: ICICI Direct,United Spirits Q4 Review - Strong Operational Performance Amid Tough Scenario: ICICI Direct,neutral,neutral,-0.0337866373849219,neutral,1.9483805668016312,positive
2021-05-25 15:13:00.000,591.95,596.95,588.3,591.75,2187555.0,"Results Review for United Spirits, Crompton Consumer, and the Ramco Cements","Results Review for United Spirits, Crompton Consumer, and the Ramco Cements",neutral,neutral,-0.0337866373849219,neutral,1.9483805668016312,positive
2021-05-25 16:23:00.000,591.95,596.95,588.3,591.75,2187555.0,"Buy United Spirits, target price Rs 685: Motilal Oswal",Motilal Oswal has a buy call on United Spirits Ltd with a target price of Rs 685. The current market price of United Spirits is Rs 588.2.,neutral,positive,-0.0337866373849219,neutral,1.9483805668016312,positive
2021-05-25 23:15:36.000,591.95,596.95,588.3,591.75,2187555.0,United Spirits: Maintain ‘add’ with revised TP of Rs 650,Volume growth of 8% (2-year CAGR still down 3%) was on the back of resilience in off-trade with on-trade continuing to see weakness.,neutral,positive,-0.0337866373849219,neutral,1.9483805668016312,positive
2021-05-26 05:30:00.000,591.95,596.95,588.3,591.75,2187555.0,Analysts Raise United Spirits Target After Q4 Results,Analysts Raise United Spirits Target After Q4 Results,neutral,neutral,-0.0337866373849219,neutral,1.9483805668016312,positive
2021-05-27 07:40:00.000,592.8,605.75,591.05,604.35,3918309.0,"Nifty FMCG in subdued trade; Heavyweights Jubilant Foodworks, HUL weigh; Marico, United Spirits lead","Tata Consumer, Varun Beverages, and ITC also gained between 0.6% - 0.4%",neutral,positive,1.9483805668016312,positive,0.6177924217462932,neutral
2021-05-27 12:45:00.000,607.0,613.45,596.85,610.75,2490730.0,Near-term headwinds could reverse United Spirits growth trajectory,"Margin expansion, debt reduction and higher premium segment sales may offer some support to the stock",positive,positive,0.6177924217462932,neutral,1.069078947368421,positive
2021-05-27 13:05:19.000,607.0,613.45,596.85,610.75,2490730.0,"United Spirits Ltd soars 1.62%, rises for fifth straight session","United Spirits Ltd is quoting at Rs 600.4, up 1.62% on the day as on 12:49 IST on the NSE. The stock is up 6.53% in last one year as compared to a 61.58% spurt in NIFTY and a 22.33% spurt in the Nifty FMCG.",positive,positive,0.6177924217462932,neutral,1.069078947368421,positive
2021-06-03 10:17:00.000,617.0,617.8,609.75,614.0,1352057.0,"SBI-led banks can now sell Vijay Mallya’s properties, shares worth Rs 5,646 cr","The combined value of assets comprising various floors of the UB City commercial tower in Bengaluru’s central business district and stocks in United Spirits and United Breweries that Mallya had controlled are assessed to be worth Rs 5,646.54 crore",neutral,neutral,-0.4862236628849271,neutral,2.034035656401937,positive
2021-06-03 13:01:00.000,617.0,644.8,611.3,629.55,6475379.0,"Banks can now sell Mallya’s Rs 5,646 cr properties, securities","The assets including several floors of the UB City commercial tower in Bengalurus central business district and shares in United Breweries and United Spirits that Mallya had controlled are estimated to be valued at ₹5,646.54 crore.",neutral,neutral,2.034035656401937,positive,-0.346456692913393,neutral
2021-06-04 08:56:00.000,617.0,644.8,611.3,629.55,6475379.0,"Hotel stocks, Liquor rally on RBI’s liquidity support; Lemon Tree, United Spirits shine","Following the announcements, Indian Hotels, Royal Orchid Hotels, Taj GVK Hotels & Resorts, EIH and Lemon Tree Hotels were up over 5%, respectively on the BSE Sensex.",positive,positive,2.034035656401937,positive,-0.346456692913393,neutral
2021-06-21 09:12:21.000,657.0,680.4,655.6,670.6,2257591.0,United Spirits enters the craft whisky market,"Inda’s top cities have seen an explosion of craft alcoholic beverages, typically small batch spirits infused with a range of ingredients as opposed to those that are mass produced",neutral,negative,2.070015220700156,positive,-0.044326241134745,neutral
2021-06-21 10:13:00.000,657.0,680.4,655.6,670.6,2257591.0,United Spirits forays into craft spirits with new whiskey,"The new brand — United’s Epitome Reserve — is part of USLs wider strategy to build a premium craft spirits portfolio in India, the company said.",neutral,positive,2.070015220700156,positive,-0.044326241134745,neutral
2021-06-23 11:36:00.000,683.8,684.0,660.0,668.0,1420315.0,Four midcap stocks that are poised to take off,"“From an investment perspective, we at Motilal Oswal have a positive view on United Spirits because of the kind of presence that it has and the kind of balance sheet repair that has been done in the last two years.”",negative,positive,-2.3106171395144712,negative,1.0082903876316378,positive
2021-07-16 21:28:00.000,643.0,674.2,633.25,670.95,10470123.0,Recovery Officer Debt Recovery Tribunal sells Rs 716-cr shares in United Spirits,"This translated into a total deal value of Rs 716.15 crore. On the BSE, shares of United Spirits ended 2.27 per cent higher at Rs 665.6 apiece.",neutral,positive,4.346811819595652,positive,-1.3197360527894353,negative
2021-07-16 23:04:05.000,643.0,674.2,633.25,670.95,10470123.0,Recovery Officer Debt Recovery Tribunal sells United Spirits’ shares worth Rs 716 cr,"Recovery Officer Debt Recovery Tribunal on Friday offloaded shares worth over Rs 716 crore in United Spirits Ltd, through an open market transaction. Bulk deal data on the BSE showed that Recovery Officer I DRT II sold over 1.13 crore shares at an average price of Rs 630.93 apiece. …",neutral,neutral,4.346811819595652,positive,-1.3197360527894353,negative
2021-07-16 23:07:03.000,643.0,674.2,633.25,670.95,10470123.0,Bulk Deals | Debt Recovery Tribunal Sells Shares Worth Rs 716 Crore In United Spirits,"Adesh Ventures LLP offloads 1,08,839 equity shares in Steel City Securities at Rs 65.1 per share, while Prasad Y V sells 2,15,300 equity shares in Vishwaraj Sugar Industries at Rs 142.54 per share on the NSE.",neutral,neutral,4.346811819595652,positive,-1.3197360527894353,negative
2021-07-23 08:12:54.000,680.0,688.4,663.8,680.0,3186182.0,"Stocks to Watch: Adani Ports, Bajaj Auto, BPCL, HUL, Vodafone Idea","ABB Power, Ambuja Cements, Federal Bank, JSW Steel, Jubilant Pharmova, Panacea Biotec, RIL, SBI Cards, United Spirits, and YES Bank, among other listed firms will be reporting their first quarter result today. Zomato is set to make its market debut today.",neutral,neutral,0.0,neutral,-4.811594202898557,negative
2021-07-23 08:29:25.000,680.0,688.4,663.8,680.0,3186182.0,"Markets likely to be volatile; RIL, Vodafone Idea, Yes Bank in focus","Among key companies, Reliance Industries, JSW Steel, SBI Cards and Payment Services, Ambuja Cements, United Spirits, Yes Bank, Crompton Greaves Consumer Electricals and Federal Bank will announce June quarterly results today.",neutral,neutral,0.0,neutral,-4.811594202898557,negative
2021-07-23 18:24:00.000,680.0,688.4,663.8,680.0,3186182.0,United Spirits reports consolidated net profit of Rs 55.50 crore in the June 2021 quarter,Sales rise 66.85% to Rs 1721.70 crore,neutral,positive,0.0,neutral,-4.811594202898557,negative
2021-07-23 18:39:47.000,680.0,688.4,663.8,680.0,3186182.0,United Spirits Q1 Net Profit At Rs 50 Crore,The company had posted a net loss of Rs 246.6 crore in the April-June period a year ago when most of the liquor shops were closed (till half of the quarter) due to the national lockdown.,neutral,negative,0.0,neutral,-4.811594202898557,negative
2021-07-23 19:24:00.000,680.0,688.4,663.8,680.0,3186182.0,Liquor firm United Spirits Q1 posts consolidate net profit at Rs 50 crore,"Diageo-controlled liquor maker United Spirits Ltd on Friday reported a consolidated net profit of Rs 50.3 crore for the quarter ended June 2021, helped by double-digit growth in sales.",neutral,positive,0.0,neutral,-4.811594202898557,negative
2021-07-23 21:50:04.000,680.0,688.4,663.8,680.0,3186182.0,United Spirits posts ₹69-cr Q1 profit,"United Spirits reported a net profit of ₹69.1 crore for the first quarter of the current fiscal while total income grew 58.61 per cent to ₹6,072.5 crore on a year-on-year basis. “We have delivered a r",neutral,positive,0.0,neutral,-4.811594202898557,negative
2021-07-23 23:53:09.000,680.0,688.4,663.8,680.0,3186182.0,United Spirits Q1 consolidated net profit rises to Rs 50 cr on robust sales growth,"Diageo-controlled liquor maker United Spirits Ltd on Friday reported a consolidated net profit of Rs 50.3 crore for the quarter ended June 2021, helped by double-digit growth in sales.The company had posted a net loss of Rs 246.6 crore in the April-June period a year ago when most of the l…",positive,positive,0.0,neutral,-4.811594202898557,negative
2021-07-26 07:25:00.000,690.0,690.0,654.1,656.8,3656240.0,United Spirits logs Q1 PAT of over Rs50cr; Board nods divestment of all equity shares and CCPS in HipBar,The company registered a consolidated net profit of Rs50.3cr in Q1FY22 aided by double-digit growth in sales.,neutral,positive,-4.811594202898557,negative,-2.1202219013602925,negative
2021-07-26 09:33:52.000,690.0,690.0,654.1,656.8,3656240.0,"United Spirits Consolidated June 2021 Net Sales At Rs 1,721.70 Crore, Up 66.85% Y-o-Y",,neutral,neutral,-4.811594202898557,negative,-2.1202219013602925,negative
