date,open,high,low,close,volume,title,description,title_sentiment,desc_sentiment,daily_change_pct,market_sentiment,next_day_change_pct,next_day_sentiment
2021-07-26 10:13:00.000,690.0,690.0,654.1,656.8,3656240.0,United Spirits hits 52-week high after Q1 PAT jumps to Rs 50 cr,The liquor major’s consolidated net profit stood at Rs 50.30 crore in Q1 June 2021 (Q1 FY22) compared with net loss of Rs 246.60 crore in Q1 June 2020 (Q1 FY21).,positive,positive,-4.811594202898557,negative,-2.1202219013602925,negative
2021-07-26 12:05:17.000,657.95,662.0,642.55,644.0,1749317.0,United Spirits Q1 Review - Decent Performance Amid The Constraint: ICICI Securities,United Spirits Q1 Review - Decent Performance Amid The Constraint: ICICI Securities,neutral,neutral,-2.1202219013602925,negative,-1.7672480321037094,negative
2021-07-26 12:50:00.000,657.95,662.0,642.55,644.0,1749317.0,"Top stocks in focus: ITC, ICICI Bank, Reliance Industries, Ambuja Cements, United Spirits",Check out the stocks that will be in focus during trade today based on recent and latest news developments.,neutral,neutral,-2.1202219013602925,negative,-1.7672480321037094,negative
2021-07-26 16:51:00.000,657.95,662.0,642.55,644.0,1749317.0,United Spirits exits liquor delivery firm Hip Bar,"The company’s board had approved sales of the equity shares and CCPS to HipBar founder and CEO Prasanna Natarajan for consideration of Rs 52 lakh, USL said in a regulatory filing.",neutral,neutral,-2.1202219013602925,negative,-1.7672480321037094,negative
2021-07-26 17:52:00.000,657.95,662.0,642.55,644.0,1749317.0,"United Spirits, part of Diageo, exits liquor delivery firm Hip Bar","Hip Bar Pvt Ltd had a turnover of Rs 50 lakh in the financial year ended March 31, 2020 and its net worth was Rs 7.76 crore.",neutral,neutral,-2.1202219013602925,negative,-1.7672480321037094,negative
2021-07-27 15:57:07.000,647.9,648.0,629.1,636.45,1842038.0,"United Spirits Q1 Review - Off-Trade Performance Leads Large Earnings Beat, Outlook Improving: Motilal Oswal","United Spirits Q1 Review - Off-Trade Performance Leads Large Earnings Beat, Outlook Improving: Motilal Oswal",neutral,neutral,-1.7672480321037094,negative,-0.3046875000000071,neutral
2021-07-28 10:09:11.000,647.9,648.0,629.1,636.45,1842038.0,Buy United Spirits; Target Of Rs 770: ICICI Direct,"ICICI Direct is bullish on United Spirits has recommended buy rating on the stock with a target price of Rs 770 in its research report dated July 26, 2021.",neutral,positive,-1.7672480321037094,negative,-0.3046875000000071,neutral
2021-08-02 13:32:17.000,652.0,667.0,650.25,653.9,1611974.0,United Spirits Ltd sees good buying,"United Spirits Ltd is quoting at Rs 651.5, up 1.68% on the day as on 12:54 IST on the NSE. The stock is up 13.5% in last one year as compared to a 45.75% spurt in NIFTY and a 17.66% spurt in the Nifty FMCG index.",positive,positive,0.2914110429447817,neutral,-2.1007763738772955,negative
2021-08-18 12:59:00.000,658.15,728.8,658.15,722.0,17765094.0,"Liquor stocks in focus; United Spirits, Pioneer Distilleries hit 52-wk high","United Breweries, Pioneer Distilleries, Globus Spirits, United Sprits and GM Breweries rallied up to 11 per cent on the BSE in intra-day trade on Wednesday",neutral,positive,9.70143584289296,positive,-2.3676880222841223,negative
2021-08-20 07:26:38.000,718.0,731.6,696.55,701.0,6288140.0,"Trade Spotlight: What Should Investors Do With HDFC Bank, United Spirits And Aster DM Healthcare?","Aster DM Healthcare rose over 7 percent to hit a 52-week high, United Spirits rallied nearly 10 percent and HDFC Bank pared gains to closed in the red on August 18",neutral,positive,-2.3676880222841223,negative,-1.7679944095038405,negative
2021-08-20 12:10:00.000,718.0,731.6,696.55,701.0,6288140.0,"Nifty FMCG advances over 300 points amid weak markets; HUL, Britannia outperform","Britannia, Godrej Consumer, and Nestle India were also bullish. Emami, United Breweries, and United Spirits dragged the most.",positive,positive,-2.3676880222841223,negative,-1.7679944095038405,negative
2021-08-20 16:34:00.000,718.0,731.6,696.55,701.0,6288140.0,"NCLT, Bengaluru directs Pioneer Distilleries to convene shareholders meeting on scheme of amalgamation; Stock slumps 5.5%",Shareholders on September 30 will consider the Scheme of Amalgamation amongst the Company and United Spirits.,neutral,neutral,-2.3676880222841223,negative,-1.7679944095038405,negative
2021-08-23 07:19:50.000,715.5,715.5,695.75,702.85,2635139.0,Hot Stocks | ‘Can Bet On Bata India And United Spirits For Short Term’,"The weekly chart of Nifty now exhibits a shooting star candle which is an indication of some pause if the low of the candle is breached on a closing basis, said Sameet Chavan of Angel Broking.",neutral,neutral,-1.7679944095038405,negative,-1.9787234042553257,negative
2021-08-25 07:40:00.000,693.5,695.45,678.25,684.0,1641368.0,"Nifty FMCG advances over 300 points amid volatile trade; Jubilant Foodworks, Godrej Consumer, Varun Beverages emerge top gainers","Nestle India and Dabur India also gained around 1.2% to outperform. Marico, United Breweries, and United Spirits struggled.",positive,positive,-1.36986301369863,negative,0.5277818501686002,neutral
2021-09-02 16:23:00.000,749.95,777.0,749.15,752.4,5190808.0,Diageo-owned United Spirits outperforms Pernod Richard in premium segment,"Pernod Ricard, which only sells premium and semi-premium brands, mainly Blenders Pride, Royal Stag and Imperial Blue, grew 9% during the year ended June. In comparison, Diageo-owned USL expanded 13.7% during the same period.",neutral,positive,0.3266884458963839,neutral,-1.116248348745052,negative
2021-09-03 06:57:00.000,749.95,777.0,749.15,752.4,5190808.0,"In a first, USL pips Pernod Ricard in premium segment",United Spirits (USL) has outpaced Pernod Ricard in the premium segment of Indias alcohol beverages market for the first time ever in the last fiscal.Diageo-owned USL grew 13.,neutral,positive,0.3266884458963839,neutral,-1.116248348745052,negative
2021-09-17 12:38:02.000,744.0,768.6,740.7,743.95,3947961.0,"Globus Spirits, UBL to Radico Khaitan, why liquor stocks are surging?","Liquor major Radico Khaitan share price shot up around 4 per cent, United Spirits shares went up over 3 per cent while Globus Spirits stocks surged near 4 per cent in the intraday trade session",neutral,positive,-0.0067204301075207,neutral,-0.4871447902571073,neutral
2021-09-23 13:31:07.000,834.95,853.25,817.75,825.3,4804482.0,United Spirits Ltd gallops 7.6%,"United Spirits Ltd is quoting at Rs 832.3, up 7.6% on the day as on 12:54 IST on the NSE. The stock is up 67.95% in last one year as compared to a 64.52% spurt in NIFTY and a 43.49% spurt in the Nifty FMCG index.",neutral,positive,-1.155757829810179,negative,-1.252861101072157,negative
2021-09-23 14:50:08.000,834.95,853.25,817.75,825.3,4804482.0,Volumes soar at United Spirits Ltd counter,"United Spirits Ltd recorded volume of 125.35 lakh shares by 14:19 IST on NSE, a 6.19 times surge over two-week average daily volume of 20.26 lakh shares",neutral,positive,-1.155757829810179,negative,-1.252861101072157,negative
2021-09-24 02:17:00.000,834.95,853.25,817.75,825.3,4804482.0,United Spirits high on post-lockdown party; stock jumps over 7%,"Its share price has risen 44% in 2021, against 21% rise in BSE FMCG index",positive,positive,-1.155757829810179,negative,-1.252861101072157,negative
2021-09-24 07:50:37.000,834.95,853.25,817.75,825.3,4804482.0,"Trade Spotlight: What Should Investors Do With United Spirits, Bajaj Finserv And Mphasis?",Here’s what Shrikant Chouhan of Kotak Securities recommends investors should do with these stocks when the market resumes trading today.,neutral,neutral,-1.155757829810179,negative,-1.252861101072157,negative
2021-09-24 08:37:53.000,834.95,853.25,817.75,825.3,4804482.0,"United Spirits - Recovery Evident, Longer-Term Prospects Remain Attractive: Motilal Oswal","United Spirits - Recovery Evident, Longer Term Prospects Remain Attractive: Motilal Oswal",neutral,neutral,-1.155757829810179,negative,-1.252861101072157,negative
2021-09-28 23:07:18.000,819.0,835.3,817.05,824.15,1603829.0,"Improved prospects, product mix aid earnings outlook for USL",Shares of United Spirits have gained over 48% so far in FY22 to hit a fresh 52-week high on Monday. An improving outlook on sales on the back of easing of covid restrictions seems to be behind the optimism for the stock,positive,positive,0.628815628815626,neutral,3.389830508474576,positive
2021-09-30 13:16:09.000,855.0,869.45,840.1,864.0,3579809.0,United Spirits Ltd gains for third straight session,"United Spirits Ltd is quoting at Rs 852.4, up 3.05% on the day as on 12:54 IST on the NSE. The stock is up 63.05% in last one year as compared to a 54.81% jump in NIFTY and a 34.8% jump in the Nifty FMCG index.",positive,positive,1.0526315789473684,positive,-0.3682605443351223,neutral
2021-10-04 13:04:09.000,865.0,886.65,863.0,881.5,3155999.0,United Spirits Ltd up for fifth session,"United Spirits Ltd is quoting at Rs 868.25, up 0.36% on the day as on 12:49 IST on the NSE. The stock is up 65.62% in last one year as compared to a 53.64% spurt in NIFTY and a 34.41% spurt in the Nifty FMCG.",positive,positive,1.907514450867052,positive,-1.938746838999719,negative
2021-10-07 13:23:20.000,907.5,925.5,901.0,914.25,2402327.0,"Over 250 Stocks Hit 52-week High On BSE As Auto, Realty Rally. Titan At Rs 2-lakh-crore Market-cap","274 stocks hit new 52-week high on BSE including names like Titan Company, Sobha, Chambal Fertilisers, Tata Motors, PAGE Industries, Godrej Properties, Bata India, IRCTC, United Spirits and Tata Elxsi among others.",neutral,neutral,0.743801652892562,neutral,-1.3186813186813189,negative
2021-10-11 17:26:46.000,900.0,918.45,892.25,905.9,2942200.0,United Spirits Q2 PAT Seen Up 14.9% YoY To Rs 147.5 Cr: Motilal Oswal,"Net Sales are expected to (up 32.9 percent Q-o-Q) to Rs 2,145.9 crore, according to Motilal Oswal.",neutral,positive,0.6555555555555531,neutral,-1.4786418400876231,negative
2021-10-12 17:40:00.000,913.0,919.8,897.55,899.5,2172663.0,Nifty FMCG trades higher amid volatile markets; Radico Khaitan hits new high to lead the gains,"Dabur India, Marico, and United Spirits were also in the fast lane. Emami led the laggards.",positive,neutral,-1.4786418400876231,negative,-1.843877663685552,negative
2021-10-27 07:47:00.000,839.0,897.65,834.7,894.9,4024861.0,"Ashok Leyland, Biocon look good on charts for a rebound: Ajit Mishra",The technical analyst from Religare Broking also recommends to accumulate United Spirits. Check out the range below,positive,positive,6.662693682955897,positive,-2.8423913043478235,negative
2021-10-27 08:44:00.000,839.0,897.65,834.7,894.9,4024861.0,"Axis Bank, Bajaj Finance, Cipla to react to September quarterly results","Larsen & Toubro, ITC, IndusInd Bank, Bajaj Auto, Titan Company, Lupin, Maruti Suzuki India, SBI Life Insurance Company, Zee Entertainment Enterprises, Adani Enterprises, Adani Ports and Special Economic Zone, United Spirits among others will",positive,neutral,6.662693682955897,positive,-2.8423913043478235,negative
2021-10-27 16:14:00.000,920.0,944.75,876.8,893.85,16079210.0,United Spirits Q2 PAT up 113% YoY to Rs 273 crore,United Spirits reported 112.9% rise in standalone net profit to Rs 273.4 crore in Q2 FY22 from Rs 128.4 crore in Q2 FY21.,positive,positive,-2.8423913043478235,negative,5.784848147736122,positive
2021-10-27 16:55:00.000,920.0,944.75,876.8,893.85,16079210.0,United Spirits consolidated net profit rises 125.50% in the September 2021 quarter,Sales rise 14.19% to Rs 2507.60 crore,positive,positive,-2.8423913043478235,negative,5.784848147736122,positive
2021-10-27 17:30:00.000,920.0,944.75,876.8,893.85,16079210.0,United Spirits Q2 profit jumps 113% YoY to Rs 273 cr; net sales up 14%,"The company also registered a 494% jump in its profit after tax (PAT) at Rs 343 crore for the first half (H1) of FY22 driven by resilient consumer demand, easing of trade restrictions and the arrival of peak season.",positive,positive,-2.8423913043478235,negative,5.784848147736122,positive
2021-10-27 17:58:56.000,920.0,944.75,876.8,893.85,16079210.0,United Spirits standalone net more than doubles to ₹27 crore,Gradual on-trade recovery and higher sales of Prestige and Above segments boost performance,positive,positive,-2.8423913043478235,negative,5.784848147736122,positive
2021-10-27 18:16:00.000,920.0,944.75,876.8,893.85,16079210.0,United Spirits second quarter profit jumps two-fold to Rs 286 crore,"During the quarter, USL’s off-trade gained momentum as the second wave of the pandemic started receding, while on-trade continues to gradually recover with the easing of restrictions",positive,positive,-2.8423913043478235,negative,5.784848147736122,positive
2021-10-27 22:44:42.000,920.0,944.75,876.8,893.85,16079210.0,"United Spirits Consolidated September 2021 Net Sales At Rs 8,208.80 Crore, Up 273.81% Y-o-Y",,neutral,neutral,-2.8423913043478235,negative,5.784848147736122,positive
2021-10-28 13:16:14.000,898.9,963.4,881.5,950.9,9661724.0,"United Spirits Ltd spurts 5.53%, up for third straight session","United Spirits Ltd is quoting at Rs 931.7, up 5.53% on the day as on 12:54 IST on the NSE. The stock is up 84.55% in last one year as compared to a 54.49% gain in NIFTY and a 29.49% gain in the Nifty FMCG index.",positive,positive,5.784848147736122,positive,1.0363231255505467,positive
2021-10-28 17:30:00.000,898.9,963.4,881.5,950.9,9661724.0,"Stocks in news: ITC, Titan, L&T, Adani Ports, United Spirits, PNB and more","Sensex tumbled 207 points on Wednesday, weighed by losses in Axis Bank, Reliance Industries and Bajaj Finance amid a weak trend in global markets.",neutral,negative,5.784848147736122,positive,1.0363231255505467,positive
2021-10-29 08:15:00.000,898.9,963.4,881.5,950.9,9661724.0,United Spirits to bring Guinness to India,"Launched in 1759, Guinness is one of world’s top beer brands and USL said the launch is part of the company’s wider strategy to reshape its premium portfolio and have more broad-based growth.",neutral,neutral,5.784848147736122,positive,1.0363231255505467,positive
2021-10-29 08:37:45.000,898.9,963.4,881.5,950.9,9661724.0,"Trade Spotlight | What Should You Do With ITC, IndusInd Bank, United Spirits Stocks?",Here’s what Shrikant Chouhan of Kotak Securities advises investors holding these stocks on trading today.,neutral,neutral,5.784848147736122,positive,1.0363231255505467,positive
2021-10-29 11:01:00.000,898.9,963.4,881.5,950.9,9661724.0,"United Spirits, the outlier at a time when everyone on D-St is in a tense huddle",United Spirits is putting up a spirited fight following a strong second-quarter amid sharp corrections in the broader markets.,negative,negative,5.784848147736122,positive,1.0363231255505467,positive
2021-10-29 12:15:19.000,898.9,963.4,881.5,950.9,9661724.0,United Spirits’ improved business momentum boosts investor confidence,The easing of covid-led restrictions is helping the company see a strong rebound in sales.,positive,positive,5.784848147736122,positive,1.0363231255505467,positive
2021-10-29 12:43:00.000,898.9,963.4,881.5,950.9,9661724.0,"Alcohol stocks in limelight, jump up to 10%; United Spirits at record high","Pioneer Distilleries, Tilaknagar Industries, IFB Agro Industries, Khoday India, GM Breweries, Som Distilleries and United Breweries were rallied by upto 10% on the BSE in intra-day today.",positive,positive,5.784848147736122,positive,1.0363231255505467,positive
2021-10-29 12:58:00.000,898.9,963.4,881.5,950.9,9661724.0,"Results Review For Bajaj Auto, Marico, United Spirits, Gujarat Gas, Lupin, Dalmia","Results Review For Bajaj Auto, Marico, United Spirits, Gujarat Gas, Lupin, Dalmia",neutral,neutral,5.784848147736122,positive,1.0363231255505467,positive
2021-10-29 16:42:01.000,898.9,963.4,881.5,950.9,9661724.0,"UltraTech Cement, United Spirits And More - Top Stock Picks For Diwali And Samvat 2078: Motilal Oswal","UltraTech Cement, United Spirits And More - Top Stock Picks For Diwali And Samvat 2078: Motilal Oswal",neutral,neutral,5.784848147736122,positive,1.0363231255505467,positive
2021-10-29 17:30:00.000,898.9,963.4,881.5,950.9,9661724.0,United Spirits shares at record high! Can the momentum sustain?,The stock has been gaining after posting a healthy set of numbers for the quarter ended September 2021.,positive,positive,5.784848147736122,positive,1.0363231255505467,positive
2021-11-01 13:04:23.000,973.5,988.35,965.5,978.0,2139737.0,"United Spirits Ltd spurts 3.12%, up for five straight sessions","United Spirits Ltd is quoting at Rs 976.9, up 3.12% on the day as on 12:49 IST on the NSE. The stock is up 93.85% in last one year as compared to a 52.53% gain in NIFTY and a 30.07% gain in the Nifty FMCG.",positive,positive,0.4622496147919877,neutral,-1.6173469387755126,negative
2021-11-01 13:31:15.000,973.5,988.35,965.5,978.0,2139737.0,United Spirits Ltd stays in winning mode,"United Spirits Ltd is quoting at Rs 976.9, up 3.12% on the day as on 12:49 IST on the NSE. The stock is up 93.85% in last one year as compared to a 52.53% gain in NIFTY and a 30.07% gain in the Nifty FMCG.",positive,positive,0.4622496147919877,neutral,-1.6173469387755126,negative
2021-11-10 14:35:00.000,973.4,975.0,943.75,952.05,1895355.0,Hemang Jani’s 4 FMCG bets and why United Spirits can be a good buy,“Our pecking order in terms of the consumer names would start with HUL. We also have Dabur as one of our top largecap picks along with Godrej Consumer. Within the midcap universe we prefer Marico.”,positive,neutral,-2.193342921717693,negative,0.5241090146750524,neutral
2021-11-14 11:01:54.000,959.0,962.5,935.4,936.5,1687564.0,United Spirits - Emerging Headwinds; Fair Valuations: Motilal Oswal,United Spirits - Emerging Headwinds; Fair Valuations: Motilal Oswal,neutral,neutral,-2.346193952033368,negative,-0.3737319807794981,neutral
2021-11-15 17:40:00.000,936.5,949.8,930.6,933.0,1516670.0,"Nifty FMCG stock edge over 200 points higher; P&G Hygiene, ITC drive performance","Emami, Varun Beverages, and United Spirits were under heavy pressure.",positive,neutral,-0.3737319807794981,neutral,-0.4504021447721228,neutral
2021-11-26 07:01:32.000,930.0,937.8,881.3,886.55,3403965.0,"Hot Stocks | Here’s Why You Should Bet On Reliance, PI Industries, United Spirits For Short Term","Any sustainable move above 17,600 levels may cause an upside momentum towards 17,700-17,800 levels, says Rajesh Palviya of Axis Securities.",neutral,positive,-4.672043010752693,negative,0.5612244897959235,neutral
2021-12-17 13:05:00.000,922.1,925.95,878.2,882.45,1941879.0,"ZEE, Vedanta, Adani Ports among 50 stocks sending ‘sell’ signals on MACD","The momentum indicator has signalled bearish crossovers on these stocks — a sign of bearish undertone — hinting at possible downsides in the days ahead. The list includes Suzlon Energy, Union Bank of India, India Overseas Bank, Redington India, United Spirits, MOIL and PNB Housing Finance.",neutral,neutral,-4.299967465567723,negative,-1.4662084765177497,negative
2021-12-21 01:10:00.000,863.3,902.35,863.3,887.85,1683608.0,"Nifty FMCG trades higher to go with upbeat markets; Godrej Consumer, United Spirits lift performance","Radico Khaitan, Colgate Palmolive, Nestle India and Tata Consumer also outperformed on Tuesday.",positive,positive,2.843739140507364,positive,1.6763233391460848,positive
2021-12-21 09:34:00.000,863.3,902.35,863.3,887.85,1683608.0,"Buy United Spirits, target price Rs 1015: Emkay Global","United Spirits Ltd., incorporated in the year 1999, is a Large Cap company (having a market cap of Rs 62690.76 Crore) operating in Beverages - Alcoholic sector.",neutral,neutral,2.843739140507364,positive,1.6763233391460848,positive
2021-12-27 17:30:00.000,887.8,903.0,886.9,897.5,760323.0,"United Spirits extends timeline for ‘strategic review’ of selected brands till March 31, 2021","The review of the selected popular brands, which consist of a portfolio of around 30 brands, will now be completed by March 31, 2022, the company said in a regulatory filing.",positive,neutral,1.092588420815504,positive,-0.7923222854592146,neutral
2021-12-27 21:06:00.000,887.8,903.0,886.9,897.5,760323.0,United Spirits Ltd extends deadline for strategic review of selected popular liquor brands by 3 months,"USL’s popular portfolio comprises around 30 entry-level lower-priced brands, with an average consumer price less than Rs 400 for a 750 ml bottle and straddle whisky, rum, brandy, vodka and gin. Under the strategic review, USL will therefore assess all options to continue this approach while taking i…",neutral,neutral,1.092588420815504,positive,-0.7923222854592146,neutral
2021-12-27 21:06:40.000,887.8,903.0,886.9,897.5,760323.0,United Spirits Extends Deadline For Strategic Review Of Selected Popular Brands By 3 Months,"The review of the selected popular brands, which consist of a portfolio of around 30 brands, will now be completed by March 31, 2022, informed USL in a regulatory filing.",neutral,positive,1.092588420815504,positive,-0.7923222854592146,neutral
2021-12-28 08:14:05.000,887.8,903.0,886.9,897.5,760323.0,"Stocks To Watch: RBL Bank, Supriya Lifescience Debut, Shyam Metalics, United Spirits, Siemens India",Here are the stocks to watch in trade today...,neutral,neutral,1.092588420815504,positive,-0.7923222854592146,neutral
2021-12-31 19:05:00.000,889.0,905.05,889.0,898.5,1284051.0,United Spirits receives revision in credit ratings from CRISIL,Total bank loan facilities - Rs 2800 crore Long term rating - CRISIL AAA/ Stable (upgraded from CRISIL AA+/ Positive) Short term rating - CRISIL A1+ (reaffirmed),neutral,positive,1.0686164229471318,positive,0.969404908663016,positive
2022-01-03 09:01:00.000,892.3,910.95,892.3,900.95,699936.0,"Buy United Spirits, target price Rs 940: Chandan Taparia","United Spirits Ltd., incorporated in the year 1999, is a Large Cap company (having a market cap of Rs 65270.32 Crore) operating in Beverages - Alcoholic sector.",neutral,neutral,0.969404908663016,positive,1.0938017898574717,positive
2022-01-13 09:07:00.000,916.05,950.6,910.2,943.25,4084322.0,"Buy United Spirits, target price Rs 965: IIFL","United Spirits Ltd., incorporated in the year 1999, is a Large Cap company (having a market cap of Rs 66465.64 Crore) operating in Beverages - Alcoholic sector.",neutral,neutral,2.969270236340816,positive,0.308576292828271,neutral
2022-01-25 07:55:47.000,850.0,882.4,831.5,873.1,2054091.0,"Stocks to Watch: Maruti, Axis Bank, Vodafone Idea, IEX, Deepak Nitrite","Shares of companies like Maruti Suzuki India, Cipla, ICRA, Federal Bank, Pidilite, Raymond, RPG Life Sciences, Allsec Technologies, Star Cement, Torrent Pharma, United Spirits, and Finolex Industries will be in focus as they announce their December quarter earnings today",neutral,neutral,2.717647058823532,positive,-3.692272519433008,negative
2022-01-25 08:03:00.000,850.0,882.4,831.5,873.1,2054091.0,"Stocks in the news: Axis Bank, Maruti, Voda Idea, SBI Cards and IEX","Maruti Suzuki, Pidilite Industries, SRF, Cipla, United Spirits, Macrotech Developers, Torrent Pharma, APL Apollo Tubes and Federal Bank are among the companies that will announce their December quarter results today.",neutral,neutral,2.717647058823532,positive,-3.692272519433008,negative
2022-01-25 08:04:00.000,850.0,882.4,831.5,873.1,2054091.0,"Stocks to Watch: Axis Bank, Airtel, SBI Cards, Voda Idea, IEX, Burger King","Cipla, Federal Bank, Finolex Industries, Indiabulls Real Estate, ICRA, Macrotech Developers, Maruti Suzuki, Pidilite, SRF, Torrent Pharma and United Spirits to announce results today.",neutral,neutral,2.717647058823532,positive,-3.692272519433008,negative
2022-01-25 08:04:00.000,850.0,882.4,831.5,873.1,2054091.0,"Stocks to Watch: Axis Bank, Airtel, SBI Cards, Voda Idea, IEX, Burger King","Cipla, Federal Bank, Finolex Industries, Indiabulls Real Estate, ICRA, Macrotech Developers, Maruti Suzuki, Pidilite, SRF, Torrent Pharma and United Spirits to announce results today.",neutral,neutral,2.717647058823532,positive,-3.692272519433008,negative
2022-01-25 17:30:00.000,850.0,882.4,831.5,873.1,2054091.0,"Stocks in news: Vodafone Idea, Axis Bank, Maruti Suzuki, Pidilite and more","Stocks in news: Shriram Transport Finance, Vodafone Idea, Hero MotoCorp, Axis Bank, Maruti Suzuki, Sensex, Nifty, Pidilite, SRF, Cipla, United Spirits, Macrotech Developers and more",neutral,neutral,2.717647058823532,positive,-3.692272519433008,negative
2022-01-25 17:30:00.000,850.0,882.4,831.5,873.1,2054091.0,United Spirits Q3 results: Net profit up 27% to Rs 291 crore,"Reported net sales increased 15.9 per cent, reflecting resilient consumer demand in the offtrade channel, continued premiumisation and recovery of the on-trade channel, the company said.",positive,positive,2.717647058823532,positive,-3.692272519433008,negative
2022-01-25 18:00:00.000,850.0,882.4,831.5,873.1,2054091.0,United Spirits consolidated net profit rises 4.39% in the December 2021 quarter,Sales rise 10.27% to Rs 2947.40 crore,positive,positive,2.717647058823532,positive,-3.692272519433008,negative
2022-01-25 18:00:00.000,850.0,882.4,831.5,873.1,2054091.0,United Spirits consolidated net profit rises 4.39% in the December 2021 quarter,Sales rise 10.27% to Rs 2947.40 crore,positive,positive,2.717647058823532,positive,-3.692272519433008,negative
2022-01-25 18:44:10.000,850.0,882.4,831.5,873.1,2054091.0,"United Spirits Q3 profit rises 27% to Rs 291 crore, net sales up 7.6% at Rs 8,854.5 crore","The company had posted a net profit of Rs 229.9 crore in the October-December period a year ago, United Spirits Ltd (USL) said in a regulatory filing.",positive,positive,2.717647058823532,positive,-3.692272519433008,negative
