date,open,high,low,close,volume,title,description,title_sentiment,desc_sentiment,daily_change_pct,market_sentiment,next_day_change_pct,next_day_sentiment
2018-01-25 13:02:12.118,4305.0,4305.0,4164.1,4200.0,48876.0,"Buy State Bank of India, Vedanta, Oracle Financial Services: Amit Gupta","Amit Gupta of ICICIdirect recommends buying State Bank of India, Vedanta  and Oracle Financial Services.",neutral,neutral,-2.4390243902439024,negative,0.4928057553956878,neutral
2018-09-20 10:02:11.683,4116.0,4187.0,3959.0,4070.0,172648.0,FPIs cut stake in Oracle Financial,"Shares of Oracle Financial Services Software may remain in focus, as FPIs have reduced their stake in the company. In a disclosure, the company said Sussex (Mauritius) and Wessex (Mauritius) have sold",negative,neutral,-1.1175898931000972,negative,1.197841904667626,positive
2018-10-24 18:01:30.945,3660.15,3700.0,3553.9,3620.0,47941.0,"Bajaj Auto, Hero MotoCorp, Tata Motors hit 52-week low","Shree Cement, Grasim Ind, Container Corporation, Indian Bank, Motilal Oswal Financial, Edelweiss Financial and Oracle Financial Services were among 10 stocks from the S&P BSE 200 index hit 52-week low",neutral,neutral,-1.0969495785691867,negative,-2.2187751031827347,negative
2018-11-28 13:02:49.799,3467.0,3480.0,3371.0,3414.0,29788.0,"D-Street Buzz: Nifty IT outperforms as TCS, Infosys jump 3%; Jet Airways spikes 7%, DLF drags","Nifty IT is outshining all other indices, up over 2 percent led by Infosys which jumped 3 percent followed by Tata Consultancy Services, Oracle Financial Services, Tata Elxsi, Tech Mahindra and HCL Tech.",positive,positive,-1.528699163541967,negative,0.0599774718764224,neutral
2019-01-14 18:01:52.346,3606.05,3684.7,3604.1,3675.65,14884.0,Oracle Financial Services Q3 PAT seen up 3.5% QoQ to Rs. 364.2 cr: Dolat Capital,"Net Sales are expected to increase by 5.1 percent Q-o-Q (up 20.4 percent Y-o-Y) to Rs. 1,275.6 crore, according to Dolat Capital.",positive,positive,1.930089710347885,positive,0.2208348101093243,neutral
2019-04-15 18:00:46.524,3615.0,3634.35,3546.8,3563.0,30601.0,"D-Street Buzz: TCS jumps 4%, Tata Motors extends gains; PC Jeweller zooms 15%","From the IT space, TCS jumped 4 percent followed by HCL Tech, Tata Elxsi, Tech Mahindra, Wipro, Oracle Financial Services and Birlasoft.",positive,positive,-1.438450899031812,negative,-1.0140845070422535,negative
2019-05-10 23:00:51.901,3489.95,3500.0,3355.7,3371.0,42398.0,Company news: Oracle Financial Services Software,"The board of Oracle Financial Services Software on Friday approved to divest the foreign direct investments in the company’s stepdown subsidiaries - Mantas India Private Limited, and Oracle (OFSS) BPO",neutral,positive,-3.408358285935324,negative,0.6766696087084437,neutral
2019-07-23 13:00:14.514,3360.0,3360.0,3207.05,3249.0,26006.0,NSE to exclude 9 stocks from Futures and Options contracts after September 27,"The stocks include Arvind, Birlasoft, Engineers India, Hindustan Zinc, IDBI Bank, Kajaria Ceramics, Multi Commodity Exchange of India, Oracle Financial Services Software, and Raymond.",neutral,neutral,-3.303571428571429,negative,1.41321044546851,positive
2020-06-26 12:29:50.000,2700.0,2790.3,2700.0,2742.0,58715.0,"D-Street Buzz: IT Stocks Rally; NIIT Tech, Infosys Jump 6-8%, TCS, Wipro, HCL Tech Gain","S&P BSE IT jumped 5 percent led by Mastek, NIIT Tech, Nucleus Software, Intellect Design, L&T Technology, Mphasis, Oracle Financial Services, Sonata Software and Sasken Tech.",neutral,positive,1.5555555555555556,positive,4.950603933356557,positive
2020-07-22 15:04:00.000,3086.95,3102.25,3016.05,3038.95,13988.0,Buy Oracle Financial Services Software; target of Rs 3500: Dolat Capital,"Dolat Capital is bullish on Oracle Financial Services Software has recommended buy rating on the stock with a target price of Rs 3500 in its research report dated July 21, 2020.",neutral,positive,-1.5549328625342167,negative,-1.983322432962724,negative
2020-08-11 05:30:00.000,2993.1,2993.1,2922.0,2967.05,50827.0,BRIEF-India’s Oracle Financial Services Software June Qtr Consol Net Profit Rises - Investing.com India,"The Financial News section features stock market news in addition to stories about bonds, forex, commodities and economic releases.",neutral,neutral,-0.8703351040726914,neutral,-2.4115755627009645,negative
2020-08-12 11:38:42.000,3110.0,3150.0,2988.0,3035.0,512141.0,Dolat Capital: Oracle Financial Services Software’s Digital Acceleration Drives Stellar Q1 Performance; Beats On All Count,Dolat Capital: Oracle Financial Services Software’s Digital Acceleration Drives Stellar Q1 Performance; Beats On All Count,neutral,neutral,-2.4115755627009645,negative,-0.7832898172323759,neutral
2020-08-12 15:27:00.000,3064.0,3068.0,3011.0,3040.0,63990.0,Buy Oracle Financial Services Software; target of Rs 4000: Dolat Capital,"Dolat Capital is bullish on Oracle Financial Services Software has recommended buy rating on the stock with a target price of Rs 4000 in its research report dated August 12, 2020.",neutral,positive,-0.7832898172323759,neutral,-1.6470588235294146,negative
2020-08-24 10:51:00.000,3065.0,3083.85,3041.0,3079.85,29985.0,Oracle Financial Services Software allots 11955 equity shares under ESOS,With this allotment the paid up capital of the Company has increased to Rs. 429910515/- divided into 85982103 equity shares of face value of Rs. 5/- each.,neutral,neutral,0.4845024469820525,neutral,-0.8525397905928939,neutral
2020-08-24 12:13:00.000,3084.9,3099.95,3039.0,3058.6,16029.0,"Oracle Financial Services Software allots 11,955 equity shares",Under ESOS,neutral,neutral,-0.8525397905928939,neutral,-0.9452411994784876,negative
2020-09-10 11:04:08.000,2928.0,2999.9,2920.0,2930.0,33661.0,Volumes jump at Oracle Financial Services Software Ltd counter,"Oracle Financial Services Software Ltd witnessed volume of 40265 shares by 10:54 IST on BSE, a 3.91 times surge over two-week average daily volume of 10295 shares",neutral,positive,0.0683060109289617,neutral,-0.9775586535192112,negative
2020-09-21 12:31:13.000,3064.0,3084.0,2941.0,3059.95,95877.0,KPIT Technologies Ltd leads gainers in ‘A’ group,"HFCL Ltd, Capri Global Capital Ltd, Oracle Financial Services Software Ltd and Essel Propack Ltd are among the other gainers in the BSEs A group today, 21 September 2020.",positive,neutral,-0.1321801566579694,neutral,-0.522875816993464,neutral
2020-09-23 12:05:00.000,3069.45,3069.45,2950.1,2956.0,62237.0,"Oracle Financial Services Software allots 9,368 equity shares under ESOS","With this allotment, the paid up capital of the Company has increased to
Rs. 429,957,355/- divided into 85,991,471 equity shares of face value of Rs. 5/- each.",neutral,neutral,-3.696101907507854,negative,-0.8496233115396074,neutral
2020-10-20 10:43:00.000,3306.1,3315.4,3225.0,3257.0,60747.0,"Oracle Financial Services Software allots 4,488 equity shares under ESOP","With this allotment, the paid up capital of the Company has increased to
Rs. 429,979,795/- divided into 85,995,959 equity shares of face value of Rs. 5/- each.",neutral,neutral,-1.4851335410302142,negative,-1.6458396830234685,negative
2020-11-03 08:01:00.000,3050.0,3150.0,3011.0,3101.1,71586.0,Oracle Financial Services Software consolidated net profit rises 9.26% in the September 2020 quarter,Sales rise 3.00% to Rs 1197.39 crore,positive,positive,1.675409836065571,positive,-1.5064102564102564,negative
2020-11-03 16:02:53.000,3120.0,3148.0,3062.0,3073.0,21029.0,Dolat Capital: Oracle Financial Services’ Qualitative Wins Fortify Acceleration Hopes,Dolat Capital: Oracle Financial Services’ Qualitative Wins Fortify Acceleration Hopes,neutral,neutral,-1.5064102564102564,negative,-0.2224134292254463,neutral
2020-11-25 11:46:00.000,3035.0,3063.55,3010.0,3011.0,30210.0,"Oracle Financial Services Software allots 5,502 equity shares under ESOS","With this allotment, the paid up capital of the Company has increased to Rs. 430,007,305/- divided into 86,001,461 equity shares of face value of Rs. 5/- each.",neutral,neutral,-0.7907742998352554,neutral,0.0331125827814569,neutral
2021-01-20 13:34:00.000,3367.9,3399.95,3340.0,3350.0,59359.0,"Oracle Financial Services Software allots 14,578 equity shares under ESOP","With this allotment, the paid up capital of the Company has increased to Rs. 430,273,475/- divided into 86,054,695 equity shares of face value of Rs. 5/- each.",neutral,neutral,-0.5314884646218739,neutral,-0.8955223880597015,neutral
2021-01-29 07:58:00.000,3322.9,3322.9,3201.0,3217.5,78345.0,Oracle Financial Services Software consolidated net profit declines 5.93% in the December 2020 quarter,Sales rise 6.75% to Rs 1238.42 crore,negative,positive,-3.171928135062749,negative,0.9944064636420136,positive
2021-02-24 16:02:00.000,3050.75,3150.0,3005.1,3020.0,134753.0,Oracle Financial Services Software allots 3620 equity shares under ESOS,"With this allotment, the paid up capital of the Company has increased to Rs.
430,291,575/- divided into 86,058,315 equity shares of face value of Rs. 5/- each.",neutral,neutral,-1.0079488650331885,negative,0.9149891864914323,positive
2021-03-24 11:24:00.000,3200.0,3254.95,3185.0,3185.3,46655.0,"Oracle Financial Services Software allots 3,918 equity shares under ESOP","With this allotment, the paid up capital of the Company has increased to Rs. 430,311,165/- divided into 86,062,233 equity shares of face value of Rs. 5/- each.",neutral,neutral,-0.4593749999999943,neutral,-1.596473739953897,negative
2021-04-01 07:05:00.000,3230.0,3270.0,3185.0,3207.15,109774.0,"Nifty IT index trades higher; HCL Tech top gainer; Infosys, Wipro strengthen too",Infosys and Oracle Financial Services Software surged over 1% to lift the IT sector. Larsen & Turbo Infotech and Wipro were also trading around 0.65% higher.,positive,positive,-0.7074303405572727,neutral,-0.9969040247677962,negative
2021-04-28 13:51:12.000,3589.9,3609.3,3445.2,3469.0,93086.0,Oracle Financial Services Software Ltd extends upmove,"Oracle Financial Services Software Ltd is quoting at Rs 3533, up 3.87% on the day as on 12:49 IST on the NSE. The stock is up 48.09% in last one year as compared to a 55.32% jump in NIFTY and a 92.48% jump in the Nifty IT index.",positive,positive,-3.367781832363021,negative,-0.1383285302593712,neutral
2021-05-06 08:09:00.000,3564.0,3595.0,3474.0,3484.9,188679.0,Oracle Financial Services Software consolidated net profit rises 70.97% in the March 2021 quarter,Sales decline 4.17% to Rs 1210.86 crore,positive,negative,-2.2194163860830503,negative,0.8156028368794326,neutral
2021-05-06 08:46:28.000,3564.0,3595.0,3474.0,3484.9,188679.0,Markets may see a gap-up opening on positive global cues,"Stocks to watch out for today: IDBI Bank, Indian Bank, Ceat, Oracle Financial Services Software, and Godrej Industries.",positive,neutral,-2.2194163860830503,negative,0.8156028368794326,neutral
2021-05-06 11:56:00.000,3564.0,3595.0,3474.0,3484.9,188679.0,OFSS Q4 PAT up 7% QoQ,"On a consolidated basis, Oracle Financial Services Software (OFSS) reported 7.1% rise in net profit to Rs 460.31 crore on 2.2% fall in net sales to Rs 1210.86 crore in Q4 FY21 over Q3 FY21.",positive,positive,-2.2194163860830503,negative,0.8156028368794326,neutral
2021-05-06 15:32:00.000,3525.0,3590.0,3476.65,3553.75,153622.0,Oracle Financial Services Software Q4 net income jumps 71% yoy to Rs460cr,"The company’s revenue in Q4FY21 was down 4% yoy to Rs1,210.9cr in Q4FY21 from Rs1,263.6cr in Q4FY20. Declares an interim dividend of Rs200 per equity share of Rs5 face value.",positive,negative,0.8156028368794326,neutral,0.8031016338964275,neutral
2021-05-11 13:32:15.000,3770.0,3795.0,3685.05,3702.0,140362.0,Oracle Financial Services Software Ltd up for third consecutive session,"Oracle Financial Services Software Ltd is quoting at Rs 3723.9, up 2.01% on the day as on 12:49 IST on the NSE. The stock is up 46.53% in last one year as compared to a 61.57% jump in NIFTY and a 90.2% jump in the Nifty IT index.",positive,positive,-1.8037135278514589,negative,-1.521216973578863,negative
2021-05-12 11:30:00.000,3770.0,3795.0,3685.05,3702.0,140362.0,"Oracle Financial Services Software allots 52,730 equity shares under ESOP","With this allotment, the paid up capital of the Company has increased to Rs. 430,584,845/- divided into 86,116,969 equity shares of face value of Rs. 5/- each.",neutral,neutral,-1.8037135278514589,negative,-1.521216973578863,negative
2021-05-26 07:05:00.000,3620.0,3620.0,3501.0,3514.4,67615.0,"Nifty IT index surge 1.5%; Infosys, Wipro, Tech Mahindra among top gainers",Coforge leads gains while LTI was also bullish. Oracle Financial Services Software dragged the most.,positive,positive,-2.917127071823202,negative,-0.3755747865078711,neutral
2021-07-06 07:40:00.000,3609.9,3759.0,3598.5,3740.0,188859.0,"Nifty IT sheds over 200 pts as index heavyweight TCS, Tech Mahindra weigh down",Oracle Financial Services Software Limited had a good bull run amidst the gloom in the sector.,neutral,positive,3.603977949527685,positive,-1.2533333333333334,negative
2021-07-07 16:59:54.000,3724.95,3845.0,3701.25,3794.0,213783.0,Oracle Financial Services - Underlying Changes In The Hood (Products) For The Next Wave: Dolat Capital,Oracle Financial Services - Underlying Changes In The Hood (Products) For The Next Wave: Dolat Capital,neutral,neutral,1.853716157263861,positive,3.827877507919747,positive
2021-07-09 06:45:00.000,3788.0,3980.3,3782.3,3933.0,442765.0,"Nifty IT index under pressure; Coforge, TCS, Wipro emerge top losers",Oracle Financial Services Software Limited surged over 3% and Mphasis was also in the fast lane.,positive,positive,3.827877507919747,positive,-1.859373817392836,negative
2021-07-20 11:38:00.000,4105.55,4177.8,3945.0,3948.1,471740.0,"Oracle Financial Services Software allots 12,958 equity shares under ESOS","With this allotment, the paid up capital of the Company has increased to Rs. 430,686,610/- divided into 86,137,322 equity shares of face value of Rs. 5/- each.",neutral,neutral,-3.8350525508153663,negative,0.3973181028060591,neutral
2021-07-28 14:04:05.000,4520.0,4650.0,4352.3,4425.0,787446.0,Oracle Financial Services Software Ltd up for third straight session,"Oracle Financial Services Software Ltd is quoting at Rs 4262, up 2.19% on the day as on 12:54 IST on the NSE. The stock is up 42.65% in last one year as compared to a 39.77% jump in NIFTY and a 66.79% jump in the Nifty IT index.",positive,positive,-2.101769911504425,negative,-2.6377570599787683,negative
2021-07-29 07:45:00.000,4520.0,4650.0,4352.3,4425.0,787446.0,Oracle Financial Services Software consolidated net profit rises 9.25% in the June 2021 quarter,Sales rise 4.50% to Rs 1397.37 crore,positive,positive,-2.101769911504425,negative,-2.6377570599787683,negative
2021-07-29 14:54:11.000,4429.9,4454.75,4240.15,4313.05,254260.0,Oracle Financial Services - Rerating On The Cards: Dolat Capital,Oracle Financial Services - Rerating On The Cards: Dolat Capital,neutral,neutral,-2.6377570599787683,negative,-2.14811339108938,negative
2021-08-10 13:17:01.000,4481.0,4509.95,4365.0,4430.0,118765.0,"Oracle Financial Services Software Ltd soars 0.68%, gains for fifth straight session","Oracle Financial Services Software Ltd is quoting at Rs 4488.35, up 0.68% on the day as on 12:49 IST on the NSE. The stock is up 51.64% in last one year as compared to a 44.3% jump in NIFTY and a 75.76% jump in the Nifty IT.",positive,positive,-1.1381388083017183,negative,4.968666069829902,positive
2021-08-27 14:33:00.000,4750.5,4824.35,4714.0,4775.0,249417.0,Select stocks gain on inclusion in F&O; Hindustan Aeronautics surges 9%,"Can Fin Homes, Polycab India, IndiaMART InterMESH, Oracle Financial Services, Syngene International, Dixon Technologies, MCX and Ipca Labs were up between 2 per cent and 3 per cent in intra-day trade.",positive,positive,0.515735185769919,neutral,-1.8102372034956304,negative
2021-08-30 14:09:00.000,4713.85,4762.1,4607.0,4708.55,192271.0,BSE Midcap index hits record high; Adani Transmission zooms 67% in 1 month,"Individually, Hindustan Aeronautics, Info Edge, L&T Infotech, Oracle Financial Services and PI Industries hit their respective record highs",neutral,positive,-0.1124346341101261,neutral,-1.7251378739468175,negative
2021-09-21 08:15:00.000,4694.65,4713.0,4606.6,4680.0,99181.0,"Nifty IT index soars 700 pts; HCL Tech, Mindtree log new highs; Infosys, TCS, Tech Mahindra add to gains","HCL Tech and Mindytree have touched a new all-time higher. Except for Oracle Financial Services, all other stocks were on a bull run.",positive,positive,-0.3120573418678631,neutral,-0.5106382978723404,neutral
2021-10-28 09:05:00.000,4485.0,4568.6,4258.05,4404.0,531531.0,Oracle Financial Services Software consolidated net profit rises 14.15% in the September 2021 quarter,Sales rise 6.98% to Rs 1280.97 crore,positive,positive,-1.806020066889632,negative,-0.743578188373141,neutral
2022-01-19 08:11:00.000,3975.0,4052.75,3948.4,4015.0,92155.0,"Stocks to Watch: Bajaj Auto, RIL, Just Dial, Bajaj Fin, Tata Motors, Telcos","Aptech, Bajaj Auto, Ceat, JSW Energy, L&T Infotech, Mastek, Oracle Financial Services, Rallis India, Saregama and Tata Communications to announce December quarter results on Wednesday",neutral,neutral,1.0062893081761006,positive,-3.896103896103896,negative
2022-01-20 12:48:00.000,3695.0,3749.9,3660.0,3675.0,186147.0,OFSS tumbles after weak Q3 performance,Oracle Financial Services Software (OFSS) slumped 6.20% to Rs 3747.20 following the announcement of its December quarter earnings that was made after market hours yesterday.,negative,negative,-0.5412719891745602,neutral,-4.749019077256122,negative
2022-01-20 16:16:54.000,3695.0,3749.9,3660.0,3675.0,186147.0,Hikal Ltd leads losers in ‘A’ group,"Sterlite Technologies Ltd, Mastek Ltd, PTC India Ltd and Oracle Financial Services Software Ltd are among the other losers in the BSE’s ‘A’ group today, 20 January 2022.",negative,negative,-0.5412719891745602,neutral,-4.749019077256122,negative
2022-04-28 22:23:51.000,3530.0,3584.85,3528.05,3574.25,40822.0,Trade setup for Friday: Top 15 things to know before Opening Bell,"Based on the open interest future percentage, here are 133 stocks including NTPC, Oracle Financial Services Software, Escorts, Indus Towers, and United Breweries, in which short-covering was seen.",neutral,neutral,1.253541076487252,positive,-0.7344632768361582,neutral
2022-07-20 08:34:00.000,3275.0,3276.0,3233.7,3249.0,117473.0,"Corporate Radar: Orient Cement to turn ex-dividend; Wipro Q1 results; ITC AGM, and more","Wipro, Havells India, IndusInd Bank, Gland Pharma, Tata Communications, Oracle Financial Services Software, Syngene International, Mastek, Ceat and Hathway Cable are among the companies that will announce their quarterly earnings today.",neutral,neutral,-0.7938931297709925,neutral,-2.21221374045801,negative
2022-09-19 14:31:04.000,3028.0,3049.0,3010.0,3016.05,88552.0,Oracle Financial Services Software grants 2.59 lakh stock options under OFSS Stock Plan,Powered by Capital Market - Live News,neutral,neutral,-0.3946499339497958,neutral,-0.4131685066437495,neutral
2022-10-19 08:32:00.000,2963.1,2977.3,2945.25,2960.0,84538.0,"Stocks in the news: TechM, Tata Motors, Adani Enterprises, Nestle, ICICI Lombard and ZEEL","Nestle, UltraTech Cement, IndusInd Bank, Havells, AU Small Finance Bank, HDFC AMC, Persistent Systems, Metro Brands and Oracle Financial Services Software are among the companies that will announce their results for September 2022 quarter today.",neutral,neutral,-0.104620161317536,neutral,0.8635578583765112,neutral
2023-01-18 07:25:19.000,3138.0,3149.85,3102.75,3110.1,49825.0,"Stocks to Watch: ITC, BoI, ICICI Prudential, ICICI Lombard, Adani Ent, Nalco","IndusInd Bank, Persistent Systems, Central Bank of India, Oracle Financial Services Software, CCL Products and PSP Projects will be among the stocks in focus as they declare their December quarter earnings today.",neutral,neutral,-0.8891013384321254,neutral,-0.8365384615384587,neutral
2023-01-19 09:04:19.000,3120.0,3148.4,3087.1,3093.9,92531.0,Oracle Financial Services Software consolidated net profit rises 0.46% in the December 2022 quarter,Sales rise 14.45% to Rs 1449.30 crore,positive,positive,-0.8365384615384587,neutral,-1.6957090486264754,negative
2023-02-08 08:17:08.000,3180.0,3193.3,3165.75,3166.75,62611.0,"Here’s why Vinay Rajani is bullish on Dr Reddy’s, Oracle Financial Services","As per the technical analyst, the Budget session high of 17,973 and low of 17,353 have become crucial levels to watch out for any directional move in the Nifty index",positive,neutral,-0.4166666666666667,neutral,0.4725897920604915,neutral
2023-04-27 12:33:31.000,3530.9,3590.95,3525.0,3573.9,179945.0,"Oracle Financial Services Q4 Review - Results Miss, Healthy Licence Wins Restore Confidence: Dolat Capital",Pipeline remains robust.,neutral,positive,1.2178198193095244,positive,0.3876129388233721,neutral
2023-05-03 15:34:00.000,3650.0,3707.5,3639.25,3680.0,143582.0,Market in a bullish trend; buy these 2 stocks on dips now: Shilpa Rout,"Analyst Shilpa Rout suggests buying Oracle Financial Services Software (OFSS) and Chambal Fertilisers on dips. OFSS has been consolidating above Rs 3,600 and is expected to reach targets of Rs 3,700 and above with a stop loss of around Rs 3,620 for intraday. Chambal Fertilisers is experiencing a goo…",positive,positive,0.821917808219178,neutral,-1.0248112189859764,negative
2023-05-09 17:30:00.000,3453.95,3500.0,3419.25,3495.0,145947.0,IT services stock with Rs 225 dividend turns ex-dividend today,"Oracle Financial Services Software shares: Ahead of the record and the ex-dividend date, the IT services stock hit a fresh 52-week high in the previous session.",neutral,positive,1.188494332575752,positive,1.0680869850040586,positive
